Topic,Count,Name,Representation,Representative_Docs
-1,643,-1_iran_government_gaza_students,"['iran', 'government', 'gaza', 'students', 'trump', 'language', 'authorities', 'israel', 'despite', 'workforce']","[""T-Mobile adds harsh rule to flexible payment option for customers As a subscriber, you can share up to 3 articles each month with friends for free. Just click “Gift this Article” on this page, then copy the link or enter their email. Gifts are exclusive to subscribers, reset monthly, and each article can be redeemed once. T-Mobile has a new CEO, and the phone carrier is wasting no time in implementing drastic policy changes that impact customers. On Nov. 1, Srini Gopalan officially became CEO of T-Mobile, replacing Mike Sievert, who held the position for over five years. Javascript is required for you to be able to read premium content. Please enable it in your browser settings. Thanks for the feedback. Log In Keep it Clean. Please avoid obscene, vulgar, lewd, racist or sexually-oriented language. PLEASE TURN OFF YOUR CAPS LOCK. Don't Threaten. Threats of harming another person will not be tolerated. Be Truthful. Don't knowingly lie about anyone or anything. Be Nice. No racism, sexism or any sort of -ism that is degrading to another person. Be Proactive. Use the 'Report' link on each comment to let us know of abusive posts. Share with Us. We'd love to hear eyewitness accounts, the history behind an article. Monday, Oct 6, 2025 The Government has"", ""Ceasefire impact holds across markets despite varying reports on the Strait of Hormuz (The Center Square) – Stock markets soared and oil prices plummeted after the start of a two-week ceasefire with Iran, despite conflicting reports regarding the Strait of Hormuz. After a strong opening with the S&P 500 climbing 2.1%, the Dow Jones Industrial Average up 2.3% and the Nasdaq composite up 2.6%, the three indexes stayed relatively stable Wednesday despite some reports that Iran had already re-closed the strait. Oil prices, too, dropped from $110 to $95 Wednesday morning and remained below $97 at 4 p.m. Javascript is required for you to be able to read premium content. Please enable it in your browser settings. Originally published on thecentersquare.com, part of the BLOX Digital Content Exchange. Log In Keep it Clean. Please avoid obscene, vulgar, lewd, racist or sexually-oriented language. PLEASE TURN OFF YOUR CAPS LOCK. Don't Threaten. Threats of harming another person will not be tolerated. Be Truthful. Don't knowingly lie about anyone or anything. Be Nice. No racism, sexism or any sort of -ism that is degrading to another person. Be Proactive. Use the 'Report' link on each comment to let us know of abusive posts. Share with Us. We'd love to hear eyewitness accounts,"", ""Teen drug use remains low, but survey finds small rise in heroin and cocaine use Students walk the halls at a high school in Philadelphia on Aug. 29, 2013. NEW YORK (AP) — Teen use of alcohol, nicotine and marijuana remains at record lows, according to national survey results released Wednesday. They consume a lot of energy drinks, though. And there are slight, but concerning, increases in heroin and cocaine use. Javascript is required for you to be able to read premium content. Please enable it in your browser settings. Story continues below video Copyright 2025 The Associated Press. All rights reserved. This material may not be published, broadcast, rewritten or redistributed without permission. Log In Keep it Clean. Please avoid obscene, vulgar, lewd, racist or sexually-oriented language. PLEASE TURN OFF YOUR CAPS LOCK. Don't Threaten. Threats of harming another person will not be tolerated. Be Truthful. Don't knowingly lie about anyone or anything. Be Nice. No racism, sexism or any sort of -ism that is degrading to another person. Be Proactive. Use the 'Report' link on each comment to let us know of abusive posts. Share with Us. We'd love to hear eyewitness accounts, the history behind an article.""]"
0,276,0_nasdaq_nyse_stocks_shareholders,"['nasdaq', 'nyse', 'stocks', 'shareholders', 'holdings', 'investor', 'companies', 'llc', 'corporation', 'earnings']","['Eli Lilly and Company $LLY Shares Sold by Founders Grove Wealth Partners LLC Posted by Defense World Staff on Mar 27th, 2026 Founders Grove Wealth Partners LLC trimmed its holdings in Eli Lilly and Company (NYSE:LLY – Free Report) by 18.5% during the fourth quarter, according to its most recent 13F filing with the Securities and Exchange Commission (SEC). The firm owned 17,414 shares of the company’s stock after selling 3,956 shares during the quarter. Eli Lilly and Company comprises about 4.2% of Founders Grove Wealth Partners LLC’s portfolio, making the stock its 5th biggest position. Founders Grove Wealth Partners LLC’s holdings in Eli Lilly and Company were worth $18,715,000 at the end of the most recent quarter. Several other institutional investors and hedge funds also recently made changes to their positions in LLY. Sumitomo Mitsui Financial Group Inc. bought a new stake in shares of Eli Lilly and Company during the second quarter valued at approximately $27,000. Vermillion & White Wealth Management Group LLC raised its position in shares of Eli Lilly and Company by 84.2% during the third quarter. Vermillion & White Wealth Management Group LLC now owns 35 shares of the company’s stock worth $27,000 after purchasing an additional 16 shares during the', 'Adams Wealth Management Has $2.71 Million Stake in Schwab US Broad Market ETF $SCHB Posted by Defense World Staff on Dec 15th, 2025 Adams Wealth Management increased its holdings in shares of Schwab US Broad Market ETF (NYSEARCA:SCHB – Free Report) by 26.5% in the second quarter, according to the company in its most recent Form 13F filing with the Securities and Exchange Commission (SEC). The fund owned 113,506 shares of the company’s stock after buying an additional 23,754 shares during the period. Adams Wealth Management’s holdings in Schwab US Broad Market ETF were worth $2,705,000 at the end of the most recent quarter. A number of other hedge funds and other institutional investors have also recently bought and sold shares of the business. Milestones Private Investment Advisors LLC acquired a new position in shares of Schwab US Broad Market ETF in the 2nd quarter valued at $3,619,000. WT Wealth Management grew its stake in shares of Schwab US Broad Market ETF by 0.3% during the second quarter. WT Wealth Management now owns 1,284,069 shares of the company’s stock worth $30,599,000 after purchasing an additional 3,857 shares during the period. Cambridge Financial Group LLC increased its holdings in Schwab US Broad Market ETF by 43.8% in the second quarter. Cambr', 'AA Financial Advisors LLC Buys 37,001 Shares of FS KKR Capital Corp. $FSK Posted by Defense World Staff on Dec 22nd, 2025 AA Financial Advisors LLC increased its stake in shares of FS KKR Capital Corp. (NYSE:FSK – Free Report) by 24.9% during the third quarter, according to the company in its most recent disclosure with the Securities & Exchange Commission. The firm owned 185,859 shares of the company’s stock after acquiring an additional 37,001 shares during the period. AA Financial Advisors LLC’s holdings in FS KKR Capital were worth $2,775,000 as of its most recent SEC filing. A number of other institutional investors and hedge funds have also recently added to or reduced their stakes in the stock. CCLA Investment Management acquired a new stake in shares of FS KKR Capital in the 2nd quarter valued at about $33,463,000. SCS Capital Management LLC bought a new position in shares of FS KKR Capital during the first quarter worth about $10,822,000. Generali Asset Management SPA SGR grew its holdings in shares of FS KKR Capital by 21.7% during the second quarter. Generali Asset Management SPA SGR now owns 2,485,265 shares of the company’s stock worth $51,569,000 after buying an additional 442,374 shares in the last quarter. Wellington Management Group LLP']"
1,198,1_nba_basketball_rebounds_ncaa,"['nba', 'basketball', 'rebounds', 'ncaa', 'head coach', 'points rebounds', 'women basketball', 'nfl', 'espn', 'football']","[""Mizzou men's basketball opens season on the road against Howard Mark Mitchell Missouri center Shawn Phillips Jr. dunks the ball during an exhibition game against Kansas State on Friday at Mizzou Arena. The Tigers will open their season Monday at Howard in Washington D.C. Javascript is required for you to be able to read premium content. Please enable it in your browser settings. Originally published on columbiamissourian.com, part of the BLOX Digital Content Exchange. Log In Keep it Clean. Please avoid obscene, vulgar, lewd, racist or sexually-oriented language. PLEASE TURN OFF YOUR CAPS LOCK. Don't Threaten. Threats of harming another person will not be tolerated. Be Truthful. Don't knowingly lie about anyone or anything. Be Nice. No racism, sexism or any sort of -ism that is degrading to another person. Be Proactive. Use the 'Report' link on each comment to let us know of abusive posts. Share with Us. We'd love to hear eyewitness accounts, the history behind an article."", ""Cameron Boozer should be the number one overall pick over AJ Dybantsa and Darryn Peterson — He gets criticized for the same reason Luka Doncic did As a subscriber, you can share up to 3 articles each month with friends for free. Just click “Gift this Article” on this page, then copy the link or enter their email. Gifts are exclusive to subscribers, reset monthly, and each article can be redeemed once. Duke's do-it-all power forward Cameron Boozer is hands down the best college player this season. Interestingly, however, he continues to lag in many mock drafts for the number one pick in this year's NBA Draft. Such takes make me wonder what is making pundits and observers continue to be unconvinced that he deserves to be the top pick. Javascript is required for you to be able to read premium content. Please enable it in your browser settings. Log In Keep it Clean. Please avoid obscene, vulgar, lewd, racist or sexually-oriented language. PLEASE TURN OFF YOUR CAPS LOCK. Don't Threaten. Threats of harming another person will not be tolerated. Be Truthful. Don't knowingly lie about anyone or anything. Be Nice. No racism, sexism or any sort of -ism that is degrading to another person. Be Proactive. Use the 'Report' link on each comment to let us know of abusive posts. Share with Us. We'd love to hear eyewitness accounts, the history"", ""Josh Heupel, Tennessee Receive Strong Message From 5-Star RB As a subscriber, you can share up to 3 articles each month with friends for free. Just click “Gift this Article” on this page, then copy the link or enter their email. Gifts are exclusive to subscribers, reset monthly, and each article can be redeemed once. The Tennessee Volunteers had a disappointing season after making their first College Football Playoff in 2024. The Volunteers, under the leadership of head coach Josh Heupel, finished the 2025 season with an 8-5 record. That was after being ranked as high as No. 11 in the country. However, the team struggled down the stretch, losing four of its final seven games. As a result, it is now focused on building a championship contender for the upcoming season. Javascript is required for you to be able to read premium content. Please enable it in your browser settings. Log In Keep it Clean. Please avoid obscene, vulgar, lewd, racist or sexually-oriented language. PLEASE TURN OFF YOUR CAPS LOCK. Don't Threaten. Threats of harming another person will not be tolerated. Be Truthful. Don't knowingly lie about anyone or anything. Be Nice. No racism, sexism or any sort of -ism that is degrading to another person. Be Proactive. Use the 'Report""]"
2,173,2_crime_kelowna_police_mass shooting,"['crime', 'kelowna', 'police', 'mass shooting', 'police department', 'arrested', 'deputies', 'county', 'suspect', 'court']","['One arrested after police raid on West Kelowna ‘problem property’ Published 12:20 pm Monday, February 9, 2026 By Brennan Phillips One person was arrested, and seven others were detained after RCMP executed a search warrant on a West Kelowna property on Feb. 4. The West Kelowna RCMP Crime Reduction Unit (CRU), with the assistance of frontline officers, West Kelowna Drug Section, and the Southeast District Emergency Response Team (SED ERT), worked together to search the Applegreen Court property. According to a Feb. 9 RCMP news release, the warrant was issued as part of a months-long investigation into the “ongoing problem property”, which was the result of repeated complaints from residents in the neighbourhood about the property and the activity associated with it. RCMP seized more than 200 grams of suspected illegal drugs, drug trafficking equipment, ammunition, and weapons. “This investigation is a clear example of our officers listening to the community and taking decisive action where criminal activity is impacting neighbourhood safety,” said Cpl. Bryan Mulrooney, non-commissioned officer-in-charge of the West Kelowna RCMP CRU. “We take residents’ concerns seriously and take enforcement action when warranted. Removing drugs, weapons, and traf', '6 killed in Mississippi mass shooting, suspect charged with murder Authorities have charged a 24-year-old man with murder after six people — including a child — were killed in a series of shootings in northeast Mississippi. Clay County Sheriff Eddie Scott said the victims — four family members related to the suspect and two other adults — were shot at three separate locations late Friday. The youngest victim was a cousin of the suspect. Related video above: Search underway for the killer of Ohio couple ""I don\'t know what kind of motive you could have to kill a 7-year-old,"" Scott said at a press conference Saturday. The suspect was identified as Daricka M. Moore. He faces a first-degree murder charge that could be upgraded to capital murder, Scott said. Moore may face additional murder charges as the investigation proceeds. The shootings took place in the rural community of Cedarbluff, west of the county seat of West Point. Clay County deputies received a call around 5:56 p.m. reporting gunshot victims in the Cedarbluff area; deputies arrived about 7:03 p.m. Investigators allege 24-year-old Daricka Moore shot multiple family members at the first scene and then stole a Ford F-150 belonging to his alleged deceased brother. Authorities say Moore later', '6 killed in Mississippi mass shooting, suspect charged with murder Authorities have charged a 24-year-old man with murder after six people — including a child — were killed in a series of shootings in northeast Mississippi. Clay County Sheriff Eddie Scott said the victims — four family members related to the suspect and two other adults — were shot at three separate locations late Friday. The youngest victim was a cousin of the suspect. Related video above: Search underway for the killer of Ohio couple ""I don\'t know what kind of motive you could have to kill a 7-year-old,"" Scott said at a press conference Saturday. The suspect was identified as Daricka M. Moore. He faces a first-degree murder charge that could be upgraded to capital murder, Scott said. Moore may face additional murder charges as the investigation proceeds. The shootings took place in the rural community of Cedarbluff, west of the county seat of West Point. Clay County deputies received a call around 5:56 p.m. reporting gunshot victims in the Cedarbluff area; deputies arrived about 7:03 p.m. Investigators allege 24-year-old Daricka Moore shot multiple family members at the first scene and then stole a Ford F-150 belonging to his alleged deceased brother. Authorities say Moore later']"
3,139,3_arsenal_injury_villa_chelsea,"['arsenal', 'injury', 'villa', 'chelsea', 'united', 'salah', 'bayern', 'premier league', 'newcastle', 'madrid']","['Man City vs. Arsenal: Gunners suffer fresh \'injury blow\' ahead of Premier League blockbuster By Matt Law | 15 Apr 2026 21:37, Last updated: 15 Apr 2026 21:46 Arsenal attacker Noni Madueke has emerged as a major doubt for Sunday\'s blockbuster Premier League contest with Manchester City at the Etihad Stadium. Madueke made his fifth Champions League start of the campaign in Wednesday\'s quarter-final second leg against Sporting Lisbon at the Emirates Stadium. However, the 24-year-old was forced off in the 63rd minute after taking a knock to his knee. Max Dowman was introduced as the England international\'s replacement, and he has now emerged as a major doubt for this weekend\'s top-of-the-table clash with Man City. Arsenal are currently top of the Premier League table, six points ahead of second-placed Man City, who have a game in hand on the Gunners. Madueke has come up with seven goals and four assists in 35 appearances this season, but he could now be facing a spell on the sidelines entering the final straight. Bukayo Saka was also again absent for the Champions League game with Sporting. ""It was something that he was carrying for a while. It was an Achilles issue,"" said Arsenal boss Mikel Arteta ahead of the European fixture on Wednesday night when asked about his star play', ""Liverpool injury update: Alexander Isak, Alisson Becker and Jeremie Frimpong latest news and return dates Sport | Football Liverpool returned to winning ways with a 2-0 victory over Aston Villa to end their four-game losing streak in the Premier League. Pressure was piling on Arne Slot after the Reds slumped to ninth in the table, but even without a number of key players, the champions were able to sweep Villa aside to move back up to third. They welcome Real Madrid - Trent Alexander-Arnold, Xabi Alonso, et al - to Anfield in midweek, before they take on Manchester City in a mouth-watering encounter at the weekend. But will they have any of their star names back from injury? Ahead of a big few weeks, here’s all the latest Liverpool injury news and return dates... Alexander Isak has endured a tough start to life on Merseyside. Subbed at half-time in Liverpool’s 5-1 win over Frankfurt in the Champions League, Slot later revealed the £125million summer signing had suffered a minor groin injury. “Alexander had to go off at half-time because he felt his groin a little bit. That's a pity,” said Slot. “I've said many times it is such a difficult balance to find with a player that missed three months.” Isak was not in the squad in the 3-2 loss at Brentford, and he also missed out on the Caraba"", ""Liverpool injury update: Alexander Isak, Alisson Becker and Jeremie Frimpong latest news and return dates Liverpool returned to winning ways with a 2-0 victory over Aston Villa to end their four-game losing streak in the Premier League. Pressure was piling on Arne Slot after the Reds slumped to ninth in the table, but even without a number of key players, the champions were able to sweep Villa aside to move back up to third. They welcome Real Madrid - Trent Alexander-Arnold, Xabi Alonso, et al - to Anfield in midweek, before they take on Manchester City in a mouth-watering encounter at the weekend. But will they have any of their star names back from injury? Ahead of a big few weeks, here’s all the latest Liverpool injury news and return dates... Alexander Isak has endured a tough start to life on Merseyside. Subbed at half-time in Liverpool’s 5-1 win over Frankfurt in the Champions League, Slot later revealed the £125million summer signing had suffered a minor groin injury. “Alexander had to go off at half-time because he felt his groin a little bit. That's a pity,” said Slot. “I've said many times it is such a difficult balance to find with a player that missed three months.” Isak was not in the squad in the 3-2 loss at Brentford, and he also missed out on the Carabao Cup defeat agai""]"
4,123,4_passed away_grandmother_memorial_funeral,"['passed away', 'grandmother', 'memorial', 'funeral', 'mary', 'lived', 'ann', 'birth death', 'wife', 'death']","['Jane Marie Solaro Birth: 1934 Death: 2026 Jane passed away peacefully on January 4, 2026 at the age of 91. Jane was born in Pacific Grove, CA on December 14, 1934 and lived in San Pedro her entire life. She is preceded in death by her loving husband John Solaro and her parents Matthew Bodul & Ann (Berkovich) Bodul. Jane enjoyed the last four years at the Canterbury in Rancho Palos Verdes with her loving friends and caretakers. She is survived by her loving children, Karen Solaro Durber (Martin), Denise Solaro and John Solaro (Lynn). She was a loving grandmother to Anthony Durber (Christina), Michelle Durber Dilly (Ian), Mark Durber, Nikki Solaro, Ali Solaro Sandoval (Dustin), Jack Solaro and Max Solaro and her great grandchildren Brooklynn and Logan Dilly She is also survived by her siblings Bob Bodul (Marylou), Sharon Bodul Werth (Fred) and Matthew Bodul (Angie) as well as several nieces and nephews. She will be deeply missed and remembered by all. Graveside burial at Green Hills Cemetery on Friday, January 23, 2026 @ 2 pm. Celebration of Life to follow. Honor with Flowers In memory of Jane Marie Plant a Living Memorial In memory of Jane Marie', 'Mary Kuljis Fiamengo Birth: 1934 Death: 2025 Mary Fiamengo passed away peacefully on November 6, 2025. Mary was born on September 20, 1934 in Komiza, Croatia. She was preceded in death by her beloved husband, Pete J. Fiamengo. Mary was a devoted wife, mother, sister, grandmother, great grandmother, aunt and dear friend. She is survived by her daughters, Deborah Dwight and Jennifer (Tim) Lovoy; her grandchildren, Peter Dwight (Cassandra), John Lovoy (Sloane), Ellen (Justin) Ralph and Lauren Dwight (Tim); her great grandchildren, Jordana Koonce, Hank Ralph and Margot Dwight and her sister, Betty Galosic. She was a long standing member of Mary Star of the Sea Church Velike Gospe Society, San Pedro Peninsula Cancer Guild and San Pedro Peninsula Hospital Bookworm Guild. Mary was a woman of grace, elegance and kindness; always extending a gentle word, a thoughtful gesture or a warm embrace. A memorial mass will be held at 10:30 am on Monday, November 17, 2025 at Mary Star of the Sea Catholic Church. In lieu of flowers, Mary requested that a donation in her memory be made to the San Pedro Peninsula Cancer Guild or to Mary Star of the Sea High School. Send Flowers Plant a Tree Send a Meal', 'Linda Sue (Jordan) Schlosser Birth: 1950 Death: 2025 Linda Sue (Jordan) Schlosser March 16, 1950-December 15, 2025 passed away peacefully surrounded by her family at her home in San Pancho, Mexico. Survived by her husband of 41 years, Phil Schlosser, her mother Gerry, daughter Kelly Noel, son Kevin Noel and wife Jennifer and her grandchildren Trevor and Lena. She was preceded in death by her father, Wayne Henry Jordan and brother Michael Wayne Jordan. Linda was born and raised in San Rafael, CA and graduated from Terra Linda High School. Linda loved sunshine, warm weather and travel. She was an outstanding cook and loved to entertain. Her great adventure was moving to Mexico, building a wonderful home filled with warmth, family, friends and great meals. She loved traveling throughout Mexico and Italy. Her family requests that gifts in lieu of flowers be made in Linda’s name to St. Jude Children’s Research Hospital. Forever deep in my soul, The memory of your love Fills my heart And I am never alone. Honor with Flowers In memory of Linda Sue Plant a Living Memorial In memory of Linda Sue']"
