Topic,Count,Name,Representation,Representative_Docs
23,11,23_government shutdown_groceries_grocery_washington,"['government shutdown', 'groceries', 'grocery', 'washington', 'government', 'states', 'white house', 'veterans affairs', 'snap', 'president donald']","['States scramble to send full SNAP food benefits to millions of people after shutdown ends The US government shutdown finally ended on November 12 after 43 days of budget paralysis – the longest in the nation’s history. Federal operations are resuming, but key issues remain unresolved and tensions in Washington persist. With the longest U.S. government shutdown over, state officials said Thursday they were working quickly to get full SNAP food benefits to millions of people who made do with little to no assistance for the past couple of weeks. A person shops for produce Monday at a grocery store in Baltimore. President Donald Trump signs the funding bill to reopen the government Wednesday in the Oval Office of the White House in Washington. Produce is displayed Monday at a grocery store in Baltimore. Stay up-to-date on the latest in local and national government and political topics with our newsletter. The US government shutdown finally ended on November 12 after 43 days of budget paralysis – the longest in the nation’s history. Federal opera…', 'States scramble to send full SNAP food benefits to millions of people after shutdown ends The US government shutdown finally ended on November 12 after 43 days of budget paralysis – the longest in the nation’s history. Federal operations are resuming, but key issues remain unresolved and tensions in Washington persist. With the longest U.S. government shutdown over, state officials said Thursday they were working quickly to get full SNAP food benefits to millions of people who made do with little to no assistance for the past couple of weeks. A person shops for produce Monday at a grocery store in Baltimore. President Donald Trump signs the funding bill to reopen the government Wednesday in the Oval Office of the White House in Washington. Produce is displayed Monday at a grocery store in Baltimore. Stay up-to-date on the latest in local and national government and political topics with our newsletter. The US government shutdown finally ended on November 12 after 43 days of budget paralysis – the longest in the nation’s history. Federal opera…', 'States scramble to send full SNAP food benefits to millions of people after shutdown ends The US government shutdown finally ended on November 12 after 43 days of budget paralysis – the longest in the nation’s history. Federal operations are resuming, but key issues remain unresolved and tensions in Washington persist. With the longest U.S. government shutdown over, state officials said Thursday they were working quickly to get full SNAP food benefits to millions of people who made do with little to no assistance for the past couple of weeks. A person shops for produce Monday at a grocery store in Baltimore. President Donald Trump signs the funding bill to reopen the government Wednesday in the Oval Office of the White House in Washington. Produce is displayed Monday at a grocery store in Baltimore. Stay up-to-date on the latest in local and national government and political topics with our newsletter. The US government shutdown finally ended on November 12 after 43 days of budget paralysis – the longest in the nation’s history. Federal opera…']"
24,10,24_strictly_itv_dancing_chris,"['strictly', 'itv', 'dancing', 'chris', 'bbc', 'elimination', 'spin', 'adverts parties', 'favourite', 'viewers']","[""Strictly Come Dancing star confesses to feelings of 'guilt' about winning BBC show Karen Carney, George Clarke and Amber Davies will battle it out for the coveted Glitterball trophy on Strictly Come Dancing this weekend, with YouTuber George currently leading as the bookmakers' favourite. Yet the competition doesn't always go according to plan, with the BBC ballroom series having witnessed numerous surprising outcomes throughout its history. The 2009 series delivered one of the programme's most unexpected moments when Chris Hollins defied the odds to triumph over favourite Ricky Whittle. The victory surprised many, with the presenter later admitting he felt somewhat guilty about his win too. Hollyoaks actor Ricky, partnered with professional dancer Natalie Lowe, had regularly out-danced Chris, who performed alongside Ola Jordan. Nevertheless, Chris garnered substantial support from the viewing public and whilst he wasn't receiving the highest judges' scores, he consistently progressed through public votes, never facing elimination in the dance-off. Ultimately, he claimed victory, reports Wales Online. Prior to the finale, Chris acknowledged feeling a little guilty about reaching the last stage instead of Ali Bastian and Brian Fortuna, who had achieved better scor"", 'Strictly Come Dancing fans have same complaint as La Voix withdraws from show \'Pointless!\' Strictly Come Dancing fans have been left with the same question after it was announced La Voix has withdrawn from the competition. During Saturday (November 22) night\'s show, the remaining contestants took to the dance floor at the iconic Blackpool Tower Ballroom. Before things kicked off for Blackpool Week, presenter Tess Daly informed viewers that the drag queen – real name Chris Dennis – would not be returning to the competition after sustaining a foot injury. She said: ""We can confirm she has very sadly had to withdraw from the competition,"" before revealing there would be no elimination this weekend. But this has left fans wondering why Sunday night\'s show is still airing now that there is no dance-off. Taking to social media with their queries, one wrote: ""So what’s the point of Sunday’s show when everything can be done tonight #Strictly?"" Read more: Strictly pro says only one person can replace Craig Revel Horwood Read more: BBC Strictly viewers switch off as major star pulls out of show We use your sign-up to provide content in ways you\'ve consented to and to improve our understanding of you. This may include adverts from us and 3rd parties based on our understanding. You', 'Strictly Come Dancing star breaks silence after concern fifth contestant would quit Strictly Come Dancing\'s Alex Kingston is poised to carry on with her dance adventure, putting to rest concerns she might have to withdraw due to injury. The 62-year-old actress had triggered concerns about a potential exit after her daughter disclosed a rib injury on social media, stating that her mother had endured the discomfort to participate in Saturday\'s programme. The Doctor Who legend, who has been dazzling audiences on the dance floor alongside partner Johannes Radebe, was swift to comfort her supporters that injuries were simply ""part and parcel"" of the Strictly experience, and she had absolutely no plans to retire her dancing shoes. Fleur East, host of Strictly spin-off It Takes Two, has now verified that Alex will return to the competition following last week\'s Blackpool special. Discussing their forthcoming performance, Fleur disclosed: ""Alex and Johannes will be dancing a cha-cha-cha to Ring My Bell by Anita Ward."" We use your sign-up to provide content in ways you\'ve consented to and to improve our understanding of you. This may include adverts from us and 3rd parties based on our understanding. You can unsubscribe at any time. Read our Privacy Policy She continued: ""']"
25,10,25_tvs_roku_samsung_tv,"['tvs', 'roku', 'samsung', 'tv', 'display', 'streaming services', 'bright', 'channels', 'netflix', 'budget']","['Samsung OLED 48S95H: New 48-inch and 165 Hz OLED TV revealed ahead of schedule with HDR10 Plus Advanced support Samsung has already teased plenty of devices on the eve of CES 2026. However, the trade show has decided to lift the lid on one of Samsung\'s forthcoming OLED Smart TVs. For context, Samsung listed numerous unreleased Smart TVs on its Parts Database over a month ago. Of those, CES has announced that the S95H is a 2026 Honoree in its Gaming & eSports category. Specifically, the trade show has signalled out a 48-inch variant that was missing from November\'s leak. Incidentally, last year\'s S95F only went as small as 55-inches (curr. $1,997 on Amazon). According to the listing, the S95H offers a 165 Hz refresh rate with VRR technology supported. Assuming a 4K resolution from the S95F series and the usage of HDMI 2.1 ports, a 165 Hz refresh rate would require the usage of Display Stream Compression (DSC) to output at its peak resolution and refresh rate simultaneously. Moreover, the new 48-inch Smart TV will support Samsung\'s new HDR10 Plus Advanced format. Pricing and availability are unknown for now; the full description provided by Samsung and CES is as follows: The Samsung OLED (S95H) is the world\'s most advanced 48"" OLED TV for high-end gaming. Combining unparalleled brightness and', ""Our pick for the best budget TV just dropped to its lowest-ever price on Amazon The best TVs come in all shapes and sizes, and as a result, it can be difficult to know what to buy. One that we'd recommend right now is the Roku Pro Series 65-inch Mini LED QLED TV at Amazon for $799.99 (was $1,199.99) – that's a 33% discount, which drops the TV to its lowest-ever price. But it's not just the price that is worthy of your attention. Thanks to the pairing of mini-LED and QLED technology, the Roku Pro Series offers picture quality that is sharp, vivid, and colorful. It's so good that it's our pick for the best budget TV you can buy, so if you're looking for a top TV without breaking the bank this Black Friday, it could be just the deal for you This TV boasts a lot for the price. 4K resolution. Mini-LED. QLED. Roku interface. 65 inches. What more could you want? Maybe a seriously juicy discount. Yep, that's included as well. You can now save a generous $400 on the Roku TV ahead of Black Friday, making one of our top budget picks even better value for money. Our reviewer of the Roku Pro Series TV gave the set an impressive 4.5 out of five stars. That's excellent, especially given its budget-friendly price tag. The high praise is due to the 4K resolution support and sm"", ""Forget Micro RGB: I saw TCL's new SQD-Mini LED TV, and it's the model to beat at CES Follow ZDNET: Add us as a preferred source on Google. This year's CES is indisputably the Micro RGB show. Virtually every major TV manufacturer is incorporating the tri-colored pixel technology, as if the transparent TVs from last year are no longer cutting-edge. TCL has other plans. Also: CES 2026 news: Live updates on TVs, smart glasses, robots, and more we've seen so far The brand's new crown jewel TV of 2026 is the X11L, which features TCL's Super Quantum Dot (SQD) Mini LED panel, for which the company claims achieves 100 percent of the BT2020 color gamut. This is accomplished by pairing the SQD layer with a CSOT UltraColor Filter, as well as an Advanced Color Purity Algorithm. If that assembly of tech jargon doesn't tell you it's CES (or that TCL means business), then I don't know what will. Effectively, the X11L solves a major pain point with conventional Micro RGB TVs: color blooming, or color crosstalk. With Micro RGB TVs often emitting very bright light, certain colors can bleed into surrounding dark areas, reducing color accuracy. With the CSOT UltraColor Filter, TCL has significantly reduced these artifacts, rendering images that, to my fresh-off-a-plane eyes, appeared c""]"
26,10,26_royal_prince_andrew_chief executive,"['royal', 'prince', 'andrew', 'chief executive', 'secretary general', 'charity', 'billionaire', 'meghan', 'estate', 'revoked']","[""Prince Harry's visa row back in spotlight as Andrew asked to testify in US Prince Harry’s visa row has been brought back into the spotlight as a result of the latest news that Andrew Mountbatten Windsor has been asked to appear before the US Congress for questioning over his links to convicted paedophile Jeffrey Epstein. On Thursday evening, it was revealed that Andrew, who has recently been stripped of all his royal titles as a result of scandals surrounding his past friendship with Epstein, has now been asked to give evidence in the US. Andrew has always denied any allegations made against him. While this has led to mixed public reaction, one public figure has said that if this is the case for Andrew, Prince Harry should also be asked to testify before Congress in the US about his visa. This is because over recent years, think tank group The Heritage Foundation have repeatedly asked for Harry’s US visa to be made public to see if he lied about his past drug use. This is because Harry has lived in America since 2020, but revealed in his 2023 memoir that he took drugs as a teenager. READ MORE: Meghan Markle's acting return 'proves marriage is at breaking point' READ MORE: Meghan Markle's Hollywood return dubbed a 'desperate call for attention' Our communi"", ""Prince Harry spotted for second time on holiday without Meghan Markle Prince Harry has been spotted for a second time this week on his holiday without his wife, Meghan Markle. On Wednesday, the Duke of Sussex was spotted taking part in the St. Regis World Snow Polo Championship in Aspen, Colorado, just hours after he was spotted skiing with close friend Nacho Figueras. The Prince, 41, reportedly was taking part in the polo tournament to stand in for a friend who couldn’t make it. He is believed to have been on the Aspen Valley team. Harry would have most likely been delighted to take part in the event, having played polo for a number of years. READ MORE: Meghan Markle breaks silence after Prince Harry spotted alone on holiday READ MORE: Princess Kate sends coded message at Royal Family Christmas lunch We use your sign-up to provide content in ways you've consented to and to improve our understanding of you. This may include adverts from us and 3rd parties based on our understanding. You can unsubscribe at any time. Read our Privacy Policy The sighting of the prince on the polo field came not long after the duke was spotted skiing at a resort with some male friends. A source told Hello magazine that the duke seemed to be enjoying himself in the mounta"", ""Real reason Andrew's Royal Lodge eviction announcement took so long Andrew hit an all-time royal low last week as it was announced he was to be stripped of all his royal titles and evicted from his 30-room Royal Lodge home. Buckingham Palace made the announcement on Thursday after weeks of Andrew dominating the headlines as a result of scandals involving his past friendship with the late convicted paedophile Jeffrey Epstein. While Andrew has always denied all accusations against him, the King’s brother was aware of how he was being a distraction to the monarchy, and on October 17 said he would no longer use his royal titles. However, King Charles took this a step further by formally removing them from him - a move that many did not see coming. While the King’s actions have been praised, some believe the monarch, 76, took too long to take action, especially over evicting the former prince from his Crown Estate mansion, however Queen Elizabeth's former press secretary Ailsa Anderson has now explained why. READ MORE: Donald Trump breaks silence on Royal Family stripping Andrew of titles READ MORE: Meghan Markle 'wants to be a billionaire' but it won't be from jam Our community members are treated to special offers, promotions, and adverts from us and""]"
27,9,27_central bank_federal reserve_florence_meeting,"['central bank', 'federal reserve', 'florence', 'meeting', 'italy', 'economy', 'frankfurt', 'euro', 'forecasts', 'trade tensions']","['Florence Press Conference Confirms ECB Remains Comfortable in Its Good Place Even a change of scenery has done nothing to change the European Central Bank’s current wait-and-see stance. Florence, where the ECB met today for its only annual meeting outside of Frankfurt, is apparently also this ’good place’, the central bank’s well-known pseudonym for comfortably keeping interest rates on hold. ECB President Christine Lagarde even called it a ‘magnificent’ place – Florence, that is, not rates. The comments at the press conference confirmed once again that the ECB has no intention to leave its ‘good place’ any time soon. We had feared a rather uneventful press conference. What should we say? We hate to be right… Anyhow, here are a few interesting remarks made by Lagarde: On the ECB’s risk assessment, the introductory statement had the most remarkable change compared with September. Last month, the ECB had still talked about risks to the growth outlook that had become “more balanced”; today, it refrained from qualifying any balance of risk. Instead, the central bank had a somewhat more extensive list of upside and downside risks to the growth outlook. Lagarde even said that some of the downside risks had abated. When asked whether this was a sign of an upcoming', 'Florence Press Conference Confirms ECB Remains Comfortable in Its Good Place Even a change of scenery has done nothing to change the European Central Bank’s current wait-and-see stance. Florence, where the ECB met today for its only annual meeting outside of Frankfurt, is apparently also this ’good place’, the central bank’s well-known pseudonym for comfortably keeping interest rates on hold. ECB President Christine Lagarde even called it a ‘magnificent’ place – Florence, that is, not rates. The comments at the press conference confirmed once again that the ECB has no intention to leave its ‘good place’ any time soon. We had feared a rather uneventful press conference. What should we say? We hate to be right… Anyhow, here are a few interesting remarks made by Lagarde: On the ECB’s risk assessment, the introductory statement had the most remarkable change compared with September. Last month, the ECB had still talked about risks to the growth outlook that had become “more balanced”; today, it refrained from qualifying any balance of risk. Instead, the central bank had a somewhat more extensive list of upside and downside risks to the growth outlook. Lagarde even said that some of the downside risks had abated. When asked whether this was a sign of an upcoming', 'Florence Press Conference Confirms ECB Remains Comfortable in Its Good Place Even a change of scenery has done nothing to change the European Central Bank’s current wait-and-see stance. Florence, where the ECB met today for its only annual meeting outside of Frankfurt, is apparently also this ’good place’, the central bank’s well-known pseudonym for comfortably keeping interest rates on hold. ECB President Christine Lagarde even called it a ‘magnificent’ place – Florence, that is, not rates. The comments at the press conference confirmed once again that the ECB has no intention to leave its ‘good place’ any time soon. We had feared a rather uneventful press conference. What should we say? We hate to be right… Anyhow, here are a few interesting remarks made by Lagarde: On the ECB’s risk assessment, the introductory statement had the most remarkable change compared with September. Last month, the ECB had still talked about risks to the growth outlook that had become “more balanced”; today, it refrained from qualifying any balance of risk. Instead, the central bank had a somewhat more extensive list of upside and downside risks to the growth outlook. Lagarde even said that some of the downside risks had abated. When asked whether this was a sign of an upcoming']"
28,9,28_state parks_tennessee_west virginia_arkansas,"['state parks', 'tennessee', 'west virginia', 'arkansas', 'hunting', 'permits', 'virginia', 'rural areas', 'iowa', 'river']","['Mid-season WMA waterfowl quota hunt app period to be held Oct. 22-Nov. 12 TWRA News Tennessee Wildlife Resources Agency (TWRA) announced that the application period for the 2025 Mid-Season Wildlife Management Area (WMA) Waterfowl Quota Hunt will be open from Wednesday, Oct. 22 through Wednesday, Nov. 12. Applications can be submitted online at gooutdoorstennessee.com, through the TWRA mobile app, at TWRA regional offices, or at any TWRA license agent. Mailed applications will not be accepted, and applicants must be at least 16 years old. Detailed application instructions, WMA locations, and general waterfowl quota hunt information are available on the TWRA Quota Hunts webpage. The deadline to submit applications is Wednesday, Nov. 12 at 11:59 p.m. (CST). A person may only submit one application, which can include up to 48 unique hunt choices; hunt choices may not be repeated. Qualifying parties must have at least four members, with a maximum of eight. Successful applicants will receive an email with instructions to log in and must claim their permit by Monday, Nov. 24 at 11:59 p.m. CST. Each party member must claim their own permit. Permits will be available to print after they have been claimed. Individuals in the party who fail to claim their permit fo', 'Mid-season WMA waterfowl quota hunt app period to be held Oct. 22-Nov. 12 TWRA News Tennessee Wildlife Resources Agency (TWRA) announced that the application period for the 2025 Mid-Season Wildlife Management Area (WMA) Waterfowl Quota Hunt will be open from Wednesday, Oct. 22 through Wednesday, Nov. 12. Applications can be submitted online at gooutdoorstennessee.com, through the TWRA mobile app, at TWRA regional offices, or at any TWRA license agent. Mailed applications will not be accepted, and applicants must be at least 16 years old. Detailed application instructions, WMA locations, and general waterfowl quota hunt information are available on the TWRA Quota Hunts webpage. The deadline to submit applications is Wednesday, Nov. 12 at 11:59 p.m. (CST). A person may only submit one application, which can include up to 48 unique hunt choices; hunt choices may not be repeated. Qualifying parties must have at least four members, with a maximum of eight. Successful applicants will receive an email with instructions to log in and must claim their permit by Monday, Nov. 24 at 11:59 p.m. CST. Each party member must claim their own permit. Permits will be available to print after they have been claimed. Individuals in the party who fail to claim their permit fo', 'Mid-season WMA waterfowl quota hunt app period to be held Oct. 22-Nov. 12 TWRA News Tennessee Wildlife Resources Agency (TWRA) announced that the application period for the 2025 Mid-Season Wildlife Management Area (WMA) Waterfowl Quota Hunt will be open from Wednesday, Oct. 22 through Wednesday, Nov. 12. Applications can be submitted online at gooutdoorstennessee.com, through the TWRA mobile app, at TWRA regional offices, or at any TWRA license agent. Mailed applications will not be accepted, and applicants must be at least 16 years old. Detailed application instructions, WMA locations, and general waterfowl quota hunt information are available on the TWRA Quota Hunts webpage. The deadline to submit applications is Wednesday, Nov. 12 at 11:59 p.m. (CST). A person may only submit one application, which can include up to 48 unique hunt choices; hunt choices may not be repeated. Qualifying parties must have at least four members, with a maximum of eight. Successful applicants will receive an email with instructions to log in and must claim their permit by Monday, Nov. 24 at 11:59 p.m. CST. Each party member must claim their own permit. Permits will be available to print after they have been claimed. Individuals in the party who fail to claim their permit fo']"
