Topic,Count,Name,Representation,Representative_Docs
17,15,17_immigration_britain_immigrants_societal,"['immigration', 'britain', 'immigrants', 'societal', 'diversity', 'america', 'population', 'respondents', 'liberal', 'countries']","['‘UK public have tougher stance on immigration and diversity than people in US’ People in the UK are less likely than their US counterparts to feel diversity strengthens society and more likely to have tougher attitudes on immigration, according to research. The findings are said to show that a common narrative about Britain being more socially liberal than America does not ring true across all issues. The National Centre for Social Research also found Reform UK voters in Britain were more likely than supporters of President Donald Trump in the US to say immigrants living in their country without permission should not be allowed to stay. While seven in 10 supporters of Mr Trump felt this way, the figure was almost eight in 10 (79%) among Reform followers. The researchers said they wanted to “better understand how public attitudes in the UK compare with those in the US, and the extent of polarisation in the two countries”. Their survey found 42% of people in the UK think there should be legal efforts to deport immigrants living here without permission, compared with just a third (33%) in the US. While almost two-thirds (64%) of respondents in the US felt diversity strengthens society, only around half (49%) of the UK public agreed. Proportions were similar when', '‘UK public have tougher stance on immigration and diversity than people in US’ People in the UK are less likely than their US counterparts to feel diversity strengthens society and more likely to have tougher attitudes on immigration, according to research. The findings are said to show that a common narrative about Britain being more socially liberal than America does not ring true across all issues. The National Centre for Social Research also found Reform UK voters in Britain were more likely than supporters of President Donald Trump in the US to say immigrants living in their country without permission should not be allowed to stay. While seven in 10 supporters of Mr Trump felt this way, the figure was almost eight in 10 (79%) among Reform followers. The researchers said they wanted to “better understand how public attitudes in the UK compare with those in the US, and the extent of polarisation in the two countries”. Their survey found 42% of people in the UK think there should be legal efforts to deport immigrants living here without permission, compared with just a third (33%) in the US. While almost two-thirds (64%) of respondents in the US felt diversity strengthens society, only around half (49%) of the UK public agreed. Proportions were similar when', '‘UK public have tougher stance on immigration and diversity than people in US’ People in the UK are less likely than their US counterparts to feel diversity strengthens society and more likely to have tougher attitudes on immigration, according to research. The findings are said to show that a common narrative about Britain being more socially liberal than America does not ring true across all issues. The National Centre for Social Research also found Reform UK voters in Britain were more likely than supporters of President Donald Trump in the US to say immigrants living in their country without permission should not be allowed to stay. While seven in 10 supporters of Mr Trump felt this way, the figure was almost eight in 10 (79%) among Reform followers. The researchers said they wanted to “better understand how public attitudes in the UK compare with those in the US, and the extent of polarisation in the two countries”. Their survey found 42% of people in the UK think there should be legal efforts to deport immigrants living here without permission, compared with just a third (33%) in the US. While almost two-thirds (64%) of respondents in the US felt diversity strengthens society, only around half (49%) of the UK public agreed. Proportions were similar when']"
18,14,18_downtown_lewiston_sacramento_vendors,"['downtown', 'lewiston', 'sacramento', 'vendors', 'exhibition', 'artists', 'local', 'town', 'donations', 'store']","['West Sacramento exhibit at Gallery 1075 features local artists for Black History Month Your contribution directly supports our newsroom. The West Sacramento Department of Parks and Recreation is showcasing art by local Black artists in its Gallery 1075 space through February. “Throughout the rest of the month people can come in anytime the community center is open … to just enjoy the pieces themselves,” gallery curator Evan Harté said. “The art reception [on Feb. 12] though is going to be extra special because we’re going to have the artists actually come out and talk with the community, get to know them and talk about their processes.” One of the artists featured is Sacramento-based Danitta Nelson, who works on her art in-between taking care of her children and working as a program manager at a mental health care facility. Nelson said she loves to do 3D art where she can attach things to her illustrations, especially hair. “My biological father was an artist and my sister was an artist, but they don’t do art anymore,” Nelson said. She added that a brain injury from a car accident means her sister no longer creates art. “So I do it to try and keep it going for the family so it doesn’t just die down.” Nelson said she started actively pursuing presenting in galleries a', 'Oakland County debuts 2025 ‘Local Gems’ contest Some shoppers in Oakland County can win between $250 and $1,000 in November as part of the annual Local Gems Sweepstakes. The rules are pretty simple: Visit one or more of the county’s 6,000-plus small retail businesses, take a selfie at the store and submit the entry to the county. A random drawing of selfies submitted online, in person or by mail determines the winner of the three prizes: $1,000, $500, or $250. Every entry must include a photo of the person inside or outside a local small business. The contest gets underway on Saturday, Nov. 1 and continues through Nov. 30. This year’s contest was launched in downtown Pontiac at Designed Mindfully, an interior-design company. Designed Mindfully was among the 2024’s top vote getters, with HobbyTown and AM2PM Barbershop in Southfield; It’s the Little Things in Ortonville; and Vibrant Vizionz in Oak Park. Designed Mindfully owner Deya Marchand said her shop is more than a small store. “We are a space where community, creativity, and intentional living come together,” she said, adding that Local Gems aligns beautifully with her store’s mission “to live and shop with purpose, supporting other small businesses and local artists.” The n', 'Oakland County debuts 2025 ‘Local Gems’ contest Some shoppers in Oakland County can win between $250 and $1,000 in November as part of the annual Local Gems Sweepstakes. The rules are pretty simple: Visit one or more of the county’s 6,000-plus small retail businesses, take a selfie at the store and submit the entry to the county. A random drawing of selfies submitted online, in person or by mail determines the winner of the three prizes: $1,000, $500, or $250. Every entry must include a photo of the person inside or outside a local small business. The contest gets underway on Saturday, Nov. 1 and continues through Nov. 30. This year’s contest was launched in downtown Pontiac at Designed Mindfully, an interior-design company. Designed Mindfully was among the 2024’s top vote getters, with HobbyTown and AM2PM Barbershop in Southfield; It’s the Little Things in Ortonville; and Vibrant Vizionz in Oak Park. Designed Mindfully owner Deya Marchand said her shop is more than a small store. “We are a space where community, creativity, and intentional living come together,” she said, adding that Local Gems aligns beautifully with her store’s mission “to live and shop with purpose, supporting other small businesses and local artists.” The n']"
19,13,19_new film_movie_actors_actor,"['new film', 'movie', 'actors', 'actor', 'films', 'theaters', 'oscar', 'director', 'brendan', 'fraser']","[""AP Entertainment SummaryBrief at 3:08 p.m. EST Brendan Fraser's new horizons include 'Rental Family' and rental hedgehogs BEDFORD, N.Y. (AP) — “Rental Family” is Brendan Fraser’s first leading role since winning the best actor Oscar for “The Whale.” In it, the 56-year-old plays a struggling actor living in Japan who, out of desperation and curiosity, takes a job with an agency that hires out actors to fulfill roles in real people’s lives. In an interview, Fraser discusses his life since the Oscar win, his eye-opening experiences in Japan and what returning to the “Mummy” series means to him. His time in Japan included a visit to a hedgehog cafe. “Rental Family” opens Friday in theaters. Copyright 2025 The Associated Press. All rights reserved. This material may not be published, broadcast, rewritten or redistributed. Log In Keep it Clean. Please avoid obscene, vulgar, lewd, racist or sexually-oriented language. PLEASE TURN OFF YOUR CAPS LOCK. Don't Threaten. Threats of harming another person will not be tolerated. Be Truthful. Don't knowingly lie about anyone or anything. Be Nice. No racism, sexism or any sort of -ism that is degrading to another person. Be Proactive. Use the 'Report' link on each comment to let us know of abus"", ""AP Entertainment SummaryBrief at 3:08 p.m. EST Brendan Fraser's new horizons include 'Rental Family' and rental hedgehogs BEDFORD, N.Y. (AP) — “Rental Family” is Brendan Fraser’s first leading role since winning the best actor Oscar for “The Whale.” In it, the 56-year-old plays a struggling actor living in Japan who, out of desperation and curiosity, takes a job with an agency that hires out actors to fulfill roles in real people’s lives. In an interview, Fraser discusses his life since the Oscar win, his eye-opening experiences in Japan and what returning to the “Mummy” series means to him. His time in Japan included a visit to a hedgehog cafe. “Rental Family” opens Friday in theaters. Movie Review: Joel Edgerton delivers a profound, understated performance in ‘Train Dreams’ Joel Edgerton plays a logger at the beginning of the 20th century in “Train Dreams.” Clint Bentley's film is an adaptation of Denis Johnson's novella, about the toll of progress and the people left behind. Edgerton stars alongside Felicity Jones and William H. Macy in the meditative film. In her review, Associated Press Film Writer Lindsey Bahr praises Edgerton's understated performance and adds that, “Bentley’s film is haunting and patient, a dreamlike jo"", ""AP Entertainment SummaryBrief at 3:08 p.m. EST Brendan Fraser's new horizons include 'Rental Family' and rental hedgehogs BEDFORD, N.Y. (AP) — “Rental Family” is Brendan Fraser’s first leading role since winning the best actor Oscar for “The Whale.” In it, the 56-year-old plays a struggling actor living in Japan who, out of desperation and curiosity, takes a job with an agency that hires out actors to fulfill roles in real people’s lives. In an interview, Fraser discusses his life since the Oscar win, his eye-opening experiences in Japan and what returning to the “Mummy” series means to him. His time in Japan included a visit to a hedgehog cafe. “Rental Family” opens Friday in theaters. Movie Review: Joel Edgerton delivers a profound, understated performance in ‘Train Dreams’ Joel Edgerton plays a logger at the beginning of the 20th century in “Train Dreams.” Clint Bentley's film is an adaptation of Denis Johnson's novella, about the toll of progress and the people left behind. Edgerton stars alongside Felicity Jones and William H. Macy in the meditative film. In her review, Associated Press Film Writer Lindsey Bahr praises Edgerton's understated performance and adds that, “Bentley’s film is haunting and patient, a dreamlike jo""]"
20,12,20_nhl_hockey_scoreless_goals,"['nhl', 'hockey', 'scoreless', 'goals', 'scoring', 'devils', 'rangers', 'ottawa', 'hughes', 'new team']","['Buium, Demko lead Canucks to 2-1 win over Devils as post-Hughes era begins Published 12:10 pm Sunday, December 14, 2025 By Philip Wolf Vancouver Canucks defenceman Zeeb Buium, in NHL action Sunday, Dec. 25, 2025 against the New Jersey Devils at the Prudential Center in Newark, N.J. ( photo) Zeev Buium had a goal and an assist in his Vancouver Canucks debut, leading his new team to a 2-1 win over the host New Jersey Devils in NHL action Sunday afternoon at the Prudential Center in Newark, N.J. Buium, along with Marco Rossi and Liam Ohgren, were picked up by the Canucks in a blockbuster trade for Vancouver captain Quinn Hughes on Friday. Jake DeBrusk had the other goal for the Canucks (12-17-3), with Thatcher Demko sharp in making 25 saves for the goaltending win. Quinn’s brother Luke Hughes scored for the Devils (18-14-1). Former Canuck Jacob Markstrom stopped 13 of 15 shots and took the loss in goal. DeBrusk opened the scoring just 61 seconds into the game on the power play, knocking home his own rebound in front of Markstrom. It was DeBrusk’s first goal in 11 games and ninth of the season. Eight of those have come with the man advantage. Buium made it 2-0 at 6:48, when he flipped the puck toward the net and it banked in off a Devils defender. Buium now h', 'Buium, Demko lead Canucks to 2-1 win over Devils as post-Hughes era begins Published 12:10 pm Sunday, December 14, 2025 By Philip Wolf Vancouver Canucks defenceman Zeeb Buium, in NHL action Sunday, Dec. 25, 2025 against the New Jersey Devils at the Prudential Center in Newark, N.J. ( photo) Zeev Buium had a goal and an assist in his Vancouver Canucks debut, leading his new team to a 2-1 win over the host New Jersey Devils in NHL action Sunday afternoon at the Prudential Center in Newark, N.J. Buium, along with Marco Rossi and Liam Ohgren, were picked up by the Canucks in a blockbuster trade for Vancouver captain Quinn Hughes on Friday. Jake DeBrusk had the other goal for the Canucks (12-17-3), with Thatcher Demko sharp in making 25 saves for the goaltending win. Quinn’s brother Luke Hughes scored for the Devils (18-14-1). Former Canuck Jacob Markstrom stopped 13 of 15 shots and took the loss in goal. DeBrusk opened the scoring just 61 seconds into the game on the power play, knocking home his own rebound in front of Markstrom. It was DeBrusk’s first goal in 11 games and ninth of the season. Eight of those have come with the man advantage. Buium made it 2-0 at 6:48, when he flipped the puck toward the net and it banked in off a Devils defender. Buium now h', 'Buium, Demko lead Canucks to 2-1 win over Devils as post-Hughes era begins Published 12:10 pm Sunday, December 14, 2025 By Philip Wolf Vancouver Canucks defenceman Zeeb Buium, in NHL action Sunday, Dec. 25, 2025 against the New Jersey Devils at the Prudential Center in Newark, N.J. ( photo) Zeev Buium had a goal and an assist in his Vancouver Canucks debut, leading his new team to a 2-1 win over the host New Jersey Devils in NHL action Sunday afternoon at the Prudential Center in Newark, N.J. Buium, along with Marco Rossi and Liam Ohgren, were picked up by the Canucks in a blockbuster trade for Vancouver captain Quinn Hughes on Friday. Jake DeBrusk had the other goal for the Canucks (12-17-3), with Thatcher Demko sharp in making 25 saves for the goaltending win. Quinn’s brother Luke Hughes scored for the Devils (18-14-1). Former Canuck Jacob Markstrom stopped 13 of 15 shots and took the loss in goal. DeBrusk opened the scoring just 61 seconds into the game on the power play, knocking home his own rebound in front of Markstrom. It was DeBrusk’s first goal in 11 games and ninth of the season. Eight of those have come with the man advantage. Buium made it 2-0 at 6:48, when he flipped the puck toward the net and it banked in off a Devils defender. Buium now h']"
21,12,21_brisbane_queensland_teachers_staffing,"['brisbane', 'queensland', 'teachers', 'staffing', 'infrastructure', 'victoria', 'working week', 'city council', 'public service', 'employment']","['The FIFO CEO: Rail Loop boss commutes from Queensland Add articles to your saved list and come back to them any time. The $900,000-a-year executive responsible for Melbourne’s most expensive infrastructure project commutes from Brisbane and is paid additional expenses to attend unscheduled meetings. Freedom of information documents released to The Age reveal the extraordinary arrangements to enable Suburban Rail Loop Authority chief executive Frankie Carroll to maintain a residence in Brisbane, fly in and out of his Big Build job, and bill taxpayers for flight costs when he is “recalled to duty”. Suburban Rail Loop Authority chief executive Frankie Carroll. This is an employment term used when staff are asked to work or return to the office outside their regular work hours. Carroll, who is on a remuneration package of between $900,000 and $909,999, has led the Allan government’s signature infrastructure project since 2021. This includes superannuation and accrued leave and other entitlements. While Carroll meets the cost of his regular commute himself, the documents show that taxpayers were charged when Carroll flew to Melbourne, where the rail loop authority is headquartered, to attend a conference. In another example of travel costs', '‘We’re in it for the fight’: State school teachers rally outside Parliament Add articles to your saved list and come back to them any time. Peter Haffenden is standing with hundreds of fellow state school teachers outside Parliament House, in inner-Brisbane, shortly after 4.30pm on Thursday. The humanities teacher says he frequently spends weekends, holidays, and nights marking work, preparing lessons, and planning curriculum. “I’ve been teaching 35 years and the workload’s probably gone up by a factor of five … I never get a chance to really spend time with my family because I’m working at home so much,” Haffenden said. Teachers Andrew Weber (left) and Peter Haffenden (right) said workloads had increased over the more than three decades both men had been teachers.Credit: Catherine Strohfeldt Fellow Brisbane region teacher Andrew Weber estimated a normal working week demanded about 45 to 50 hours’ work, but said during marking periods the hours spent on teaching tasks skyrocketed. “It’s obviously weekends, it’s obviously nights, it’s holidays … for instance, I’ve got to do probably 10 to 12 hours of drafts this weekend,” he said. Thursday’s rally was a warm-up for Queensland Teachers’ Union (QTU) members, who are planning to strike before the end of the sc', '‘We’re in it for the fight’: State school teachers rally outside Parliament Add articles to your saved list and come back to them any time. Peter Haffenden is standing with hundreds of fellow state school teachers outside Parliament House, in inner-Brisbane, shortly after 4.30pm on Thursday. The humanities teacher says he frequently spends weekends, holidays, and nights marking work, preparing lessons, and planning curriculum. “I’ve been teaching 35 years and the workload’s probably gone up by a factor of five … I never get a chance to really spend time with my family because I’m working at home so much,” Haffenden said. Teachers Andrew Weber (left) and Peter Haffenden (right) said workloads had increased over the more than three decades both men had been teachers.Credit: Catherine Strohfeldt Fellow Brisbane region teacher Andrew Weber estimated a normal working week demanded about 45 to 50 hours’ work, but said during marking periods the hours spent on teaching tasks skyrocketed. “It’s obviously weekends, it’s obviously nights, it’s holidays … for instance, I’ve got to do probably 10 to 12 hours of drafts this weekend,” he said. Thursday’s rally was a warm-up for Queensland Teachers’ Union (QTU) members, who are planning to strike before the end of the sc']"
22,11,22_welfare_budget cuts_labour_social security,"['welfare', 'budget cuts', 'labour', 'social security', 'taxpayers', 'jobs', 'increase', 'claims', 'income', 'savings']","['How much will DWP benefits and pensions rise following the budget? Benefits Budget 2025 Child Benefit Department for Work and Pensions DWP Pensions PIP Rachel Reeves Universal Credit National government Personal Finance DWP benefits including Universal Credit, Child Benefit, PIP, Carer\'s Allowance, and the State Pension are to increase in April 2026 after Rachel Reeves announced higher payments in her budget speech today. Anyone who claims DWP benefits should be in line for an increase in the next financial year, as the chancellor laid out plans to help pensioners, disabled people, parents, low earners, carers and unemployed people keep up with rising costs. Addressing MPs, Ms Reeves said: ""The broken welfare system that we inherited wrote off millions of people as too sick to work and we will reform that system so that it is a system that does not count the cost of failure, but one that protects people who cannot work and empowers those who can. ""We have brought back face-to-face assessments for disability benefits. Those are the face-to-face assessments that the shadow chancellor (Sir Mel Stride) got rid of when he was work and pensions secretary and our changes we have made to Universal Credit will get 15,000 people back into work, a figure con', 'How much will DWP benefits and pensions rise following the budget? Benefits Budget 2025 Child Benefit Department for Work and Pensions DWP Pensions PIP Rachel Reeves Universal Credit National government Personal Finance DWP benefits including Universal Credit, Child Benefit, PIP, Carer\'s Allowance, and the State Pension are to increase in April 2026 after Rachel Reeves announced higher payments in her budget speech today. Anyone who claims DWP benefits should be in line for an increase in the next financial year, as the chancellor laid out plans to help pensioners, disabled people, parents, low earners, carers and unemployed people keep up with rising costs. Addressing MPs, Ms Reeves said: ""The broken welfare system that we inherited wrote off millions of people as too sick to work and we will reform that system so that it is a system that does not count the cost of failure, but one that protects people who cannot work and empowers those who can. ""We have brought back face-to-face assessments for disability benefits. Those are the face-to-face assessments that the shadow chancellor (Sir Mel Stride) got rid of when he was work and pensions secretary and our changes we have made to Universal Credit will get 15,000 people back into work, a figure con', 'How much will DWP benefits and pensions rise following the budget? Benefits Budget 2025 Child Benefit Department for Work and Pensions DWP Pensions PIP Rachel Reeves Universal Credit National government Personal Finance DWP benefits including Universal Credit, Child Benefit, PIP, Carer\'s Allowance, and the State Pension are to increase in April 2026 after Rachel Reeves announced higher payments in her budget speech today. Anyone who claims DWP benefits should be in line for an increase in the next financial year, as the chancellor laid out plans to help pensioners, disabled people, parents, low earners, carers and unemployed people keep up with rising costs. Addressing MPs, Ms Reeves said: ""The broken welfare system that we inherited wrote off millions of people as too sick to work and we will reform that system so that it is a system that does not count the cost of failure, but one that protects people who cannot work and empowers those who can. ""We have brought back face-to-face assessments for disability benefits. Those are the face-to-face assessments that the shadow chancellor (Sir Mel Stride) got rid of when he was work and pensions secretary and our changes we have made to Universal Credit will get 15,000 people back into work, a figure con']"
