Topic,Count,Name,Representation,Representative_Docs
23,20,23_nhl_hockey_scoring_devils,"['nhl', 'hockey', 'scoring', 'devils', 'second period', 'newark', 'buffalo', 'ottawa', 'hughes', 'new team']","['Buium, Demko lead Canucks to 2-1 win over Devils as post-Hughes era begins Published 12:10 pm Sunday, December 14, 2025 By Philip Wolf Vancouver Canucks defenceman Zeeb Buium, in NHL action Sunday, Dec. 25, 2025 against the New Jersey Devils at the Prudential Center in Newark, N.J. ( photo) Zeev Buium had a goal and an assist in his Vancouver Canucks debut, leading his new team to a 2-1 win over the host New Jersey Devils in NHL action Sunday afternoon at the Prudential Center in Newark, N.J. Buium, along with Marco Rossi and Liam Ohgren, were picked up by the Canucks in a blockbuster trade for Vancouver captain Quinn Hughes on Friday. Jake DeBrusk had the other goal for the Canucks (12-17-3), with Thatcher Demko sharp in making 25 saves for the goaltending win. Quinn’s brother Luke Hughes scored for the Devils (18-14-1). Former Canuck Jacob Markstrom stopped 13 of 15 shots and took the loss in goal. DeBrusk opened the scoring just 61 seconds into the game on the power play, knocking home his own rebound in front of Markstrom. It was DeBrusk’s first goal in 11 games and ninth of the season. Eight of those have come with the man advantage. Buium made it 2-0 at 6:48, when he flipped the puck toward the net and it banked in off a Devils defender. Buium now h', 'Buium, Demko lead Canucks to 2-1 win over Devils as post-Hughes era begins Published 12:10 pm Sunday, December 14, 2025 By Philip Wolf Vancouver Canucks defenceman Zeeb Buium, in NHL action Sunday, Dec. 25, 2025 against the New Jersey Devils at the Prudential Center in Newark, N.J. ( photo) Zeev Buium had a goal and an assist in his Vancouver Canucks debut, leading his new team to a 2-1 win over the host New Jersey Devils in NHL action Sunday afternoon at the Prudential Center in Newark, N.J. Buium, along with Marco Rossi and Liam Ohgren, were picked up by the Canucks in a blockbuster trade for Vancouver captain Quinn Hughes on Friday. Jake DeBrusk had the other goal for the Canucks (12-17-3), with Thatcher Demko sharp in making 25 saves for the goaltending win. Quinn’s brother Luke Hughes scored for the Devils (18-14-1). Former Canuck Jacob Markstrom stopped 13 of 15 shots and took the loss in goal. DeBrusk opened the scoring just 61 seconds into the game on the power play, knocking home his own rebound in front of Markstrom. It was DeBrusk’s first goal in 11 games and ninth of the season. Eight of those have come with the man advantage. Buium made it 2-0 at 6:48, when he flipped the puck toward the net and it banked in off a Devils defender. Buium now h', 'Buium, Demko lead Canucks to 2-1 win over Devils as post-Hughes era begins Published 12:10 pm Sunday, December 14, 2025 By Philip Wolf Vancouver Canucks defenceman Zeeb Buium, in NHL action Sunday, Dec. 25, 2025 against the New Jersey Devils at the Prudential Center in Newark, N.J. ( photo) Zeev Buium had a goal and an assist in his Vancouver Canucks debut, leading his new team to a 2-1 win over the host New Jersey Devils in NHL action Sunday afternoon at the Prudential Center in Newark, N.J. Buium, along with Marco Rossi and Liam Ohgren, were picked up by the Canucks in a blockbuster trade for Vancouver captain Quinn Hughes on Friday. Jake DeBrusk had the other goal for the Canucks (12-17-3), with Thatcher Demko sharp in making 25 saves for the goaltending win. Quinn’s brother Luke Hughes scored for the Devils (18-14-1). Former Canuck Jacob Markstrom stopped 13 of 15 shots and took the loss in goal. DeBrusk opened the scoring just 61 seconds into the game on the power play, knocking home his own rebound in front of Markstrom. It was DeBrusk’s first goal in 11 games and ninth of the season. Eight of those have come with the man advantage. Buium made it 2-0 at 6:48, when he flipped the puck toward the net and it banked in off a Devils defender. Buium now h']"
24,20,24_cultural events_tourism_world cup_events,"['cultural events', 'tourism', 'world cup', 'events', 'sports', 'concerts', 'festivals', 'fifa world', 'sporting', 'competitions']","['Sporting And Cultural Events Boost Travel Intentions For 2026 Photo Credit: Deposit Photos Thirty-four percent of American travelers say they are likely to take an overnight trip to attend a sporting event in 2026. Twenty percent plan to attend a FIFA World Cup match, and 52% intend to travel overnight for cultural events such as concerts and festivals. Meanwhile, 47% are interested in touring Route 66 during its 100th anniversary year. These figures highlight a shift for the coming year where travel decisions are increasingly driven by events rather than relaxation. In 2026, Americans are choosing what to attend, not just where to go. The latest Longwoods International study shows that milestone celebrations and global competitions are now major motivators for travel. The calendar is driving demand. “Special events such as the FIFA World Cup, America 250 and the 100th anniversary of Route 66 will all motivate U.S. travel this year,” said Amir Eylon, President and CEO of Longwoods International. The industry has emphasized experience-based travel, but 2026 denotes a more specific trend. Events offer deadlines, shared participation, and reasons to plan trips in advance. The FIFA World Cup brings global visibility and international visitors. Am', 'Sporting And Cultural Events Boost Travel Intentions For 2026 Photo Credit: Deposit Photos Thirty-four percent of American travelers say they are likely to take an overnight trip to attend a sporting event in 2026. Twenty percent plan to attend a FIFA World Cup match, and 52% intend to travel overnight for cultural events such as concerts and festivals. Meanwhile, 47% are interested in touring Route 66 during its 100th anniversary year. These figures highlight a shift for the coming year where travel decisions are increasingly driven by events rather than relaxation. In 2026, Americans are choosing what to attend, not just where to go. The latest Longwoods International study shows that milestone celebrations and global competitions are now major motivators for travel. The calendar is driving demand. “Special events such as the FIFA World Cup, America 250 and the 100th anniversary of Route 66 will all motivate U.S. travel this year,” said Amir Eylon, President and CEO of Longwoods International. The industry has emphasized experience-based travel, but 2026 denotes a more specific trend. Events offer deadlines, shared participation, and reasons to plan trips in advance. The FIFA World Cup brings global visibility and international visitors. Am', 'Sporting And Cultural Events Boost Travel Intentions For 2026 Photo Credit: Deposit Photos Thirty-four percent of American travelers say they are likely to take an overnight trip to attend a sporting event in 2026. Twenty percent plan to attend a FIFA World Cup match, and 52% intend to travel overnight for cultural events such as concerts and festivals. Meanwhile, 47% are interested in touring Route 66 during its 100th anniversary year. These figures highlight a shift for the coming year where travel decisions are increasingly driven by events rather than relaxation. In 2026, Americans are choosing what to attend, not just where to go. The latest Longwoods International study shows that milestone celebrations and global competitions are now major motivators for travel. The calendar is driving demand. “Special events such as the FIFA World Cup, America 250 and the 100th anniversary of Route 66 will all motivate U.S. travel this year,” said Amir Eylon, President and CEO of Longwoods International. The industry has emphasized experience-based travel, but 2026 denotes a more specific trend. Events offer deadlines, shared participation, and reasons to plan trips in advance. The FIFA World Cup brings global visibility and international visitors. Am']"
25,19,25_jailed_offences_sentencing_crime,"['jailed', 'offences', 'sentencing', 'crime', 'asylum seekers', 'assaults', 'williams', 'pleaded guilty', 'devon', 'nottingham']","['Builder jailed after leaving families thousands out of pocket and homes in chaos Court A NORTH WALES builder has been jailed after leaving multiple customers with unfinished and substandard building work, despite taking tens of thousands of pounds in payments. Christian Williams, of Golygfa Mynydd, Mynydd Isa, appeared before Judge Simon Mills for sentencing at Mold Crown Court on Thursday (December 10) after admitting one count of theft and three counts of fraud by false representation. Williams, 53, had initially entered a not-guilty plea in December 2024 before changing his plea in July. Prosecutor Lee Reynolds said Williams, who ran a construction business, took large deposits from four sets of customers despite being in no financial position to carry out the work. The court heard that Mr John Hoyle agreed a £65,000 extension in March 2021 and paid a £13,000 deposit. Work was repeatedly delayed, and by March 2022 the project was still far from complete. Williams falsely told Mr Hoyle that bifold doors would arrive within four weeks and requested further payment, but the funds were never used to buy them. In texts to Mr Hoyle, Williams said he was “a mess”, had “lost money on the job”, and admitted he had not paid plasterers or plumbers. The family lived on', 'Builder jailed after leaving families thousands out of pocket and homes in chaos Court A NORTH WALES builder has been jailed after leaving multiple customers with unfinished and substandard building work, despite taking tens of thousands of pounds in payments. Christian Williams, of Golygfa Mynydd, Mynydd Isa, appeared before Judge Simon Mills for sentencing at Mold Crown Court on Thursday (December 10) after admitting one count of theft and three counts of fraud by false representation. Williams, 53, had initially entered a not-guilty plea in December 2024 before changing his plea in July. Prosecutor Lee Reynolds said Williams, who ran a construction business, took large deposits from four sets of customers despite being in no financial position to carry out the work. The court heard that Mr John Hoyle agreed a £65,000 extension in March 2021 and paid a £13,000 deposit. Work was repeatedly delayed, and by March 2022 the project was still far from complete. Williams falsely told Mr Hoyle that bifold doors would arrive within four weeks and requested further payment, but the funds were never used to buy them. In texts to Mr Hoyle, Williams said he was “a mess”, had “lost money on the job”, and admitted he had not paid plasterers or plumbers. The family lived on', 'Builder jailed after leaving families thousands out of pocket and homes in chaos Court A NORTH WALES builder has been jailed after leaving multiple customers with unfinished and substandard building work, despite taking tens of thousands of pounds in payments. Christian Williams, of Golygfa Mynydd, Mynydd Isa, appeared before Judge Simon Mills for sentencing at Mold Crown Court on Thursday (December 10) after admitting one count of theft and three counts of fraud by false representation. Williams, 53, had initially entered a not-guilty plea in December 2024 before changing his plea in July. Prosecutor Lee Reynolds said Williams, who ran a construction business, took large deposits from four sets of customers despite being in no financial position to carry out the work. The court heard that Mr John Hoyle agreed a £65,000 extension in March 2021 and paid a £13,000 deposit. Work was repeatedly delayed, and by March 2022 the project was still far from complete. Williams falsely told Mr Hoyle that bifold doors would arrive within four weeks and requested further payment, but the funds were never used to buy them. In texts to Mr Hoyle, Williams said he was “a mess”, had “lost money on the job”, and admitted he had not paid plasterers or plumbers. The family lived on']"
26,19,26_monitor_tvs_display_screen,"['monitor', 'tvs', 'display', 'screen', 'playstation', 'resolution', 'gaming', 'roku', 'android', 'immersive']","['Luckfox 16-inch 4K 120Hz portable touch monitor offers 100% sRGB coverage The segment of portable monitors continues to grow, with many models available on Amazon at relatively affordable prices, typically between $100 and $150. These screens can be useful for productivity on business trips or while traveling. But portable monitors that combine a high resolution with a fast refresh rate remain uncommon in the mid-range segment. Luckfox wants to address this gap with its new 16"" 4K Touch Monitor. The 16-inch display features a 3840 × 2400 (WQUXGA) IPS panel with 350 nits brightness and a 1200:1 contrast ratio. It uses optical bonding technology with 6H-hardness toughened glass and a matte finish to minimize ambient reflections. The 16:10 aspect ratio provides more vertical workspace than the standard 16:9 format. It also supports a 120Hz refresh rate, which is an upgrade over the common 60Hz panels found in many portable monitors, such as the Auzai ME16Z01 or the Arzopa A1M; response times aren\'t disclosed, though. As for connectivity, the product integrates two USB Type-C ports and a Mini HDMI input. Both USB-C ports support audio, video, and power delivery, meaning that only a single USB-C cable is required when connected to a compatible smartphone, tab', 'Samsung OLED 48S95H: New 48-inch and 165 Hz OLED TV revealed ahead of schedule with HDR10 Plus Advanced support Samsung has already teased plenty of devices on the eve of CES 2026. However, the trade show has decided to lift the lid on one of Samsung\'s forthcoming OLED Smart TVs. For context, Samsung listed numerous unreleased Smart TVs on its Parts Database over a month ago. Of those, CES has announced that the S95H is a 2026 Honoree in its Gaming & eSports category. Specifically, the trade show has signalled out a 48-inch variant that was missing from November\'s leak. Incidentally, last year\'s S95F only went as small as 55-inches (curr. $1,997 on Amazon). According to the listing, the S95H offers a 165 Hz refresh rate with VRR technology supported. Assuming a 4K resolution from the S95F series and the usage of HDMI 2.1 ports, a 165 Hz refresh rate would require the usage of Display Stream Compression (DSC) to output at its peak resolution and refresh rate simultaneously. Moreover, the new 48-inch Smart TV will support Samsung\'s new HDR10 Plus Advanced format. Pricing and availability are unknown for now; the full description provided by Samsung and CES is as follows: The Samsung OLED (S95H) is the world\'s most advanced 48"" OLED TV for high-end gaming. Combining unparalleled brightness and', ""World's largest monitor company designed a 4K 48-inch OLED dual-sided smart gaming display with metal feet, a magnetic power socket, and an Alienware-inspired sound system - but who will actually use it? Sign up for breaking news, reviews, opinion, top tech deals, and more. You are now subscribed Your newsletter sign-up was successful GP TV has unveiled what it calls the world’s first dual-sided 48-inch 4K OLED television, designed for gaming and sports viewing. The display is intended to deliver immersive experiences on both sides simultaneously, with built-in audio and dynamic lighting effects. TPV Technology Group, the company behind GP TV, claims the screen targets premium users who value high-end visual fidelity, as well as the public sector and government institutions. This design feels unusual because most monitors or televisions sit against a wall or on a desk, making a rear-facing display largely unnecessary. Its relevance only emerges if the screen stands in the center of a room, similar to display setups commonly seen in shopping malls - and even then, deploying such a device in public spaces would increase the risk of physical damage, leaving the practical use case for this product uncertain. It comes with an audio system that integrates surround sound, Dolby Atmos support, and sound tracking that follows on-screen action. Speakers with fabric covers on both sides creat""]"
27,18,27_tennis_tournament_tournaments_novak,"['tennis', 'tournament', 'tournaments', 'novak', 'semifinals', 'grand slam', 'match', 'competing', 'golf', 'standings']","['Australian Open star accuses BBC pundits of thinking \'tennis is only for white people\' A rising tennis player has slammed BBC pundits for attacking Naomi Osaka\'s bold outfit choices at the Australian Open. Osaka raised eyebrows when she entered the court for her first-round match against Antonia Ruzic sporting a unique pre-match look. She wore an ocean blue tie-dye tracksuit jacket and white wide-leg bottoms for the coin toss, along with a white umbrella. The jellyfish-inspired look was curated by fashion designer Robert Wun, who has previously worked on pieces worn by the likes of Beyonce, Cardi B and Ariana Grande. It came from a vision Osaka had while she was reading to her two-year-old daughter, Shai. Not everybody loved the outfit, though, with Jamie Murray and Eliza Wastcoat among those who weren\'t impressed. Speaking on BBC Radio 5 Live, Murray said: ""I felt there was an element of disrespect to the sport of tennis,"" while Wastcoat added: ""It looked a bit cheap, a little bit tacky."" It came after Wastcoat lasted Osaka\'s attire in a video on her Instagram account, saying: ""You are simply lying to yourself if you say you like Naomi Osaka\'s walk on outfit. ""You know what? I am tired of my own argument that anything that gets people talking about tennis is a good', 'Faker\'s T1 win third back-to-back League Of Legends world crown Winners from South Korea\'s T1 team (L-R) coach Kim Jeong-gyun, Doran or Choi Hyeon-joon, Oner or Mun Hyeon-jun, Faker or Lee Sang-hyeok, Gumayusi or Lee Min-hyeong and Keria or Ryu Min-seok pose with the trophy during a press conference as they celebrate their victory against South Korea\'s KT Rolster at the final of the League of Legends World Championship in Chengdu, southwestern China\'s Sichuan province on Nov 9, 2025. — AFP CHENGDU, China: South Korean giants T1, headlined by star player Faker, made history on Nov 9 winning their third consecutive League of Legends World Championship crown in Chengdu, beating KT Rolsters in a nail-biting final. Touted as one of the world\'s largest eSports tournaments, the League of Legends World Championships offers a grand prize of US$1mil (RM4.16mil) along with numerous sponsorship deals worth billions. The two teams battled to a 2-2 deadlock, but T1 surged ahead in a thrilling fifth game to claim the world title after nearly five hours of relentless, high-stakes play. Nearly 40,000 fans gathered at the arena in China\'s Chengdu to watch the final, with Faker being the star player. ""He is really the god,"" Palm, a 28-year-old who had flown from', 'Retiring Wawrinka winds back the clock with gutsy win Stan Wawrinka\'s farewell tour has started with a gutsy win, the three-time grand slam champion beating world No.29 Arthur Rinderknech in a three-set thriller at the United Cup. Hold tight - we’re checking permissions before loading more content Wawrinka announced last month that 2026 will be his final year on tour, but he warned he wasn\'t planning to go quietly. The 40-year-old lived up to his word in 33-degree heat at Perth\'s RAC Arena on Saturday, digging deep into his reserves to pull off a brave 5-7 7-6 (7-5) 7-6 (7-5) victory over Rinderknech to give Switzerland an unassailable 2-0 lead in their tie against France. World No.11 Belinda Bencic had given Switzerland a 1-0 lead earlier in the day by beating Leolia Jeanjean 6-2 6-4 in 91 minutes. After an epic match that lasted three hours and 18 minutes, Wawrinka joked he had hoped for a quicker contest to begin 2026. ""But no, this is why I keep playing,"" Wawrinka said. ""I\'m passionate about the game. I\'m always going to push my own limit. I\'ve said I\'ve been working hard this off-season. ""Even if it\'s my last year, I don\'t just want to play to play. I want to play to compete and try to win. ""So I\'m super happy with the performanc']"
28,17,28_museum_egypt_cultural heritage_egyptian,"['museum', 'egypt', 'cultural heritage', 'egyptian', 'world largest', 'civilization', 'architecture', 'tourism industry', 'tourists', 'morocco']","[""Egypt unveils the world's largest museum dedicated to a single civilization CAIRO (AP) — Egypt is inaugurating on Saturday the Grand Egyptian Museum, two decades in the making, with the aim of drawing more visitors to revitalize the country's tourist industry. Located just outside Cairo on the Giza Plateau which also includes the three pyramids and the Sphinx, the museum will be the world’s largest dedicated to a single civilization. It will display over 50,000 artifacts detailing life in ancient Egypt. World leaders, including monarchs, heads of states and governments, are set to attend the grand opening ceremony, according to the Egyptian presidency which touted the museum as “an exceptional event in the history of human culture and civilization.” The museum is one of the megaprojects championed by President Abdel-Fattah el-Sissi since he took office in 2014. He has embarked on massive investments in infrastructure with the aim of reviving an economy weakened by decades of stagnation and battered by the unrest that followed the 2011 Arab Spring uprising. Preparations for the grand reveal have been shrouded in secrecy. The museum, which was opened for limited visits in recent years, has been closed for the past two weeks. The government has revamped the a"", ""Egypt unveils the world's largest museum dedicated to a single civilization CAIRO (AP) — Egypt is inaugurating on Saturday the Grand Egyptian Museum, two decades in the making, with the aim of drawing more visitors to revitalize the country's tourist industry. Located just outside Cairo on the Giza Plateau which also includes the three pyramids and the Sphinx, the museum will be the world’s largest dedicated to a single civilization. It will display over 50,000 artifacts detailing life in ancient Egypt. World leaders, including monarchs, heads of states and governments, are set to attend the grand opening ceremony, according to the Egyptian presidency which touted the museum as “an exceptional event in the history of human culture and civilization.” The museum is one of the megaprojects championed by President Abdel-Fattah el-Sissi since he took office in 2014. He has embarked on massive investments in infrastructure with the aim of reviving an economy weakened by decades of stagnation and battered by the unrest that followed the 2011 Arab Spring uprising. Preparations for the grand reveal have been shrouded in secrecy. The museum, which was opened for limited visits in recent years, has been closed for the past two weeks. The government has revamped the a"", ""Egypt unveils the world's largest museum dedicated to a single civilization Egypt is inaugurating on Saturday the Grand Egyptian Museum, two decades in the making, with the aim of drawing more visitors to revitalize the country's tourist industry. Located just outside Cairo on the Giza Plateau which also includes the three pyramids and the Sphinx, the museum will be the world’s largest dedicated to a single civilization. It will display over 50,000 artifacts detailing life in ancient Egypt. World leaders, including monarchs, heads of states and governments, are set to attend the grand opening ceremony, according to the Egyptian presidency which touted the museum as “an exceptional event in the history of human culture and civilization.” The museum is one of the megaprojects championed by President Abdel-Fattah el-Sissi since he took office in 2014. He has embarked on massive investments in infrastructure with the aim of reviving an economy weakened by decades of stagnation and battered by the unrest that followed the 2011 Arab Spring uprising. Preparations for the grand reveal have been shrouded in secrecy. The museum, which was opened for limited visits in recent years, has been closed for the past two weeks. The government has revamped the areas around t""]"
