Topic,Count,Name,Representation,Representative_Docs
-1,650,-1_officials_customers_national_students,"['officials', 'customers', 'national', 'students', 'statement', 'trump', 'media', 'companies', 'police', 'security']","[""Inagawa helps pace Drake in 24-19 win over Butler to stay perfect in Pioneer Football League INDIANAPOLIS (AP) — Logan Inagawa threw for 244 yards and a touchdown and Drake remained unbeaten in the Pioneer Football League by beating Butler 24-19 on Saturday. Drake's Isaiah Bragg returned the opening kickoff 32 yards to the Drake 34. On the first play from scrimmage, Nick Herman took the handoff and ran 66 yards to the end zone for a 7-0 Drake (6-2, 5-0) lead. Javascript is required for you to be able to read premium content. Please enable it in your browser settings. Copyright 2025 The Associated Press. All rights reserved. This material may not be published, broadcast, rewritten or redistributed without permission. Log In Keep it Clean. Please avoid obscene, vulgar, lewd, racist or sexually-oriented language. PLEASE TURN OFF YOUR CAPS LOCK. Don't Threaten. Threats of harming another person will not be tolerated. Be Truthful. Don't knowingly lie about anyone or anything. Be Nice. No racism, sexism or any sort of -ism that is degrading to another person. Be Proactive. Use the 'Report' link on each comment to let us know of abusive posts. Share with Us. We'd love to hear eyewitness accounts, the history behind an article. Sorry, there are no recent results for popular commen"", ""Pepsi adds a new take on cola Coca-Cola does not offer As a subscriber, you can share up to 3 articles each month with friends for free. Just click “Gift this Article” on this page, then copy the link or enter their email. Gifts are exclusive to subscribers, reset monthly, and each article can be redeemed once. It's natural for consumers to want healthier versions of unhealthy things. I, for example, have a sweet tooth and have been ordering from Shameless Snacks, a company that makes gummy candies that are 90 calories a package with only 3 grams of sugar and nearly a full day's worth of fiber. Javascript is required for you to be able to read premium content. Please enable it in your browser settings. Thanks for the feedback. Log In Keep it Clean. Please avoid obscene, vulgar, lewd, racist or sexually-oriented language. PLEASE TURN OFF YOUR CAPS LOCK. Don't Threaten. Threats of harming another person will not be tolerated. Be Truthful. Don't knowingly lie about anyone or anything. Be Nice. No racism, sexism or any sort of -ism that is degrading to another person. Be Proactive. Use the 'Report' link on each comment to let us know of abusive posts. Share with Us. We'd love to hear eyewitness accounts, the history behind an article. This"", ""T-Mobile adds harsh rule to flexible payment option for customers As a subscriber, you can share up to 3 articles each month with friends for free. Just click “Gift this Article” on this page, then copy the link or enter their email. Gifts are exclusive to subscribers, reset monthly, and each article can be redeemed once. T-Mobile has a new CEO, and the phone carrier is wasting no time in implementing drastic policy changes that impact customers. On Nov. 1, Srini Gopalan officially became CEO of T-Mobile, replacing Mike Sievert, who held the position for over five years. Javascript is required for you to be able to read premium content. Please enable it in your browser settings. Thanks for the feedback. Log In Keep it Clean. Please avoid obscene, vulgar, lewd, racist or sexually-oriented language. PLEASE TURN OFF YOUR CAPS LOCK. Don't Threaten. Threats of harming another person will not be tolerated. Be Truthful. Don't knowingly lie about anyone or anything. Be Nice. No racism, sexism or any sort of -ism that is degrading to another person. Be Proactive. Use the 'Report' link on each comment to let us know of abusive posts. Share with Us. We'd love to hear eyewitness accounts, the history behind an article. Monday, Oct 6, 2025 The Government has""]"
0,305,0_nasdaq_stocks_securities_shares,"['nasdaq', 'stocks', 'securities', 'shares', 'holdings', 'shareholders', 'companies', 'corporation', 'dividend', 'stock market']","['Eli Lilly and Company $LLY Shares Sold by Founders Grove Wealth Partners LLC Posted by Defense World Staff on Mar 27th, 2026 Founders Grove Wealth Partners LLC trimmed its holdings in Eli Lilly and Company (NYSE:LLY – Free Report) by 18.5% during the fourth quarter, according to its most recent 13F filing with the Securities and Exchange Commission (SEC). The firm owned 17,414 shares of the company’s stock after selling 3,956 shares during the quarter. Eli Lilly and Company comprises about 4.2% of Founders Grove Wealth Partners LLC’s portfolio, making the stock its 5th biggest position. Founders Grove Wealth Partners LLC’s holdings in Eli Lilly and Company were worth $18,715,000 at the end of the most recent quarter. Several other institutional investors and hedge funds also recently made changes to their positions in LLY. Sumitomo Mitsui Financial Group Inc. bought a new stake in shares of Eli Lilly and Company during the second quarter valued at approximately $27,000. Vermillion & White Wealth Management Group LLC raised its position in shares of Eli Lilly and Company by 84.2% during the third quarter. Vermillion & White Wealth Management Group LLC now owns 35 shares of the company’s stock worth $27,000 after purchasing an additional 16 shares during the', '49 Wealth Management LLC Makes New $624,000 Investment in Accenture PLC $ACN Posted by Defense World Staff on Mar 1st, 2026 49 Wealth Management LLC bought a new stake in shares of Accenture PLC (NYSE:ACN – Free Report) during the third quarter, according to the company in its most recent disclosure with the Securities and Exchange Commission. The fund bought 2,532 shares of the information technology services provider’s stock, valued at approximately $624,000. A number of other institutional investors also recently bought and sold shares of ACN. Brighton Jones LLC lifted its stake in shares of Accenture by 36.2% in the 4th quarter. Brighton Jones LLC now owns 18,438 shares of the information technology services provider’s stock valued at $6,486,000 after purchasing an additional 4,905 shares during the period. Sivia Capital Partners LLC raised its holdings in Accenture by 46.9% in the second quarter. Sivia Capital Partners LLC now owns 2,066 shares of the information technology services provider’s stock worth $618,000 after purchasing an additional 660 shares in the last quarter. United Bank lifted its position in Accenture by 49.8% during the second quarter. United Bank now owns 3,639 shares of the information technology services provider’s stock valued a', 'Adams Wealth Management Has $2.71 Million Stake in Schwab US Broad Market ETF $SCHB Posted by Defense World Staff on Dec 15th, 2025 Adams Wealth Management increased its holdings in shares of Schwab US Broad Market ETF (NYSEARCA:SCHB – Free Report) by 26.5% in the second quarter, according to the company in its most recent Form 13F filing with the Securities and Exchange Commission (SEC). The fund owned 113,506 shares of the company’s stock after buying an additional 23,754 shares during the period. Adams Wealth Management’s holdings in Schwab US Broad Market ETF were worth $2,705,000 at the end of the most recent quarter. A number of other hedge funds and other institutional investors have also recently bought and sold shares of the business. Milestones Private Investment Advisors LLC acquired a new position in shares of Schwab US Broad Market ETF in the 2nd quarter valued at $3,619,000. WT Wealth Management grew its stake in shares of Schwab US Broad Market ETF by 0.3% during the second quarter. WT Wealth Management now owns 1,284,069 shares of the company’s stock worth $30,599,000 after purchasing an additional 3,857 shares during the period. Cambridge Financial Group LLC increased its holdings in Schwab US Broad Market ETF by 43.8% in the second quarter. Cambr']"
1,208,1_basketball_ncaa_head coach_warriors,"['basketball', 'ncaa', 'head coach', 'warriors', 'rebounds', 'bulldogs', 'playoff', 'women basketball', 'football', 'espn']","['""The things they\'ve never had since Andrew Bogut"" - Udonis Haslem believes Warriors need a true big man to get back on track As a subscriber, you can share up to 3 articles each month with friends for free. Just click “Gift this Article” on this page, then copy the link or enter their email. Gifts are exclusive to subscribers, reset monthly, and each article can be redeemed once. Different people are pointing at various things as the cause or causes of the Golden State Warriors\' struggles this season. Some say it\'s because they don\'t have a consistent second option behind Steph Curry. Others say it\'s because their young guys have not progressed as expected. While some believe it\'s Steve Kerr\'s coaching. Former Miami Heat captain Udonis Haslem thinks that the Dubs\' issues are rooted in the fact that they did not get what they were supposed to receive last offseason. Javascript is required for you to be able to read premium content. Please enable it in your browser settings. Log In Keep it Clean. Please avoid obscene, vulgar, lewd, racist or sexually-oriented language. PLEASE TURN OFF YOUR CAPS LOCK. Don\'t Threaten. Threats of harming another person will not be tolerated. Be Truthful. Don\'t knowingly lie about anyone or anything. Be Nice. No racism, sexism or any sort of -ism that is degrading to another p', ""Cameron Boozer should be the number one overall pick over AJ Dybantsa and Darryn Peterson — He gets criticized for the same reason Luka Doncic did As a subscriber, you can share up to 3 articles each month with friends for free. Just click “Gift this Article” on this page, then copy the link or enter their email. Gifts are exclusive to subscribers, reset monthly, and each article can be redeemed once. Duke's do-it-all power forward Cameron Boozer is hands down the best college player this season. Interestingly, however, he continues to lag in many mock drafts for the number one pick in this year's NBA Draft. Such takes make me wonder what is making pundits and observers continue to be unconvinced that he deserves to be the top pick. Javascript is required for you to be able to read premium content. Please enable it in your browser settings. Log In Keep it Clean. Please avoid obscene, vulgar, lewd, racist or sexually-oriented language. PLEASE TURN OFF YOUR CAPS LOCK. Don't Threaten. Threats of harming another person will not be tolerated. Be Truthful. Don't knowingly lie about anyone or anything. Be Nice. No racism, sexism or any sort of -ism that is degrading to another person. Be Proactive. Use the 'Report' link on each comment to let us know of abusive posts. Share with Us. We'd love to hear eyewitness accounts, the history"", ""Josh Heupel, Tennessee Receive Strong Message From 5-Star RB As a subscriber, you can share up to 3 articles each month with friends for free. Just click “Gift this Article” on this page, then copy the link or enter their email. Gifts are exclusive to subscribers, reset monthly, and each article can be redeemed once. The Tennessee Volunteers had a disappointing season after making their first College Football Playoff in 2024. The Volunteers, under the leadership of head coach Josh Heupel, finished the 2025 season with an 8-5 record. That was after being ranked as high as No. 11 in the country. However, the team struggled down the stretch, losing four of its final seven games. As a result, it is now focused on building a championship contender for the upcoming season. Javascript is required for you to be able to read premium content. Please enable it in your browser settings. Log In Keep it Clean. Please avoid obscene, vulgar, lewd, racist or sexually-oriented language. PLEASE TURN OFF YOUR CAPS LOCK. Don't Threaten. Threats of harming another person will not be tolerated. Be Truthful. Don't knowingly lie about anyone or anything. Be Nice. No racism, sexism or any sort of -ism that is degrading to another person. Be Proactive. Use the 'Report""]"
2,155,2_arsenal_villa_chelsea_united,"['arsenal', 'villa', 'chelsea', 'united', 'salah', 'bayern', 'premier league', 'newcastle', 'inter', 'madrid']","['Man City vs. Arsenal: Gunners suffer fresh \'injury blow\' ahead of Premier League blockbuster By Matt Law | 15 Apr 2026 21:37, Last updated: 15 Apr 2026 21:46 Arsenal attacker Noni Madueke has emerged as a major doubt for Sunday\'s blockbuster Premier League contest with Manchester City at the Etihad Stadium. Madueke made his fifth Champions League start of the campaign in Wednesday\'s quarter-final second leg against Sporting Lisbon at the Emirates Stadium. However, the 24-year-old was forced off in the 63rd minute after taking a knock to his knee. Max Dowman was introduced as the England international\'s replacement, and he has now emerged as a major doubt for this weekend\'s top-of-the-table clash with Man City. Arsenal are currently top of the Premier League table, six points ahead of second-placed Man City, who have a game in hand on the Gunners. Madueke has come up with seven goals and four assists in 35 appearances this season, but he could now be facing a spell on the sidelines entering the final straight. Bukayo Saka was also again absent for the Champions League game with Sporting. ""It was something that he was carrying for a while. It was an Achilles issue,"" said Arsenal boss Mikel Arteta ahead of the European fixture on Wednesday night when asked about his star play', ""Liverpool injury update: Alexander Isak, Alisson Becker and Jeremie Frimpong latest news and return dates Sport | Football Liverpool returned to winning ways with a 2-0 victory over Aston Villa to end their four-game losing streak in the Premier League. Pressure was piling on Arne Slot after the Reds slumped to ninth in the table, but even without a number of key players, the champions were able to sweep Villa aside to move back up to third. They welcome Real Madrid - Trent Alexander-Arnold, Xabi Alonso, et al - to Anfield in midweek, before they take on Manchester City in a mouth-watering encounter at the weekend. But will they have any of their star names back from injury? Ahead of a big few weeks, here’s all the latest Liverpool injury news and return dates... Alexander Isak has endured a tough start to life on Merseyside. Subbed at half-time in Liverpool’s 5-1 win over Frankfurt in the Champions League, Slot later revealed the £125million summer signing had suffered a minor groin injury. “Alexander had to go off at half-time because he felt his groin a little bit. That's a pity,” said Slot. “I've said many times it is such a difficult balance to find with a player that missed three months.” Isak was not in the squad in the 3-2 loss at Brentford, and he also missed out on the Caraba"", ""Liverpool injury update: Alexander Isak, Alisson Becker and Jeremie Frimpong latest news and return dates Liverpool returned to winning ways with a 2-0 victory over Aston Villa to end their four-game losing streak in the Premier League. Pressure was piling on Arne Slot after the Reds slumped to ninth in the table, but even without a number of key players, the champions were able to sweep Villa aside to move back up to third. They welcome Real Madrid - Trent Alexander-Arnold, Xabi Alonso, et al - to Anfield in midweek, before they take on Manchester City in a mouth-watering encounter at the weekend. But will they have any of their star names back from injury? Ahead of a big few weeks, here’s all the latest Liverpool injury news and return dates... Alexander Isak has endured a tough start to life on Merseyside. Subbed at half-time in Liverpool’s 5-1 win over Frankfurt in the Champions League, Slot later revealed the £125million summer signing had suffered a minor groin injury. “Alexander had to go off at half-time because he felt his groin a little bit. That's a pity,” said Slot. “I've said many times it is such a difficult balance to find with a player that missed three months.” Isak was not in the squad in the 3-2 loss at Brentford, and he also missed out on the Carabao Cup defeat agai""]"
3,150,3_passed away_linda_jane_grandmother,"['passed away', 'linda', 'jane', 'grandmother', 'died', 'memorial', 'funeral', 'mary', 'lived', 'sister']","['Mary Kuljis Fiamengo Birth: 1934 Death: 2025 Mary Fiamengo passed away peacefully on November 6, 2025. Mary was born on September 20, 1934 in Komiza, Croatia. She was preceded in death by her beloved husband, Pete J. Fiamengo. Mary was a devoted wife, mother, sister, grandmother, great grandmother, aunt and dear friend. She is survived by her daughters, Deborah Dwight and Jennifer (Tim) Lovoy; her grandchildren, Peter Dwight (Cassandra), John Lovoy (Sloane), Ellen (Justin) Ralph and Lauren Dwight (Tim); her great grandchildren, Jordana Koonce, Hank Ralph and Margot Dwight and her sister, Betty Galosic. She was a long standing member of Mary Star of the Sea Church Velike Gospe Society, San Pedro Peninsula Cancer Guild and San Pedro Peninsula Hospital Bookworm Guild. Mary was a woman of grace, elegance and kindness; always extending a gentle word, a thoughtful gesture or a warm embrace. A memorial mass will be held at 10:30 am on Monday, November 17, 2025 at Mary Star of the Sea Catholic Church. In lieu of flowers, Mary requested that a donation in her memory be made to the San Pedro Peninsula Cancer Guild or to Mary Star of the Sea High School. Send Flowers Plant a Tree Send a Meal', 'Jane Marie Solaro Birth: 1934 Death: 2026 Jane passed away peacefully on January 4, 2026 at the age of 91. Jane was born in Pacific Grove, CA on December 14, 1934 and lived in San Pedro her entire life. She is preceded in death by her loving husband John Solaro and her parents Matthew Bodul & Ann (Berkovich) Bodul. Jane enjoyed the last four years at the Canterbury in Rancho Palos Verdes with her loving friends and caretakers. She is survived by her loving children, Karen Solaro Durber (Martin), Denise Solaro and John Solaro (Lynn). She was a loving grandmother to Anthony Durber (Christina), Michelle Durber Dilly (Ian), Mark Durber, Nikki Solaro, Ali Solaro Sandoval (Dustin), Jack Solaro and Max Solaro and her great grandchildren Brooklynn and Logan Dilly She is also survived by her siblings Bob Bodul (Marylou), Sharon Bodul Werth (Fred) and Matthew Bodul (Angie) as well as several nieces and nephews. She will be deeply missed and remembered by all. Graveside burial at Green Hills Cemetery on Friday, January 23, 2026 @ 2 pm. Celebration of Life to follow. Honor with Flowers In memory of Jane Marie Plant a Living Memorial In memory of Jane Marie', 'Linda Sue (Jordan) Schlosser Birth: 1950 Death: 2025 Linda Sue (Jordan) Schlosser March 16, 1950-December 15, 2025 passed away peacefully surrounded by her family at her home in San Pancho, Mexico. Survived by her husband of 41 years, Phil Schlosser, her mother Gerry, daughter Kelly Noel, son Kevin Noel and wife Jennifer and her grandchildren Trevor and Lena. She was preceded in death by her father, Wayne Henry Jordan and brother Michael Wayne Jordan. Linda was born and raised in San Rafael, CA and graduated from Terra Linda High School. Linda loved sunshine, warm weather and travel. She was an outstanding cook and loved to entertain. Her great adventure was moving to Mexico, building a wonderful home filled with warmth, family, friends and great meals. She loved traveling throughout Mexico and Italy. Her family requests that gifts in lieu of flowers be made in Linda’s name to St. Jude Children’s Research Hospital. Forever deep in my soul, The memory of your love Fills my heart And I am never alone. Honor with Flowers In memory of Linda Sue Plant a Living Memorial In memory of Linda Sue']"
4,104,4_shootings_murder_county sheriff_sheriff office,"['shootings', 'murder', 'county sheriff', 'sheriff office', 'police', 'kelowna', 'county', 'arrested', 'suspect', 'warrant']","['6 killed in Mississippi mass shooting, suspect charged with murder Authorities have charged a 24-year-old man with murder after six people — including a child — were killed in a series of shootings in northeast Mississippi. Clay County Sheriff Eddie Scott said the victims — four family members related to the suspect and two other adults — were shot at three separate locations late Friday. The youngest victim was a cousin of the suspect. Related video above: Search underway for the killer of Ohio couple ""I don\'t know what kind of motive you could have to kill a 7-year-old,"" Scott said at a press conference Saturday. The suspect was identified as Daricka M. Moore. He faces a first-degree murder charge that could be upgraded to capital murder, Scott said. Moore may face additional murder charges as the investigation proceeds. The shootings took place in the rural community of Cedarbluff, west of the county seat of West Point. Clay County deputies received a call around 5:56 p.m. reporting gunshot victims in the Cedarbluff area; deputies arrived about 7:03 p.m. Investigators allege 24-year-old Daricka Moore shot multiple family members at the first scene and then stole a Ford F-150 belonging to his alleged deceased brother. Authorities say Moore later', '6 killed in Mississippi mass shooting, suspect charged with murder Authorities have charged a 24-year-old man with murder after six people — including a child — were killed in a series of shootings in northeast Mississippi. Clay County Sheriff Eddie Scott said the victims — four family members related to the suspect and two other adults — were shot at three separate locations late Friday. The youngest victim was a cousin of the suspect. Related video above: Search underway for the killer of Ohio couple ""I don\'t know what kind of motive you could have to kill a 7-year-old,"" Scott said at a press conference Saturday. The suspect was identified as Daricka M. Moore. He faces a first-degree murder charge that could be upgraded to capital murder, Scott said. Moore may face additional murder charges as the investigation proceeds. The shootings took place in the rural community of Cedarbluff, west of the county seat of West Point. Clay County deputies received a call around 5:56 p.m. reporting gunshot victims in the Cedarbluff area; deputies arrived about 7:03 p.m. Investigators allege 24-year-old Daricka Moore shot multiple family members at the first scene and then stole a Ford F-150 belonging to his alleged deceased brother. Authorities say Moore later', '6 killed in Mississippi mass shooting, suspect charged with murder Authorities have charged a 24-year-old man with murder after six people — including a child — were killed in a series of shootings in northeast Mississippi. Clay County Sheriff Eddie Scott said the victims — four family members related to the suspect and two other adults — were shot at three separate locations late Friday. The youngest victim was a cousin of the suspect. Related video above: Search underway for the killer of Ohio couple ""I don\'t know what kind of motive you could have to kill a 7-year-old,"" Scott said at a press conference Saturday. The suspect was identified as Daricka M. Moore. He faces a first-degree murder charge that could be upgraded to capital murder, Scott said. Moore may face additional murder charges as the investigation proceeds. The shootings took place in the rural community of Cedarbluff, west of the county seat of West Point. Clay County deputies received a call around 5:56 p.m. reporting gunshot victims in the Cedarbluff area; deputies arrived about 7:03 p.m. Investigators allege 24-year-old Daricka Moore shot multiple family members at the first scene and then stole a Ford F-150 belonging to his alleged deceased brother. Authorities say Moore later']"
