Topic,Count,Name,Representation,Representative_Docs
23,18,23_premium_betting_investments_rewards,"['premium', 'betting', 'investments', 'rewards', 'uk', 'casino', 'jackpot', 'slots', 'partnership', 'deals']","['Three lucky winners scoop £100,000 in Premium Bonds prize draw Leisure Lifestyle Norfolk Three people from Norfolk won an incredible £100,000 in this month\'s Premium Bonds prize draw. But they were not the only people to get lucky. A total of 342 people across the county scooped a share of £1,134,000, averaging £3,325 each. Three others bagged £50,000 and eight won £25,000. Nine people won £10,000, 19 won £5,000 and hundreds more received £1,000. Last month, 369 people won a share of £1,919,000 - with £1,000,000 going to just one person. Premium Bonds are an investment product from National Savings & Investments (NS&I). Unlike other investments, where investors earn interest or a regular dividend income, bonds are entered into a monthly prize draw where people can win between £25 and £1m. Andrew Westhead, NS&I retail director, said: ""The quickest way to check if you have won a prize is to use our Premium Bonds prize checker app, check online, or even ask Alexa from the second working day of each month onwards.""', 'AGS Interactive Expands Its UK Presence with bet365 Partnership LAS VEGAS, Dec. 05, 2025 (GLOBE NEWSWIRE) -- AGS Interactive (AGSi) has solidified its presence across the pond, taking a selection of its best-performing games live in the UK with bet365. This announcement further cements AGS\' partnership with bet365 building on existing collaborations in the United States, Canada, and Latin America. bet365\'s established UK market position and diverse global presence make them a logical strategic partner to support AGS\' global growth initiatives throughout Europe and beyond. At the time of launch, bet365 players across the UK will have access to more than 20 popular game titles from AGS\' interactive content library. Notable titles include: ""We\'ve worked closely with bet365 for years and extending our partnership to the UK is an important milestone for AGS,"" said Zoe Ebling, Vice President of Interactive at AGS. ""It not only reflects the strength of our relationship, but the growing global appeal and potential of our increasingly diverse portfolio of high-performing online slot content. This is a clear sign of where AGS is headed — broader reach, more markets, and a rapidly expanding international footprint."" ""We\'re delighted to welcome a selection', ""AGS Interactive Expands Its UK Presence with bet365 Partnership LAS VEGAS, Dec. 05, 2025 (GLOBE NEWSWIRE) -- AGS Interactive (AGSi) has solidified its presence across the pond, taking a selection of its best-performing games live in the UK with bet365. This announcement further cements AGS’ partnership with bet365 building on existing collaborations in the United States, Canada, and Latin America. bet365’s established UK market position and diverse global presence make them a logical strategic partner to support AGS’ global growth initiatives throughout Europe and beyond. At the time of launch, bet365 players across the UK will have access to more than 20 popular game titles from AGS' interactive content library. Notable titles include: “We’ve worked closely with bet365 for years and extending our partnership to the UK is an important milestone for AGS,” said Zoe Ebling, Vice President of Interactive at AGS. “It not only reflects the strength of our relationship, but the growing global appeal and potential of our increasingly diverse portfolio of high-performing online slot content. This is a clear sign of where AGS is headed — broader reach, more markets, and a rapidly expanding international footprint.” “We’re delighted to welcome a selection""]"
24,18,24_crosby_nhl_hockey_goals,"['crosby', 'nhl', 'hockey', 'goals', 'scoring', 'second period', 'rangers', 'ottawa', 'game winning', 'hughes']","['Buium, Demko lead Canucks to 2-1 win over Devils as post-Hughes era begins Published 12:10 pm Sunday, December 14, 2025 By Philip Wolf Vancouver Canucks defenceman Zeeb Buium, in NHL action Sunday, Dec. 25, 2025 against the New Jersey Devils at the Prudential Center in Newark, N.J. ( photo) Zeev Buium had a goal and an assist in his Vancouver Canucks debut, leading his new team to a 2-1 win over the host New Jersey Devils in NHL action Sunday afternoon at the Prudential Center in Newark, N.J. Buium, along with Marco Rossi and Liam Ohgren, were picked up by the Canucks in a blockbuster trade for Vancouver captain Quinn Hughes on Friday. Jake DeBrusk had the other goal for the Canucks (12-17-3), with Thatcher Demko sharp in making 25 saves for the goaltending win. Quinn’s brother Luke Hughes scored for the Devils (18-14-1). Former Canuck Jacob Markstrom stopped 13 of 15 shots and took the loss in goal. DeBrusk opened the scoring just 61 seconds into the game on the power play, knocking home his own rebound in front of Markstrom. It was DeBrusk’s first goal in 11 games and ninth of the season. Eight of those have come with the man advantage. Buium made it 2-0 at 6:48, when he flipped the puck toward the net and it banked in off a Devils defender. Buium now h', 'Buium, Demko lead Canucks to 2-1 win over Devils as post-Hughes era begins Published 12:10 pm Sunday, December 14, 2025 By Philip Wolf Vancouver Canucks defenceman Zeeb Buium, in NHL action Sunday, Dec. 25, 2025 against the New Jersey Devils at the Prudential Center in Newark, N.J. ( photo) Zeev Buium had a goal and an assist in his Vancouver Canucks debut, leading his new team to a 2-1 win over the host New Jersey Devils in NHL action Sunday afternoon at the Prudential Center in Newark, N.J. Buium, along with Marco Rossi and Liam Ohgren, were picked up by the Canucks in a blockbuster trade for Vancouver captain Quinn Hughes on Friday. Jake DeBrusk had the other goal for the Canucks (12-17-3), with Thatcher Demko sharp in making 25 saves for the goaltending win. Quinn’s brother Luke Hughes scored for the Devils (18-14-1). Former Canuck Jacob Markstrom stopped 13 of 15 shots and took the loss in goal. DeBrusk opened the scoring just 61 seconds into the game on the power play, knocking home his own rebound in front of Markstrom. It was DeBrusk’s first goal in 11 games and ninth of the season. Eight of those have come with the man advantage. Buium made it 2-0 at 6:48, when he flipped the puck toward the net and it banked in off a Devils defender. Buium now h', 'Buium, Demko lead Canucks to 2-1 win over Devils as post-Hughes era begins Published 12:10 pm Sunday, December 14, 2025 By Philip Wolf Vancouver Canucks defenceman Zeeb Buium, in NHL action Sunday, Dec. 25, 2025 against the New Jersey Devils at the Prudential Center in Newark, N.J. ( photo) Zeev Buium had a goal and an assist in his Vancouver Canucks debut, leading his new team to a 2-1 win over the host New Jersey Devils in NHL action Sunday afternoon at the Prudential Center in Newark, N.J. Buium, along with Marco Rossi and Liam Ohgren, were picked up by the Canucks in a blockbuster trade for Vancouver captain Quinn Hughes on Friday. Jake DeBrusk had the other goal for the Canucks (12-17-3), with Thatcher Demko sharp in making 25 saves for the goaltending win. Quinn’s brother Luke Hughes scored for the Devils (18-14-1). Former Canuck Jacob Markstrom stopped 13 of 15 shots and took the loss in goal. DeBrusk opened the scoring just 61 seconds into the game on the power play, knocking home his own rebound in front of Markstrom. It was DeBrusk’s first goal in 11 games and ninth of the season. Eight of those have come with the man advantage. Buium made it 2-0 at 6:48, when he flipped the puck toward the net and it banked in off a Devils defender. Buium now h']"
25,17,25_xi jinping_trade tensions_beijing_china,"['xi jinping', 'trade tensions', 'beijing', 'china', 'trump', 'tariffs', 'taiwan', 'trump reporters', 'largest economies', 'xi']","['Trump cuts China tariffs to 47pc after ‘amazing’ Xi meeting BUSAN, Oct 30 — US President Donald Trump said today he had agreed to reduce tariffs on China to 47 per cent in exchange for Beijing resuming US soybean purchases, keeping rare earths exports flowing and cracking down on the illicit trade of fentanyl. His remarks after face-to-face talks with Chinese President Xi Jinping in the South Korean city of Busan, their first since 2019, marked the finale of Trump’s whirlwind Asia trip on which he also touted trade breakthroughs with South Korea, Japan and South-east Asian nations. “I thought it was an amazing meeting,” Trump told reporters aboard Air Force One shortly after he departed Busan, adding that tariffs imposed on Chinese imports would be cut to 47 per cent from 57 per cent. Trading in global stocks was choppy as Trump revealed details of the deal, with major Asian indexes and European futures swinging between gains and losses. China’s Shanghai Composite Index slipped from a 10-year high, while US soybean futures were weaker. World stock markets from Wall Street to Tokyo had hit record highs leading up to the meeting on hopes of a breakthrough in a trade war between the world’s two largest economies that has upended supply chains', 'Xi tells Trump it’s ‘normal’ for world’s top economies to clash but calls for partnership KUALA LUMPUR, Oct 30 — China and the United States (US) should be partners and friends, Chinese President Xi Jinping said in his meeting with his counterpart Donald Trump at the Gimhae Air Base in Busan, South Korea, while stating that it is normal for two economic powerhouses to have frictions at times. Trump called Xi a great leader, “President Xi is a great leader of a great country, and I think we are going to have a fantastic relationship for a long period of time, and it is an honour to have you with us. Thank you very much.” Xi said, “China’s relations have remained stable on the whole (and) given our different national conditions, we do not always see eye to eye with each other, and it is normal for the two leading economies of the world to have frictions now and then and in the face of winds, waves and challenges.” “You and I at the helm of China-US relations should stay the right course and ensure the steady sailing forward of the giant ship of China-US relations. I always believe that China’s development goes hand in hand with your vision to make America great again,” he said. Xi said both leaders have spoken over the phone three times, exchanged several letters, and sta', ""Business : Xi Jinping Urges Partnership With Us, Says Frictions Are 'normal' Between Economic Powers KUALA LUMPUR, Oct 30 (Bernama) -- China and the United States (US) should be partners and friends, Chinese President Xi Jinping said in his meeting with his counterpart Donald Trump at the Gimhae Air Base in Busan, South Korea, while stating that it is normal for two economic powerhouses to have frictions at times. Trump called Xi a great leader, “President Xi is a great leader of a great country, and I think we are going to have a fantastic relationship for a long period of time, and it is an honour to have you with us. Thank you very much.” Xi said, “China’s relations have remained stable on the whole (and) given our different national conditions, we do not always see eye to eye with each other, and it is normal for the two leading economies of the world to have frictions now and then and in the face of winds, waves and challenges.” “You and I at the helm of China-US relations should stay the right course and ensure the steady sailing forward of the giant ship of China-US relations. I always believe that China’s development goes hand in hand with your vision to make America great again,” he said in the video that was streamed live by The White House. Xi said both leaders have spo""]"
26,17,26_harry_duchess_prince_queen elizabeth,"['harry', 'duchess', 'prince', 'queen elizabeth', 'royal', 'meghan markle', 'princess', 'billionaire', 'william', 'charles']","[""Prince Harry spotted for second time on holiday without Meghan Markle Prince Harry has been spotted for a second time this week on his holiday without his wife, Meghan Markle. On Wednesday, the Duke of Sussex was spotted taking part in the St. Regis World Snow Polo Championship in Aspen, Colorado, just hours after he was spotted skiing with close friend Nacho Figueras. The Prince, 41, reportedly was taking part in the polo tournament to stand in for a friend who couldn’t make it. He is believed to have been on the Aspen Valley team. Harry would have most likely been delighted to take part in the event, having played polo for a number of years. READ MORE: Meghan Markle breaks silence after Prince Harry spotted alone on holiday READ MORE: Princess Kate sends coded message at Royal Family Christmas lunch We use your sign-up to provide content in ways you've consented to and to improve our understanding of you. This may include adverts from us and 3rd parties based on our understanding. You can unsubscribe at any time. Read our Privacy Policy The sighting of the prince on the polo field came not long after the duke was spotted skiing at a resort with some male friends. A source told Hello magazine that the duke seemed to be enjoying himself in the mounta"", ""Real reason Andrew's Royal Lodge eviction announcement took so long Andrew hit an all-time royal low last week as it was announced he was to be stripped of all his royal titles and evicted from his 30-room Royal Lodge home. Buckingham Palace made the announcement on Thursday after weeks of Andrew dominating the headlines as a result of scandals involving his past friendship with the late convicted paedophile Jeffrey Epstein. While Andrew has always denied all accusations against him, the King’s brother was aware of how he was being a distraction to the monarchy, and on October 17 said he would no longer use his royal titles. However, King Charles took this a step further by formally removing them from him - a move that many did not see coming. While the King’s actions have been praised, some believe the monarch, 76, took too long to take action, especially over evicting the former prince from his Crown Estate mansion, however Queen Elizabeth's former press secretary Ailsa Anderson has now explained why. READ MORE: Donald Trump breaks silence on Royal Family stripping Andrew of titles READ MORE: Meghan Markle 'wants to be a billionaire' but it won't be from jam Our community members are treated to special offers, promotions, and adverts from us and"", '\'Harry and Andrew should both be removed from line of succession in royal shake-up\' Former BBC royal correspondent Jennie Bond has shared that she believes Prince Harry and Andrew Mountbatten-Windsor should both face the same fate when it comes to their positions in the line of succession. Harry, who is the King\'s second-born son, stepped down from royal duties in 2020 and has since relocated to the US. The 41-year-old, who lives in California with Meghan Markle and their children, is still fifth in line to the throne, following Prince William and his three children - Prince George, Princess Charlotte and Prince Louis. Disgraced Andrew, who was stripped of his royal titles last year over his connection to the late sex offender Jeffrey Epstein, is still eighth in line to the throne. Andrew\'s position follows Harry and Meghan\'s children, six-year-old Prince Archie and four-year-old Princess Lilibet, who are sixth and seventh in line. Read more: Fans share verdict on whether Meghan and Harry should do more \'royal tours\' Read more: Meghan Markle embarrassed live on SNL with savage Andrew comparison Speaking of Andrew\'s fate, Ms Bond told The Mirror: ""Of course Andrew should be removed from the line of succession. If you are not fit to be a prince, you’re certainly not']"
27,17,27_christmas_santa_holiday season_festive,"['christmas', 'santa', 'holiday season', 'festive', 'decorated', 'christmas eve', 'presents', 'holiday', 'festival', 'donations']","['Oakland County debuts 2025 ‘Local Gems’ contest Some shoppers in Oakland County can win between $250 and $1,000 in November as part of the annual Local Gems Sweepstakes. The rules are pretty simple: Visit one or more of the county’s 6,000-plus small retail businesses, take a selfie at the store and submit the entry to the county. A random drawing of selfies submitted online, in person or by mail determines the winner of the three prizes: $1,000, $500, or $250. Every entry must include a photo of the person inside or outside a local small business. The contest gets underway on Saturday, Nov. 1 and continues through Nov. 30. This year’s contest was launched in downtown Pontiac at Designed Mindfully, an interior-design company. Designed Mindfully was among the 2024’s top vote getters, with HobbyTown and AM2PM Barbershop in Southfield; It’s the Little Things in Ortonville; and Vibrant Vizionz in Oak Park. Designed Mindfully owner Deya Marchand said her shop is more than a small store. “We are a space where community, creativity, and intentional living come together,” she said, adding that Local Gems aligns beautifully with her store’s mission “to live and shop with purpose, supporting other small businesses and local artists.” The n', 'Want an ‘ezbacke uvin’ or ‘mot cantrl’ for Christmas? Write to Santa The time has come again for both the young and old to send in their letters to Santa. This has become one of my favorite Christmas traditions. The letters to Santa we publish each December are often heartwarming and occasionally heartbreaking. They are a reminder of what makes Christmas magical. They are an amusing break from the sometimes jarring news we must print in the paper. And, hey, they might even be beneficial to your brain’s elasticity. It takes some creativity on the reader’s part to figure out just what the little kiddies are asking for, since we publish the letters verbatim. Try to decipher these phrases from previous Santa letters: I’m looking forward to the, umm, creative writing in this year’s batch of letters. We will publish Santa letters from children and adults in north central Idaho and southeastern Washington. The letters can be just a few words if you have a short wish list, but please try to write no more than 300 words. Be sure to include the author’s name, age and town of residence. The letters can be emailed to city@lmtribune.com, sent in the mail to Letters to Santa, Lewiston Tribune, 505 Capital St., Lewiston, ID 83501, or dropped off at our office. The', 'Want an ‘ezbacke uvin’ or ‘mot cantrl’ for Christmas? Write to Santa The time has come again for both the young and old to send in their letters to Santa. This has become one of my favorite Christmas traditions. The letters to Santa we publish each December are often heartwarming and occasionally heartbreaking. They are a reminder of what makes Christmas magical. They are an amusing break from the sometimes jarring news we must print in the paper. And, hey, they might even be beneficial to your brain’s elasticity. It takes some creativity on the reader’s part to figure out just what the little kiddies are asking for, since we publish the letters verbatim. Try to decipher these phrases from previous Santa letters: I’m looking forward to the, umm, creative writing in this year’s batch of letters. We will publish Santa letters from children and adults in north central Idaho and southeastern Washington. The letters can be just a few words if you have a short wish list, but please try to write no more than 300 words. Be sure to include the author’s name, age and town of residence. The letters can be emailed to city@lmtribune.com, sent in the mail to Letters to Santa, Lewiston Tribune, 505 Capital St., Lewiston, ID 83501, or dropped off at our office. The']"
28,16,28_invasion ukraine_war ukraine_putin_ukraine,"['invasion ukraine', 'war ukraine', 'putin', 'ukraine', 'russia', 'sanctions', 'drone attack', 'energy infrastructure', 'nuclear', 'missiles']","[""Bulgaria names manager to take over Russia's Lukoil refinery after US sanctions A parliamentary vote authorised the government to seize Lukoil's assets in the country Bulgaria on Friday nominated a senior government official to take control of a major Lukoil refinery in the east of the country following US sanctions against the Russian oil giant. The United States last month hit Russia's two biggest oil producers -- Rosneft and Lukoil -- with sanctions over its war in Ukraine. Javascript is required for you to be able to read premium content. Please enable it in your browser settings. Originally published on doc.afp.com, part of the BLOX Digital Content Exchange. Log In Keep it Clean. Please avoid obscene, vulgar, lewd, racist or sexually-oriented language. PLEASE TURN OFF YOUR CAPS LOCK. Don't Threaten. Threats of harming another person will not be tolerated. Be Truthful. Don't knowingly lie about anyone or anything. Be Nice. No racism, sexism or any sort of -ism that is degrading to another person. Be Proactive. Use the 'Report' link on each comment to let us know of abusive posts. Share with Us. We'd love to hear eyewitness accounts, the history behind an article."", 'Russian general hospitalized in shooting, officials say A Russian general was shot at an apartment building in Moscow on Friday and taken to a hospital, Russian officials said. Investigative Committee spokesperson Svetlana Petrenko said in a statement that ""an unidentified individual fired several shots"" at Vladimir Alekseyev, the deputy chief of military intelligence. The spokesperson did not say who could be behind the shooting, and did not provide immediate information about Alekseyev\'s condition. A report by Russian business daily Kommersant cited by the Associated Press said the shooter posed as a delivery person and fired at Alekseyev in the stairway of his apartment building, wounding the general in the foot and arm. In an ensuing scuffle, Alekseyev tried to wrestle the gun away and was shot again in the chest before the assailant fled, the report said. When asked about the shooting, Foreign Minister Sergey Lavrov described it as a ""terrorist act"" by Ukraine intended to derail peace talks between Russian, Ukrainian and US negotiators that concluded in Abu Dhabi yesterday. The Kremlin said Russian President Vladimir Putin has been informed about the shooting, without sharing further details. Ukrainian authorities haven\'t commented', 'Russian general hospitalized after \'several shots\' in Moscow A Russian general was shot at an apartment building in Moscow on Friday and taken to a hospital, Russian officials said. Investigative Committee spokesperson Svetlana Petrenko said in a statement that ""an unidentified individual fired several shots"" at Vladimir Alekseyev, the deputy chief of military intelligence. The spokesperson did not say who could be behind the shooting, and did not provide immediate information about Alekseyev\'s condition. A report by Russian business daily Kommersant cited by the Associated Press said the shooter posed as a delivery person and fired at Alekseyev in the stairway of his apartment building, wounding the general in the foot and arm. In an ensuing scuffle, Alekseyev tried to wrestle the gun away and was shot again in the chest before the assailant fled, the report said. When asked about the shooting, Foreign Minister Sergey Lavrov described it as a ""terrorist act"" by Ukraine intended to derail peace talks between Russian, Ukrainian and US negotiators that concluded in Abu Dhabi yesterday. The Kremlin said Russian President Vladimir Putin has been informed about the shooting, without sharing further details. Ukrainian authorities haven\'t commented']"
