Topic,Count,Name,Representation,Representative_Docs
11,33,11_laboratory_hospitals_doctors_nursing,"['laboratory', 'hospitals', 'doctors', 'nursing', 'clinical', 'medical', 'nhs', 'tests', 'blood', 'screening']","['HNL Lab Medicine Brings Escape Room Fun to Hospital Education ALLENTOWN, Pa., Nov. 10, 2025 /PRNewswire/ -- HNL Lab Medicine is transforming hospital training by turning mandatory education into an adventure. To strengthen the collaboration between laboratory and nursing teams, HNL Lab Medicine\'s Clinical Hospital Advisors have introduced an innovative ""escape room""–style educational game that turns essential lab‐related lessons into an interactive experience. The escape room begins with a familiar challenge: how to avoid getting a phone call from the lab about a rejected sample. From there, nurses progress through a series of puzzles based on real‐world scenarios, selecting properly filled blood culture bottles; answering type & screen questions; identifying best practices to prevent clotted or hemolyzed samples; ordering laboratory tubes correctly, and collecting laboratory tubes in the correct order of draw. Each correct answer provides a key or code to unlock the next stage, ultimately leading to a prize. The activity takes less than ten minutes per nurse, no longer than a standard training session, but delivers far more excitement and engagement. The format encourages problem‐solving, sparks conversation, and helps key lessons stick. ""Ou', 'HNL Lab Medicine Brings Escape Room Fun to Hospital Education ALLENTOWN, Pa., Nov. 10, 2025 /PRNewswire/ -- HNL Lab Medicine is transforming hospital training by turning mandatory education into an adventure. To strengthen the collaboration between laboratory and nursing teams, HNL Lab Medicine\'s Clinical Hospital Advisors have introduced an innovative ""escape room""–style educational game that turns essential lab‐related lessons into an interactive experience. The escape room begins with a familiar challenge: how to avoid getting a phone call from the lab about a rejected sample. From there, nurses progress through a series of puzzles based on real‐world scenarios, selecting properly filled blood culture bottles; answering type & screen questions; identifying best practices to prevent clotted or hemolyzed samples; ordering laboratory tubes correctly, and collecting laboratory tubes in the correct order of draw. Each correct answer provides a key or code to unlock the next stage, ultimately leading to a prize. The activity takes less than ten minutes per nurse, no longer than a standard training session, but delivers far more excitement and engagement. The format encourages problem‐solving, sparks conversation, and helps key lessons stick. ""Ou', 'HNL Lab Medicine Brings Escape Room Fun to Hospital Education ALLENTOWN, Pa., Nov. 10, 2025 /PRNewswire/ -- HNL Lab Medicine is transforming hospital training by turning mandatory education into an adventure. To strengthen the collaboration between laboratory and nursing teams, HNL Lab Medicine\'s Clinical Hospital Advisors have introduced an innovative ""escape room""–style educational game that turns essential lab‐related lessons into an interactive experience. The escape room begins with a familiar challenge: how to avoid getting a phone call from the lab about a rejected sample. From there, nurses progress through a series of puzzles based on real‐world scenarios, selecting properly filled blood culture bottles; answering type & screen questions; identifying best practices to prevent clotted or hemolyzed samples; ordering laboratory tubes correctly, and collecting laboratory tubes in the correct order of draw. Each correct answer provides a key or code to unlock the next stage, ultimately leading to a prize. The activity takes less than ten minutes per nurse, no longer than a standard training session, but delivers far more excitement and engagement. The format encourages problem‐solving, sparks conversation, and helps key lessons stick. ""Ou']"
12,32,12_xi jinping_trump tariffs_beijing_tariffs,"['xi jinping', 'trump tariffs', 'beijing', 'tariffs', 'china', 'trump', 'diplomacy', 'taiwan', 'trump reporters', 'largest economies']","['Trump cuts China tariffs to 47pc after ‘amazing’ Xi meeting BUSAN, Oct 30 — US President Donald Trump said today he had agreed to reduce tariffs on China to 47 per cent in exchange for Beijing resuming US soybean purchases, keeping rare earths exports flowing and cracking down on the illicit trade of fentanyl. His remarks after face-to-face talks with Chinese President Xi Jinping in the South Korean city of Busan, their first since 2019, marked the finale of Trump’s whirlwind Asia trip on which he also touted trade breakthroughs with South Korea, Japan and South-east Asian nations. “I thought it was an amazing meeting,” Trump told reporters aboard Air Force One shortly after he departed Busan, adding that tariffs imposed on Chinese imports would be cut to 47 per cent from 57 per cent. Trading in global stocks was choppy as Trump revealed details of the deal, with major Asian indexes and European futures swinging between gains and losses. China’s Shanghai Composite Index slipped from a 10-year high, while US soybean futures were weaker. World stock markets from Wall Street to Tokyo had hit record highs leading up to the meeting on hopes of a breakthrough in a trade war between the world’s two largest economies that has upended supply chains', 'Xi tells Trump it’s ‘normal’ for world’s top economies to clash but calls for partnership KUALA LUMPUR, Oct 30 — China and the United States (US) should be partners and friends, Chinese President Xi Jinping said in his meeting with his counterpart Donald Trump at the Gimhae Air Base in Busan, South Korea, while stating that it is normal for two economic powerhouses to have frictions at times. Trump called Xi a great leader, “President Xi is a great leader of a great country, and I think we are going to have a fantastic relationship for a long period of time, and it is an honour to have you with us. Thank you very much.” Xi said, “China’s relations have remained stable on the whole (and) given our different national conditions, we do not always see eye to eye with each other, and it is normal for the two leading economies of the world to have frictions now and then and in the face of winds, waves and challenges.” “You and I at the helm of China-US relations should stay the right course and ensure the steady sailing forward of the giant ship of China-US relations. I always believe that China’s development goes hand in hand with your vision to make America great again,” he said. Xi said both leaders have spoken over the phone three times, exchanged several letters, and sta', ""Business : Xi Jinping Urges Partnership With Us, Says Frictions Are 'normal' Between Economic Powers KUALA LUMPUR, Oct 30 (Bernama) -- China and the United States (US) should be partners and friends, Chinese President Xi Jinping said in his meeting with his counterpart Donald Trump at the Gimhae Air Base in Busan, South Korea, while stating that it is normal for two economic powerhouses to have frictions at times. Trump called Xi a great leader, “President Xi is a great leader of a great country, and I think we are going to have a fantastic relationship for a long period of time, and it is an honour to have you with us. Thank you very much.” Xi said, “China’s relations have remained stable on the whole (and) given our different national conditions, we do not always see eye to eye with each other, and it is normal for the two leading economies of the world to have frictions now and then and in the face of winds, waves and challenges.” “You and I at the helm of China-US relations should stay the right course and ensure the steady sailing forward of the giant ship of China-US relations. I always believe that China’s development goes hand in hand with your vision to make America great again,” he said in the video that was streamed live by The White House. Xi said both leaders have spo""]"
13,32,13_crore_delhi_international airport_india,"['crore', 'delhi', 'international airport', 'india', 'rs lakh', 'navi mumbai', 'railways', 'pune', 'icc', 'manufacturing']","['Air India receives first factory-fresh 787-9; expects A350-1000 deliveries this year By Alfred Chua2026-01-13T08:06:00+00:00 Air India has taken delivery of its first factory-fresh Boeing 787-9, as it looks to receive more widebodies – including its first Airbus A350-1000 – through the rest of the year. The 787-9 (registered VT-AWA) arrived at Delhi airport following a delivery flight of almost 17h from Boeing’s Everett factory. It is the first of 20 787s the Star Alliance carrier ordered in 2023, and forms part of a record order for close to 500 new aircraft. Source: Air India Air India’s first line-fit 787-9. The carrier has configured the 787-9 to seat 296 passengers across three classes – business, premium economy and economy – and alludes to “bespoke cabin interiors” that have been installed during production. Details of the cabin products will be revealed “in the coming weeks”, Air India adds. The aircraft will enter commercial service in February on an unspecified long-haul route. The airline currently has six 787-9s in service, which it inherited following its merger with compatriot Vistara. It also has 26 -8s, which are undergoing cabin upgrades. Air India says “many of these aircraft” will be retrofitted with new products – likely similar to those on the', 'Air India receives first line-fit 787; expects A350-1000 deliveries this year By Alfred Chua2026-01-13T08:06:00+00:00 Air India has taken delivery of its first factory-fresh Boeing 787-9, as it looks to receive more widebodies – including its first Airbus A350-1000 – through the rest of the year. The 787-9 (registered VT-AWA) arrived at Delhi airport following a delivery flight of almost 17h from Boeing’s Everett factory. It is the first of 20 787s the Star Alliance carrier ordered in 2023, and forms part of a record order for close to 500 new aircraft. Source: Air India Air India’s first line-fit 787-9. The carrier has configured the 787-9 to seat 296 passengers across three classes – business, premium economy and economy – and alludes to “bespoke cabin interiors” that have been installed during production. Details of the cabin products will be revealed “in the coming weeks”, Air India adds. The aircraft will enter commercial service in February on an unspecified long-haul route. The airline currently has six 787-9s in service, which it inherited following its merger with compatriot Vistara. It also has 26 -8s, which are undergoing cabin upgrades. Air India says “many of these aircraft” will be retrofitted with new products – likely similar to those on the', 'Budget 2026: FM Proposes Raising Electronics Manufacturing Outlay To Rs 40,000 cr In FY27 Finance Minister Nirmala Sitharaman on Sunday proposed to increase the outlay on electronics manufacturing to Rs 40,000 crore in the 2026-27 fiscal year. Presenting the Union Budget for 2026-27, she said high-tech tool rooms will be established at two locations to give push to capital goods manufacturing. Sitharaman also proposed a scheme for container manufacturing to create globally competitive ecosystem. Three dedicated chemical parks will also be set up to enhance domestic production, reduce import dependency, she added. The move comes amid a massive thrust by the government on increasing electronics manufacturing in the country. The mobile manufacturing segment witnessed a nearly 30-fold increase in production value, rising from Rs 18,000 crore in FY15 to Rs 5.45 lakh crore in FY25. iPhone exports from India have hit Rs 2.03 lakh crore in 2025, which is almost double that of Rs 1.1 lakh crore Apple exported in the calendar year 2024. Mobile phone production in the country is expected to reach about Rs 6.76 lakh crore, comprising exports over USD 30 billion, or about Rs 2.7 lakh crore, by the end of the current fiscal year. As of August 2025, 10 semiconductor manufacturing and']"
14,31,14_husband_cats_kardashian_chloe,"['husband', 'cats', 'kardashian', 'chloe', 'awards', 'inappropriate', 'baby', 'feud', 'chris', 'scenes']","[""Oscars Front-Runner Makes Shocking Confession About Her Husband's Cats: 'This Is Bad' Jessie Buckley won over critics and moviegoers with her heart-wrenching performance in “Hamnet,” but her comments in a three-month-old interview are receiving new scrutiny as awards season draws to a close. Appearing on the “Happy Sad Confused” podcast with her “Hamnet” co-star Paul Mescal in November, Buckley admitted she’d made her husband, Freddie Sorensen, get rid of his two cats early in their relationship. Buzz: Valerie Bertinelli Says 'Shame' Forced Her To Keep Childhood ****** Abuse Secret For Over 50 Years “Cats are mean,” she insisted. “My husband, when I started dating him, he had two cats ... this is bad ... One of the cats was, like, a pedigree model *****. And she staged, like, a coup against me. I’d come home, and there would just be, like, poo on my pillow.” Eventually, Buckley gave Sorensen an ultimatum ― which she joked may now get her “canceled.” “I was like: ‘It’s me or the cats,’” she recalled. “But I won! Sorry!” Mescal appeared to support his co-star’s actions, and quipped: “**** cats, honestly. **** ’em!” Watch Jessie Buckley and Paul Mescal’s “Happy Sad Confused” interview below. Their comments on cats can be found around the 36:42 mark. Like this article?"", ""Oscars Front-Runner Makes Shocking Confession About Her Husband's Cats: 'This Is Bad' Jessie Buckley won over critics and moviegoers with her heart-wrenching performance in “Hamnet,” but her comments in a three-month-old interview are receiving new scrutiny as awards season draws to a close. Appearing on the “Happy Sad Confused” podcast with her “Hamnet” co-star Paul Mescal in November, Buckley admitted she’d made her husband, Freddie Sorensen, get rid of his two cats early in their relationship. Buzz: Actor And Rapper Jailed For Killing Student In Hit-And-Run “Cats are mean,” she insisted. “My husband, when I started dating him, he had two cats ... this is bad ... One of the cats was, like, a pedigree model *****. And she staged, like, a coup against me. I’d come home, and there would just be, like, poo on my pillow.” Eventually, Buckley gave Sorensen an ultimatum ― which she joked may now get her “canceled.” “I was like: ‘It’s me or the cats,’” she recalled. “But I won! Sorry!” Mescal appeared to support his co-star’s actions, and quipped: “**** cats, honestly. **** ’em!” Advertisement Watch Jessie Buckley and Paul Mescal’s “Happy Sad Confused” interview below. Their comments on cats can be found around the 36:42 mark. Like this article? Keep independent journalis"", 'Strictly Come Dancing star breaks silence after concern fifth contestant would quit Strictly Come Dancing\'s Alex Kingston is poised to carry on with her dance adventure, putting to rest concerns she might have to withdraw due to injury. The 62-year-old actress had triggered concerns about a potential exit after her daughter disclosed a rib injury on social media, stating that her mother had endured the discomfort to participate in Saturday\'s programme. The Doctor Who legend, who has been dazzling audiences on the dance floor alongside partner Johannes Radebe, was swift to comfort her supporters that injuries were simply ""part and parcel"" of the Strictly experience, and she had absolutely no plans to retire her dancing shoes. Fleur East, host of Strictly spin-off It Takes Two, has now verified that Alex will return to the competition following last week\'s Blackpool special. Discussing their forthcoming performance, Fleur disclosed: ""Alex and Johannes will be dancing a cha-cha-cha to Ring My Bell by Anita Ward."" We use your sign-up to provide content in ways you\'ve consented to and to improve our understanding of you. This may include adverts from us and 3rd parties based on our understanding. You can unsubscribe at any time. Read our Privacy Policy She continued: ""']"
15,27,15_epstein files_department justice_sex offender_clinton,"['epstein files', 'department justice', 'sex offender', 'clinton', 'investigative', 'fbi', 'white house', 'jeffrey', 'convicted', 'donald']","[""Latest Epstein release shows scope of DOJ probes into Epstein, Maxwell The U.S. Justice Department has released tens of thousands more documents related to Jeffrey Epstein, a tranche that included multiple mentions of President Donald Trump but added little new revelatory information. WASHINGTON — The U.S. Justice Department released tens of thousands more documents related to Jeffrey Epstein, a tranche that included multiple mentions of President Donald Trump but added little new revelatory information to the long-anticipated public file on the late financier and convicted sex offender. President Donald Trump speaks Monday at his Mar-a-Lago club in Palm Beach, Fla. A desk and photographs are pictured July 6, 2019, during a search of Jeffrey Epstein's home in New York. An email that was included in the U.S. Department of Justice release of the Jeffrey Epstein files is photographed Monday. Get local news delivered to your inbox! The U.S. Justice Department has released tens of thousands more documents related to Jeffrey Epstein, a tranche that included multiple mention…"", ""Latest Epstein release shows scope of DOJ probes into Epstein, Maxwell The U.S. Justice Department has released tens of thousands more documents related to Jeffrey Epstein, a tranche that included multiple mentions of President Donald Trump but added little new revelatory information. WASHINGTON — The U.S. Justice Department released tens of thousands more documents related to Jeffrey Epstein, a tranche that included multiple mentions of President Donald Trump but added little new revelatory information to the long-anticipated public file on the late financier and convicted sex offender. President Donald Trump speaks Monday at his Mar-a-Lago club in Palm Beach, Fla. A desk and photographs are pictured July 6, 2019, during a search of Jeffrey Epstein's home in New York. An email that was included in the U.S. Department of Justice release of the Jeffrey Epstein files is photographed Monday. Get local news delivered to your inbox! The U.S. Justice Department has released tens of thousands more documents related to Jeffrey Epstein, a tranche that included multiple mention…"", ""Latest Epstein release shows scope of DOJ probes into Epstein, Maxwell The U.S. Justice Department has released tens of thousands more documents related to Jeffrey Epstein, a tranche that included multiple mentions of President Donald Trump but added little new revelatory information. WASHINGTON — The U.S. Justice Department released tens of thousands more documents related to Jeffrey Epstein, a tranche that included multiple mentions of President Donald Trump but added little new revelatory information to the long-anticipated public file on the late financier and convicted sex offender. President Donald Trump speaks Monday at his Mar-a-Lago club in Palm Beach, Fla. A desk and photographs are pictured July 6, 2019, during a search of Jeffrey Epstein's home in New York. An email that was included in the U.S. Department of Justice release of the Jeffrey Epstein files is photographed Monday. Get local news delivered to your inbox! The U.S. Justice Department has released tens of thousands more documents related to Jeffrey Epstein, a tranche that included multiple mention…""]"
16,25,16_board directors_governance_niagara_alberta,"['board directors', 'governance', 'niagara', 'alberta', 'province', 'provincial', 'natural resources', 'british columbia', 'mackenzie', 'directors']","['New directors join the Columbia Basin Trust team Published 1:18 pm Wednesday, February 25, 2026 By Gillian Francis The new Columbia Basin Trust Board of Directors. Front row (L-R): Betty Anne Marino, Susan Clovechok, Ron Oszust, Suzan Hewat, Melanie Jeannotte, Christine Hoechsmann. Back row (L-R): Am Naqvi, Jared Basil, Owen Torgerson, Katrine Conroy. Missing: Angus Graeme and Karen Hamling (Submitted) Four new directors have been appointed to the Columbia Basin Trust’s Board of Directors. Melanie Jeannotte (Fernie), Jared Basil (yaqan nuʔkiy), Am Naqvi (Nelson), and Katrine Conroy (Pass Creek) are joining the 12-person team, bringing their own diverse business and leadership expertise to the table. Melanie Jeannotte took over ownership of Polar Peak Books in Fernie last year. She is the former CEO of Gallagher Benefit Services Canada, and brings a wealth of experience in national growth, economic development, food security and small business advocacy. Jared Basil is an educator and governance leader for Ktunaxa First Nation’s Lower Kootenay Band near Creston, and currently chairs the College of the Rockies Board of Governors. Am Naqvi is a chartered professional accountant, who serves on the board of Kootenay Savings Credit Unio', 'New directors join the Columbia Basin Trust team Published 12:18 pm Wednesday, February 25, 2026 By Gillian Francis The new Columbia Basin Trust Board of Directors. Front row (L-R): Betty Anne Marino, Susan Clovechok, Ron Oszust, Suzan Hewat, Melanie Jeannotte, Christine Hoechsmann. Back row (L-R): Am Naqvi, Jared Basil, Owen Torgerson, Katrine Conroy. Missing: Angus Graeme and Karen Hamling (Submitted) Four new directors have been appointed to the Columbia Basin Trust’s Board of Directors. Melanie Jeannotte (Fernie), Jared Basil (yaqan nuʔkiy), Am Naqvi (Nelson), and Katrine Conroy (Pass Creek) are joining the 12-person team, bringing their own diverse business and leadership expertise to the table. Melanie Jeannotte took over ownership of Polar Peak Books in Fernie last year. She is the former CEO of Gallagher Benefit Services Canada, and brings a wealth of experience in national growth, economic development, food security and small business advocacy. Jared Basil is an educator and governance leader for Ktunaxa First Nation’s Lower Kootenay Band near Creston, and currently chairs the College of the Rockies Board of Governors. Am Naqvi is a chartered professional accountant, who serves on the board of Kootenay Savings Credit Uni', 'New directors join the Columbia Basin Trust team Published 12:18 pm Wednesday, February 25, 2026 By Gillian Francis The new Columbia Basin Trust Board of Directors. Front row (L-R): Betty Anne Marino, Susan Clovechok, Ron Oszust, Suzan Hewat, Melanie Jeannotte, Christine Hoechsmann. Back row (L-R): Am Naqvi, Jared Basil, Owen Torgerson, Katrine Conroy. Missing: Angus Graeme and Karen Hamling (Submitted) Four new directors have been appointed to the Columbia Basin Trust’s Board of Directors. Melanie Jeannotte (Fernie), Jared Basil (yaqan nuʔkiy), Am Naqvi (Nelson), and Katrine Conroy (Pass Creek) are joining the 12-person team, bringing their own diverse business and leadership expertise to the table. Melanie Jeannotte took over ownership of Polar Peak Books in Fernie last year. She is the former CEO of Gallagher Benefit Services Canada, and brings a wealth of experience in national growth, economic development, food security and small business advocacy. Jared Basil is an educator and governance leader for Ktunaxa First Nation’s Lower Kootenay Band near Creston, and currently chairs the College of the Rockies Board of Governors. Am Naqvi is a chartered professional accountant, who serves on the board of Kootenay Savings Credit Uni']"
