Topic,Count,Name,Representation,Representative_Docs
-1,614,-1_students_government_social_school,"['students', 'government', 'social', 'school', 'department', 'finance', 'community', 'services', 'usc', 'companies']","[""Kerr groups ready to help feed families cut off from SNAP due to shutdown Approximately 2,000 in Kerr County have not received November SNAP credits to their card since benefits ran out in October. Although the federal government shutdown is interfering with the Supplemental Nutritional Assistance Program that helps millions of low-income families, Kerr County food assistance partners stand ready to fill the gap. In Kerr County, 2,013 households totaling 4,082 individuals have not received November SNAP credits to their card since benefits ran out in October, according to the Texas Health and Human Services Department. Javascript is required for you to be able to read premium content. Please enable it in your browser settings. Virginia covers local government for the Kerrville Daily Times. reporter Log In Keep it Clean. Please avoid obscene, vulgar, lewd, racist or sexually-oriented language. PLEASE TURN OFF YOUR CAPS LOCK. Don't Threaten. Threats of harming another person will not be tolerated. Be Truthful. Don't knowingly lie about anyone or anything. Be Nice. No racism, sexism or any sort of -ism that is degrading to another person. Be Proactive. Use the 'Report' link on each comment to let us know of abusive posts. Share with Us. We'd love to hear ey"", ""Teen drug use remains low, but survey finds small rise in heroin and cocaine use Students walk the halls at a high school in Philadelphia on Aug. 29, 2013. NEW YORK (AP) — Teen use of alcohol, nicotine and marijuana remains at record lows, according to national survey results released Wednesday. They consume a lot of energy drinks, though. And there are slight, but concerning, increases in heroin and cocaine use. Javascript is required for you to be able to read premium content. Please enable it in your browser settings. Story continues below video Copyright 2025 The Associated Press. All rights reserved. This material may not be published, broadcast, rewritten or redistributed without permission. Log In Keep it Clean. Please avoid obscene, vulgar, lewd, racist or sexually-oriented language. PLEASE TURN OFF YOUR CAPS LOCK. Don't Threaten. Threats of harming another person will not be tolerated. Be Truthful. Don't knowingly lie about anyone or anything. Be Nice. No racism, sexism or any sort of -ism that is degrading to another person. Be Proactive. Use the 'Report' link on each comment to let us know of abusive posts. Share with Us. We'd love to hear eyewitness accounts, the history behind an article."", ""Anglo-French star Jane Birkin gets name on bridge over Paris canal Birkin's daughters, singer Lou Doillon and actor and singer Charlotte Gainsbourg attended the ceremony Anglo-French singer and film star Jane Birkin was honoured Saturday by the city she made her home after Paris named a footbridge over one of its canals after her. Birkin's daughters, singer Lou Doillon and actor and singer Charlotte Gainsbourg, were among the guests who attended the ceremony for their mother, who died in 2023 at the age of 76. Javascript is required for you to be able to read premium content. Please enable it in your browser settings. Originally published on doc.afp.com, part of the BLOX Digital Content Exchange. Log In Keep it Clean. Please avoid obscene, vulgar, lewd, racist or sexually-oriented language. PLEASE TURN OFF YOUR CAPS LOCK. Don't Threaten. Threats of harming another person will not be tolerated. Be Truthful. Don't knowingly lie about anyone or anything. Be Nice. No racism, sexism or any sort of -ism that is degrading to another person. Be Proactive. Use the 'Report' link on each comment to let us know of abusive posts. Share with Us. We'd love to hear eyewitness accounts, the history behind an article. Sorry, there are no recent results for popular""]"
0,308,0_nasdaq_nyse_stocks_investors,"['nasdaq', 'nyse', 'stocks', 'investors', 'shares', 'securities', 'holdings', 'companies', 'stock market', 'dividend']","['AA Financial Advisors LLC Buys 37,001 Shares of FS KKR Capital Corp. $FSK Posted by Defense World Staff on Dec 22nd, 2025 AA Financial Advisors LLC increased its stake in shares of FS KKR Capital Corp. (NYSE:FSK – Free Report) by 24.9% during the third quarter, according to the company in its most recent disclosure with the Securities & Exchange Commission. The firm owned 185,859 shares of the company’s stock after acquiring an additional 37,001 shares during the period. AA Financial Advisors LLC’s holdings in FS KKR Capital were worth $2,775,000 as of its most recent SEC filing. A number of other institutional investors and hedge funds have also recently added to or reduced their stakes in the stock. CCLA Investment Management acquired a new stake in shares of FS KKR Capital in the 2nd quarter valued at about $33,463,000. SCS Capital Management LLC bought a new position in shares of FS KKR Capital during the first quarter worth about $10,822,000. Generali Asset Management SPA SGR grew its holdings in shares of FS KKR Capital by 21.7% during the second quarter. Generali Asset Management SPA SGR now owns 2,485,265 shares of the company’s stock worth $51,569,000 after buying an additional 442,374 shares in the last quarter. Wellington Management Group LLP', 'Adams Wealth Management Has $2.71 Million Stake in Schwab US Broad Market ETF $SCHB Posted by Defense World Staff on Dec 15th, 2025 Adams Wealth Management increased its holdings in shares of Schwab US Broad Market ETF (NYSEARCA:SCHB – Free Report) by 26.5% in the second quarter, according to the company in its most recent Form 13F filing with the Securities and Exchange Commission (SEC). The fund owned 113,506 shares of the company’s stock after buying an additional 23,754 shares during the period. Adams Wealth Management’s holdings in Schwab US Broad Market ETF were worth $2,705,000 at the end of the most recent quarter. A number of other hedge funds and other institutional investors have also recently bought and sold shares of the business. Milestones Private Investment Advisors LLC acquired a new position in shares of Schwab US Broad Market ETF in the 2nd quarter valued at $3,619,000. WT Wealth Management grew its stake in shares of Schwab US Broad Market ETF by 0.3% during the second quarter. WT Wealth Management now owns 1,284,069 shares of the company’s stock worth $30,599,000 after purchasing an additional 3,857 shares during the period. Cambridge Financial Group LLC increased its holdings in Schwab US Broad Market ETF by 43.8% in the second quarter. Cambr', 'Promising Large Cap Stocks To Follow Now – February 23rd Posted by Defense World Staff on Feb 25th, 2026 Invesco QQQ, NVIDIA, Tesla, Microsoft, Sandisk, Amazon.com, and Micron Technology are the seven Large Cap stocks to watch today, according to MarketBeat’s stock screener tool. Large-cap stocks are shares of companies with a large market capitalization—generally firms valued at roughly $10 billion or more—calculated by multiplying the current share price by the number of outstanding shares. To investors they typically represent well-established, relatively stable businesses with lower volatility and slower growth than smaller-cap companies, often paying dividends and serving as core portfolio holdings. These companies had the highest dollar trading volume of any Large Cap stocks within the last several days. PowerShares QQQ Trust, Series 1 is a unit investment trust that issues securities called Nasdaq-100 Index Tracking Stock. The Trust’s investment objective is to provide investment results that generally correspond to the price and yield performance of the Nasdaq-100 Index. The Trust provides investors with the opportunity to purchase units of beneficial interest in the Trust representing proportionate undivided interests in the por']"
1,193,1_ncaa_basketball_bulldogs_championship,"['ncaa', 'basketball', 'bulldogs', 'championship', 'offense', 'head coach', 'women basketball', 'rebounds', 'sports', 'espn']","[""Inagawa helps pace Drake in 24-19 win over Butler to stay perfect in Pioneer Football League INDIANAPOLIS (AP) — Logan Inagawa threw for 244 yards and a touchdown and Drake remained unbeaten in the Pioneer Football League by beating Butler 24-19 on Saturday. Drake's Isaiah Bragg returned the opening kickoff 32 yards to the Drake 34. On the first play from scrimmage, Nick Herman took the handoff and ran 66 yards to the end zone for a 7-0 Drake (6-2, 5-0) lead. Javascript is required for you to be able to read premium content. Please enable it in your browser settings. Copyright 2025 The Associated Press. All rights reserved. This material may not be published, broadcast, rewritten or redistributed without permission. Log In Keep it Clean. Please avoid obscene, vulgar, lewd, racist or sexually-oriented language. PLEASE TURN OFF YOUR CAPS LOCK. Don't Threaten. Threats of harming another person will not be tolerated. Be Truthful. Don't knowingly lie about anyone or anything. Be Nice. No racism, sexism or any sort of -ism that is degrading to another person. Be Proactive. Use the 'Report' link on each comment to let us know of abusive posts. Share with Us. We'd love to hear eyewitness accounts, the history behind an article. Sorry, there are no recent results for popular commen"", ""Strong first half is enough for Indiana to topple Chicago State Lamar Wilkerson scored a game-high 21 points Saturday and Indiana made 14 of its 15 3-pointers in the first half of a 78-58 nonconference home win over Chicago State in Bloomington. Reed Bailey came off the bench to add 17 points and eight rebounds, while Nick Dorn contributed 15 points on 5-of-11 shooting from the 3-point line. The Hoosiers (9-3) drew assists on all but two of their 26 field goals, with Conor Enright dishing out seven and Wilkerson handing out six. Javascript is required for you to be able to read premium content. Please enable it in your browser settings. Please log in, or sign up for a new, free account to read or post comments. Log In Keep it Clean. Please avoid obscene, vulgar, lewd, racist or sexually-oriented language. PLEASE TURN OFF YOUR CAPS LOCK. Don't Threaten. Threats of harming another person will not be tolerated. Be Truthful. Don't knowingly lie about anyone or anything. Be Nice. No racism, sexism or any sort of -ism that is degrading to another person. Be Proactive. Use the 'Report' link on each comment to let us know of abusive posts. Share with Us. We'd love to hear eyewitness accounts, the history behind an article. Please purchase a subscriptio"", ""Mizzou men's basketball opens season on the road against Howard Mark Mitchell Missouri center Shawn Phillips Jr. dunks the ball during an exhibition game against Kansas State on Friday at Mizzou Arena. The Tigers will open their season Monday at Howard in Washington D.C. Javascript is required for you to be able to read premium content. Please enable it in your browser settings. Originally published on columbiamissourian.com, part of the BLOX Digital Content Exchange. Log In Keep it Clean. Please avoid obscene, vulgar, lewd, racist or sexually-oriented language. PLEASE TURN OFF YOUR CAPS LOCK. Don't Threaten. Threats of harming another person will not be tolerated. Be Truthful. Don't knowingly lie about anyone or anything. Be Nice. No racism, sexism or any sort of -ism that is degrading to another person. Be Proactive. Use the 'Report' link on each comment to let us know of abusive posts. Share with Us. We'd love to hear eyewitness accounts, the history behind an article.""]"
2,156,2_war iran_iran_ceasefire_middle east,"['war iran', 'iran', 'ceasefire', 'middle east', 'gaza', 'war', 'terrorist', 'trump administration', 'foreign minister', 'oil']","['US-Iran peace plan shared amid Trump threat over strait On the eve of a US deadline, the United States and Iran are weighing \u200cthe framework of a plan to end their five-week-old conflict, even as Tehran pushes back against pressure to swiftly reopen the Strait of Hormuz. President Donald Trump has threatened to rain ""hell"" on Tehran if it does not make a deal by the end of Tuesday that would allow \u200ctraffic to start moving again through the vital route for global energy supplies. The Pakistani-brokered plan emerged from intense overnight contacts and proposes an immediate ceasefire, followed by negotiations on a broader peace settlement to be concluded within 15 to 20 days, a source aware of the proposals said on Monday. Pakistan\'s \u200carmy chief, Field Marshal Asim Munir, was in contact ""all night long"" with US Vice-President JD Vance, special envoy Steve Witkoff and Iranian Foreign Minister Abbas Araqchi, the source said. Iran\'s foreign ministry said on Monday that Tehran had formulated positions and demands based on its interests and communicated them through intermediaries, in response to ceasefire proposals. Ministry spokesman Esmaeil Baghaei said details of the response would be announced in due time, but added negotiations were ""incom', ""AP News Summary at 4:09 a.m. EDT Iran launches new attacks at Israel and Gulf countries as it keeps up pressure on the Middle East DUBAI, United Arab Emirates (AP) — Iran has fired more drones and missiles at Israel and Gulf Arab countries as it keeps up pressure on the Middle East in a war that has sent oil prices surging and stunned global economies. The Saudi Defense Ministry said on Tuesday that it has destroyed two drones over the kingdom’s oil-rich eastern region, while in Kuwait, the National Guard said it shot down six drones attacking the county’s northern and southern areas. The attacks come as U.S. President Donald Trump sends contradictory signals about how long the war could last, adding to uncertainty that’s causing markets to swing. Copyright 2026 The Associated Press. All rights reserved. This material may not be published, broadcast, rewritten or redistributed. Log In Keep it Clean. Please avoid obscene, vulgar, lewd, racist or sexually-oriented language. PLEASE TURN OFF YOUR CAPS LOCK. Don't Threaten. Threats of harming another person will not be tolerated. Be Truthful. Don't knowingly lie about anyone or anything. Be Nice. No racism, sexism or any sort of -ism that is degrading to another person"", 'AP News Summary at 4:09 a.m. EDT Iranian barrages target Israel and Gulf countries as US warns Iran of ‘most intense day of strikes’ DUBAI, United Arab Emirates (AP) — Iran has fired more drones and missiles at Israel and Gulf Arab countries as it keeps up pressure on the Middle East. The war launched by the United States and Israel has sent oil prices surging and stunned global economies. The Saudi Defense Ministry said on Tuesday that it has destroyed two drones over the kingdom’s oil-rich eastern region, while in Kuwait, the National Guard said it shot down six drones attacking the country’s northern and southern areas. The attacks come as U.S. President Donald Trump sends contradictory signals about how long the war could last, adding to uncertainty that’s causing markets to swing. Javascript is required for you to be able to read premium content. Please enable it in your browser settings. Copyright 2026 The Associated Press. All rights reserved. This material may not be published, broadcast, rewritten or redistributed. Sorry, there are no recent results for popular videos. Sorry, there are no recent results for popular commented articles.']"
3,151,3_arsenal_villa_salah_bayern,"['arsenal', 'villa', 'salah', 'bayern', 'chelsea', 'inter', 'united', 'newcastle', 'madrid', 'milan']","['Man City vs. Arsenal: Gunners suffer fresh \'injury blow\' ahead of Premier League blockbuster By Matt Law | 15 Apr 2026 21:37, Last updated: 15 Apr 2026 21:46 Arsenal attacker Noni Madueke has emerged as a major doubt for Sunday\'s blockbuster Premier League contest with Manchester City at the Etihad Stadium. Madueke made his fifth Champions League start of the campaign in Wednesday\'s quarter-final second leg against Sporting Lisbon at the Emirates Stadium. However, the 24-year-old was forced off in the 63rd minute after taking a knock to his knee. Max Dowman was introduced as the England international\'s replacement, and he has now emerged as a major doubt for this weekend\'s top-of-the-table clash with Man City. Arsenal are currently top of the Premier League table, six points ahead of second-placed Man City, who have a game in hand on the Gunners. Madueke has come up with seven goals and four assists in 35 appearances this season, but he could now be facing a spell on the sidelines entering the final straight. Bukayo Saka was also again absent for the Champions League game with Sporting. ""It was something that he was carrying for a while. It was an Achilles issue,"" said Arsenal boss Mikel Arteta ahead of the European fixture on Wednesday night when asked about his star play', ""Liverpool injury update: Alexander Isak, Alisson Becker and Jeremie Frimpong latest news and return dates Sport | Football Liverpool returned to winning ways with a 2-0 victory over Aston Villa to end their four-game losing streak in the Premier League. Pressure was piling on Arne Slot after the Reds slumped to ninth in the table, but even without a number of key players, the champions were able to sweep Villa aside to move back up to third. They welcome Real Madrid - Trent Alexander-Arnold, Xabi Alonso, et al - to Anfield in midweek, before they take on Manchester City in a mouth-watering encounter at the weekend. But will they have any of their star names back from injury? Ahead of a big few weeks, here’s all the latest Liverpool injury news and return dates... Alexander Isak has endured a tough start to life on Merseyside. Subbed at half-time in Liverpool’s 5-1 win over Frankfurt in the Champions League, Slot later revealed the £125million summer signing had suffered a minor groin injury. “Alexander had to go off at half-time because he felt his groin a little bit. That's a pity,” said Slot. “I've said many times it is such a difficult balance to find with a player that missed three months.” Isak was not in the squad in the 3-2 loss at Brentford, and he also missed out on the Caraba"", ""Liverpool injury update: Alexander Isak, Alisson Becker and Jeremie Frimpong latest news and return dates Liverpool returned to winning ways with a 2-0 victory over Aston Villa to end their four-game losing streak in the Premier League. Pressure was piling on Arne Slot after the Reds slumped to ninth in the table, but even without a number of key players, the champions were able to sweep Villa aside to move back up to third. They welcome Real Madrid - Trent Alexander-Arnold, Xabi Alonso, et al - to Anfield in midweek, before they take on Manchester City in a mouth-watering encounter at the weekend. But will they have any of their star names back from injury? Ahead of a big few weeks, here’s all the latest Liverpool injury news and return dates... Alexander Isak has endured a tough start to life on Merseyside. Subbed at half-time in Liverpool’s 5-1 win over Frankfurt in the Champions League, Slot later revealed the £125million summer signing had suffered a minor groin injury. “Alexander had to go off at half-time because he felt his groin a little bit. That's a pity,” said Slot. “I've said many times it is such a difficult balance to find with a player that missed three months.” Isak was not in the squad in the 3-2 loss at Brentford, and he also missed out on the Carabao Cup defeat agai""]"
4,128,4_mumbai_maharashtra_pradesh_delhi,"['mumbai', 'maharashtra', 'pradesh', 'delhi', 'kumar', 'nadu', 'crore', 'murder', 'new delhi', 'high court']","['Rahul Narwekar Denies Allegations After Viral Video Allegedly Shows Him Threatening BMC Polls Candidates, Disrupting Nomination In Mumbai Mumbai: A major political controversy erupted in Maharashtra after a video allegedly showing Assembly Speaker Rahul Narwekar threatening opposition leaders during the filing of nomination papers went viral on social media. The incident triggered sharp reactions from opposition parties, with the Maharashtra Congress demanding that a criminal case be registered against the Speaker for alleged violations of the Model Code of Conduct (MCC). #WATCH | Mumbai | Maharashtra Assembly Speaker Rahul Narvekar says, ""...When I went to the spot, a former MLC pressurised me and he, along with his security guards, tried to stop me and I have submitted a complaint regarding it to the police officials"" pic.twitter.com/LhTilQfuL2 Responding to the allegations, Rahul Narwekar rejected all charges and denied any wrongdoing. He claimed that it was he who was pressured at the spot. “When I went there, a former MLC pressurised me and, along with his security guards, tried to stop me. I have submitted a complaint regarding this to the police officials,” Narwekar said. Viral Video Allegedly Shows Narwekar Threatening Ex-MP, MLC The controversy intensified after Aam Aadmi Party (AAP) leader Sanjay Singh shar', ""CRA soul-searching begins with vote to elect new leader The Centrist Reform Alliance (CRA) is facing serious questions about its future in the wake of a disastrous defeat in Sunday’s general election — starting with picking a new leader. The fledgling opposition party — founded by the Constitutional Democratic Party of Japan (CDP) and Komeito just days ahead of the Jan. 23 Lower House dissolution — is now preparing for a party leadership vote ahead of Feb. 18, where Sanae Takaichi will be reconfirmed as the country’s prime minister by parliament. The CRA’s newly elected lawmakers held a plenary meeting in Tokyo on Wednesday and agreed to pick a new chief on Friday. In a time of both misinformation and too much information, quality journalism is more crucial than ever.By subscribing, you can help us get the story right. With your current subscription plan you can comment on stories. However, before writing your first comment, please create a display name in the Profile section of your subscriber account page. Your subscription plan doesn't allow commenting. To learn more see our FAQ Sponsored contents planned and edited by JT Media Enterprise Division. 広告出稿に関するおといあわせはこちらまで Read more"", ""Top court grants retrial for deceased inmate over 1984 murder in Shiga The Supreme Court has upheld a high court decision to reopen a case involving a deceased man who had been serving a life sentence over a murder in Shiga Prefecture in 1984. The top court’s decision, finalized Tuesday, makes it the first case in recent history in which a retrial was granted for a deceased inmate who had been sentenced to life in prison or a heavier penalty. Known as the Hino town incident, the robbery-murder took place in December 1984 in Shiga Prefecture where a 69-year-old woman who ran a local liquor shop had gone missing. Her body was found in the same town a month later, with an opened portable safe belonging to the woman also found four months after her initial disappearance. In a time of both misinformation and too much information, quality journalism is more crucial than ever.By subscribing, you can help us get the story right. With your current subscription plan you can comment on stories. However, before writing your first comment, please create a display name in the Profile section of your subscriber account page. Your subscription plan doesn't allow commenting. To learn more see our FAQ Sponsored contents planned and edited by JT Media Enterprise Divisio""]"
