Topic,Count,Name,Representation,Representative_Docs
5,19,5_travel_tourism_world cup_events,"['travel', 'tourism', 'world cup', 'events', 'touring', 'concerts', 'fifa', 'fifa world', 'sporting', 'attend']","['Sporting And Cultural Events Boost Travel Intentions For 2026 Photo Credit: Deposit Photos Thirty-four percent of American travelers say they are likely to take an overnight trip to attend a sporting event in 2026. Twenty percent plan to attend a FIFA World Cup match, and 52% intend to travel overnight for cultural events such as concerts and festivals. Meanwhile, 47% are interested in touring Route 66 during its 100th anniversary year. These figures highlight a shift for the coming year where travel decisions are increasingly driven by events rather than relaxation. In 2026, Americans are choosing what to attend, not just where to go. The latest Longwoods International study shows that milestone celebrations and global competitions are now major motivators for travel. The calendar is driving demand. “Special events such as the FIFA World Cup, America 250 and the 100th anniversary of Route 66 will all motivate U.S. travel this year,” said Amir Eylon, President and CEO of Longwoods International. The industry has emphasized experience-based travel, but 2026 denotes a more specific trend. Events offer deadlines, shared participation, and reasons to plan trips in advance. The FIFA World Cup brings global visibility and international visitors. Am', 'Sporting And Cultural Events Boost Travel Intentions For 2026 Photo Credit: Deposit Photos Thirty-four percent of American travelers say they are likely to take an overnight trip to attend a sporting event in 2026. Twenty percent plan to attend a FIFA World Cup match, and 52% intend to travel overnight for cultural events such as concerts and festivals. Meanwhile, 47% are interested in touring Route 66 during its 100th anniversary year. These figures highlight a shift for the coming year where travel decisions are increasingly driven by events rather than relaxation. In 2026, Americans are choosing what to attend, not just where to go. The latest Longwoods International study shows that milestone celebrations and global competitions are now major motivators for travel. The calendar is driving demand. “Special events such as the FIFA World Cup, America 250 and the 100th anniversary of Route 66 will all motivate U.S. travel this year,” said Amir Eylon, President and CEO of Longwoods International. The industry has emphasized experience-based travel, but 2026 denotes a more specific trend. Events offer deadlines, shared participation, and reasons to plan trips in advance. The FIFA World Cup brings global visibility and international visitors. Am', 'Sporting And Cultural Events Boost Travel Intentions For 2026 Photo Credit: Deposit Photos Thirty-four percent of American travelers say they are likely to take an overnight trip to attend a sporting event in 2026. Twenty percent plan to attend a FIFA World Cup match, and 52% intend to travel overnight for cultural events such as concerts and festivals. Meanwhile, 47% are interested in touring Route 66 during its 100th anniversary year. These figures highlight a shift for the coming year where travel decisions are increasingly driven by events rather than relaxation. In 2026, Americans are choosing what to attend, not just where to go. The latest Longwoods International study shows that milestone celebrations and global competitions are now major motivators for travel. The calendar is driving demand. “Special events such as the FIFA World Cup, America 250 and the 100th anniversary of Route 66 will all motivate U.S. travel this year,” said Amir Eylon, President and CEO of Longwoods International. The industry has emphasized experience-based travel, but 2026 denotes a more specific trend. Events offer deadlines, shared participation, and reasons to plan trips in advance. The FIFA World Cup brings global visibility and international visitors. Am']"
6,16,6_museum_egypt_egyptian_world largest,"['museum', 'egypt', 'egyptian', 'world largest', 'tourism', 'civilization', 'architecture', 'tourism industry', 'ancient', 'opening ceremony']","[""Egypt unveils the world's largest museum dedicated to a single civilization CAIRO (AP) — Egypt is inaugurating on Saturday the Grand Egyptian Museum, two decades in the making, with the aim of drawing more visitors to revitalize the country's tourist industry. Located just outside Cairo on the Giza Plateau which also includes the three pyramids and the Sphinx, the museum will be the world’s largest dedicated to a single civilization. It will display over 50,000 artifacts detailing life in ancient Egypt. World leaders, including monarchs, heads of states and governments, are set to attend the grand opening ceremony, according to the Egyptian presidency which touted the museum as “an exceptional event in the history of human culture and civilization.” The museum is one of the megaprojects championed by President Abdel-Fattah el-Sissi since he took office in 2014. He has embarked on massive investments in infrastructure with the aim of reviving an economy weakened by decades of stagnation and battered by the unrest that followed the 2011 Arab Spring uprising. Preparations for the grand reveal have been shrouded in secrecy. The museum, which was opened for limited visits in recent years, has been closed for the past two weeks. The government has revamped the a"", ""Egypt unveils the world's largest museum dedicated to a single civilization CAIRO (AP) — Egypt is inaugurating on Saturday the Grand Egyptian Museum, two decades in the making, with the aim of drawing more visitors to revitalize the country's tourist industry. Located just outside Cairo on the Giza Plateau which also includes the three pyramids and the Sphinx, the museum will be the world’s largest dedicated to a single civilization. It will display over 50,000 artifacts detailing life in ancient Egypt. World leaders, including monarchs, heads of states and governments, are set to attend the grand opening ceremony, according to the Egyptian presidency which touted the museum as “an exceptional event in the history of human culture and civilization.” The museum is one of the megaprojects championed by President Abdel-Fattah el-Sissi since he took office in 2014. He has embarked on massive investments in infrastructure with the aim of reviving an economy weakened by decades of stagnation and battered by the unrest that followed the 2011 Arab Spring uprising. Preparations for the grand reveal have been shrouded in secrecy. The museum, which was opened for limited visits in recent years, has been closed for the past two weeks. The government has revamped the a"", ""Egypt unveils the world's largest museum dedicated to a single civilization Egypt is inaugurating on Saturday the Grand Egyptian Museum, two decades in the making, with the aim of drawing more visitors to revitalize the country's tourist industry. Located just outside Cairo on the Giza Plateau which also includes the three pyramids and the Sphinx, the museum will be the world’s largest dedicated to a single civilization. It will display over 50,000 artifacts detailing life in ancient Egypt. World leaders, including monarchs, heads of states and governments, are set to attend the grand opening ceremony, according to the Egyptian presidency which touted the museum as “an exceptional event in the history of human culture and civilization.” The museum is one of the megaprojects championed by President Abdel-Fattah el-Sissi since he took office in 2014. He has embarked on massive investments in infrastructure with the aim of reviving an economy weakened by decades of stagnation and battered by the unrest that followed the 2011 Arab Spring uprising. Preparations for the grand reveal have been shrouded in secrecy. The museum, which was opened for limited visits in recent years, has been closed for the past two weeks. The government has revamped the areas around t""]"
7,16,7_grammy_song_taylor swift_singer,"['grammy', 'song', 'taylor swift', 'singer', 'onstage', 'super bowl', 'billboard', 'bad', 'debuted', 'taylor']","['JD Vance slammed after Kid Rock\'s \'repulsive\' song about underage girls resurfaces Vice President JD Vance has come under fire for showing support for singer Kid Rock as his sickening lyrics about ""underage"" girls resurfaced. The country star is headlining Turning Point USA’s conservative Super Bowl LX halftime show, which was put together as a protest against the official NFL show featuring Bad Bunny as the headliner on February 8. The even has of course had Vance plugging it as it was designed to appeal to the MAGA audience who did not feel comfortable with Bad Bunny performing in Spanish. Sharing a post about the alternative show on X Vance wrote, ""Fantastic lineup for the TPUSA halftime show, including the great Bob Ritchie AKA KID ROCK."" Viewers of the post were less than impressed by the vice president endorsing Kid Rock, especially in light of his 1997 song Daddy Cool resurfacing with some controversial lyrics. Set The Express as a \'Preferred Source\' to get quicker access to the news you value. Democratic Rep. Shri Thanedar pointed out the lyrics as he wrote, “This is who the Vice President is promoting. No surprise here, sounds like the kind of guy he’d normally be sucking up to.” The song in question includes the wording, “Young ladies, young ladies, I l', ""Lorraine Ali: Bad Bunny is American; Coldplay is not. The right is selectively freaking out over the Super Bowl Chris Martin, center, and Coldplay perform during halftime of Super Bowl 50, along with BeyoncÃ©, left, and Bruno Mars, at Levi's Stadium on Feb. 7, 2016, in Santa Clara, California. (Ezra Shaw/Getty Images/TNS) President Donald Trump told the New York Post that music artist Bad Bunny was a “terrible choice” to headline the 2026 Super Bowl halftime show and that the NFL’s selection of the Puerto Rican singer and rapper sows “hatred.” Department of Homeland Security adviser Corey Lewandowski suggested that Bad Bunny loathes the U.S. “It’s so shameful that they’ve decided to pick somebody who just seems to hate America so much to represent them at the halftime game,” he told conservative podcaster Benny Johnson. Sen. Tommy Tuberville, R-Ala., said on Monday that Bad Bunny disseminates “anti-American propaganda.” The upshot: Bad Bunny (aka Benito Antonio Martínez Ocasio) is an enemy of the state. An outsider who doesn’t possess American values. A Super Bowl wrecker. Heated debate around who is worthy to perform the halftime show is an American tradition (Prince, yes. The Red Hot Chili Peppers, no). But now, unsurprisingly, politics are part of that debate, so the mere fact that Bad Bu"", 'Dairy Queen brings Taylor and Swift to the Super Bowl 2026 with this promotion With the arrival of Super Bowl LX, more and more brands are joining the celebration of this sporting event with advertising campaigns and attractive offers for their customers. One of them is Dairy Queen, which has decided to “bring” Taylor and Swift to the halftime show… no, not the pop star, but two football players who come together in a new promotion from the franchise. Here’s what it’s all about. ALSO READ Dairy Queen launches new Swicy menu: what’s included When preparations for Super Bowl LX began to be announced, there was a lot of speculation about Taylor Swift’s participation in the halftime show; however, the famous singer will not be taking the main stage at this event. Dairy Queen decided to take advantage of that buzz with a clever campaign, bringing together football players Tyrod Taylor and D’Andre Swift, whose last names form the name of the pop star. ALSO READ Paris Baguette Launches Menu and Special Deals for Football Season and the Super Bowl: What’s Included The players are promoting the brand’s new Chicken Strip Party Platters, which you can get for free through a simple promotion: tag your game-day buddy and you’ll have the chance to win one of 60 Chicken Str']"
8,14,8_welfare_disability_rising costs_social security,"['welfare', 'disability', 'rising costs', 'social security', 'premiums', 'taxpayers', 'pip', 'benefit', 'jobs', 'income']","['How much will DWP benefits and pensions rise following the budget? Benefits Budget 2025 Child Benefit Department for Work and Pensions DWP Pensions PIP Rachel Reeves Universal Credit National government Personal Finance DWP benefits including Universal Credit, Child Benefit, PIP, Carer\'s Allowance, and the State Pension are to increase in April 2026 after Rachel Reeves announced higher payments in her budget speech today. Anyone who claims DWP benefits should be in line for an increase in the next financial year, as the chancellor laid out plans to help pensioners, disabled people, parents, low earners, carers and unemployed people keep up with rising costs. Addressing MPs, Ms Reeves said: ""The broken welfare system that we inherited wrote off millions of people as too sick to work and we will reform that system so that it is a system that does not count the cost of failure, but one that protects people who cannot work and empowers those who can. ""We have brought back face-to-face assessments for disability benefits. Those are the face-to-face assessments that the shadow chancellor (Sir Mel Stride) got rid of when he was work and pensions secretary and our changes we have made to Universal Credit will get 15,000 people back into work, a figure con', 'How much will DWP benefits and pensions rise following the budget? Benefits Budget 2025 Child Benefit Department for Work and Pensions DWP Pensions PIP Rachel Reeves Universal Credit National government Personal Finance DWP benefits including Universal Credit, Child Benefit, PIP, Carer\'s Allowance, and the State Pension are to increase in April 2026 after Rachel Reeves announced higher payments in her budget speech today. Anyone who claims DWP benefits should be in line for an increase in the next financial year, as the chancellor laid out plans to help pensioners, disabled people, parents, low earners, carers and unemployed people keep up with rising costs. Addressing MPs, Ms Reeves said: ""The broken welfare system that we inherited wrote off millions of people as too sick to work and we will reform that system so that it is a system that does not count the cost of failure, but one that protects people who cannot work and empowers those who can. ""We have brought back face-to-face assessments for disability benefits. Those are the face-to-face assessments that the shadow chancellor (Sir Mel Stride) got rid of when he was work and pensions secretary and our changes we have made to Universal Credit will get 15,000 people back into work, a figure con', 'How much will DWP benefits and pensions rise following the budget? Benefits Budget 2025 Child Benefit Department for Work and Pensions DWP Pensions PIP Rachel Reeves Universal Credit National government Personal Finance DWP benefits including Universal Credit, Child Benefit, PIP, Carer\'s Allowance, and the State Pension are to increase in April 2026 after Rachel Reeves announced higher payments in her budget speech today. Anyone who claims DWP benefits should be in line for an increase in the next financial year, as the chancellor laid out plans to help pensioners, disabled people, parents, low earners, carers and unemployed people keep up with rising costs. Addressing MPs, Ms Reeves said: ""The broken welfare system that we inherited wrote off millions of people as too sick to work and we will reform that system so that it is a system that does not count the cost of failure, but one that protects people who cannot work and empowers those who can. ""We have brought back face-to-face assessments for disability benefits. Those are the face-to-face assessments that the shadow chancellor (Sir Mel Stride) got rid of when he was work and pensions secretary and our changes we have made to Universal Credit will get 15,000 people back into work, a figure con']"
9,13,9_casino_betting_gaming_games,"['casino', 'betting', 'gaming', 'games', 'platforms', 'slots', 'servers', 'global', 'nhl', 'interactive']","[""New Online Casinos 2025: Lucky Creek Ranked High For New U.S. Players New players gain fast access to bonuses, smooth payouts, and a broad gaming lineup Lucky Creek offers strong bonuses, steady payouts, and a wide range of games for new players A leading 2025 option for U.S. beginners seeking secure payouts and a large game selection Lucky Creek delivers fast rewards, clear navigation, and a wide mix of games for first-time players Las Vegas, Nov. 15, 2025 (GLOBE NEWSWIRE) -- CasinoTop10 has ranked Lucky Creek Casino as the best online gaming casino for new players, offering them a premium experience from the outset. The casino has solidified its position as the best for beginners, as they kick-start their online gaming journeys through its fast payouts, extensive gaming collection, and 24/7 customer support. Lucky Creek prioritizes player satisfaction at every step, whether you're topping up your account or cashing out after a productive gaming session. New players are greeted with a generous 200% match bonus of up to $7,000, plus 200 free spins over 5 days as a welcome bonus to explore the platform and wager on their favorite games without stretching their budget. The magic does not end there. Lucky Creek continues to celebrate players as they con"", 'AGS Interactive Expands Its UK Presence with bet365 Partnership LAS VEGAS, Dec. 05, 2025 (GLOBE NEWSWIRE) -- AGS Interactive (AGSi) has solidified its presence across the pond, taking a selection of its best-performing games live in the UK with bet365. This announcement further cements AGS\' partnership with bet365 building on existing collaborations in the United States, Canada, and Latin America. bet365\'s established UK market position and diverse global presence make them a logical strategic partner to support AGS\' global growth initiatives throughout Europe and beyond. At the time of launch, bet365 players across the UK will have access to more than 20 popular game titles from AGS\' interactive content library. Notable titles include: ""We\'ve worked closely with bet365 for years and extending our partnership to the UK is an important milestone for AGS,"" said Zoe Ebling, Vice President of Interactive at AGS. ""It not only reflects the strength of our relationship, but the growing global appeal and potential of our increasingly diverse portfolio of high-performing online slot content. This is a clear sign of where AGS is headed — broader reach, more markets, and a rapidly expanding international footprint."" ""We\'re delighted to welcome a selection', ""AGS Interactive Expands Its UK Presence with bet365 Partnership LAS VEGAS, Dec. 05, 2025 (GLOBE NEWSWIRE) -- AGS Interactive (AGSi) has solidified its presence across the pond, taking a selection of its best-performing games live in the UK with bet365. This announcement further cements AGS’ partnership with bet365 building on existing collaborations in the United States, Canada, and Latin America. bet365’s established UK market position and diverse global presence make them a logical strategic partner to support AGS’ global growth initiatives throughout Europe and beyond. At the time of launch, bet365 players across the UK will have access to more than 20 popular game titles from AGS' interactive content library. Notable titles include: “We’ve worked closely with bet365 for years and extending our partnership to the UK is an important milestone for AGS,” said Zoe Ebling, Vice President of Interactive at AGS. “It not only reflects the strength of our relationship, but the growing global appeal and potential of our increasingly diverse portfolio of high-performing online slot content. This is a clear sign of where AGS is headed — broader reach, more markets, and a rapidly expanding international footprint.” “We’re delighted to welcome a selection""]"
10,12,10_new season_episodes_release date_hbo,"['new season', 'episodes', 'release date', 'hbo', 'season', 'emmy', 'emily', 'looking forward', 'ariana', 'horror']","['Evan Peters gives update on ‘American Horror Story\' with Ariana Grande “Wicked: For Good” is now available to watch at home, thanks to a digital release that also includes exclusive behind-the-scenes content – including bringing the incredible costumes to life. Originally appeared on E! Online. Evan Peters is getting into position for Ariana Grande to join ""American Horror Story."" Stream San Diego News for free, 24/7, wherever you are with NBC 7. Following the Halloween 2025 announcement that the ""Wicked: For Good"" actress will star alongside the Emmy winner in season 13 of the anthology series, he detailed the benefit of having Grande join the Ryan Murphy show. “What doesn\'t she bring to the cast?” Peters, who with Grande in her “we can’t be friends” music video, told E! News’ Will Marfuggi in an exclusive interview. “She\'s an incredible performer and actress, and I think that\'s gonna be awesome to have her on board.” And the ""Monster: The Jeffrey Dahmer Story"" actor is looking forward to what the future has in store with Grande — who previously starred in Murphy\'s 2015 show ""Scream Queens"" — and the rest of the cast, including AHS alums Jessica Lange, Kathy Bates and Emma Roberts. He’s particularly eager to see how Murphy utilizes all of Grande’s di', 'Evan Peters gives update on ‘American Horror Story\' with Ariana Grande “Wicked: For Good” is now available to watch at home, thanks to a digital release that also includes exclusive behind-the-scenes content – including bringing the incredible costumes to life. Originally appeared on E! Online. Evan Peters is getting into position for Ariana Grande to join ""American Horror Story."" Watch NBC Bay Area News free wherever you are Following the Halloween 2025 announcement that the ""Wicked: For Good"" actress will star alongside the Emmy winner in season 13 of the anthology series, he detailed the benefit of having Grande join the Ryan Murphy show. “What doesn\'t she bring to the cast?” Peters, who with Grande in her “we can’t be friends” music video, told E! News’ Will Marfuggi in an exclusive interview. “She\'s an incredible performer and actress, and I think that\'s gonna be awesome to have her on board.” And the ""Monster: The Jeffrey Dahmer Story"" actor is looking forward to what the future has in store with Grande — who previously starred in Murphy\'s 2015 show ""Scream Queens"" — and the rest of the cast, including AHS alums Jessica Lange, Kathy Bates and Emma Roberts. He’s particularly eager to see how Murphy utilizes all of Grande’s different talents for t', 'Is There a The Morning Show Season 4 Episode 11 Release Date & Time? Viewers are wondering if there’s a The Morning Show Season 4 Episode 11 release date and time. The popular drama series has recently released its 10th episode, leaving fans eager to know whether the season is over. Here’s all you need to know. There isn’t a The Morning Show Season 4 Episode 11 release date and time. This is because the season has ended with just 10 episodes, according to the show’s official schedule. The Morning Show is a drama series that delves into the inner workings of a high-profile network broadcast morning news program. The series features a stellar cast that includes Jennifer Aniston, Reese Witherspoon, and Billy Crudup, among others. Yes, The Morning Show Season 4 has finished. The fourth season of the show released its 10th and final episode, titled “Knowing Violation,” recently. There won’t be an additional episode in the coming weeks. However, fans need not worry as it will come back with a new season. In September 2025, Apple TV+ announced that The Morning Show had been renewed for Season 5. But a release window has yet to be confirmed. You can watch The Morning Show Season 4 via Apple TV+. Apple TV+ is one of the most popular streaming services in the']"
