Topic,Count,Name,Representation,Representative_Docs
5,41,5_family_friendship_husband_divorced,"['family', 'friendship', 'husband', 'divorced', 'friendships', 'divorce', 'niece', 'mom', 'father', 'friends']","['Dear Abby: I left my son a message about a family emergency. He replied with a photo from Disneyland DEAR ABBY: My sister recently became very ill and had to be hospitalized for four days. When I called and told our daughter, she was concerned and supportive. Then, I called our son, “Isaac,” and left a message to please call me because it was important. He did not return my call. A couple days later, my husband left another message for Isaac to call. He finally sent us a picture of himself and his family at Disneyland in California. He was on vacation with his wife and two kids and didn’t want to be bothered. After he got back, he waited a few days to call me. I am hurt and disappointed in Isaac. We live in Texas, and they go to Disneyland three or four times a year. I think Isaac should have taken five minutes to return my call so I could fill him in about the situation with his aunt. Because of this, I no longer feel as close to my son. In fact, I feel I’m very unimportant to him. Am I wrong to be sad and disappointed? Is it common for close relatives not to respond when they are on vacation? My sister is now recovering, but her illness has taken a huge toll on her. -- DISILLUSIONED IN TEXAS DEAR DISILLUSIONED: What a rude awakening you had. That you are hurt and disappointed is', 'Asking Eric: Can mom work through tension in son’s relationship with dad so they can celebrate special birthday? Dear Eric: My son is turning 40 on December 22. My husband and I are at a quandary as to how to celebrate him. There have been issues between my husband and him over things from his childhood. We did a special trip for his older brother when he turned 40 and would like to do something special for this son’s 40th as well. Our daughter-in-law has made special plans for him and we are not included. I understand that, but I need some ideas as to how to celebrate this extra special year without rocking the boat. I love my son with all my heart, as I do all my children, and want his 40th birthday to be memorable in a positive way. Any suggestions? – Mom Who Wants to Celebrate Dear Mom: The issues your son and your husband are having may be an obstacle, but they aren’t insurmountable. And the thing that can get them on the path to resolution is the same thing that can get you answers about how to celebrate your son: open communication. It’s not within your purview to try to fix things between them, but you have your own relationship with your son and so I’d encourage you to reach out and tell him what you told me: you want to celebrate him, you know things are difficult, and you’re lookin', 'Asking Eric: After 6 years sober, man is frustrated by his family’s hold on their hurt and distrust Dear Eric: I’ve just turned 40 this past year. The last 15 years I was in a horrible drug addiction. I lied and hurt and did terrible things to a lot of people, especially my family. About eight years ago they officially disowned me. Understandable. I’ve cleaned up and got my act together six years ago. At first, I tried to force my way back into their lives, which all refuted. I lashed out, said horrible things and stopped trying to be in their lives. My mom will stop by on my birthday for 10 minutes or so and drop a card off at Christmas. As for my two older brothers and my father, it’s radio silence. I guess what I’m asking is, what do I do to fix this and fast, as I said I’ve turned 40 this year, my parents are both 70. Time is running out, and I couldn’t imagine living my life without some kind of acceptance from my father. Or knowing he did or does love me. My heart breaks at the thought, but this is a real pickle. How can I fix a problem when the ones I need to fix it with won’t talk to me? Do I just keep ignoring their existence and put on this façade that I don’t care to my wife and 4-year-old son? What picture am I painting to my son, as he’s been guilty by association yo']"
6,33,6_covers_fabric_lace_bed,"['covers', 'fabric', 'lace', 'bed', 'garment', 'luxurious', 'cotton', 'lamp', 'price', 'colours']","[""'Luxury' quilted bedspread reduced from £65 'makes my bedroom look expensive' The bedspread has been reduced in price(Image: Dusk ) Finding the perfect finishing touch for the bedroom can be challenging, but sometimes a bedspread is all that's needed to add style and additional warmth. Over at Dusk, there is one bedspread which has been reduced in price and it comes in two colours. The Rome Velvet Greek Matelasse Bedspread is currently available from Dusk for £52, reduced from £65, saving shoppers £13. It also comes in the colour deep pink, but this is for the full price of £65. Dusk says the Rome Velvet Greek Matelasse Bedspread has been designed to add a 'luxurious and inviting finish' to the bedroom, and it features a Greek-inspired matelassé pattern. The velvet-feel fabric creates a 'soft touch', while the intricate quilting enhances its aesthetic, the site says. Shoppers have left rave reviews online The Rome Velvet Greek Matelasse Bedspread, which measures 2.5m x 2.6m, can be styled alone or layered with matching cushion covers. Plus, it is easy to care for, as it can be machine washed at 30 degrees and tumble dried on a low setting - but it is worth noting that it should not be ironed. As an alternative, Dunelm is selling this Helston Quilted Bedsprea"", ""Dusk's white lace-trim spring duvet cover 'looks gorgeous on' and is reduced This elegant lace-trim duvet from Dusk is perfect for spring (Image: Dusk) March signals the arrival of spring and, gradually, the days are growing longer and brighter. Households anticipating the arrival of milder weather can usher spring indoors through fresh décor choices. A straightforward method to revitalise a bedroom is to update the bedding, which breathes new life into the space. Dusk remains a favourite destination for those seeking to refresh their homeware and the retailer frequently runs promotions and special offers. Currently, the brand is offering 15% off this Alice Duvet Cover when customers apply the code EXTRA15 during checkout. Typically retailing between £55 and £65, the promotional code reduces the cost to between £46.75 and £55.25. The Alice Duvet Cover comes in double, king and super king sizes and boasts a 200 thread count. It's worth noting that pillowcases aren't included and must be purchased separately, starting from £15 for one, for example. Dusk's Alice Duvet Cover is white and features an intricate lace, scalloped trim for a period aesthetic. The retailer describes the cover as 'soft, breathable, and effortlessly stylish', reports the Daily Record. T"", ""Dusk's white lace-trim spring duvet cover 'looks gorgeous on' and is reduced The Alice Duvet Cover can be easily styled with lots of different themes and hues(Image: Dusk) March signals the arrival of spring and, gradually, the days are growing longer and brighter. Households anticipating the arrival of milder weather can help usher spring indoors with fresh décor choices. A straightforward method to revitalise a bedroom is to update the bedding which breathes new life into the space. Dusk remains a favourite destination for those seeking to refresh their homeware and the retailer frequently runs promotions and special offers. Currently, the brand is offering 15% off this Alice Duvet Cover when customers apply the code EXTRA15 during checkout. Typically retailing between £55 and £65, the promotional code reduces the cost to between £46.75 and £55.25. The Alice Duvet Cover comes in double, king and super king sizes and boasts a 200 thread count. It's worth noting that pillowcases aren't included and must be purchased separately, starting from £15 for one, for example. Dusk's Alice Duvet Cover is white and features an intricate lace, scalloped trim for a period aesthetic. The retailer describes the cover as 'soft, breathable, and effortlessly stylish', report""]"
7,31,7_onstage_grammy_singer_prince,"['onstage', 'grammy', 'singer', 'prince', 'song', 'taylor swift', 'debut', 'band', 'red carpet', 'pink']","[""Lorraine Ali: Bad Bunny is American; Coldplay is not. The right is selectively freaking out over the Super Bowl Chris Martin, center, and Coldplay perform during halftime of Super Bowl 50, along with BeyoncÃ©, left, and Bruno Mars, at Levi's Stadium on Feb. 7, 2016, in Santa Clara, California. (Ezra Shaw/Getty Images/TNS) President Donald Trump told the New York Post that music artist Bad Bunny was a “terrible choice” to headline the 2026 Super Bowl halftime show and that the NFL’s selection of the Puerto Rican singer and rapper sows “hatred.” Department of Homeland Security adviser Corey Lewandowski suggested that Bad Bunny loathes the U.S. “It’s so shameful that they’ve decided to pick somebody who just seems to hate America so much to represent them at the halftime game,” he told conservative podcaster Benny Johnson. Sen. Tommy Tuberville, R-Ala., said on Monday that Bad Bunny disseminates “anti-American propaganda.” The upshot: Bad Bunny (aka Benito Antonio Martínez Ocasio) is an enemy of the state. An outsider who doesn’t possess American values. A Super Bowl wrecker. Heated debate around who is worthy to perform the halftime show is an American tradition (Prince, yes. The Red Hot Chili Peppers, no). But now, unsurprisingly, politics are part of that debate, so the mere fact that Bad Bu"", ""THE THINK PINK GALA DEBUTS MARCH 14TH 2026 AT THE PLAZA WITH BERNADETTE PETERS AND A MICHELIN-STARRED CULINARY EXPERIENCE A landmark night of glamour, generosity, and world-class artistry in support of breast cancer patients, survivors, and families NEW YORK, Jan. 12, 2026 /PRNewswire/ -- The Think Pink Gala will debut on Saturday, March 14th, 2026, at the iconic Plaza Hotel, marking a premier cultural milestone in the New York philanthropic season. This inaugural evening unites world-class artistry with culinary excellence to mark United Breast Cancer Foundation's landmark 25th anniversary of life-changing support. The evening features Broadway legend and three-time Tony Award winner Bernadette Peters, two-time Tony Award winner Christine Ebersole, whose legendary career continues to define the height of American musical theater and screen, and Melissa Errico, celebrated as one of the most iconic leading ladies of musical theater. The program highlights the work of Emmy and Grammy nominated conductor, composer, and musical director Judith Clurman, who leads Judith Clurman's Essential Voices USA, an acclaimed, award-winning choral ensemble and one of New York's preeminent vocal groups. The stage also features Simone Dinnerstein, a Diapason d'Or winner with fifteen number-one Billboard Classical albums"", ""THE THINK PINK GALA DEBUTS MARCH 14TH 2026 AT THE PLAZA WITH BERNADETTE PETERS AND A MICHELIN-STARRED CULINARY EXPERIENCE A landmark night of glamour, generosity, and world-class artistry in support of breast cancer patients, survivors, and families NEW YORK, Jan. 12, 2026 /PRNewswire/ -- The Think Pink Gala will debut on Saturday, March 14th, 2026, at the iconic Plaza Hotel, marking a premier cultural milestone in the New York philanthropic season. This inaugural evening unites world-class artistry with culinary excellence to mark United Breast Cancer Foundation's landmark 25th anniversary of life-changing support. The evening features Broadway legend and three-time Tony Award winner Bernadette Peters, two-time Tony Award winner Christine Ebersole, whose legendary career continues to define the height of American musical theater and screen, and Melissa Errico, celebrated as one of the most iconic leading ladies of musical theater. The program highlights the work of Emmy and Grammy nominated conductor, composer, and musical director Judith Clurman, who leads Judith Clurman's Essential Voices USA, an acclaimed, award-winning choral ensemble and one of New York's preeminent vocal groups. The stage also features Simone Dinnerstein, a Diapason d'Or winner with fifteen number-one Billboard Classical albums""]"
8,25,8_museum_egypt_heritage_world largest,"['museum', 'egypt', 'heritage', 'world largest', 'doha', 'tourism', 'architecture', 'tourism industry', 'arab', 'morocco']","[""Egypt unveils the world's largest museum dedicated to a single civilization CAIRO (AP) — Egypt is inaugurating on Saturday the Grand Egyptian Museum, two decades in the making, with the aim of drawing more visitors to revitalize the country's tourist industry. Located just outside Cairo on the Giza Plateau which also includes the three pyramids and the Sphinx, the museum will be the world’s largest dedicated to a single civilization. It will display over 50,000 artifacts detailing life in ancient Egypt. World leaders, including monarchs, heads of states and governments, are set to attend the grand opening ceremony, according to the Egyptian presidency which touted the museum as “an exceptional event in the history of human culture and civilization.” The museum is one of the megaprojects championed by President Abdel-Fattah el-Sissi since he took office in 2014. He has embarked on massive investments in infrastructure with the aim of reviving an economy weakened by decades of stagnation and battered by the unrest that followed the 2011 Arab Spring uprising. Preparations for the grand reveal have been shrouded in secrecy. The museum, which was opened for limited visits in recent years, has been closed for the past two weeks. The government has revamped the a"", ""Egypt unveils the world's largest museum dedicated to a single civilization CAIRO (AP) — Egypt is inaugurating on Saturday the Grand Egyptian Museum, two decades in the making, with the aim of drawing more visitors to revitalize the country's tourist industry. Located just outside Cairo on the Giza Plateau which also includes the three pyramids and the Sphinx, the museum will be the world’s largest dedicated to a single civilization. It will display over 50,000 artifacts detailing life in ancient Egypt. World leaders, including monarchs, heads of states and governments, are set to attend the grand opening ceremony, according to the Egyptian presidency which touted the museum as “an exceptional event in the history of human culture and civilization.” The museum is one of the megaprojects championed by President Abdel-Fattah el-Sissi since he took office in 2014. He has embarked on massive investments in infrastructure with the aim of reviving an economy weakened by decades of stagnation and battered by the unrest that followed the 2011 Arab Spring uprising. Preparations for the grand reveal have been shrouded in secrecy. The museum, which was opened for limited visits in recent years, has been closed for the past two weeks. The government has revamped the a"", ""Egypt unveils the world's largest museum dedicated to a single civilization Egypt is inaugurating on Saturday the Grand Egyptian Museum, two decades in the making, with the aim of drawing more visitors to revitalize the country's tourist industry. Located just outside Cairo on the Giza Plateau which also includes the three pyramids and the Sphinx, the museum will be the world’s largest dedicated to a single civilization. It will display over 50,000 artifacts detailing life in ancient Egypt. World leaders, including monarchs, heads of states and governments, are set to attend the grand opening ceremony, according to the Egyptian presidency which touted the museum as “an exceptional event in the history of human culture and civilization.” The museum is one of the megaprojects championed by President Abdel-Fattah el-Sissi since he took office in 2014. He has embarked on massive investments in infrastructure with the aim of reviving an economy weakened by decades of stagnation and battered by the unrest that followed the 2011 Arab Spring uprising. Preparations for the grand reveal have been shrouded in secrecy. The museum, which was opened for limited visits in recent years, has been closed for the past two weeks. The government has revamped the areas around t""]"
9,16,9_immigration_britain_british_immigrants,"['immigration', 'britain', 'british', 'immigrants', 'diversity', 'society', 'scotland', 'respondents', 'liberal', 'nigel']","['‘UK public have tougher stance on immigration and diversity than people in US’ People in the UK are less likely than their US counterparts to feel diversity strengthens society and more likely to have tougher attitudes on immigration, according to research. The findings are said to show that a common narrative about Britain being more socially liberal than America does not ring true across all issues. The National Centre for Social Research also found Reform UK voters in Britain were more likely than supporters of President Donald Trump in the US to say immigrants living in their country without permission should not be allowed to stay. While seven in 10 supporters of Mr Trump felt this way, the figure was almost eight in 10 (79%) among Reform followers. The researchers said they wanted to “better understand how public attitudes in the UK compare with those in the US, and the extent of polarisation in the two countries”. Their survey found 42% of people in the UK think there should be legal efforts to deport immigrants living here without permission, compared with just a third (33%) in the US. While almost two-thirds (64%) of respondents in the US felt diversity strengthens society, only around half (49%) of the UK public agreed. Proportions were similar when', '‘UK public have tougher stance on immigration and diversity than people in US’ People in the UK are less likely than their US counterparts to feel diversity strengthens society and more likely to have tougher attitudes on immigration, according to research. The findings are said to show that a common narrative about Britain being more socially liberal than America does not ring true across all issues. The National Centre for Social Research also found Reform UK voters in Britain were more likely than supporters of President Donald Trump in the US to say immigrants living in their country without permission should not be allowed to stay. While seven in 10 supporters of Mr Trump felt this way, the figure was almost eight in 10 (79%) among Reform followers. The researchers said they wanted to “better understand how public attitudes in the UK compare with those in the US, and the extent of polarisation in the two countries”. Their survey found 42% of people in the UK think there should be legal efforts to deport immigrants living here without permission, compared with just a third (33%) in the US. While almost two-thirds (64%) of respondents in the US felt diversity strengthens society, only around half (49%) of the UK public agreed. Proportions were similar when', '‘UK public have tougher stance on immigration and diversity than people in US’ People in the UK are less likely than their US counterparts to feel diversity strengthens society and more likely to have tougher attitudes on immigration, according to research. The findings are said to show that a common narrative about Britain being more socially liberal than America does not ring true across all issues. The National Centre for Social Research also found Reform UK voters in Britain were more likely than supporters of President Donald Trump in the US to say immigrants living in their country without permission should not be allowed to stay. While seven in 10 supporters of Mr Trump felt this way, the figure was almost eight in 10 (79%) among Reform followers. The researchers said they wanted to “better understand how public attitudes in the UK compare with those in the US, and the extent of polarisation in the two countries”. Their survey found 42% of people in the UK think there should be legal efforts to deport immigrants living here without permission, compared with just a third (33%) in the US. While almost two-thirds (64%) of respondents in the US felt diversity strengthens society, only around half (49%) of the UK public agreed. Proportions were similar when']"
10,16,10_freezing rain_winter weather_flooding_snow,"['freezing rain', 'winter weather', 'flooding', 'snow', 'spring', 'ontario', 'weather', 'sleet', 'rain', 'forecast']","['Spring thaw brings flood risks to Ontario waterways: Here is what you need to know Ontario conservation authorities are keeping an eye on the risk of flooding as mild temperatures melt snow this week. With a spring thaw expected this week, Ontario conservation authorities are keeping watch for possible flood risks in rivers and streams. But no warnings have been issued just yet, said Toronto and Region Conservation Authority (TRCA) spokesperson Afiya Jilani. There are 36 conservation authorities across Ontario, and most do not have any flood alerts issued as of Tuesday, March 3. According to Environment and Climate Change Canada, temperatures across Ontario will be above freezing from Wednesday, March 4 through the weekend, which will result in snow melting around the clock. And there is also a chance of rain or freezing rain to fall as some storm activity passes across the province later this week. Meteorologists predicted this stretch of warm temperatures at the end of February, and Ontario conservation authorities have been keeping watch. “Based on forecasts for later this week, river flows are expected to increase due to above zero degree temperatures and anticipated rainfall, but it remains too early to determine if this will result in a severe river floodin', 'Spring thaw brings flood risks to Ontario waterways: Here is what you need to know Ontario conservation authorities are keeping an eye on the risk of flooding as mild temperatures melt snow this week. With a spring thaw expected this week, Ontario conservation authorities are keeping watch for possible flood risks in rivers and streams. But no warnings have been issued just yet, said Toronto and Region Conservation Authority (TRCA) spokesperson Afiya Jilani. There are 36 conservation authorities across Ontario, and most do not have any flood alerts issued as of Tuesday, March 3. According to Environment and Climate Change Canada, temperatures across Ontario will be above freezing from Wednesday, March 4 through the weekend, which will result in snow melting around the clock. And there is also a chance of rain or freezing rain to fall as some storm activity passes across the province later this week. Meteorologists predicted this stretch of warm temperatures at the end of February, and Ontario conservation authorities have been keeping watch. “Based on forecasts for later this week, river flows are expected to increase due to above zero degree temperatures and anticipated rainfall, but it remains too early to determine if this will result in a severe river floodin', 'Spring thaw brings flood risks to Ontario waterways: Here is what you need to know Ontario conservation authorities are keeping an eye on the risk of flooding as mild temperatures melt snow this week. With a spring thaw expected this week, Ontario conservation authorities are keeping watch for possible flood risks in rivers and streams. But no warnings have been issued just yet, said Toronto and Region Conservation Authority (TRCA) spokesperson Afiya Jilani. There are 36 conservation authorities across Ontario, and most do not have any flood alerts issued as of Tuesday, March 3. According to Environment and Climate Change Canada, temperatures across Ontario will be above freezing from Wednesday, March 4 through the weekend, which will result in snow melting around the clock. And there is also a chance of rain or freezing rain to fall as some storm activity passes across the province later this week. Meteorologists predicted this stretch of warm temperatures at the end of February, and Ontario conservation authorities have been keeping watch. “Based on forecasts for later this week, river flows are expected to increase due to above zero degree temperatures and anticipated rainfall, but it remains too early to determine if this will result in a severe river floodin']"
