Topic,Count,Name,Representation,Representative_Docs
41,13,41_strike_union_labor_protest,"['strike', 'union', 'labor', 'protest', 'union president', 'agreements', 'wages', 'employees', 'benefits', 'vancouver']","['B.C. Nurses Union says bargaining at an impasse, strike vote likely Published 1:39 pm Wednesday, April 22, 2026 By Lauren Collins B.C. Nurses Union president Adriane Gear speaks at a protest May 31, 2023 that saw hundreds of nurses in town for a conference march along the streets of Vancouver calling for safer staffing levels. (Lauren Collins/Black Press Media) The B.C. Nurses’ Union says bargaining is at an impasse after “limited movement at the table.” The union now says a strike vote is likely, according to a post on the union’s Facebook on April 21. In a bargaining update email obtained by Black Press Media, the B.C. Nurses Union said that after a call Monday night (April 20) the union’s council unanimously voted to endorse the bargaining committee’s to declare an impasse, step away from the bargaining table and authorize a strike vote.” The union is now urging members to vote “yes” in a strike vote to show their support. A “yes” vote doesn’t mean an immediate strike. The impasse follows a recent ruling from arbitrator Vince Ready regarding massage therapy benefits. “This is a step backwards,” the email reads. “These benefits are not luxuries. They are essential.” The email says that Ready’s decision threatens the benefits that members rely on.', 'B.C. Nurses Union says bargaining at an impasse, strike vote likely Published 1:39 pm Wednesday, April 22, 2026 By Lauren Collins B.C. Nurses Union president Adriane Gear speaks at a protest May 31, 2023 that saw hundreds of nurses in town for a conference march along the streets of Vancouver calling for safer staffing levels. (Lauren Collins/Black Press Media) The B.C. Nurses’ Union says bargaining is at an impasse after “limited movement at the table.” The union now says a strike vote is likely, according to a post on the union’s Facebook on April 21. In a bargaining update email obtained by Black Press Media, the B.C. Nurses Union said that after a call Monday night (April 20) the union’s council unanimously voted to endorse the bargaining committee’s to declare an impasse, step away from the bargaining table and authorize a strike vote.” The union is now urging members to vote “yes” in a strike vote to show their support. A “yes” vote doesn’t mean an immediate strike. The impasse follows a recent ruling from arbitrator Vince Ready regarding massage therapy benefits. “This is a step backwards,” the email reads. “These benefits are not luxuries. They are essential.” The email says that Ready’s decision threatens the benefits that members rely on.', 'B.C. Nurses Union says bargaining at an impasse, strike vote likely Published 1:39 pm Wednesday, April 22, 2026 By Lauren Collins B.C. Nurses Union president Adriane Gear speaks at a protest May 31, 2023 that saw hundreds of nurses in town for a conference march along the streets of Vancouver calling for safer staffing levels. (Lauren Collins/Black Press Media) The B.C. Nurses’ Union says bargaining is at an impasse after “limited movement at the table.” The union now says a strike vote is likely, according to a post on the union’s Facebook on April 21. In a bargaining update email obtained by Black Press Media, the B.C. Nurses Union said that after a call Monday night (April 20) the union’s council unanimously voted to endorse the bargaining committee’s to declare an impasse, step away from the bargaining table and authorize a strike vote.” The union is now urging members to vote “yes” in a strike vote to show their support. A “yes” vote doesn’t mean an immediate strike. The impasse follows a recent ruling from arbitrator Vince Ready regarding massage therapy benefits. “This is a step backwards,” the email reads. “These benefits are not luxuries. They are essential.” The email says that Ready’s decision threatens the benefits that members rely on.']"
42,12,42_new season_fourth season_episodes_emmy,"['new season', 'fourth season', 'episodes', 'emmy', 'nbc', 'idol', 'emily', 'looking forward', 'ariana', 'ariana grande']","['Is There a The Morning Show Season 4 Episode 11 Release Date & Time? Viewers are wondering if there’s a The Morning Show Season 4 Episode 11 release date and time. The popular drama series has recently released its 10th episode, leaving fans eager to know whether the season is over. Here’s all you need to know. There isn’t a The Morning Show Season 4 Episode 11 release date and time. This is because the season has ended with just 10 episodes, according to the show’s official schedule. The Morning Show is a drama series that delves into the inner workings of a high-profile network broadcast morning news program. The series features a stellar cast that includes Jennifer Aniston, Reese Witherspoon, and Billy Crudup, among others. Yes, The Morning Show Season 4 has finished. The fourth season of the show released its 10th and final episode, titled “Knowing Violation,” recently. There won’t be an additional episode in the coming weeks. However, fans need not worry as it will come back with a new season. In September 2025, Apple TV+ announced that The Morning Show had been renewed for Season 5. But a release window has yet to be confirmed. You can watch The Morning Show Season 4 via Apple TV+. Apple TV+ is one of the most popular streaming services in the', 'Evan Peters gives update on ‘American Horror Story\' with Ariana Grande “Wicked: For Good” is now available to watch at home, thanks to a digital release that also includes exclusive behind-the-scenes content – including bringing the incredible costumes to life. Originally appeared on E! Online. Evan Peters is getting into position for Ariana Grande to join ""American Horror Story."" Stream San Diego News for free, 24/7, wherever you are with NBC 7. Following the Halloween 2025 announcement that the ""Wicked: For Good"" actress will star alongside the Emmy winner in season 13 of the anthology series, he detailed the benefit of having Grande join the Ryan Murphy show. “What doesn\'t she bring to the cast?” Peters, who with Grande in her “we can’t be friends” music video, told E! News’ Will Marfuggi in an exclusive interview. “She\'s an incredible performer and actress, and I think that\'s gonna be awesome to have her on board.” And the ""Monster: The Jeffrey Dahmer Story"" actor is looking forward to what the future has in store with Grande — who previously starred in Murphy\'s 2015 show ""Scream Queens"" — and the rest of the cast, including AHS alums Jessica Lange, Kathy Bates and Emma Roberts. He’s particularly eager to see how Murphy utilizes all of Grande’s di', 'Evan Peters gives update on ‘American Horror Story\' with Ariana Grande “Wicked: For Good” is now available to watch at home, thanks to a digital release that also includes exclusive behind-the-scenes content – including bringing the incredible costumes to life. Originally appeared on E! Online. Evan Peters is getting into position for Ariana Grande to join ""American Horror Story."" Watch NBC Bay Area News free wherever you are Following the Halloween 2025 announcement that the ""Wicked: For Good"" actress will star alongside the Emmy winner in season 13 of the anthology series, he detailed the benefit of having Grande join the Ryan Murphy show. “What doesn\'t she bring to the cast?” Peters, who with Grande in her “we can’t be friends” music video, told E! News’ Will Marfuggi in an exclusive interview. “She\'s an incredible performer and actress, and I think that\'s gonna be awesome to have her on board.” And the ""Monster: The Jeffrey Dahmer Story"" actor is looking forward to what the future has in store with Grande — who previously starred in Murphy\'s 2015 show ""Scream Queens"" — and the rest of the cast, including AHS alums Jessica Lange, Kathy Bates and Emma Roberts. He’s particularly eager to see how Murphy utilizes all of Grande’s different talents for t']"
43,11,43_colbert_correspondents dinner_trump publicly_cbs,"['colbert', 'correspondents dinner', 'trump publicly', 'cbs', 'primetime', 'melania', 'politics', 'correspondents', 'speech', 'media']","[""Ben Stiller Slams Trump Administration For Including Tropic Thunder Clip In 'Propaganda' Video Ben Stiller has slammed the Donald Trump administration for using footage from one of his films in what he described as the US leader’s “propaganda machine”. Last week, the official White House TikTok page shared a provocative montage titled “justice the American way”, which included short clips of hit movies like Iron Man, Top Gun, Braveheart and Gladiator. The clip also included shots from Tropic Thunder, a satirical action comedy that Ben starred in alongside Robert Downey Jr, Jack Black and Tom Cruise almost 20 years ago. Reacting to the clip on Friday night, the Severance director wrote on X: “Hey White House, please remove the Tropic Thunder clip. We never gave you permission and have no interest in being a part of your propaganda machine.” “War is not a movie,” the Emmy winner added. Hey White House, please remove the Tropic Thunder clip. We never gave you permission and have no interest in being a part of your propaganda machine. War is not a movie. Ben is far from the only public figure upset by the White House’s social media output in recent history. Just last week, the Grammy-nominated musician Kesha fired back at the Trump administration over a similar video using one o"", 'Bari Weiss turned against Megyn Kelly after she spurned CBS debate proposal: report Bari Weiss’s very public break with Megyn Kelly came after Kelly quietly rebuffed weeks of behind-the-scenes lobbying to appear in a CBS debate with “Call Her Daddy” podcaster Alex Cooper, according to a report. Weiss courted Kelly to take part in a high-profile feminism debate as CBS News prepared to roll out a new town hall series under Weiss’s leadership, Vanity Fair reported. Kelly declined, a rejection that preceded Weiss’s decision to promote Ben Shapiro’s onstage broadside against the former Fox News star at Turning Point USA’s AmericaFest. Weiss took to social media and amplified Shapiro’s speech — a blistering address that accused Kelly, Tucker Carlson and others of cowardice and moral failure for refusing to condemn Candace Owens. Owens — the influential podcaster who made a name for herself as host of her own show at Shapiro’s outlet Daily Wire before she left the company under acrimonious circumstances — has baselessly suggested TPUSA officials may have been involved in the assassination of co-founder Charlie Kirk. Kelly has since described Shapiro’s move as a “betrayal by a friend” accused Weiss of backing an effort to freeze dissent out of the conservative movement un', ""Here's How 'Survivor' Finale Will Handle Trump's Speech Interruption: Will the Entire Episode Air? 'Heated Rivalry' Episode 5 Photos Revealed - See All The Pics! New Lawsuit Alleges Riley Keough Is the Biological Mother of John Travolta's Son Ben Khloe Kardashian Reveals Who Pays for Famous Family's Lavish Christmas Eve Party Rob & Michele Reiner's Kids Romy & Jake Break Silence, Release Statement Amid Brother Nick's Murder Charges The Survivor season 49 finale is set to air tonight, but there’s going to be an interruption to the episode. Donald Trump announced he will be making a speech tonight (December 17) at 9pm ET. The Survivor finale starts at 8pm ET, and is three hours long. CBS released a statement, explaining how it will be handled. Keep reading to find out more… “CBS News will air a Special Report for President Donald J. Trump’s live primetime address to the nation from the White House, Wednesday, Dec. 17 at 9:00 PM, ET. CBS News’ Norah O’Donnell will anchor and be joined by chief White House correspondent Nancy Cordes, reporting from the White House,” they said in a statement. They continued, “The SURVIVOR finale (starting at 8:00 PM, ET/PT) will resume where it left off immediately following the president’s address for Eastern and Central Time Zone viewers on the CBS""]"
44,11,44_electric vehicles_range rover_tesla_ev,"['electric vehicles', 'range rover', 'tesla', 'ev', 'suv', 'automotive', 'toyota', 'engine', 'electric', 'motor']","[""Power Up with MSI: Eco Series AC EV Charger and EZgo 7 kW Portable EV Charger Launch in Thailand BANGKOK, Thailand, Feb. 6, 2026 /PRNewswire/ -- MSI, a global leader in AI PCs and energy technology, has launched the MSI Eco Series AC EV Charger and EZgo 7 kW Portable EV Charger in Thailand. Designed, manufactured, and supported by MSI, the lineup delivers consistent quality and long-term reliability, backed by up to USD 5 million in product liability insurance and a 5-year or 3-year warranty for Eco chargers. Built for everyday use, Eco Series enables dependable home and site charging, while EZgo adds portable flexibility—so drivers can charge with confidence anytime, anywhere. MSI Eco-Series AC EV Charger Built for Thailand's harsh outdoor conditions, the Eco Series features corrosion-resistant materials validated by IEC 60068-2-11 salt spray testing, built-in lightning surge protection, and an IP65 dustproof, splash-resistant design. Its heat- and ASTM G154–compliant UV-resistant construction supports temperatures up to 55°C. For safety and security, Eco chargers use UL94 V-0 flame-retardant materials, RDC-DD leakage detection with automatic power cut-off, and an NXP industrial-grade MCU with data encryption. A bright 5-inch display, dynamic LED status lighting, and three-si"", ""Prince Harry’s £350k Jaguar once owned by British pop legend Prince Harry once got behind the wheel of a stunning £350,000 classic Jaguar E-Type once owned by an iconic pop star. Prince Harry and Meghan Markle jumped in the iconic convertible just hours after their Royal wedding at Windsor Castle in May 2018. Despite its classic appearance, the model has been converted to fully electric power put together by engineers at Jaguar Land Rover Classic. The EV certainly packs a punch, with drivers hitting 0-62mph in just 5.5 seconds, around one second quicker than the original combustion E-Type. We use your sign-up to provide content in ways you've consented to and to improve our understanding of you. This may include adverts from us and 3rd parties based on our understanding. You can unsubscribe at any time. Read our Privacy Policy READ MORE: The ‘real reason’ King Charles drives a £160k EV that can hit a whopping 165mph READ MORE: King Charles III’s vintage classic car converted to run on wine and cheese The converted E-Type is understood to have an average range of about 170 miles on a single charge. The model retains its original brakes, suspension, and chassis to preserve the look and handling of the iconic machine. It is understood that the"", 'Tata Curvv.ev SeriesX launched with 502 km range at Rs 16.99 lakh New Delhi: Tata Passenger Electric Mobility has launched the Curvv.ev SeriesX in India, with prices starting at Rs 16.99 lakh, ex-showroom Mumbai. The new SeriesX range adds two long-range variants to the Curvv.ev line-up, called Accomplished X 55 and Empowered X 55. The timing is interesting. Indian EV buyers are no longer only asking, “kitna range deti hai?” They now want proper features, better cabin comfort, highway confidence and a battery warranty that does not feel scary. The Curvv.ev SeriesX is Tata.ev’s fresh answer to that crowd. The Curvv.ev SeriesX gets a 55 kWh battery pack and a certified driving range of 502 km. Tata.ev also claims a real-world C75 range of around 400 km, based on internal testing. The SUV-coupe is built on the company’s acti.ev architecture and produces 167 hp and 215 Nm of torque. Here are the prices: The Accomplished X 55 gets a panoramic sunroof, dual 26.03 cm screens, wireless Android Auto and Apple CarPlay, 360-degree camera, blind-spot view monitor, leatherette upholstery and rear sunshades. The Empowered X 55 adds more kit. It gets ventilated front seats, 6-way powered driver seat, two-stage reclining rear seats, 31.24 cm Harman touchscreen,']"
45,11,45_oil supply_oil prices_global oil_crude prices,"['oil supply', 'oil prices', 'global oil', 'crude prices', 'brent crude', 'crude oil', 'refineries', 'oil gas', 'pipeline', 'market recovery']","['Aramco Sees Slow Oil Market Recovery after Shock Supply Loss The oil market will take months to normalize even if flows through the Strait of Hormuz resumed today, as 1 billion barrels of oil have been wiped off the supply balance over the past two and a half months. That’s the verdict on the global oil markets of Amin Nasser, chief executive officer of Saudi Arabia’s state oil giant and the world’s single largest crude oil exporter, Saudi Aramco. “Reopening routes is not the same as normalizing a market that has been deprived of about one billion barrels of oil,” Nasser told Reuters in statements this weekend after the Saudi oil giant reported consensus-beating Q1 earnings despite the closure of the Strait of Hormuz for a full month in the first quarter. In comments on the results, Nasser said in the Aramco press release that the company showed strong operational flexibility in re-routing exports through the East-West pipeline to the Yanbu export port on the Red Sea, which bypasses the closed-off Strait of Hormuz. “Our East-West Pipeline, which reached its maximum capacity of 7.0 million barrels of oil per day, has proven itself to be a critical supply artery, helping to mitigate the impact of a global energy shock and providing relief to c', 'Aramco Sees Slow Oil Market Recovery after Shock Supply Loss The oil market will take months to normalize even if flows through the Strait of Hormuz resumed today, as 1 billion barrels of oil have been wiped off the supply balance over the past two and a half months. That’s the verdict on the global oil markets of Amin Nasser, chief executive officer of Saudi Arabia’s state oil giant and the world’s single largest crude oil exporter, Saudi Aramco. “Reopening routes is not the same as normalizing a market that has been deprived of about one billion barrels of oil,” Nasser told Reuters in statements this weekend after the Saudi oil giant reported consensus-beating Q1 earnings despite the closure of the Strait of Hormuz for a full month in the first quarter. In comments on the results, Nasser said in the Aramco press release that the company showed strong operational flexibility in re-routing exports through the East-West pipeline to the Yanbu export port on the Red Sea, which bypasses the closed-off Strait of Hormuz. “Our East-West Pipeline, which reached its maximum capacity of 7.0 million barrels of oil per day, has proven itself to be a critical supply artery, helping to mitigate the impact of a global energy shock and providing relief to c', 'Aramco Sees Slow Oil Market Recovery after Shock Supply Loss The oil market will take months to normalize even if flows through the Strait of Hormuz resumed today, as 1 billion barrels of oil have been wiped off the supply balance over the past two and a half months. That’s the verdict on the global oil markets of Amin Nasser, chief executive officer of Saudi Arabia’s state oil giant and the world’s single largest crude oil exporter, Saudi Aramco. “Reopening routes is not the same as normalizing a market that has been deprived of about one billion barrels of oil,” Nasser told Reuters in statements this weekend after the Saudi oil giant reported consensus-beating Q1 earnings despite the closure of the Strait of Hormuz for a full month in the first quarter. In comments on the results, Nasser said in the Aramco press release that the company showed strong operational flexibility in re-routing exports through the East-West pipeline to the Yanbu export port on the Red Sea, which bypasses the closed-off Strait of Hormuz. “Our East-West Pipeline, which reached its maximum capacity of 7.0 million barrels of oil per day, has proven itself to be a critical supply artery, helping to mitigate the impact of a global energy shock and providing relief to c']"
46,11,46_fentanyl_drugs_marijuana_substances,"['fentanyl', 'drugs', 'marijuana', 'substances', 'addiction treatment', 'addiction', 'alcohol', 'effectiveness', 'public safety', 'patients']","['DEA warns fentanyl mixtures overwhelming overdose reversal drug (The Center Square) – The U.S. Drug Enforcement Administration warned Americans Tuesday that fentanyl is increasingly mixed with a dangerous array of synthetic substances that can limit the effectiveness of naloxone, the standard overdose reversal drug, making the illicit drug supply more unpredictable and more lethal than ever. Law enforcement and public health officials are seeing fentanyl combined with xylazine, medetomidine, nitazenes and cychlorphine – substances that either cannot be reversed by naloxone or require multiple doses to counter, the DEA said in a public safety advisory. Users typically have no way of knowing what is in the drugs they are taking. The advisory arrives as the DEA and the Trump administration have been touting significant progress against fentanyl. Enforcement pressure drove the share of fentanyl pills containing a potentially lethal dose from 76% in fiscal 2023 to 29% in fiscal 2025, a result the agency has repeatedly cited as a win. But the DEA\'s own 2025 National Drug Threat Assessment warned that the declining purity trend ""does not mean that street-level fentanyl is less dangerous,"" pointing directly to adulteration as the compensating threat. C', 'DEA warns fentanyl mixtures overwhelming overdose reversal drug (The Center Square) – The U.S. Drug Enforcement Administration warned Americans Tuesday that fentanyl is increasingly mixed with a dangerous array of synthetic substances that can limit the effectiveness of naloxone, the standard overdose reversal drug, making the illicit drug supply more unpredictable and more lethal than ever. Law enforcement and public health officials are seeing fentanyl combined with xylazine, medetomidine, nitazenes and cychlorphine – substances that either cannot be reversed by naloxone or require multiple doses to counter, the DEA said in a public safety advisory. Users typically have no way of knowing what is in the drugs they are taking. The advisory arrives as the DEA and the Trump administration have been touting significant progress against fentanyl. Enforcement pressure drove the share of fentanyl pills containing a potentially lethal dose from 76% in fiscal 2023 to 29% in fiscal 2025, a result the agency has repeatedly cited as a win. But the DEA\'s own 2025 National Drug Threat Assessment warned that the declining purity trend ""does not mean that street-level fentanyl is less dangerous,"" pointing directly to adulteration as the compensating threat. C', 'DEA warns fentanyl mixtures overwhelming overdose reversal drug (The Center Square) – The U.S. Drug Enforcement Administration warned Americans Tuesday that fentanyl is increasingly mixed with a dangerous array of synthetic substances that can limit the effectiveness of naloxone, the standard overdose reversal drug, making the illicit drug supply more unpredictable and more lethal than ever. Law enforcement and public health officials are seeing fentanyl combined with xylazine, medetomidine, nitazenes and cychlorphine – substances that either cannot be reversed by naloxone or require multiple doses to counter, the DEA said in a public safety advisory. Users typically have no way of knowing what is in the drugs they are taking. The advisory arrives as the DEA and the Trump administration have been touting significant progress against fentanyl. Enforcement pressure drove the share of fentanyl pills containing a potentially lethal dose from 76% in fiscal 2023 to 29% in fiscal 2025, a result the agency has repeatedly cited as a win. But the DEA\'s own 2025 National Drug Threat Assessment warned that the declining purity trend ""does not mean that street-level fentanyl is less dangerous,"" pointing directly to adulteration as the compensating threat. C']"
