Topic,Count,Name,Representation,Representative_Docs
-1,701,-1_officials_usc_community_social,"['officials', 'usc', 'community', 'social', 'government', 'students', 'jobs', 'industry', 'state', 'county']","[""Pepsi adds a new take on cola Coca-Cola does not offer As a subscriber, you can share up to 3 articles each month with friends for free. Just click “Gift this Article” on this page, then copy the link or enter their email. Gifts are exclusive to subscribers, reset monthly, and each article can be redeemed once. It's natural for consumers to want healthier versions of unhealthy things. I, for example, have a sweet tooth and have been ordering from Shameless Snacks, a company that makes gummy candies that are 90 calories a package with only 3 grams of sugar and nearly a full day's worth of fiber. Javascript is required for you to be able to read premium content. Please enable it in your browser settings. Thanks for the feedback. Log In Keep it Clean. Please avoid obscene, vulgar, lewd, racist or sexually-oriented language. PLEASE TURN OFF YOUR CAPS LOCK. Don't Threaten. Threats of harming another person will not be tolerated. Be Truthful. Don't knowingly lie about anyone or anything. Be Nice. No racism, sexism or any sort of -ism that is degrading to another person. Be Proactive. Use the 'Report' link on each comment to let us know of abusive posts. Share with Us. We'd love to hear eyewitness accounts, the history behind an article. This"", ""Cameron Boozer should be the number one overall pick over AJ Dybantsa and Darryn Peterson — He gets criticized for the same reason Luka Doncic did As a subscriber, you can share up to 3 articles each month with friends for free. Just click “Gift this Article” on this page, then copy the link or enter their email. Gifts are exclusive to subscribers, reset monthly, and each article can be redeemed once. Duke's do-it-all power forward Cameron Boozer is hands down the best college player this season. Interestingly, however, he continues to lag in many mock drafts for the number one pick in this year's NBA Draft. Such takes make me wonder what is making pundits and observers continue to be unconvinced that he deserves to be the top pick. Javascript is required for you to be able to read premium content. Please enable it in your browser settings. Log In Keep it Clean. Please avoid obscene, vulgar, lewd, racist or sexually-oriented language. PLEASE TURN OFF YOUR CAPS LOCK. Don't Threaten. Threats of harming another person will not be tolerated. Be Truthful. Don't knowingly lie about anyone or anything. Be Nice. No racism, sexism or any sort of -ism that is degrading to another person. Be Proactive. Use the 'Report' link on each comment to let us know of abusive posts. Share with Us. We'd love to hear eyewitness accounts, the history"", ""California lawmakers push back against offshore oil drilling (The Center Square) – Weeks after California Lt. Gov. Eleni Kounalakis spoke out against federal efforts to expand offshore oil drilling, state lawmakers told The Center Square that increased drilling is deeply unpopular among coastal residents. Opponents warn against the environmental costs. Javascript is required for you to be able to read premium content. Please enable it in your browser settings. Originally published on thecentersquare.com, part of the BLOX Digital Content Exchange. Thanks for signing up. Keep an eye on your inbox for the next edition. You may want to whitelistthe-daily-sun@adamspg-email.comto make sure it doesn't go to your spam folder! Get the top headlines delivered straight to your inbox every morning. Log In Keep it Clean. Please avoid obscene, vulgar, lewd, racist or sexually-oriented language. PLEASE TURN OFF YOUR CAPS LOCK. Don't Threaten. Threats of harming another person will not be tolerated. Be Truthful. Don't knowingly lie about anyone or anything. Be Nice. No racism, sexism or any sort of -ism that is degrading to another person. Be Proactive. Use the 'Report' link on each comment to let us know of abusive posts. Share with Us. We'd love to hear e""]"
0,271,0_nasdaq_nyse_stocks_etf,"['nasdaq', 'nyse', 'stocks', 'etf', 'securities', 'shares', 'holdings', 'investor', 'companies', 'dividend']","['Allspring Global Investments Holdings LLC Boosts Holdings in Ecolab Inc. $ECL Posted by Defense World Staff on Jan 4th, 2026 Allspring Global Investments Holdings LLC lifted its position in shares of Ecolab Inc. (NYSE:ECL – Free Report) by 40.2% during the third quarter, according to the company in its most recent Form 13F filing with the Securities and Exchange Commission. The institutional investor owned 110,340 shares of the basic materials company’s stock after purchasing an additional 31,665 shares during the period. Allspring Global Investments Holdings LLC’s holdings in Ecolab were worth $29,760,000 as of its most recent SEC filing. A number of other large investors have also added to or reduced their stakes in the company. Financial Connections Group Inc. acquired a new position in Ecolab in the 2nd quarter worth $26,000. J.Safra Asset Management Corp increased its position in shares of Ecolab by 202.6% during the second quarter. J.Safra Asset Management Corp now owns 115 shares of the basic materials company’s stock worth $31,000 after acquiring an additional 77 shares during the last quarter. Vermillion & White Wealth Management Group LLC lifted its stake in shares of Ecolab by 81.5% in the second quarter. Vermillion & White Wealth Management Group', 'AA Financial Advisors LLC Buys 37,001 Shares of FS KKR Capital Corp. $FSK Posted by Defense World Staff on Dec 22nd, 2025 AA Financial Advisors LLC increased its stake in shares of FS KKR Capital Corp. (NYSE:FSK – Free Report) by 24.9% during the third quarter, according to the company in its most recent disclosure with the Securities & Exchange Commission. The firm owned 185,859 shares of the company’s stock after acquiring an additional 37,001 shares during the period. AA Financial Advisors LLC’s holdings in FS KKR Capital were worth $2,775,000 as of its most recent SEC filing. A number of other institutional investors and hedge funds have also recently added to or reduced their stakes in the stock. CCLA Investment Management acquired a new stake in shares of FS KKR Capital in the 2nd quarter valued at about $33,463,000. SCS Capital Management LLC bought a new position in shares of FS KKR Capital during the first quarter worth about $10,822,000. Generali Asset Management SPA SGR grew its holdings in shares of FS KKR Capital by 21.7% during the second quarter. Generali Asset Management SPA SGR now owns 2,485,265 shares of the company’s stock worth $51,569,000 after buying an additional 442,374 shares in the last quarter. Wellington Management Group LLP', 'Adams Wealth Management Has $2.71 Million Stake in Schwab US Broad Market ETF $SCHB Posted by Defense World Staff on Dec 15th, 2025 Adams Wealth Management increased its holdings in shares of Schwab US Broad Market ETF (NYSEARCA:SCHB – Free Report) by 26.5% in the second quarter, according to the company in its most recent Form 13F filing with the Securities and Exchange Commission (SEC). The fund owned 113,506 shares of the company’s stock after buying an additional 23,754 shares during the period. Adams Wealth Management’s holdings in Schwab US Broad Market ETF were worth $2,705,000 at the end of the most recent quarter. A number of other hedge funds and other institutional investors have also recently bought and sold shares of the business. Milestones Private Investment Advisors LLC acquired a new position in shares of Schwab US Broad Market ETF in the 2nd quarter valued at $3,619,000. WT Wealth Management grew its stake in shares of Schwab US Broad Market ETF by 0.3% during the second quarter. WT Wealth Management now owns 1,284,069 shares of the company’s stock worth $30,599,000 after purchasing an additional 3,857 shares during the period. Cambridge Financial Group LLC increased its holdings in Schwab US Broad Market ETF by 43.8% in the second quarter. Cambr']"
1,216,1_iran war_war iran_iran_missiles,"['iran war', 'war iran', 'iran', 'missiles', 'war', 'middle east', 'gaza', 'ceasefire', 'drones', 'trump administration']","[""AP News Summary at 4:09 a.m. EDT Iran launches new attacks at Israel and Gulf countries as it keeps up pressure on the Middle East DUBAI, United Arab Emirates (AP) — Iran has fired more drones and missiles at Israel and Gulf Arab countries as it keeps up pressure on the Middle East in a war that has sent oil prices surging and stunned global economies. The Saudi Defense Ministry said on Tuesday that it has destroyed two drones over the kingdom’s oil-rich eastern region, while in Kuwait, the National Guard said it shot down six drones attacking the county’s northern and southern areas. The attacks come as U.S. President Donald Trump sends contradictory signals about how long the war could last, adding to uncertainty that’s causing markets to swing. Copyright 2026 The Associated Press. All rights reserved. This material may not be published, broadcast, rewritten or redistributed. Log In Keep it Clean. Please avoid obscene, vulgar, lewd, racist or sexually-oriented language. PLEASE TURN OFF YOUR CAPS LOCK. Don't Threaten. Threats of harming another person will not be tolerated. Be Truthful. Don't knowingly lie about anyone or anything. Be Nice. No racism, sexism or any sort of -ism that is degrading to another person"", 'AP News Summary at 4:09 a.m. EDT Iran launches new attacks at Israel and Gulf countries as it keeps up pressure on the Middle East DUBAI, United Arab Emirates (AP) — Iran has fired more drones and missiles at Israel and Gulf Arab countries as it keeps up pressure on the Middle East in a war that has sent oil prices surging and stunned global economies. The Saudi Defense Ministry said on Tuesday that it has destroyed two drones over the kingdom’s oil-rich eastern region, while in Kuwait, the National Guard said it shot down six drones attacking the county’s northern and southern areas. The attacks come as U.S. President Donald Trump sends contradictory signals about how long the war could last, adding to uncertainty that’s causing markets to swing. Javascript is required for you to be able to read premium content. Please enable it in your browser settings. Copyright 2026 The Associated Press. All rights reserved. This material may not be published, broadcast, rewritten or redistributed. React to this story: Sorry, there are no recent results for popular videos. Sorry, there are no recent results for popular commented articles.', 'AP News Summary at 4:09 a.m. EDT Iranian barrages target Israel and Gulf countries as US warns Iran of ‘most intense day of strikes’ DUBAI, United Arab Emirates (AP) — Iran has fired more drones and missiles at Israel and Gulf Arab countries as it keeps up pressure on the Middle East. The war launched by the United States and Israel has sent oil prices surging and stunned global economies. The Saudi Defense Ministry said on Tuesday that it has destroyed two drones over the kingdom’s oil-rich eastern region, while in Kuwait, the National Guard said it shot down six drones attacking the country’s northern and southern areas. The attacks come as U.S. President Donald Trump sends contradictory signals about how long the war could last, adding to uncertainty that’s causing markets to swing. Javascript is required for you to be able to read premium content. Please enable it in your browser settings. Copyright 2026 The Associated Press. All rights reserved. This material may not be published, broadcast, rewritten or redistributed. Sorry, there are no recent results for popular videos. Sorry, there are no recent results for popular commented articles.']"
2,202,2_crime_kelowna_shootings_police,"['crime', 'kelowna', 'shootings', 'police', 'county sheriff', 'police department', 'murder', 'arrested', 'deputies', 'suspect']","['One arrested after police raid on West Kelowna ‘problem property’ Published 12:20 pm Monday, February 9, 2026 By Brennan Phillips One person was arrested, and seven others were detained after RCMP executed a search warrant on a West Kelowna property on Feb. 4. The West Kelowna RCMP Crime Reduction Unit (CRU), with the assistance of frontline officers, West Kelowna Drug Section, and the Southeast District Emergency Response Team (SED ERT), worked together to search the Applegreen Court property. According to a Feb. 9 RCMP news release, the warrant was issued as part of a months-long investigation into the “ongoing problem property”, which was the result of repeated complaints from residents in the neighbourhood about the property and the activity associated with it. RCMP seized more than 200 grams of suspected illegal drugs, drug trafficking equipment, ammunition, and weapons. “This investigation is a clear example of our officers listening to the community and taking decisive action where criminal activity is impacting neighbourhood safety,” said Cpl. Bryan Mulrooney, non-commissioned officer-in-charge of the West Kelowna RCMP CRU. “We take residents’ concerns seriously and take enforcement action when warranted. Removing drugs, weapons, and traf', '6 killed in Mississippi mass shooting, suspect charged with murder Authorities have charged a 24-year-old man with murder after six people — including a child — were killed in a series of shootings in northeast Mississippi. Clay County Sheriff Eddie Scott said the victims — four family members related to the suspect and two other adults — were shot at three separate locations late Friday. The youngest victim was a cousin of the suspect. Related video above: Search underway for the killer of Ohio couple ""I don\'t know what kind of motive you could have to kill a 7-year-old,"" Scott said at a press conference Saturday. The suspect was identified as Daricka M. Moore. He faces a first-degree murder charge that could be upgraded to capital murder, Scott said. Moore may face additional murder charges as the investigation proceeds. The shootings took place in the rural community of Cedarbluff, west of the county seat of West Point. Clay County deputies received a call around 5:56 p.m. reporting gunshot victims in the Cedarbluff area; deputies arrived about 7:03 p.m. Investigators allege 24-year-old Daricka Moore shot multiple family members at the first scene and then stole a Ford F-150 belonging to his alleged deceased brother. Authorities say Moore later', '6 killed in Mississippi mass shooting, suspect charged with murder Authorities have charged a 24-year-old man with murder after six people — including a child — were killed in a series of shootings in northeast Mississippi. Clay County Sheriff Eddie Scott said the victims — four family members related to the suspect and two other adults — were shot at three separate locations late Friday. The youngest victim was a cousin of the suspect. Related video above: Search underway for the killer of Ohio couple ""I don\'t know what kind of motive you could have to kill a 7-year-old,"" Scott said at a press conference Saturday. The suspect was identified as Daricka M. Moore. He faces a first-degree murder charge that could be upgraded to capital murder, Scott said. Moore may face additional murder charges as the investigation proceeds. The shootings took place in the rural community of Cedarbluff, west of the county seat of West Point. Clay County deputies received a call around 5:56 p.m. reporting gunshot victims in the Cedarbluff area; deputies arrived about 7:03 p.m. Investigators allege 24-year-old Daricka Moore shot multiple family members at the first scene and then stole a Ford F-150 belonging to his alleged deceased brother. Authorities say Moore later']"
3,172,3_arsenal_injury_midfielder_villa,"['arsenal', 'injury', 'midfielder', 'villa', 'chelsea', 'united', 'salah', 'bayern', 'spurs', 'derby']","['Man City vs. Arsenal: Gunners suffer fresh \'injury blow\' ahead of Premier League blockbuster By Matt Law | 15 Apr 2026 21:37, Last updated: 15 Apr 2026 21:46 Arsenal attacker Noni Madueke has emerged as a major doubt for Sunday\'s blockbuster Premier League contest with Manchester City at the Etihad Stadium. Madueke made his fifth Champions League start of the campaign in Wednesday\'s quarter-final second leg against Sporting Lisbon at the Emirates Stadium. However, the 24-year-old was forced off in the 63rd minute after taking a knock to his knee. Max Dowman was introduced as the England international\'s replacement, and he has now emerged as a major doubt for this weekend\'s top-of-the-table clash with Man City. Arsenal are currently top of the Premier League table, six points ahead of second-placed Man City, who have a game in hand on the Gunners. Madueke has come up with seven goals and four assists in 35 appearances this season, but he could now be facing a spell on the sidelines entering the final straight. Bukayo Saka was also again absent for the Champions League game with Sporting. ""It was something that he was carrying for a while. It was an Achilles issue,"" said Arsenal boss Mikel Arteta ahead of the European fixture on Wednesday night when asked about his star play', ""Liverpool injury update: Alexander Isak, Alisson Becker and Jeremie Frimpong latest news and return dates Sport | Football Liverpool returned to winning ways with a 2-0 victory over Aston Villa to end their four-game losing streak in the Premier League. Pressure was piling on Arne Slot after the Reds slumped to ninth in the table, but even without a number of key players, the champions were able to sweep Villa aside to move back up to third. They welcome Real Madrid - Trent Alexander-Arnold, Xabi Alonso, et al - to Anfield in midweek, before they take on Manchester City in a mouth-watering encounter at the weekend. But will they have any of their star names back from injury? Ahead of a big few weeks, here’s all the latest Liverpool injury news and return dates... Alexander Isak has endured a tough start to life on Merseyside. Subbed at half-time in Liverpool’s 5-1 win over Frankfurt in the Champions League, Slot later revealed the £125million summer signing had suffered a minor groin injury. “Alexander had to go off at half-time because he felt his groin a little bit. That's a pity,” said Slot. “I've said many times it is such a difficult balance to find with a player that missed three months.” Isak was not in the squad in the 3-2 loss at Brentford, and he also missed out on the Caraba"", ""Liverpool injury update: Alexander Isak, Alisson Becker and Jeremie Frimpong latest news and return dates Liverpool returned to winning ways with a 2-0 victory over Aston Villa to end their four-game losing streak in the Premier League. Pressure was piling on Arne Slot after the Reds slumped to ninth in the table, but even without a number of key players, the champions were able to sweep Villa aside to move back up to third. They welcome Real Madrid - Trent Alexander-Arnold, Xabi Alonso, et al - to Anfield in midweek, before they take on Manchester City in a mouth-watering encounter at the weekend. But will they have any of their star names back from injury? Ahead of a big few weeks, here’s all the latest Liverpool injury news and return dates... Alexander Isak has endured a tough start to life on Merseyside. Subbed at half-time in Liverpool’s 5-1 win over Frankfurt in the Champions League, Slot later revealed the £125million summer signing had suffered a minor groin injury. “Alexander had to go off at half-time because he felt his groin a little bit. That's a pity,” said Slot. “I've said many times it is such a difficult balance to find with a player that missed three months.” Isak was not in the squad in the 3-2 loss at Brentford, and he also missed out on the Carabao Cup defeat agai""]"
4,167,4_governor_colorado_state state_gov,"['governor', 'colorado', 'state state', 'gov', 'federal', 'legislative', 'statewide', 'senate', 'democrat', 'idaho']","['WATCH: Gov. Polis calls out Republicans in State of the State (The Center Square) – Colorado Gov. Jared Polis delivered his last State of the State to a joint session of the Colorado General Assembly on Thursday. In his speech, the Democratic governor called out Republicans, reflected on his past seven years in office, and looked to policy priorities for his last 10 months in office. Since the Trump administration took office one year ago, the Democrat-led Colorado state government has often faced off against the federal government over policies and funding cuts. Polis reflected on that. “Over the past 12 months, it seems like Washington has often been in it to ... make life harder and less affordable, to make Americans feel more fearful, more belligerent and more vulnerable,” Polis said. “In the last month alone, the Trump administration has threatened over $1 billion in funding for Colorado.” As reported by The Center Square, Colorado has filed dozens of lawsuits to challenge federal Republican policies and cuts. Polis promised to keep up those efforts, while calling out Republicans. “We are fighting hard to protect every federal dollar owed to Colorado,” he said. “In partnership with Attorney General [Phil] Weiser, our state has successful', 'WATCH: Gov. Polis calls out Republicans in State of the State (The Center Square) – Colorado Gov. Jared Polis delivered his last State of the State to a joint session of the Colorado General Assembly on Thursday. In his speech, the Democratic governor called out Republicans, reflected on his past seven years in office, and looked to policy priorities for his last 10 months in office. Since the Trump administration took office one year ago, the Democrat-led Colorado state government has often faced off against the federal government over policies and funding cuts. Polis reflected on that. “Over the past 12 months, it seems like Washington has often been in it to ... make life harder and less affordable, to make Americans feel more fearful, more belligerent and more vulnerable,” Polis said. “In the last month alone, the Trump administration has threatened over $1 billion in funding for Colorado.” As reported by The Center Square, Colorado has filed dozens of lawsuits to challenge federal Republican policies and cuts. Polis promised to keep up those efforts, while calling out Republicans. “We are fighting hard to protect every federal dollar owed to Colorado,” he said. “In partnership with Attorney General [Phil] Weiser, our state has successful', 'WATCH: Gov. Polis calls out Republicans in State of the State (The Center Square) – Colorado Gov. Jared Polis delivered his last State of the State to a joint session of the Colorado General Assembly on Thursday. In his speech, the Democratic governor called out Republicans, reflected on his past seven years in office, and looked to policy priorities for his last 10 months in office. Since the Trump administration took office one year ago, the Democrat-led Colorado state government has often faced off against the federal government over policies and funding cuts. Polis reflected on that. “Over the past 12 months, it seems like Washington has often been in it to ... make life harder and less affordable, to make Americans feel more fearful, more belligerent and more vulnerable,” Polis said. “In the last month alone, the Trump administration has threatened over $1 billion in funding for Colorado.” As reported by The Center Square, Colorado has filed dozens of lawsuits to challenge federal Republican policies and cuts. Polis promised to keep up those efforts, while calling out Republicans. “We are fighting hard to protect every federal dollar owed to Colorado,” he said. “In partnership with Attorney General [Phil] Weiser, our state has successful']"
