Topic,Count,Name,Representation,Representative_Docs
29,15,29_cricket team_cricket_icc_opening match,"['cricket team', 'cricket', 'icc', 'opening match', 'rahul', 'india', 'singh', 'innings', 'women team', 'world cup']","['Delhi Capitals IPL 2026 Schedule: Full Fixtures, Opening Match Details, Squad And Key Encounters Delhi Capitals will kick off their IPL 2026 campaign against Lucknow Super Giants on April 1 in Lucknow. The franchise will then return home for their first match at the Arun Jaitley Stadium, a day game scheduled for April 4. Delhi Capitals (DC) will be eager to make amends in IPL 2026 after narrowly missing out on a playoff berth in IPL 2025. The team started last season strongly but lost momentum in the second half of the tournament. Axar Patel and co. eventually finished fifth on the points table, falling short of the playoffs by a single point. That disappointment has only sharpened the team’s focus heading into the new season. Delhi Capitals have strengthened their squad ahead of IPL 2026 by bringing in Nitish Rana and Prithvi Shaw, along with promising domestic talent Auqib Nabi. The franchise has also added several experienced international players to create a balanced squad capable of making a deep run in the tournament. With a refreshed squad and renewed determination, DC will be hoping to deliver a stronger campaign this season, and potentially challenge for their maiden IPL title. With IPL 2026 set to begin on March 28, here’s a look at Delhi Capitals’ schedule for the o', 'Women in Blue, World Champions: Tech titans Sundar Pichai, Satya Nadella hail India’s historic World Cup win New Delhi, Nov 3, 2025 Global tech leaders Sundar Pichai and Satya Nadella joined millions of Indians in celebrating the country’s maiden triumph at the ICC Women’s Cricket World Cup 2025, lauding the team’s grit, inspiration, and historic achievement. Google CEO Sundar Pichai took to X to express his excitement after India’s thrilling victory over South Africa in the final at DY Patil Stadium on Sunday. “That was a nail-biting women’s world cup cricket final, memories of 1983 and 2011 indeed. Congrats to Team India, am sure will inspire a whole generation. Great tournament from South Africa too!” he wrote, drawing parallels between the women’s team’s triumph and India’s iconic men’s World Cup wins. Microsoft CEO Satya Nadella also saluted the champions in his post, declaring, “Women in Blue = World Champions! Respect to South Africa for making their first-ever final. A truly historic day for women’s cricket—new chapters written, barriers broken, legends born.” His words reflected the broader sentiment that India’s win marks a new era for women’s sport globally. The posts from two of the world’s most influential tech leaders underscored the worldwide recognition of India’s achievem', 'BCCI announces Rs 51 crore reward as India’s women clinch maiden World Cup New Delhi, Nov 3: In a watershed moment for Indian cricket, the national women’s team etched their name in history by winning their first-ever ICC Women’s World Cup title, defeating South Africa by 52 runs in a pulsating final at the DY Patil Stadium on Sunday night. Celebrations erupted across the country as BCCI Secretary Devajit Saikia reportedly announced a Rs 51 crore reward for the players and support staff, hailing the victory as a “monumental achievement that will take Indian women’s cricket to a new level.” Meanwhile, IPL chairman Arun Dhumal lauded the team’s historic feat, drawing parallels with India’s iconic 1983 men’s World Cup triumph. “It’s a red-letter day for Indian women’s cricket. What the men’s team achieved in 1983, the Indian women have recreated today in Mumbai. This historic triumph will give a tremendous boost to women’s cricket in the country, and I’m confident our game will now reach new heights,” Dhumal said. Earlier, batting first, India posted a commanding 298/7, powered by Shafali Verma’s fluent 87, Deepti Sharma’s composed 58, and valuable contributions from Smriti Mandhana (45) and Richa Ghosh (34). A solid 100-run opening stand between Mandhana an']"
30,14,30_monitor_tvs_display_screen,"['monitor', 'tvs', 'display', 'screen', 'samsung', 'device', 'resolution', 'gaming', 'roku', 'tv']","['Luckfox 16-inch 4K 120Hz portable touch monitor offers 100% sRGB coverage The segment of portable monitors continues to grow, with many models available on Amazon at relatively affordable prices, typically between $100 and $150. These screens can be useful for productivity on business trips or while traveling. But portable monitors that combine a high resolution with a fast refresh rate remain uncommon in the mid-range segment. Luckfox wants to address this gap with its new 16"" 4K Touch Monitor. The 16-inch display features a 3840 × 2400 (WQUXGA) IPS panel with 350 nits brightness and a 1200:1 contrast ratio. It uses optical bonding technology with 6H-hardness toughened glass and a matte finish to minimize ambient reflections. The 16:10 aspect ratio provides more vertical workspace than the standard 16:9 format. It also supports a 120Hz refresh rate, which is an upgrade over the common 60Hz panels found in many portable monitors, such as the Auzai ME16Z01 or the Arzopa A1M; response times aren\'t disclosed, though. As for connectivity, the product integrates two USB Type-C ports and a Mini HDMI input. Both USB-C ports support audio, video, and power delivery, meaning that only a single USB-C cable is required when connected to a compatible smartphone, tab', 'Samsung OLED 48S95H: New 48-inch and 165 Hz OLED TV revealed ahead of schedule with HDR10 Plus Advanced support Samsung has already teased plenty of devices on the eve of CES 2026. However, the trade show has decided to lift the lid on one of Samsung\'s forthcoming OLED Smart TVs. For context, Samsung listed numerous unreleased Smart TVs on its Parts Database over a month ago. Of those, CES has announced that the S95H is a 2026 Honoree in its Gaming & eSports category. Specifically, the trade show has signalled out a 48-inch variant that was missing from November\'s leak. Incidentally, last year\'s S95F only went as small as 55-inches (curr. $1,997 on Amazon). According to the listing, the S95H offers a 165 Hz refresh rate with VRR technology supported. Assuming a 4K resolution from the S95F series and the usage of HDMI 2.1 ports, a 165 Hz refresh rate would require the usage of Display Stream Compression (DSC) to output at its peak resolution and refresh rate simultaneously. Moreover, the new 48-inch Smart TV will support Samsung\'s new HDR10 Plus Advanced format. Pricing and availability are unknown for now; the full description provided by Samsung and CES is as follows: The Samsung OLED (S95H) is the world\'s most advanced 48"" OLED TV for high-end gaming. Combining unparalleled brightness and', ""World's largest monitor company designed a 4K 48-inch OLED dual-sided smart gaming display with metal feet, a magnetic power socket, and an Alienware-inspired sound system - but who will actually use it? Sign up for breaking news, reviews, opinion, top tech deals, and more. You are now subscribed Your newsletter sign-up was successful GP TV has unveiled what it calls the world’s first dual-sided 48-inch 4K OLED television, designed for gaming and sports viewing. The display is intended to deliver immersive experiences on both sides simultaneously, with built-in audio and dynamic lighting effects. TPV Technology Group, the company behind GP TV, claims the screen targets premium users who value high-end visual fidelity, as well as the public sector and government institutions. This design feels unusual because most monitors or televisions sit against a wall or on a desk, making a rear-facing display largely unnecessary. Its relevance only emerges if the screen stands in the center of a room, similar to display setups commonly seen in shopping malls - and even then, deploying such a device in public spaces would increase the risk of physical damage, leaving the practical use case for this product uncertain. It comes with an audio system that integrates surround sound, Dolby Atmos support, and sound tracking that follows on-screen action. Speakers with fabric covers on both sides creat""]"
31,13,31_welfare_wages_rising costs_social security,"['welfare', 'wages', 'rising costs', 'social security', 'premiums', 'taxpayers', 'benefits', 'jobs', 'claims', 'income']","['How much will DWP benefits and pensions rise following the budget? Benefits Budget 2025 Child Benefit Department for Work and Pensions DWP Pensions PIP Rachel Reeves Universal Credit National government Personal Finance DWP benefits including Universal Credit, Child Benefit, PIP, Carer\'s Allowance, and the State Pension are to increase in April 2026 after Rachel Reeves announced higher payments in her budget speech today. Anyone who claims DWP benefits should be in line for an increase in the next financial year, as the chancellor laid out plans to help pensioners, disabled people, parents, low earners, carers and unemployed people keep up with rising costs. Addressing MPs, Ms Reeves said: ""The broken welfare system that we inherited wrote off millions of people as too sick to work and we will reform that system so that it is a system that does not count the cost of failure, but one that protects people who cannot work and empowers those who can. ""We have brought back face-to-face assessments for disability benefits. Those are the face-to-face assessments that the shadow chancellor (Sir Mel Stride) got rid of when he was work and pensions secretary and our changes we have made to Universal Credit will get 15,000 people back into work, a figure con', 'How much will DWP benefits and pensions rise following the budget? Benefits Budget 2025 Child Benefit Department for Work and Pensions DWP Pensions PIP Rachel Reeves Universal Credit National government Personal Finance DWP benefits including Universal Credit, Child Benefit, PIP, Carer\'s Allowance, and the State Pension are to increase in April 2026 after Rachel Reeves announced higher payments in her budget speech today. Anyone who claims DWP benefits should be in line for an increase in the next financial year, as the chancellor laid out plans to help pensioners, disabled people, parents, low earners, carers and unemployed people keep up with rising costs. Addressing MPs, Ms Reeves said: ""The broken welfare system that we inherited wrote off millions of people as too sick to work and we will reform that system so that it is a system that does not count the cost of failure, but one that protects people who cannot work and empowers those who can. ""We have brought back face-to-face assessments for disability benefits. Those are the face-to-face assessments that the shadow chancellor (Sir Mel Stride) got rid of when he was work and pensions secretary and our changes we have made to Universal Credit will get 15,000 people back into work, a figure con', 'How much will DWP benefits and pensions rise following the budget? Benefits Budget 2025 Child Benefit Department for Work and Pensions DWP Pensions PIP Rachel Reeves Universal Credit National government Personal Finance DWP benefits including Universal Credit, Child Benefit, PIP, Carer\'s Allowance, and the State Pension are to increase in April 2026 after Rachel Reeves announced higher payments in her budget speech today. Anyone who claims DWP benefits should be in line for an increase in the next financial year, as the chancellor laid out plans to help pensioners, disabled people, parents, low earners, carers and unemployed people keep up with rising costs. Addressing MPs, Ms Reeves said: ""The broken welfare system that we inherited wrote off millions of people as too sick to work and we will reform that system so that it is a system that does not count the cost of failure, but one that protects people who cannot work and empowers those who can. ""We have brought back face-to-face assessments for disability benefits. Those are the face-to-face assessments that the shadow chancellor (Sir Mel Stride) got rid of when he was work and pensions secretary and our changes we have made to Universal Credit will get 15,000 people back into work, a figure con']"
32,13,32_brisbane_queensland_melbourne_teachers,"['brisbane', 'queensland', 'melbourne', 'teachers', 'staffing', 'victoria', 'school board', 'parliament', 'australia', 'expenses']","['The FIFO CEO: Rail Loop boss commutes from Queensland Add articles to your saved list and come back to them any time. The $900,000-a-year executive responsible for Melbourne’s most expensive infrastructure project commutes from Brisbane and is paid additional expenses to attend unscheduled meetings. Freedom of information documents released to The Age reveal the extraordinary arrangements to enable Suburban Rail Loop Authority chief executive Frankie Carroll to maintain a residence in Brisbane, fly in and out of his Big Build job, and bill taxpayers for flight costs when he is “recalled to duty”. Suburban Rail Loop Authority chief executive Frankie Carroll. This is an employment term used when staff are asked to work or return to the office outside their regular work hours. Carroll, who is on a remuneration package of between $900,000 and $909,999, has led the Allan government’s signature infrastructure project since 2021. This includes superannuation and accrued leave and other entitlements. While Carroll meets the cost of his regular commute himself, the documents show that taxpayers were charged when Carroll flew to Melbourne, where the rail loop authority is headquartered, to attend a conference. In another example of travel costs', '‘We’re in it for the fight’: State school teachers rally outside Parliament Add articles to your saved list and come back to them any time. Peter Haffenden is standing with hundreds of fellow state school teachers outside Parliament House, in inner-Brisbane, shortly after 4.30pm on Thursday. The humanities teacher says he frequently spends weekends, holidays, and nights marking work, preparing lessons, and planning curriculum. “I’ve been teaching 35 years and the workload’s probably gone up by a factor of five … I never get a chance to really spend time with my family because I’m working at home so much,” Haffenden said. Teachers Andrew Weber (left) and Peter Haffenden (right) said workloads had increased over the more than three decades both men had been teachers.Credit: Catherine Strohfeldt Fellow Brisbane region teacher Andrew Weber estimated a normal working week demanded about 45 to 50 hours’ work, but said during marking periods the hours spent on teaching tasks skyrocketed. “It’s obviously weekends, it’s obviously nights, it’s holidays … for instance, I’ve got to do probably 10 to 12 hours of drafts this weekend,” he said. Thursday’s rally was a warm-up for Queensland Teachers’ Union (QTU) members, who are planning to strike before the end of the sc', '‘We’re in it for the fight’: State school teachers rally outside Parliament Add articles to your saved list and come back to them any time. Peter Haffenden is standing with hundreds of fellow state school teachers outside Parliament House, in inner-Brisbane, shortly after 4.30pm on Thursday. The humanities teacher says he frequently spends weekends, holidays, and nights marking work, preparing lessons, and planning curriculum. “I’ve been teaching 35 years and the workload’s probably gone up by a factor of five … I never get a chance to really spend time with my family because I’m working at home so much,” Haffenden said. Teachers Andrew Weber (left) and Peter Haffenden (right) said workloads had increased over the more than three decades both men had been teachers.Credit: Catherine Strohfeldt Fellow Brisbane region teacher Andrew Weber estimated a normal working week demanded about 45 to 50 hours’ work, but said during marking periods the hours spent on teaching tasks skyrocketed. “It’s obviously weekends, it’s obviously nights, it’s holidays … for instance, I’ve got to do probably 10 to 12 hours of drafts this weekend,” he said. Thursday’s rally was a warm-up for Queensland Teachers’ Union (QTU) members, who are planning to strike before the end of the sc']"
33,12,33_santa_christmas_holiday season_christmas eve,"['santa', 'christmas', 'holiday season', 'christmas eve', 'festive', 'presents', 'festival', 'traditions', 'toys', 'children need']","['Celebrating Christmas in and around Larnaca The city, the suburbs and the villages of Larnaca all get into the festive mood this season as dozens of Christmas events pop up. All around the Larnaca region, markets, workshops and performances will share magical moments for visitors. The SanTa Lefkara Christmas Village is on until January 6 with artists’ stalls, entertainment, craft workshops, children’s activities and concerts taking over the village centre. As one of the deputy ministry of tourism’s eight Christmas Villages, Lefkara is dressed in full holiday glam with glimmering string lights, Christmas trees and a rich, weekly entertainment programme. On December’s first weekend coming up, Larnaca region’s biggest fair returns. The Traditional Christmas Market makes its anticipated annual comeback at Forest Beach, Dekeleia Road, bringing over 200 stalls selling a wide range of food, craft and handmade items from handbags to sweets, candles, baked goods and hundreds of other unique items. The market will include Santa visits, live radio links, hot drinks and food stands. The Livadia Christmas Programme will also bring holiday cheer on December 6, 14, 20 and 28 as the community square fills with music and dance beats, the fam', 'Want an ‘ezbacke uvin’ or ‘mot cantrl’ for Christmas? Write to Santa The time has come again for both the young and old to send in their letters to Santa. This has become one of my favorite Christmas traditions. The letters to Santa we publish each December are often heartwarming and occasionally heartbreaking. They are a reminder of what makes Christmas magical. They are an amusing break from the sometimes jarring news we must print in the paper. And, hey, they might even be beneficial to your brain’s elasticity. It takes some creativity on the reader’s part to figure out just what the little kiddies are asking for, since we publish the letters verbatim. Try to decipher these phrases from previous Santa letters: I’m looking forward to the, umm, creative writing in this year’s batch of letters. We will publish Santa letters from children and adults in north central Idaho and southeastern Washington. The letters can be just a few words if you have a short wish list, but please try to write no more than 300 words. Be sure to include the author’s name, age and town of residence. The letters can be emailed to city@lmtribune.com, sent in the mail to Letters to Santa, Lewiston Tribune, 505 Capital St., Lewiston, ID 83501, or dropped off at our office. The', 'Want an ‘ezbacke uvin’ or ‘mot cantrl’ for Christmas? Write to Santa The time has come again for both the young and old to send in their letters to Santa. This has become one of my favorite Christmas traditions. The letters to Santa we publish each December are often heartwarming and occasionally heartbreaking. They are a reminder of what makes Christmas magical. They are an amusing break from the sometimes jarring news we must print in the paper. And, hey, they might even be beneficial to your brain’s elasticity. It takes some creativity on the reader’s part to figure out just what the little kiddies are asking for, since we publish the letters verbatim. Try to decipher these phrases from previous Santa letters: I’m looking forward to the, umm, creative writing in this year’s batch of letters. We will publish Santa letters from children and adults in north central Idaho and southeastern Washington. The letters can be just a few words if you have a short wish list, but please try to write no more than 300 words. Be sure to include the author’s name, age and town of residence. The letters can be emailed to city@lmtribune.com, sent in the mail to Letters to Santa, Lewiston Tribune, 505 Capital St., Lewiston, ID 83501, or dropped off at our office. The']"
34,12,34_pitches_pitch_inning_garza,"['pitches', 'pitch', 'inning', 'garza', 'major league', 'softball', 'prospects', 'starter', 'davis', 'aaron']","['When it comes to starting pitching, Yankees future is bright TAMPA, Fla. — It remains to be seen if Ryan Weathers, the hard-throwing lefty the New York Yankees acquired over the winter, is going to be the rotation “find” they envisioned after surrendering four prospects to the Miami Marlins for him. Another rough outing against the Atlanta Braves Friday ballooned Weathers’ spring ERA to 8.68 for three starts, which is about the only not-so-good news out of the Yankee camp this spring. But fret not Yankee legions. For even if Weathers continues to fall short of the front office’s glowing expectations, when it comes to starting pitching, the Yankees’ future couldn’t be brighter. For in Carlos Lagrange, Elmer Rodriguez and Ben Hess, all of whom lit up the radar guns and wowed the scouts in their brief spring outings before being shipped off to the minor league camp, the Yankees have three legitimate top-tier starting pitching prospects in all of baseball. It’s not a matter of if they will maintain their dominance to the big league level but when. Javascript is required for you to be able to read premium content. Please enable it in your browser settings.', ""Braves' Schwellenbach undergoes surgery; procedure on tap for Waldrep Hurston Waldrep FILE - Atlanta Braves' Spencer Schwellenbach pitches to a San Francisco Giants batter during the first inning of a baseball game, June 6, 2025, in San Francisco. (AP Photo/Godofredo A. Vásquez, File) NORTH PORT, Fla. — Atlanta Braves right-handed starter Spencer Schwellenbach had surgery Wednesday to clean up “loose bodies” in his elbow, and rotation candidate Hurston Waldrep is scheduled to undergo a similar procedure next week. While the Braves didn’t reveal a timeline for when the pitchers could be available, manager Walt Weiss told reporters Wednesday that he is hopeful that both will be able to pitch this season. Schwellenbach was placed on the 60-day injured list on Feb. 10, at the start of spring training, because of inflammation in his right elbow. The 25-year-old was 7-4 with a 3.08 ERA in 17 starts last year before missing the final three months of the season because of a broken right elbow. Waldrep, the Braves’ first-round pick out of Florida in the 2023 amateur draft, experienced discomfort after throwing batting practice over the weekend. An MRI showed no ligament damage for the pitcher who turns 24 on March 1. Before getting hurt last season, Schwellen"", ""Braves will begin season without starters Schwellenbach and Waldrep NORTH PORT, Fla. — Atlanta Braves right-handed starter Spencer Schwellenbach had surgery Wednesday to clean up “loose bodies” in his elbow, and rotation candidate Hurston Waldrep is scheduled to undergo a similar procedure next week. While the Braves didn't reveal a timeline for when the pitchers could be available, manager Walt Weiss told reporters Wednesday that he is hopeful that both will be able to pitch this season. Javascript is required for you to be able to read premium content. Please enable it in your browser settings. Copyright 2026 The Associated Press. All rights reserved. This material may not be published, broadcast, rewritten or redistributed without permission. Please log in, or sign up for a new, free account to read or post comments. Log In Keep it Clean. Please avoid obscene, vulgar, lewd, racist or sexually-oriented language. PLEASE TURN OFF YOUR CAPS LOCK. Don't Threaten. Threats of harming another person will not be tolerated. Be Truthful. Don't knowingly lie about anyone or anything. Be Nice. No racism, sexism or any sort of -ism that is degrading to another person. Be Proactive. Use the 'Report' link on each comment to let us know of abusive posts. Share w""]"
