Topic,Count,Name,Representation,Representative_Docs
41,14,41_manila_philippines_philippine_manila philippines,"['manila', 'philippines', 'philippine', 'manila philippines', 'finance ministry', 'smuggling', 'corruption', 'bureau', 'marcos', 'arrest']","['JV: Philippines still facing urgent housing crisis, warns of worsening backlog Senator JV Ejercito stressed the urgency of addressing the Philippines’ deepening housing crisis, warning that the country could need around 22 million housing units by 2040 amid a widening backlog and millions of informal settlers. At the Senate, Ejercito cited current estimates showing a housing backlog of 2.2 million units and around 3.7 million informal settler families (ISFs), underscoring what he described as a growing national shortage of decent and affordable housing. “Behind these numbers are extended families in cramped up spaces and shared bedrooms, those who would rather put food on the table than pay for a bigger house,” Ejercito said, adding that even minimum wage earners and members of the middle class continue to struggle with long-term housing security and remain renters. He emphasized that the country’s housing situation reflects a broader systemic issue, where “there is no sufficient housing security for ordinary Filipinos.” As principal author of Republic Act No. 11201, which created the Department of Human Settlements and Urban Development (DSHUD), Ejercito reiterated that the law was designed to streamline housing policies and consolidate government functions', ""'There na ‘Yan!': The Palawan promise to OFW families MANILA, Philippines — For millions of Filipino families, Overseas Filipino Workers (OFWs) are everyday heroes who carry the weight of sacrifice so their loved ones can build better lives back home. Every remittance tells a story of love, resilience and deep responsibility. In tribute to these modern-day heroes, Palawan Group of Companies launches its “There Na” campaign, shining a spotlight on OFWs and reinforcing the value of fast, reliable and accessible international remittance services. Through Palawan Express Pera Padala and PalawanPay, families can receive support quickly and securely via more than 45 international remittance partners and thousands of branches nationwide or via the app anytime, anywhere, ensuring that distance never becomes a barrier to care. In their recent commercial, the “There Na” message comes alive through real stories of overseas Filipino workers, whom many Filipinos regard as modern-day heroes. A construction worker in Dubai sends his son’s allowance for school in Luzon, while a seafarer in Alaska sends funds to her wife in the Visayas, and OFWs in Hong Kong also send financial support, showing that distance is no longer a barrier. Bringing this messa"", 'BIR files tax raps vs. Wawao Builders over ghost project in Bulacan MANILA – In line with the whole-of-government effort to combat corruption in infrastructure projects exposed by President Ferdinand R. Marcos Jr., the Bureau of Internal Revenue (BIR) on Thursday filed criminal complaints before the Department of Justice (DOJ) against Mark Allan Villamor Arevalo, sole proprietor of Wawao Builders. The charges are in connection with an estimated PHP48.39 million tax deficiency arising from a ghost flood-control project of Wawao Builders in Malolos City, Bulacan in 2024. According to the criminal complaints, Wawao violated Sections 254 and 255 of the National Internal Revenue Code of 1997, as amended, by committing tax evasion and failing to supply correct and accurate information in its filings of income tax and value-added tax (VAT) returns for the first and second quarters of 2024. BIR Commissioner Charlito Martin Mendoza said the tax compliance investigation is also in line with Finance Secretary Frederick Go’s directive to prioritize tax violations connected to irregular government projects. “This case reflects the BIR’s active participation in the President’s anti-corruption crusade,” Mendoza said as quoted in a news release. “While other agenc']"
42,13,42_tariffs imposed_tariffs_tariff_trade agreement,"['tariffs imposed', 'tariffs', 'tariff', 'trade agreement', 'international trade', 'president donald', 'supreme court', 'pence', 'trump', 'vice president']","[""Groups ask trade court to pause Trump's new tariffs amid legal fight (The Center Square) – Several groups joined together to ask a Manhattan trade court to pause President Donald Trump's latest wave of tariffs as states and small businesses move ahead with legal challenges. A coalition of advocacy groups is urging the U.S. Court of International Trade to halt President Donald Trump's newly imposed tariffs, calling the measures both unprecedented and potentially unconstitutional. Their legal challenge follows the president's imposition of a 10% tariff on all imports under a rarely used provision, Section 122 of the Trade Act of 1974, just hours after the Supreme Court struck down his previous tariffs. Critics warn that allowing the continued collection of these tariffs could cause significant financial hardship for importers and ignite new debates over the scope of executive power. Trump invoked Section 122 of the Trade Act of 1974 to impose a 10% tariff on all imports, acting swiftly after the U.S. Supreme Court struck down his earlier tariffs under a different statute. Because Section 122 has never been applied in this context, its constitutionality and legal boundaries remain untested in court. Groups, including former Vice President Mike Pence's"", ""Groups ask trade court to pause Trump's new tariffs amid legal fight (The Center Square) – Several groups joined together to ask a Manhattan trade court to pause President Donald Trump's latest wave of tariffs as states and small businesses move ahead with legal challenges. A coalition of advocacy groups is urging the U.S. Court of International Trade to halt President Donald Trump's newly imposed tariffs, calling the measures both unprecedented and potentially unconstitutional. Their legal challenge follows the president's imposition of a 10% tariff on all imports under a rarely used provision, Section 122 of the Trade Act of 1974, just hours after the Supreme Court struck down his previous tariffs. Critics warn that allowing the continued collection of these tariffs could cause significant financial hardship for importers and ignite new debates over the scope of executive power. Trump invoked Section 122 of the Trade Act of 1974 to impose a 10% tariff on all imports, acting swiftly after the U.S. Supreme Court struck down his earlier tariffs under a different statute. Because Section 122 has never been applied in this context, its constitutionality and legal boundaries remain untested in court. Groups, including former Vice President Mike Pence's"", ""Groups ask trade court to pause Trump's new tariffs amid legal fight (The Center Square) – Several groups joined together to ask a Manhattan trade court to pause President Donald Trump's latest wave of tariffs as states and small businesses move ahead with legal challenges. A coalition of advocacy groups is urging the U.S. Court of International Trade to halt President Donald Trump's newly imposed tariffs, calling the measures both unprecedented and potentially unconstitutional. Their legal challenge follows the president's imposition of a 10% tariff on all imports under a rarely used provision, Section 122 of the Trade Act of 1974, just hours after the Supreme Court struck down his previous tariffs. Critics warn that allowing the continued collection of these tariffs could cause significant financial hardship for importers and ignite new debates over the scope of executive power. Trump invoked Section 122 of the Trade Act of 1974 to impose a 10% tariff on all imports, acting swiftly after the U.S. Supreme Court struck down his earlier tariffs under a different statute. Because Section 122 has never been applied in this context, its constitutionality and legal boundaries remain untested in court. Groups, including former Vice President Mike Pence's""]"
43,13,43_appliances_appliance_kitchen_grocery,"['appliances', 'appliance', 'kitchen', 'grocery', 'stainless steel', 'openers', 'brands', 'products', 'staples', 'retailers']","[""10 High-End Kitchen Items From Costco Worth Every Penny Costco has more than bulk groceries and Kirkland Signature products. The warehouse also has some excellent high-end kitchen tools and appliances that make cooking easier and help build your ideal smart kitchen. Trusted name brands are sold at excellent prices, including everything from refrigerators and kitchen faucets to mixers, coffee makers, and more. You typically save money when buying kitchen appliances at Costco because their prices may be lower than other retailers and they offer the Costco Direct and Spend & Save online. Buying appliances at Costco comes with the additional benefit of free returns — and for larger appliances, the warehouse offers free installation and even haul away, which all add to the value of the products. We collected some of the top-rated kitchen tools and appliances sold at Costco and found the best of the best. These products from trusted brands all have more than four stars across hundreds, and in some cases, thousands, of customer reviews, so deciding which appliances are worth your money is made simple. If you're stocking a new kitchen or looking to replace some beat-up pots and pans, it's far less expensive to purchase cookware in a set than to"", ""The Old-School Kitchen Appliance Nobody Uses Anymore For all the problems plaguing our daily lives, there's one modern miracle we can always count on: refrigeration. We don't have to wonder how we'll keep our items cold and fresh. Instead, we're asking ourselves how to choose a more energy-efficient refrigerator or trying to figure out whether stainless steel or black would be the better finish. Before people relied on refrigeration, they had tons of other methods of preserving food, like canning, pickling, drying, curing, or fermenting foods. Many of these techniques are still used today, often for flavor enhancement or bulk item storage rather than basic food safety. People also relied on one retro appliance to keep their items chilly, the ice box. Once a staple for storing perishables, it has now almost entirely disappeared from modern American kitchens. It's one of the appliances that some older generations may remember, but not one of the kitchen essentials you'll still find today. More efficient electric refrigerators and freezers now handle the job, but back in the day, households relied on an ice delivery and their ice box to keep items fresh. Read more: 12 Once-Popular Kitchen Trends That Won't Be Coming Back Anytime Soon Ic"", ""Kitchen Appliance Experts Say These Are the 4 Best Electric Can Openers We've been independently researching and testing products for over 120 years. If you buy through our links, we may earn a commission. Learn more about our review process. If you keep a pantry stocked with canned staples like tomatoes, tuna, and beans, you need a quality can opener. While a manual can opener works fine, an electric model gets the job done in a fraction of the time and with much less effort. Along with my expert colleagues in the Good Housekeeping Institute Kitchen & Cooking Lab, I tested nine electric can openers. As a trained chef and food writer, I care about efficiency, quality, and safety in every kitchen appliance. After running each product through the same series of tests for ease of use and performance, I strongly recommend these four openers. Cuisinart's stainless steel electric can opener has a sleek design that looks more high-end than others, which might be important if you plan to keep it on the kitchen counter. It also has a sturdy, wide base and grippy rubber feet that keep the can and opener stable during use. During our tests, the magnet securely held cans up to 32 ounces, and the auto shut-off feature worked every time. It was even tall enough to o""]"
44,13,44_strike_union_labor_protest,"['strike', 'union', 'labor', 'protest', 'union president', 'wages', 'workers', 'staffing', 'vancouver', 'committee']","['B.C. Nurses Union says bargaining at an impasse, strike vote likely Published 1:39 pm Wednesday, April 22, 2026 By Lauren Collins B.C. Nurses Union president Adriane Gear speaks at a protest May 31, 2023 that saw hundreds of nurses in town for a conference march along the streets of Vancouver calling for safer staffing levels. (Lauren Collins/Black Press Media) The B.C. Nurses’ Union says bargaining is at an impasse after “limited movement at the table.” The union now says a strike vote is likely, according to a post on the union’s Facebook on April 21. In a bargaining update email obtained by Black Press Media, the B.C. Nurses Union said that after a call Monday night (April 20) the union’s council unanimously voted to endorse the bargaining committee’s to declare an impasse, step away from the bargaining table and authorize a strike vote.” The union is now urging members to vote “yes” in a strike vote to show their support. A “yes” vote doesn’t mean an immediate strike. The impasse follows a recent ruling from arbitrator Vince Ready regarding massage therapy benefits. “This is a step backwards,” the email reads. “These benefits are not luxuries. They are essential.” The email says that Ready’s decision threatens the benefits that members rely on.', 'B.C. Nurses Union says bargaining at an impasse, strike vote likely Published 1:39 pm Wednesday, April 22, 2026 By Lauren Collins B.C. Nurses Union president Adriane Gear speaks at a protest May 31, 2023 that saw hundreds of nurses in town for a conference march along the streets of Vancouver calling for safer staffing levels. (Lauren Collins/Black Press Media) The B.C. Nurses’ Union says bargaining is at an impasse after “limited movement at the table.” The union now says a strike vote is likely, according to a post on the union’s Facebook on April 21. In a bargaining update email obtained by Black Press Media, the B.C. Nurses Union said that after a call Monday night (April 20) the union’s council unanimously voted to endorse the bargaining committee’s to declare an impasse, step away from the bargaining table and authorize a strike vote.” The union is now urging members to vote “yes” in a strike vote to show their support. A “yes” vote doesn’t mean an immediate strike. The impasse follows a recent ruling from arbitrator Vince Ready regarding massage therapy benefits. “This is a step backwards,” the email reads. “These benefits are not luxuries. They are essential.” The email says that Ready’s decision threatens the benefits that members rely on.', 'B.C. Nurses Union says bargaining at an impasse, strike vote likely Published 1:39 pm Wednesday, April 22, 2026 By Lauren Collins B.C. Nurses Union president Adriane Gear speaks at a protest May 31, 2023 that saw hundreds of nurses in town for a conference march along the streets of Vancouver calling for safer staffing levels. (Lauren Collins/Black Press Media) The B.C. Nurses’ Union says bargaining is at an impasse after “limited movement at the table.” The union now says a strike vote is likely, according to a post on the union’s Facebook on April 21. In a bargaining update email obtained by Black Press Media, the B.C. Nurses Union said that after a call Monday night (April 20) the union’s council unanimously voted to endorse the bargaining committee’s to declare an impasse, step away from the bargaining table and authorize a strike vote.” The union is now urging members to vote “yes” in a strike vote to show their support. A “yes” vote doesn’t mean an immediate strike. The impasse follows a recent ruling from arbitrator Vince Ready regarding massage therapy benefits. “This is a step backwards,” the email reads. “These benefits are not luxuries. They are essential.” The email says that Ready’s decision threatens the benefits that members rely on.']"
45,12,45_snow_winter storm_cold weather_winter,"['snow', 'winter storm', 'cold weather', 'winter', 'driving conditions', 'weather', 'freezing', 'rain', 'temperatures', 'chicago']","[""Adopt the 'penguin protocol': Experts give cold-weather safety tips As temperatures drop, the risk of house fires rises. AccuWeather's Geoff Cornish explains why. For big parts of the United States, the past few days have brought lots of snow and lots of cold. Where there's snow and cold, there are slips, falls and ice-related injuries. Ice forms along the shore of Lake Michigan on Jan. 23 in Chicago. A man digs out his car on Beacon Hill following a winter storm that dumped more than a foot of snow across the region Monday in Boston. A woman walks across the campus of the University of Mississippi Monday in Oxford, Miss., following a weekend ice storm. Freezing rain and sleet are responsible for some of the most dangerous driving conditions during the winter. AccuWeather's Anna Azallion offers the best safety tips if driving on ice is unavoidable. A person walks across a street during a winter storm in Philadelphia, Sunday, Jan. 25, 2026. (AP Photo/Matt Rourke) A person jogs at JFK Plaza, also knows as Love Park during a winter storm in Philadelphia, Sunday, Jan. 25, 2026. (AP Photo/Matt Rourke) A worker throws salt onto the pavement to melt ice in downtown Indianapolis, on Sunday, Jan. 25, 2026. (AP Photo/Obed Lamy) Emilia O'Brien, of Michigan, s"", ""Adopt the 'penguin protocol': Experts give cold-weather safety tips As temperatures drop, the risk of house fires rises. AccuWeather's Geoff Cornish explains why. For big parts of the United States, the past few days have brought lots of snow and lots of cold. Where there's snow and cold, there are slips, falls and ice-related injuries. Ice forms along the shore of Lake Michigan on Jan. 23 in Chicago. A man digs out his car on Beacon Hill following a winter storm that dumped more than a foot of snow across the region Monday in Boston. A woman walks across the campus of the University of Mississippi Monday in Oxford, Miss., following a weekend ice storm. Freezing rain and sleet are responsible for some of the most dangerous driving conditions during the winter. AccuWeather's Anna Azallion offers the best safety tips if driving on ice is unavoidable. A person walks across a street during a winter storm in Philadelphia, Sunday, Jan. 25, 2026. (AP Photo/Matt Rourke) A person jogs at JFK Plaza, also knows as Love Park during a winter storm in Philadelphia, Sunday, Jan. 25, 2026. (AP Photo/Matt Rourke) A worker throws salt onto the pavement to melt ice in downtown Indianapolis, on Sunday, Jan. 25, 2026. (AP Photo/Obed Lamy) Emilia O'Brien, of Michigan, s"", ""Adopt the 'penguin protocol': Experts give cold-weather safety tips As temperatures drop, the risk of house fires rises. AccuWeather's Geoff Cornish explains why. For big parts of the United States, the past few days have brought lots of snow and lots of cold. Where there's snow and cold, there are slips, falls and ice-related injuries. Ice forms along the shore of Lake Michigan on Jan. 23 in Chicago. A man digs out his car on Beacon Hill following a winter storm that dumped more than a foot of snow across the region Monday in Boston. A woman walks across the campus of the University of Mississippi Monday in Oxford, Miss., following a weekend ice storm. Freezing rain and sleet are responsible for some of the most dangerous driving conditions during the winter. AccuWeather's Anna Azallion offers the best safety tips if driving on ice is unavoidable. A person walks across a street during a winter storm in Philadelphia, Sunday, Jan. 25, 2026. (AP Photo/Matt Rourke) A person jogs at JFK Plaza, also knows as Love Park during a winter storm in Philadelphia, Sunday, Jan. 25, 2026. (AP Photo/Matt Rourke) A worker throws salt onto the pavement to melt ice in downtown Indianapolis, on Sunday, Jan. 25, 2026. (AP Photo/Obed Lamy) Emilia O'Brien, of Michigan, s""]"
46,12,46_welfare_security benefits_disability_pensioners,"['welfare', 'security benefits', 'disability', 'pensioners', 'rising costs', 'social security', 'premiums', 'mps', 'energy bills', 'taxpayers']","['How much will DWP benefits and pensions rise following the budget? Benefits Budget 2025 Child Benefit Department for Work and Pensions DWP Pensions PIP Rachel Reeves Universal Credit National government Personal Finance DWP benefits including Universal Credit, Child Benefit, PIP, Carer\'s Allowance, and the State Pension are to increase in April 2026 after Rachel Reeves announced higher payments in her budget speech today. Anyone who claims DWP benefits should be in line for an increase in the next financial year, as the chancellor laid out plans to help pensioners, disabled people, parents, low earners, carers and unemployed people keep up with rising costs. Addressing MPs, Ms Reeves said: ""The broken welfare system that we inherited wrote off millions of people as too sick to work and we will reform that system so that it is a system that does not count the cost of failure, but one that protects people who cannot work and empowers those who can. ""We have brought back face-to-face assessments for disability benefits. Those are the face-to-face assessments that the shadow chancellor (Sir Mel Stride) got rid of when he was work and pensions secretary and our changes we have made to Universal Credit will get 15,000 people back into work, a figure con', 'How much will DWP benefits and pensions rise following the budget? Benefits Budget 2025 Child Benefit Department for Work and Pensions DWP Pensions PIP Rachel Reeves Universal Credit National government Personal Finance DWP benefits including Universal Credit, Child Benefit, PIP, Carer\'s Allowance, and the State Pension are to increase in April 2026 after Rachel Reeves announced higher payments in her budget speech today. Anyone who claims DWP benefits should be in line for an increase in the next financial year, as the chancellor laid out plans to help pensioners, disabled people, parents, low earners, carers and unemployed people keep up with rising costs. Addressing MPs, Ms Reeves said: ""The broken welfare system that we inherited wrote off millions of people as too sick to work and we will reform that system so that it is a system that does not count the cost of failure, but one that protects people who cannot work and empowers those who can. ""We have brought back face-to-face assessments for disability benefits. Those are the face-to-face assessments that the shadow chancellor (Sir Mel Stride) got rid of when he was work and pensions secretary and our changes we have made to Universal Credit will get 15,000 people back into work, a figure con', 'How much will DWP benefits and pensions rise following the budget? Benefits Budget 2025 Child Benefit Department for Work and Pensions DWP Pensions PIP Rachel Reeves Universal Credit National government Personal Finance DWP benefits including Universal Credit, Child Benefit, PIP, Carer\'s Allowance, and the State Pension are to increase in April 2026 after Rachel Reeves announced higher payments in her budget speech today. Anyone who claims DWP benefits should be in line for an increase in the next financial year, as the chancellor laid out plans to help pensioners, disabled people, parents, low earners, carers and unemployed people keep up with rising costs. Addressing MPs, Ms Reeves said: ""The broken welfare system that we inherited wrote off millions of people as too sick to work and we will reform that system so that it is a system that does not count the cost of failure, but one that protects people who cannot work and empowers those who can. ""We have brought back face-to-face assessments for disability benefits. Those are the face-to-face assessments that the shadow chancellor (Sir Mel Stride) got rid of when he was work and pensions secretary and our changes we have made to Universal Credit will get 15,000 people back into work, a figure con']"
