Topic,Count,Name,Representation,Representative_Docs
23,12,23_tvs_monitors_samsung_display,"['tvs', 'monitors', 'samsung', 'display', 'screen', 'roku', 'tv', 'devices', 'ces', 'budget']","[""Our pick for the best budget TV just dropped to its lowest-ever price on Amazon The best TVs come in all shapes and sizes, and as a result, it can be difficult to know what to buy. One that we'd recommend right now is the Roku Pro Series 65-inch Mini LED QLED TV at Amazon for $799.99 (was $1,199.99) – that's a 33% discount, which drops the TV to its lowest-ever price. But it's not just the price that is worthy of your attention. Thanks to the pairing of mini-LED and QLED technology, the Roku Pro Series offers picture quality that is sharp, vivid, and colorful. It's so good that it's our pick for the best budget TV you can buy, so if you're looking for a top TV without breaking the bank this Black Friday, it could be just the deal for you This TV boasts a lot for the price. 4K resolution. Mini-LED. QLED. Roku interface. 65 inches. What more could you want? Maybe a seriously juicy discount. Yep, that's included as well. You can now save a generous $400 on the Roku TV ahead of Black Friday, making one of our top budget picks even better value for money. Our reviewer of the Roku Pro Series TV gave the set an impressive 4.5 out of five stars. That's excellent, especially given its budget-friendly price tag. The high praise is due to the 4K resolution support and sm"", 'Samsung OLED 48S95H: New 48-inch and 165 Hz OLED TV revealed ahead of schedule with HDR10 Plus Advanced support Samsung has already teased plenty of devices on the eve of CES 2026. However, the trade show has decided to lift the lid on one of Samsung\'s forthcoming OLED Smart TVs. For context, Samsung listed numerous unreleased Smart TVs on its Parts Database over a month ago. Of those, CES has announced that the S95H is a 2026 Honoree in its Gaming & eSports category. Specifically, the trade show has signalled out a 48-inch variant that was missing from November\'s leak. Incidentally, last year\'s S95F only went as small as 55-inches (curr. $1,997 on Amazon). According to the listing, the S95H offers a 165 Hz refresh rate with VRR technology supported. Assuming a 4K resolution from the S95F series and the usage of HDMI 2.1 ports, a 165 Hz refresh rate would require the usage of Display Stream Compression (DSC) to output at its peak resolution and refresh rate simultaneously. Moreover, the new 48-inch Smart TV will support Samsung\'s new HDR10 Plus Advanced format. Pricing and availability are unknown for now; the full description provided by Samsung and CES is as follows: The Samsung OLED (S95H) is the world\'s most advanced 48"" OLED TV for high-end gaming. Combining unparalleled brightness and', ""World's largest monitor company designed a 4K 48-inch OLED dual-sided smart gaming display with metal feet, a magnetic power socket, and an Alienware-inspired sound system - but who will actually use it? Sign up for breaking news, reviews, opinion, top tech deals, and more. You are now subscribed Your newsletter sign-up was successful GP TV has unveiled what it calls the world’s first dual-sided 48-inch 4K OLED television, designed for gaming and sports viewing. The display is intended to deliver immersive experiences on both sides simultaneously, with built-in audio and dynamic lighting effects. TPV Technology Group, the company behind GP TV, claims the screen targets premium users who value high-end visual fidelity, as well as the public sector and government institutions. This design feels unusual because most monitors or televisions sit against a wall or on a desk, making a rear-facing display largely unnecessary. Its relevance only emerges if the screen stands in the center of a room, similar to display setups commonly seen in shopping malls - and even then, deploying such a device in public spaces would increase the risk of physical damage, leaving the practical use case for this product uncertain. It comes with an audio system that integrates surround sound, Dolby Atmos support, and sound tracking that follows on-screen action. Speakers with fabric covers on both sides creat""]"
24,12,24_grocery_groceries_supermarket_retailers,"['grocery', 'groceries', 'supermarket', 'retailers', 'shopping', 'shoppers', 'consumers', 'products', 'sales', 'market']","['Food reporter shares the money-saving hack she uses to score deals on grocery staples: \'Half the price of the grocery store\' If you\'re tired of spending all your hard-earned cash on groceries, check out this food reporter\'s simple hack that will take some of the pressure off your wallet. Buying food doesn\'t have to be expensive. In fact, there are plenty of online grocery stores now that offer affordable, healthy items that can be much cheaper than retail. One of these grocers is Martie, a discount retailer that sells overstock, surplus, and near-best-by goods. Its pantry staples, snacks, and household goods\' prices are significantly reduced (up to 80% off brand-name items). The online store aims to help shoppers save money and reduce food waste. The U.S. wastes around 30-40% of food supplies, according to the U.S. Food and Drug Administration. Retailers like Martie are important in combating food loss and rescuing items that would have likely gone to landfills. A food reporter at Eater revealed that Martie has helped them save on jams, pastas, almond butter, ramen noodles, and more. They described the company as a ""high-end version of the Marshall\'s food aisle."" They even reported spending much less than they would have at a conventional grocery store. ""What clinched my first order was the fact that Mar', 'Convenience Store Market 2031 Outlook – A USD 1001 Bn Opportunity as APAC Leads Growth with Hyper Convenience Store Expansion says a 2026 Mordor Intelligence Report Hyderabad, Jan. 09, 2026 (GLOBE NEWSWIRE) -- According to Mordor Intelligence, the convenience store market valued at around USD 704 billion in 2025, is projected to grow from USD 747 billion in 2026 to USD 1001.6 billion by 2031, growing at a CAGR of 6%. Growth is fueled by urban migration, rising demand for quick-shopping experiences, and the integration of digital ordering, loyalty programs, and payment systems. Retailers are expanding prepared-food offerings, adding EV charging stations, and using real-time analytics to speed up restocking, boosting basket value even as fuel sales fluctuate. Active private-equity deals and M&A continue due to steady cash flows and consistent customer traffic, while regulatory incentives for alternative-energy solutions offer new revenue opportunities. Moderate competition, with top chains holding a limited share, opens room for regional and mid-tier players to gain an edge through localized strategies, diversified products, and data-driven promotions. Regional Market Outlook Asia-Pacific Asia-Pacific is emerging as the fastest-growing region, driven by rising incomes and compact urban living. Retailers in Japan and South Korea focus on hot-food', 'Convenience Store Market 2031 Outlook – A USD 1001 Bn Opportunity as APAC Leads Growth with Hyper Convenience Store Expansion says a 2026 Mordor Intelligence Report Hyderabad, Jan. 09, 2026 (GLOBE NEWSWIRE) -- According to Mordor Intelligence, the convenience store market valued at around USD 704 billion in 2025, is projected to grow from USD 747 billion in 2026 to USD 1001.6 billion by 2031, growing at a CAGR of 6%. Growth is fueled by urban migration, rising demand for quick-shopping experiences, and the integration of digital ordering, loyalty programs, and payment systems. Retailers are expanding prepared-food offerings, adding EV charging stations, and using real-time analytics to speed up restocking, boosting basket value even as fuel sales fluctuate. Active private-equity deals and M&A continue due to steady cash flows and consistent customer traffic, while regulatory incentives for alternative-energy solutions offer new revenue opportunities. Moderate competition, with top chains holding a limited share, opens room for regional and mid-tier players to gain an edge through localized strategies, diversified products, and data-driven promotions. Regional Market Outlook Asia-Pacific Asia-Pacific is emerging as the fastest-growing region, driven by rising incomes and compact urban living. Retailers in Japan and South Korea focus on hot-food']"
25,11,25_nigeria_economic growth_private sector_education,"['nigeria', 'economic growth', 'private sector', 'education', 'economic', 'agricultural', 'productivity', 'reforms', 'curriculum', 'growth']","['Alausa’s skills-focused agenda gets support Education October 30, 2025 by Bola Olajuwon and Victoria Amadi The Minister of Education, Dr. Maruf Tunji Alausa, has embarked on a comprehensive overhaul of the country’s education system since he took over the ministry, moving from the traditional structure towards a skills-focused curriculum and a sustainable education model. A major part of the reforms is the restructuring of the national curriculum for basic, senior secondary and technical education, which commenced this academic year. The ministry had also added new vocational and trade subjects to the curriculum, including digital literacy, solar installation, agricultural entrepreneurship, and garment making. This is intended to entrench practical skills from an early age and prepare students for the demands of the modern job market. According to the minister, the total number of subjects a student would offer would be streamlined across different grade levels to reduce “content overload” and enable deeper learning. The government has converted federal science and technical colleges into modern technical colleges. This includes free tuition and stipends for students, with a curriculum that is 80 per cent practical and 20 pe', 'Madam Yang Yang Pushes Local Talent, Innovation in Industrial Sector Madam Yang Yang, Executive Officer of Zonda Tec Ghana Limited, has reaffirmed the company’s commitment to driving Ghana’s industrial growth through skills development, localisation, and strong community partnerships. Speaking in an interview with the media, Madam Yang outlined how Zonda Tec Ghana has evolved into a major force in the country’s heavy-duty automobile and equipment industry. Under her leadership, the company she said has expanded its footprint across Ghana and the West African sub-region, supplying heavy-duty trucks, construction equipment, and comprehensive technical support services. But beyond market expansion, Madam Yang stressed that Zonda Tec’s mission is rooted in human development. “Our greatest achievement is not measured in the number of trucks we sell, but in the number of Ghanaian youths we empower to build and maintain those trucks,” she said. Over the years, the company has invested heavily in training academies and technical programmes, creating opportunities for artisans, technicians, and engineers to gain industry-relevant skills. Many of these trainees have secured employment in the competitive automobile and machinery sector, a development Madam Yan', 'Vocational education key to unlocking Nigeria’s demographic dividends Nigeria is one of the youngest countries in the world, with over 70 percent of its population under the age of 25. This presents a powerful demographic dividend that could drive innovation, productivity, and economic growth for decades. Yet without urgent and meaningful reforms in the education sector, this opportunity risks becoming a missed advantage. Fixing Nigeria’s education system is not just a policy priority; it is the foundation for unlocking the potential of an entire generation. Experts maintain that beyond the federal government’s policy rhetoric, there are urgent need to amplify vocational and technical education in the country. The pivotal roles of vocational and technical education in tackling unemployment, they say, cannot be overemphasised. Vocational education has been an integral part of development strategies in many developed countries because of its impact on productivity and economic growth. Christopher Itua, head of industrial services and development at the Institute for Industrial Technology (IIT), said vocational skills will not only transform Nigeria’s economy but will also elevate families from poverty. According to a World Bank report, “Nigeria’s pover']"
26,11,26_santa_christmas_holiday season_festive,"['santa', 'christmas', 'holiday season', 'festive', 'holiday', 'presents', 'festival', 'traditions', 'moscow', 'toys']","['Celebrating Christmas in and around Larnaca The city, the suburbs and the villages of Larnaca all get into the festive mood this season as dozens of Christmas events pop up. All around the Larnaca region, markets, workshops and performances will share magical moments for visitors. The SanTa Lefkara Christmas Village is on until January 6 with artists’ stalls, entertainment, craft workshops, children’s activities and concerts taking over the village centre. As one of the deputy ministry of tourism’s eight Christmas Villages, Lefkara is dressed in full holiday glam with glimmering string lights, Christmas trees and a rich, weekly entertainment programme. On December’s first weekend coming up, Larnaca region’s biggest fair returns. The Traditional Christmas Market makes its anticipated annual comeback at Forest Beach, Dekeleia Road, bringing over 200 stalls selling a wide range of food, craft and handmade items from handbags to sweets, candles, baked goods and hundreds of other unique items. The market will include Santa visits, live radio links, hot drinks and food stands. The Livadia Christmas Programme will also bring holiday cheer on December 6, 14, 20 and 28 as the community square fills with music and dance beats, the fam', 'Want an ‘ezbacke uvin’ or ‘mot cantrl’ for Christmas? Write to Santa The time has come again for both the young and old to send in their letters to Santa. This has become one of my favorite Christmas traditions. The letters to Santa we publish each December are often heartwarming and occasionally heartbreaking. They are a reminder of what makes Christmas magical. They are an amusing break from the sometimes jarring news we must print in the paper. And, hey, they might even be beneficial to your brain’s elasticity. It takes some creativity on the reader’s part to figure out just what the little kiddies are asking for, since we publish the letters verbatim. Try to decipher these phrases from previous Santa letters: I’m looking forward to the, umm, creative writing in this year’s batch of letters. We will publish Santa letters from children and adults in north central Idaho and southeastern Washington. The letters can be just a few words if you have a short wish list, but please try to write no more than 300 words. Be sure to include the author’s name, age and town of residence. The letters can be emailed to city@lmtribune.com, sent in the mail to Letters to Santa, Lewiston Tribune, 505 Capital St., Lewiston, ID 83501, or dropped off at our office. The', 'Want an ‘ezbacke uvin’ or ‘mot cantrl’ for Christmas? Write to Santa The time has come again for both the young and old to send in their letters to Santa. This has become one of my favorite Christmas traditions. The letters to Santa we publish each December are often heartwarming and occasionally heartbreaking. They are a reminder of what makes Christmas magical. They are an amusing break from the sometimes jarring news we must print in the paper. And, hey, they might even be beneficial to your brain’s elasticity. It takes some creativity on the reader’s part to figure out just what the little kiddies are asking for, since we publish the letters verbatim. Try to decipher these phrases from previous Santa letters: I’m looking forward to the, umm, creative writing in this year’s batch of letters. We will publish Santa letters from children and adults in north central Idaho and southeastern Washington. The letters can be just a few words if you have a short wish list, but please try to write no more than 300 words. Be sure to include the author’s name, age and town of residence. The letters can be emailed to city@lmtribune.com, sent in the mail to Letters to Santa, Lewiston Tribune, 505 Capital St., Lewiston, ID 83501, or dropped off at our office. The']"
27,11,27_downtown_lewiston_sacramento_shoppers,"['downtown', 'lewiston', 'sacramento', 'shoppers', 'exhibition', 'artists', 'local', 'town', 'store', 'street']","['West Sacramento exhibit at Gallery 1075 features local artists for Black History Month Your contribution directly supports our newsroom. The West Sacramento Department of Parks and Recreation is showcasing art by local Black artists in its Gallery 1075 space through February. “Throughout the rest of the month people can come in anytime the community center is open … to just enjoy the pieces themselves,” gallery curator Evan Harté said. “The art reception [on Feb. 12] though is going to be extra special because we’re going to have the artists actually come out and talk with the community, get to know them and talk about their processes.” One of the artists featured is Sacramento-based Danitta Nelson, who works on her art in-between taking care of her children and working as a program manager at a mental health care facility. Nelson said she loves to do 3D art where she can attach things to her illustrations, especially hair. “My biological father was an artist and my sister was an artist, but they don’t do art anymore,” Nelson said. She added that a brain injury from a car accident means her sister no longer creates art. “So I do it to try and keep it going for the family so it doesn’t just die down.” Nelson said she started actively pursuing presenting in galleries a', 'Oakland County debuts 2025 ‘Local Gems’ contest Some shoppers in Oakland County can win between $250 and $1,000 in November as part of the annual Local Gems Sweepstakes. The rules are pretty simple: Visit one or more of the county’s 6,000-plus small retail businesses, take a selfie at the store and submit the entry to the county. A random drawing of selfies submitted online, in person or by mail determines the winner of the three prizes: $1,000, $500, or $250. Every entry must include a photo of the person inside or outside a local small business. The contest gets underway on Saturday, Nov. 1 and continues through Nov. 30. This year’s contest was launched in downtown Pontiac at Designed Mindfully, an interior-design company. Designed Mindfully was among the 2024’s top vote getters, with HobbyTown and AM2PM Barbershop in Southfield; It’s the Little Things in Ortonville; and Vibrant Vizionz in Oak Park. Designed Mindfully owner Deya Marchand said her shop is more than a small store. “We are a space where community, creativity, and intentional living come together,” she said, adding that Local Gems aligns beautifully with her store’s mission “to live and shop with purpose, supporting other small businesses and local artists.” The n', 'Oakland County debuts 2025 ‘Local Gems’ contest Some shoppers in Oakland County can win between $250 and $1,000 in November as part of the annual Local Gems Sweepstakes. The rules are pretty simple: Visit one or more of the county’s 6,000-plus small retail businesses, take a selfie at the store and submit the entry to the county. A random drawing of selfies submitted online, in person or by mail determines the winner of the three prizes: $1,000, $500, or $250. Every entry must include a photo of the person inside or outside a local small business. The contest gets underway on Saturday, Nov. 1 and continues through Nov. 30. This year’s contest was launched in downtown Pontiac at Designed Mindfully, an interior-design company. Designed Mindfully was among the 2024’s top vote getters, with HobbyTown and AM2PM Barbershop in Southfield; It’s the Little Things in Ortonville; and Vibrant Vizionz in Oak Park. Designed Mindfully owner Deya Marchand said her shop is more than a small store. “We are a space where community, creativity, and intentional living come together,” she said, adding that Local Gems aligns beautifully with her store’s mission “to live and shop with purpose, supporting other small businesses and local artists.” The n']"
28,11,28_government shutdown_groceries_federal_government,"['government shutdown', 'groceries', 'federal', 'government', 'states', 'house washington', 'white house', 'snap', 'president donald', 'produce']","['States scramble to send full SNAP food benefits to millions of people after shutdown ends The US government shutdown finally ended on November 12 after 43 days of budget paralysis – the longest in the nation’s history. Federal operations are resuming, but key issues remain unresolved and tensions in Washington persist. With the longest U.S. government shutdown over, state officials said Thursday they were working quickly to get full SNAP food benefits to millions of people who made do with little to no assistance for the past couple of weeks. A person shops for produce Monday at a grocery store in Baltimore. President Donald Trump signs the funding bill to reopen the government Wednesday in the Oval Office of the White House in Washington. Produce is displayed Monday at a grocery store in Baltimore. Stay up-to-date on the latest in local and national government and political topics with our newsletter. The US government shutdown finally ended on November 12 after 43 days of budget paralysis – the longest in the nation’s history. Federal opera…', 'States scramble to send full SNAP food benefits to millions of people after shutdown ends The US government shutdown finally ended on November 12 after 43 days of budget paralysis – the longest in the nation’s history. Federal operations are resuming, but key issues remain unresolved and tensions in Washington persist. With the longest U.S. government shutdown over, state officials said Thursday they were working quickly to get full SNAP food benefits to millions of people who made do with little to no assistance for the past couple of weeks. A person shops for produce Monday at a grocery store in Baltimore. President Donald Trump signs the funding bill to reopen the government Wednesday in the Oval Office of the White House in Washington. Produce is displayed Monday at a grocery store in Baltimore. Stay up-to-date on the latest in local and national government and political topics with our newsletter. The US government shutdown finally ended on November 12 after 43 days of budget paralysis – the longest in the nation’s history. Federal opera…', 'States scramble to send full SNAP food benefits to millions of people after shutdown ends The US government shutdown finally ended on November 12 after 43 days of budget paralysis – the longest in the nation’s history. Federal operations are resuming, but key issues remain unresolved and tensions in Washington persist. With the longest U.S. government shutdown over, state officials said Thursday they were working quickly to get full SNAP food benefits to millions of people who made do with little to no assistance for the past couple of weeks. A person shops for produce Monday at a grocery store in Baltimore. President Donald Trump signs the funding bill to reopen the government Wednesday in the Oval Office of the White House in Washington. Produce is displayed Monday at a grocery store in Baltimore. Stay up-to-date on the latest in local and national government and political topics with our newsletter. The US government shutdown finally ended on November 12 after 43 days of budget paralysis – the longest in the nation’s history. Federal opera…']"
