Topic,Count,Name,Representation,Representative_Docs
23,17,23_movie_new film_sequel_actor,"['movie', 'new film', 'sequel', 'actor', 'theaters', 'thriller', 'starring', 'brendan', 'netflix', 'fraser']","[""AP Entertainment SummaryBrief at 3:08 p.m. EST Brendan Fraser's new horizons include 'Rental Family' and rental hedgehogs BEDFORD, N.Y. (AP) — “Rental Family” is Brendan Fraser’s first leading role since winning the best actor Oscar for “The Whale.” In it, the 56-year-old plays a struggling actor living in Japan who, out of desperation and curiosity, takes a job with an agency that hires out actors to fulfill roles in real people’s lives. In an interview, Fraser discusses his life since the Oscar win, his eye-opening experiences in Japan and what returning to the “Mummy” series means to him. His time in Japan included a visit to a hedgehog cafe. “Rental Family” opens Friday in theaters. Copyright 2025 The Associated Press. All rights reserved. This material may not be published, broadcast, rewritten or redistributed. Log In Keep it Clean. Please avoid obscene, vulgar, lewd, racist or sexually-oriented language. PLEASE TURN OFF YOUR CAPS LOCK. Don't Threaten. Threats of harming another person will not be tolerated. Be Truthful. Don't knowingly lie about anyone or anything. Be Nice. No racism, sexism or any sort of -ism that is degrading to another person. Be Proactive. Use the 'Report' link on each comment to let us know of abus"", ""AP Entertainment SummaryBrief at 3:08 p.m. EST Brendan Fraser's new horizons include 'Rental Family' and rental hedgehogs BEDFORD, N.Y. (AP) — “Rental Family” is Brendan Fraser’s first leading role since winning the best actor Oscar for “The Whale.” In it, the 56-year-old plays a struggling actor living in Japan who, out of desperation and curiosity, takes a job with an agency that hires out actors to fulfill roles in real people’s lives. In an interview, Fraser discusses his life since the Oscar win, his eye-opening experiences in Japan and what returning to the “Mummy” series means to him. His time in Japan included a visit to a hedgehog cafe. “Rental Family” opens Friday in theaters. Movie Review: Joel Edgerton delivers a profound, understated performance in ‘Train Dreams’ Joel Edgerton plays a logger at the beginning of the 20th century in “Train Dreams.” Clint Bentley's film is an adaptation of Denis Johnson's novella, about the toll of progress and the people left behind. Edgerton stars alongside Felicity Jones and William H. Macy in the meditative film. In her review, Associated Press Film Writer Lindsey Bahr praises Edgerton's understated performance and adds that, “Bentley’s film is haunting and patient, a dreamlike jo"", ""AP Entertainment SummaryBrief at 3:08 p.m. EST Brendan Fraser's new horizons include 'Rental Family' and rental hedgehogs BEDFORD, N.Y. (AP) — “Rental Family” is Brendan Fraser’s first leading role since winning the best actor Oscar for “The Whale.” In it, the 56-year-old plays a struggling actor living in Japan who, out of desperation and curiosity, takes a job with an agency that hires out actors to fulfill roles in real people’s lives. In an interview, Fraser discusses his life since the Oscar win, his eye-opening experiences in Japan and what returning to the “Mummy” series means to him. His time in Japan included a visit to a hedgehog cafe. “Rental Family” opens Friday in theaters. Movie Review: Joel Edgerton delivers a profound, understated performance in ‘Train Dreams’ Joel Edgerton plays a logger at the beginning of the 20th century in “Train Dreams.” Clint Bentley's film is an adaptation of Denis Johnson's novella, about the toll of progress and the people left behind. Edgerton stars alongside Felicity Jones and William H. Macy in the meditative film. In her review, Associated Press Film Writer Lindsey Bahr praises Edgerton's understated performance and adds that, “Bentley’s film is haunting and patient, a dreamlike jo""]"
24,16,24_hockey team_hockey_winter olympics_olympics,"['hockey team', 'hockey', 'winter olympics', 'olympics', 'women team', 'olympic', 'curling', 'gold medal', 'opening ceremony', 'athletes']","['Team USA Women’s Ice Hockey: How to Watch the 2026 Winter Olympics Event Live Online for Free If you purchase an independently reviewed product or service through a link on our website, The Hollywood Reporter may receive an affiliate commission. The 2026 Winter Olympics officially starts on Friday, Feb. 6 with the opening ceremony in Milano Cortina, Italy. However, there are a few events, like curling, that start early for group play, preliminaries and qualifying rounds. Countries, like Sweden, Germany, France, Italy, United States and others, compete in Women’s Ice Hockey to start the medal tournament. In addition, this is the first Winter Olympics featuring pro players from the PWHL (Professional Women’s Hockey League) participating in the games. Starting on Wednesday, Feb. 4, women’s ice hockey (preliminary rounds and group play) starts at 3:10 a.m. PT/6:10 a.m. ET and broadcasts on NBC, USA Network and CNBC, as well as livestream on Peacock. Related Stories TV How to Watch Chloe Kim Snowboarding at the 2026 Winter Olympics in Milan Live Online for Free TV How to Watch the 2026 Winter Olympics Live Online At a Glance: How to Watch 2026 Women’s Ice Hockey at the Winter Olympics Online The simplest way to watch Winter Olympics Women’s Ice Hockey without cable is by signing', 'U.S. Women’s Hockey Team declines Trump invite to State of the Union The U.S. Women’s Hockey Team declined an invite to President Donald Trump‘s State of the Union address on Monday, shortly after a clip of Trump making light of the women’s team made the rounds. Both American squads won gold at the 2026 Winter Olympics in Milan, taking down the Canadian team in their respective finals. On Sunday, Trump invited the men’s team to his annual speech and joked about the inclusion of the women’s team. “I must tell you, we’re going to have to bring the women’s team, you do know that,” Trump said, adding that he “probably would be impeached” if he didn’t. Everything about this is so genuinely gross but the “I guess I have to invite the women’s team too or else I’ll get impeached” is fucking crazy. Britta Curl is that your boy? Abbey Murphy you cool with this? pic.twitter.com/dTgpBF7hda — Maya🇵🇸🇱🇧 (@ilyasamsHOEnov) February 23, 2026 Related Trump celebrated the men’s hockey win on social media, lauding the team on Truth Social after their overtime victory. “Congratulations to our great U.S.A. Ice Hockey team. THEY WON THE GOLD. WOW!” he wrote. When the women’s team won just days earlier, Trump remained silent. Start your day with essential news from Salon. S', 'U.S. Women’s Hockey Team declines Trump invite to State of the Union The U.S. Women’s Hockey Team declined an invite to President Donald Trump‘s State of the Union address on Monday, shortly after a clip of Trump making light of the women’s team made the rounds. Both American squads won gold at the 2026 Winter Olympics in Milan, taking down the Canadian team in their respective finals. On Sunday, Trump invited the men’s team to his annual speech and joked about the inclusion of the women’s team. “I must tell you, we’re going to have to bring the women’s team, you do know that,” Trump said, adding that he “probably would be impeached” if he didn’t. Trump celebrated the men’s hockey win on social media, lauding the team on Truth Social after their overtime victory. “Congratulations to our great U.S.A. Ice Hockey team. THEY WON THE GOLD. WOW!” he wrote. When the women’s team won just days earlier, Trump remained silent. Start your day with essential news from Salon. Sign up for our free morning newsletter, Crash Course. On Monday, the women’s team shared in a statement that they would not be attending the State of the Union. The statement made no mention of Trump’s comments, citing “academic and professional commitments” for the athletes’ decision. “We']"
25,16,25_casino_betting_gaming_games,"['casino', 'betting', 'gaming', 'games', 'platforms', 'slots', 'playstation', 'servers', 'nhl', 'interactive']","[""New Online Casinos 2025: Lucky Creek Ranked High For New U.S. Players New players gain fast access to bonuses, smooth payouts, and a broad gaming lineup Lucky Creek offers strong bonuses, steady payouts, and a wide range of games for new players A leading 2025 option for U.S. beginners seeking secure payouts and a large game selection Lucky Creek delivers fast rewards, clear navigation, and a wide mix of games for first-time players Las Vegas, Nov. 15, 2025 (GLOBE NEWSWIRE) -- CasinoTop10 has ranked Lucky Creek Casino as the best online gaming casino for new players, offering them a premium experience from the outset. The casino has solidified its position as the best for beginners, as they kick-start their online gaming journeys through its fast payouts, extensive gaming collection, and 24/7 customer support. Lucky Creek prioritizes player satisfaction at every step, whether you're topping up your account or cashing out after a productive gaming session. New players are greeted with a generous 200% match bonus of up to $7,000, plus 200 free spins over 5 days as a welcome bonus to explore the platform and wager on their favorite games without stretching their budget. The magic does not end there. Lucky Creek continues to celebrate players as they con"", ""AGS Interactive Expands Its UK Presence with bet365 Partnership LAS VEGAS, Dec. 05, 2025 (GLOBE NEWSWIRE) -- AGS Interactive (AGSi) has solidified its presence across the pond, taking a selection of its best-performing games live in the UK with bet365. This announcement further cements AGS’ partnership with bet365 building on existing collaborations in the United States, Canada, and Latin America. bet365’s established UK market position and diverse global presence make them a logical strategic partner to support AGS’ global growth initiatives throughout Europe and beyond. At the time of launch, bet365 players across the UK will have access to more than 20 popular game titles from AGS' interactive content library. Notable titles include: “We’ve worked closely with bet365 for years and extending our partnership to the UK is an important milestone for AGS,” said Zoe Ebling, Vice President of Interactive at AGS. “It not only reflects the strength of our relationship, but the growing global appeal and potential of our increasingly diverse portfolio of high-performing online slot content. This is a clear sign of where AGS is headed — broader reach, more markets, and a rapidly expanding international footprint.” “We’re delighted to welcome a selection"", 'AGS Interactive Expands Its UK Presence with bet365 Partnership LAS VEGAS, Dec. 05, 2025 (GLOBE NEWSWIRE) -- AGS Interactive (AGSi) has solidified its presence across the pond, taking a selection of its best-performing games live in the UK with bet365. This announcement further cements AGS\' partnership with bet365 building on existing collaborations in the United States, Canada, and Latin America. bet365\'s established UK market position and diverse global presence make them a logical strategic partner to support AGS\' global growth initiatives throughout Europe and beyond. At the time of launch, bet365 players across the UK will have access to more than 20 popular game titles from AGS\' interactive content library. Notable titles include: ""We\'ve worked closely with bet365 for years and extending our partnership to the UK is an important milestone for AGS,"" said Zoe Ebling, Vice President of Interactive at AGS. ""It not only reflects the strength of our relationship, but the growing global appeal and potential of our increasingly diverse portfolio of high-performing online slot content. This is a clear sign of where AGS is headed — broader reach, more markets, and a rapidly expanding international footprint."" ""We\'re delighted to welcome a selection']"
26,16,26_egypt_egyptian_world largest_tourism,"['egypt', 'egyptian', 'world largest', 'tourism', 'exhibition', 'civilization', 'architecture', 'tourism industry', 'opening ceremony', 'economy']","[""Egypt unveils the world's largest museum dedicated to a single civilization CAIRO (AP) — Egypt is inaugurating on Saturday the Grand Egyptian Museum, two decades in the making, with the aim of drawing more visitors to revitalize the country's tourist industry. Located just outside Cairo on the Giza Plateau which also includes the three pyramids and the Sphinx, the museum will be the world’s largest dedicated to a single civilization. It will display over 50,000 artifacts detailing life in ancient Egypt. World leaders, including monarchs, heads of states and governments, are set to attend the grand opening ceremony, according to the Egyptian presidency which touted the museum as “an exceptional event in the history of human culture and civilization.” The museum is one of the megaprojects championed by President Abdel-Fattah el-Sissi since he took office in 2014. He has embarked on massive investments in infrastructure with the aim of reviving an economy weakened by decades of stagnation and battered by the unrest that followed the 2011 Arab Spring uprising. Preparations for the grand reveal have been shrouded in secrecy. The museum, which was opened for limited visits in recent years, has been closed for the past two weeks. The government has revamped the a"", ""Egypt unveils the world's largest museum dedicated to a single civilization CAIRO (AP) — Egypt is inaugurating on Saturday the Grand Egyptian Museum, two decades in the making, with the aim of drawing more visitors to revitalize the country's tourist industry. Located just outside Cairo on the Giza Plateau which also includes the three pyramids and the Sphinx, the museum will be the world’s largest dedicated to a single civilization. It will display over 50,000 artifacts detailing life in ancient Egypt. World leaders, including monarchs, heads of states and governments, are set to attend the grand opening ceremony, according to the Egyptian presidency which touted the museum as “an exceptional event in the history of human culture and civilization.” The museum is one of the megaprojects championed by President Abdel-Fattah el-Sissi since he took office in 2014. He has embarked on massive investments in infrastructure with the aim of reviving an economy weakened by decades of stagnation and battered by the unrest that followed the 2011 Arab Spring uprising. Preparations for the grand reveal have been shrouded in secrecy. The museum, which was opened for limited visits in recent years, has been closed for the past two weeks. The government has revamped the a"", ""Egypt unveils the world's largest museum dedicated to a single civilization Egypt is inaugurating on Saturday the Grand Egyptian Museum, two decades in the making, with the aim of drawing more visitors to revitalize the country's tourist industry. Located just outside Cairo on the Giza Plateau which also includes the three pyramids and the Sphinx, the museum will be the world’s largest dedicated to a single civilization. It will display over 50,000 artifacts detailing life in ancient Egypt. World leaders, including monarchs, heads of states and governments, are set to attend the grand opening ceremony, according to the Egyptian presidency which touted the museum as “an exceptional event in the history of human culture and civilization.” The museum is one of the megaprojects championed by President Abdel-Fattah el-Sissi since he took office in 2014. He has embarked on massive investments in infrastructure with the aim of reviving an economy weakened by decades of stagnation and battered by the unrest that followed the 2011 Arab Spring uprising. Preparations for the grand reveal have been shrouded in secrecy. The museum, which was opened for limited visits in recent years, has been closed for the past two weeks. The government has revamped the areas around t""]"
27,15,27_education_higher education_curriculum_teaching,"['education', 'higher education', 'curriculum', 'teaching', 'universities', 'inspire', 'students', 'youth', 'helping young', 'colleges']","['Winners of 2025 Queen Elizabeth Prizes for Higher and Further Education Announced Highest National Honour in Education Awarded to 19 Universities and Colleges across the UK LONDON, Nov. 26, 2025 /PRNewswire/ -- His Majesty The King has approved the award of the Queen Elizabeth Prizes for Education to nineteen higher and further education institutions across the United Kingdom. Winners of the Queen Elizabeth Prizes for Higher and Further Education Sixteenth Round | 2024-2026 The University of Edinburgh A world-first Centre for Fire Safety Engineering, conducting internationally significant research and advanced education and training to underpin fire safety design, policy, regulation and innovation throughout the world in both the built and natural environments. Gateshead College A unique employer-led programme that has transformed apprenticeships in the built environment sector, including expansion into Canada, by tackling skills gaps to create a multi-skilled, adaptable workforce, with further expansion into other sectors underway across the UK. Hull College A globally recognised English for Speakers of Other Languages (ESOL) programme using AI-powered digital storytelling, real-time translation, and trauma-informed teaching to transform language learning, boos', ""TEACHING AWARDS TRUST LAUNCHES NEW 'EDUCATION INSIGHTS' EVENT SERIES LONDON, Nov. 17, 2025 /PRNewswire/ -- The Teaching Awards Trust, supported by Nord Anglia Education, is proud to launch Education Insights, a brand new series of education-focused regional events. Starting in January 2026, the events will connect teachers, school leaders, and local decision-makers with leading voices from sport, technology, business, and politics to explore the defining issues shaping young people's lives and how to unlock their full potential. The series opens on 27 January in Manchester with 'A Focus on Resilience', with former 'Educating Yorkshire' student Musharaf Asghar delivering the keynote address. The programme continues throughout February with four further events exploring critical education themes, including future skills and metacognition (helping young people understand how they learn best). Each event will feature a panel of world-class experts who bring both insights and a passion for young people's development. From BAFTA-winning historian David Olusoga OBE and Adrianne Chapman, Vice Principal at the world-renowned BRIT School, to Baroness Floella Benjamin OM DBE DL, speakers will deliver valuable insights to inspire debate, new thinking, and meani"", ""TEACHING AWARDS TRUST LAUNCHES NEW 'EDUCATION INSIGHTS' EVENT SERIES LONDON, Nov. 17, 2025 /PRNewswire/ -- The Teaching Awards Trust, supported by Nord Anglia Education, is proud to launch Education Insights, a brand new series of education-focused regional events. Starting in January 2026, the events will connect teachers, school leaders, and local decision-makers with leading voices from sport, technology, business, and politics to explore the defining issues shaping young people's lives and how to unlock their full potential. The series opens on 27 January in Manchester with 'A Focus on Resilience', with former 'Educating Yorkshire' student Musharaf Asghar delivering the keynote address. The programme continues throughout February with four further events exploring critical education themes, including future skills and metacognition (helping young people understand how they learn best). Each event will feature a panel of world-class experts who bring both insights and a passion for young people's development. From BAFTA-winning historian David Olusoga OBE and Adrianne Chapman, Vice Principal at the world-renowned BRIT School, to Baroness Floella Benjamin OM DBE DL, speakers will deliver valuable insights to inspire debate, new thinking, and meani""]"
28,15,28_prince harry_prince_royal_meghan markle,"['prince harry', 'prince', 'royal', 'meghan markle', 'markle', 'princess', 'billionaire', 'william', 'queen', 'charles']","[""Real reason Andrew's Royal Lodge eviction announcement took so long Andrew hit an all-time royal low last week as it was announced he was to be stripped of all his royal titles and evicted from his 30-room Royal Lodge home. Buckingham Palace made the announcement on Thursday after weeks of Andrew dominating the headlines as a result of scandals involving his past friendship with the late convicted paedophile Jeffrey Epstein. While Andrew has always denied all accusations against him, the King’s brother was aware of how he was being a distraction to the monarchy, and on October 17 said he would no longer use his royal titles. However, King Charles took this a step further by formally removing them from him - a move that many did not see coming. While the King’s actions have been praised, some believe the monarch, 76, took too long to take action, especially over evicting the former prince from his Crown Estate mansion, however Queen Elizabeth's former press secretary Ailsa Anderson has now explained why. READ MORE: Donald Trump breaks silence on Royal Family stripping Andrew of titles READ MORE: Meghan Markle 'wants to be a billionaire' but it won't be from jam Our community members are treated to special offers, promotions, and adverts from us and"", ""Prince Harry spotted for second time on holiday without Meghan Markle Prince Harry has been spotted for a second time this week on his holiday without his wife, Meghan Markle. On Wednesday, the Duke of Sussex was spotted taking part in the St. Regis World Snow Polo Championship in Aspen, Colorado, just hours after he was spotted skiing with close friend Nacho Figueras. The Prince, 41, reportedly was taking part in the polo tournament to stand in for a friend who couldn’t make it. He is believed to have been on the Aspen Valley team. Harry would have most likely been delighted to take part in the event, having played polo for a number of years. READ MORE: Meghan Markle breaks silence after Prince Harry spotted alone on holiday READ MORE: Princess Kate sends coded message at Royal Family Christmas lunch We use your sign-up to provide content in ways you've consented to and to improve our understanding of you. This may include adverts from us and 3rd parties based on our understanding. You can unsubscribe at any time. Read our Privacy Policy The sighting of the prince on the polo field came not long after the duke was spotted skiing at a resort with some male friends. A source told Hello magazine that the duke seemed to be enjoying himself in the mounta"", '\'Harry and Andrew should both be removed from line of succession in royal shake-up\' Former BBC royal correspondent Jennie Bond has shared that she believes Prince Harry and Andrew Mountbatten-Windsor should both face the same fate when it comes to their positions in the line of succession. Harry, who is the King\'s second-born son, stepped down from royal duties in 2020 and has since relocated to the US. The 41-year-old, who lives in California with Meghan Markle and their children, is still fifth in line to the throne, following Prince William and his three children - Prince George, Princess Charlotte and Prince Louis. Disgraced Andrew, who was stripped of his royal titles last year over his connection to the late sex offender Jeffrey Epstein, is still eighth in line to the throne. Andrew\'s position follows Harry and Meghan\'s children, six-year-old Prince Archie and four-year-old Princess Lilibet, who are sixth and seventh in line. Read more: Fans share verdict on whether Meghan and Harry should do more \'royal tours\' Read more: Meghan Markle embarrassed live on SNL with savage Andrew comparison Speaking of Andrew\'s fate, Ms Bond told The Mirror: ""Of course Andrew should be removed from the line of succession. If you are not fit to be a prince, you’re certainly not']"
