Topic,Count,Name,Representation,Representative_Docs
-1,588,-1_usc_students_university_department,"['usc', 'students', 'university', 'department', 'social', 'jobs', 'health', 'federal', 'results', 'community']","[""AHSAA announces fall reclassification Along with Friday’s historic announcement by the Alabama High School Athletic Association (AHSAA) concerning its separation of public and private schools in championship competition, was the announcement of the organization’s reclassification for the next athletic calendar, 2026-27. The public schools will be divided into six classifications instead of the seven of recent years, while the private schools will have two classifications. As in the past, schools will be classified based on enrollment. Javascript is required for you to be able to read premium content. Please enable it in your browser settings. Email Tommy Hicks at tommy@lagniappemobile.com. Log In Keep it Clean. Please avoid obscene, vulgar, lewd, racist or sexually-oriented language. PLEASE TURN OFF YOUR CAPS LOCK. Don't Threaten. Threats of harming another person will not be tolerated. Be Truthful. Don't knowingly lie about anyone or anything. Be Nice. No racism, sexism or any sort of -ism that is degrading to another person. Be Proactive. Use the 'Report' link on each comment to let us know of abusive posts. Share with Us. We'd love to hear eyewitness accounts, the history behind an article. Please log in, or sign up"", ""Inagawa helps pace Drake in 24-19 win over Butler to stay perfect in Pioneer Football League INDIANAPOLIS (AP) — Logan Inagawa threw for 244 yards and a touchdown and Drake remained unbeaten in the Pioneer Football League by beating Butler 24-19 on Saturday. Drake's Isaiah Bragg returned the opening kickoff 32 yards to the Drake 34. On the first play from scrimmage, Nick Herman took the handoff and ran 66 yards to the end zone for a 7-0 Drake (6-2, 5-0) lead. Javascript is required for you to be able to read premium content. Please enable it in your browser settings. Copyright 2025 The Associated Press. All rights reserved. This material may not be published, broadcast, rewritten or redistributed without permission. Log In Keep it Clean. Please avoid obscene, vulgar, lewd, racist or sexually-oriented language. PLEASE TURN OFF YOUR CAPS LOCK. Don't Threaten. Threats of harming another person will not be tolerated. Be Truthful. Don't knowingly lie about anyone or anything. Be Nice. No racism, sexism or any sort of -ism that is degrading to another person. Be Proactive. Use the 'Report' link on each comment to let us know of abusive posts. Share with Us. We'd love to hear eyewitness accounts, the history behind an article. Sorry, there are no recent results for popular commen"", ""Anglo-French star Jane Birkin gets name on bridge over Paris canal Birkin's daughters, singer Lou Doillon and actor and singer Charlotte Gainsbourg attended the ceremony Anglo-French singer and film star Jane Birkin was honoured Saturday by the city she made her home after Paris named a footbridge over one of its canals after her. Birkin's daughters, singer Lou Doillon and actor and singer Charlotte Gainsbourg, were among the guests who attended the ceremony for their mother, who died in 2023 at the age of 76. Javascript is required for you to be able to read premium content. Please enable it in your browser settings. Originally published on doc.afp.com, part of the BLOX Digital Content Exchange. Log In Keep it Clean. Please avoid obscene, vulgar, lewd, racist or sexually-oriented language. PLEASE TURN OFF YOUR CAPS LOCK. Don't Threaten. Threats of harming another person will not be tolerated. Be Truthful. Don't knowingly lie about anyone or anything. Be Nice. No racism, sexism or any sort of -ism that is degrading to another person. Be Proactive. Use the 'Report' link on each comment to let us know of abusive posts. Share with Us. We'd love to hear eyewitness accounts, the history behind an article. Sorry, there are no recent results for popular""]"
0,239,0_nasdaq_stocks_nyse_shares,"['nasdaq', 'stocks', 'nyse', 'shares', 'investors', 'holdings', 'securities', 'companies', 'earnings', 'financial']","['American Century Companies Inc. Purchases 134,358 Shares of Planet Fitness, Inc. $PLNT Posted by Defense World Staff on Nov 26th, 2025 American Century Companies Inc. grew its position in shares of Planet Fitness, Inc. (NYSE:PLNT – Free Report) by 18.6% during the 2nd quarter, according to its most recent filing with the Securities and Exchange Commission (SEC). The firm owned 858,210 shares of the company’s stock after buying an additional 134,358 shares during the period. American Century Companies Inc. owned approximately 1.02% of Planet Fitness worth $93,588,000 at the end of the most recent quarter. A number of other institutional investors also recently modified their holdings of the business. Game Plan Financial Advisors LLC acquired a new position in shares of Planet Fitness in the second quarter valued at about $25,000. Hantz Financial Services Inc. grew its position in shares of Planet Fitness by 964.0% during the 2nd quarter. Hantz Financial Services Inc. now owns 266 shares of the company’s stock worth $29,000 after purchasing an additional 241 shares in the last quarter. Brooklyn Investment Group grew its position in shares of Planet Fitness by 57.8% during the 1st quarter. Brooklyn Investment Group now owns 322 shares of the company’s stock worth $31,00', 'Adams Wealth Management Has $2.71 Million Stake in Schwab US Broad Market ETF $SCHB Posted by Defense World Staff on Dec 15th, 2025 Adams Wealth Management increased its holdings in shares of Schwab US Broad Market ETF (NYSEARCA:SCHB – Free Report) by 26.5% in the second quarter, according to the company in its most recent Form 13F filing with the Securities and Exchange Commission (SEC). The fund owned 113,506 shares of the company’s stock after buying an additional 23,754 shares during the period. Adams Wealth Management’s holdings in Schwab US Broad Market ETF were worth $2,705,000 at the end of the most recent quarter. A number of other hedge funds and other institutional investors have also recently bought and sold shares of the business. Milestones Private Investment Advisors LLC acquired a new position in shares of Schwab US Broad Market ETF in the 2nd quarter valued at $3,619,000. WT Wealth Management grew its stake in shares of Schwab US Broad Market ETF by 0.3% during the second quarter. WT Wealth Management now owns 1,284,069 shares of the company’s stock worth $30,599,000 after purchasing an additional 3,857 shares during the period. Cambridge Financial Group LLC increased its holdings in Schwab US Broad Market ETF by 43.8% in the second quarter. Cambr', 'AA Financial Advisors LLC Buys 37,001 Shares of FS KKR Capital Corp. $FSK Posted by Defense World Staff on Dec 22nd, 2025 AA Financial Advisors LLC increased its stake in shares of FS KKR Capital Corp. (NYSE:FSK – Free Report) by 24.9% during the third quarter, according to the company in its most recent disclosure with the Securities & Exchange Commission. The firm owned 185,859 shares of the company’s stock after acquiring an additional 37,001 shares during the period. AA Financial Advisors LLC’s holdings in FS KKR Capital were worth $2,775,000 as of its most recent SEC filing. A number of other institutional investors and hedge funds have also recently added to or reduced their stakes in the stock. CCLA Investment Management acquired a new stake in shares of FS KKR Capital in the 2nd quarter valued at about $33,463,000. SCS Capital Management LLC bought a new position in shares of FS KKR Capital during the first quarter worth about $10,822,000. Generali Asset Management SPA SGR grew its holdings in shares of FS KKR Capital by 21.7% during the second quarter. Generali Asset Management SPA SGR now owns 2,485,265 shares of the company’s stock worth $51,569,000 after buying an additional 442,374 shares in the last quarter. Wellington Management Group LLP']"
1,191,1_nba_basketball_warriors_head coach,"['nba', 'basketball', 'warriors', 'head coach', 'ncaa', 'coach', 'championship', 'coaching', 'women basketball', 'defense']","['""The things they\'ve never had since Andrew Bogut"" - Udonis Haslem believes Warriors need a true big man to get back on track As a subscriber, you can share up to 3 articles each month with friends for free. Just click “Gift this Article” on this page, then copy the link or enter their email. Gifts are exclusive to subscribers, reset monthly, and each article can be redeemed once. Different people are pointing at various things as the cause or causes of the Golden State Warriors\' struggles this season. Some say it\'s because they don\'t have a consistent second option behind Steph Curry. Others say it\'s because their young guys have not progressed as expected. While some believe it\'s Steve Kerr\'s coaching. Former Miami Heat captain Udonis Haslem thinks that the Dubs\' issues are rooted in the fact that they did not get what they were supposed to receive last offseason. Javascript is required for you to be able to read premium content. Please enable it in your browser settings. Log In Keep it Clean. Please avoid obscene, vulgar, lewd, racist or sexually-oriented language. PLEASE TURN OFF YOUR CAPS LOCK. Don\'t Threaten. Threats of harming another person will not be tolerated. Be Truthful. Don\'t knowingly lie about anyone or anything. Be Nice. No racism, sexism or any sort of -ism that is degrading to another p', ""Cameron Boozer should be the number one overall pick over AJ Dybantsa and Darryn Peterson — He gets criticized for the same reason Luka Doncic did As a subscriber, you can share up to 3 articles each month with friends for free. Just click “Gift this Article” on this page, then copy the link or enter their email. Gifts are exclusive to subscribers, reset monthly, and each article can be redeemed once. Duke's do-it-all power forward Cameron Boozer is hands down the best college player this season. Interestingly, however, he continues to lag in many mock drafts for the number one pick in this year's NBA Draft. Such takes make me wonder what is making pundits and observers continue to be unconvinced that he deserves to be the top pick. Javascript is required for you to be able to read premium content. Please enable it in your browser settings. Log In Keep it Clean. Please avoid obscene, vulgar, lewd, racist or sexually-oriented language. PLEASE TURN OFF YOUR CAPS LOCK. Don't Threaten. Threats of harming another person will not be tolerated. Be Truthful. Don't knowingly lie about anyone or anything. Be Nice. No racism, sexism or any sort of -ism that is degrading to another person. Be Proactive. Use the 'Report' link on each comment to let us know of abusive posts. Share with Us. We'd love to hear eyewitness accounts, the history"", ""Josh Heupel, Tennessee Receive Strong Message From 5-Star RB As a subscriber, you can share up to 3 articles each month with friends for free. Just click “Gift this Article” on this page, then copy the link or enter their email. Gifts are exclusive to subscribers, reset monthly, and each article can be redeemed once. The Tennessee Volunteers had a disappointing season after making their first College Football Playoff in 2024. The Volunteers, under the leadership of head coach Josh Heupel, finished the 2025 season with an 8-5 record. That was after being ranked as high as No. 11 in the country. However, the team struggled down the stretch, losing four of its final seven games. As a result, it is now focused on building a championship contender for the upcoming season. Javascript is required for you to be able to read premium content. Please enable it in your browser settings. Log In Keep it Clean. Please avoid obscene, vulgar, lewd, racist or sexually-oriented language. PLEASE TURN OFF YOUR CAPS LOCK. Don't Threaten. Threats of harming another person will not be tolerated. Be Truthful. Don't knowingly lie about anyone or anything. Be Nice. No racism, sexism or any sort of -ism that is degrading to another person. Be Proactive. Use the 'Report""]"
2,117,2_united_arsenal_villa_chelsea,"['united', 'arsenal', 'villa', 'chelsea', 'injury', 'salah', 'inter', 'milan', 'alexander', 'goal']","['Doku, Bobb, Stones, Rodri, Kovacic latest: Man City injury list for West Ham clash By Oliver Thomas | 18 Dec 2025 08:05, Last updated: 18 Dec 2025 08:09 Manchester City will be looking to win their seventh game in a row in all competitions when they welcome West Ham United to the Etihad Stadium for their latest Premier League fixture on Saturday afternoon. The Citizens are in high spirits after securing their spot in the semi-finals of the EFL Cup with a 2-0 home victory over Brentford on Wednesday night, Prior to that triumph, Pep Guardiola’s men beat Crystal Palace by a 3-0 scoreline in the Premier League to climb up to second place in the table and move to within two points of leaders Arsenal. Here, Sports Mole rounds up Man City’s latest injury and suspension news ahead of the contest against the Hammers. Status: Major doubt Type of injury: Hamstring Possible return date: Unknown Oscar Bobb was forced off with an apparent hamstring injury in the EFL Cup win over Brentford and it remains to be seen whether he will be facing a period on the sidelines. Status: Out Type of injury: Leg Possible return date: January 1 (vs. Sunderland) Jeremy Doku has missed Man City’s last two games with a leg injury and Guardiola expects the winger to be sidelined for the next two', ""Liverpool injury update: Alexander Isak, Alisson Becker and Jeremie Frimpong latest news and return dates Sport | Football Liverpool returned to winning ways with a 2-0 victory over Aston Villa to end their four-game losing streak in the Premier League. Pressure was piling on Arne Slot after the Reds slumped to ninth in the table, but even without a number of key players, the champions were able to sweep Villa aside to move back up to third. They welcome Real Madrid - Trent Alexander-Arnold, Xabi Alonso, et al - to Anfield in midweek, before they take on Manchester City in a mouth-watering encounter at the weekend. But will they have any of their star names back from injury? Ahead of a big few weeks, here’s all the latest Liverpool injury news and return dates... Alexander Isak has endured a tough start to life on Merseyside. Subbed at half-time in Liverpool’s 5-1 win over Frankfurt in the Champions League, Slot later revealed the £125million summer signing had suffered a minor groin injury. “Alexander had to go off at half-time because he felt his groin a little bit. That's a pity,” said Slot. “I've said many times it is such a difficult balance to find with a player that missed three months.” Isak was not in the squad in the 3-2 loss at Brentford, and he also missed out on the Caraba"", ""Liverpool injury update: Alexander Isak, Alisson Becker and Jeremie Frimpong latest news and return dates Liverpool returned to winning ways with a 2-0 victory over Aston Villa to end their four-game losing streak in the Premier League. Pressure was piling on Arne Slot after the Reds slumped to ninth in the table, but even without a number of key players, the champions were able to sweep Villa aside to move back up to third. They welcome Real Madrid - Trent Alexander-Arnold, Xabi Alonso, et al - to Anfield in midweek, before they take on Manchester City in a mouth-watering encounter at the weekend. But will they have any of their star names back from injury? Ahead of a big few weeks, here’s all the latest Liverpool injury news and return dates... Alexander Isak has endured a tough start to life on Merseyside. Subbed at half-time in Liverpool’s 5-1 win over Frankfurt in the Champions League, Slot later revealed the £125million summer signing had suffered a minor groin injury. “Alexander had to go off at half-time because he felt his groin a little bit. That's a pity,” said Slot. “I've said many times it is such a difficult balance to find with a player that missed three months.” Isak was not in the squad in the 3-2 loss at Brentford, and he also missed out on the Carabao Cup defeat agai""]"
3,95,3_mumbai_delhi_singh_maharashtra,"['mumbai', 'delhi', 'singh', 'maharashtra', 'pradesh', 'modi', 'jammu', 'yadav', 'india', 'arrest']","['Rohit Shetty shooting case: six more arrested in connection with firing outside his residence; total accused climbs to 11 Six more accused have been arrested in connection with the firing outside Rohit Shetty’s Juhu residence, taking the total number of arrests in the case to 11. Trending Photos Mumbai: Six more individuals have been arrested in connection with the shooting incident outside filmmaker Rohit Shetty\'s Juhu\'s residence. As per Mumbai Police Crime Branch, the accused were caught in Rajasthan and are being brought to Mumbai. A total of 11 people have been arrested so far. Add Zee News as a Preferred Source Recently, in the wake of the incident, the Indian Motion Picture Producers\' Association (IMPPA) wrote a letter to Maharashtra Chief Minister Devendra Fadnavis, urging the state government\'s intervention to ensure a swift investigation and appropriate security measures. In its letter, IMPPA described the incident as ""deeply concerning"", stating that it has caused ""anxiety and apprehension"" in the film fraternity.The association also noted that such events can create an atmosphere of ""fear and insecurity"" among the artists, producers, and technicians, among others. Also Read | Lawrence Bishnoi gang issues fresh threat to Ranveer Singh and Rohit Shetty, warns of killing ‘entire staff’ if dem', ""Indore News: Minor Injured After Being Hit By Car; CCTV Footage Goes Viral Indore (Madhya Pradesh): A minor boy sustained injuries after being struck by a speeding taxi in Babu Murai Colony under Aerodrome police station limits on Sunday. The incident, which was captured on CCTV and went viral on Tuesday, reportedly occurred while the taxi driver was attempting to flee from a group of people chasing him on two-wheelers. The footage shows the child having a narrow escape from a more serious accident as he was not directly hit by the car but was struck by a parked two-wheeler that was knocked over by the vehicle's impact. The incident occurred while two children were playing on the street. A recklessly driven sedan (registration number MP09AH8097) sped through the colony, colliding with a parked scooter belonging to Dilip Prajapat. The force of the impact caused the scooter to fall onto a boy identified as Aviral, son of Nitesh Sisodia, who was standing nearby. Following the incident, the Aerodrome police registered a case against the driver Rahul Panwar of Sanwer based on a complaint filed by Nitesh Sisodia. According to the victim's family, Aviral sustained leg injuries and was immediately rushed to a private hospital for treatment. Aerodrome police stati"", 'Rahul Narwekar Denies Allegations After Viral Video Allegedly Shows Him Threatening BMC Polls Candidates, Disrupting Nomination In Mumbai Mumbai: A major political controversy erupted in Maharashtra after a video allegedly showing Assembly Speaker Rahul Narwekar threatening opposition leaders during the filing of nomination papers went viral on social media. The incident triggered sharp reactions from opposition parties, with the Maharashtra Congress demanding that a criminal case be registered against the Speaker for alleged violations of the Model Code of Conduct (MCC). #WATCH | Mumbai | Maharashtra Assembly Speaker Rahul Narvekar says, ""...When I went to the spot, a former MLC pressurised me and he, along with his security guards, tried to stop me and I have submitted a complaint regarding it to the police officials"" pic.twitter.com/LhTilQfuL2 Responding to the allegations, Rahul Narwekar rejected all charges and denied any wrongdoing. He claimed that it was he who was pressured at the spot. “When I went there, a former MLC pressurised me and, along with his security guards, tried to stop me. I have submitted a complaint regarding this to the police officials,” Narwekar said. Viral Video Allegedly Shows Narwekar Threatening Ex-MP, MLC The controversy intensified after Aam Aadmi Party (AAP) leader Sanjay Singh shar']"
4,78,4_governor_colorado_state state_gov,"['governor', 'colorado', 'state state', 'gov', 'federal', 'republicans', 'legislative', 'senate', 'democrat', 'idaho']","['WATCH: Gov. Polis calls out Republicans in State of the State (The Center Square) – Colorado Gov. Jared Polis delivered his last State of the State to a joint session of the Colorado General Assembly on Thursday. In his speech, the Democratic governor called out Republicans, reflected on his past seven years in office, and looked to policy priorities for his last 10 months in office. Since the Trump administration took office one year ago, the Democrat-led Colorado state government has often faced off against the federal government over policies and funding cuts. Polis reflected on that. “Over the past 12 months, it seems like Washington has often been in it to ... make life harder and less affordable, to make Americans feel more fearful, more belligerent and more vulnerable,” Polis said. “In the last month alone, the Trump administration has threatened over $1 billion in funding for Colorado.” As reported by The Center Square, Colorado has filed dozens of lawsuits to challenge federal Republican policies and cuts. Polis promised to keep up those efforts, while calling out Republicans. “We are fighting hard to protect every federal dollar owed to Colorado,” he said. “In partnership with Attorney General [Phil] Weiser, our state has successful', 'WATCH: Gov. Polis calls out Republicans in State of the State (The Center Square) – Colorado Gov. Jared Polis delivered his last State of the State to a joint session of the Colorado General Assembly on Thursday. In his speech, the Democratic governor called out Republicans, reflected on his past seven years in office, and looked to policy priorities for his last 10 months in office. Since the Trump administration took office one year ago, the Democrat-led Colorado state government has often faced off against the federal government over policies and funding cuts. Polis reflected on that. “Over the past 12 months, it seems like Washington has often been in it to ... make life harder and less affordable, to make Americans feel more fearful, more belligerent and more vulnerable,” Polis said. “In the last month alone, the Trump administration has threatened over $1 billion in funding for Colorado.” As reported by The Center Square, Colorado has filed dozens of lawsuits to challenge federal Republican policies and cuts. Polis promised to keep up those efforts, while calling out Republicans. “We are fighting hard to protect every federal dollar owed to Colorado,” he said. “In partnership with Attorney General [Phil] Weiser, our state has successful', 'WATCH: Gov. Polis calls out Republicans in State of the State (The Center Square) – Colorado Gov. Jared Polis delivered his last State of the State to a joint session of the Colorado General Assembly on Thursday. In his speech, the Democratic governor called out Republicans, reflected on his past seven years in office, and looked to policy priorities for his last 10 months in office. Since the Trump administration took office one year ago, the Democrat-led Colorado state government has often faced off against the federal government over policies and funding cuts. Polis reflected on that. “Over the past 12 months, it seems like Washington has often been in it to ... make life harder and less affordable, to make Americans feel more fearful, more belligerent and more vulnerable,” Polis said. “In the last month alone, the Trump administration has threatened over $1 billion in funding for Colorado.” As reported by The Center Square, Colorado has filed dozens of lawsuits to challenge federal Republican policies and cuts. Polis promised to keep up those efforts, while calling out Republicans. “We are fighting hard to protect every federal dollar owed to Colorado,” he said. “In partnership with Attorney General [Phil] Weiser, our state has successful']"
