Topic,Count,Name,Representation,Representative_Docs
17,15,17_immigration_britain_immigrants_societal,"['immigration', 'britain', 'immigrants', 'societal', 'diversity', 'america', 'population', 'respondents', 'liberal', 'countries']","['‘UK public have tougher stance on immigration and diversity than people in US’ People in the UK are less likely than their US counterparts to feel diversity strengthens society and more likely to have tougher attitudes on immigration, according to research. The findings are said to show that a common narrative about Britain being more socially liberal than America does not ring true across all issues. The National Centre for Social Research also found Reform UK voters in Britain were more likely than supporters of President Donald Trump in the US to say immigrants living in their country without permission should not be allowed to stay. While seven in 10 supporters of Mr Trump felt this way, the figure was almost eight in 10 (79%) among Reform followers. The researchers said they wanted to “better understand how public attitudes in the UK compare with those in the US, and the extent of polarisation in the two countries”. Their survey found 42% of people in the UK think there should be legal efforts to deport immigrants living here without permission, compared with just a third (33%) in the US. While almost two-thirds (64%) of respondents in the US felt diversity strengthens society, only around half (49%) of the UK public agreed. Proportions were similar when', '‘UK public have tougher stance on immigration and diversity than people in US’ People in the UK are less likely than their US counterparts to feel diversity strengthens society and more likely to have tougher attitudes on immigration, according to research. The findings are said to show that a common narrative about Britain being more socially liberal than America does not ring true across all issues. The National Centre for Social Research also found Reform UK voters in Britain were more likely than supporters of President Donald Trump in the US to say immigrants living in their country without permission should not be allowed to stay. While seven in 10 supporters of Mr Trump felt this way, the figure was almost eight in 10 (79%) among Reform followers. The researchers said they wanted to “better understand how public attitudes in the UK compare with those in the US, and the extent of polarisation in the two countries”. Their survey found 42% of people in the UK think there should be legal efforts to deport immigrants living here without permission, compared with just a third (33%) in the US. While almost two-thirds (64%) of respondents in the US felt diversity strengthens society, only around half (49%) of the UK public agreed. Proportions were similar when', '‘UK public have tougher stance on immigration and diversity than people in US’ People in the UK are less likely than their US counterparts to feel diversity strengthens society and more likely to have tougher attitudes on immigration, according to research. The findings are said to show that a common narrative about Britain being more socially liberal than America does not ring true across all issues. The National Centre for Social Research also found Reform UK voters in Britain were more likely than supporters of President Donald Trump in the US to say immigrants living in their country without permission should not be allowed to stay. While seven in 10 supporters of Mr Trump felt this way, the figure was almost eight in 10 (79%) among Reform followers. The researchers said they wanted to “better understand how public attitudes in the UK compare with those in the US, and the extent of polarisation in the two countries”. Their survey found 42% of people in the UK think there should be legal efforts to deport immigrants living here without permission, compared with just a third (33%) in the US. While almost two-thirds (64%) of respondents in the US felt diversity strengthens society, only around half (49%) of the UK public agreed. Proportions were similar when']"
18,15,18_museum_egypt_egyptian_world largest,"['museum', 'egypt', 'egyptian', 'world largest', 'tourism', 'exhibition', 'architecture', 'governments', 'opening ceremony', 'culture']","[""Egypt unveils the world's largest museum dedicated to a single civilization Egypt is inaugurating on Saturday the Grand Egyptian Museum, two decades in the making, with the aim of drawing more visitors to revitalize the country's tourist industry. Located just outside Cairo on the Giza Plateau which also includes the three pyramids and the Sphinx, the museum will be the world’s largest dedicated to a single civilization. It will display over 50,000 artifacts detailing life in ancient Egypt. World leaders, including monarchs, heads of states and governments, are set to attend the grand opening ceremony, according to the Egyptian presidency which touted the museum as “an exceptional event in the history of human culture and civilization.” The museum is one of the megaprojects championed by President Abdel-Fattah el-Sissi since he took office in 2014. He has embarked on massive investments in infrastructure with the aim of reviving an economy weakened by decades of stagnation and battered by the unrest that followed the 2011 Arab Spring uprising. Preparations for the grand reveal have been shrouded in secrecy. The museum, which was opened for limited visits in recent years, has been closed for the past two weeks. The government has revamped the areas around t"", ""Egypt unveils the world's largest museum dedicated to a single civilization CAIRO (AP) — Egypt is inaugurating on Saturday the Grand Egyptian Museum, two decades in the making, with the aim of drawing more visitors to revitalize the country's tourist industry. Located just outside Cairo on the Giza Plateau which also includes the three pyramids and the Sphinx, the museum will be the world’s largest dedicated to a single civilization. It will display over 50,000 artifacts detailing life in ancient Egypt. World leaders, including monarchs, heads of states and governments, are set to attend the grand opening ceremony, according to the Egyptian presidency which touted the museum as “an exceptional event in the history of human culture and civilization.” The museum is one of the megaprojects championed by President Abdel-Fattah el-Sissi since he took office in 2014. He has embarked on massive investments in infrastructure with the aim of reviving an economy weakened by decades of stagnation and battered by the unrest that followed the 2011 Arab Spring uprising. Preparations for the grand reveal have been shrouded in secrecy. The museum, which was opened for limited visits in recent years, has been closed for the past two weeks. The government has revamped the a"", ""Egypt unveils the world's largest museum dedicated to a single civilization CAIRO (AP) — Egypt is inaugurating on Saturday the Grand Egyptian Museum, two decades in the making, with the aim of drawing more visitors to revitalize the country's tourist industry. Located just outside Cairo on the Giza Plateau which also includes the three pyramids and the Sphinx, the museum will be the world’s largest dedicated to a single civilization. It will display over 50,000 artifacts detailing life in ancient Egypt. World leaders, including monarchs, heads of states and governments, are set to attend the grand opening ceremony, according to the Egyptian presidency which touted the museum as “an exceptional event in the history of human culture and civilization.” The museum is one of the megaprojects championed by President Abdel-Fattah el-Sissi since he took office in 2014. He has embarked on massive investments in infrastructure with the aim of reviving an economy weakened by decades of stagnation and battered by the unrest that followed the 2011 Arab Spring uprising. Preparations for the grand reveal have been shrouded in secrecy. The museum, which was opened for limited visits in recent years, has been closed for the past two weeks. The government has revamped the a""]"
19,14,19_putin_kremlin_ukraine_moscow,"['putin', 'kremlin', 'ukraine', 'moscow', 'russian', 'russia', 'sanctions', 'energy infrastructure', 'armed forces', 'missiles']","['Russian general hospitalized in shooting, officials say A Russian general was shot at an apartment building in Moscow on Friday and taken to a hospital, Russian officials said. Investigative Committee spokesperson Svetlana Petrenko said in a statement that ""an unidentified individual fired several shots"" at Vladimir Alekseyev, the deputy chief of military intelligence. The spokesperson did not say who could be behind the shooting, and did not provide immediate information about Alekseyev\'s condition. A report by Russian business daily Kommersant cited by the Associated Press said the shooter posed as a delivery person and fired at Alekseyev in the stairway of his apartment building, wounding the general in the foot and arm. In an ensuing scuffle, Alekseyev tried to wrestle the gun away and was shot again in the chest before the assailant fled, the report said. When asked about the shooting, Foreign Minister Sergey Lavrov described it as a ""terrorist act"" by Ukraine intended to derail peace talks between Russian, Ukrainian and US negotiators that concluded in Abu Dhabi yesterday. The Kremlin said Russian President Vladimir Putin has been informed about the shooting, without sharing further details. Ukrainian authorities haven\'t commented', 'Russian general hospitalized after \'several shots\' in Moscow A Russian general was shot at an apartment building in Moscow on Friday and taken to a hospital, Russian officials said. Investigative Committee spokesperson Svetlana Petrenko said in a statement that ""an unidentified individual fired several shots"" at Vladimir Alekseyev, the deputy chief of military intelligence. The spokesperson did not say who could be behind the shooting, and did not provide immediate information about Alekseyev\'s condition. A report by Russian business daily Kommersant cited by the Associated Press said the shooter posed as a delivery person and fired at Alekseyev in the stairway of his apartment building, wounding the general in the foot and arm. In an ensuing scuffle, Alekseyev tried to wrestle the gun away and was shot again in the chest before the assailant fled, the report said. When asked about the shooting, Foreign Minister Sergey Lavrov described it as a ""terrorist act"" by Ukraine intended to derail peace talks between Russian, Ukrainian and US negotiators that concluded in Abu Dhabi yesterday. The Kremlin said Russian President Vladimir Putin has been informed about the shooting, without sharing further details. Ukrainian authorities haven\'t commented', ""Bulgaria names manager to take over Russia's Lukoil refinery after US sanctions A parliamentary vote authorised the government to seize Lukoil's assets in the country Bulgaria on Friday nominated a senior government official to take control of a major Lukoil refinery in the east of the country following US sanctions against the Russian oil giant. The United States last month hit Russia's two biggest oil producers -- Rosneft and Lukoil -- with sanctions over its war in Ukraine. Javascript is required for you to be able to read premium content. Please enable it in your browser settings. Originally published on doc.afp.com, part of the BLOX Digital Content Exchange. Log In Keep it Clean. Please avoid obscene, vulgar, lewd, racist or sexually-oriented language. PLEASE TURN OFF YOUR CAPS LOCK. Don't Threaten. Threats of harming another person will not be tolerated. Be Truthful. Don't knowingly lie about anyone or anything. Be Nice. No racism, sexism or any sort of -ism that is degrading to another person. Be Proactive. Use the 'Report' link on each comment to let us know of abusive posts. Share with Us. We'd love to hear eyewitness accounts, the history behind an article.""]"
20,12,20_new film_movie_actors_actor,"['new film', 'movie', 'actors', 'actor', 'films', 'theaters', 'oscar', 'director', 'brendan', 'fraser']","[""AP Entertainment SummaryBrief at 3:08 p.m. EST Brendan Fraser's new horizons include 'Rental Family' and rental hedgehogs BEDFORD, N.Y. (AP) — “Rental Family” is Brendan Fraser’s first leading role since winning the best actor Oscar for “The Whale.” In it, the 56-year-old plays a struggling actor living in Japan who, out of desperation and curiosity, takes a job with an agency that hires out actors to fulfill roles in real people’s lives. In an interview, Fraser discusses his life since the Oscar win, his eye-opening experiences in Japan and what returning to the “Mummy” series means to him. His time in Japan included a visit to a hedgehog cafe. “Rental Family” opens Friday in theaters. Copyright 2025 The Associated Press. All rights reserved. This material may not be published, broadcast, rewritten or redistributed. Log In Keep it Clean. Please avoid obscene, vulgar, lewd, racist or sexually-oriented language. PLEASE TURN OFF YOUR CAPS LOCK. Don't Threaten. Threats of harming another person will not be tolerated. Be Truthful. Don't knowingly lie about anyone or anything. Be Nice. No racism, sexism or any sort of -ism that is degrading to another person. Be Proactive. Use the 'Report' link on each comment to let us know of abus"", ""AP Entertainment SummaryBrief at 3:08 p.m. EST Brendan Fraser's new horizons include 'Rental Family' and rental hedgehogs BEDFORD, N.Y. (AP) — “Rental Family” is Brendan Fraser’s first leading role since winning the best actor Oscar for “The Whale.” In it, the 56-year-old plays a struggling actor living in Japan who, out of desperation and curiosity, takes a job with an agency that hires out actors to fulfill roles in real people’s lives. In an interview, Fraser discusses his life since the Oscar win, his eye-opening experiences in Japan and what returning to the “Mummy” series means to him. His time in Japan included a visit to a hedgehog cafe. “Rental Family” opens Friday in theaters. Movie Review: Joel Edgerton delivers a profound, understated performance in ‘Train Dreams’ Joel Edgerton plays a logger at the beginning of the 20th century in “Train Dreams.” Clint Bentley's film is an adaptation of Denis Johnson's novella, about the toll of progress and the people left behind. Edgerton stars alongside Felicity Jones and William H. Macy in the meditative film. In her review, Associated Press Film Writer Lindsey Bahr praises Edgerton's understated performance and adds that, “Bentley’s film is haunting and patient, a dreamlike jo"", ""AP Entertainment SummaryBrief at 3:08 p.m. EST Brendan Fraser's new horizons include 'Rental Family' and rental hedgehogs BEDFORD, N.Y. (AP) — “Rental Family” is Brendan Fraser’s first leading role since winning the best actor Oscar for “The Whale.” In it, the 56-year-old plays a struggling actor living in Japan who, out of desperation and curiosity, takes a job with an agency that hires out actors to fulfill roles in real people’s lives. In an interview, Fraser discusses his life since the Oscar win, his eye-opening experiences in Japan and what returning to the “Mummy” series means to him. His time in Japan included a visit to a hedgehog cafe. “Rental Family” opens Friday in theaters. Movie Review: Joel Edgerton delivers a profound, understated performance in ‘Train Dreams’ Joel Edgerton plays a logger at the beginning of the 20th century in “Train Dreams.” Clint Bentley's film is an adaptation of Denis Johnson's novella, about the toll of progress and the people left behind. Edgerton stars alongside Felicity Jones and William H. Macy in the meditative film. In her review, Associated Press Film Writer Lindsey Bahr praises Edgerton's understated performance and adds that, “Bentley’s film is haunting and patient, a dreamlike jo""]"
21,12,21_betting_casino_games_platform,"['betting', 'casino', 'games', 'platform', 'playstation', 'servers', 'nhl', 'vegas', 'new players', 'interactive']","[""New Online Casinos 2025: Lucky Creek Ranked High For New U.S. Players New players gain fast access to bonuses, smooth payouts, and a broad gaming lineup Lucky Creek offers strong bonuses, steady payouts, and a wide range of games for new players A leading 2025 option for U.S. beginners seeking secure payouts and a large game selection Lucky Creek delivers fast rewards, clear navigation, and a wide mix of games for first-time players Las Vegas, Nov. 15, 2025 (GLOBE NEWSWIRE) -- CasinoTop10 has ranked Lucky Creek Casino as the best online gaming casino for new players, offering them a premium experience from the outset. The casino has solidified its position as the best for beginners, as they kick-start their online gaming journeys through its fast payouts, extensive gaming collection, and 24/7 customer support. Lucky Creek prioritizes player satisfaction at every step, whether you're topping up your account or cashing out after a productive gaming session. New players are greeted with a generous 200% match bonus of up to $7,000, plus 200 free spins over 5 days as a welcome bonus to explore the platform and wager on their favorite games without stretching their budget. The magic does not end there. Lucky Creek continues to celebrate players as they con"", ""AGS Interactive Expands Its UK Presence with bet365 Partnership LAS VEGAS, Dec. 05, 2025 (GLOBE NEWSWIRE) -- AGS Interactive (AGSi) has solidified its presence across the pond, taking a selection of its best-performing games live in the UK with bet365. This announcement further cements AGS’ partnership with bet365 building on existing collaborations in the United States, Canada, and Latin America. bet365’s established UK market position and diverse global presence make them a logical strategic partner to support AGS’ global growth initiatives throughout Europe and beyond. At the time of launch, bet365 players across the UK will have access to more than 20 popular game titles from AGS' interactive content library. Notable titles include: “We’ve worked closely with bet365 for years and extending our partnership to the UK is an important milestone for AGS,” said Zoe Ebling, Vice President of Interactive at AGS. “It not only reflects the strength of our relationship, but the growing global appeal and potential of our increasingly diverse portfolio of high-performing online slot content. This is a clear sign of where AGS is headed — broader reach, more markets, and a rapidly expanding international footprint.” “We’re delighted to welcome a selection"", 'AGS Interactive Expands Its UK Presence with bet365 Partnership LAS VEGAS, Dec. 05, 2025 (GLOBE NEWSWIRE) -- AGS Interactive (AGSi) has solidified its presence across the pond, taking a selection of its best-performing games live in the UK with bet365. This announcement further cements AGS\' partnership with bet365 building on existing collaborations in the United States, Canada, and Latin America. bet365\'s established UK market position and diverse global presence make them a logical strategic partner to support AGS\' global growth initiatives throughout Europe and beyond. At the time of launch, bet365 players across the UK will have access to more than 20 popular game titles from AGS\' interactive content library. Notable titles include: ""We\'ve worked closely with bet365 for years and extending our partnership to the UK is an important milestone for AGS,"" said Zoe Ebling, Vice President of Interactive at AGS. ""It not only reflects the strength of our relationship, but the growing global appeal and potential of our increasingly diverse portfolio of high-performing online slot content. This is a clear sign of where AGS is headed — broader reach, more markets, and a rapidly expanding international footprint."" ""We\'re delighted to welcome a selection']"
22,12,22_tennis_tournament_semifinal_match,"['tennis', 'tournament', 'semifinal', 'match', 'championship', 'second round', 'standings', 'cup', 'finals', 'tie']","['Australian Open star accuses BBC pundits of thinking \'tennis is only for white people\' A rising tennis player has slammed BBC pundits for attacking Naomi Osaka\'s bold outfit choices at the Australian Open. Osaka raised eyebrows when she entered the court for her first-round match against Antonia Ruzic sporting a unique pre-match look. She wore an ocean blue tie-dye tracksuit jacket and white wide-leg bottoms for the coin toss, along with a white umbrella. The jellyfish-inspired look was curated by fashion designer Robert Wun, who has previously worked on pieces worn by the likes of Beyonce, Cardi B and Ariana Grande. It came from a vision Osaka had while she was reading to her two-year-old daughter, Shai. Not everybody loved the outfit, though, with Jamie Murray and Eliza Wastcoat among those who weren\'t impressed. Speaking on BBC Radio 5 Live, Murray said: ""I felt there was an element of disrespect to the sport of tennis,"" while Wastcoat added: ""It looked a bit cheap, a little bit tacky."" It came after Wastcoat lasted Osaka\'s attire in a video on her Instagram account, saying: ""You are simply lying to yourself if you say you like Naomi Osaka\'s walk on outfit. ""You know what? I am tired of my own argument that anything that gets people talking about tennis is a good', 'Sabalenka serves her way past Paolini at WTA Finals; Gauff hits 17 double-faults in loss to Pegula RIYADH, Saudi Arabia (AP) — Top-ranked Aryna Sabalenka put on a dominant serving display in her opening match at the WTA finals, producing 10 aces in a 6-3, 6-1 win over No. 8-ranked Jasmine Paolini on Sunday. Sabalenka served four aces in the final game of the first set alone and overall put 82.7% of her first serves in play. The match, which was Sabalenka’s 500th at the WTA level, lasted 70 minutes. “I was focused, I was calm and it felt like everything was in control,” Sabalenka said. On Saturday, Sabalenka was presented with a trophy for finishing the year at No. 1. “I’m super happy and super proud of the work that has been done and that things are working and I’m getting better and better every day,” she said. “And I just hope that we’re going to keep doing what we’re doing and hopefully we can stay there.” The season-ending tournament for the year’s top eight players starts with two four-woman groups of round-robin play. The top two finishers in each group advance to the semifinals. “I take this tournament as a regular tournament that I have to win five matches if I want to win the title,” Sabalenka said. “So I’m just trying to bring my best tennis and fight for every point.”', 'Retiring Wawrinka winds back the clock with gutsy win Stan Wawrinka\'s farewell tour has started with a gutsy win, the three-time grand slam champion beating world No.29 Arthur Rinderknech in a three-set thriller at the United Cup. Hold tight - we’re checking permissions before loading more content Wawrinka announced last month that 2026 will be his final year on tour, but he warned he wasn\'t planning to go quietly. The 40-year-old lived up to his word in 33-degree heat at Perth\'s RAC Arena on Saturday, digging deep into his reserves to pull off a brave 5-7 7-6 (7-5) 7-6 (7-5) victory over Rinderknech to give Switzerland an unassailable 2-0 lead in their tie against France. World No.11 Belinda Bencic had given Switzerland a 1-0 lead earlier in the day by beating Leolia Jeanjean 6-2 6-4 in 91 minutes. After an epic match that lasted three hours and 18 minutes, Wawrinka joked he had hoped for a quicker contest to begin 2026. ""But no, this is why I keep playing,"" Wawrinka said. ""I\'m passionate about the game. I\'m always going to push my own limit. I\'ve said I\'ve been working hard this off-season. ""Even if it\'s my last year, I don\'t just want to play to play. I want to play to compete and try to win. ""So I\'m super happy with the performanc']"
