Topic,Count,Name,Representation,Representative_Docs
-1,332,-1_usc_workforce_university_academic,"['usc', 'workforce', 'university', 'academic', 'companies', 'ces', 'economic', 'management', 'services', 'education']","['USC cutting 259 jobs as it tackles rising $230 million deficit The University of Southern California began cutting 259 jobs on Friday as it tackles a rising operating deficit of more than $230 million Since July 9, USC has laid off — or is in the process of terminating — 975 people throughout the university system’s nearly 24,600 faculty and staff. That tally doesn’t include 9,185 student workers. The university is “reducing and reorganizing its workforce due to cutbacks in funding and necessary budget reductions,” wrote Melissa Gerdes-Leonard, associate vice president of client services with USC’s human resources department, in an Oct. 27 letter filed with the state’s Employment Development Department. Also see: USC won’t sign Trump compact on federal funding The latest round of layoffs are happening at USC’s University Park, a leafy 229-acre main campus for the institution’s academic schools and residential buildings near Exposition Park in downtown Los Angeles. After the cuts are completed Dec. 31, USC will have shed 616 people on its main campus, or two-thirds of the workforce laid off to date. Some of the positions cut include a marketing director, procurement specialist, research administrator, office managers, library supervisor, event', 'USC cutting 259 jobs as it tackles rising $230 million deficit The University of Southern California began cutting 259 jobs on Friday as it tackles a rising operating deficit of more than $230 million Since July 9, USC has laid off — or is in the process of terminating — 975 people throughout the university system’s nearly 24,600 faculty and staff. That tally doesn’t include 9,185 student workers. The university is “reducing and reorganizing its workforce due to cutbacks in funding and necessary budget reductions,” wrote Melissa Gerdes-Leonard, associate vice president of client services with USC’s human resources department, in an Oct. 27 letter filed with the state’s Employment Development Department. Also see: USC won’t sign Trump compact on federal funding The latest round of layoffs are happening at USC’s University Park, a leafy 229-acre main campus for the institution’s academic schools and residential buildings near Exposition Park in downtown Los Angeles. After the cuts are completed Dec. 31, USC will have shed 616 people on its main campus, or two-thirds of the workforce laid off to date. Some of the positions cut include a marketing director, procurement specialist, research administrator, office managers, library supervisor, event', 'USC cutting 259 staff members to tackle rising $230 million deficit The University of Southern California began cutting 259 jobs on Friday as it tackles a rising operating deficit of more than $230 million Since July 9, USC has laid off — or is in the process of terminating — 975 people throughout the university system’s nearly 24,600 faculty and staff. That tally doesn’t include 9,185 student workers. The university is “reducing and reorganizing its workforce due to cutbacks in funding and necessary budget reductions,” wrote Melissa Gerdes-Leonard, associate vice president of client services with USC’s human resources department, in an Oct. 27 letter filed with the state’s Employment Development Department. Also see: USC won’t sign Trump compact on federal funding The latest round of layoffs are happening at USC’s University Park, a leafy 229-acre main campus for the institution’s academic schools and residential buildings near Exposition Park in downtown Los Angeles. After the cuts are completed Dec. 31, USC will have shed 616 people on its main campus, or two-thirds of the workforce laid off to date. Some of the positions cut include a marketing director, procurement specialist, research administrator, office managers, library supervisor, event']"
0,201,0_basketball_ncaa_playoff_offense,"['basketball', 'ncaa', 'playoff', 'offense', 'coach', 'head coach', 'nfl', 'coaching', 'jr', 'sports']","[""Strong first half is enough for Indiana to topple Chicago State Lamar Wilkerson scored a game-high 21 points Saturday and Indiana made 14 of its 15 3-pointers in the first half of a 78-58 nonconference home win over Chicago State in Bloomington. Reed Bailey came off the bench to add 17 points and eight rebounds, while Nick Dorn contributed 15 points on 5-of-11 shooting from the 3-point line. The Hoosiers (9-3) drew assists on all but two of their 26 field goals, with Conor Enright dishing out seven and Wilkerson handing out six. Javascript is required for you to be able to read premium content. Please enable it in your browser settings. Please log in, or sign up for a new, free account to read or post comments. Log In Keep it Clean. Please avoid obscene, vulgar, lewd, racist or sexually-oriented language. PLEASE TURN OFF YOUR CAPS LOCK. Don't Threaten. Threats of harming another person will not be tolerated. Be Truthful. Don't knowingly lie about anyone or anything. Be Nice. No racism, sexism or any sort of -ism that is degrading to another person. Be Proactive. Use the 'Report' link on each comment to let us know of abusive posts. Share with Us. We'd love to hear eyewitness accounts, the history behind an article. Please purchase a subscriptio"", ""Six Players Ejected After Massive Brawl During St. John's vs. Providence As a subscriber, you can share up to 3 articles each month with friends for free. Just click “Gift this Article” on this page, then copy the link or enter their email. Gifts are exclusive to subscribers, reset monthly, and each article can be redeemed once. A legitimate brawl broke out during the second half of this Saturday's game between No. 17 St. John's and Providence. With over 14:25 remaining in the second half, St. John's forward Bryce Hopkins went up for a layup when he was grabbed in midair by Providence's Duncan Powell. Not only did Powell hack Hopkins, he basically threw him to the floor. While we can't say for sure what his intentions were, it certainly looked dirty from the broadcast angle. Javascript is required for you to be able to read premium content. Please enable it in your browser settings. Log In Keep it Clean. Please avoid obscene, vulgar, lewd, racist or sexually-oriented language. PLEASE TURN OFF YOUR CAPS LOCK. Don't Threaten. Threats of harming another person will not be tolerated. Be Truthful. Don't knowingly lie about anyone or anything. Be Nice. No racism, sexism or any sort of -ism that is degrading to another person. Be Proactive. Use the 'Report' li"", ""Josh Heupel, Tennessee Receive Strong Message From 5-Star RB As a subscriber, you can share up to 3 articles each month with friends for free. Just click “Gift this Article” on this page, then copy the link or enter their email. Gifts are exclusive to subscribers, reset monthly, and each article can be redeemed once. The Tennessee Volunteers had a disappointing season after making their first College Football Playoff in 2024. The Volunteers, under the leadership of head coach Josh Heupel, finished the 2025 season with an 8-5 record. That was after being ranked as high as No. 11 in the country. However, the team struggled down the stretch, losing four of its final seven games. As a result, it is now focused on building a championship contender for the upcoming season. Javascript is required for you to be able to read premium content. Please enable it in your browser settings. Log In Keep it Clean. Please avoid obscene, vulgar, lewd, racist or sexually-oriented language. PLEASE TURN OFF YOUR CAPS LOCK. Don't Threaten. Threats of harming another person will not be tolerated. Be Truthful. Don't knowingly lie about anyone or anything. Be Nice. No racism, sexism or any sort of -ism that is degrading to another person. Be Proactive. Use the 'Report""]"
1,178,1_nasdaq_holdings_stocks_nyse,"['nasdaq', 'holdings', 'stocks', 'nyse', 'shares', 'investor', 'corporation', 'companies', 'dividend', 'stock market']","['Abner Herrman & Brock LLC Buys New Shares in Realty Income Corporation $O Posted by Defense World Staff on Dec 22nd, 2025 Abner Herrman & Brock LLC purchased a new position in Realty Income Corporation (NYSE:O – Free Report) during the third quarter, according to its most recent Form 13F filing with the Securities and Exchange Commission. The firm purchased 10,000 shares of the real estate investment trust’s stock, valued at approximately $608,000. Several other hedge funds and other institutional investors also recently added to or reduced their stakes in O. Compagnie Lombard Odier SCmA acquired a new position in Realty Income during the second quarter worth approximately $25,000. Heartwood Wealth Advisors LLC purchased a new stake in shares of Realty Income during the 3rd quarter valued at $29,000. Avion Wealth raised its position in shares of Realty Income by 142.4% in the 2nd quarter. Avion Wealth now owns 526 shares of the real estate investment trust’s stock worth $30,000 after buying an additional 309 shares during the period. Twin Peaks Wealth Advisors LLC purchased a new position in shares of Realty Income in the 2nd quarter worth $31,000. Finally, Country Trust Bank boosted its holdings in Realty Income by 806.5% in the second quarter. Country', 'Adams Wealth Management Has $2.71 Million Stake in Schwab US Broad Market ETF $SCHB Posted by Defense World Staff on Dec 15th, 2025 Adams Wealth Management increased its holdings in shares of Schwab US Broad Market ETF (NYSEARCA:SCHB – Free Report) by 26.5% in the second quarter, according to the company in its most recent Form 13F filing with the Securities and Exchange Commission (SEC). The fund owned 113,506 shares of the company’s stock after buying an additional 23,754 shares during the period. Adams Wealth Management’s holdings in Schwab US Broad Market ETF were worth $2,705,000 at the end of the most recent quarter. A number of other hedge funds and other institutional investors have also recently bought and sold shares of the business. Milestones Private Investment Advisors LLC acquired a new position in shares of Schwab US Broad Market ETF in the 2nd quarter valued at $3,619,000. WT Wealth Management grew its stake in shares of Schwab US Broad Market ETF by 0.3% during the second quarter. WT Wealth Management now owns 1,284,069 shares of the company’s stock worth $30,599,000 after purchasing an additional 3,857 shares during the period. Cambridge Financial Group LLC increased its holdings in Schwab US Broad Market ETF by 43.8% in the second quarter. Cambr', 'AA Financial Advisors LLC Buys 37,001 Shares of FS KKR Capital Corp. $FSK Posted by Defense World Staff on Dec 22nd, 2025 AA Financial Advisors LLC increased its stake in shares of FS KKR Capital Corp. (NYSE:FSK – Free Report) by 24.9% during the third quarter, according to the company in its most recent disclosure with the Securities & Exchange Commission. The firm owned 185,859 shares of the company’s stock after acquiring an additional 37,001 shares during the period. AA Financial Advisors LLC’s holdings in FS KKR Capital were worth $2,775,000 as of its most recent SEC filing. A number of other institutional investors and hedge funds have also recently added to or reduced their stakes in the stock. CCLA Investment Management acquired a new stake in shares of FS KKR Capital in the 2nd quarter valued at about $33,463,000. SCS Capital Management LLC bought a new position in shares of FS KKR Capital during the first quarter worth about $10,822,000. Generali Asset Management SPA SGR grew its holdings in shares of FS KKR Capital by 21.7% during the second quarter. Generali Asset Management SPA SGR now owns 2,485,265 shares of the company’s stock worth $51,569,000 after buying an additional 442,374 shares in the last quarter. Wellington Management Group LLP']"
2,178,2_county sheriff_sheriff_city council_police,"['county sheriff', 'sheriff', 'city council', 'police', 'gov', 'colorado', 'county', 'murder', 'victims', 'residents']","[""California sets up a showdown with Washington by reissuing licenses to migrant truckers Trucks were parked in Bakersfield, California, in November because of a lack of drivers after a crackdown on immigrant drivers. California has delayed its cancellation of thousands of commercial driver's licenses held by migrants, setting it up for another showdown with Washington. The Department of Motor Vehicles announced on Tuesday that the 17,000 migrant truck drivers whose licenses had been revoked can now keep them for 60 more days, which could enable the drivers to retake tests and do whatever is necessary to remain legal. Javascript is required for you to be able to read premium content. Please enable it in your browser settings. Log In Keep it Clean. Please avoid obscene, vulgar, lewd, racist or sexually-oriented language. PLEASE TURN OFF YOUR CAPS LOCK. Don't Threaten. Threats of harming another person will not be tolerated. Be Truthful. Don't knowingly lie about anyone or anything. Be Nice. No racism, sexism or any sort of -ism that is degrading to another person. Be Proactive. Use the 'Report' link on each comment to let us know of abusive posts. Share with Us. We'd love to hear eyewitness accounts, the history behind an article."", ""Freeport Civil Service Commission elects chairman FREEPORT — Former police chief Tyrone Morrow will chair Freeport’s newly formed Civil Service Commission after being elected to lead the three-person panel during the commission’s first meeting. Voters approved creating the commission during the Nov. 4 election, with supporters saying it would remove politics from the hiring, promotion and discipline processes of the city’s police and fire departments. David Thornton Jr. is news editor with The Facts. Contact him at 979-269-6921 News Editor Log In Keep it Clean. Please avoid obscene, vulgar, lewd, racist or sexually-oriented language. PLEASE TURN OFF YOUR CAPS LOCK. Don't Threaten. Threats of harming another person will not be tolerated. Be Truthful. Don't knowingly lie about anyone or anything. Be Nice. No racism, sexism or any sort of -ism that is degrading to another person. Be Proactive. Use the 'Report' link on each comment to let us know of abusive posts. Share with Us. We'd love to hear eyewitness accounts, the history behind an article. Success! An email has been sent to with a link to confirm list signup. Error! There was an error processing your request. Get a list of the day’s obituaries, delivered to your inbox every da"", ""WATCH: Gov. Polis calls out Republicans in State of the State (The Center Square) – Colorado Gov. Jared Polis delivered his last State of the State to a joint session of the Colorado General Assembly on Thursday. In his speech, the Democratic governor called out Republicans, reflected on his past seven years in office, and looked to policy priorities for his last 10 months in office. Javascript is required for you to be able to read premium content. Please enable it in your browser settings. Colorado Gov. Jared Polis gives 2026 State of the State address January 15, 2026 Source: Colorado Channel Elyse Apel, a graduate of Hillsdale College, is a reporter for The Center Square covering Colorado and Michigan. Her writing has been published in a wide variety of national publications from the Washington Examiner to The American Spectator and The Daily Wire. Originally published on thecentersquare.com, part of the BLOX Digital Content Exchange. Log In Keep it Clean. Please avoid obscene, vulgar, lewd, racist or sexually-oriented language. PLEASE TURN OFF YOUR CAPS LOCK. Don't Threaten. Threats of harming another person will not be tolerated. Be Truthful. Don't knowingly lie about anyone or anything. Be Nice. No racism, sexism or any sort of -ism th""]"
3,136,3_passed away_grandmother_died_jane,"['passed away', 'grandmother', 'died', 'jane', 'funeral', 'memorial', 'ann', 'lived', 'mary', 'sister']","['Diane Rae Gunter Birth: 1939 Death: 2025 Diane Rae Gunter, 86, passed on November 2, 2025 at her home in Soquel surrounded by family. Born May 13, 1939, in Soquel, she graduated from Santa Cruz high school where she met her husband, Jesse Edwin Gunter. She is survived by her daughter, son, grandchildren, and great grandchildren and is pre-deceased by her husband. Diane taught swimming to children for many years at Polly’s Puddle and spent her career working in a sheltered workshop for disabled adults in Oregon. She was an avid tennis and softball player early in life, and she found her love for golf later. She spent much of her time in her garden, often ending the day with a pint of her favorite Guinness. She enjoyed traveling and spending time with family and friends. Diane lived her life on her terms and will be missed by all. A celebration of life will be held January 17, 2026, at DeLaveaga Golf Course from 3 to 6 pm. Honor with Flowers In memory of Diane Rae Plant a Living Memorial In memory of Diane Rae', 'Janet Marie Flores Birth: 1931 Death: 2025 Janet Marie Flores passed away peacefully on November 21, 2025 at the age of 94 surrounded by the love of her family. Jan was born on October 31, 1931 in San Francisco to loving parents Alice Detour and Joseph Hettrick. Jan was a loving mother, grandmother and great grandmother who found her greatest joy in her family. She had a way of making people feel welcomed. She was kind, big hearted, extremely gracious and devoted to those she loved. Her presence will be deeply missed. Jan lived a long life traveling, playing golf, bunco with her friends and one of her greatest talents was to find a treasure at garage sales. In her final years she enjoyed playing penny slots at the casino. The last nine years Jan spent in the loving care of her daughter and son in law. A special thank you to her granddaughter Samantha for making her last days warm, comfortable and full of love. Jan survived by her daughter Tina Schilling (Michael), her grandchildren Michael (Marissa), Paul (Kacie), Samantha (Carlos), and her nine great grandchildren Jackson, Aubrey, Jordan, Mikey, Ellie, Luna, Ryder, Makayla and Stella. And her friends who will forever cherish her memory. Celebration', 'Linda Sue (Jordan) Schlosser Birth: 1950 Death: 2025 Linda Sue (Jordan) Schlosser March 16, 1950-December 15, 2025 passed away peacefully surrounded by her family at her home in San Pancho, Mexico. Survived by her husband of 41 years, Phil Schlosser, her mother Gerry, daughter Kelly Noel, son Kevin Noel and wife Jennifer and her grandchildren Trevor and Lena. She was preceded in death by her father, Wayne Henry Jordan and brother Michael Wayne Jordan. Linda was born and raised in San Rafael, CA and graduated from Terra Linda High School. Linda loved sunshine, warm weather and travel. She was an outstanding cook and loved to entertain. Her great adventure was moving to Mexico, building a wonderful home filled with warmth, family, friends and great meals. She loved traveling throughout Mexico and Italy. Her family requests that gifts in lieu of flowers be made in Linda’s name to St. Jude Children’s Research Hospital. Forever deep in my soul, The memory of your love Fills my heart And I am never alone. Honor with Flowers In memory of Linda Sue Plant a Living Memorial In memory of Linda Sue']"
4,122,4_pentagon_terrorists_terrorism_war,"['pentagon', 'terrorists', 'terrorism', 'war', 'crackdown', 'boats', 'terrorist', 'operation', 'president', 'killing']","[""Hegseth, Pentagon stand by explanation of second boat strike (The Center Square) – After a story was published last week claiming that Secretary of War Pete Hegseth ordered a second strike on an alleged Venezuelan drug boat to kill those remaining, both Hegseth and the Pentagon reiterated their defense of the War Department’s actions as completely legal. Pentagon Press Secretary Kingsley Wilson told reporters Tuesday that the U.S. has performed 21 strikes on drug boats in the Western Hemisphere, killing “82 narco-terrorists.” “Our operations in the SOUTHCOM region are lawful under both U.S. and international law, with all actions in compliance with the law of armed conflict,” Wilson said. “These actions have also been approved by the best military and civilian lawyers up and down the chain of command.” Wilson repeatedly described the boats as narco-terrorist vessels at the Pentagon's first press briefing under this administration, underscoring that the terrorist designation allows the Trump administration to respond more forcefully while remaining within the law. Democrats and some Republicans have questioned the legality of the strike, with some calling it a war crime. After the first strike, there were allegedly only two people left, cling"", ""Hegseth, Pentagon stand by explanation of second boat strike (The Center Square) – After a story was published last week claiming that Secretary of War Pete Hegseth ordered a second strike on an alleged Venezuelan drug boat to kill those remaining, both Hegseth and the Pentagon reiterated their defense of the War Department’s actions as completely legal. Pentagon Press Secretary Kingsley Wilson told reporters Tuesday that the U.S. has performed 21 strikes on drug boats in the Western Hemisphere, killing “82 narco-terrorists.” “Our operations in the SOUTHCOM region are lawful under both U.S. and international law, with all actions in compliance with the law of armed conflict,” Wilson said. “These actions have also been approved by the best military and civilian lawyers up and down the chain of command.” Wilson repeatedly described the boats as narco-terrorist vessels at the Pentagon's first press briefing under this administration, underscoring that the terrorist designation allows the Trump administration to respond more forcefully while remaining within the law. Democrats and some Republicans have questioned the legality of the strike, with some calling it a war crime. After the first strike, there were allegedly only two people left, cling"", ""Hegseth, Pentagon stand by explanation of second boat strike (The Center Square) – After a story was published last week claiming that Secretary of War Pete Hegseth ordered a second strike on an alleged Venezuelan drug boat to kill those remaining, both Hegseth and the Pentagon reiterated their defense of the War Department’s actions as completely legal. Pentagon Press Secretary Kingsley Wilson told reporters Tuesday that the U.S. has performed 21 strikes on drug boats in the Western Hemisphere, killing “82 narco-terrorists.” “Our operations in the SOUTHCOM region are lawful under both U.S. and international law, with all actions in compliance with the law of armed conflict,” Wilson said. “These actions have also been approved by the best military and civilian lawyers up and down the chain of command.” Wilson repeatedly described the boats as narco-terrorist vessels at the Pentagon's first press briefing under this administration, underscoring that the terrorist designation allows the Trump administration to respond more forcefully while remaining within the law. Democrats and some Republicans have questioned the legality of the strike, with some calling it a war crime. After the first strike, there were allegedly only two people left, cling""]"
