Topic,Count,Name,Representation,Representative_Docs
11,24,11_xi jinping_beijing_china_president donald,"['xi jinping', 'beijing', 'china', 'president donald', 'trump', 'tariffs', 'taiwan', 'largest economies', 'xi', 'donald trump']","[""‘Friction Is Natural, But Ties Must Stay On Track’: Xi Jinping Urges Trump For China-US Partnership Chinese President Xi Jinping met his American counterpart Donald Trump in South Korea on Thursday, marking their first meeting in six years. During the talks, Xi emphasised that Beijing and Washington must remain partners and friends, acknowledging that differences were “natural” but urging both nations to stay on the “right course.” “It is natural to have friction,” Xi said, adding, “China and the US can jointly shoulder our responsibility as major countries and work together to accomplish more great and concrete things for the good of our two countries and the whole world.” He also expressed appreciation for Trump’s efforts to promote peace in ongoing global conflicts, reiterating China’s willingness to continue working with the United States. In response, President Trump described Xi as “a great leader of a great country,” adding, “I think we're going to have a fantastic relationship for a long period of time, and it's an honour to have you with us.” The two leaders met at an air base in the southern port city of Busan, with the encounter taking place on the sidelines of the Asia-Pacific Economic Cooperation (APEC) summit. This was also the first meeting since Trump’s return to"", 'Xi tells Trump it’s ‘normal’ for world’s top economies to clash but calls for partnership KUALA LUMPUR, Oct 30 — China and the United States (US) should be partners and friends, Chinese President Xi Jinping said in his meeting with his counterpart Donald Trump at the Gimhae Air Base in Busan, South Korea, while stating that it is normal for two economic powerhouses to have frictions at times. Trump called Xi a great leader, “President Xi is a great leader of a great country, and I think we are going to have a fantastic relationship for a long period of time, and it is an honour to have you with us. Thank you very much.” Xi said, “China’s relations have remained stable on the whole (and) given our different national conditions, we do not always see eye to eye with each other, and it is normal for the two leading economies of the world to have frictions now and then and in the face of winds, waves and challenges.” “You and I at the helm of China-US relations should stay the right course and ensure the steady sailing forward of the giant ship of China-US relations. I always believe that China’s development goes hand in hand with your vision to make America great again,” he said. Xi said both leaders have spoken over the phone three times, exchanged several letters, and sta', ""Business : Xi Jinping Urges Partnership With Us, Says Frictions Are 'normal' Between Economic Powers KUALA LUMPUR, Oct 30 (Bernama) -- China and the United States (US) should be partners and friends, Chinese President Xi Jinping said in his meeting with his counterpart Donald Trump at the Gimhae Air Base in Busan, South Korea, while stating that it is normal for two economic powerhouses to have frictions at times. Trump called Xi a great leader, “President Xi is a great leader of a great country, and I think we are going to have a fantastic relationship for a long period of time, and it is an honour to have you with us. Thank you very much.” Xi said, “China’s relations have remained stable on the whole (and) given our different national conditions, we do not always see eye to eye with each other, and it is normal for the two leading economies of the world to have frictions now and then and in the face of winds, waves and challenges.” “You and I at the helm of China-US relations should stay the right course and ensure the steady sailing forward of the giant ship of China-US relations. I always believe that China’s development goes hand in hand with your vision to make America great again,” he said in the video that was streamed live by The White House. Xi said both leaders have spo""]"
12,23,12_strictly_contestants_itv_chris,"['strictly', 'contestants', 'itv', 'chris', 'dance', 'prince', 'royal', 'stripped', 'humiliation', 'meghan markle']","[""Prince Harry spotted for second time on holiday without Meghan Markle Prince Harry has been spotted for a second time this week on his holiday without his wife, Meghan Markle. On Wednesday, the Duke of Sussex was spotted taking part in the St. Regis World Snow Polo Championship in Aspen, Colorado, just hours after he was spotted skiing with close friend Nacho Figueras. The Prince, 41, reportedly was taking part in the polo tournament to stand in for a friend who couldn’t make it. He is believed to have been on the Aspen Valley team. Harry would have most likely been delighted to take part in the event, having played polo for a number of years. READ MORE: Meghan Markle breaks silence after Prince Harry spotted alone on holiday READ MORE: Princess Kate sends coded message at Royal Family Christmas lunch We use your sign-up to provide content in ways you've consented to and to improve our understanding of you. This may include adverts from us and 3rd parties based on our understanding. You can unsubscribe at any time. Read our Privacy Policy The sighting of the prince on the polo field came not long after the duke was spotted skiing at a resort with some male friends. A source told Hello magazine that the duke seemed to be enjoying himself in the mounta"", 'Strictly Come Dancing fans have same complaint as La Voix withdraws from show \'Pointless!\' Strictly Come Dancing fans have been left with the same question after it was announced La Voix has withdrawn from the competition. During Saturday (November 22) night\'s show, the remaining contestants took to the dance floor at the iconic Blackpool Tower Ballroom. Before things kicked off for Blackpool Week, presenter Tess Daly informed viewers that the drag queen – real name Chris Dennis – would not be returning to the competition after sustaining a foot injury. She said: ""We can confirm she has very sadly had to withdraw from the competition,"" before revealing there would be no elimination this weekend. But this has left fans wondering why Sunday night\'s show is still airing now that there is no dance-off. Taking to social media with their queries, one wrote: ""So what’s the point of Sunday’s show when everything can be done tonight #Strictly?"" Read more: Strictly pro says only one person can replace Craig Revel Horwood Read more: BBC Strictly viewers switch off as major star pulls out of show We use your sign-up to provide content in ways you\'ve consented to and to improve our understanding of you. This may include adverts from us and 3rd parties based on our understanding. You', 'Strictly Come Dancing star breaks silence after concern fifth contestant would quit Strictly Come Dancing\'s Alex Kingston is poised to carry on with her dance adventure, putting to rest concerns she might have to withdraw due to injury. The 62-year-old actress had triggered concerns about a potential exit after her daughter disclosed a rib injury on social media, stating that her mother had endured the discomfort to participate in Saturday\'s programme. The Doctor Who legend, who has been dazzling audiences on the dance floor alongside partner Johannes Radebe, was swift to comfort her supporters that injuries were simply ""part and parcel"" of the Strictly experience, and she had absolutely no plans to retire her dancing shoes. Fleur East, host of Strictly spin-off It Takes Two, has now verified that Alex will return to the competition following last week\'s Blackpool special. Discussing their forthcoming performance, Fleur disclosed: ""Alex and Johannes will be dancing a cha-cha-cha to Ring My Bell by Anita Ward."" We use your sign-up to provide content in ways you\'ve consented to and to improve our understanding of you. This may include adverts from us and 3rd parties based on our understanding. You can unsubscribe at any time. Read our Privacy Policy She continued: ""']"
13,22,13_nigeria_democracy_west african_democratic,"['nigeria', 'democracy', 'west african', 'democratic', 'constituency', 'election', 'coalition', 'democratic party', 'labour', 'candidates']","['Netflix’s ‘The Herd’ sparks controversy over portrayal of Fulani herders A new Nollywood crime thriller ‘The Herd‘ has ignited a fierce online debate, with critics accusing it of unfairly stereotyping Fulani herders as terrorists. The film, directed by Daniel Etim-Effiong, recently became available on Netflix. Its plot follows a couple whose wedding day in south-west Nigeria turns into a nightmare when their celebratory convoy is ambushed by gunmen disguised as cattle herders. The story quickly shifts from a joyous celebration to a brutal fight for survival. However, the movie’s central conflict has drawn significant criticism on the social media platform X. Prominent voices, including former presidential aide Bashir Ahmad, have condemned the film for what they call “a dangerous profiling of an ethnic group”. In a lengthy post, Ahmad argued that the scene depicting the attack “paints a picture that is dangerously inaccurate”. He expressed concern that the stereotyping fuels suspicion and violence against innocent Fulani people and could create an international stigma against the entire community. Ahmad concluded by calling on the Nigerian Film Corporation, led by Ali Nuhu, to investigate the film. The reason why some Arewa people are angry about The Her', 'ADC-Obidient alliance can end APC dominance in 2027 – Odigie-Oyegun Chief John Odigie-Oyegun, former National Chairman of the All Progressives Congress, APC, and a prominent leader of the African Democratic Congress, ADC, has expressed confidence that the growing collaboration between the ADC and the Obidient Movement could dislodge the APC from power in the 2027 general elections. Odigie-Oyegun made the remarks on Monday in Benin City, Edo State, during a formal reception for members of the Obidient Movement who recently defected en masse to the ADC. The defection follows the recent alignment of former Labour Party presidential candidate, Mr Peter Obi, with the ADC. Addressing the gathering, Odigie-Oyegun said the decision by the Obidient Movement to join the ADC reflects a growing commitment among Nigerians, especially young people, to pursue political change and national renewal. “The calibre and dedication of new members joining our party strengthens my belief that a new Nigeria is within reach,” he said. Recalling recent developments, he added: “A few days ago, I witnessed the entry of Dele Momodu, a prominent figure, into the party. Today, I see a large group of youths who are genuinely committed to nation-building. Meeting the members of the', 'ADC Coalition: Atiku Saved Many Political Actors From Becoming Politically Stranded – Okai Prominent youth advocate and political figure, Comrade Usman Okai Austin, has identified former Vice President and 2023 presidential candidate of the Peoples Democratic Party (PDP), Atiku Abubakar, as a major driving force behind efforts to restore Nigeria’s democratic direction ahead of the 2027 general elections. Okai, a chieftain of the African Democratic Congress (ADC), stated this following a closed-door strategic meeting with Atiku, where discussions centred on the urgent need to build a united and formidable opposition capable of challenging the ruling party. The youth leader described the move to form a broad opposition coalition under the ADC platform as timely, especially in view of the prolonged leadership and structural crises rocking the PDP. According to him, Atiku’s intervention has prevented many political actors from becoming politically stranded as a result of the turmoil within their former party. He said, “Today, we are no longer at the mercy of those bent on destroying the PDP from within, because a stronger coalition has emerged due to Atiku’s foresight.” Okai argued that without the ADC-driven alliance, opposition voices would have been largely silenced in Ni']"
14,18,14_fabric_furniture_pigment_colours,"['fabric', 'furniture', 'pigment', 'colours', 'colors', 'glow', 'essentials', 'product', 'skin', 'beauty']","['The darkest fabric ever made is now a dress Get the Popular Science daily newsletter💡 Breakthroughs, discoveries, and DIY tips sent every weekday. Terms of Service and Privacy Policy. There is black, and then there is ultrablack. The shade defined as a black that reflects less than 0.5 percent of the light that hits it, is used on everything from telescopes to cameras. This uniquely dark color is not easy to produce and may appear less black when it is viewed at an angle. To find a better way to reproduce this cool color, a team at Cornell University looked to nature. Specifically, a bird called the magnificent riflebird. The result is the darkest known fabric ever created and it is detailed in a study recently published in the journal Nature Communications. The magnificent riflebird is a large songbird and member of the bird-of-paradise family found in New Guinea and Australia. Male riflebirds are almost completely black, with a green and blue metallic sheen on their belly, throat, and crown feathers. With the help of Mary M. Ferraro and Vanya Rohwer from the Cornell Lab of Ornithology, the team studied the riflebird’s black feathers. Their plumage comes from melanin pigment paired with tightly bunched filaments called barb', ""Sam's Club Is Selling a Versatile 12-Drawer Organizer That's a Serial Hobbyist's Dream Come True As a subscriber, you can share up to 3 articles each month with friends for free. Just click “Gift this Article” on this page, then copy the link or enter their email. Gifts are exclusive to subscribers, reset monthly, and each article can be redeemed once. Parade aims to feature only the best products and services. If you buy something via one of our links, we may earn a commission. I'm calling it now: 2026 will be the year of hobbies. Whether you love crafting, building LEGO sets, sewing, painting, putting together puzzles, crocheting or all of the above, there are plenty of different hobbies you can get into this year. Of course, many of these activities require supplies that can easily get scattered about and disorganized (looking at you LEGO bricks). This may lead to more clutter and chaos in the home—something no one wants. That's why before you start a new hobby it can be helpful to think about a storage solution for all of your hobby essentials. Javascript is required for you to be able to read premium content. Please enable it in your browser settings. Log In Keep it Clean. Please avoid obscene, vulgar, lewd, racist or sexually-oriented language. PLEASE TURN OFF YOUR CAPS"", ""Target's 'Elegant' 3-Piece Duvet Set Is 'Perfect in Every Way' As a subscriber, you can share up to 3 articles each month with friends for free. Just click “Gift this Article” on this page, then copy the link or enter their email. Gifts are exclusive to subscribers, reset monthly, and each article can be redeemed once. Parade aims to feature only the best products and services. If you buy something via one of our links, we may earn a commission. It's that time of year where many of us are looking to upgrade our bedding. If you're looking for an affordable but luxe option, this duvet set from Target is just what you need. Despite it's inexpensive price point, it looks so high-end. Javascript is required for you to be able to read premium content. Please enable it in your browser settings. Log In Keep it Clean. Please avoid obscene, vulgar, lewd, racist or sexually-oriented language. PLEASE TURN OFF YOUR CAPS LOCK. Don't Threaten. Threats of harming another person will not be tolerated. Be Truthful. Don't knowingly lie about anyone or anything. Be Nice. No racism, sexism or any sort of -ism that is degrading to another person. Be Proactive. Use the 'Report' link on each comment to let us know of abusive posts. Share with Us. We'd love to hear ey""]"
15,17,15_epstein files_justice department_clinton_investigative,"['epstein files', 'justice department', 'clinton', 'investigative', 'fbi', 'jeffrey', 'convicted', 'donald', 'emails', 'documents']","[""Latest Epstein release shows scope of DOJ probes into Epstein, Maxwell The U.S. Justice Department has released tens of thousands more documents related to Jeffrey Epstein, a tranche that included multiple mentions of President Donald Trump but added little new revelatory information. WASHINGTON — The U.S. Justice Department released tens of thousands more documents related to Jeffrey Epstein, a tranche that included multiple mentions of President Donald Trump but added little new revelatory information to the long-anticipated public file on the late financier and convicted sex offender. President Donald Trump speaks Monday at his Mar-a-Lago club in Palm Beach, Fla. A desk and photographs are pictured July 6, 2019, during a search of Jeffrey Epstein's home in New York. An email that was included in the U.S. Department of Justice release of the Jeffrey Epstein files is photographed Monday. Get local news delivered to your inbox! The U.S. Justice Department has released tens of thousands more documents related to Jeffrey Epstein, a tranche that included multiple mention…"", ""Latest Epstein release shows scope of DOJ probes into Epstein, Maxwell The U.S. Justice Department has released tens of thousands more documents related to Jeffrey Epstein, a tranche that included multiple mentions of President Donald Trump but added little new revelatory information. WASHINGTON — The U.S. Justice Department released tens of thousands more documents related to Jeffrey Epstein, a tranche that included multiple mentions of President Donald Trump but added little new revelatory information to the long-anticipated public file on the late financier and convicted sex offender. President Donald Trump speaks Monday at his Mar-a-Lago club in Palm Beach, Fla. A desk and photographs are pictured July 6, 2019, during a search of Jeffrey Epstein's home in New York. An email that was included in the U.S. Department of Justice release of the Jeffrey Epstein files is photographed Monday. Get local news delivered to your inbox! The U.S. Justice Department has released tens of thousands more documents related to Jeffrey Epstein, a tranche that included multiple mention…"", ""Latest Epstein release shows scope of DOJ probes into Epstein, Maxwell The U.S. Justice Department has released tens of thousands more documents related to Jeffrey Epstein, a tranche that included multiple mentions of President Donald Trump but added little new revelatory information. WASHINGTON — The U.S. Justice Department released tens of thousands more documents related to Jeffrey Epstein, a tranche that included multiple mentions of President Donald Trump but added little new revelatory information to the long-anticipated public file on the late financier and convicted sex offender. President Donald Trump speaks Monday at his Mar-a-Lago club in Palm Beach, Fla. A desk and photographs are pictured July 6, 2019, during a search of Jeffrey Epstein's home in New York. An email that was included in the U.S. Department of Justice release of the Jeffrey Epstein files is photographed Monday. Get local news delivered to your inbox! The U.S. Justice Department has released tens of thousands more documents related to Jeffrey Epstein, a tranche that included multiple mention…""]"
16,15,16_museum_egypt_egyptian_world largest,"['museum', 'egypt', 'egyptian', 'world largest', 'tourism', 'exhibition', 'architecture', 'governments', 'opening ceremony', 'culture']","[""Egypt unveils the world's largest museum dedicated to a single civilization Egypt is inaugurating on Saturday the Grand Egyptian Museum, two decades in the making, with the aim of drawing more visitors to revitalize the country's tourist industry. Located just outside Cairo on the Giza Plateau which also includes the three pyramids and the Sphinx, the museum will be the world’s largest dedicated to a single civilization. It will display over 50,000 artifacts detailing life in ancient Egypt. World leaders, including monarchs, heads of states and governments, are set to attend the grand opening ceremony, according to the Egyptian presidency which touted the museum as “an exceptional event in the history of human culture and civilization.” The museum is one of the megaprojects championed by President Abdel-Fattah el-Sissi since he took office in 2014. He has embarked on massive investments in infrastructure with the aim of reviving an economy weakened by decades of stagnation and battered by the unrest that followed the 2011 Arab Spring uprising. Preparations for the grand reveal have been shrouded in secrecy. The museum, which was opened for limited visits in recent years, has been closed for the past two weeks. The government has revamped the areas around t"", ""Egypt unveils the world's largest museum dedicated to a single civilization CAIRO (AP) — Egypt is inaugurating on Saturday the Grand Egyptian Museum, two decades in the making, with the aim of drawing more visitors to revitalize the country's tourist industry. Located just outside Cairo on the Giza Plateau which also includes the three pyramids and the Sphinx, the museum will be the world’s largest dedicated to a single civilization. It will display over 50,000 artifacts detailing life in ancient Egypt. World leaders, including monarchs, heads of states and governments, are set to attend the grand opening ceremony, according to the Egyptian presidency which touted the museum as “an exceptional event in the history of human culture and civilization.” The museum is one of the megaprojects championed by President Abdel-Fattah el-Sissi since he took office in 2014. He has embarked on massive investments in infrastructure with the aim of reviving an economy weakened by decades of stagnation and battered by the unrest that followed the 2011 Arab Spring uprising. Preparations for the grand reveal have been shrouded in secrecy. The museum, which was opened for limited visits in recent years, has been closed for the past two weeks. The government has revamped the a"", ""Egypt unveils the world's largest museum dedicated to a single civilization CAIRO (AP) — Egypt is inaugurating on Saturday the Grand Egyptian Museum, two decades in the making, with the aim of drawing more visitors to revitalize the country's tourist industry. Located just outside Cairo on the Giza Plateau which also includes the three pyramids and the Sphinx, the museum will be the world’s largest dedicated to a single civilization. It will display over 50,000 artifacts detailing life in ancient Egypt. World leaders, including monarchs, heads of states and governments, are set to attend the grand opening ceremony, according to the Egyptian presidency which touted the museum as “an exceptional event in the history of human culture and civilization.” The museum is one of the megaprojects championed by President Abdel-Fattah el-Sissi since he took office in 2014. He has embarked on massive investments in infrastructure with the aim of reviving an economy weakened by decades of stagnation and battered by the unrest that followed the 2011 Arab Spring uprising. Preparations for the grand reveal have been shrouded in secrecy. The museum, which was opened for limited visits in recent years, has been closed for the past two weeks. The government has revamped the a""]"
