Topic,Count,Name,Representation,Representative_Docs
11,16,11_contestants_itv_strictly_big brother,"['contestants', 'itv', 'strictly', 'big brother', 'couples', 'simon', 'chris', 'elimination', 'lorraine', 'dancing']","[""BGT fans spot ‘feud’ between Simon Cowell and host Dec Donnelly after cutting remark – did you see it? BRITAIN’S Got Talent fans are convinced they have spotted a secret ‘feud’ between Simon Cowell and host Dec Donnelly. It comes following an awkward moment between the pair during tonight’s first live semi-final, with show creator Simon making a cutting remark towards the presenter. Please provide a valid email. Your info will be used in accordance with our Privacy Policy You'll now receive top stories, breaking news, and more, straight to your email. The first semi-final saw several acts take to the stage in front of Simon and his fellow judges; Alesha Dixon, Amanda Holden and KSI. After watching mentalist Fraser Penman perform, Simon had some constructive criticism for the perfomer. After delivering some feedback, Simon said to Fraser: “You’re very mysterious,” as Dec interrupted: “Thank you judges”. “I’m not done talking,” clapped back Simon in a snipy remark as he continued with even more feedback. Read more TV news CHEEKY DIG BGT's Ant McPartlin addresses I'm a Celeb drama with cheeky dig at campmate explosive exit Watch moment Jimmy & David claim they were 'kicked out' of I'm a Celeb final The moments didn’t go unnoticed by fans either, as they shared their sadness for Dec aft"", 'Strictly Come Dancing fans have same complaint as La Voix withdraws from show \'Pointless!\' Strictly Come Dancing fans have been left with the same question after it was announced La Voix has withdrawn from the competition. During Saturday (November 22) night\'s show, the remaining contestants took to the dance floor at the iconic Blackpool Tower Ballroom. Before things kicked off for Blackpool Week, presenter Tess Daly informed viewers that the drag queen – real name Chris Dennis – would not be returning to the competition after sustaining a foot injury. She said: ""We can confirm she has very sadly had to withdraw from the competition,"" before revealing there would be no elimination this weekend. But this has left fans wondering why Sunday night\'s show is still airing now that there is no dance-off. Taking to social media with their queries, one wrote: ""So what’s the point of Sunday’s show when everything can be done tonight #Strictly?"" Read more: Strictly pro says only one person can replace Craig Revel Horwood Read more: BBC Strictly viewers switch off as major star pulls out of show We use your sign-up to provide content in ways you\'ve consented to and to improve our understanding of you. This may include adverts from us and 3rd parties based on our understanding. You', 'Strictly Come Dancing star breaks silence after concern fifth contestant would quit Strictly Come Dancing\'s Alex Kingston is poised to carry on with her dance adventure, putting to rest concerns she might have to withdraw due to injury. The 62-year-old actress had triggered concerns about a potential exit after her daughter disclosed a rib injury on social media, stating that her mother had endured the discomfort to participate in Saturday\'s programme. The Doctor Who legend, who has been dazzling audiences on the dance floor alongside partner Johannes Radebe, was swift to comfort her supporters that injuries were simply ""part and parcel"" of the Strictly experience, and she had absolutely no plans to retire her dancing shoes. Fleur East, host of Strictly spin-off It Takes Two, has now verified that Alex will return to the competition following last week\'s Blackpool special. Discussing their forthcoming performance, Fleur disclosed: ""Alex and Johannes will be dancing a cha-cha-cha to Ring My Bell by Anita Ward."" We use your sign-up to provide content in ways you\'ve consented to and to improve our understanding of you. This may include adverts from us and 3rd parties based on our understanding. You can unsubscribe at any time. Read our Privacy Policy She continued: ""']"
12,12,12_racing_newman_raceway_track,"['racing', 'newman', 'raceway', 'track', 'qualifying', 'kyle', 'chase', 'toyota', 'fast', 'tie']","[""Denny Hamlin qualifies first at Martinsville, moves into tie for 10th in NASCAR poles MARTINSVILLE, Va. — Denny Hamlin earned his fifth pole position at Martinsville Speedway and 49th of his Cup Series career, tying him with NASCAR Hall of Famer Bobby Isaac for 10th all time. The Joe Gibbs Racing star turned a 98.241-mph lap Saturday in the No. 11 Toyota to beat William Byron, whose No. 24 Chevrolet qualified second at 97.957 mph for Sunday’s 400-lap race. With his win two weeks ago at Las Vegas Motor Speedway, Hamlin, 45, broke a tie with Kevin Harvick for 10th on the all-time win list in NASCAR's premier series. He is two poles away from tying the career total of Ryan Newman, one of the greatest qualifiers in NASCAR history. “It’s pretty awesome,” said Hamlin, who grew up a few hours east of Martinsville in the Richmond, Virginia, suburb of Chesterfield. “Really with age, the hardest part is still having the fast time. It’s one thing to be able to manage races and use your experience to your advantage. But usually the first thing to go is your all-out speed, and we’re still knocking off poles, which is really good. I was around when Newman was just unstoppable in qualifying. So damn, I didn’t know he had that many.” Hamlin has six wins at Martinsville, and his vic"", ""Denny Hamlin qualifies first at Martinsville, moves into tie for 10th in NASCAR poles MARTINSVILLE, Va. — Denny Hamlin earned his fifth pole position at Martinsville Speedway and 49th of his Cup Series career, tying him with NASCAR Hall of Famer Bobby Isaac for 10th all time. The Joe Gibbs Racing star turned a 98.241-mph lap Saturday in the No. 11 Toyota to beat William Byron, whose No. 24 Chevrolet qualified second at 97.957 mph for Sunday’s 400-lap race. With his win two weeks ago at Las Vegas Motor Speedway, Hamlin, 45, broke a tie with Kevin Harvick for 10th on the all-time win list in NASCAR's premier series. He is two poles away from tying the career total of Ryan Newman, one of the greatest qualifiers in NASCAR history. “It’s pretty awesome,” said Hamlin, who grew up a few hours east of Martinsville in the Richmond, Virginia, suburb of Chesterfield. “Really with age, the hardest part is still having the fast time. It’s one thing to be able to manage races and use your experience to your advantage. But usually the first thing to go is your all-out speed, and we’re still knocking off poles, which is really good. I was around when Newman was just unstoppable in qualifying. So damn, I didn’t know he had that many.” Hamlin has six wins at Martinsville, and his vic"", ""Denny Hamlin qualifies first at Martinsville, moves into tie for 10th in NASCAR poles MARTINSVILLE, Va. — Denny Hamlin earned his fifth pole position at Martinsville Speedway and 49th of his Cup Series career, tying him with NASCAR Hall of Famer Bobby Isaac for 10th all time. The Joe Gibbs Racing star turned a 98.241-mph lap Saturday in the No. 11 Toyota to beat William Byron, whose No. 24 Chevrolet qualified second at 97.957 mph for Sunday’s 400-lap race. With his win two weeks ago at Las Vegas Motor Speedway, Hamlin, 45, broke a tie with Kevin Harvick for 10th on the all-time win list in NASCAR's premier series. He is two poles away from tying the career total of Ryan Newman, one of the greatest qualifiers in NASCAR history. “It’s pretty awesome,” said Hamlin, who grew up a few hours east of Martinsville in the Richmond, Virginia, suburb of Chesterfield. “Really with age, the hardest part is still having the fast time. It’s one thing to be able to manage races and use your experience to your advantage. But usually the first thing to go is your all-out speed, and we’re still knocking off poles, which is really good. I was around when Newman was just unstoppable in qualifying. So damn, I didn’t know he had that many.” Hamlin has six wins at Martinsville, and his vic""]"
13,11,13_whatsapp_facebook_status_friends,"['whatsapp', 'facebook', 'status', 'friends', 'relationships', 'predictions', 'privacy', 'signs', 'leo', 'new feature']","['Aquarius Horoscope Today, March 12, 2026 Aquarius Daily Horoscope Today, 12 March 2026: Ganesha says for Aquarius, the day will bring satisfaction and joy, especially with engaging in conversations and exchanging gifts with close relatives and friends. Trusting your own decisions over others’ advice will be beneficial today. However, despite hard work, the desired results may be delayed, so patience is key. Avoid getting into debates, as it could disturb your peace. In business, connecting with influential people will be advantageous, and your financial situation will improve once you hit key targets. The office environment will be relaxed, but remember to put in more effort for sustained growth. In love, emotional closeness will strengthen between you and your spouse, but steer clear of any relationships that could disrupt family peace. Health will remain stable, though it’s wise to protect yourself from environmental stressors. Positive– The day will be quite satisfactory. There will be a round of meetings and conversations with close relatives and friends. There will also be an exchange of gifts. Taking your own decisions will prove to be more beneficial than trusting someone’s advice. Business– The policy of connectin', 'Not just polls, you may soon see interactive quizzes on WhatsApp Channels: Details WhatsApp has launched several new features this year, whether it be to make the app more secure or more fun to use. As the year is about to end, the messaging app is preparing to add yet another feature focused on improving interaction within the Channels section. Currently in the beta phase, the feature is expected to be available on both Android and iOS. It will allow channel admins to connect more effectively with their audience by enabling them to share interactive content. While Channels already includes a polls feature, this upcoming quiz feature is designed to be more engaging and knowledge-based, setting it apart from existing options. According to a recent report by WABetaInfo, WhatsApp may soon release a new feature for WhatsApp Channels. As per the report, the feature is currently in the beta stage and is available to beta testers on Android and iOS devices. The rumoured new feature will allow channel admins to create quizzes that followers can take directly within the channel. Much like the polls feature, admins will be able to add a question and provide multiple answer options. Furthermore, they will also have the option to include images with each answer, which can be', 'Soon you can share WhatsApp Status only with Close Friends New Delhi: Privacy controls on WhatsApp may soon get more personal. A new Android beta update suggests the company is preparing a feature that lets users choose a Close Friends list for Status updates, giving people tighter control over who sees what. The discovery comes from WABetaInfo, which tracks upcoming WhatsApp features through beta releases. The latest Android beta version 2.26.5.13, now available via the Google Play Beta Program, hints that WhatsApp is actively building this option, though it is not yet available for testing. WhatsApp working on Close Friends list for Status privacy | Image source: WaBetaInfo According to WABetaInfo, WhatsApp is working on a feature that will allow users to select specific contacts as Close Friends for Status sharing. Once available, users will be able to decide whether a Status update goes to everyone, selected contacts, or only to their Close Friends. More accurately, WABetaInfo notes that users will first need to choose who they consider Close Friends. This can be done directly from Status privacy settings or from within the Status interface itself. From what has been spotted so far, users will be able to create and manage their Close F']"
14,11,14_fentanyl_drugs_marijuana_substances,"['fentanyl', 'drugs', 'marijuana', 'substances', 'addiction', 'alcohol', 'public safety', 'patients', 'advisory', 'public health']","['DEA warns fentanyl mixtures overwhelming overdose reversal drug (The Center Square) – The U.S. Drug Enforcement Administration warned Americans Tuesday that fentanyl is increasingly mixed with a dangerous array of synthetic substances that can limit the effectiveness of naloxone, the standard overdose reversal drug, making the illicit drug supply more unpredictable and more lethal than ever. Law enforcement and public health officials are seeing fentanyl combined with xylazine, medetomidine, nitazenes and cychlorphine – substances that either cannot be reversed by naloxone or require multiple doses to counter, the DEA said in a public safety advisory. Users typically have no way of knowing what is in the drugs they are taking. The advisory arrives as the DEA and the Trump administration have been touting significant progress against fentanyl. Enforcement pressure drove the share of fentanyl pills containing a potentially lethal dose from 76% in fiscal 2023 to 29% in fiscal 2025, a result the agency has repeatedly cited as a win. But the DEA\'s own 2025 National Drug Threat Assessment warned that the declining purity trend ""does not mean that street-level fentanyl is less dangerous,"" pointing directly to adulteration as the compensating threat. C', 'DEA warns fentanyl mixtures overwhelming overdose reversal drug (The Center Square) – The U.S. Drug Enforcement Administration warned Americans Tuesday that fentanyl is increasingly mixed with a dangerous array of synthetic substances that can limit the effectiveness of naloxone, the standard overdose reversal drug, making the illicit drug supply more unpredictable and more lethal than ever. Law enforcement and public health officials are seeing fentanyl combined with xylazine, medetomidine, nitazenes and cychlorphine – substances that either cannot be reversed by naloxone or require multiple doses to counter, the DEA said in a public safety advisory. Users typically have no way of knowing what is in the drugs they are taking. The advisory arrives as the DEA and the Trump administration have been touting significant progress against fentanyl. Enforcement pressure drove the share of fentanyl pills containing a potentially lethal dose from 76% in fiscal 2023 to 29% in fiscal 2025, a result the agency has repeatedly cited as a win. But the DEA\'s own 2025 National Drug Threat Assessment warned that the declining purity trend ""does not mean that street-level fentanyl is less dangerous,"" pointing directly to adulteration as the compensating threat. C', 'DEA warns fentanyl mixtures overwhelming overdose reversal drug (The Center Square) – The U.S. Drug Enforcement Administration warned Americans Tuesday that fentanyl is increasingly mixed with a dangerous array of synthetic substances that can limit the effectiveness of naloxone, the standard overdose reversal drug, making the illicit drug supply more unpredictable and more lethal than ever. Law enforcement and public health officials are seeing fentanyl combined with xylazine, medetomidine, nitazenes and cychlorphine – substances that either cannot be reversed by naloxone or require multiple doses to counter, the DEA said in a public safety advisory. Users typically have no way of knowing what is in the drugs they are taking. The advisory arrives as the DEA and the Trump administration have been touting significant progress against fentanyl. Enforcement pressure drove the share of fentanyl pills containing a potentially lethal dose from 76% in fiscal 2023 to 29% in fiscal 2025, a result the agency has repeatedly cited as a win. But the DEA\'s own 2025 National Drug Threat Assessment warned that the declining purity trend ""does not mean that street-level fentanyl is less dangerous,"" pointing directly to adulteration as the compensating threat. C']"
15,10,15_surgical_surgeons_surgery_memorial hospital,"['surgical', 'surgeons', 'surgery', 'memorial hospital', 'procedures', 'dr', 'laser', 'fraser', 'health care', 'precision']","['VIDEO: $5.5M robotic surgery system arrives at Surrey Memorial Hospital Published 12:10 pm Tuesday, January 27, 2026 By Anna Burns The da Vinci Xi System has been unpacked and calibrated and is being held in a temporary location until its permanent location is finished. Fraser Health said that it expects it to “go-live” later in the spring. (Fraser Health/ Contributed to Surrey Now-Leader) Health care workers pose in front of the da Vinci Xi System. (Fraser Health/ Contributed to Surrey Now-Leader) Surrey Memorial Hospital is one step closer to providing robotic-assisted surgery with the arrival of the da Vinci Xi Robotic Surgery system. It is expected to be used in surgeries in the spring. “With the aid of the da Vinci Xi system, we can expand minimally invasive thoracic and foregut surgery, and we can do operations with greater precision and accuracy,” says Dr Ahmad Ashrafi, regional division head and chief of thoracic surgery for Fraser Health. “Patients may experience quicker recovery times, and we can carry out more complex procedures right here in Surrey, using minimally invasive techniques. This advanced technology will also help us attract and retain top surgical talent at Surrey Memorial Hospital.” Construction is underway on an operating room', 'VIDEO: $5.5M robotic surgery system arrives at Surrey Memorial Hospital Published 12:10 pm Tuesday, January 27, 2026 By Anna Burns The da Vinci Xi System has been unpacked and calibrated and is being held in a temporary location until its permanent location is finished. Fraser Health said that it expects it to “go-live” later in the spring. (Fraser Health/ Contributed to Surrey Now-Leader) Health care workers pose in front of the da Vinci Xi System. (Fraser Health/ Contributed to Surrey Now-Leader) Surrey Memorial Hospital is one step closer to providing robotic-assisted surgery with the arrival of the da Vinci Xi Robotic Surgery system. It is expected to be used in surgeries in the spring. “With the aid of the da Vinci Xi system, we can expand minimally invasive thoracic and foregut surgery, and we can do operations with greater precision and accuracy,” says Dr Ahmad Ashrafi, regional division head and chief of thoracic surgery for Fraser Health. “Patients may experience quicker recovery times, and we can carry out more complex procedures right here in Surrey, using minimally invasive techniques. This advanced technology will also help us attract and retain top surgical talent at Surrey Memorial Hospital.” Construction is underway on an operating room', 'VIDEO: $5.5M robotic surgery system arrives at Surrey Memorial Hospital Published 12:10 pm Tuesday, January 27, 2026 By Anna Burns The da Vinci Xi System has been unpacked and calibrated and is being held in a temporary location until its permanent location is finished. Fraser Health said that it expects it to “go-live” later in the spring. (Fraser Health/ Contributed to Surrey Now-Leader) Health care workers pose in front of the da Vinci Xi System. (Fraser Health/ Contributed to Surrey Now-Leader) Surrey Memorial Hospital is one step closer to providing robotic-assisted surgery with the arrival of the da Vinci Xi Robotic Surgery system. It is expected to be used in surgeries in the spring. “With the aid of the da Vinci Xi system, we can expand minimally invasive thoracic and foregut surgery, and we can do operations with greater precision and accuracy,” says Dr Ahmad Ashrafi, regional division head and chief of thoracic surgery for Fraser Health. “Patients may experience quicker recovery times, and we can carry out more complex procedures right here in Surrey, using minimally invasive techniques. This advanced technology will also help us attract and retain top surgical talent at Surrey Memorial Hospital.” Construction is underway on an operating room']"
16,9,16_creams_surgery_injections_cardiovascular,"['creams', 'surgery', 'injections', 'cardiovascular', 'patients', 'medicine', 'healthcare services', 'clinics', 'health complications', 'treatments']","['Could AI help treat people with prostate cancer? A groundbreaking study is set to find out A new study is set to investigate how AI could significantly improve doctors’ decisions regarding prostate cancer treatment. While diagnostic methods for the disease have become safer and more precise, medical professionals still face considerable challenges in accurately assessing its aggressiveness in individual patients. This difficulty can lead to some men undergoing invasive procedures such as surgery or radiotherapy, when a less aggressive monitoring approach might have been more appropriate. The crucial Vanguard Path study, spearheaded by researchers at the University of Oxford, is being funded with a £1.9m grant from the charity Prostate Cancer UK to address this vital issue. Experts will first test the technology – called ArteraAI Prostate Biopsy Assay – on prostate biopsy samples from men who have already been diagnosed and treated for the disease and have at least five years of follow-up data. The study will compare how well the predictions made by the AI tool match what happened to patients in the real world. It will then be tested in real clinics on biopsies from men as they are diagnosed, with a focus on cases in which doctors find it hard to decide the best course of', 'Atlanta, GA Lip Fillers for Fuller, Natural-Looking Lips: Treatments Announced Oculus Plastic Surgery (404-256-1500) announces lip filler injections as a non-surgical option for lip enhancement, reflecting rising demand for minimally invasive aesthetic treatments focused on proportion, symmetry, and reversible facial volume adjustment. Atlanta, United States, April 24, 2026 -- Oculus Plastic Surgery recently announced the availability of lip filler injections as part of its non-surgical facial aesthetic services, offering patients a minimally invasive option to enhance lip volume, definition, and overall facial balance. The treatment uses hyaluronic acid-based dermal fillers, a substance naturally found in the body that is commonly used in aesthetic medicine to restore soft tissue volume. More information is available at According to the American Society of Plastic Surgeons (ASPS), lip augmentation using injectable materials accounted for approximately 1.45 million procedures last year, reflecting its position among the top five non-surgical aesthetic treatments nationwide. The data underscores sustained demand for injectable treatments that address facial volume changes without surgical intervention. The procedure involves carefully placed injections of derm', ""Mammograms may reveal hidden heart risks for women, Penn State study finds Routine mammograms are best known as a front-line tool for detecting breast cancer. But new research suggests the same X-ray images may also offer an early warning sign for cardiovascular disease — the leading cause of death among women. A study presented at a Dec. 3 Radiological Society of North America meeting found that calcium deposits visible in the arteries of the breast can help predict a woman’s future risk of heart attack, heart failure, stroke and death. The findings add to growing evidence that mammograms may hold untapped value beyond cancer screening. Javascript is required for you to be able to read premium content. Please enable it in your browser settings. Copyright 2025 Tribune Content Agency. We're always interested in hearing about news in our community. Let us know what's going on! Sorry, there are no recent results for popular commented articles. Success! An email has been sent to with a link to confirm list signup. Error! There was an error processing your request. Friday night's high school football scores delivered to your inbox every Saturday morning! Would you like to receive our daily news? Signup today!""]"
