Topic,Count,Name,Representation,Representative_Docs
41,13,41_tariffs imposed_tariffs_tariff_tariff rate,"['tariffs imposed', 'tariffs', 'tariff', 'tariff rate', 'international trade', 'president donald', 'supreme court', 'pence', 'imposed', 'vice president']","[""Groups ask trade court to pause Trump's new tariffs amid legal fight (The Center Square) – Several groups joined together to ask a Manhattan trade court to pause President Donald Trump's latest wave of tariffs as states and small businesses move ahead with legal challenges. A coalition of advocacy groups is urging the U.S. Court of International Trade to halt President Donald Trump's newly imposed tariffs, calling the measures both unprecedented and potentially unconstitutional. Their legal challenge follows the president's imposition of a 10% tariff on all imports under a rarely used provision, Section 122 of the Trade Act of 1974, just hours after the Supreme Court struck down his previous tariffs. Critics warn that allowing the continued collection of these tariffs could cause significant financial hardship for importers and ignite new debates over the scope of executive power. Trump invoked Section 122 of the Trade Act of 1974 to impose a 10% tariff on all imports, acting swiftly after the U.S. Supreme Court struck down his earlier tariffs under a different statute. Because Section 122 has never been applied in this context, its constitutionality and legal boundaries remain untested in court. Groups, including former Vice President Mike Pence's"", ""Groups ask trade court to pause Trump's new tariffs amid legal fight (The Center Square) – Several groups joined together to ask a Manhattan trade court to pause President Donald Trump's latest wave of tariffs as states and small businesses move ahead with legal challenges. A coalition of advocacy groups is urging the U.S. Court of International Trade to halt President Donald Trump's newly imposed tariffs, calling the measures both unprecedented and potentially unconstitutional. Their legal challenge follows the president's imposition of a 10% tariff on all imports under a rarely used provision, Section 122 of the Trade Act of 1974, just hours after the Supreme Court struck down his previous tariffs. Critics warn that allowing the continued collection of these tariffs could cause significant financial hardship for importers and ignite new debates over the scope of executive power. Trump invoked Section 122 of the Trade Act of 1974 to impose a 10% tariff on all imports, acting swiftly after the U.S. Supreme Court struck down his earlier tariffs under a different statute. Because Section 122 has never been applied in this context, its constitutionality and legal boundaries remain untested in court. Groups, including former Vice President Mike Pence's"", ""Groups ask trade court to pause Trump's new tariffs amid legal fight (The Center Square) – Several groups joined together to ask a Manhattan trade court to pause President Donald Trump's latest wave of tariffs as states and small businesses move ahead with legal challenges. A coalition of advocacy groups is urging the U.S. Court of International Trade to halt President Donald Trump's newly imposed tariffs, calling the measures both unprecedented and potentially unconstitutional. Their legal challenge follows the president's imposition of a 10% tariff on all imports under a rarely used provision, Section 122 of the Trade Act of 1974, just hours after the Supreme Court struck down his previous tariffs. Critics warn that allowing the continued collection of these tariffs could cause significant financial hardship for importers and ignite new debates over the scope of executive power. Trump invoked Section 122 of the Trade Act of 1974 to impose a 10% tariff on all imports, acting swiftly after the U.S. Supreme Court struck down his earlier tariffs under a different statute. Because Section 122 has never been applied in this context, its constitutionality and legal boundaries remain untested in court. Groups, including former Vice President Mike Pence's""]"
42,13,42_welfare_security benefits_disability_pensioners,"['welfare', 'security benefits', 'disability', 'pensioners', 'rising costs', 'social security', 'medicare', 'premiums', 'public sector', 'taxpayers']","['How much will DWP benefits and pensions rise following the budget? Benefits Budget 2025 Child Benefit Department for Work and Pensions DWP Pensions PIP Rachel Reeves Universal Credit National government Personal Finance DWP benefits including Universal Credit, Child Benefit, PIP, Carer\'s Allowance, and the State Pension are to increase in April 2026 after Rachel Reeves announced higher payments in her budget speech today. Anyone who claims DWP benefits should be in line for an increase in the next financial year, as the chancellor laid out plans to help pensioners, disabled people, parents, low earners, carers and unemployed people keep up with rising costs. Addressing MPs, Ms Reeves said: ""The broken welfare system that we inherited wrote off millions of people as too sick to work and we will reform that system so that it is a system that does not count the cost of failure, but one that protects people who cannot work and empowers those who can. ""We have brought back face-to-face assessments for disability benefits. Those are the face-to-face assessments that the shadow chancellor (Sir Mel Stride) got rid of when he was work and pensions secretary and our changes we have made to Universal Credit will get 15,000 people back into work, a figure con', 'How much will DWP benefits and pensions rise following the budget? Benefits Budget 2025 Child Benefit Department for Work and Pensions DWP Pensions PIP Rachel Reeves Universal Credit National government Personal Finance DWP benefits including Universal Credit, Child Benefit, PIP, Carer\'s Allowance, and the State Pension are to increase in April 2026 after Rachel Reeves announced higher payments in her budget speech today. Anyone who claims DWP benefits should be in line for an increase in the next financial year, as the chancellor laid out plans to help pensioners, disabled people, parents, low earners, carers and unemployed people keep up with rising costs. Addressing MPs, Ms Reeves said: ""The broken welfare system that we inherited wrote off millions of people as too sick to work and we will reform that system so that it is a system that does not count the cost of failure, but one that protects people who cannot work and empowers those who can. ""We have brought back face-to-face assessments for disability benefits. Those are the face-to-face assessments that the shadow chancellor (Sir Mel Stride) got rid of when he was work and pensions secretary and our changes we have made to Universal Credit will get 15,000 people back into work, a figure con', 'How much will DWP benefits and pensions rise following the budget? Benefits Budget 2025 Child Benefit Department for Work and Pensions DWP Pensions PIP Rachel Reeves Universal Credit National government Personal Finance DWP benefits including Universal Credit, Child Benefit, PIP, Carer\'s Allowance, and the State Pension are to increase in April 2026 after Rachel Reeves announced higher payments in her budget speech today. Anyone who claims DWP benefits should be in line for an increase in the next financial year, as the chancellor laid out plans to help pensioners, disabled people, parents, low earners, carers and unemployed people keep up with rising costs. Addressing MPs, Ms Reeves said: ""The broken welfare system that we inherited wrote off millions of people as too sick to work and we will reform that system so that it is a system that does not count the cost of failure, but one that protects people who cannot work and empowers those who can. ""We have brought back face-to-face assessments for disability benefits. Those are the face-to-face assessments that the shadow chancellor (Sir Mel Stride) got rid of when he was work and pensions secretary and our changes we have made to Universal Credit will get 15,000 people back into work, a figure con']"
43,13,43_art_artists_arts_community,"['art', 'artists', 'arts', 'community', 'exhibition', 'storytelling', 'creativity', 'admiration', 'newsroom', 'butte']","['Crown Point confirmed in Turning Point USA\'s \'Make Heaven Crowded\' tour The ""Make Heaven Crowded"" tour, hosted by Turning Point USA, will make a stop at a local church in Crown Point this summer as one of 33 confirmed locations. Chefs of Steel Saul Chavez puts some last minute touches on his carne asada (left) and salmon at Mi Sueño. Chefs of Steel Saul Chavez prepares carne asada and salmon at Mi Sueño. Chefs of Steel Saul Chavez prepares carne asada and salmon at Mi Sueño. Indiana University Northwest Chancellor Arrick Jackson speaks during a program announcing the ""Scholarship Plus"" at 21st Century Charter School in Gary. Jai\'dyn Mitchell sings the National Anthem during a program announcing the ""Scholarship Plus"" program at 21st Century Charter School in Gary. Marcus Hurt offers a prayer during a program announcing the ""Scholarship Plus"" program at 21st Century Charter School in Gary. Vanessa Allen-McCloud speaks during a program announcing the ""Scholarship Plus"" at 21st Century Charter School in Gary. Samara speaks at the Boys and Girls Club of Greater Northwest Indiana Youth of the Year Awards. Chris Mahlmann emcees the Boys and Girls Club of Greater Northwest Indiana Youth of the Year Awards. JaMal speaks at the Boys and Girls Club of Greater No', ""Expert reveals the five dog breeds to avoid - 1 is top family favourite Choosing the right dog breed can be both thrilling and overwhelming. With hundreds of options, each with its own temperament, activity level, grooming needs, and potential health issues, finding the perfect fit requires careful consideration. While some dogs thrive in homes with children or adapt easily to a calm lifestyle, others require constant exercise, mental stimulation, or may have costly medical concerns. The reality of dog ownership is often more complex than the adorable posts we see online. That's why consulting experienced professionals and doing thorough research is essential. READ MORE: ‘I’m a vet - this is the reason to wash your dog’s paws after December walks’ READ MORE: 5 dog breeds that are 'more likely to bite' and some may surprise you We use your sign-up to provide content in ways you've consented to and to improve our understanding of you. This may include adverts from us and 3rd parties based on our understanding. You can unsubscribe at any time. Read our Privacy Policy Dog behaviourist Casey Ray, who has nearly 30 years of experience, recently shared his insights on breeds that can be particularly challenging for the average owner. In a YouTube video, he em"", 'West Sacramento exhibit at Gallery 1075 features local artists for Black History Month Your contribution directly supports our newsroom. The West Sacramento Department of Parks and Recreation is showcasing art by local Black artists in its Gallery 1075 space through February. “Throughout the rest of the month people can come in anytime the community center is open … to just enjoy the pieces themselves,” gallery curator Evan Harté said. “The art reception [on Feb. 12] though is going to be extra special because we’re going to have the artists actually come out and talk with the community, get to know them and talk about their processes.” One of the artists featured is Sacramento-based Danitta Nelson, who works on her art in-between taking care of her children and working as a program manager at a mental health care facility. Nelson said she loves to do 3D art where she can attach things to her illustrations, especially hair. “My biological father was an artist and my sister was an artist, but they don’t do art anymore,” Nelson said. She added that a brain injury from a car accident means her sister no longer creates art. “So I do it to try and keep it going for the family so it doesn’t just die down.” Nelson said she started actively pursuing presenting in galleries a']"
44,11,44_deer hunting_tennessee_state parks_hunting,"['deer hunting', 'tennessee', 'state parks', 'hunting', 'west virginia', 'permits', 'deer', 'arkansas', 'hikes', 'deadline']","['Mid-season WMA waterfowl quota hunt app period to be held Oct. 22-Nov. 12 TWRA News Tennessee Wildlife Resources Agency (TWRA) announced that the application period for the 2025 Mid-Season Wildlife Management Area (WMA) Waterfowl Quota Hunt will be open from Wednesday, Oct. 22 through Wednesday, Nov. 12. Applications can be submitted online at gooutdoorstennessee.com, through the TWRA mobile app, at TWRA regional offices, or at any TWRA license agent. Mailed applications will not be accepted, and applicants must be at least 16 years old. Detailed application instructions, WMA locations, and general waterfowl quota hunt information are available on the TWRA Quota Hunts webpage. The deadline to submit applications is Wednesday, Nov. 12 at 11:59 p.m. (CST). A person may only submit one application, which can include up to 48 unique hunt choices; hunt choices may not be repeated. Qualifying parties must have at least four members, with a maximum of eight. Successful applicants will receive an email with instructions to log in and must claim their permit by Monday, Nov. 24 at 11:59 p.m. CST. Each party member must claim their own permit. Permits will be available to print after they have been claimed. Individuals in the party who fail to claim their permit fo', 'Mid-season WMA waterfowl quota hunt app period to be held Oct. 22-Nov. 12 TWRA News Tennessee Wildlife Resources Agency (TWRA) announced that the application period for the 2025 Mid-Season Wildlife Management Area (WMA) Waterfowl Quota Hunt will be open from Wednesday, Oct. 22 through Wednesday, Nov. 12. Applications can be submitted online at gooutdoorstennessee.com, through the TWRA mobile app, at TWRA regional offices, or at any TWRA license agent. Mailed applications will not be accepted, and applicants must be at least 16 years old. Detailed application instructions, WMA locations, and general waterfowl quota hunt information are available on the TWRA Quota Hunts webpage. The deadline to submit applications is Wednesday, Nov. 12 at 11:59 p.m. (CST). A person may only submit one application, which can include up to 48 unique hunt choices; hunt choices may not be repeated. Qualifying parties must have at least four members, with a maximum of eight. Successful applicants will receive an email with instructions to log in and must claim their permit by Monday, Nov. 24 at 11:59 p.m. CST. Each party member must claim their own permit. Permits will be available to print after they have been claimed. Individuals in the party who fail to claim their permit fo', 'Mid-season WMA waterfowl quota hunt app period to be held Oct. 22-Nov. 12 TWRA News Tennessee Wildlife Resources Agency (TWRA) announced that the application period for the 2025 Mid-Season Wildlife Management Area (WMA) Waterfowl Quota Hunt will be open from Wednesday, Oct. 22 through Wednesday, Nov. 12. Applications can be submitted online at gooutdoorstennessee.com, through the TWRA mobile app, at TWRA regional offices, or at any TWRA license agent. Mailed applications will not be accepted, and applicants must be at least 16 years old. Detailed application instructions, WMA locations, and general waterfowl quota hunt information are available on the TWRA Quota Hunts webpage. The deadline to submit applications is Wednesday, Nov. 12 at 11:59 p.m. (CST). A person may only submit one application, which can include up to 48 unique hunt choices; hunt choices may not be repeated. Qualifying parties must have at least four members, with a maximum of eight. Successful applicants will receive an email with instructions to log in and must claim their permit by Monday, Nov. 24 at 11:59 p.m. CST. Each party member must claim their own permit. Permits will be available to print after they have been claimed. Individuals in the party who fail to claim their permit fo']"
45,11,45_racing_raceway_fourth place_qualifying,"['racing', 'raceway', 'fourth place', 'qualifying', 'chevrolet', 'kyle', 'hall famer', 'tie', 'richmond', 'fast']","[""Denny Hamlin qualifies first at Martinsville, moves into tie for 10th in NASCAR poles MARTINSVILLE, Va. — Denny Hamlin earned his fifth pole position at Martinsville Speedway and 49th of his Cup Series career, tying him with NASCAR Hall of Famer Bobby Isaac for 10th all time. The Joe Gibbs Racing star turned a 98.241-mph lap Saturday in the No. 11 Toyota to beat William Byron, whose No. 24 Chevrolet qualified second at 97.957 mph for Sunday’s 400-lap race. With his win two weeks ago at Las Vegas Motor Speedway, Hamlin, 45, broke a tie with Kevin Harvick for 10th on the all-time win list in NASCAR's premier series. He is two poles away from tying the career total of Ryan Newman, one of the greatest qualifiers in NASCAR history. “It’s pretty awesome,” said Hamlin, who grew up a few hours east of Martinsville in the Richmond, Virginia, suburb of Chesterfield. “Really with age, the hardest part is still having the fast time. It’s one thing to be able to manage races and use your experience to your advantage. But usually the first thing to go is your all-out speed, and we’re still knocking off poles, which is really good. I was around when Newman was just unstoppable in qualifying. So damn, I didn’t know he had that many.” Hamlin has six wins at Martinsville, and his vic"", ""Denny Hamlin qualifies first at Martinsville, moves into tie for 10th in NASCAR poles MARTINSVILLE, Va. — Denny Hamlin earned his fifth pole position at Martinsville Speedway and 49th of his Cup Series career, tying him with NASCAR Hall of Famer Bobby Isaac for 10th all time. The Joe Gibbs Racing star turned a 98.241-mph lap Saturday in the No. 11 Toyota to beat William Byron, whose No. 24 Chevrolet qualified second at 97.957 mph for Sunday’s 400-lap race. With his win two weeks ago at Las Vegas Motor Speedway, Hamlin, 45, broke a tie with Kevin Harvick for 10th on the all-time win list in NASCAR's premier series. He is two poles away from tying the career total of Ryan Newman, one of the greatest qualifiers in NASCAR history. “It’s pretty awesome,” said Hamlin, who grew up a few hours east of Martinsville in the Richmond, Virginia, suburb of Chesterfield. “Really with age, the hardest part is still having the fast time. It’s one thing to be able to manage races and use your experience to your advantage. But usually the first thing to go is your all-out speed, and we’re still knocking off poles, which is really good. I was around when Newman was just unstoppable in qualifying. So damn, I didn’t know he had that many.” Hamlin has six wins at Martinsville, and his vic"", ""Denny Hamlin qualifies first at Martinsville, moves into tie for 10th in NASCAR poles MARTINSVILLE, Va. — Denny Hamlin earned his fifth pole position at Martinsville Speedway and 49th of his Cup Series career, tying him with NASCAR Hall of Famer Bobby Isaac for 10th all time. The Joe Gibbs Racing star turned a 98.241-mph lap Saturday in the No. 11 Toyota to beat William Byron, whose No. 24 Chevrolet qualified second at 97.957 mph for Sunday’s 400-lap race. With his win two weeks ago at Las Vegas Motor Speedway, Hamlin, 45, broke a tie with Kevin Harvick for 10th on the all-time win list in NASCAR's premier series. He is two poles away from tying the career total of Ryan Newman, one of the greatest qualifiers in NASCAR history. “It’s pretty awesome,” said Hamlin, who grew up a few hours east of Martinsville in the Richmond, Virginia, suburb of Chesterfield. “Really with age, the hardest part is still having the fast time. It’s one thing to be able to manage races and use your experience to your advantage. But usually the first thing to go is your all-out speed, and we’re still knocking off poles, which is really good. I was around when Newman was just unstoppable in qualifying. So damn, I didn’t know he had that many.” Hamlin has six wins at Martinsville, and his vic""]"
46,11,46_media platforms_meta platforms_addiction_lawsuits,"['media platforms', 'meta platforms', 'addiction', 'lawsuits', 'google', 'social', 'tiktok', 'advertising', 'platforms', 'subscription']","[""NHK moves to crack down on free riders NHK is cracking down on households with TVs that have failed to pay subscription fees in order to prevent free riders from using its services, by limiting who can access its news website as well as setting up a new team in charge of enforcement. The public broadcaster last week began requiring users to enter their NHK subscription information to use NHK One, its online news website that was newly launched in October to replace its news site. The move is part of an effort to reduce the number of users who are watching NHK channels and accessing news on its website without paying its mandatory subscription fee. In a time of both misinformation and too much information, quality journalism is more crucial than ever.By subscribing, you can help us get the story right. With your current subscription plan you can comment on stories. However, before writing your first comment, please create a display name in the Profile section of your subscriber account page. Your subscription plan doesn't allow commenting. To learn more see our FAQ Sponsored contents planned and edited by JT Media Enterprise Division. 広告出稿に関するおといあわせはこちらまで Read more"", ""Google, Meta, push back on addiction claims in landmark social media trial The TikTok app logo is shown on an iPhone on Friday, January 17, 2025, in Houston. LOS ANGELES (AP) — Jurors in a landmark social media case that seeks to hold tech companies responsible for harms to children got their first glimpse into what will be a lengthy trial characterized by dueling narratives from the plaintiffs and the two remaining defendants, Meta and YouTube. At the core of the Los Angeles case is a 20-year-old identified only by the initials “KGM,” whose case could determine how thousands of similar lawsuits will play out. KGM and the cases of two other plaintiffs have been selected to be bellwether trials — essentially test cases for both sides to see how their arguments play out before a jury. Comparing social media platforms to casinos and addictive drugs, lawyer Mark Lanier delivered opening statements Monday in the Los Angeles Superior Court trial that seeks to hold Instagram owner Meta and Google's YouTube responsible for addictive features and harms to children who use their products. Two other defendants, TikTok and Snap, have settled the case. Meta lawyer Paul Schmidt spoke of the disagreement within the scientific community over social media addiction, with"", 'Instagram chief rejects idea of social media addiction The head of Meta\'s Instagram has testified during a landmark social media trial in Los Angeles that he disagrees with the idea that people can be clinically addicted to social media platforms. The question of addiction is a key pillar of the case, where plaintiffs seek to hold social media companies responsible for harms to children who use their platforms. Meta Platforms and Google\'s YouTube are the two remaining defendants in the case, which TikTok and Snap have settled. At the core of the Los Angeles case is a 20-year-old identified only by the initials ""KGM"", whose lawsuit could determine how thousands of similar lawsuits against social media companies would play out. She and two other plaintiffs have been selected for bellwether trials - essentially test cases for both sides to see how their arguments play out before a jury. Sign-up to our weekly newsletter for free Adam Mosseri, who has headed Instagram since 2018, said it was important to differentiate between clinical addiction and what he called problematic use. The plaintiff\'s lawyer, however, presented quotes directly from Mosseri in a podcast interview a few years ago where he used the term addiction in relation to soci']"
