Topic,Count,Name,Representation,Representative_Docs
-1,505,-1_government_students_community_trump,"['government', 'students', 'community', 'trump', 'media', 'health', 'leaders', 'school', 'industry', 'department']","[""Iran Protests Quelled Since Deadly Crackdown, Residents Say A heavy police presence and deadly crackdowns on protesters appeared to have largely suppressed demonstrations in many cities and towns across Iran, according to several witnesses and a human rights group. For weeks, Iran has been convulsed by protests sparked by a collapsing economy and a currency in free fall, with the demonstrations snowballing into a broader antigovernment movement. Authorities have sought to quell the protests with brutal force and have plunged the country into a communications blackout that has made it difficult to know what’s happening. Javascript is required for you to be able to read premium content. Please enable it in your browser settings. Log In Keep it Clean. Please avoid obscene, vulgar, lewd, racist or sexually-oriented language. PLEASE TURN OFF YOUR CAPS LOCK. Don't Threaten. Threats of harming another person will not be tolerated. Be Truthful. Don't knowingly lie about anyone or anything. Be Nice. No racism, sexism or any sort of -ism that is degrading to another person. Be Proactive. Use the 'Report' link on each comment to let us know of abusive posts. Share with Us. We'd love to hear eyewitness accounts, the history behind an article. SIERRA VI"", ""Teen drug use remains low, but survey finds small rise in heroin and cocaine use Students walk the halls at a high school in Philadelphia on Aug. 29, 2013. NEW YORK (AP) — Teen use of alcohol, nicotine and marijuana remains at record lows, according to national survey results released Wednesday. They consume a lot of energy drinks, though. And there are slight, but concerning, increases in heroin and cocaine use. Javascript is required for you to be able to read premium content. Please enable it in your browser settings. Story continues below video Copyright 2025 The Associated Press. All rights reserved. This material may not be published, broadcast, rewritten or redistributed without permission. Log In Keep it Clean. Please avoid obscene, vulgar, lewd, racist or sexually-oriented language. PLEASE TURN OFF YOUR CAPS LOCK. Don't Threaten. Threats of harming another person will not be tolerated. Be Truthful. Don't knowingly lie about anyone or anything. Be Nice. No racism, sexism or any sort of -ism that is degrading to another person. Be Proactive. Use the 'Report' link on each comment to let us know of abusive posts. Share with Us. We'd love to hear eyewitness accounts, the history behind an article."", ""Anglo-French star Jane Birkin gets name on bridge over Paris canal Birkin's daughters, singer Lou Doillon and actor and singer Charlotte Gainsbourg attended the ceremony Anglo-French singer and film star Jane Birkin was honoured Saturday by the city she made her home after Paris named a footbridge over one of its canals after her. Birkin's daughters, singer Lou Doillon and actor and singer Charlotte Gainsbourg, were among the guests who attended the ceremony for their mother, who died in 2023 at the age of 76. Javascript is required for you to be able to read premium content. Please enable it in your browser settings. Originally published on doc.afp.com, part of the BLOX Digital Content Exchange. Log In Keep it Clean. Please avoid obscene, vulgar, lewd, racist or sexually-oriented language. PLEASE TURN OFF YOUR CAPS LOCK. Don't Threaten. Threats of harming another person will not be tolerated. Be Truthful. Don't knowingly lie about anyone or anything. Be Nice. No racism, sexism or any sort of -ism that is degrading to another person. Be Proactive. Use the 'Report' link on each comment to let us know of abusive posts. Share with Us. We'd love to hear eyewitness accounts, the history behind an article. Sorry, there are no recent results for popular""]"
0,1747,0_basketball_coach_football_win,"['basketball', 'coach', 'football', 'win', 'iran', 'team', 'national', 'trump', 'announced', 'president']","[""Bulgaria names manager to take over Russia's Lukoil refinery after US sanctions A parliamentary vote authorised the government to seize Lukoil's assets in the country Bulgaria on Friday nominated a senior government official to take control of a major Lukoil refinery in the east of the country following US sanctions against the Russian oil giant. The United States last month hit Russia's two biggest oil producers -- Rosneft and Lukoil -- with sanctions over its war in Ukraine. Javascript is required for you to be able to read premium content. Please enable it in your browser settings. Originally published on doc.afp.com, part of the BLOX Digital Content Exchange. Log In Keep it Clean. Please avoid obscene, vulgar, lewd, racist or sexually-oriented language. PLEASE TURN OFF YOUR CAPS LOCK. Don't Threaten. Threats of harming another person will not be tolerated. Be Truthful. Don't knowingly lie about anyone or anything. Be Nice. No racism, sexism or any sort of -ism that is degrading to another person. Be Proactive. Use the 'Report' link on each comment to let us know of abusive posts. Share with Us. We'd love to hear eyewitness accounts, the history behind an article."", ""T-Mobile adds harsh rule to flexible payment option for customers As a subscriber, you can share up to 3 articles each month with friends for free. Just click “Gift this Article” on this page, then copy the link or enter their email. Gifts are exclusive to subscribers, reset monthly, and each article can be redeemed once. T-Mobile has a new CEO, and the phone carrier is wasting no time in implementing drastic policy changes that impact customers. On Nov. 1, Srini Gopalan officially became CEO of T-Mobile, replacing Mike Sievert, who held the position for over five years. Javascript is required for you to be able to read premium content. Please enable it in your browser settings. Thanks for the feedback. Log In Keep it Clean. Please avoid obscene, vulgar, lewd, racist or sexually-oriented language. PLEASE TURN OFF YOUR CAPS LOCK. Don't Threaten. Threats of harming another person will not be tolerated. Be Truthful. Don't knowingly lie about anyone or anything. Be Nice. No racism, sexism or any sort of -ism that is degrading to another person. Be Proactive. Use the 'Report' link on each comment to let us know of abusive posts. Share with Us. We'd love to hear eyewitness accounts, the history behind an article. Monday, Oct 6, 2025 The Government has"", ""Josh Heupel, Tennessee Receive Strong Message From 5-Star RB As a subscriber, you can share up to 3 articles each month with friends for free. Just click “Gift this Article” on this page, then copy the link or enter their email. Gifts are exclusive to subscribers, reset monthly, and each article can be redeemed once. The Tennessee Volunteers had a disappointing season after making their first College Football Playoff in 2024. The Volunteers, under the leadership of head coach Josh Heupel, finished the 2025 season with an 8-5 record. That was after being ranked as high as No. 11 in the country. However, the team struggled down the stretch, losing four of its final seven games. As a result, it is now focused on building a championship contender for the upcoming season. Javascript is required for you to be able to read premium content. Please enable it in your browser settings. Log In Keep it Clean. Please avoid obscene, vulgar, lewd, racist or sexually-oriented language. PLEASE TURN OFF YOUR CAPS LOCK. Don't Threaten. Threats of harming another person will not be tolerated. Be Truthful. Don't knowingly lie about anyone or anything. Be Nice. No racism, sexism or any sort of -ism that is degrading to another person. Be Proactive. Use the 'Report""]"
1,75,1_passed away_linda_doris_grandmother,"['passed away', 'linda', 'doris', 'grandmother', 'died', 'gloria', 'mary', 'carol', 'memorial', 'birth death']","['Mary Louise Nichols Birth: 1948 Death: 2025 August 14, 1948 December 5, 2025 Mary Louise Nichols (nee Mary Louise Assel, age 77 passed away peacefully on December 5, 2025. She was born on August 14, 1948 in Chico, CA to her parents Albert and Gloria Assell and attended schools in Chico, graduating from Chico Senior High School in 1966. Mary married her loving husband, Will (“Bill”) Nichols, also of Chico, on June 21, 1968. Will and Mary were married for 57 years. Mary put her family above all else and was a dedicated wife, mother, grandmother, sister, and aunt. Mary was active in the Chico community. For many years, before her retirement from Chico Unified School District, she pursued her passion for teaching elementary school children to read. She was a member of local chapters of both the charitable organizations of Omega Nu and PEO. She enjoyed spending her free time in Chico golfing with Will and friends, playing tennis, volunteering at her children’s schools, attending dance club, and socializing with friends and neighbors. Although Mary was a lifetime resident of Chico, she spent much of her time in the mountains at her cabins in Bucks Lake and Whitehawk Ranch and at her family home in the beach', 'Mary Kuljis Fiamengo Birth: 1934 Death: 2025 Mary Fiamengo passed away peacefully on November 6, 2025. Mary was born on September 20, 1934 in Komiza, Croatia. She was preceded in death by her beloved husband, Pete J. Fiamengo. Mary was a devoted wife, mother, sister, grandmother, great grandmother, aunt and dear friend. She is survived by her daughters, Deborah Dwight and Jennifer (Tim) Lovoy; her grandchildren, Peter Dwight (Cassandra), John Lovoy (Sloane), Ellen (Justin) Ralph and Lauren Dwight (Tim); her great grandchildren, Jordana Koonce, Hank Ralph and Margot Dwight and her sister, Betty Galosic. She was a long standing member of Mary Star of the Sea Church Velike Gospe Society, San Pedro Peninsula Cancer Guild and San Pedro Peninsula Hospital Bookworm Guild. Mary was a woman of grace, elegance and kindness; always extending a gentle word, a thoughtful gesture or a warm embrace. A memorial mass will be held at 10:30 am on Monday, November 17, 2025 at Mary Star of the Sea Catholic Church. In lieu of flowers, Mary requested that a donation in her memory be made to the San Pedro Peninsula Cancer Guild or to Mary Star of the Sea High School. Send Flowers Plant a Tree Send a Meal', 'Linda Sue (Jordan) Schlosser Birth: 1950 Death: 2025 Linda Sue (Jordan) Schlosser March 16, 1950-December 15, 2025 passed away peacefully surrounded by her family at her home in San Pancho, Mexico. Survived by her husband of 41 years, Phil Schlosser, her mother Gerry, daughter Kelly Noel, son Kevin Noel and wife Jennifer and her grandchildren Trevor and Lena. She was preceded in death by her father, Wayne Henry Jordan and brother Michael Wayne Jordan. Linda was born and raised in San Rafael, CA and graduated from Terra Linda High School. Linda loved sunshine, warm weather and travel. She was an outstanding cook and loved to entertain. Her great adventure was moving to Mexico, building a wonderful home filled with warmth, family, friends and great meals. She loved traveling throughout Mexico and Italy. Her family requests that gifts in lieu of flowers be made in Linda’s name to St. Jude Children’s Research Hospital. Forever deep in my soul, The memory of your love Fills my heart And I am never alone. Honor with Flowers In memory of Linda Sue Plant a Living Memorial In memory of Linda Sue']"
2,73,2_passed away_died_francisco_dan,"['passed away', 'died', 'francisco', 'dan', 'birth death', 'jerry', 'grandfather', 'david', 'michael', 'career']","['Anthony Duarte Birth: 1980 Death: 2025 Anthony Duarte, of La Puente, California, passed away on Wednesday, October 29, 2025, surrounded by love and family. Born on June 9, 1980, in West Covina, California, to Doreen Cardenas and Gildardo Duarte, Anthony was raised with deep love and guidance, and shared a profoundly special bond with his father Robert Cardenas, who helped shape the man he became. Anthony lived a life marked by warmth, creativity, and generosity. His kindness was as constant as his humor, and he approached every day with an open heart and an unwavering sense of purpose. Anthony’s passions reflected his deep belief in connection — through both community and service. He had a profound dedication to civic life, demonstrated by his years of service on the Hacienda La Puente Unified School Board, his time working for a member of Congress, and his contributions to the California Democratic Party. Through these roles, he championed education, representation, and opportunity for others, always guided by empathy and integrity. Anthony cared deeply for his friends and made a lasting impact on everyone lucky enough to know him. He was the first to reach out when someone needed support and al', 'Anthony Duarte Birth: 1980 Death: 2025 Anthony Duarte, of La Puente, California, passed away on Wednesday, October 29, 2025, surrounded by love and family. Born on June 9, 1980, in West Covina, California, to Doreen Cardenas and Gildardo Duarte, Anthony was raised with deep love and guidance, and shared a profoundly special bond with his father Robert Cardenas, who helped shape the man he became. Anthony lived a life marked by warmth, creativity, and generosity. His kindness was as constant as his humor, and he approached every day with an open heart and an unwavering sense of purpose. Anthony’s passions reflected his deep belief in connection — through both community and service. He had a profound dedication to civic life, demonstrated by his years of service on the Hacienda La Puente Unified School Board, his time working for a member of Congress, and his contributions to the California Democratic Party. Through these roles, he championed education, representation, and opportunity for others, always guided by empathy and integrity. Anthony cared deeply for his friends and made a lasting impact on everyone lucky enough to know him. He was the first to reach out when someone needed support and al', 'Anthony Duarte Birth: 1980 Death: 2025 Anthony Duarte, of La Puente, California, passed away on Wednesday, October 29, 2025, surrounded by love and family. Born on June 9, 1980, in West Covina, California, to Doreen Cardenas and Gildardo Duarte, Anthony was raised with deep love and guidance, and shared a profoundly special bond with his father Robert Cardenas, who helped shape the man he became. Anthony lived a life marked by warmth, creativity, and generosity. His kindness was as constant as his humor, and he approached every day with an open heart and an unwavering sense of purpose. Anthony’s passions reflected his deep belief in connection — through both community and service. He had a profound dedication to civic life, demonstrated by his years of service on the Hacienda La Puente Unified School Board, his time working for a member of Congress, and his contributions to the California Democratic Party. Through these roles, he championed education, representation, and opportunity for others, always guided by empathy and integrity. Anthony cared deeply for his friends and made a lasting impact on everyone lucky enough to know him. He was the first to reach out when someone needed support and al']"
3,35,3_family_family members_gifts_friendships,"['family', 'family members', 'gifts', 'friendships', 'santa', 'parents', 'friends', 'christmas', 'husband', 'siblings']","['Asking Eric: Family, friends don’t seem to appreciate time I put into tedious Christmas cookie tradition Dear Eric: My late mother made a special Christmas cookie that required tedious decorating, considering each person’s personal preference for toppings, and giving them as gifts to family and friends. They always had a place of honor on our family Christmas table. When she was no longer able, she gave me the cookie cutter, and my daughters and I took over the family tradition. It takes the three of us several days to make, bake, decorate, package and mail cookies to family members around the country. We enjoy doing it and feel like we’re continuing the fun and festive tradition. However, in recent years, not all of the recipients acknowledge receipt. At some point in their lives, they have all helped Grandma decorate, so they know the time involved. Because of past delivery issues, I track the boxes and inquire if I haven’t heard from them in a couple of days. Last year, one response was “yes we got them.” This feels unappreciative! In the past most would text a picture of their children with the cookies, which we really enjoyed. We rarely see any of them anymore, as they are busy raising their families and don’t live nearby. This seems like a way for us to continue somewhat of a co', 'Asking Eric: Can mom work through tension in son’s relationship with dad so they can celebrate special birthday? Dear Eric: My son is turning 40 on December 22. My husband and I are at a quandary as to how to celebrate him. There have been issues between my husband and him over things from his childhood. We did a special trip for his older brother when he turned 40 and would like to do something special for this son’s 40th as well. Our daughter-in-law has made special plans for him and we are not included. I understand that, but I need some ideas as to how to celebrate this extra special year without rocking the boat. I love my son with all my heart, as I do all my children, and want his 40th birthday to be memorable in a positive way. Any suggestions? – Mom Who Wants to Celebrate Dear Mom: The issues your son and your husband are having may be an obstacle, but they aren’t insurmountable. And the thing that can get them on the path to resolution is the same thing that can get you answers about how to celebrate your son: open communication. It’s not within your purview to try to fix things between them, but you have your own relationship with your son and so I’d encourage you to reach out and tell him what you told me: you want to celebrate him, you know things are difficult, and you’re lookin', 'Asking Eric: After 6 years sober, man is frustrated by his family’s hold on their hurt and distrust Dear Eric: I’ve just turned 40 this past year. The last 15 years I was in a horrible drug addiction. I lied and hurt and did terrible things to a lot of people, especially my family. About eight years ago they officially disowned me. Understandable. I’ve cleaned up and got my act together six years ago. At first, I tried to force my way back into their lives, which all refuted. I lashed out, said horrible things and stopped trying to be in their lives. My mom will stop by on my birthday for 10 minutes or so and drop a card off at Christmas. As for my two older brothers and my father, it’s radio silence. I guess what I’m asking is, what do I do to fix this and fast, as I said I’ve turned 40 this year, my parents are both 70. Time is running out, and I couldn’t imagine living my life without some kind of acceptance from my father. Or knowing he did or does love me. My heart breaks at the thought, but this is a real pickle. How can I fix a problem when the ones I need to fix it with won’t talk to me? Do I just keep ignoring their existence and put on this façade that I don’t care to my wife and 4-year-old son? What picture am I painting to my son, as he’s been guilty by association yo']"
4,31,4_covers_garment_sewing_bed,"['covers', 'garment', 'sewing', 'bed', 'fashion', 'luxury', 'cotton', 'organizer', 'shoppers', 'design']","[""Aldi's Foldable Trunk Organizer Is a Total Must-Have As a subscriber, you can share up to 3 articles each month with friends for free. Just click “Gift this Article” on this page, then copy the link or enter their email. Gifts are exclusive to subscribers, reset monthly, and each article can be redeemed once. A somewhat embarrassing confession: My car is a complete and total disorganized mess. The backseat? Occupied with extra coats and returns, I haven't gotten around to them yet, and clothes I'm definitely going to donate at some point, probably. The trunk? Somehow, even worse. In short, I need to get it together and clean up my act. This is why Aldi's sleek new foldable trunk organizer caught my eye immediately. Could this be the answer to my messy car woes? I think it just might be. Ride+Go's Foldable Trunk Organizer comes in four colors—black, green, gray and beige—giving you plenty of options. These trunk organizers are a total game changer, especially for people with super-busy schedules or, if you're like me, Type-B messes. Javascript is required for you to be able to read premium content. Please enable it in your browser settings. Log In Keep it Clean. Please avoid obscene, vulgar, lewd, racist or sexually-oriented language."", ""Sam's Club Is Selling a Versatile 12-Drawer Organizer That's a Serial Hobbyist's Dream Come True As a subscriber, you can share up to 3 articles each month with friends for free. Just click “Gift this Article” on this page, then copy the link or enter their email. Gifts are exclusive to subscribers, reset monthly, and each article can be redeemed once. Parade aims to feature only the best products and services. If you buy something via one of our links, we may earn a commission. I'm calling it now: 2026 will be the year of hobbies. Whether you love crafting, building LEGO sets, sewing, painting, putting together puzzles, crocheting or all of the above, there are plenty of different hobbies you can get into this year. Of course, many of these activities require supplies that can easily get scattered about and disorganized (looking at you LEGO bricks). This may lead to more clutter and chaos in the home—something no one wants. That's why before you start a new hobby it can be helpful to think about a storage solution for all of your hobby essentials. Javascript is required for you to be able to read premium content. Please enable it in your browser settings. Log In Keep it Clean. Please avoid obscene, vulgar, lewd, racist or sexually-oriented language. PLEASE TURN OFF YOUR CAPS"", ""Target's 'Elegant' 3-Piece Duvet Set Is 'Perfect in Every Way' As a subscriber, you can share up to 3 articles each month with friends for free. Just click “Gift this Article” on this page, then copy the link or enter their email. Gifts are exclusive to subscribers, reset monthly, and each article can be redeemed once. Parade aims to feature only the best products and services. If you buy something via one of our links, we may earn a commission. It's that time of year where many of us are looking to upgrade our bedding. If you're looking for an affordable but luxe option, this duvet set from Target is just what you need. Despite it's inexpensive price point, it looks so high-end. Javascript is required for you to be able to read premium content. Please enable it in your browser settings. Log In Keep it Clean. Please avoid obscene, vulgar, lewd, racist or sexually-oriented language. PLEASE TURN OFF YOUR CAPS LOCK. Don't Threaten. Threats of harming another person will not be tolerated. Be Truthful. Don't knowingly lie about anyone or anything. Be Nice. No racism, sexism or any sort of -ism that is degrading to another person. Be Proactive. Use the 'Report' link on each comment to let us know of abusive posts. Share with Us. We'd love to hear ey""]"
