Topic,Count,Name,Representation,Representative_Docs
-1,637,-1_usc_students_department_university,"['usc', 'students', 'department', 'university', 'company', 'management', 'officials', 'government', 'social', 'president']","['USC cutting 259 staff members to tackle rising $230 million deficit The University of Southern California began cutting 259 jobs on Friday as it tackles a rising operating deficit of more than $230 million Since July 9, USC has laid off — or is in the process of terminating — 975 people throughout the university system’s nearly 24,600 faculty and staff. That tally doesn’t include 9,185 student workers. The university is “reducing and reorganizing its workforce due to cutbacks in funding and necessary budget reductions,” wrote Melissa Gerdes-Leonard, associate vice president of client services with USC’s human resources department, in an Oct. 27 letter filed with the state’s Employment Development Department. Also see: USC won’t sign Trump compact on federal funding The latest round of layoffs are happening at USC’s University Park, a leafy 229-acre main campus for the institution’s academic schools and residential buildings near Exposition Park in downtown Los Angeles. After the cuts are completed Dec. 31, USC will have shed 616 people on its main campus, or two-thirds of the workforce laid off to date. Some of the positions cut include a marketing director, procurement specialist, research administrator, office managers, library supervisor, event', ""Machado Presents Trump With Her Nobel Peace Prize María Corina Machado, Venezuela’s opposition leader and last year’s Nobel Peace Prize winner, presented her prize to President Donald Trump on Thursday during a meeting in the White House. Trump took to social media several hours later to thank her. Javascript is required for you to be able to read premium content. Please enable it in your browser settings. Log In Keep it Clean. Please avoid obscene, vulgar, lewd, racist or sexually-oriented language. PLEASE TURN OFF YOUR CAPS LOCK. Don't Threaten. Threats of harming another person will not be tolerated. Be Truthful. Don't knowingly lie about anyone or anything. Be Nice. No racism, sexism or any sort of -ism that is degrading to another person. Be Proactive. Use the 'Report' link on each comment to let us know of abusive posts. Share with Us. We'd love to hear eyewitness accounts, the history behind an article. SIERRA VISTA — Sierra Vista Fire & Medical Services reported its busiest year on record in 2025, answering 11,123 emergency calls — a year-over-year increase of 946 compared to 2024. That … Read moreSierra Vista Fire & Medical Logs Record 11,123 Emergency Responses in 2025 María Corina Machado, Venezuela’s opposition leader"", ""T-Mobile adds harsh rule to flexible payment option for customers As a subscriber, you can share up to 3 articles each month with friends for free. Just click “Gift this Article” on this page, then copy the link or enter their email. Gifts are exclusive to subscribers, reset monthly, and each article can be redeemed once. T-Mobile has a new CEO, and the phone carrier is wasting no time in implementing drastic policy changes that impact customers. On Nov. 1, Srini Gopalan officially became CEO of T-Mobile, replacing Mike Sievert, who held the position for over five years. Javascript is required for you to be able to read premium content. Please enable it in your browser settings. Thanks for the feedback. Log In Keep it Clean. Please avoid obscene, vulgar, lewd, racist or sexually-oriented language. PLEASE TURN OFF YOUR CAPS LOCK. Don't Threaten. Threats of harming another person will not be tolerated. Be Truthful. Don't knowingly lie about anyone or anything. Be Nice. No racism, sexism or any sort of -ism that is degrading to another person. Be Proactive. Use the 'Report' link on each comment to let us know of abusive posts. Share with Us. We'd love to hear eyewitness accounts, the history behind an article. Monday, Oct 6, 2025 The Government has""]"
0,1766,0_defense_investors_basketball_war,"['defense', 'investors', 'basketball', 'war', 'iran', 'trump', 'companies', 'growth', 'financial', 'washington']","[""Inagawa helps pace Drake in 24-19 win over Butler to stay perfect in Pioneer Football League INDIANAPOLIS (AP) — Logan Inagawa threw for 244 yards and a touchdown and Drake remained unbeaten in the Pioneer Football League by beating Butler 24-19 on Saturday. Drake's Isaiah Bragg returned the opening kickoff 32 yards to the Drake 34. On the first play from scrimmage, Nick Herman took the handoff and ran 66 yards to the end zone for a 7-0 Drake (6-2, 5-0) lead. Javascript is required for you to be able to read premium content. Please enable it in your browser settings. Copyright 2025 The Associated Press. All rights reserved. This material may not be published, broadcast, rewritten or redistributed without permission. Log In Keep it Clean. Please avoid obscene, vulgar, lewd, racist or sexually-oriented language. PLEASE TURN OFF YOUR CAPS LOCK. Don't Threaten. Threats of harming another person will not be tolerated. Be Truthful. Don't knowingly lie about anyone or anything. Be Nice. No racism, sexism or any sort of -ism that is degrading to another person. Be Proactive. Use the 'Report' link on each comment to let us know of abusive posts. Share with Us. We'd love to hear eyewitness accounts, the history behind an article. Sorry, there are no recent results for popular commen"", ""Lake-Effect Snow Can Turn Into a Whiteout in Seconds: Here's How to Stay Safe As a subscriber, you can share up to 3 articles each month with friends for free. Just click “Gift this Article” on this page, then copy the link or enter their email. Gifts are exclusive to subscribers, reset monthly, and each article can be redeemed once. Lake-effect snow is the sneakiest kind. The sky looks “fine,” then you hit a band and it’s instant whiteout—no shoulder, no lines, just brake lights and panic. That’s why an “arctic blast” story only matters when it’s roads-first: sudden drops in visibility, fast accumulation in localized zones, and a travel day that turns into a tow bill. Javascript is required for you to be able to read premium content. Please enable it in your browser settings. Log In Keep it Clean. Please avoid obscene, vulgar, lewd, racist or sexually-oriented language. PLEASE TURN OFF YOUR CAPS LOCK. Don't Threaten. Threats of harming another person will not be tolerated. Be Truthful. Don't knowingly lie about anyone or anything. Be Nice. No racism, sexism or any sort of -ism that is degrading to another person. Be Proactive. Use the 'Report' link on each comment to let us know of abusive posts. Share with Us. We'd love to hear eyewitness accounts, the his"", '""The things they\'ve never had since Andrew Bogut"" - Udonis Haslem believes Warriors need a true big man to get back on track As a subscriber, you can share up to 3 articles each month with friends for free. Just click “Gift this Article” on this page, then copy the link or enter their email. Gifts are exclusive to subscribers, reset monthly, and each article can be redeemed once. Different people are pointing at various things as the cause or causes of the Golden State Warriors\' struggles this season. Some say it\'s because they don\'t have a consistent second option behind Steph Curry. Others say it\'s because their young guys have not progressed as expected. While some believe it\'s Steve Kerr\'s coaching. Former Miami Heat captain Udonis Haslem thinks that the Dubs\' issues are rooted in the fact that they did not get what they were supposed to receive last offseason. Javascript is required for you to be able to read premium content. Please enable it in your browser settings. Log In Keep it Clean. Please avoid obscene, vulgar, lewd, racist or sexually-oriented language. PLEASE TURN OFF YOUR CAPS LOCK. Don\'t Threaten. Threats of harming another person will not be tolerated. Be Truthful. Don\'t knowingly lie about anyone or anything. Be Nice. No racism, sexism or any sort of -ism that is degrading to another p']"
1,167,1_injury_villa_chelsea_salah,"['injury', 'villa', 'chelsea', 'salah', 'inter', 'united', 'madrid', 'newcastle', 'spurs', 'alexander']","['Man City vs. Arsenal: Gunners suffer fresh \'injury blow\' ahead of Premier League blockbuster By Matt Law | 15 Apr 2026 21:37, Last updated: 15 Apr 2026 21:46 Arsenal attacker Noni Madueke has emerged as a major doubt for Sunday\'s blockbuster Premier League contest with Manchester City at the Etihad Stadium. Madueke made his fifth Champions League start of the campaign in Wednesday\'s quarter-final second leg against Sporting Lisbon at the Emirates Stadium. However, the 24-year-old was forced off in the 63rd minute after taking a knock to his knee. Max Dowman was introduced as the England international\'s replacement, and he has now emerged as a major doubt for this weekend\'s top-of-the-table clash with Man City. Arsenal are currently top of the Premier League table, six points ahead of second-placed Man City, who have a game in hand on the Gunners. Madueke has come up with seven goals and four assists in 35 appearances this season, but he could now be facing a spell on the sidelines entering the final straight. Bukayo Saka was also again absent for the Champions League game with Sporting. ""It was something that he was carrying for a while. It was an Achilles issue,"" said Arsenal boss Mikel Arteta ahead of the European fixture on Wednesday night when asked about his star play', ""Liverpool injury update: Alexander Isak, Alisson Becker and Jeremie Frimpong latest news and return dates Sport | Football Liverpool returned to winning ways with a 2-0 victory over Aston Villa to end their four-game losing streak in the Premier League. Pressure was piling on Arne Slot after the Reds slumped to ninth in the table, but even without a number of key players, the champions were able to sweep Villa aside to move back up to third. They welcome Real Madrid - Trent Alexander-Arnold, Xabi Alonso, et al - to Anfield in midweek, before they take on Manchester City in a mouth-watering encounter at the weekend. But will they have any of their star names back from injury? Ahead of a big few weeks, here’s all the latest Liverpool injury news and return dates... Alexander Isak has endured a tough start to life on Merseyside. Subbed at half-time in Liverpool’s 5-1 win over Frankfurt in the Champions League, Slot later revealed the £125million summer signing had suffered a minor groin injury. “Alexander had to go off at half-time because he felt his groin a little bit. That's a pity,” said Slot. “I've said many times it is such a difficult balance to find with a player that missed three months.” Isak was not in the squad in the 3-2 loss at Brentford, and he also missed out on the Caraba"", ""Liverpool injury update: Alexander Isak, Alisson Becker and Jeremie Frimpong latest news and return dates Liverpool returned to winning ways with a 2-0 victory over Aston Villa to end their four-game losing streak in the Premier League. Pressure was piling on Arne Slot after the Reds slumped to ninth in the table, but even without a number of key players, the champions were able to sweep Villa aside to move back up to third. They welcome Real Madrid - Trent Alexander-Arnold, Xabi Alonso, et al - to Anfield in midweek, before they take on Manchester City in a mouth-watering encounter at the weekend. But will they have any of their star names back from injury? Ahead of a big few weeks, here’s all the latest Liverpool injury news and return dates... Alexander Isak has endured a tough start to life on Merseyside. Subbed at half-time in Liverpool’s 5-1 win over Frankfurt in the Champions League, Slot later revealed the £125million summer signing had suffered a minor groin injury. “Alexander had to go off at half-time because he felt his groin a little bit. That's a pity,” said Slot. “I've said many times it is such a difficult balance to find with a player that missed three months.” Isak was not in the squad in the 3-2 loss at Brentford, and he also missed out on the Carabao Cup defeat agai""]"
2,149,2_passed away_linda_jane_grandmother,"['passed away', 'linda', 'jane', 'grandmother', 'died', 'memorial', 'funeral', 'mary', 'lived', 'ann']","['Janet Marie Flores Birth: 1931 Death: 2025 Janet Marie Flores passed away peacefully on November 21, 2025 at the age of 94 surrounded by the love of her family. Jan was born on October 31, 1931 in San Francisco to loving parents Alice Detour and Joseph Hettrick. Jan was a loving mother, grandmother and great grandmother who found her greatest joy in her family. She had a way of making people feel welcomed. She was kind, big hearted, extremely gracious and devoted to those she loved. Her presence will be deeply missed. Jan lived a long life traveling, playing golf, bunco with her friends and one of her greatest talents was to find a treasure at garage sales. In her final years she enjoyed playing penny slots at the casino. The last nine years Jan spent in the loving care of her daughter and son in law. A special thank you to her granddaughter Samantha for making her last days warm, comfortable and full of love. Jan survived by her daughter Tina Schilling (Michael), her grandchildren Michael (Marissa), Paul (Kacie), Samantha (Carlos), and her nine great grandchildren Jackson, Aubrey, Jordan, Mikey, Ellie, Luna, Ryder, Makayla and Stella. And her friends who will forever cherish her memory. Celebration', 'Jane Marie Solaro Birth: 1934 Death: 2026 Jane passed away peacefully on January 4, 2026 at the age of 91. Jane was born in Pacific Grove, CA on December 14, 1934 and lived in San Pedro her entire life. She is preceded in death by her loving husband John Solaro and her parents Matthew Bodul & Ann (Berkovich) Bodul. Jane enjoyed the last four years at the Canterbury in Rancho Palos Verdes with her loving friends and caretakers. She is survived by her loving children, Karen Solaro Durber (Martin), Denise Solaro and John Solaro (Lynn). She was a loving grandmother to Anthony Durber (Christina), Michelle Durber Dilly (Ian), Mark Durber, Nikki Solaro, Ali Solaro Sandoval (Dustin), Jack Solaro and Max Solaro and her great grandchildren Brooklynn and Logan Dilly She is also survived by her siblings Bob Bodul (Marylou), Sharon Bodul Werth (Fred) and Matthew Bodul (Angie) as well as several nieces and nephews. She will be deeply missed and remembered by all. Graveside burial at Green Hills Cemetery on Friday, January 23, 2026 @ 2 pm. Celebration of Life to follow. Honor with Flowers In memory of Jane Marie Plant a Living Memorial In memory of Jane Marie', 'Linda Sue (Jordan) Schlosser Birth: 1950 Death: 2025 Linda Sue (Jordan) Schlosser March 16, 1950-December 15, 2025 passed away peacefully surrounded by her family at her home in San Pancho, Mexico. Survived by her husband of 41 years, Phil Schlosser, her mother Gerry, daughter Kelly Noel, son Kevin Noel and wife Jennifer and her grandchildren Trevor and Lena. She was preceded in death by her father, Wayne Henry Jordan and brother Michael Wayne Jordan. Linda was born and raised in San Rafael, CA and graduated from Terra Linda High School. Linda loved sunshine, warm weather and travel. She was an outstanding cook and loved to entertain. Her great adventure was moving to Mexico, building a wonderful home filled with warmth, family, friends and great meals. She loved traveling throughout Mexico and Italy. Her family requests that gifts in lieu of flowers be made in Linda’s name to St. Jude Children’s Research Hospital. Forever deep in my soul, The memory of your love Fills my heart And I am never alone. Honor with Flowers In memory of Linda Sue Plant a Living Memorial In memory of Linda Sue']"
3,47,3_grocery_retailers_stores_consumers,"['grocery', 'retailers', 'stores', 'consumers', 'groceries', 'aldi', 'shoppers', 'products', 'restaurants', 'shopping']","[""Major UK department store chain in working from home crackdown telling staff to be at office ‘more in person’ JOHN LEWIS has told staff it wants to see more of them back in the office to ensure it can push ahead with its recovery. The employee-owned business has reminded its workers — known as “partners” — that it expects them to be at work “more in person than not”. Please provide a valid email. Your info will be used in accordance with our Privacy Policy You'll now receive top stories, breaking news, and more, straight to your email. That means being in the office, out with suppliers or visiting customers, rather than working from home. Bosses say the move is designed to improve collaboration, speed up decisions and strengthen the firm’s culture as it continues its turnaround. John Lewis, which also owns supermarket Waitrose, insisted it was not ripping up hybrid working, stressing that it remained in place. In the note to staff, it said many businesses had stronger teamwork, a better culture and improved performance from a hybrid model with more face-to-face interactions. read more on john lewis RISKY BUSINESS UK furniture brand stocked in M&S & John Lewis axes 300 jobs after collapse SHOP TO IT John Lewis is making major change in stores and shoppers will be delighted The partnership i"", 'Convenience Store Market 2031 Outlook – A USD 1001 Bn Opportunity as APAC Leads Growth with Hyper Convenience Store Expansion says a 2026 Mordor Intelligence Report Hyderabad, Jan. 09, 2026 (GLOBE NEWSWIRE) -- According to Mordor Intelligence, the convenience store market valued at around USD 704 billion in 2025, is projected to grow from USD 747 billion in 2026 to USD 1001.6 billion by 2031, growing at a CAGR of 6%. Growth is fueled by urban migration, rising demand for quick-shopping experiences, and the integration of digital ordering, loyalty programs, and payment systems. Retailers are expanding prepared-food offerings, adding EV charging stations, and using real-time analytics to speed up restocking, boosting basket value even as fuel sales fluctuate. Active private-equity deals and M&A continue due to steady cash flows and consistent customer traffic, while regulatory incentives for alternative-energy solutions offer new revenue opportunities. Moderate competition, with top chains holding a limited share, opens room for regional and mid-tier players to gain an edge through localized strategies, diversified products, and data-driven promotions. Regional Market Outlook Asia-Pacific Asia-Pacific is emerging as the fastest-growing region, driven by rising incomes and compact urban living. Retailers in Japan and South Korea focus on hot-food', 'Convenience Store Market 2031 Outlook – A USD 1001 Bn Opportunity as APAC Leads Growth with Hyper Convenience Store Expansion says a 2026 Mordor Intelligence Report Hyderabad, Jan. 09, 2026 (GLOBE NEWSWIRE) -- According to Mordor Intelligence, the convenience store market valued at around USD 704 billion in 2025, is projected to grow from USD 747 billion in 2026 to USD 1001.6 billion by 2031, growing at a CAGR of 6%. Growth is fueled by urban migration, rising demand for quick-shopping experiences, and the integration of digital ordering, loyalty programs, and payment systems. Retailers are expanding prepared-food offerings, adding EV charging stations, and using real-time analytics to speed up restocking, boosting basket value even as fuel sales fluctuate. Active private-equity deals and M&A continue due to steady cash flows and consistent customer traffic, while regulatory incentives for alternative-energy solutions offer new revenue opportunities. Moderate competition, with top chains holding a limited share, opens room for regional and mid-tier players to gain an edge through localized strategies, diversified products, and data-driven promotions. Regional Market Outlook Asia-Pacific Asia-Pacific is emerging as the fastest-growing region, driven by rising incomes and compact urban living. Retailers in Japan and South Korea focus on hot-food']"
4,46,4_oscar_brendan_actress_starring,"['oscar', 'brendan', 'actress', 'starring', 'mother', 'wedding', 'director', 'husband', 'fraser', 'films']","['Source details Victoria Beckham’s ‘inappropriate’ wedding dance with son Brooklyn In this photo illustration, U.K. newspaper front pages display stories and images on the Beckham family feud on Jan. 20, 2026, in London. On Monday night, Brooklyn Beckham posted a six-page statement via Instagram detailing the tension between him and his parents, David and Victoria Beckham. (Photo Illustration by Mark Case/Getty Images/TNS) A source is detailing the “inappropriate” dance Victoria Beckham shared with son Brooklyn at his 2022 wedding to Nicola Peltz, saying it left guests “deeply uncomfortable.” The 26-year-old son of Posh Spice, 51, and David Beckham claimed in a multi-part Instagram statement Monday that his mother “hijacked my first dance with my wife,” during which he said Victoria “danced very inappropriately on me in front of everyone.” “The dance was deeply uncomfortable, and people did notice at the wedding,” an insider told Us Weekly. The source claims that the fashion designer “nuzzled on Brooklyn’s neck in front of everyone and he made a face.” Brooklyn “was in shock and upset,” they continued. “It was inappropriate and weird.” But another source speaking to the outlet felt the former Spice Girl “just seemed to be having a fun time” and people were not “g', ""AP Entertainment SummaryBrief at 3:08 p.m. EST Brendan Fraser's new horizons include 'Rental Family' and rental hedgehogs BEDFORD, N.Y. (AP) — “Rental Family” is Brendan Fraser’s first leading role since winning the best actor Oscar for “The Whale.” In it, the 56-year-old plays a struggling actor living in Japan who, out of desperation and curiosity, takes a job with an agency that hires out actors to fulfill roles in real people’s lives. In an interview, Fraser discusses his life since the Oscar win, his eye-opening experiences in Japan and what returning to the “Mummy” series means to him. His time in Japan included a visit to a hedgehog cafe. “Rental Family” opens Friday in theaters. Movie Review: Joel Edgerton delivers a profound, understated performance in ‘Train Dreams’ Joel Edgerton plays a logger at the beginning of the 20th century in “Train Dreams.” Clint Bentley's film is an adaptation of Denis Johnson's novella, about the toll of progress and the people left behind. Edgerton stars alongside Felicity Jones and William H. Macy in the meditative film. In her review, Associated Press Film Writer Lindsey Bahr praises Edgerton's understated performance and adds that, “Bentley’s film is haunting and patient, a dreamlike jo"", ""AP Entertainment SummaryBrief at 3:08 p.m. EST Brendan Fraser's new horizons include 'Rental Family' and rental hedgehogs BEDFORD, N.Y. (AP) — “Rental Family” is Brendan Fraser’s first leading role since winning the best actor Oscar for “The Whale.” In it, the 56-year-old plays a struggling actor living in Japan who, out of desperation and curiosity, takes a job with an agency that hires out actors to fulfill roles in real people’s lives. In an interview, Fraser discusses his life since the Oscar win, his eye-opening experiences in Japan and what returning to the “Mummy” series means to him. His time in Japan included a visit to a hedgehog cafe. “Rental Family” opens Friday in theaters. Movie Review: Joel Edgerton delivers a profound, understated performance in ‘Train Dreams’ Joel Edgerton plays a logger at the beginning of the 20th century in “Train Dreams.” Clint Bentley's film is an adaptation of Denis Johnson's novella, about the toll of progress and the people left behind. Edgerton stars alongside Felicity Jones and William H. Macy in the meditative film. In her review, Associated Press Film Writer Lindsey Bahr praises Edgerton's understated performance and adds that, “Bentley’s film is haunting and patient, a dreamlike jo""]"
