Topic,Count,Name,Representation,Representative_Docs
11,41,11_family_divorce_parents_gifts,"['family', 'divorce', 'parents', 'gifts', 'husband', 'siblings', 'niece', 'father', 'friendship', 'christmas']","['Dear Abby: I feel my wife’s family is being immature when they shut out nephew’s ex after divorce DEAR ABBY: My wife’s nephew is getting divorced. The process seems to be amicable; there was no cheating or abuse. They have two children. Even though the soon-to-be-ex, “Michelle,” has always been welcoming and nice, my wife’s family has circled the wagons. They no longer talk to her and have made clear I can’t either. I don’t think that’s right. Michelle has done nothing wrong and has been cordial to us. My wife says to stay out of it and never contact her. I think that’s immature. I realize my thoughts don’t matter. However, I’m thinking about contacting Michelle to say I feel bad about being in that position and apologize. I think if I did, I’d feel better about myself, and she’d know that everyone doesn’t hate her. Should something happen to my wife’s nephew, I would have some basis for connection to the children. What do you think? -- NAVIGATING CHANGE IN ILLINOIS DEAR NAVIGATING: I think you are more mature than your wife’s family. You are an adult, and you should do what you feel is right. DEAR ABBY: My father left our family when I was in sixth grade. Because he had cheated on our mom numerous times, he was removed from his ministry and went into education. I tried to reso', 'Asking Eric: Can mom work through tension in son’s relationship with dad so they can celebrate special birthday? Dear Eric: My son is turning 40 on December 22. My husband and I are at a quandary as to how to celebrate him. There have been issues between my husband and him over things from his childhood. We did a special trip for his older brother when he turned 40 and would like to do something special for this son’s 40th as well. Our daughter-in-law has made special plans for him and we are not included. I understand that, but I need some ideas as to how to celebrate this extra special year without rocking the boat. I love my son with all my heart, as I do all my children, and want his 40th birthday to be memorable in a positive way. Any suggestions? – Mom Who Wants to Celebrate Dear Mom: The issues your son and your husband are having may be an obstacle, but they aren’t insurmountable. And the thing that can get them on the path to resolution is the same thing that can get you answers about how to celebrate your son: open communication. It’s not within your purview to try to fix things between them, but you have your own relationship with your son and so I’d encourage you to reach out and tell him what you told me: you want to celebrate him, you know things are difficult, and you’re lookin', 'Asking Eric: After 6 years sober, man is frustrated by his family’s hold on their hurt and distrust Dear Eric: I’ve just turned 40 this past year. The last 15 years I was in a horrible drug addiction. I lied and hurt and did terrible things to a lot of people, especially my family. About eight years ago they officially disowned me. Understandable. I’ve cleaned up and got my act together six years ago. At first, I tried to force my way back into their lives, which all refuted. I lashed out, said horrible things and stopped trying to be in their lives. My mom will stop by on my birthday for 10 minutes or so and drop a card off at Christmas. As for my two older brothers and my father, it’s radio silence. I guess what I’m asking is, what do I do to fix this and fast, as I said I’ve turned 40 this year, my parents are both 70. Time is running out, and I couldn’t imagine living my life without some kind of acceptance from my father. Or knowing he did or does love me. My heart breaks at the thought, but this is a real pickle. How can I fix a problem when the ones I need to fix it with won’t talk to me? Do I just keep ignoring their existence and put on this façade that I don’t care to my wife and 4-year-old son? What picture am I painting to my son, as he’s been guilty by association yo']"
12,33,12_jessie buckley_celebrity_husband_cats,"['jessie buckley', 'celebrity', 'husband', 'cats', 'buckley', 'meghan markle', 'inappropriate', 'miranda', 'awards', 'chloe']","[""Oscars Front-Runner Makes Shocking Confession About Her Husband's Cats: 'This Is Bad' Jessie Buckley won over critics and moviegoers with her heart-wrenching performance in “Hamnet,” but her comments in a three-month-old interview are receiving new scrutiny as awards season draws to a close. Appearing on the “Happy Sad Confused” podcast with her “Hamnet” co-star Paul Mescal in November, Buckley admitted she’d made her husband, Freddie Sorensen, get rid of his two cats early in their relationship. “Cats are mean,” she insisted. “My husband, when I started dating him, he had two cats ... this is bad ... One of the cats was, like, a pedigree model bitch. And she staged, like, a coup against me. I’d come home, and there would just be, like, poo on my pillow.” Eventually, Buckley gave Sorensen an ultimatum ― which she joked may now get her “canceled.” “I was like: ‘It’s me or the cats,’” she recalled. “But I won! Sorry!” Mescal appeared to support his co-star’s actions, and quipped: “Fuck cats, honestly. Fuck ’em!” Watch Jessie Buckley and Paul Mescal’s “Happy Sad Confused” interview below. Their comments on cats can be found around the 36:42 mark. A snippet of Buckley’s remarks has drawn a plethora of amusing, if polarized, responses after being posted to Reddit this we"", ""Oscars Front-Runner Makes Shocking Confession About Her Husband's Cats: 'This Is Bad' Jessie Buckley won over critics and moviegoers with her heart-wrenching performance in “Hamnet,” but her comments in a three-month-old interview are receiving new scrutiny as awards season draws to a close. Appearing on the “Happy Sad Confused” podcast with her “Hamnet” co-star Paul Mescal in November, Buckley admitted she’d made her husband, Freddie Sorensen, get rid of his two cats early in their relationship. Buzz: Valerie Bertinelli Says 'Shame' Forced Her To Keep Childhood ****** Abuse Secret For Over 50 Years “Cats are mean,” she insisted. “My husband, when I started dating him, he had two cats ... this is bad ... One of the cats was, like, a pedigree model *****. And she staged, like, a coup against me. I’d come home, and there would just be, like, poo on my pillow.” Eventually, Buckley gave Sorensen an ultimatum ― which she joked may now get her “canceled.” “I was like: ‘It’s me or the cats,’” she recalled. “But I won! Sorry!” Mescal appeared to support his co-star’s actions, and quipped: “**** cats, honestly. **** ’em!” Watch Jessie Buckley and Paul Mescal’s “Happy Sad Confused” interview below. Their comments on cats can be found around the 36:42 mark. Like this article?"", ""Oscars Front-Runner Makes Shocking Confession About Her Husband's Cats: 'This Is Bad' Jessie Buckley won over critics and moviegoers with her heart-wrenching performance in “Hamnet,” but her comments in a three-month-old interview are receiving new scrutiny as awards season draws to a close. Appearing on the “Happy Sad Confused” podcast with her “Hamnet” co-star Paul Mescal in November, Buckley admitted she’d made her husband, Freddie Sorensen, get rid of his two cats early in their relationship. Buzz: Actor And Rapper Jailed For Killing Student In Hit-And-Run “Cats are mean,” she insisted. “My husband, when I started dating him, he had two cats ... this is bad ... One of the cats was, like, a pedigree model *****. And she staged, like, a coup against me. I’d come home, and there would just be, like, poo on my pillow.” Eventually, Buckley gave Sorensen an ultimatum ― which she joked may now get her “canceled.” “I was like: ‘It’s me or the cats,’” she recalled. “But I won! Sorry!” Mescal appeared to support his co-star’s actions, and quipped: “**** cats, honestly. **** ’em!” Advertisement Watch Jessie Buckley and Paul Mescal’s “Happy Sad Confused” interview below. Their comments on cats can be found around the 36:42 mark. Like this article? Keep independent journalis""]"
13,33,13_fabric_covers_lace_garment,"['fabric', 'covers', 'lace', 'garment', 'cotton', 'luxurious', 'leather', 'fashion', 'coat', 'colours']","[""'Luxury' quilted bedspread reduced from £65 'makes my bedroom look expensive' The bedspread has been reduced in price(Image: Dusk ) Finding the perfect finishing touch for the bedroom can be challenging, but sometimes a bedspread is all that's needed to add style and additional warmth. Over at Dusk, there is one bedspread which has been reduced in price and it comes in two colours. The Rome Velvet Greek Matelasse Bedspread is currently available from Dusk for £52, reduced from £65, saving shoppers £13. It also comes in the colour deep pink, but this is for the full price of £65. Dusk says the Rome Velvet Greek Matelasse Bedspread has been designed to add a 'luxurious and inviting finish' to the bedroom, and it features a Greek-inspired matelassé pattern. The velvet-feel fabric creates a 'soft touch', while the intricate quilting enhances its aesthetic, the site says. Shoppers have left rave reviews online The Rome Velvet Greek Matelasse Bedspread, which measures 2.5m x 2.6m, can be styled alone or layered with matching cushion covers. Plus, it is easy to care for, as it can be machine washed at 30 degrees and tumble dried on a low setting - but it is worth noting that it should not be ironed. As an alternative, Dunelm is selling this Helston Quilted Bedsprea"", ""Dusk's white lace-trim spring duvet cover 'looks gorgeous on' and is reduced The Alice Duvet Cover can be easily styled with lots of different themes and hues(Image: Dusk) March signals the arrival of spring and, gradually, the days are growing longer and brighter. Households anticipating the arrival of milder weather can help usher spring indoors with fresh décor choices. A straightforward method to revitalise a bedroom is to update the bedding which breathes new life into the space. Dusk remains a favourite destination for those seeking to refresh their homeware and the retailer frequently runs promotions and special offers. Currently, the brand is offering 15% off this Alice Duvet Cover when customers apply the code EXTRA15 during checkout. Typically retailing between £55 and £65, the promotional code reduces the cost to between £46.75 and £55.25. The Alice Duvet Cover comes in double, king and super king sizes and boasts a 200 thread count. It's worth noting that pillowcases aren't included and must be purchased separately, starting from £15 for one, for example. Dusk's Alice Duvet Cover is white and features an intricate lace, scalloped trim for a period aesthetic. The retailer describes the cover as 'soft, breathable, and effortlessly stylish', report"", ""Dusk's white lace-trim spring duvet cover 'looks gorgeous on' and is reduced This elegant lace-trim duvet from Dusk is perfect for spring (Image: Dusk) March signals the arrival of spring and, gradually, the days are growing longer and brighter. Households anticipating the arrival of milder weather can usher spring indoors through fresh décor choices. A straightforward method to revitalise a bedroom is to update the bedding, which breathes new life into the space. Dusk remains a favourite destination for those seeking to refresh their homeware and the retailer frequently runs promotions and special offers. Currently, the brand is offering 15% off this Alice Duvet Cover when customers apply the code EXTRA15 during checkout. Typically retailing between £55 and £65, the promotional code reduces the cost to between £46.75 and £55.25. The Alice Duvet Cover comes in double, king and super king sizes and boasts a 200 thread count. It's worth noting that pillowcases aren't included and must be purchased separately, starting from £15 for one, for example. Dusk's Alice Duvet Cover is white and features an intricate lace, scalloped trim for a period aesthetic. The retailer describes the cover as 'soft, breathable, and effortlessly stylish', reports the Daily Record. T""]"
14,33,14_epstein files_convicted sex_prosecutors_department justice,"['epstein files', 'convicted sex', 'prosecutors', 'department justice', 'sex offender', 'doj', 'comey', 'clinton', 'jeffrey', 'president donald']","[""Latest Epstein release shows scope of DOJ probes into Epstein, Maxwell The U.S. Justice Department has released tens of thousands more documents related to Jeffrey Epstein, a tranche that included multiple mentions of President Donald Trump but added little new revelatory information. WASHINGTON — The U.S. Justice Department released tens of thousands more documents related to Jeffrey Epstein, a tranche that included multiple mentions of President Donald Trump but added little new revelatory information to the long-anticipated public file on the late financier and convicted sex offender. President Donald Trump speaks Monday at his Mar-a-Lago club in Palm Beach, Fla. A desk and photographs are pictured July 6, 2019, during a search of Jeffrey Epstein's home in New York. An email that was included in the U.S. Department of Justice release of the Jeffrey Epstein files is photographed Monday. Get local news delivered to your inbox! The U.S. Justice Department has released tens of thousands more documents related to Jeffrey Epstein, a tranche that included multiple mention…"", ""Latest Epstein release shows scope of DOJ probes into Epstein, Maxwell The U.S. Justice Department has released tens of thousands more documents related to Jeffrey Epstein, a tranche that included multiple mentions of President Donald Trump but added little new revelatory information. WASHINGTON — The U.S. Justice Department released tens of thousands more documents related to Jeffrey Epstein, a tranche that included multiple mentions of President Donald Trump but added little new revelatory information to the long-anticipated public file on the late financier and convicted sex offender. President Donald Trump speaks Monday at his Mar-a-Lago club in Palm Beach, Fla. A desk and photographs are pictured July 6, 2019, during a search of Jeffrey Epstein's home in New York. An email that was included in the U.S. Department of Justice release of the Jeffrey Epstein files is photographed Monday. Get local news delivered to your inbox! The U.S. Justice Department has released tens of thousands more documents related to Jeffrey Epstein, a tranche that included multiple mention…"", ""Latest Epstein release shows scope of DOJ probes into Epstein, Maxwell The U.S. Justice Department has released tens of thousands more documents related to Jeffrey Epstein, a tranche that included multiple mentions of President Donald Trump but added little new revelatory information. WASHINGTON — The U.S. Justice Department released tens of thousands more documents related to Jeffrey Epstein, a tranche that included multiple mentions of President Donald Trump but added little new revelatory information to the long-anticipated public file on the late financier and convicted sex offender. President Donald Trump speaks Monday at his Mar-a-Lago club in Palm Beach, Fla. A desk and photographs are pictured July 6, 2019, during a search of Jeffrey Epstein's home in New York. An email that was included in the U.S. Department of Justice release of the Jeffrey Epstein files is photographed Monday. Get local news delivered to your inbox! The U.S. Justice Department has released tens of thousands more documents related to Jeffrey Epstein, a tranche that included multiple mention…""]"
15,31,15_onstage_grammy_taylor swift_prince,"['onstage', 'grammy', 'taylor swift', 'prince', 'singer', 'pop star', 'super bowl', 'perform', 'gala', 'music']","[""Lorraine Ali: Bad Bunny is American; Coldplay is not. The right is selectively freaking out over the Super Bowl Chris Martin, center, and Coldplay perform during halftime of Super Bowl 50, along with BeyoncÃ©, left, and Bruno Mars, at Levi's Stadium on Feb. 7, 2016, in Santa Clara, California. (Ezra Shaw/Getty Images/TNS) President Donald Trump told the New York Post that music artist Bad Bunny was a “terrible choice” to headline the 2026 Super Bowl halftime show and that the NFL’s selection of the Puerto Rican singer and rapper sows “hatred.” Department of Homeland Security adviser Corey Lewandowski suggested that Bad Bunny loathes the U.S. “It’s so shameful that they’ve decided to pick somebody who just seems to hate America so much to represent them at the halftime game,” he told conservative podcaster Benny Johnson. Sen. Tommy Tuberville, R-Ala., said on Monday that Bad Bunny disseminates “anti-American propaganda.” The upshot: Bad Bunny (aka Benito Antonio Martínez Ocasio) is an enemy of the state. An outsider who doesn’t possess American values. A Super Bowl wrecker. Heated debate around who is worthy to perform the halftime show is an American tradition (Prince, yes. The Red Hot Chili Peppers, no). But now, unsurprisingly, politics are part of that debate, so the mere fact that Bad Bu"", ""THE THINK PINK GALA DEBUTS MARCH 14TH 2026 AT THE PLAZA WITH BERNADETTE PETERS AND A MICHELIN-STARRED CULINARY EXPERIENCE A landmark night of glamour, generosity, and world-class artistry in support of breast cancer patients, survivors, and families NEW YORK, Jan. 12, 2026 /PRNewswire/ -- The Think Pink Gala will debut on Saturday, March 14th, 2026, at the iconic Plaza Hotel, marking a premier cultural milestone in the New York philanthropic season. This inaugural evening unites world-class artistry with culinary excellence to mark United Breast Cancer Foundation's landmark 25th anniversary of life-changing support. The evening features Broadway legend and three-time Tony Award winner Bernadette Peters, two-time Tony Award winner Christine Ebersole, whose legendary career continues to define the height of American musical theater and screen, and Melissa Errico, celebrated as one of the most iconic leading ladies of musical theater. The program highlights the work of Emmy and Grammy nominated conductor, composer, and musical director Judith Clurman, who leads Judith Clurman's Essential Voices USA, an acclaimed, award-winning choral ensemble and one of New York's preeminent vocal groups. The stage also features Simone Dinnerstein, a Diapason d'Or winner with fifteen number-one Billboard Classical albums"", ""THE THINK PINK GALA DEBUTS MARCH 14TH 2026 AT THE PLAZA WITH BERNADETTE PETERS AND A MICHELIN-STARRED CULINARY EXPERIENCE A landmark night of glamour, generosity, and world-class artistry in support of breast cancer patients, survivors, and families NEW YORK, Jan. 12, 2026 /PRNewswire/ -- The Think Pink Gala will debut on Saturday, March 14th, 2026, at the iconic Plaza Hotel, marking a premier cultural milestone in the New York philanthropic season. This inaugural evening unites world-class artistry with culinary excellence to mark United Breast Cancer Foundation's landmark 25th anniversary of life-changing support. The evening features Broadway legend and three-time Tony Award winner Bernadette Peters, two-time Tony Award winner Christine Ebersole, whose legendary career continues to define the height of American musical theater and screen, and Melissa Errico, celebrated as one of the most iconic leading ladies of musical theater. The program highlights the work of Emmy and Grammy nominated conductor, composer, and musical director Judith Clurman, who leads Judith Clurman's Essential Voices USA, an acclaimed, award-winning choral ensemble and one of New York's preeminent vocal groups. The stage also features Simone Dinnerstein, a Diapason d'Or winner with fifteen number-one Billboard Classical albums""]"
16,27,16_inning_pitcher_home run_baseball,"['inning', 'pitcher', 'home run', 'baseball', 'opening day', 'spring training', 'major league', 'pitch', 'cardinals', 'cincinnati']","['Pittsburgh Pirates capture 8-3 exhibition victory over Toronto Blue Jays BRADENTON — Oneil Cruz and Spencer Horwitz homered to lead the Pittsburgh Pirates to an 8-3 win over the Toronto Blue Jays in spring-training action Saturday. Horwitz belted a solo homer against his former team off Toronto starter Kevin Gausman in the fourth inning. Cruz added a two-run shot in the sixth for Pittsburgh (16-11). Gausman, tabbed as Toronto’s opening-day starter, went five innings. He allowed six hits and three earned runs while fanning two and walking three. Shortstop Andres Giminez, who was a member of Venezuela’s World Baseball Classic-winning team. had two hits in three plate appearances for Toronto (11-13). He also scored a run.', ""Pittsburgh Pirates capture 8-3 exhibition victory over Toronto Blue Jays BRADENTON - Oneil Cruz and Spencer Horwitz homered to lead the Pittsburgh Pirates to an 8-3 win over the Toronto Blue Jays in spring-training action Saturday. Horwitz belted a solo homer against his former team off Toronto starter Kevin Gausman in the fourth inning. Cruz added a two-run shot in the sixth for Pittsburgh (16-11). Gausman, tabbed as Toronto's opening-day starter, went five innings. He allowed six hits and three earned runs while fanning two and walking three. Shortstop Andres Giminez, who was a member of Venezuela's World Baseball Classic-winning team. had two hits in three plate appearances for Toronto (11-13). He also scored a run. Also on Saturday, Toronto manager John Schneider told reporters the team's five starting pitchers will be Gausman, Dylan Cease, Eric Lauer, Cody Ponce and Max Scherzer, in that order. That means Gausman, Cease and Lauer will go the mound when Toronto opens its season Friday against the Athletics at Rogers Centre. Ponce and Scherzer would then start against the Colorado Rockies. This report by The Canadian Press was first published March 21, 2026. The Canadian Press If you're interested in submitting a Letter to the Editor, click here. We'"", 'Pittsburgh Pirates capture 8-3 exhibition victory over Toronto Blue Jays Toronto Blue Jays’ Kevin Gausman (34) pitches to Canada during the first inning of an exhibition baseball game Tuesday, March 3, 2026, in Dunedin, Fla. (AP Photo/Chris O’Meara) BRADENTON - Oneil Cruz and Spencer Horwitz homered to lead the Pittsburgh Pirates to an 8-3 win over the Toronto Blue Jays in spring-training action Saturday. Horwitz belted a solo homer against his former team off Toronto starter Kevin Gausman in the fourth inning. Cruz added a two-run shot in the sixth for Pittsburgh (16-11). Gausman, tabbed as Toronto’s opening-day starter, went five innings. He allowed six hits and three earned runs while fanning two and walking three. Shortstop Andres Giminez, who was a member of Venezuela’s World Baseball Classic-winning team. had two hits in three plate appearances for Toronto (11-13). He also scored a run. Also on Saturday, Toronto manager John Schneider told reporters the team’s five starting pitchers will be Gausman, Dylan Cease, Eric Lauer, Cody Ponce and Max Scherzer, in that order. That means Gausman, Cease and Lauer will go the mound when Toronto opens its season Friday against the Athletics at Rogers Centre. Ponce and Scherzer would then start against the Colo']"
