Topic,Count,Name,Representation,Representative_Docs
-1,624,-1_healthcare_students_usc_awards,"['healthcare', 'students', 'usc', 'awards', 'mexican', 'sustainability', 'department', 'education', 'climate', 'innovation']","[""Machado Presents Trump With Her Nobel Peace Prize María Corina Machado, Venezuela’s opposition leader and last year’s Nobel Peace Prize winner, presented her prize to President Donald Trump on Thursday during a meeting in the White House. Trump took to social media several hours later to thank her. Javascript is required for you to be able to read premium content. Please enable it in your browser settings. Log In Keep it Clean. Please avoid obscene, vulgar, lewd, racist or sexually-oriented language. PLEASE TURN OFF YOUR CAPS LOCK. Don't Threaten. Threats of harming another person will not be tolerated. Be Truthful. Don't knowingly lie about anyone or anything. Be Nice. No racism, sexism or any sort of -ism that is degrading to another person. Be Proactive. Use the 'Report' link on each comment to let us know of abusive posts. Share with Us. We'd love to hear eyewitness accounts, the history behind an article. SIERRA VISTA — Sierra Vista Fire & Medical Services reported its busiest year on record in 2025, answering 11,123 emergency calls — a year-over-year increase of 946 compared to 2024. That … Read moreSierra Vista Fire & Medical Logs Record 11,123 Emergency Responses in 2025 María Corina Machado, Venezuela’s opposition leader"", ""T-Mobile adds harsh rule to flexible payment option for customers As a subscriber, you can share up to 3 articles each month with friends for free. Just click “Gift this Article” on this page, then copy the link or enter their email. Gifts are exclusive to subscribers, reset monthly, and each article can be redeemed once. T-Mobile has a new CEO, and the phone carrier is wasting no time in implementing drastic policy changes that impact customers. On Nov. 1, Srini Gopalan officially became CEO of T-Mobile, replacing Mike Sievert, who held the position for over five years. Javascript is required for you to be able to read premium content. Please enable it in your browser settings. Thanks for the feedback. Log In Keep it Clean. Please avoid obscene, vulgar, lewd, racist or sexually-oriented language. PLEASE TURN OFF YOUR CAPS LOCK. Don't Threaten. Threats of harming another person will not be tolerated. Be Truthful. Don't knowingly lie about anyone or anything. Be Nice. No racism, sexism or any sort of -ism that is degrading to another person. Be Proactive. Use the 'Report' link on each comment to let us know of abusive posts. Share with Us. We'd love to hear eyewitness accounts, the history behind an article. Monday, Oct 6, 2025 The Government has"", ""California lawmakers push back against offshore oil drilling (The Center Square) – Weeks after California Lt. Gov. Eleni Kounalakis spoke out against federal efforts to expand offshore oil drilling, state lawmakers told The Center Square that increased drilling is deeply unpopular among coastal residents. Opponents warn against the environmental costs. Javascript is required for you to be able to read premium content. Please enable it in your browser settings. Originally published on thecentersquare.com, part of the BLOX Digital Content Exchange. Thanks for signing up. Keep an eye on your inbox for the next edition. You may want to whitelistthe-daily-sun@adamspg-email.comto make sure it doesn't go to your spam folder! Get the top headlines delivered straight to your inbox every morning. Log In Keep it Clean. Please avoid obscene, vulgar, lewd, racist or sexually-oriented language. PLEASE TURN OFF YOUR CAPS LOCK. Don't Threaten. Threats of harming another person will not be tolerated. Be Truthful. Don't knowingly lie about anyone or anything. Be Nice. No racism, sexism or any sort of -ism that is degrading to another person. Be Proactive. Use the 'Report' link on each comment to let us know of abusive posts. Share with Us. We'd love to hear e""]"
0,247,0_nasdaq_stocks_investors_shareholders,"['nasdaq', 'stocks', 'investors', 'shareholders', 'shares', 'securities', 'holdings', 'companies', 'securities exchange', 'dividend']","['49 Wealth Management LLC Makes New $624,000 Investment in Accenture PLC $ACN Posted by Defense World Staff on Mar 1st, 2026 49 Wealth Management LLC bought a new stake in shares of Accenture PLC (NYSE:ACN – Free Report) during the third quarter, according to the company in its most recent disclosure with the Securities and Exchange Commission. The fund bought 2,532 shares of the information technology services provider’s stock, valued at approximately $624,000. A number of other institutional investors also recently bought and sold shares of ACN. Brighton Jones LLC lifted its stake in shares of Accenture by 36.2% in the 4th quarter. Brighton Jones LLC now owns 18,438 shares of the information technology services provider’s stock valued at $6,486,000 after purchasing an additional 4,905 shares during the period. Sivia Capital Partners LLC raised its holdings in Accenture by 46.9% in the second quarter. Sivia Capital Partners LLC now owns 2,066 shares of the information technology services provider’s stock worth $618,000 after purchasing an additional 660 shares in the last quarter. United Bank lifted its position in Accenture by 49.8% during the second quarter. United Bank now owns 3,639 shares of the information technology services provider’s stock valued a', 'Smart investors have been buying this beaten-down S&P 500 stock You’re reading a free article with opinions that may differ from The Motley Fool’s Premium Investing Services. Become a Motley Fool member today to get instant access to our top analyst recommendations, in-depth research, investing resources, and more. Learn More. Opportunities for value investors in the S&P 500 have been limited in recent years. But Molina Healthcare (NYSE:MOH) is one that’s been catching the attention of some big names recently. As well as Michael Burry, recent data shows that Bill Nygren and Seth Klarman – two highly-respected value investors – were buying the stock in Q4 2025. So what’s the deal here? Image source: Getty Images Molina is a US healthcare provider focused on Medicaid – the scheme that primarily covers low-income individuals. And some recent challenges has made the stock look cheap recently. Unfortunately, anyone who bought shares in Q4 2025 saw their investment crash 30% in a day when the company released its earnings earlier this month. And it’s not that hard to see why. Analysts were expecting earnings per share of $0.43, but the firm posted a loss of $2.75. There were a few reasons for this, but the biggest was a reclassification of the status', 'Adams Wealth Management Has $2.71 Million Stake in Schwab US Broad Market ETF $SCHB Posted by Defense World Staff on Dec 15th, 2025 Adams Wealth Management increased its holdings in shares of Schwab US Broad Market ETF (NYSEARCA:SCHB – Free Report) by 26.5% in the second quarter, according to the company in its most recent Form 13F filing with the Securities and Exchange Commission (SEC). The fund owned 113,506 shares of the company’s stock after buying an additional 23,754 shares during the period. Adams Wealth Management’s holdings in Schwab US Broad Market ETF were worth $2,705,000 at the end of the most recent quarter. A number of other hedge funds and other institutional investors have also recently bought and sold shares of the business. Milestones Private Investment Advisors LLC acquired a new position in shares of Schwab US Broad Market ETF in the 2nd quarter valued at $3,619,000. WT Wealth Management grew its stake in shares of Schwab US Broad Market ETF by 0.3% during the second quarter. WT Wealth Management now owns 1,284,069 shares of the company’s stock worth $30,599,000 after purchasing an additional 3,857 shares during the period. Cambridge Financial Group LLC increased its holdings in Schwab US Broad Market ETF by 43.8% in the second quarter. Cambr']"
1,232,1_college football_basketball_nba_ncaa,"['college football', 'basketball', 'nba', 'ncaa', 'head coach', 'warriors', 'championship', 'coach', 'rebounds', 'nfl']","['""The things they\'ve never had since Andrew Bogut"" - Udonis Haslem believes Warriors need a true big man to get back on track As a subscriber, you can share up to 3 articles each month with friends for free. Just click “Gift this Article” on this page, then copy the link or enter their email. Gifts are exclusive to subscribers, reset monthly, and each article can be redeemed once. Different people are pointing at various things as the cause or causes of the Golden State Warriors\' struggles this season. Some say it\'s because they don\'t have a consistent second option behind Steph Curry. Others say it\'s because their young guys have not progressed as expected. While some believe it\'s Steve Kerr\'s coaching. Former Miami Heat captain Udonis Haslem thinks that the Dubs\' issues are rooted in the fact that they did not get what they were supposed to receive last offseason. Javascript is required for you to be able to read premium content. Please enable it in your browser settings. Log In Keep it Clean. Please avoid obscene, vulgar, lewd, racist or sexually-oriented language. PLEASE TURN OFF YOUR CAPS LOCK. Don\'t Threaten. Threats of harming another person will not be tolerated. Be Truthful. Don\'t knowingly lie about anyone or anything. Be Nice. No racism, sexism or any sort of -ism that is degrading to another p', ""Cameron Boozer should be the number one overall pick over AJ Dybantsa and Darryn Peterson — He gets criticized for the same reason Luka Doncic did As a subscriber, you can share up to 3 articles each month with friends for free. Just click “Gift this Article” on this page, then copy the link or enter their email. Gifts are exclusive to subscribers, reset monthly, and each article can be redeemed once. Duke's do-it-all power forward Cameron Boozer is hands down the best college player this season. Interestingly, however, he continues to lag in many mock drafts for the number one pick in this year's NBA Draft. Such takes make me wonder what is making pundits and observers continue to be unconvinced that he deserves to be the top pick. Javascript is required for you to be able to read premium content. Please enable it in your browser settings. Log In Keep it Clean. Please avoid obscene, vulgar, lewd, racist or sexually-oriented language. PLEASE TURN OFF YOUR CAPS LOCK. Don't Threaten. Threats of harming another person will not be tolerated. Be Truthful. Don't knowingly lie about anyone or anything. Be Nice. No racism, sexism or any sort of -ism that is degrading to another person. Be Proactive. Use the 'Report' link on each comment to let us know of abusive posts. Share with Us. We'd love to hear eyewitness accounts, the history"", ""Josh Heupel, Tennessee Receive Strong Message From 5-Star RB As a subscriber, you can share up to 3 articles each month with friends for free. Just click “Gift this Article” on this page, then copy the link or enter their email. Gifts are exclusive to subscribers, reset monthly, and each article can be redeemed once. The Tennessee Volunteers had a disappointing season after making their first College Football Playoff in 2024. The Volunteers, under the leadership of head coach Josh Heupel, finished the 2025 season with an 8-5 record. That was after being ranked as high as No. 11 in the country. However, the team struggled down the stretch, losing four of its final seven games. As a result, it is now focused on building a championship contender for the upcoming season. Javascript is required for you to be able to read premium content. Please enable it in your browser settings. Log In Keep it Clean. Please avoid obscene, vulgar, lewd, racist or sexually-oriented language. PLEASE TURN OFF YOUR CAPS LOCK. Don't Threaten. Threats of harming another person will not be tolerated. Be Truthful. Don't knowingly lie about anyone or anything. Be Nice. No racism, sexism or any sort of -ism that is degrading to another person. Be Proactive. Use the 'Report""]"
2,198,2_governor_colorado_state state_gov,"['governor', 'colorado', 'state state', 'gov', 'congressional', 'democrats', 'republican', 'idaho', 'trump administration', 'democratic']","['WATCH: Gov. Polis calls out Republicans in State of the State (The Center Square) – Colorado Gov. Jared Polis delivered his last State of the State to a joint session of the Colorado General Assembly on Thursday. In his speech, the Democratic governor called out Republicans, reflected on his past seven years in office, and looked to policy priorities for his last 10 months in office. Since the Trump administration took office one year ago, the Democrat-led Colorado state government has often faced off against the federal government over policies and funding cuts. Polis reflected on that. “Over the past 12 months, it seems like Washington has often been in it to ... make life harder and less affordable, to make Americans feel more fearful, more belligerent and more vulnerable,” Polis said. “In the last month alone, the Trump administration has threatened over $1 billion in funding for Colorado.” As reported by The Center Square, Colorado has filed dozens of lawsuits to challenge federal Republican policies and cuts. Polis promised to keep up those efforts, while calling out Republicans. “We are fighting hard to protect every federal dollar owed to Colorado,” he said. “In partnership with Attorney General [Phil] Weiser, our state has successful', 'WATCH: Gov. Polis calls out Republicans in State of the State (The Center Square) – Colorado Gov. Jared Polis delivered his last State of the State to a joint session of the Colorado General Assembly on Thursday. In his speech, the Democratic governor called out Republicans, reflected on his past seven years in office, and looked to policy priorities for his last 10 months in office. Since the Trump administration took office one year ago, the Democrat-led Colorado state government has often faced off against the federal government over policies and funding cuts. Polis reflected on that. “Over the past 12 months, it seems like Washington has often been in it to ... make life harder and less affordable, to make Americans feel more fearful, more belligerent and more vulnerable,” Polis said. “In the last month alone, the Trump administration has threatened over $1 billion in funding for Colorado.” As reported by The Center Square, Colorado has filed dozens of lawsuits to challenge federal Republican policies and cuts. Polis promised to keep up those efforts, while calling out Republicans. “We are fighting hard to protect every federal dollar owed to Colorado,” he said. “In partnership with Attorney General [Phil] Weiser, our state has successful', 'WATCH: Gov. Polis calls out Republicans in State of the State (The Center Square) – Colorado Gov. Jared Polis delivered his last State of the State to a joint session of the Colorado General Assembly on Thursday. In his speech, the Democratic governor called out Republicans, reflected on his past seven years in office, and looked to policy priorities for his last 10 months in office. Since the Trump administration took office one year ago, the Democrat-led Colorado state government has often faced off against the federal government over policies and funding cuts. Polis reflected on that. “Over the past 12 months, it seems like Washington has often been in it to ... make life harder and less affordable, to make Americans feel more fearful, more belligerent and more vulnerable,” Polis said. “In the last month alone, the Trump administration has threatened over $1 billion in funding for Colorado.” As reported by The Center Square, Colorado has filed dozens of lawsuits to challenge federal Republican policies and cuts. Polis promised to keep up those efforts, while calling out Republicans. “We are fighting hard to protect every federal dollar owed to Colorado,” he said. “In partnership with Attorney General [Phil] Weiser, our state has successful']"
3,171,3_war iran_iran_missiles_ceasefire,"['war iran', 'iran', 'missiles', 'ceasefire', 'gaza', 'middle east', 'terrorist', 'nato', 'lebanon', 'president donald']","['US warns ‘the big one is coming’ amid conflicting signals over war’s duration London: US and Israeli forces have hammered Iran with new strikes against missile and drone launch sites, aiming to wipe out its capacity to hit regional military and civilian targets amid conflicting signals about the goals and duration of the war. The Israel Defence Forces launched simultaneous attacks against Tehran and Beirut on the fourth day of the conflict, targeting services in the Iranian capital and intensifying the war against Hezbollah in Lebanon, positioning troops at several points near the border. The IDF announced the latest strikes on Tuesday morning in the Middle East (4.30pm AEDT) after earlier confirming it had targeted the Iranian state broadcaster IRIB in Tehran and told civilians to leave the surrounding area. US President Donald Trump declared the war might go “far longer” than his previous estimate of “four to five weeks” and did not rule out sending ground forces into Iran. “I don’t have the yips with respect to boots on the ground,” he told The New York Post. But Trump has sent a range of messages about the reasons for the war since initially calling on Iranians to topple the Islamic Republic’s regime, emphasising instead the goal of removing Iran’s abili', ""AP News Summary at 4:09 a.m. EDT Iran launches new attacks at Israel and Gulf countries as it keeps up pressure on the Middle East DUBAI, United Arab Emirates (AP) — Iran has fired more drones and missiles at Israel and Gulf Arab countries as it keeps up pressure on the Middle East in a war that has sent oil prices surging and stunned global economies. The Saudi Defense Ministry said on Tuesday that it has destroyed two drones over the kingdom’s oil-rich eastern region, while in Kuwait, the National Guard said it shot down six drones attacking the county’s northern and southern areas. The attacks come as U.S. President Donald Trump sends contradictory signals about how long the war could last, adding to uncertainty that’s causing markets to swing. Copyright 2026 The Associated Press. All rights reserved. This material may not be published, broadcast, rewritten or redistributed. Log In Keep it Clean. Please avoid obscene, vulgar, lewd, racist or sexually-oriented language. PLEASE TURN OFF YOUR CAPS LOCK. Don't Threaten. Threats of harming another person will not be tolerated. Be Truthful. Don't knowingly lie about anyone or anything. Be Nice. No racism, sexism or any sort of -ism that is degrading to another person"", 'AP News Summary at 4:09 a.m. EDT Iranian barrages target Israel and Gulf countries as US warns Iran of ‘most intense day of strikes’ DUBAI, United Arab Emirates (AP) — Iran has fired more drones and missiles at Israel and Gulf Arab countries as it keeps up pressure on the Middle East. The war launched by the United States and Israel has sent oil prices surging and stunned global economies. The Saudi Defense Ministry said on Tuesday that it has destroyed two drones over the kingdom’s oil-rich eastern region, while in Kuwait, the National Guard said it shot down six drones attacking the country’s northern and southern areas. The attacks come as U.S. President Donald Trump sends contradictory signals about how long the war could last, adding to uncertainty that’s causing markets to swing. Javascript is required for you to be able to read premium content. Please enable it in your browser settings. Copyright 2026 The Associated Press. All rights reserved. This material may not be published, broadcast, rewritten or redistributed. Sorry, there are no recent results for popular videos. Sorry, there are no recent results for popular commented articles.']"
4,158,4_arsenal_villa_salah_bayern,"['arsenal', 'villa', 'salah', 'bayern', 'chelsea', 'inter', 'united', 'newcastle', 'madrid', 'milan']","['Man City vs. Arsenal: Gunners suffer fresh \'injury blow\' ahead of Premier League blockbuster By Matt Law | 15 Apr 2026 21:37, Last updated: 15 Apr 2026 21:46 Arsenal attacker Noni Madueke has emerged as a major doubt for Sunday\'s blockbuster Premier League contest with Manchester City at the Etihad Stadium. Madueke made his fifth Champions League start of the campaign in Wednesday\'s quarter-final second leg against Sporting Lisbon at the Emirates Stadium. However, the 24-year-old was forced off in the 63rd minute after taking a knock to his knee. Max Dowman was introduced as the England international\'s replacement, and he has now emerged as a major doubt for this weekend\'s top-of-the-table clash with Man City. Arsenal are currently top of the Premier League table, six points ahead of second-placed Man City, who have a game in hand on the Gunners. Madueke has come up with seven goals and four assists in 35 appearances this season, but he could now be facing a spell on the sidelines entering the final straight. Bukayo Saka was also again absent for the Champions League game with Sporting. ""It was something that he was carrying for a while. It was an Achilles issue,"" said Arsenal boss Mikel Arteta ahead of the European fixture on Wednesday night when asked about his star play', ""Liverpool injury update: Alexander Isak, Alisson Becker and Jeremie Frimpong latest news and return dates Sport | Football Liverpool returned to winning ways with a 2-0 victory over Aston Villa to end their four-game losing streak in the Premier League. Pressure was piling on Arne Slot after the Reds slumped to ninth in the table, but even without a number of key players, the champions were able to sweep Villa aside to move back up to third. They welcome Real Madrid - Trent Alexander-Arnold, Xabi Alonso, et al - to Anfield in midweek, before they take on Manchester City in a mouth-watering encounter at the weekend. But will they have any of their star names back from injury? Ahead of a big few weeks, here’s all the latest Liverpool injury news and return dates... Alexander Isak has endured a tough start to life on Merseyside. Subbed at half-time in Liverpool’s 5-1 win over Frankfurt in the Champions League, Slot later revealed the £125million summer signing had suffered a minor groin injury. “Alexander had to go off at half-time because he felt his groin a little bit. That's a pity,” said Slot. “I've said many times it is such a difficult balance to find with a player that missed three months.” Isak was not in the squad in the 3-2 loss at Brentford, and he also missed out on the Caraba"", ""Liverpool injury update: Alexander Isak, Alisson Becker and Jeremie Frimpong latest news and return dates Liverpool returned to winning ways with a 2-0 victory over Aston Villa to end their four-game losing streak in the Premier League. Pressure was piling on Arne Slot after the Reds slumped to ninth in the table, but even without a number of key players, the champions were able to sweep Villa aside to move back up to third. They welcome Real Madrid - Trent Alexander-Arnold, Xabi Alonso, et al - to Anfield in midweek, before they take on Manchester City in a mouth-watering encounter at the weekend. But will they have any of their star names back from injury? Ahead of a big few weeks, here’s all the latest Liverpool injury news and return dates... Alexander Isak has endured a tough start to life on Merseyside. Subbed at half-time in Liverpool’s 5-1 win over Frankfurt in the Champions League, Slot later revealed the £125million summer signing had suffered a minor groin injury. “Alexander had to go off at half-time because he felt his groin a little bit. That's a pity,” said Slot. “I've said many times it is such a difficult balance to find with a player that missed three months.” Isak was not in the squad in the 3-2 loss at Brentford, and he also missed out on the Carabao Cup defeat agai""]"
