Topic,Count,Name,Representation,Representative_Docs
23,20,23_nhl_hockey_scoring_devils,"['nhl', 'hockey', 'scoring', 'devils', 'goal', 'second period', 'rangers', 'buffalo', 'ottawa', 'hughes']","['Buium, Demko lead Canucks to 2-1 win over Devils as post-Hughes era begins Published 12:10 pm Sunday, December 14, 2025 By Philip Wolf Vancouver Canucks defenceman Zeeb Buium, in NHL action Sunday, Dec. 25, 2025 against the New Jersey Devils at the Prudential Center in Newark, N.J. ( photo) Zeev Buium had a goal and an assist in his Vancouver Canucks debut, leading his new team to a 2-1 win over the host New Jersey Devils in NHL action Sunday afternoon at the Prudential Center in Newark, N.J. Buium, along with Marco Rossi and Liam Ohgren, were picked up by the Canucks in a blockbuster trade for Vancouver captain Quinn Hughes on Friday. Jake DeBrusk had the other goal for the Canucks (12-17-3), with Thatcher Demko sharp in making 25 saves for the goaltending win. Quinn’s brother Luke Hughes scored for the Devils (18-14-1). Former Canuck Jacob Markstrom stopped 13 of 15 shots and took the loss in goal. DeBrusk opened the scoring just 61 seconds into the game on the power play, knocking home his own rebound in front of Markstrom. It was DeBrusk’s first goal in 11 games and ninth of the season. Eight of those have come with the man advantage. Buium made it 2-0 at 6:48, when he flipped the puck toward the net and it banked in off a Devils defender. Buium now h', 'Buium, Demko lead Canucks to 2-1 win over Devils as post-Hughes era begins Published 12:10 pm Sunday, December 14, 2025 By Philip Wolf Vancouver Canucks defenceman Zeeb Buium, in NHL action Sunday, Dec. 25, 2025 against the New Jersey Devils at the Prudential Center in Newark, N.J. ( photo) Zeev Buium had a goal and an assist in his Vancouver Canucks debut, leading his new team to a 2-1 win over the host New Jersey Devils in NHL action Sunday afternoon at the Prudential Center in Newark, N.J. Buium, along with Marco Rossi and Liam Ohgren, were picked up by the Canucks in a blockbuster trade for Vancouver captain Quinn Hughes on Friday. Jake DeBrusk had the other goal for the Canucks (12-17-3), with Thatcher Demko sharp in making 25 saves for the goaltending win. Quinn’s brother Luke Hughes scored for the Devils (18-14-1). Former Canuck Jacob Markstrom stopped 13 of 15 shots and took the loss in goal. DeBrusk opened the scoring just 61 seconds into the game on the power play, knocking home his own rebound in front of Markstrom. It was DeBrusk’s first goal in 11 games and ninth of the season. Eight of those have come with the man advantage. Buium made it 2-0 at 6:48, when he flipped the puck toward the net and it banked in off a Devils defender. Buium now h', 'Buium, Demko lead Canucks to 2-1 win over Devils as post-Hughes era begins Published 12:10 pm Sunday, December 14, 2025 By Philip Wolf Vancouver Canucks defenceman Zeeb Buium, in NHL action Sunday, Dec. 25, 2025 against the New Jersey Devils at the Prudential Center in Newark, N.J. ( photo) Zeev Buium had a goal and an assist in his Vancouver Canucks debut, leading his new team to a 2-1 win over the host New Jersey Devils in NHL action Sunday afternoon at the Prudential Center in Newark, N.J. Buium, along with Marco Rossi and Liam Ohgren, were picked up by the Canucks in a blockbuster trade for Vancouver captain Quinn Hughes on Friday. Jake DeBrusk had the other goal for the Canucks (12-17-3), with Thatcher Demko sharp in making 25 saves for the goaltending win. Quinn’s brother Luke Hughes scored for the Devils (18-14-1). Former Canuck Jacob Markstrom stopped 13 of 15 shots and took the loss in goal. DeBrusk opened the scoring just 61 seconds into the game on the power play, knocking home his own rebound in front of Markstrom. It was DeBrusk’s first goal in 11 games and ninth of the season. Eight of those have come with the man advantage. Buium made it 2-0 at 6:48, when he flipped the puck toward the net and it banked in off a Devils defender. Buium now h']"
24,20,24_singh_shah_dhurandhar_tamil,"['singh', 'shah', 'dhurandhar', 'tamil', 'cinema', 'upcoming film', 'vijay', 'visit india', 'yadav', 'actors']","['Jack Whitehall’s Victoria Beckham Swipe Reignites Brooklyn Wedding Drama Before Big Day The teaser of Ramayana is finally here, showcasing Ranbir Kapoor as Rama in a powerful new avatar. Released on Hanuman Jayanti, the glimpse promises massive scale, drawing comparisons to RRR. Directed by Nitesh Tiwari, the film features Sai Pallavi and Yash in key roles. With music by A. R. Rahman and Hans Zimmer, this epic aims to redefine Indian cinema globally. Amid the massive success of Dhurandhar 2, casting director Mukesh Chhabra has sparked fresh debate by revealing the film’s most satisfying casting choice—and it’s neither Ranveer Singh nor Akshaye Khanna. His insight shifts the spotlight onto a performance that quietly stole the film, proving that sometimes the real star isn’t the biggest name, but the most impactful presence on screen. A controversy has erupted after an “unflattering” photo of White House Press Secretary Karoline Leavitt was reportedly removed from major photo archives, sparking debate over media control and public transparency. The image, captured during an official White House press briefing, showed Leavitt smiling while holding her son, with a turkey named “Waddle” also in the frame. What appeared to be a simple moment quickly went viral due to the lo', 'OG ‘Ramba Ho Ho Ho’ girl Kalpana Iyer recreates iconic dance at Family wedding in new Dhurandhar song, video goes viral Veteran actress Kalpana Iyer, famously known as the OG ""Ramba Ho"" girl, has gone viral for recreating her iconic dance at a family wedding. Trending Photos New Delhi: Veteran actor and dancer Kalpana Iyer, who featured in the iconic song Ramba Ho Ho Ho sung by Usha Uthup and composed by Bappi Lahiri, has recreated her famous dance in a new video from a family wedding that is now going viral and leaving fans nostalgic. The Ramba Ho Ho Ho song was originally picturised on Kalpana Iyer in the 1981 film Armaan. Sharing the clip online, Kalpana expressed her gratitude in the caption, writing, “Grateful for all the love, kindness and blessings to each one of you forever.” Add Zee News as a Preferred Source The OG Kalpana Iyer dancing to Ramba Ho. Pure joy. pic.twitter.com/q8yYEstKJv — CinemaRare (@CinemaRareIN) January 30, 2026 In the video, Kalpana is seen performing during the wedding celebrations, draped in a purple silk sari paired with a black-and-gold blouse. She gracefully recreates the signature steps from Ramba Ho Ho Ho as the audience cheers for her. The track has once again found love among the younger generation. It recently gained renewed attention after being referenced in', 'Not Shah Rukh Khan or Salman Khan! French President Emmanuel Macron reveals his favourite Bollywood actor during India visit French President Emmanuel Macron revealed his favourite Bollywood actor during his state visit to India. Trending Photos New Delhi: French President Emmanuel Macron, who was recently on an official visit to India, opened up about his favourite Bollywood actor. His warm interaction with Indian film personalities during the trip also grabbed headlines and won hearts on social media. Emmanuel Macron Reveals His Favourite Bollywood Actor During an interaction with Brut India, President Macron was asked to name his favourite Bollywood star. Without hesitation, he responded with a smile, saying, “I mean, yesterday I mentioned Jai Ho, so I would say Anil Kapoor.” Add Zee News as a Preferred Source Earlier this week, Macron took to Instagram to share pictures from his meeting with several Bollywood celebrities. He captioned the post in French: “Aux côtés de légendes du cinéma indien. La culture nous rassemble,” which translates to, “Alongside legends of Indian cinema. Culture unites us.” The first photograph showed President Macron and First Lady Brigitte Macron posing with Manoj Bajpayee, Anil Kapoor, Zoya Akhtar, Richa Chadha, Shabana Azmi, Ricky Kej, and others. Another image captured t']"
25,20,25_itv_strictly_big brother_simon,"['itv', 'strictly', 'big brother', 'simon', 'alison', 'chris', 'elimination', 'dancing', 'davies', 'holden']","[""Married At First Sight Australia has just exposed this couple's dealbreakers Homestays week has a habit of turning even Married At First Sight Australia's strongest relationships into something far more fragile. And this Wednesday's (28 April) episode proved Alissa and David were no exception. While the pair initially appeared to be one of this season's more promising couples, their latest test outside the experiment revealed that chemistry and emotional connection do not always guarantee long-term compatibility. Like many MAFS couples before them, Alissa and David entered the experiment with optimism, quickly emerging as one of the more stable pairings on the Channel 4 reality series, despite some awkward moments. But homestay week has done what it does best: force reality into the fantasy, bringing up difficult questions in tow. Related: Best streaming services Wednesday's episode saw David travel to Alissa's hometown of Adelaide, where their relationship faced one of its biggest turning points yet. Removed from the controlled environment of the experiment, the couple were confronted with real-life decisions about where they might actually live and what kind of future they truly wanted. Cracks began to emerge almost immediately. A discussion about whether"", 'Strictly Come Dancing fans have same complaint as La Voix withdraws from show \'Pointless!\' Strictly Come Dancing fans have been left with the same question after it was announced La Voix has withdrawn from the competition. During Saturday (November 22) night\'s show, the remaining contestants took to the dance floor at the iconic Blackpool Tower Ballroom. Before things kicked off for Blackpool Week, presenter Tess Daly informed viewers that the drag queen – real name Chris Dennis – would not be returning to the competition after sustaining a foot injury. She said: ""We can confirm she has very sadly had to withdraw from the competition,"" before revealing there would be no elimination this weekend. But this has left fans wondering why Sunday night\'s show is still airing now that there is no dance-off. Taking to social media with their queries, one wrote: ""So what’s the point of Sunday’s show when everything can be done tonight #Strictly?"" Read more: Strictly pro says only one person can replace Craig Revel Horwood Read more: BBC Strictly viewers switch off as major star pulls out of show We use your sign-up to provide content in ways you\'ve consented to and to improve our understanding of you. This may include adverts from us and 3rd parties based on our understanding. You', 'Strictly Come Dancing star breaks silence after concern fifth contestant would quit Strictly Come Dancing\'s Alex Kingston is poised to carry on with her dance adventure, putting to rest concerns she might have to withdraw due to injury. The 62-year-old actress had triggered concerns about a potential exit after her daughter disclosed a rib injury on social media, stating that her mother had endured the discomfort to participate in Saturday\'s programme. The Doctor Who legend, who has been dazzling audiences on the dance floor alongside partner Johannes Radebe, was swift to comfort her supporters that injuries were simply ""part and parcel"" of the Strictly experience, and she had absolutely no plans to retire her dancing shoes. Fleur East, host of Strictly spin-off It Takes Two, has now verified that Alex will return to the competition following last week\'s Blackpool special. Discussing their forthcoming performance, Fleur disclosed: ""Alex and Johannes will be dancing a cha-cha-cha to Ring My Bell by Anita Ward."" We use your sign-up to provide content in ways you\'ve consented to and to improve our understanding of you. This may include adverts from us and 3rd parties based on our understanding. You can unsubscribe at any time. Read our Privacy Policy She continued: ""']"
26,19,26_nigeria_economic growth_ghana_education,"['nigeria', 'economic growth', 'ghana', 'education', 'higher education', 'stakeholders', 'development', 'private sector', 'growth', 'curriculum']","['Madam Yang Yang Pushes Local Talent, Innovation in Industrial Sector Madam Yang Yang, Executive Officer of Zonda Tec Ghana Limited, has reaffirmed the company’s commitment to driving Ghana’s industrial growth through skills development, localisation, and strong community partnerships. Speaking in an interview with the media, Madam Yang outlined how Zonda Tec Ghana has evolved into a major force in the country’s heavy-duty automobile and equipment industry. Under her leadership, the company she said has expanded its footprint across Ghana and the West African sub-region, supplying heavy-duty trucks, construction equipment, and comprehensive technical support services. But beyond market expansion, Madam Yang stressed that Zonda Tec’s mission is rooted in human development. “Our greatest achievement is not measured in the number of trucks we sell, but in the number of Ghanaian youths we empower to build and maintain those trucks,” she said. Over the years, the company has invested heavily in training academies and technical programmes, creating opportunities for artisans, technicians, and engineers to gain industry-relevant skills. Many of these trainees have secured employment in the competitive automobile and machinery sector, a development Madam Yan', 'Government deepens private sector partnerships to tackle housing deficit Audio By Carbonatix The government has reaffirmed its commitment to addressing Ghana’s housing deficit through stronger collaboration with private developers. The Deputy Minister for Works and Housing and Member of Parliament, Gizella Tetteh-Agbotui, made the remarks at the launch of the Puna high-rise development by VAAL Real Estate Ghana. She acknowledged the growing demand for affordable and quality housing, particularly in rapidly expanding urban centres. “Government is committed to addressing the housing deficit through strategic partnerships with the private sector. We recognise the rising demand for affordable and quality housing, especially in our urban areas,” she said. According to her, collaboration between public and private stakeholders remains critical to closing the housing gap. “We will continue to create an enabling environment for private developers to thrive because partnerships like these are key to delivering sustainable housing solutions for Ghanaians,” she added. The Deputy Minister noted that innovative housing models and sustained investment will be crucial in meeting the country’s housing needs amid increasing urbanisation. Also speaking to JoyBusiness at', 'Vocational education key to unlocking Nigeria’s demographic dividends Nigeria is one of the youngest countries in the world, with over 70 percent of its population under the age of 25. This presents a powerful demographic dividend that could drive innovation, productivity, and economic growth for decades. Yet without urgent and meaningful reforms in the education sector, this opportunity risks becoming a missed advantage. Fixing Nigeria’s education system is not just a policy priority; it is the foundation for unlocking the potential of an entire generation. Experts maintain that beyond the federal government’s policy rhetoric, there are urgent need to amplify vocational and technical education in the country. The pivotal roles of vocational and technical education in tackling unemployment, they say, cannot be overemphasised. Vocational education has been an integral part of development strategies in many developed countries because of its impact on productivity and economic growth. Christopher Itua, head of industrial services and development at the Institute for Industrial Technology (IIT), said vocational skills will not only transform Nigeria’s economy but will also elevate families from poverty. According to a World Bank report, “Nigeria’s pover']"
27,19,27_accommodation_homes_family home_bedrooms,"['accommodation', 'homes', 'family home', 'bedrooms', 'hotel', 'pub', 'acre', 'essex', 'square feet', 'building']","['Huge home with heated pool hits the market for £1.85m Property Melksham A home ‘ideally set up for entertaining’ with its own heated swimming pool has been put up for sale for almost £2m. Cleeve Grange, located on Trowbridge Road, in Seend, near Melksham, has been put on the market for £1.85m. It is being marketed by Knight Frank. The agents have described the property as an “impressive and substantial house of about 5,422 square feet. The house has five bedrooms, with the option to turn an annexe in use as a gym and home office into further accommodation. At the home’s centre is an open plan kitchen-slash-breakfast room with double aspect sitting area and doors leading on to a sheltered terrace. Outside the property. (Image: Knight Frank/Rightmove) Full access to all of our articles online and on the app, fewer adverts, a better reading experience, exclusive competitions and more - all for less than the price of a cup of coffee. ☕️Subscribe now! - pic.twitter.com/Dk1fvaFm1K — Wiltshire Times (@wiltshiretimes) April 13, 2026 The kitchen is comprised of an island and various integrated appliances and lies adjacent to an oak-floored sitting room. Steps from the sitting room lead up to a games room with tiled floor and bi-fold doors open', 'Huge home with heated pool hits the market for £1.85m Property Melksham A home ‘ideally set up for entertaining’ with its own heated swimming pool has been put up for sale for almost £2m. Cleeve Grange, located on Trowbridge Road, in Seend, near Melksham, has been put on the market for £1.85m. It is being marketed by Knight Frank. The agents have described the property as an “impressive and substantial house of about 5,422 square feet. The house has five bedrooms, with the option to turn an annexe in use as a gym and home office into further accommodation. At the home’s centre is an open plan kitchen-slash-breakfast room with double aspect sitting area and doors leading on to a sheltered terrace. Outside the property. (Image: Knight Frank/Rightmove) Full access to all of our articles online and on the app, fewer adverts, a better reading experience, exclusive competitions and more - all for less than the price of a cup of coffee. ☕️Subscribe now! - pic.twitter.com/Dk1fvaFm1K — Wiltshire Times (@wiltshiretimes) April 13, 2026 The kitchen is comprised of an island and various integrated appliances and lies adjacent to an oak-floored sitting room. Steps from the sitting room lead up to a games room with tiled floor and bi-fold doors open', 'Huge home with heated pool hits the market for £1.85m Property Melksham A home ‘ideally set up for entertaining’ with its own heated swimming pool has been put up for sale for almost £2m. Cleeve Grange, located on Trowbridge Road, in Seend, near Melksham, has been put on the market for £1.85m. It is being marketed by Knight Frank. The agents have described the property as an “impressive and substantial house of about 5,422 square feet. The house has five bedrooms, with the option to turn an annexe in use as a gym and home office into further accommodation. At the home’s centre is an open plan kitchen-slash-breakfast room with double aspect sitting area and doors leading on to a sheltered terrace. Outside the property. (Image: Knight Frank/Rightmove) Full access to all of our articles online and on the app, fewer adverts, a better reading experience, exclusive competitions and more - all for less than the price of a cup of coffee. ☕️Subscribe now! - pic.twitter.com/Dk1fvaFm1K — Wiltshire Times (@wiltshiretimes) April 13, 2026 The kitchen is comprised of an island and various integrated appliances and lies adjacent to an oak-floored sitting room. Steps from the sitting room lead up to a games room with tiled floor and bi-fold doors open']"
28,19,28_museum_egypt_cultural heritage_egyptian,"['museum', 'egypt', 'cultural heritage', 'egyptian', 'world largest', 'architecture', 'tourism industry', 'treasures', 'morocco', 'governments']","[""Egypt unveils the world's largest museum dedicated to a single civilization CAIRO (AP) — Egypt is inaugurating on Saturday the Grand Egyptian Museum, two decades in the making, with the aim of drawing more visitors to revitalize the country's tourist industry. Located just outside Cairo on the Giza Plateau which also includes the three pyramids and the Sphinx, the museum will be the world’s largest dedicated to a single civilization. It will display over 50,000 artifacts detailing life in ancient Egypt. World leaders, including monarchs, heads of states and governments, are set to attend the grand opening ceremony, according to the Egyptian presidency which touted the museum as “an exceptional event in the history of human culture and civilization.” The museum is one of the megaprojects championed by President Abdel-Fattah el-Sissi since he took office in 2014. He has embarked on massive investments in infrastructure with the aim of reviving an economy weakened by decades of stagnation and battered by the unrest that followed the 2011 Arab Spring uprising. Preparations for the grand reveal have been shrouded in secrecy. The museum, which was opened for limited visits in recent years, has been closed for the past two weeks. The government has revamped the a"", ""Egypt unveils the world's largest museum dedicated to a single civilization CAIRO (AP) — Egypt is inaugurating on Saturday the Grand Egyptian Museum, two decades in the making, with the aim of drawing more visitors to revitalize the country's tourist industry. Located just outside Cairo on the Giza Plateau which also includes the three pyramids and the Sphinx, the museum will be the world’s largest dedicated to a single civilization. It will display over 50,000 artifacts detailing life in ancient Egypt. World leaders, including monarchs, heads of states and governments, are set to attend the grand opening ceremony, according to the Egyptian presidency which touted the museum as “an exceptional event in the history of human culture and civilization.” The museum is one of the megaprojects championed by President Abdel-Fattah el-Sissi since he took office in 2014. He has embarked on massive investments in infrastructure with the aim of reviving an economy weakened by decades of stagnation and battered by the unrest that followed the 2011 Arab Spring uprising. Preparations for the grand reveal have been shrouded in secrecy. The museum, which was opened for limited visits in recent years, has been closed for the past two weeks. The government has revamped the a"", ""Egypt unveils the world's largest museum dedicated to a single civilization Egypt is inaugurating on Saturday the Grand Egyptian Museum, two decades in the making, with the aim of drawing more visitors to revitalize the country's tourist industry. Located just outside Cairo on the Giza Plateau which also includes the three pyramids and the Sphinx, the museum will be the world’s largest dedicated to a single civilization. It will display over 50,000 artifacts detailing life in ancient Egypt. World leaders, including monarchs, heads of states and governments, are set to attend the grand opening ceremony, according to the Egyptian presidency which touted the museum as “an exceptional event in the history of human culture and civilization.” The museum is one of the megaprojects championed by President Abdel-Fattah el-Sissi since he took office in 2014. He has embarked on massive investments in infrastructure with the aim of reviving an economy weakened by decades of stagnation and battered by the unrest that followed the 2011 Arab Spring uprising. Preparations for the grand reveal have been shrouded in secrecy. The museum, which was opened for limited visits in recent years, has been closed for the past two weeks. The government has revamped the areas around t""]"
