Topic,Count,Name,Representation,Representative_Docs
11,23,11_cricket_opening match_injury_world cup,"['cricket', 'opening match', 'injury', 'world cup', 'icc', 'zealand', 'matches', 'tournament', 'scoring', 'south africa']","['Australia’s Hazlewood unlikely to be fit for half of World Cup, Cummins says Australian fast bowler Josh Hazlewood may not return to action until halfway through the T20 World Cup, injured teammate Pat Cummins said on Tuesday. Hazlewood, arguably the squad’s most important bowler, has struggled with hamstring and Achilles injuries and missed the entire five-Test Ashes series against England. Australia head coach Andrew McDonald said in mid-January Hazlewood was on track to be fit for the squad’s World Cup opener against Ireland on February 11, but Cummins’s update was less optimistic. “I caught up with Joshy a few days ago, and he’s working so hard. I really feel for Joshy. He’s had a few setbacks. [He’s] one of the hardest trainers,” Cummins told Australian broadcaster Nine Network. “He’s doing everything he can. I don’t think he will be there for the start of the tournament, but he’s trying his best to be there about halfway through.” With Mitchell Starc having retired from the format and Cummins sidelined with back problems, Australia head into the February 7 to March 8 World Cup undermanned and in poor form after a 111-run humiliation by Pakistan, which completed a 3-0 series whitewash. Cummins said players’ late arrival to Pakistan after the domestic B', 'In-form England must keep developing to have Six Nations chance, says George By Mitch Phillips England hooker and former captain Jamie George has welcomed the confidence swirling around the team going into the Six Nations but said they cannot expect to win the title by playing the same way as they did to build an 11-match winning streak last year. England last won the tournament in 2020, and their most recent Grand Slam was in 2016, both under Eddie Jones, but they go into their opening match at home to Wales on February 7 with more confidence that they can top the standings than for many years. After narrowly losing their championship opener to Ireland in Dublin almost a year ago, England have chalked up 11 successive wins, including a rare one against New Zealand, and coach Steve Borthwick has built considerable depth in his squad. “We welcome the expectation because it’s a compliment for what we’ve done and what we’ve achieved over a short period of time, but it also keeps us on our toes because we know we can’t be complacent and can’t rely on previous performances,” George said at the Six Nations launch in Edinburgh on Monday. If we’re the same team as we were for the last 11 games, it will not be good enough, so our focus over the next two weeks is to', 'In-form England must keep developing to have Six Nations chance, says George By Mitch Phillips England hooker and former captain Jamie George has welcomed the confidence swirling around the team going into the Six Nations but said they cannot expect to win the title by playing the same way as they did to build an 11-match winning streak last year. England last won the tournament in 2020, and their most recent Grand Slam was in 2016, both under Eddie Jones, but they go into their opening match at home to Wales on February 7 with more confidence that they can top the standings than for many years. After narrowly losing their championship opener to Ireland in Dublin almost a year ago, England have chalked up 11 successive wins, including a rare one against New Zealand, and coach Steve Borthwick has built considerable depth in his squad. “We welcome the expectation because it’s a compliment for what we’ve done and what we’ve achieved over a short period of time, but it also keeps us on our toes because we know we can’t be complacent and can’t rely on previous performances,” George said at the Six Nations launch in Edinburgh on Monday. If we’re the same team as we were for the last 11 games, it will not be good enough, so our focus over the next two weeks is to']"
12,22,12_epstein files_justice department_doj_clinton,"['epstein files', 'justice department', 'doj', 'clinton', 'investigative', 'fbi', 'white house', 'jeffrey', 'convicted', 'donald']","[""Latest Epstein release shows scope of DOJ probes into Epstein, Maxwell The U.S. Justice Department has released tens of thousands more documents related to Jeffrey Epstein, a tranche that included multiple mentions of President Donald Trump but added little new revelatory information. WASHINGTON — The U.S. Justice Department released tens of thousands more documents related to Jeffrey Epstein, a tranche that included multiple mentions of President Donald Trump but added little new revelatory information to the long-anticipated public file on the late financier and convicted sex offender. President Donald Trump speaks Monday at his Mar-a-Lago club in Palm Beach, Fla. A desk and photographs are pictured July 6, 2019, during a search of Jeffrey Epstein's home in New York. An email that was included in the U.S. Department of Justice release of the Jeffrey Epstein files is photographed Monday. Get local news delivered to your inbox! The U.S. Justice Department has released tens of thousands more documents related to Jeffrey Epstein, a tranche that included multiple mention…"", ""Latest Epstein release shows scope of DOJ probes into Epstein, Maxwell The U.S. Justice Department has released tens of thousands more documents related to Jeffrey Epstein, a tranche that included multiple mentions of President Donald Trump but added little new revelatory information. WASHINGTON — The U.S. Justice Department released tens of thousands more documents related to Jeffrey Epstein, a tranche that included multiple mentions of President Donald Trump but added little new revelatory information to the long-anticipated public file on the late financier and convicted sex offender. President Donald Trump speaks Monday at his Mar-a-Lago club in Palm Beach, Fla. A desk and photographs are pictured July 6, 2019, during a search of Jeffrey Epstein's home in New York. An email that was included in the U.S. Department of Justice release of the Jeffrey Epstein files is photographed Monday. Get local news delivered to your inbox! The U.S. Justice Department has released tens of thousands more documents related to Jeffrey Epstein, a tranche that included multiple mention…"", ""Latest Epstein release shows scope of DOJ probes into Epstein, Maxwell The U.S. Justice Department has released tens of thousands more documents related to Jeffrey Epstein, a tranche that included multiple mentions of President Donald Trump but added little new revelatory information. WASHINGTON — The U.S. Justice Department released tens of thousands more documents related to Jeffrey Epstein, a tranche that included multiple mentions of President Donald Trump but added little new revelatory information to the long-anticipated public file on the late financier and convicted sex offender. President Donald Trump speaks Monday at his Mar-a-Lago club in Palm Beach, Fla. A desk and photographs are pictured July 6, 2019, during a search of Jeffrey Epstein's home in New York. An email that was included in the U.S. Department of Justice release of the Jeffrey Epstein files is photographed Monday. Get local news delivered to your inbox! The U.S. Justice Department has released tens of thousands more documents related to Jeffrey Epstein, a tranche that included multiple mention…""]"
13,21,13_nigeria_nigerian_lagos_democratic,"['nigeria', 'nigerian', 'lagos', 'democratic', 'election', 'west african', 'democratic party', 'candidates', 'state governor', 'kenya']","['Tinubu to Trump: Nigeria’s constitution protects every faith, intolerance is not our identity President Bola Tinubu has rejected United States President Donald Trump’s decision to redesignate Nigeria as a “country of particular concern” over alleged religious persecution. In a statement on Saturday, Tinubu said Nigeria remains a democracy anchored on constitutional guarantees of freedom of religion and belief. “Nigeria stands firmly as a democracy governed by constitutional guarantees of religious liberty,” the president said. “The characterisation of Nigeria as religiously intolerant does not reflect our national reality, nor does it take into consideration the consistent and sincere efforts of the government to safeguard freedom of religion and beliefs for all Nigerians.” Trump had on Friday announced via his Truth Social platform that Nigeria had been redesignated on the US religious freedom watchlist as a “country of particular concern”. The move follows growing criticism by some US lawmakers, American evangelical groups and lobbyists who allege persecution of Christians in parts of Nigeria. However, Tinubu described those claims as inaccurate and unhelpful, adding that his administration has maintained open and active engagement with leaders of both major religions sin', 'ADC-Obidient alliance can end APC dominance in 2027 – Odigie-Oyegun Chief John Odigie-Oyegun, former National Chairman of the All Progressives Congress, APC, and a prominent leader of the African Democratic Congress, ADC, has expressed confidence that the growing collaboration between the ADC and the Obidient Movement could dislodge the APC from power in the 2027 general elections. Odigie-Oyegun made the remarks on Monday in Benin City, Edo State, during a formal reception for members of the Obidient Movement who recently defected en masse to the ADC. The defection follows the recent alignment of former Labour Party presidential candidate, Mr Peter Obi, with the ADC. Addressing the gathering, Odigie-Oyegun said the decision by the Obidient Movement to join the ADC reflects a growing commitment among Nigerians, especially young people, to pursue political change and national renewal. “The calibre and dedication of new members joining our party strengthens my belief that a new Nigeria is within reach,” he said. Recalling recent developments, he added: “A few days ago, I witnessed the entry of Dele Momodu, a prominent figure, into the party. Today, I see a large group of youths who are genuinely committed to nation-building. Meeting the members of the', 'ADC Coalition: Atiku Saved Many Political Actors From Becoming Politically Stranded – Okai Prominent youth advocate and political figure, Comrade Usman Okai Austin, has identified former Vice President and 2023 presidential candidate of the Peoples Democratic Party (PDP), Atiku Abubakar, as a major driving force behind efforts to restore Nigeria’s democratic direction ahead of the 2027 general elections. Okai, a chieftain of the African Democratic Congress (ADC), stated this following a closed-door strategic meeting with Atiku, where discussions centred on the urgent need to build a united and formidable opposition capable of challenging the ruling party. The youth leader described the move to form a broad opposition coalition under the ADC platform as timely, especially in view of the prolonged leadership and structural crises rocking the PDP. According to him, Atiku’s intervention has prevented many political actors from becoming politically stranded as a result of the turmoil within their former party. He said, “Today, we are no longer at the mercy of those bent on destroying the PDP from within, because a stronger coalition has emerged due to Atiku’s foresight.” Okai argued that without the ADC-driven alliance, opposition voices would have been largely silenced in Ni']"
14,21,14_wedding_guests_musical_grammy,"['wedding', 'guests', 'musical', 'grammy', 'award winning', 'brooklyn', 'singer', 'david', 'fashion', 'baby']","['Source details Victoria Beckham’s ‘inappropriate’ wedding dance with son Brooklyn In this photo illustration, U.K. newspaper front pages display stories and images on the Beckham family feud on Jan. 20, 2026, in London. On Monday night, Brooklyn Beckham posted a six-page statement via Instagram detailing the tension between him and his parents, David and Victoria Beckham. (Photo Illustration by Mark Case/Getty Images/TNS) A source is detailing the “inappropriate” dance Victoria Beckham shared with son Brooklyn at his 2022 wedding to Nicola Peltz, saying it left guests “deeply uncomfortable.” The 26-year-old son of Posh Spice, 51, and David Beckham claimed in a multi-part Instagram statement Monday that his mother “hijacked my first dance with my wife,” during which he said Victoria “danced very inappropriately on me in front of everyone.” Javascript is required for you to be able to read premium content. Please enable it in your browser settings. Raising more than $20,000 to take a group of drama students to a regional competition in Tennessee takes some creativity. Cathy Simprini has always been one to go with the flow, and a little over 11 years ago, that attitude led her to pick up a new hobby — the ukulele. McQuade honored as Notable Georgian by Georgia Tren', 'Source details Victoria Beckham’s ‘inappropriate’ wedding dance with son Brooklyn In this photo illustration, U.K. newspaper front pages display stories and images on the Beckham family feud on Jan. 20, 2026, in London. On Monday night, Brooklyn Beckham posted a six-page statement via Instagram detailing the tension between him and his parents, David and Victoria Beckham. (Photo Illustration by Mark Case/Getty Images/TNS) A source is detailing the “inappropriate” dance Victoria Beckham shared with son Brooklyn at his 2022 wedding to Nicola Peltz, saying it left guests “deeply uncomfortable.” The 26-year-old son of Posh Spice, 51, and David Beckham claimed in a multi-part Instagram statement Monday that his mother “hijacked my first dance with my wife,” during which he said Victoria “danced very inappropriately on me in front of everyone.” “The dance was deeply uncomfortable, and people did notice at the wedding,” an insider told Us Weekly. The source claims that the fashion designer “nuzzled on Brooklyn’s neck in front of everyone and he made a face.” Brooklyn “was in shock and upset,” they continued. “It was inappropriate and weird.” But another source speaking to the outlet felt the former Spice Girl “just seemed to be having a fun time” and people were not “g', 'Source details Victoria Beckham’s ‘inappropriate’ wedding dance with son Brooklyn In this photo illustration, U.K. newspaper front pages display stories and images on the Beckham family feud on Jan. 20, 2026, in London. On Monday night, Brooklyn Beckham posted a six-page statement via Instagram detailing the tension between him and his parents, David and Victoria Beckham. (Photo Illustration by Mark Case/Getty Images/TNS) A source is detailing the “inappropriate” dance Victoria Beckham shared with son Brooklyn at his 2022 wedding to Nicola Peltz, saying it left guests “deeply uncomfortable.” The 26-year-old son of Posh Spice, 51, and David Beckham claimed in a multi-part Instagram statement Monday that his mother “hijacked my first dance with my wife,” during which he said Victoria “danced very inappropriately on me in front of everyone.” “The dance was deeply uncomfortable, and people did notice at the wedding,” an insider told Us Weekly. The source claims that the fashion designer “nuzzled on Brooklyn’s neck in front of everyone and he made a face.” Brooklyn “was in shock and upset,” they continued. “It was inappropriate and weird.” But another source speaking to the outlet felt the former Spice Girl “just seemed to be having a fun time” and people were not “g']"
15,20,15_fabric_furniture_essentials_pigment,"['fabric', 'furniture', 'essentials', 'pigment', 'budget friendly', 'product', 'colors', 'design', 'beauty', 'shoppers']","['The darkest fabric ever made is now a dress Get the Popular Science daily newsletter💡 Breakthroughs, discoveries, and DIY tips sent every weekday. Terms of Service and Privacy Policy. There is black, and then there is ultrablack. The shade defined as a black that reflects less than 0.5 percent of the light that hits it, is used on everything from telescopes to cameras. This uniquely dark color is not easy to produce and may appear less black when it is viewed at an angle. To find a better way to reproduce this cool color, a team at Cornell University looked to nature. Specifically, a bird called the magnificent riflebird. The result is the darkest known fabric ever created and it is detailed in a study recently published in the journal Nature Communications. The magnificent riflebird is a large songbird and member of the bird-of-paradise family found in New Guinea and Australia. Male riflebirds are almost completely black, with a green and blue metallic sheen on their belly, throat, and crown feathers. With the help of Mary M. Ferraro and Vanya Rohwer from the Cornell Lab of Ornithology, the team studied the riflebird’s black feathers. Their plumage comes from melanin pigment paired with tightly bunched filaments called barb', ""Sam's Club Is Selling a Versatile 12-Drawer Organizer That's a Serial Hobbyist's Dream Come True As a subscriber, you can share up to 3 articles each month with friends for free. Just click “Gift this Article” on this page, then copy the link or enter their email. Gifts are exclusive to subscribers, reset monthly, and each article can be redeemed once. Parade aims to feature only the best products and services. If you buy something via one of our links, we may earn a commission. I'm calling it now: 2026 will be the year of hobbies. Whether you love crafting, building LEGO sets, sewing, painting, putting together puzzles, crocheting or all of the above, there are plenty of different hobbies you can get into this year. Of course, many of these activities require supplies that can easily get scattered about and disorganized (looking at you LEGO bricks). This may lead to more clutter and chaos in the home—something no one wants. That's why before you start a new hobby it can be helpful to think about a storage solution for all of your hobby essentials. Javascript is required for you to be able to read premium content. Please enable it in your browser settings. Log In Keep it Clean. Please avoid obscene, vulgar, lewd, racist or sexually-oriented language. PLEASE TURN OFF YOUR CAPS"", ""Target's 'Elegant' 3-Piece Duvet Set Is 'Perfect in Every Way' As a subscriber, you can share up to 3 articles each month with friends for free. Just click “Gift this Article” on this page, then copy the link or enter their email. Gifts are exclusive to subscribers, reset monthly, and each article can be redeemed once. Parade aims to feature only the best products and services. If you buy something via one of our links, we may earn a commission. It's that time of year where many of us are looking to upgrade our bedding. If you're looking for an affordable but luxe option, this duvet set from Target is just what you need. Despite it's inexpensive price point, it looks so high-end. Javascript is required for you to be able to read premium content. Please enable it in your browser settings. Log In Keep it Clean. Please avoid obscene, vulgar, lewd, racist or sexually-oriented language. PLEASE TURN OFF YOUR CAPS LOCK. Don't Threaten. Threats of harming another person will not be tolerated. Be Truthful. Don't knowingly lie about anyone or anything. Be Nice. No racism, sexism or any sort of -ism that is degrading to another person. Be Proactive. Use the 'Report' link on each comment to let us know of abusive posts. Share with Us. We'd love to hear ey""]"
16,16,16_welfare_disability_labour_employment,"['welfare', 'disability', 'labour', 'employment', 'benefits', 'increase', 'claims', 'income', 'expenses', 'unemployed']","['How much will DWP benefits and pensions rise following the budget? Benefits Budget 2025 Child Benefit Department for Work and Pensions DWP Pensions PIP Rachel Reeves Universal Credit National government Personal Finance DWP benefits including Universal Credit, Child Benefit, PIP, Carer\'s Allowance, and the State Pension are to increase in April 2026 after Rachel Reeves announced higher payments in her budget speech today. Anyone who claims DWP benefits should be in line for an increase in the next financial year, as the chancellor laid out plans to help pensioners, disabled people, parents, low earners, carers and unemployed people keep up with rising costs. Addressing MPs, Ms Reeves said: ""The broken welfare system that we inherited wrote off millions of people as too sick to work and we will reform that system so that it is a system that does not count the cost of failure, but one that protects people who cannot work and empowers those who can. ""We have brought back face-to-face assessments for disability benefits. Those are the face-to-face assessments that the shadow chancellor (Sir Mel Stride) got rid of when he was work and pensions secretary and our changes we have made to Universal Credit will get 15,000 people back into work, a figure con', 'How much will DWP benefits and pensions rise following the budget? Benefits Budget 2025 Child Benefit Department for Work and Pensions DWP Pensions PIP Rachel Reeves Universal Credit National government Personal Finance DWP benefits including Universal Credit, Child Benefit, PIP, Carer\'s Allowance, and the State Pension are to increase in April 2026 after Rachel Reeves announced higher payments in her budget speech today. Anyone who claims DWP benefits should be in line for an increase in the next financial year, as the chancellor laid out plans to help pensioners, disabled people, parents, low earners, carers and unemployed people keep up with rising costs. Addressing MPs, Ms Reeves said: ""The broken welfare system that we inherited wrote off millions of people as too sick to work and we will reform that system so that it is a system that does not count the cost of failure, but one that protects people who cannot work and empowers those who can. ""We have brought back face-to-face assessments for disability benefits. Those are the face-to-face assessments that the shadow chancellor (Sir Mel Stride) got rid of when he was work and pensions secretary and our changes we have made to Universal Credit will get 15,000 people back into work, a figure con', 'How much will DWP benefits and pensions rise following the budget? Benefits Budget 2025 Child Benefit Department for Work and Pensions DWP Pensions PIP Rachel Reeves Universal Credit National government Personal Finance DWP benefits including Universal Credit, Child Benefit, PIP, Carer\'s Allowance, and the State Pension are to increase in April 2026 after Rachel Reeves announced higher payments in her budget speech today. Anyone who claims DWP benefits should be in line for an increase in the next financial year, as the chancellor laid out plans to help pensioners, disabled people, parents, low earners, carers and unemployed people keep up with rising costs. Addressing MPs, Ms Reeves said: ""The broken welfare system that we inherited wrote off millions of people as too sick to work and we will reform that system so that it is a system that does not count the cost of failure, but one that protects people who cannot work and empowers those who can. ""We have brought back face-to-face assessments for disability benefits. Those are the face-to-face assessments that the shadow chancellor (Sir Mel Stride) got rid of when he was work and pensions secretary and our changes we have made to Universal Credit will get 15,000 people back into work, a figure con']"
