Topic,Count,Name,Representation,Representative_Docs
-1,433,-1_high school_social_award_administration,"['high school', 'social', 'award', 'administration', 'cultural', 'article', 'event', 'association', 'families', 'women']","[""Mizzou men's basketball opens season on the road against Howard Mark Mitchell Missouri center Shawn Phillips Jr. dunks the ball during an exhibition game against Kansas State on Friday at Mizzou Arena. The Tigers will open their season Monday at Howard in Washington D.C. Javascript is required for you to be able to read premium content. Please enable it in your browser settings. Originally published on columbiamissourian.com, part of the BLOX Digital Content Exchange. Log In Keep it Clean. Please avoid obscene, vulgar, lewd, racist or sexually-oriented language. PLEASE TURN OFF YOUR CAPS LOCK. Don't Threaten. Threats of harming another person will not be tolerated. Be Truthful. Don't knowingly lie about anyone or anything. Be Nice. No racism, sexism or any sort of -ism that is degrading to another person. Be Proactive. Use the 'Report' link on each comment to let us know of abusive posts. Share with Us. We'd love to hear eyewitness accounts, the history behind an article."", ""Ashland High School to host senior dinner, concert The Ashland School District and Tamarack Health Ashland Medical Center invite area seniors to attend a dinner and concert on Thursday, Nov. 6 at the Ashland High School commons area. The event is free to attend and will feature live music performed by Ashland High School Jazz Band. Dinner starts at 5 p.m., followed by the concert at 5:45 p.m. Space is limited, so please call 715-682-7089 to make a reservation. (Copyright © 2025 APG Media) Log In Keep it Clean. Please avoid obscene, vulgar, lewd, racist or sexually-oriented language. PLEASE TURN OFF YOUR CAPS LOCK. Don't Threaten. Threats of harming another person will not be tolerated. Be Truthful. Don't knowingly lie about anyone or anything. Be Nice. No racism, sexism or any sort of -ism that is degrading to another person. Be Proactive. Use the 'Report' link on each comment to let us know of abusive posts. Share with Us. We'd love to hear eyewitness accounts, the history behind an article."", ""Machado Presents Trump With Her Nobel Peace Prize María Corina Machado, Venezuela’s opposition leader and last year’s Nobel Peace Prize winner, presented her prize to President Donald Trump on Thursday during a meeting in the White House. Trump took to social media several hours later to thank her. Javascript is required for you to be able to read premium content. Please enable it in your browser settings. Log In Keep it Clean. Please avoid obscene, vulgar, lewd, racist or sexually-oriented language. PLEASE TURN OFF YOUR CAPS LOCK. Don't Threaten. Threats of harming another person will not be tolerated. Be Truthful. Don't knowingly lie about anyone or anything. Be Nice. No racism, sexism or any sort of -ism that is degrading to another person. Be Proactive. Use the 'Report' link on each comment to let us know of abusive posts. Share with Us. We'd love to hear eyewitness accounts, the history behind an article. SIERRA VISTA — Sierra Vista Fire & Medical Services reported its busiest year on record in 2025, answering 11,123 emergency calls — a year-over-year increase of 946 compared to 2024. That … Read moreSierra Vista Fire & Medical Logs Record 11,123 Emergency Responses in 2025 María Corina Machado, Venezuela’s opposition leader""]"
0,1665,0_state_defense_washington_football,"['state', 'defense', 'washington', 'football', 'nation', 'injury', 'final', 'won', 'sign', 'held']","[""Strong first half is enough for Indiana to topple Chicago State Lamar Wilkerson scored a game-high 21 points Saturday and Indiana made 14 of its 15 3-pointers in the first half of a 78-58 nonconference home win over Chicago State in Bloomington. Reed Bailey came off the bench to add 17 points and eight rebounds, while Nick Dorn contributed 15 points on 5-of-11 shooting from the 3-point line. The Hoosiers (9-3) drew assists on all but two of their 26 field goals, with Conor Enright dishing out seven and Wilkerson handing out six. Javascript is required for you to be able to read premium content. Please enable it in your browser settings. Please log in, or sign up for a new, free account to read or post comments. Log In Keep it Clean. Please avoid obscene, vulgar, lewd, racist or sexually-oriented language. PLEASE TURN OFF YOUR CAPS LOCK. Don't Threaten. Threats of harming another person will not be tolerated. Be Truthful. Don't knowingly lie about anyone or anything. Be Nice. No racism, sexism or any sort of -ism that is degrading to another person. Be Proactive. Use the 'Report' link on each comment to let us know of abusive posts. Share with Us. We'd love to hear eyewitness accounts, the history behind an article. Please purchase a subscriptio"", ""Heartbreak for Canada, Sidney Crosby in Olympic hockey final MILAN -- For a nation that measures itself in hockey gold, Sunday's heartbreaking 2-1 defeat to the United States in overtime was more than a lost final. It was a symbolic shift in a rivalry Canada has long considered its own to win. Canada, owners of nine Olympic men's hockey titles to the Americans' three, is a country whose national identity is intertwined with the sport. Javascript is required for you to be able to read premium content. Please enable it in your browser settings. Please log in, or sign up for a new, free account to read or post comments. Log In Keep it Clean. Please avoid obscene, vulgar, lewd, racist or sexually-oriented language. PLEASE TURN OFF YOUR CAPS LOCK. Don't Threaten. Threats of harming another person will not be tolerated. Be Truthful. Don't knowingly lie about anyone or anything. Be Nice. No racism, sexism or any sort of -ism that is degrading to another person. Be Proactive. Use the 'Report' link on each comment to let us know of abusive posts. Share with Us. We'd love to hear eyewitness accounts, the history behind an article. Please purchase a subscription to read our premium content. If you have a subscription, please log in or sign up for an ac"", ""Inagawa helps pace Drake in 24-19 win over Butler to stay perfect in Pioneer Football League INDIANAPOLIS (AP) — Logan Inagawa threw for 244 yards and a touchdown and Drake remained unbeaten in the Pioneer Football League by beating Butler 24-19 on Saturday. Drake's Isaiah Bragg returned the opening kickoff 32 yards to the Drake 34. On the first play from scrimmage, Nick Herman took the handoff and ran 66 yards to the end zone for a 7-0 Drake (6-2, 5-0) lead. Javascript is required for you to be able to read premium content. Please enable it in your browser settings. Copyright 2025 The Associated Press. All rights reserved. This material may not be published, broadcast, rewritten or redistributed without permission. Log In Keep it Clean. Please avoid obscene, vulgar, lewd, racist or sexually-oriented language. PLEASE TURN OFF YOUR CAPS LOCK. Don't Threaten. Threats of harming another person will not be tolerated. Be Truthful. Don't knowingly lie about anyone or anything. Be Nice. No racism, sexism or any sort of -ism that is degrading to another person. Be Proactive. Use the 'Report' link on each comment to let us know of abusive posts. Share with Us. We'd love to hear eyewitness accounts, the history behind an article. Sorry, there are no recent results for popular commen""]"
1,17,1_surgical_hospital_clinics_procedures,"['surgical', 'hospital', 'clinics', 'procedures', 'operations', 'healthcare', 'doctors', 'nurses', 'clinicians', 'professionals']","['VIDEO: $5.5M robotic surgery system arrives at Surrey Memorial Hospital Published 12:10 pm Tuesday, January 27, 2026 By Anna Burns The da Vinci Xi System has been unpacked and calibrated and is being held in a temporary location until its permanent location is finished. Fraser Health said that it expects it to “go-live” later in the spring. (Fraser Health/ Contributed to Surrey Now-Leader) Health care workers pose in front of the da Vinci Xi System. (Fraser Health/ Contributed to Surrey Now-Leader) Surrey Memorial Hospital is one step closer to providing robotic-assisted surgery with the arrival of the da Vinci Xi Robotic Surgery system. It is expected to be used in surgeries in the spring. “With the aid of the da Vinci Xi system, we can expand minimally invasive thoracic and foregut surgery, and we can do operations with greater precision and accuracy,” says Dr Ahmad Ashrafi, regional division head and chief of thoracic surgery for Fraser Health. “Patients may experience quicker recovery times, and we can carry out more complex procedures right here in Surrey, using minimally invasive techniques. This advanced technology will also help us attract and retain top surgical talent at Surrey Memorial Hospital.” Construction is underway on an operating room', 'VIDEO: $5.5M robotic surgery system arrives at Surrey Memorial Hospital Published 12:10 pm Tuesday, January 27, 2026 By Anna Burns The da Vinci Xi System has been unpacked and calibrated and is being held in a temporary location until its permanent location is finished. Fraser Health said that it expects it to “go-live” later in the spring. (Fraser Health/ Contributed to Surrey Now-Leader) Health care workers pose in front of the da Vinci Xi System. (Fraser Health/ Contributed to Surrey Now-Leader) Surrey Memorial Hospital is one step closer to providing robotic-assisted surgery with the arrival of the da Vinci Xi Robotic Surgery system. It is expected to be used in surgeries in the spring. “With the aid of the da Vinci Xi system, we can expand minimally invasive thoracic and foregut surgery, and we can do operations with greater precision and accuracy,” says Dr Ahmad Ashrafi, regional division head and chief of thoracic surgery for Fraser Health. “Patients may experience quicker recovery times, and we can carry out more complex procedures right here in Surrey, using minimally invasive techniques. This advanced technology will also help us attract and retain top surgical talent at Surrey Memorial Hospital.” Construction is underway on an operating room', 'VIDEO: $5.5M robotic surgery system arrives at Surrey Memorial Hospital Published 12:10 pm Tuesday, January 27, 2026 By Anna Burns The da Vinci Xi System has been unpacked and calibrated and is being held in a temporary location until its permanent location is finished. Fraser Health said that it expects it to “go-live” later in the spring. (Fraser Health/ Contributed to Surrey Now-Leader) Health care workers pose in front of the da Vinci Xi System. (Fraser Health/ Contributed to Surrey Now-Leader) Surrey Memorial Hospital is one step closer to providing robotic-assisted surgery with the arrival of the da Vinci Xi Robotic Surgery system. It is expected to be used in surgeries in the spring. “With the aid of the da Vinci Xi system, we can expand minimally invasive thoracic and foregut surgery, and we can do operations with greater precision and accuracy,” says Dr Ahmad Ashrafi, regional division head and chief of thoracic surgery for Fraser Health. “Patients may experience quicker recovery times, and we can carry out more complex procedures right here in Surrey, using minimally invasive techniques. This advanced technology will also help us attract and retain top surgical talent at Surrey Memorial Hospital.” Construction is underway on an operating room']"
2,16,2_museum_world largest_tourism_architecture,"['museum', 'world largest', 'tourism', 'architecture', 'tourism industry', 'arab', 'governments', 'economy', 'cultural', 'grand']","[""Egypt unveils the world's largest museum dedicated to a single civilization CAIRO (AP) — Egypt is inaugurating on Saturday the Grand Egyptian Museum, two decades in the making, with the aim of drawing more visitors to revitalize the country's tourist industry. Located just outside Cairo on the Giza Plateau which also includes the three pyramids and the Sphinx, the museum will be the world’s largest dedicated to a single civilization. It will display over 50,000 artifacts detailing life in ancient Egypt. World leaders, including monarchs, heads of states and governments, are set to attend the grand opening ceremony, according to the Egyptian presidency which touted the museum as “an exceptional event in the history of human culture and civilization.” The museum is one of the megaprojects championed by President Abdel-Fattah el-Sissi since he took office in 2014. He has embarked on massive investments in infrastructure with the aim of reviving an economy weakened by decades of stagnation and battered by the unrest that followed the 2011 Arab Spring uprising. Preparations for the grand reveal have been shrouded in secrecy. The museum, which was opened for limited visits in recent years, has been closed for the past two weeks. The government has revamped the a"", ""Egypt unveils the world's largest museum dedicated to a single civilization CAIRO (AP) — Egypt is inaugurating on Saturday the Grand Egyptian Museum, two decades in the making, with the aim of drawing more visitors to revitalize the country's tourist industry. Located just outside Cairo on the Giza Plateau which also includes the three pyramids and the Sphinx, the museum will be the world’s largest dedicated to a single civilization. It will display over 50,000 artifacts detailing life in ancient Egypt. World leaders, including monarchs, heads of states and governments, are set to attend the grand opening ceremony, according to the Egyptian presidency which touted the museum as “an exceptional event in the history of human culture and civilization.” The museum is one of the megaprojects championed by President Abdel-Fattah el-Sissi since he took office in 2014. He has embarked on massive investments in infrastructure with the aim of reviving an economy weakened by decades of stagnation and battered by the unrest that followed the 2011 Arab Spring uprising. Preparations for the grand reveal have been shrouded in secrecy. The museum, which was opened for limited visits in recent years, has been closed for the past two weeks. The government has revamped the a"", ""Egypt unveils the world's largest museum dedicated to a single civilization Egypt is inaugurating on Saturday the Grand Egyptian Museum, two decades in the making, with the aim of drawing more visitors to revitalize the country's tourist industry. Located just outside Cairo on the Giza Plateau which also includes the three pyramids and the Sphinx, the museum will be the world’s largest dedicated to a single civilization. It will display over 50,000 artifacts detailing life in ancient Egypt. World leaders, including monarchs, heads of states and governments, are set to attend the grand opening ceremony, according to the Egyptian presidency which touted the museum as “an exceptional event in the history of human culture and civilization.” The museum is one of the megaprojects championed by President Abdel-Fattah el-Sissi since he took office in 2014. He has embarked on massive investments in infrastructure with the aim of reviving an economy weakened by decades of stagnation and battered by the unrest that followed the 2011 Arab Spring uprising. Preparations for the grand reveal have been shrouded in secrecy. The museum, which was opened for limited visits in recent years, has been closed for the past two weeks. The government has revamped the areas around t""]"
3,10,3_new study_inflammation_lung_tests,"['new study', 'inflammation', 'lung', 'tests', 'indications', 'clinicians', 'acid', 'cells', 'prevention', 'guidelines']","['Disagreement Between Two Kidney Function Tests Predicts Serious Health Problems NEW YORK and HOUSTON, Nov. 7, 2025 /PRNewswire/ -- A mismatch between two common tests for kidney function may indicate a higher risk for kidney failure, heart disease, and death, a new study shows. Health care providers for decades have measured blood levels of the molecule creatinine to track the rate at which kidneys filter waste from muscle breakdown in the bloodstream. According to more recent guidelines, levels of cystatin C, a small protein made by all cells in the body, can also be used to measure kidney function. Since these two tests are influenced by different factors — including some related to disease or aging — using both markers together can provide a better measure of kidney function and risk of organ failure than either one alone. Led by NYU Langone Health researchers, the new work reveals that many people, especially those who are sick, often have a large gap between the two readings, which may be a signal of future disease. Specifically, the global study shows that more than a third of hospitalized participants had a cystatin C-based readout of kidney function that was at least 30% lower than one based on their creatinine levels. ""Our findings highlight the impor', 'Pharming Group receives Complete Response Letter from U.S. FDA for sNDA for Joenja® (leniolisib) in children aged 4 to 11 years with APDS Leiden, the Netherlands, February 1, 2026: Pharming Group (Euronext: PHARM; Nasdaq: PHAR) today announced that the U.S. Food and Drug Administration (FDA) has issued a Complete Response Letter (CRL) to its supplemental New Drug Application (sNDA) for Joenja® (leniolisib), an oral, selective phosphoinositide 3-kinase delta (PI3Kδ) inhibitor, as a treatment for children aged 4 to 11 years with activated phosphoinositide 3-kinase delta syndrome (APDS), a rare primary immunodeficiency. The FDA raised an issue with the potential for underexposure in lower weight pediatric patients. As a result, the FDA has requested additional pediatric pharmacokinetic data to reassess the proposed pediatric doses and confirm that children in the lower weight dose groups can achieve exposure levels comparable to the approved adult and adolescent regimen. The letter also identified an issue with one of the analytical methods used for production batch testing, and the FDA requested additional data and clarification on this point. We believe we can address the clinical pharmacology and batch testing methodology issues outlined in the letter, and we plan to work closely with the FDA to meet the Agency’s req', 'Pharming Group receives Complete Response Letter from U.S. FDA for sNDA for Joenja® (leniolisib) in children aged 4 to 11 years with APDS Leiden, the Netherlands, February 1, 2026: Pharming Group (Euronext: PHARM; Nasdaq: PHAR) today announced that the U.S. Food and Drug Administration (FDA) has issued a Complete Response Letter (CRL) to its supplemental New Drug Application (sNDA) for Joenja® (leniolisib), an oral, selective phosphoinositide 3-kinase delta (PI3Kδ) inhibitor, as a treatment for children aged 4 to 11 years with activated phosphoinositide 3-kinase delta syndrome (APDS), a rare primary immunodeficiency. The FDA raised an issue with the potential for underexposure in lower weight pediatric patients. As a result, the FDA has requested additional pediatric pharmacokinetic data to reassess the proposed pediatric doses and confirm that children in the lower weight dose groups can achieve exposure levels comparable to the approved adult and adolescent regimen. The letter also identified an issue with one of the analytical methods used for production batch testing, and the FDA requested additional data and clarification on this point. We believe we can address the clinical pharmacology and batch testing methodology issues outlined in the letter, and we plan to work closely with the FDA to meet the Agency’s req']"
