Topic,Count,Name,Representation,Representative_Docs
29,19,29_corporation nasdaq_nasdaq_company announced_company tsxv,"['corporation nasdaq', 'nasdaq', 'company announced', 'company tsxv', 'board directors', 'products', 'patients', 'laboratories', 'financial results', 'nov prnewswire']","['Abbott Laboratories announces $21 billion deal to buy Cologuard-maker Exact Sciences Abbott Laboratories in Abbott Park on June 25, 2018. (Stacey Wescott/Chicago Tribune/TNS) Abbott Laboratories announced a $21 billion deal Thursday morning to acquire Exact Sciences, the maker of Cologuard — its largest acquisition in a decade. The deal will allow Abbott — which makes medical tests, baby formula and continuous glucose monitors, among other products — to enter the cancer testing space. Exact Sciences focuses on early cancer detection and personalized treatments, and is perhaps best known for making Cologaurd, an at-home colon cancer screening test. Javascript is required for you to be able to read premium content. Please enable it in your browser settings. An initiative by McIntosh County residents to keep herbicide from being sprayed along local roadsides earned recognition this week from the Georgia Water Coalition. Ever since Evan Wallace Ross was a child, she looked up to the older students in her dance classes at Jill Stanford’s Dance Studio. A federal government shutdown affected the Brunswick Golden Isles Airport, but it was not as bad as it could have been, the Glynn County Airport Commission heard on Tuesday. The victims weren’t real, but the situation and', 'Devonian Health Group Inc. Reports Financial and Operating Results of its Three and Six Months Ended January 31, 2026 (all amounts are in Canadian dollars) QUÉBEC, March 25, 2026 /PRNewswire/ - Devonian Health Group Inc. (""Devonian"" or the ""Company"") (TSXV: GSD) (OTCQB: DVHGF), a clinical-stage biopharmaceutical company focused on developing innovative therapies targeting fibro-inflammatory diseases, today highlighted its financial and operating results for the three and six months ended January 31, 2026. \'\'We are pleased with the continued momentum to execute on our priorities and readiness to advance our pipeline\'\', said Dr. André P. Boulet, PhD, Chief Executive Officer and president of Devonian. Corporate Highlights Board Appointment and CFO On November 26, 2025, the Company announced the appointment of Mr. Pierre Labbé, CPA as Board Director. Mr. Labbé was appointed Chair of the Audit Committee effective February 2, 2026. On February 2, 2026, the Company announced the appointment of Mr. Dennis Turpin, CPA as Chief Financial Officer. Mr. Turpin remains on the Board of directors. He succeeded Ms. Viktoria Krasteva. Strategic Update Following the expiry of the Altius Healthcare LP (""Altius"") distribution agreements, the Company is transitioning toward a focused biopharmaceutical development strat', 'Devonian Health Group Inc. Reports Financial and Operating Results of its Three and Six Months Ended January 31, 2026 (all amounts are in Canadian dollars) QUÉBEC, March 25, 2026 /CNW/ - Devonian Health Group Inc. (""Devonian"" or the ""Company"") (TSXV: GSD) (OTCQB: DVHGF), a clinical-stage biopharmaceutical company focused on developing innovative therapies targeting fibro-inflammatory diseases, today highlighted its financial and operating results for the three and six months ended January 31, 2026. \'\'We are pleased with the continued momentum to execute on our priorities and readiness to advance our pipeline\'\', said Dr. André P. Boulet, PhD, Chief Executive Officer and president of Devonian. Corporate Highlights Board Appointment and CFO On November 26, 2025, the Company announced the appointment of Mr. Pierre Labbé, CPA as Board Director. Mr. Labbé was appointed Chair of the Audit Committee effective February 2, 2026. On February 2, 2026, the Company announced the appointment of Mr. Dennis Turpin, CPA as Chief Financial Officer. Mr. Turpin remains on the Board of directors. He succeeded Ms. Viktoria Krasteva. Strategic Update Following the expiry of the Altius Healthcare LP (""Altius"") distribution agreements, the Company is transitioning toward a focused biopharmaceutical development strategy cen']"
30,19,30_prince harry_king charles_queen elizabeth_duchess,"['prince harry', 'king charles', 'queen elizabeth', 'duchess', 'royal', 'prince', 'meghan markle', 'queen', 'king', 'william']","[""Real reason Andrew's Royal Lodge eviction announcement took so long Andrew hit an all-time royal low last week as it was announced he was to be stripped of all his royal titles and evicted from his 30-room Royal Lodge home. Buckingham Palace made the announcement on Thursday after weeks of Andrew dominating the headlines as a result of scandals involving his past friendship with the late convicted paedophile Jeffrey Epstein. While Andrew has always denied all accusations against him, the King’s brother was aware of how he was being a distraction to the monarchy, and on October 17 said he would no longer use his royal titles. However, King Charles took this a step further by formally removing them from him - a move that many did not see coming. While the King’s actions have been praised, some believe the monarch, 76, took too long to take action, especially over evicting the former prince from his Crown Estate mansion, however Queen Elizabeth's former press secretary Ailsa Anderson has now explained why. READ MORE: Donald Trump breaks silence on Royal Family stripping Andrew of titles READ MORE: Meghan Markle 'wants to be a billionaire' but it won't be from jam Our community members are treated to special offers, promotions, and adverts from us and"", '\'Harry and Andrew should both be removed from line of succession in royal shake-up\' Former BBC royal correspondent Jennie Bond has shared that she believes Prince Harry and Andrew Mountbatten-Windsor should both face the same fate when it comes to their positions in the line of succession. Harry, who is the King\'s second-born son, stepped down from royal duties in 2020 and has since relocated to the US. The 41-year-old, who lives in California with Meghan Markle and their children, is still fifth in line to the throne, following Prince William and his three children - Prince George, Princess Charlotte and Prince Louis. Disgraced Andrew, who was stripped of his royal titles last year over his connection to the late sex offender Jeffrey Epstein, is still eighth in line to the throne. Andrew\'s position follows Harry and Meghan\'s children, six-year-old Prince Archie and four-year-old Princess Lilibet, who are sixth and seventh in line. Read more: Fans share verdict on whether Meghan and Harry should do more \'royal tours\' Read more: Meghan Markle embarrassed live on SNL with savage Andrew comparison Speaking of Andrew\'s fate, Ms Bond told The Mirror: ""Of course Andrew should be removed from the line of succession. If you are not fit to be a prince, you’re certainly not', ""Prince Harry spotted for second time on holiday without Meghan Markle Prince Harry has been spotted for a second time this week on his holiday without his wife, Meghan Markle. On Wednesday, the Duke of Sussex was spotted taking part in the St. Regis World Snow Polo Championship in Aspen, Colorado, just hours after he was spotted skiing with close friend Nacho Figueras. The Prince, 41, reportedly was taking part in the polo tournament to stand in for a friend who couldn’t make it. He is believed to have been on the Aspen Valley team. Harry would have most likely been delighted to take part in the event, having played polo for a number of years. READ MORE: Meghan Markle breaks silence after Prince Harry spotted alone on holiday READ MORE: Princess Kate sends coded message at Royal Family Christmas lunch We use your sign-up to provide content in ways you've consented to and to improve our understanding of you. This may include adverts from us and 3rd parties based on our understanding. You can unsubscribe at any time. Read our Privacy Policy The sighting of the prince on the polo field came not long after the duke was spotted skiing at a resort with some male friends. A source told Hello magazine that the duke seemed to be enjoying himself in the mounta""]"
31,18,31_tariffs_tariff_international trade_president donald,"['tariffs', 'tariff', 'international trade', 'president donald', 'supreme court', 'pence', 'trump', 'impose', 'ruling', 'reforms']","[""Groups ask trade court to pause Trump's new tariffs amid legal fight (The Center Square) – Several groups joined together to ask a Manhattan trade court to pause President Donald Trump's latest wave of tariffs as states and small businesses move ahead with legal challenges. A coalition of advocacy groups is urging the U.S. Court of International Trade to halt President Donald Trump's newly imposed tariffs, calling the measures both unprecedented and potentially unconstitutional. Their legal challenge follows the president's imposition of a 10% tariff on all imports under a rarely used provision, Section 122 of the Trade Act of 1974, just hours after the Supreme Court struck down his previous tariffs. Critics warn that allowing the continued collection of these tariffs could cause significant financial hardship for importers and ignite new debates over the scope of executive power. Trump invoked Section 122 of the Trade Act of 1974 to impose a 10% tariff on all imports, acting swiftly after the U.S. Supreme Court struck down his earlier tariffs under a different statute. Because Section 122 has never been applied in this context, its constitutionality and legal boundaries remain untested in court. Groups, including former Vice President Mike Pence's"", ""Groups ask trade court to pause Trump's new tariffs amid legal fight (The Center Square) – Several groups joined together to ask a Manhattan trade court to pause President Donald Trump's latest wave of tariffs as states and small businesses move ahead with legal challenges. A coalition of advocacy groups is urging the U.S. Court of International Trade to halt President Donald Trump's newly imposed tariffs, calling the measures both unprecedented and potentially unconstitutional. Their legal challenge follows the president's imposition of a 10% tariff on all imports under a rarely used provision, Section 122 of the Trade Act of 1974, just hours after the Supreme Court struck down his previous tariffs. Critics warn that allowing the continued collection of these tariffs could cause significant financial hardship for importers and ignite new debates over the scope of executive power. Trump invoked Section 122 of the Trade Act of 1974 to impose a 10% tariff on all imports, acting swiftly after the U.S. Supreme Court struck down his earlier tariffs under a different statute. Because Section 122 has never been applied in this context, its constitutionality and legal boundaries remain untested in court. Groups, including former Vice President Mike Pence's"", ""Groups ask trade court to pause Trump's new tariffs amid legal fight (The Center Square) – Several groups joined together to ask a Manhattan trade court to pause President Donald Trump's latest wave of tariffs as states and small businesses move ahead with legal challenges. A coalition of advocacy groups is urging the U.S. Court of International Trade to halt President Donald Trump's newly imposed tariffs, calling the measures both unprecedented and potentially unconstitutional. Their legal challenge follows the president's imposition of a 10% tariff on all imports under a rarely used provision, Section 122 of the Trade Act of 1974, just hours after the Supreme Court struck down his previous tariffs. Critics warn that allowing the continued collection of these tariffs could cause significant financial hardship for importers and ignite new debates over the scope of executive power. Trump invoked Section 122 of the Trade Act of 1974 to impose a 10% tariff on all imports, acting swiftly after the U.S. Supreme Court struck down his earlier tariffs under a different statute. Because Section 122 has never been applied in this context, its constitutionality and legal boundaries remain untested in court. Groups, including former Vice President Mike Pence's""]"
32,18,32_media platforms_meta platforms_addiction_subscription,"['media platforms', 'meta platforms', 'addiction', 'subscription', 'influencers', 'meta', 'google', 'social', 'accounts', 'advertising']","[""NHK moves to crack down on free riders NHK is cracking down on households with TVs that have failed to pay subscription fees in order to prevent free riders from using its services, by limiting who can access its news website as well as setting up a new team in charge of enforcement. The public broadcaster last week began requiring users to enter their NHK subscription information to use NHK One, its online news website that was newly launched in October to replace its news site. The move is part of an effort to reduce the number of users who are watching NHK channels and accessing news on its website without paying its mandatory subscription fee. In a time of both misinformation and too much information, quality journalism is more crucial than ever.By subscribing, you can help us get the story right. With your current subscription plan you can comment on stories. However, before writing your first comment, please create a display name in the Profile section of your subscriber account page. Your subscription plan doesn't allow commenting. To learn more see our FAQ Sponsored contents planned and edited by JT Media Enterprise Division. 広告出稿に関するおといあわせはこちらまで Read more"", ""Google, Meta, push back on addiction claims in landmark social media trial The TikTok app logo is shown on an iPhone on Friday, January 17, 2025, in Houston. LOS ANGELES (AP) — Jurors in a landmark social media case that seeks to hold tech companies responsible for harms to children got their first glimpse into what will be a lengthy trial characterized by dueling narratives from the plaintiffs and the two remaining defendants, Meta and YouTube. At the core of the Los Angeles case is a 20-year-old identified only by the initials “KGM,” whose case could determine how thousands of similar lawsuits will play out. KGM and the cases of two other plaintiffs have been selected to be bellwether trials — essentially test cases for both sides to see how their arguments play out before a jury. Comparing social media platforms to casinos and addictive drugs, lawyer Mark Lanier delivered opening statements Monday in the Los Angeles Superior Court trial that seeks to hold Instagram owner Meta and Google's YouTube responsible for addictive features and harms to children who use their products. Two other defendants, TikTok and Snap, have settled the case. Meta lawyer Paul Schmidt spoke of the disagreement within the scientific community over social media addiction, with"", 'Instagram chief rejects idea of social media addiction The head of Meta\'s Instagram has testified during a landmark social media trial in Los Angeles that he disagrees with the idea that people can be clinically addicted to social media platforms. The question of addiction is a key pillar of the case, where plaintiffs seek to hold social media companies responsible for harms to children who use their platforms. Meta Platforms and Google\'s YouTube are the two remaining defendants in the case, which TikTok and Snap have settled. At the core of the Los Angeles case is a 20-year-old identified only by the initials ""KGM"", whose lawsuit could determine how thousands of similar lawsuits against social media companies would play out. She and two other plaintiffs have been selected for bellwether trials - essentially test cases for both sides to see how their arguments play out before a jury. Sign-up to our weekly newsletter for free Adam Mosseri, who has headed Instagram since 2018, said it was important to differentiate between clinical addiction and what he called problematic use. The plaintiff\'s lawyer, however, presented quotes directly from Mosseri in a podcast interview a few years ago where he used the term addiction in relation to soci']"
33,18,33_trump administration_white house_president donald_trump,"['trump administration', 'white house', 'president donald', 'trump', 'president', 'trump national', 'national security', 'president jd', 'correspondents', 'bin salman']","['2 National Guard members shot near White House \'critically wounded\' Two National Guard members who were shot near the White House on Wednesday lost their lives, the governor of West Virginia said. Governor Patrick Morrisey confirmed their deaths in a social media post. ""We are in ongoing contact with federal officials as the investigation continues,"" he said. A suspect, now in custody, was also shot and has injuries that are not believed to be life-threatening, according to a law enforcement official not authorized to discuss the matter publicly and who spoke to AP on condition of anonymity. One National Guard member was shot in the head, according to a person familiar with the details of the incident who spoke to AP on condition of anonymity. ""The president has been briefed,"" White House spokeswoman Karoline Leavitt said. Trump is at his resort in Palm Beach ahead of the Thanksgiving holiday on Thursday. U.S. Vice President JD Vance is in Kentucky. Trump said two National Guardsmen were ""critically wounded,"" and that the shooter was also severely injured. ""The animal that shot the two National Guardsmen, with both being critically wounded, and now in two separate hospitals, is also severely wounded, but regardless, will pay a very steep price,"" Tr', '2 National Guard members shot near White House Two National Guard members who were shot near the White House on Wednesday lost their lives, the governor of West Virginia said. Governor Patrick Morrisey confirmed their deaths in a social media post. ""We are in ongoing contact with federal officials as the investigation continues,"" he said. A suspect, now in custody, was also shot and has injuries that are not believed to be life-threatening, according to a law enforcement official not authorized to discuss the matter publicly and who spoke to AP on condition of anonymity. One National Guard member was shot in the head, according to a person familiar with the details of the incident who spoke to AP on condition of anonymity. ""The president has been briefed,"" White House spokeswoman Karoline Leavitt said. Trump is at his resort in Palm Beach ahead of the Thanksgiving holiday on Thursday. U.S. Vice President JD Vance is in Kentucky. Trump said two National Guardsmen were ""critically wounded,"" and that the shooter was also severely injured. ""The animal that shot the two National Guardsmen, with both being critically wounded, and now in two separate hospitals, is also severely wounded, but regardless, will pay a very steep price,"" Tr', '2 National Guard members shot to death near White House Two National Guard members who were shot near the White House on Wednesday lost their lives, the governor of West Virginia said. Governor Patrick Morrisey confirmed their deaths in a social media post. ""We are in ongoing contact with federal officials as the investigation continues,"" he said. A suspect, now in custody, was also shot and has injuries that are not believed to be life-threatening, according to a law enforcement official not authorized to discuss the matter publicly and who spoke to AP on condition of anonymity. One National Guard member was shot in the head, according to a person familiar with the details of the incident who spoke to AP on condition of anonymity. ""The president has been briefed,"" White House spokeswoman Karoline Leavitt said. Trump is at his resort in Palm Beach ahead of the Thanksgiving holiday on Thursday. U.S. Vice President JD Vance is in Kentucky. Trump said two National Guardsmen were ""critically wounded,"" and that the shooter was also severely injured. ""The animal that shot the two National Guardsmen, with both being critically wounded, and now in two separate hospitals, is also severely wounded, but regardless, will pay a very steep price,"" Tr']"
34,17,34_hezbollah_israel military_lebanon_gaza,"['hezbollah', 'israel military', 'lebanon', 'gaza', 'hamas', 'beirut', 'ceasefire', 'israel', 'netanyahu', 'iran']","['Scores killed as Israel strikes central Beirut after saying Iran ceasefire doesn\'t apply there An emergency responder works at the site of an Israeli strike in Beirut, Lebanon, Wednesday. BEIRUT (AP) — Israeli strikes hit several dense commercial and residential areas in central Beirut without warning on Wednesday afternoon, hours after a ceasefire was announced in the U.S.-Israeli war with Iran. Lebanon\'s health ministry said at least 89 people were killed and 700 were wounded. U.S. President Donald Trump told PBS News Hour that Lebanon was not included in the deal because of the Lebanese militant Hezbollah group. When asked about Israel\'s latest strikes, he said, ""That\'s a separate skirmish."" Israel had said the agreement does not extend to its war with the Iran-backed Hezbollah, although mediator Pakistan said it does. The fleeting sense of relief among Lebanese after the ceasefire announcement turned into panic with what Israel\'s military called its largest coordinated strike in the current war, hitting more than 100 Hezbollah targets within 10 minutes in Beirut, southern Lebanon and the eastern Bekaa Valley. A barrage of strikes was seen across Beirut on Wednesday after Israel vowed to continue attacking Lebanon despite a ceasefire with Iran. Black smoke billowed across', 'Who Is Ali Tabatabai, Hezbollah Deputy Chief That Israel Killed In Beirut Strike? Israel carried out one of its most aggressive strikes inside Beirut in years, killing Hezbollah’s deputy chief and top military commander, Ali Tabatabai. The operation, conducted deep inside the Lebanese capital, was the first major Israeli strike since the November 2024 ceasefire and the first time the Israeli Air Force targeted a senior Hezbollah figure since the ceasefire. It was the fifth Israeli strike on Beirut’s southern suburbs since a ceasefire agreed in November 2024 after a year of conflict, and comes a week before Pope Leo XIV is scheduled to visit Lebanon. In the past, Israel had regularly targeted mid-level Hezbollah operatives in southern Lebanon, especially those accused of attempting to rebuild rocket-launch sites or infiltrate the border region. Ali Tabatabai was born to an Iranian father and a Lebanese mother. According to Haaretz, he was not among Hezbollah’s founders but belonged to its “second generation"". He was deployed in Syria and Yemen to support allied forces in both conflict zones. Israel’s military said Tabatabai joined Hezbollah in the 1980s and went on to hold several senior roles, including in the Radwan Force, the group’s elite combat unit. The US', 'Israeli strikes kill ten in Lebanon despite ceasefire BEIRUT -- Israeli airstrikes on southern Lebanon Friday killed 10 people, including six paramedics and a Syrian girl, Lebanon\'s Health Ministry said, the latest in near-daily attacks from both sides that have not stopped despite the fragile, U.S.-brokered ceasefire in the Israel-Hezbollah war. The first strike hit the village of Hanouiyeh, killing four paramedics working for Hezbollah\'s Islamic Health Association and wounding two others including one paramedic, the ministry said. Another strike Friday morning on the village of Deir Qanoun al Nahr in the coastal Tyre province killed six people, including a Syrian child and two paramedics from the Al-Risala Scouts Association, a paramedic group affiliated with Hezbollah\'s ally, the Amal movement, the ministry said. An additional six people were injured, including three paramedics and a Syrian woman. The Health Ministry said the two attacks ""violated"" international law. On Thursday, the World Health Organization reported 169 confirmed attacks on healthcare workers and facilities in Lebanon, resulting in 116 deaths since the latest Israel-Hezbollah war began. The Israeli military said it struck several Hezbollah infrastructure sites in']"
