Topic,Count,Name,Representation,Representative_Docs
47,12,47_brisbane_queensland_melbourne_teachers,"['brisbane', 'queensland', 'melbourne', 'teachers', 'victoria', 'working week', 'legislation', 'australia', 'expenses', 'taxpayers']","['‘We’re in it for the fight’: State school teachers rally outside Parliament Add articles to your saved list and come back to them any time. Peter Haffenden is standing with hundreds of fellow state school teachers outside Parliament House, in inner-Brisbane, shortly after 4.30pm on Thursday. The humanities teacher says he frequently spends weekends, holidays, and nights marking work, preparing lessons, and planning curriculum. “I’ve been teaching 35 years and the workload’s probably gone up by a factor of five … I never get a chance to really spend time with my family because I’m working at home so much,” Haffenden said. Teachers Andrew Weber (left) and Peter Haffenden (right) said workloads had increased over the more than three decades both men had been teachers.Credit: Catherine Strohfeldt Fellow Brisbane region teacher Andrew Weber estimated a normal working week demanded about 45 to 50 hours’ work, but said during marking periods the hours spent on teaching tasks skyrocketed. “It’s obviously weekends, it’s obviously nights, it’s holidays … for instance, I’ve got to do probably 10 to 12 hours of drafts this weekend,” he said. Thursday’s rally was a warm-up for Queensland Teachers’ Union (QTU) members, who are planning to strike before the end of the sc', 'The FIFO CEO: Rail Loop boss commutes from Queensland Add articles to your saved list and come back to them any time. The $900,000-a-year executive responsible for Melbourne’s most expensive infrastructure project commutes from Brisbane and is paid additional expenses to attend unscheduled meetings. Freedom of information documents released to The Age reveal the extraordinary arrangements to enable Suburban Rail Loop Authority chief executive Frankie Carroll to maintain a residence in Brisbane, fly in and out of his Big Build job, and bill taxpayers for flight costs when he is “recalled to duty”. Suburban Rail Loop Authority chief executive Frankie Carroll. This is an employment term used when staff are asked to work or return to the office outside their regular work hours. Carroll, who is on a remuneration package of between $900,000 and $909,999, has led the Allan government’s signature infrastructure project since 2021. This includes superannuation and accrued leave and other entitlements. While Carroll meets the cost of his regular commute himself, the documents show that taxpayers were charged when Carroll flew to Melbourne, where the rail loop authority is headquartered, to attend a conference. In another example of travel costs', 'The FIFO CEO: Rail Loop boss commutes from Queensland Add articles to your saved list and come back to them any time. The $900,000-a-year executive responsible for Melbourne’s most expensive infrastructure project commutes from Brisbane and is paid additional expenses to attend unscheduled meetings. Freedom of information documents released to The Age reveal the extraordinary arrangements to enable Suburban Rail Loop Authority chief executive Frankie Carroll to maintain a residence in Brisbane, fly in and out of his Big Build job, and bill taxpayers for flight costs when he is “recalled to duty”. Suburban Rail Loop Authority chief executive Frankie Carroll. This is an employment term used when staff are asked to work or return to the office outside their regular work hours. Carroll, who is on a remuneration package of between $900,000 and $909,999, has led the Allan government’s signature infrastructure project since 2021. This includes superannuation and accrued leave and other entitlements. While Carroll meets the cost of his regular commute himself, the documents show that taxpayers were charged when Carroll flew to Melbourne, where the rail loop authority is headquartered, to attend a conference. In another example of travel costs']"
48,11,48_larson_racing_newman_track,"['larson', 'racing', 'newman', 'track', 'qualifying', 'kyle', 'toyota', 'fast', 'richmond', 'tie']","[""Denny Hamlin qualifies first at Martinsville, moves into tie for 10th in NASCAR poles MARTINSVILLE, Va. — Denny Hamlin earned his fifth pole position at Martinsville Speedway and 49th of his Cup Series career, tying him with NASCAR Hall of Famer Bobby Isaac for 10th all time. The Joe Gibbs Racing star turned a 98.241-mph lap Saturday in the No. 11 Toyota to beat William Byron, whose No. 24 Chevrolet qualified second at 97.957 mph for Sunday’s 400-lap race. With his win two weeks ago at Las Vegas Motor Speedway, Hamlin, 45, broke a tie with Kevin Harvick for 10th on the all-time win list in NASCAR's premier series. He is two poles away from tying the career total of Ryan Newman, one of the greatest qualifiers in NASCAR history. “It’s pretty awesome,” said Hamlin, who grew up a few hours east of Martinsville in the Richmond, Virginia, suburb of Chesterfield. “Really with age, the hardest part is still having the fast time. It’s one thing to be able to manage races and use your experience to your advantage. But usually the first thing to go is your all-out speed, and we’re still knocking off poles, which is really good. I was around when Newman was just unstoppable in qualifying. So damn, I didn’t know he had that many.” Hamlin has six wins at Martinsville, and his vic"", ""Denny Hamlin qualifies first at Martinsville, moves into tie for 10th in NASCAR poles MARTINSVILLE, Va. — Denny Hamlin earned his fifth pole position at Martinsville Speedway and 49th of his Cup Series career, tying him with NASCAR Hall of Famer Bobby Isaac for 10th all time. The Joe Gibbs Racing star turned a 98.241-mph lap Saturday in the No. 11 Toyota to beat William Byron, whose No. 24 Chevrolet qualified second at 97.957 mph for Sunday’s 400-lap race. With his win two weeks ago at Las Vegas Motor Speedway, Hamlin, 45, broke a tie with Kevin Harvick for 10th on the all-time win list in NASCAR's premier series. He is two poles away from tying the career total of Ryan Newman, one of the greatest qualifiers in NASCAR history. “It’s pretty awesome,” said Hamlin, who grew up a few hours east of Martinsville in the Richmond, Virginia, suburb of Chesterfield. “Really with age, the hardest part is still having the fast time. It’s one thing to be able to manage races and use your experience to your advantage. But usually the first thing to go is your all-out speed, and we’re still knocking off poles, which is really good. I was around when Newman was just unstoppable in qualifying. So damn, I didn’t know he had that many.” Hamlin has six wins at Martinsville, and his vic"", ""Denny Hamlin qualifies first at Martinsville, moves into tie for 10th in NASCAR poles MARTINSVILLE, Va. — Denny Hamlin earned his fifth pole position at Martinsville Speedway and 49th of his Cup Series career, tying him with NASCAR Hall of Famer Bobby Isaac for 10th all time. The Joe Gibbs Racing star turned a 98.241-mph lap Saturday in the No. 11 Toyota to beat William Byron, whose No. 24 Chevrolet qualified second at 97.957 mph for Sunday’s 400-lap race. With his win two weeks ago at Las Vegas Motor Speedway, Hamlin, 45, broke a tie with Kevin Harvick for 10th on the all-time win list in NASCAR's premier series. He is two poles away from tying the career total of Ryan Newman, one of the greatest qualifiers in NASCAR history. “It’s pretty awesome,” said Hamlin, who grew up a few hours east of Martinsville in the Richmond, Virginia, suburb of Chesterfield. “Really with age, the hardest part is still having the fast time. It’s one thing to be able to manage races and use your experience to your advantage. But usually the first thing to go is your all-out speed, and we’re still knocking off poles, which is really good. I was around when Newman was just unstoppable in qualifying. So damn, I didn’t know he had that many.” Hamlin has six wins at Martinsville, and his vic""]"
49,10,49_santa_christmas_holiday season_christmas eve,"['santa', 'christmas', 'holiday season', 'christmas eve', 'festive', 'presents', 'festival', 'send letters', 'traditions', 'children need']","['Santa Claus is coming to Grafton: VFW Post 3081 Auxiliary hosts Breakfast with Santa Families will be welcome to breakfast with Santa on Saturday, Dec. 6, from 9-11 a.m., at the VFW Post 3081 Post Home, located at 225 West Main St., Grafton. Reservations are not needed to take part in this cherished holiday tradition. GRAFTON, W.Va. — Christmas is fast approaching, and Santa Claus is taking a break from holiday preparations at the North Pole to visit Grafton for a special breakfast. The Veterans of Foreign Wars (VFW) Post 3081 Auxiliary has announced it will be hosting this festive event for the area’s children, giving them a chance to meet Santa. “This cherished holiday tradition is all about spreading Christmas joy and giving kids a chance to share their wishes with Santa,” said VFW member Amanda Bise. “Enjoy a hearty breakfast in a festive atmosphere while soaking in the spirit of the season.” Bise On Saturday, December 6, families are invited to the post home, located at 225 West Main Street in Grafton, for a delicious breakfast designed to create magical memories. The breakfast will be held from 9 to 11 a.m. The cost for the breakfast is just $5 per adult, and children will eat for free. “Bring your little ones to meet Santa Claus before he heads back to the N', 'Want an ‘ezbacke uvin’ or ‘mot cantrl’ for Christmas? Write to Santa The time has come again for both the young and old to send in their letters to Santa. This has become one of my favorite Christmas traditions. The letters to Santa we publish each December are often heartwarming and occasionally heartbreaking. They are a reminder of what makes Christmas magical. They are an amusing break from the sometimes jarring news we must print in the paper. And, hey, they might even be beneficial to your brain’s elasticity. It takes some creativity on the reader’s part to figure out just what the little kiddies are asking for, since we publish the letters verbatim. Try to decipher these phrases from previous Santa letters: I’m looking forward to the, umm, creative writing in this year’s batch of letters. We will publish Santa letters from children and adults in north central Idaho and southeastern Washington. The letters can be just a few words if you have a short wish list, but please try to write no more than 300 words. Be sure to include the author’s name, age and town of residence. The letters can be emailed to city@lmtribune.com, sent in the mail to Letters to Santa, Lewiston Tribune, 505 Capital St., Lewiston, ID 83501, or dropped off at our office. The', 'Want an ‘ezbacke uvin’ or ‘mot cantrl’ for Christmas? Write to Santa The time has come again for both the young and old to send in their letters to Santa. This has become one of my favorite Christmas traditions. The letters to Santa we publish each December are often heartwarming and occasionally heartbreaking. They are a reminder of what makes Christmas magical. They are an amusing break from the sometimes jarring news we must print in the paper. And, hey, they might even be beneficial to your brain’s elasticity. It takes some creativity on the reader’s part to figure out just what the little kiddies are asking for, since we publish the letters verbatim. Try to decipher these phrases from previous Santa letters: I’m looking forward to the, umm, creative writing in this year’s batch of letters. We will publish Santa letters from children and adults in north central Idaho and southeastern Washington. The letters can be just a few words if you have a short wish list, but please try to write no more than 300 words. Be sure to include the author’s name, age and town of residence. The letters can be emailed to city@lmtribune.com, sent in the mail to Letters to Santa, Lewiston Tribune, 505 Capital St., Lewiston, ID 83501, or dropped off at our office. The']"
50,10,50_traffic congestion_car park_police_buildings,"['traffic congestion', 'car park', 'police', 'buildings', 'birmingham', 'city', 'protesters', 'emergency management', 'motorists', 'rise buildings']","['Horns blaring in fury as shoppers become trapped in Trafford Centre car park \'hell\' Video footage showed horns blaring in fury as shoppers became trapped in car parks at Trafford Centre on Monday (December 29). Motorists were stuck in \'gridlocked\' queues at a number of car parks around the popular shopping centre throughout the afternoon and into the evening. Visitors headed to the huge shopping outlet for discounted sales following the Christmas period, but quickly took to social media after becoming trapped in their vehicles for a number of hours when trying to leave, with long delays and queues reported to the nearby M60 junction. Pictures shared on social media showed standstill traffic around the perimeter of the Trafford Centre, along Trafford Boulevard and Barton Dock Road, which was preventing shoppers from leaving various car parks. Some claimed they had been waiting for more than two hours. In one post on X, titled: ""Hell at the Trafford Centre"", long lines of cars can be seen waiting to exit the multi-storey car park. There is gridlocked queues with horns heard blaring in frustration from those attempting to leave. One shopper, Katrina Cliffe, was forced to abandon her car and help with traffic management on Monday evening, guiding other motorists away', ""China launches campaign against fire hazards in high-rise buildings Sign up now: Get ST's newsletters delivered to your inbox The inferno – Hong Kong’s worst in decades – sent shock waves through the city. PHOTO: EPA-EFE Published Nov 29, 2025, 04:05 PM Updated Nov 29, 2025, 05:56 PM Beijing – China announced on Nov 29 a sweeping inspection of fire-safety standards in high-rise buildings nationwide after a deadly fire in Hong Kong left at least 128 people dead. left at least 128 people dead The campaign is meant to prevent any comparable disaster on the mainland. Special attention will be given to buildings undergoing external wall renovations and interior modifications, the Ministry of Emergency Management said in a statement. “We must comprehensively strengthen fire safety management of high-rise buildings to effectively protect people’s lives and property,” the ministry said. The State Council Work Safety Committee has issued a notice to the local authorities launching the inspection, it said. The inferno – Hong Kong’s worst in decades – sent shock waves through the financial hub, which has some of the world’s most densely populated and tallest residential blocks. Fire rapidly engulfed seven of eight 32-storey blocks at an apartment complex unde"", 'UK city centre locked down with bars \'closed\' as police seal off area A UK city centre has been locked down with a driver arrested and a pedestrian rushed to hospital after an incident on Sunday evening. Bars and restaurants were closed off in Friar Lane in Nottingham after reports of a serious crash in the city centre. Floods of police and ambulances rushed into the area following the collision, with unnamed pedestrians being taken to the hospital with what are said to be serious injuries. The section of the city centre is a hotspot in the evenings; however, after the incident, it was left eerily quiet as many local businesses were forced to close early. Popular local spot Ned\'s Cavern posted on social media to its customers. Read more: Huge incident on major motorway sparks delays ahead of Arsenal vs Man City Read more: Police officer, 27, dies in horror crash as colleague \'critically ill\' Ensure our latest news headlines always appear at the top of your Google Search by making us a Preferred Source. Click here to activate or add us as Preferred Source in your Google search settings. The statement said: ""Unfortunately, due to an ongoing incident on Friar Lane, which has been closed by local police, we are forced to close this evening. We apologise']"
51,10,51_whatsapp_facebook_social platform_privacy,"['whatsapp', 'facebook', 'social platform', 'privacy', 'app', 'conversations', 'messaging', 'chat', 'iphone', 'new features']","['Not just polls, you may soon see interactive quizzes on WhatsApp Channels: Details WhatsApp has launched several new features this year, whether it be to make the app more secure or more fun to use. As the year is about to end, the messaging app is preparing to add yet another feature focused on improving interaction within the Channels section. Currently in the beta phase, the feature is expected to be available on both Android and iOS. It will allow channel admins to connect more effectively with their audience by enabling them to share interactive content. While Channels already includes a polls feature, this upcoming quiz feature is designed to be more engaging and knowledge-based, setting it apart from existing options. According to a recent report by WABetaInfo, WhatsApp may soon release a new feature for WhatsApp Channels. As per the report, the feature is currently in the beta stage and is available to beta testers on Android and iOS devices. The rumoured new feature will allow channel admins to create quizzes that followers can take directly within the channel. Much like the polls feature, admins will be able to add a question and provide multiple answer options. Furthermore, they will also have the option to include images with each answer, which can be', 'Paxton sues Meta, WhatsApp over alleged privacy violations – KVIA AUSTIN (KVIA) — Thursday, Texas Attorney General Ken Paxton filed a suit against Meta Platforms Inc. and WhatsApp. Paxton alleged the company misled consumers about privacy protections on the messaging app. WhatsApp is marketed as a “secure” messaging service by using end-to-end encryption. The encryption lets the sender and recipient access messages, but the platform itself can’t. Attorney General Paxton alleges the security claims are inaccurate. He said reports imply WhatsApp employees have been able to access messages. “Texans deserve to know whether their private communications are indeed truly private,” said Attorney General Paxton in a statement. “WhatsApp markets its services as secure and encrypted, but it does not deliver on those promises. I am suing to protect Texans’ privacy and ensure that WhatsApp by Meta does not mislead Texans by unlawfully accessing private conversations and data.” Paxton filed several lawsuits over privacy concerns, including against Netflix. He recently made a settlement with LG. Attorney General Paxton is currently challenging Senator John Coryn in the high stake Republican runoff for the 2026 U.S. Senate. BE PART OF THE CONVERSATION KVIA ABC 7', 'Soon you can share WhatsApp Status only with Close Friends New Delhi: Privacy controls on WhatsApp may soon get more personal. A new Android beta update suggests the company is preparing a feature that lets users choose a Close Friends list for Status updates, giving people tighter control over who sees what. The discovery comes from WABetaInfo, which tracks upcoming WhatsApp features through beta releases. The latest Android beta version 2.26.5.13, now available via the Google Play Beta Program, hints that WhatsApp is actively building this option, though it is not yet available for testing. WhatsApp working on Close Friends list for Status privacy | Image source: WaBetaInfo According to WABetaInfo, WhatsApp is working on a feature that will allow users to select specific contacts as Close Friends for Status sharing. Once available, users will be able to decide whether a Status update goes to everyone, selected contacts, or only to their Close Friends. More accurately, WABetaInfo notes that users will first need to choose who they consider Close Friends. This can be done directly from Status privacy settings or from within the Status interface itself. From what has been spotted so far, users will be able to create and manage their Close F']"
52,10,52_tourism_travel experience_resorts_sri lanka,"['tourism', 'travel experience', 'resorts', 'sri lanka', 'lanka', 'villages', 'pier', 'rica', 'costa rica', 'scenic']","['La Pavona Pier in Costa Rica Hits Key Milestone Ahead of May Delivery Construction of the La Pavona Tourist and Neighborhood Pier moves forward on the banks of the La Suerte River in Cariari. The project supports river transportation to Tortuguero. The project manager and engineering team report 20 percent completion. They plan to deliver the first phase by the end of May. William Rodríguez, Minister of Tourism, said the pier addresses an urgent need. “The construction of the La Pavona pier is an urgent necessity, both to enhance the experience of tourists visiting the magical destination of Tortuguero and to benefit business owners and residents who rely on waterways for transportation,” he said. The estimated investment for all phases totals 1.2 billion colones, or about $2.54 million. The Municipality of Pococí, the Ministry of Public Works and Transportation, and SINAC take part in the work. JAPDEVA provides funding for the first phase. The Costa Rican Tourism Institute, known as ICT, supports the second phase. Boat operations continue without interruption in the high season. Dozens of tourists board boats each day for Tortuguero. The area ranks as the third most visited conservation area in Costa Rica and serves as a sanctuary for green turtle n', '10 Scenic And Cultural Gems To Visit In Sri Lanka From ancient rock fortresses and sacred temples to misty tea plantations and tropical beaches, Sri Lanka offers a perfect blend of history, nature, and adventure. Explore 10 must-visit destinations including Sigiriya, Ella, Kandy, Mirissa, and Yala National Park for an unforgettable travel experience on this beautiful island nation. Sri Lanka may be a small island nation, but it is full of amazing nature, ancient history, stunning mountains and some of the most beautiful beaches on the globe. From misty tea estates and wildlife safaris to ancient temples and colonial towns, Sri Lanka is a beautiful mix of nature, culture and adventure. Whether you are a history buff, a beach bum or simply want a peaceful getaway, Sri Lanka has something to offer everyone.What’s unique about Sri Lanka is the diversity of its attractions that can be covered within a short travel distance. One moment you could be wandering around ancient ruins, the next, lounging on a tropical beach or seeing leopards in the wild. Here are 10 amazing places to visit in Sri Lanka that you definitely have to check out. Sigiriya is a UNESCO World Heritage Site in Sri Lanka that draws tourists from all over the world. The', 'Villages in Northeast: Explore culture, nature, pottery and mask making ideal for slow travel New Delhi: December is one of the best months to explore the quieter corners of Northeast India, where winter brings clear skies, calm landscapes and a slower pace of life. Many villages across the region stand out for their scenic settings, cultural depth and welcoming communities. These destinations offer a mix of nature experiences, local traditions, wildlife trails, tribal heritage and winter-specific activities. From snow-covered valleys to riverside islands and clean eco-villages, each place tells its own story. Many of these locations also require permits, making planning an important part of the journey. For travellers looking to unwind, learn something new or simply escape crowded cities, these villages offer a refreshing end-of-year getaway. The list below highlights some of the most compelling options to explore in December. Late December turns Lachung and the nearby Yumthang Valley into a snow-filled landscape. The route offers views of frozen rivers and waterfalls, and travellers need a special permit for this region. Key experiences include seasonal flowers, hot springs, Shinba Rhododendron Sanctuary, Lachung Monastery, Zero Point and Mount Katao. The area is ideal fo']"
