Topic,Count,Name,Representation,Representative_Docs
11,18,11_actor_actors_oscar_movies,"['actor', 'actors', 'oscar', 'movies', 'director', 'brendan', 'sequel', 'fraser', 'filmmaker', 'role']","[""AP Entertainment SummaryBrief at 3:08 p.m. EST Brendan Fraser's new horizons include 'Rental Family' and rental hedgehogs BEDFORD, N.Y. (AP) — “Rental Family” is Brendan Fraser’s first leading role since winning the best actor Oscar for “The Whale.” In it, the 56-year-old plays a struggling actor living in Japan who, out of desperation and curiosity, takes a job with an agency that hires out actors to fulfill roles in real people’s lives. In an interview, Fraser discusses his life since the Oscar win, his eye-opening experiences in Japan and what returning to the “Mummy” series means to him. His time in Japan included a visit to a hedgehog cafe. “Rental Family” opens Friday in theaters. Copyright 2025 The Associated Press. All rights reserved. This material may not be published, broadcast, rewritten or redistributed. Log In Keep it Clean. Please avoid obscene, vulgar, lewd, racist or sexually-oriented language. PLEASE TURN OFF YOUR CAPS LOCK. Don't Threaten. Threats of harming another person will not be tolerated. Be Truthful. Don't knowingly lie about anyone or anything. Be Nice. No racism, sexism or any sort of -ism that is degrading to another person. Be Proactive. Use the 'Report' link on each comment to let us know of abus"", ""AP Entertainment SummaryBrief at 3:08 p.m. EST Brendan Fraser's new horizons include 'Rental Family' and rental hedgehogs BEDFORD, N.Y. (AP) — “Rental Family” is Brendan Fraser’s first leading role since winning the best actor Oscar for “The Whale.” In it, the 56-year-old plays a struggling actor living in Japan who, out of desperation and curiosity, takes a job with an agency that hires out actors to fulfill roles in real people’s lives. In an interview, Fraser discusses his life since the Oscar win, his eye-opening experiences in Japan and what returning to the “Mummy” series means to him. His time in Japan included a visit to a hedgehog cafe. “Rental Family” opens Friday in theaters. Movie Review: Joel Edgerton delivers a profound, understated performance in ‘Train Dreams’ Joel Edgerton plays a logger at the beginning of the 20th century in “Train Dreams.” Clint Bentley's film is an adaptation of Denis Johnson's novella, about the toll of progress and the people left behind. Edgerton stars alongside Felicity Jones and William H. Macy in the meditative film. In her review, Associated Press Film Writer Lindsey Bahr praises Edgerton's understated performance and adds that, “Bentley’s film is haunting and patient, a dreamlike jo"", ""AP Entertainment SummaryBrief at 3:08 p.m. EST Brendan Fraser's new horizons include 'Rental Family' and rental hedgehogs BEDFORD, N.Y. (AP) — “Rental Family” is Brendan Fraser’s first leading role since winning the best actor Oscar for “The Whale.” In it, the 56-year-old plays a struggling actor living in Japan who, out of desperation and curiosity, takes a job with an agency that hires out actors to fulfill roles in real people’s lives. In an interview, Fraser discusses his life since the Oscar win, his eye-opening experiences in Japan and what returning to the “Mummy” series means to him. His time in Japan included a visit to a hedgehog cafe. “Rental Family” opens Friday in theaters. Movie Review: Joel Edgerton delivers a profound, understated performance in ‘Train Dreams’ Joel Edgerton plays a logger at the beginning of the 20th century in “Train Dreams.” Clint Bentley's film is an adaptation of Denis Johnson's novella, about the toll of progress and the people left behind. Edgerton stars alongside Felicity Jones and William H. Macy in the meditative film. In her review, Associated Press Film Writer Lindsey Bahr praises Edgerton's understated performance and adds that, “Bentley’s film is haunting and patient, a dreamlike jo""]"
12,17,12_surgical_hospital_memorial hospital_patients,"['surgical', 'hospital', 'memorial hospital', 'patients', 'procedures', 'clinical', 'dr', 'md', 'fraser', 'health care']","['VIDEO: $5.5M robotic surgery system arrives at Surrey Memorial Hospital Published 12:10 pm Tuesday, January 27, 2026 By Anna Burns The da Vinci Xi System has been unpacked and calibrated and is being held in a temporary location until its permanent location is finished. Fraser Health said that it expects it to “go-live” later in the spring. (Fraser Health/ Contributed to Surrey Now-Leader) Health care workers pose in front of the da Vinci Xi System. (Fraser Health/ Contributed to Surrey Now-Leader) Surrey Memorial Hospital is one step closer to providing robotic-assisted surgery with the arrival of the da Vinci Xi Robotic Surgery system. It is expected to be used in surgeries in the spring. “With the aid of the da Vinci Xi system, we can expand minimally invasive thoracic and foregut surgery, and we can do operations with greater precision and accuracy,” says Dr Ahmad Ashrafi, regional division head and chief of thoracic surgery for Fraser Health. “Patients may experience quicker recovery times, and we can carry out more complex procedures right here in Surrey, using minimally invasive techniques. This advanced technology will also help us attract and retain top surgical talent at Surrey Memorial Hospital.” Construction is underway on an operating room', 'VIDEO: $5.5M robotic surgery system arrives at Surrey Memorial Hospital Published 12:10 pm Tuesday, January 27, 2026 By Anna Burns The da Vinci Xi System has been unpacked and calibrated and is being held in a temporary location until its permanent location is finished. Fraser Health said that it expects it to “go-live” later in the spring. (Fraser Health/ Contributed to Surrey Now-Leader) Health care workers pose in front of the da Vinci Xi System. (Fraser Health/ Contributed to Surrey Now-Leader) Surrey Memorial Hospital is one step closer to providing robotic-assisted surgery with the arrival of the da Vinci Xi Robotic Surgery system. It is expected to be used in surgeries in the spring. “With the aid of the da Vinci Xi system, we can expand minimally invasive thoracic and foregut surgery, and we can do operations with greater precision and accuracy,” says Dr Ahmad Ashrafi, regional division head and chief of thoracic surgery for Fraser Health. “Patients may experience quicker recovery times, and we can carry out more complex procedures right here in Surrey, using minimally invasive techniques. This advanced technology will also help us attract and retain top surgical talent at Surrey Memorial Hospital.” Construction is underway on an operating room', 'VIDEO: $5.5M robotic surgery system arrives at Surrey Memorial Hospital Published 12:10 pm Tuesday, January 27, 2026 By Anna Burns The da Vinci Xi System has been unpacked and calibrated and is being held in a temporary location until its permanent location is finished. Fraser Health said that it expects it to “go-live” later in the spring. (Fraser Health/ Contributed to Surrey Now-Leader) Health care workers pose in front of the da Vinci Xi System. (Fraser Health/ Contributed to Surrey Now-Leader) Surrey Memorial Hospital is one step closer to providing robotic-assisted surgery with the arrival of the da Vinci Xi Robotic Surgery system. It is expected to be used in surgeries in the spring. “With the aid of the da Vinci Xi system, we can expand minimally invasive thoracic and foregut surgery, and we can do operations with greater precision and accuracy,” says Dr Ahmad Ashrafi, regional division head and chief of thoracic surgery for Fraser Health. “Patients may experience quicker recovery times, and we can carry out more complex procedures right here in Surrey, using minimally invasive techniques. This advanced technology will also help us attract and retain top surgical talent at Surrey Memorial Hospital.” Construction is underway on an operating room']"
13,16,13_betting_casino_games_platform,"['betting', 'casino', 'games', 'platform', 'nhl', 'arena', 'interactive', 'milestone', 'fantasy', 'amazon']","[""New Online Casinos 2025: Lucky Creek Ranked High For New U.S. Players New players gain fast access to bonuses, smooth payouts, and a broad gaming lineup Lucky Creek offers strong bonuses, steady payouts, and a wide range of games for new players A leading 2025 option for U.S. beginners seeking secure payouts and a large game selection Lucky Creek delivers fast rewards, clear navigation, and a wide mix of games for first-time players Las Vegas, Nov. 15, 2025 (GLOBE NEWSWIRE) -- CasinoTop10 has ranked Lucky Creek Casino as the best online gaming casino for new players, offering them a premium experience from the outset. The casino has solidified its position as the best for beginners, as they kick-start their online gaming journeys through its fast payouts, extensive gaming collection, and 24/7 customer support. Lucky Creek prioritizes player satisfaction at every step, whether you're topping up your account or cashing out after a productive gaming session. New players are greeted with a generous 200% match bonus of up to $7,000, plus 200 free spins over 5 days as a welcome bonus to explore the platform and wager on their favorite games without stretching their budget. The magic does not end there. Lucky Creek continues to celebrate players as they con"", ""AGS Interactive Expands Its UK Presence with bet365 Partnership LAS VEGAS, Dec. 05, 2025 (GLOBE NEWSWIRE) -- AGS Interactive (AGSi) has solidified its presence across the pond, taking a selection of its best-performing games live in the UK with bet365. This announcement further cements AGS’ partnership with bet365 building on existing collaborations in the United States, Canada, and Latin America. bet365’s established UK market position and diverse global presence make them a logical strategic partner to support AGS’ global growth initiatives throughout Europe and beyond. At the time of launch, bet365 players across the UK will have access to more than 20 popular game titles from AGS' interactive content library. Notable titles include: “We’ve worked closely with bet365 for years and extending our partnership to the UK is an important milestone for AGS,” said Zoe Ebling, Vice President of Interactive at AGS. “It not only reflects the strength of our relationship, but the growing global appeal and potential of our increasingly diverse portfolio of high-performing online slot content. This is a clear sign of where AGS is headed — broader reach, more markets, and a rapidly expanding international footprint.” “We’re delighted to welcome a selection"", 'AGS Interactive Expands Its UK Presence with bet365 Partnership LAS VEGAS, Dec. 05, 2025 (GLOBE NEWSWIRE) -- AGS Interactive (AGSi) has solidified its presence across the pond, taking a selection of its best-performing games live in the UK with bet365. This announcement further cements AGS\' partnership with bet365 building on existing collaborations in the United States, Canada, and Latin America. bet365\'s established UK market position and diverse global presence make them a logical strategic partner to support AGS\' global growth initiatives throughout Europe and beyond. At the time of launch, bet365 players across the UK will have access to more than 20 popular game titles from AGS\' interactive content library. Notable titles include: ""We\'ve worked closely with bet365 for years and extending our partnership to the UK is an important milestone for AGS,"" said Zoe Ebling, Vice President of Interactive at AGS. ""It not only reflects the strength of our relationship, but the growing global appeal and potential of our increasingly diverse portfolio of high-performing online slot content. This is a clear sign of where AGS is headed — broader reach, more markets, and a rapidly expanding international footprint."" ""We\'re delighted to welcome a selection']"
14,15,14_museum_egypt_world largest_tourism,"['museum', 'egypt', 'world largest', 'tourism', 'architecture', 'arab', 'ancient', 'governments', 'opening ceremony', 'economy']","[""Egypt unveils the world's largest museum dedicated to a single civilization Egypt is inaugurating on Saturday the Grand Egyptian Museum, two decades in the making, with the aim of drawing more visitors to revitalize the country's tourist industry. Located just outside Cairo on the Giza Plateau which also includes the three pyramids and the Sphinx, the museum will be the world’s largest dedicated to a single civilization. It will display over 50,000 artifacts detailing life in ancient Egypt. World leaders, including monarchs, heads of states and governments, are set to attend the grand opening ceremony, according to the Egyptian presidency which touted the museum as “an exceptional event in the history of human culture and civilization.” The museum is one of the megaprojects championed by President Abdel-Fattah el-Sissi since he took office in 2014. He has embarked on massive investments in infrastructure with the aim of reviving an economy weakened by decades of stagnation and battered by the unrest that followed the 2011 Arab Spring uprising. Preparations for the grand reveal have been shrouded in secrecy. The museum, which was opened for limited visits in recent years, has been closed for the past two weeks. The government has revamped the areas around t"", ""Egypt unveils the world's largest museum dedicated to a single civilization CAIRO (AP) — Egypt is inaugurating on Saturday the Grand Egyptian Museum, two decades in the making, with the aim of drawing more visitors to revitalize the country's tourist industry. Located just outside Cairo on the Giza Plateau which also includes the three pyramids and the Sphinx, the museum will be the world’s largest dedicated to a single civilization. It will display over 50,000 artifacts detailing life in ancient Egypt. World leaders, including monarchs, heads of states and governments, are set to attend the grand opening ceremony, according to the Egyptian presidency which touted the museum as “an exceptional event in the history of human culture and civilization.” The museum is one of the megaprojects championed by President Abdel-Fattah el-Sissi since he took office in 2014. He has embarked on massive investments in infrastructure with the aim of reviving an economy weakened by decades of stagnation and battered by the unrest that followed the 2011 Arab Spring uprising. Preparations for the grand reveal have been shrouded in secrecy. The museum, which was opened for limited visits in recent years, has been closed for the past two weeks. The government has revamped the a"", ""Egypt unveils the world's largest museum dedicated to a single civilization CAIRO (AP) — Egypt is inaugurating on Saturday the Grand Egyptian Museum, two decades in the making, with the aim of drawing more visitors to revitalize the country's tourist industry. Located just outside Cairo on the Giza Plateau which also includes the three pyramids and the Sphinx, the museum will be the world’s largest dedicated to a single civilization. It will display over 50,000 artifacts detailing life in ancient Egypt. World leaders, including monarchs, heads of states and governments, are set to attend the grand opening ceremony, according to the Egyptian presidency which touted the museum as “an exceptional event in the history of human culture and civilization.” The museum is one of the megaprojects championed by President Abdel-Fattah el-Sissi since he took office in 2014. He has embarked on massive investments in infrastructure with the aim of reviving an economy weakened by decades of stagnation and battered by the unrest that followed the 2011 Arab Spring uprising. Preparations for the grand reveal have been shrouded in secrecy. The museum, which was opened for limited visits in recent years, has been closed for the past two weeks. The government has revamped the a""]"
15,15,15_santa_christmas eve_holiday season_christmas,"['santa', 'christmas eve', 'holiday season', 'christmas', 'festive', 'holiday', 'presents', 'festival', 'fireworks', 'traditions']","['Celebrating Christmas in and around Larnaca The city, the suburbs and the villages of Larnaca all get into the festive mood this season as dozens of Christmas events pop up. All around the Larnaca region, markets, workshops and performances will share magical moments for visitors. The SanTa Lefkara Christmas Village is on until January 6 with artists’ stalls, entertainment, craft workshops, children’s activities and concerts taking over the village centre. As one of the deputy ministry of tourism’s eight Christmas Villages, Lefkara is dressed in full holiday glam with glimmering string lights, Christmas trees and a rich, weekly entertainment programme. On December’s first weekend coming up, Larnaca region’s biggest fair returns. The Traditional Christmas Market makes its anticipated annual comeback at Forest Beach, Dekeleia Road, bringing over 200 stalls selling a wide range of food, craft and handmade items from handbags to sweets, candles, baked goods and hundreds of other unique items. The market will include Santa visits, live radio links, hot drinks and food stands. The Livadia Christmas Programme will also bring holiday cheer on December 6, 14, 20 and 28 as the community square fills with music and dance beats, the fam', 'Want an ‘ezbacke uvin’ or ‘mot cantrl’ for Christmas? Write to Santa The time has come again for both the young and old to send in their letters to Santa. This has become one of my favorite Christmas traditions. The letters to Santa we publish each December are often heartwarming and occasionally heartbreaking. They are a reminder of what makes Christmas magical. They are an amusing break from the sometimes jarring news we must print in the paper. And, hey, they might even be beneficial to your brain’s elasticity. It takes some creativity on the reader’s part to figure out just what the little kiddies are asking for, since we publish the letters verbatim. Try to decipher these phrases from previous Santa letters: I’m looking forward to the, umm, creative writing in this year’s batch of letters. We will publish Santa letters from children and adults in north central Idaho and southeastern Washington. The letters can be just a few words if you have a short wish list, but please try to write no more than 300 words. Be sure to include the author’s name, age and town of residence. The letters can be emailed to city@lmtribune.com, sent in the mail to Letters to Santa, Lewiston Tribune, 505 Capital St., Lewiston, ID 83501, or dropped off at our office. The', 'Want an ‘ezbacke uvin’ or ‘mot cantrl’ for Christmas? Write to Santa The time has come again for both the young and old to send in their letters to Santa. This has become one of my favorite Christmas traditions. The letters to Santa we publish each December are often heartwarming and occasionally heartbreaking. They are a reminder of what makes Christmas magical. They are an amusing break from the sometimes jarring news we must print in the paper. And, hey, they might even be beneficial to your brain’s elasticity. It takes some creativity on the reader’s part to figure out just what the little kiddies are asking for, since we publish the letters verbatim. Try to decipher these phrases from previous Santa letters: I’m looking forward to the, umm, creative writing in this year’s batch of letters. We will publish Santa letters from children and adults in north central Idaho and southeastern Washington. The letters can be just a few words if you have a short wish list, but please try to write no more than 300 words. Be sure to include the author’s name, age and town of residence. The letters can be emailed to city@lmtribune.com, sent in the mail to Letters to Santa, Lewiston Tribune, 505 Capital St., Lewiston, ID 83501, or dropped off at our office. The']"
16,15,16_justice department_investigative_jeffrey_president donald,"['justice department', 'investigative', 'jeffrey', 'president donald', 'convicted', 'epstein', 'emails', 'documents', 'public', 'released']","[""Latest Epstein release shows scope of DOJ probes into Epstein, Maxwell The U.S. Justice Department has released tens of thousands more documents related to Jeffrey Epstein, a tranche that included multiple mentions of President Donald Trump but added little new revelatory information. WASHINGTON — The U.S. Justice Department released tens of thousands more documents related to Jeffrey Epstein, a tranche that included multiple mentions of President Donald Trump but added little new revelatory information to the long-anticipated public file on the late financier and convicted sex offender. President Donald Trump speaks Monday at his Mar-a-Lago club in Palm Beach, Fla. A desk and photographs are pictured July 6, 2019, during a search of Jeffrey Epstein's home in New York. An email that was included in the U.S. Department of Justice release of the Jeffrey Epstein files is photographed Monday. Get local news delivered to your inbox! The U.S. Justice Department has released tens of thousands more documents related to Jeffrey Epstein, a tranche that included multiple mention…"", ""Latest Epstein release shows scope of DOJ probes into Epstein, Maxwell The U.S. Justice Department has released tens of thousands more documents related to Jeffrey Epstein, a tranche that included multiple mentions of President Donald Trump but added little new revelatory information. WASHINGTON — The U.S. Justice Department released tens of thousands more documents related to Jeffrey Epstein, a tranche that included multiple mentions of President Donald Trump but added little new revelatory information to the long-anticipated public file on the late financier and convicted sex offender. President Donald Trump speaks Monday at his Mar-a-Lago club in Palm Beach, Fla. A desk and photographs are pictured July 6, 2019, during a search of Jeffrey Epstein's home in New York. An email that was included in the U.S. Department of Justice release of the Jeffrey Epstein files is photographed Monday. Get local news delivered to your inbox! The U.S. Justice Department has released tens of thousands more documents related to Jeffrey Epstein, a tranche that included multiple mention…"", ""Latest Epstein release shows scope of DOJ probes into Epstein, Maxwell The U.S. Justice Department has released tens of thousands more documents related to Jeffrey Epstein, a tranche that included multiple mentions of President Donald Trump but added little new revelatory information. WASHINGTON — The U.S. Justice Department released tens of thousands more documents related to Jeffrey Epstein, a tranche that included multiple mentions of President Donald Trump but added little new revelatory information to the long-anticipated public file on the late financier and convicted sex offender. President Donald Trump speaks Monday at his Mar-a-Lago club in Palm Beach, Fla. A desk and photographs are pictured July 6, 2019, during a search of Jeffrey Epstein's home in New York. An email that was included in the U.S. Department of Justice release of the Jeffrey Epstein files is photographed Monday. Get local news delivered to your inbox! The U.S. Justice Department has released tens of thousands more documents related to Jeffrey Epstein, a tranche that included multiple mention…""]"
