Topic,Count,Name,Representation,Representative_Docs
-1,267,-1_usc_campus_workforce_department,"['usc', 'campus', 'workforce', 'department', 'jobs', 'federal', 'committee', 'academic', 'deficit', 'ceo']","['USC cutting 259 staff members to tackle rising $230 million deficit The University of Southern California began cutting 259 jobs on Friday as it tackles a rising operating deficit of more than $230 million Since July 9, USC has laid off — or is in the process of terminating — 975 people throughout the university system’s nearly 24,600 faculty and staff. That tally doesn’t include 9,185 student workers. The university is “reducing and reorganizing its workforce due to cutbacks in funding and necessary budget reductions,” wrote Melissa Gerdes-Leonard, associate vice president of client services with USC’s human resources department, in an Oct. 27 letter filed with the state’s Employment Development Department. Also see: USC won’t sign Trump compact on federal funding The latest round of layoffs are happening at USC’s University Park, a leafy 229-acre main campus for the institution’s academic schools and residential buildings near Exposition Park in downtown Los Angeles. After the cuts are completed Dec. 31, USC will have shed 616 people on its main campus, or two-thirds of the workforce laid off to date. Some of the positions cut include a marketing director, procurement specialist, research administrator, office managers, library supervisor, event', ""Machado Presents Trump With Her Nobel Peace Prize María Corina Machado, Venezuela’s opposition leader and last year’s Nobel Peace Prize winner, presented her prize to President Donald Trump on Thursday during a meeting in the White House. Trump took to social media several hours later to thank her. Javascript is required for you to be able to read premium content. Please enable it in your browser settings. Log In Keep it Clean. Please avoid obscene, vulgar, lewd, racist or sexually-oriented language. PLEASE TURN OFF YOUR CAPS LOCK. Don't Threaten. Threats of harming another person will not be tolerated. Be Truthful. Don't knowingly lie about anyone or anything. Be Nice. No racism, sexism or any sort of -ism that is degrading to another person. Be Proactive. Use the 'Report' link on each comment to let us know of abusive posts. Share with Us. We'd love to hear eyewitness accounts, the history behind an article. SIERRA VISTA — Sierra Vista Fire & Medical Services reported its busiest year on record in 2025, answering 11,123 emergency calls — a year-over-year increase of 946 compared to 2024. That … Read moreSierra Vista Fire & Medical Logs Record 11,123 Emergency Responses in 2025 María Corina Machado, Venezuela’s opposition leader"", ""T-Mobile adds harsh rule to flexible payment option for customers As a subscriber, you can share up to 3 articles each month with friends for free. Just click “Gift this Article” on this page, then copy the link or enter their email. Gifts are exclusive to subscribers, reset monthly, and each article can be redeemed once. T-Mobile has a new CEO, and the phone carrier is wasting no time in implementing drastic policy changes that impact customers. On Nov. 1, Srini Gopalan officially became CEO of T-Mobile, replacing Mike Sievert, who held the position for over five years. Javascript is required for you to be able to read premium content. Please enable it in your browser settings. Thanks for the feedback. Log In Keep it Clean. Please avoid obscene, vulgar, lewd, racist or sexually-oriented language. PLEASE TURN OFF YOUR CAPS LOCK. Don't Threaten. Threats of harming another person will not be tolerated. Be Truthful. Don't knowingly lie about anyone or anything. Be Nice. No racism, sexism or any sort of -ism that is degrading to another person. Be Proactive. Use the 'Report' link on each comment to let us know of abusive posts. Share with Us. We'd love to hear eyewitness accounts, the history behind an article. Monday, Oct 6, 2025 The Government has""]"
0,331,0_governor_gov_trump administration_government,"['governor', 'gov', 'trump administration', 'government', 'colorado', 'states', 'political', 'russia', 'president', 'republican']","[""Trump administration threatens to withhold $75M from Pennsylvania over immigrant truck drivers The Trump administration threatened Thursday to withhold nearly $75 million in funding if Pennsylvania does not immediately revoke what the administration claims are illegally issued commercial driver’s licenses to immigrants. The move by U.S. Transportation Secretary Sean Duffy to target Pennsylvania follows similar action against California. Both states are run by Democratic governors who have criticized President Donald Trump’s administration and who are viewed as potential top-shelf contenders to be the party’s 2028 presidential nominee. Javascript is required for you to be able to read premium content. Please enable it in your browser settings. Copyright 2025 The Associated Press. All rights reserved. This material may not be published, broadcast, rewritten or redistributed without permission. We're always interested in hearing about news in our community. Let us know what's going on! Sorry, there are no recent results for popular videos. Sorry, there are no recent results for popular commented articles. Success! An email has been sent to with a link to confirm list signup. Error! There was an error processing your request. Friday night's high school football scores delivered"", ""Bulgaria names manager to take over Russia's Lukoil refinery after US sanctions A parliamentary vote authorised the government to seize Lukoil's assets in the country Bulgaria on Friday nominated a senior government official to take control of a major Lukoil refinery in the east of the country following US sanctions against the Russian oil giant. The United States last month hit Russia's two biggest oil producers -- Rosneft and Lukoil -- with sanctions over its war in Ukraine. Javascript is required for you to be able to read premium content. Please enable it in your browser settings. Originally published on doc.afp.com, part of the BLOX Digital Content Exchange. Log In Keep it Clean. Please avoid obscene, vulgar, lewd, racist or sexually-oriented language. PLEASE TURN OFF YOUR CAPS LOCK. Don't Threaten. Threats of harming another person will not be tolerated. Be Truthful. Don't knowingly lie about anyone or anything. Be Nice. No racism, sexism or any sort of -ism that is degrading to another person. Be Proactive. Use the 'Report' link on each comment to let us know of abusive posts. Share with Us. We'd love to hear eyewitness accounts, the history behind an article."", ""Hegseth, Pentagon stand by explanation of second boat strike (The Center Square) – After a story was published last week claiming that Secretary of War Pete Hegseth ordered a second strike on an alleged Venezuelan drug boat to kill those remaining, both Hegseth and the Pentagon reiterated their explanations of the War Department’s actions as completely legal. Pentagon Press Secretary Kingsley Wilson told reporters Tuesday that the U.S. has performed 21 strikes on drug boats in the Western Hemisphere, killing “82 narco-terrorists.” Javascript is required for you to be able to read premium content. Please enable it in your browser settings. Originally published on thecentersquare.com, part of the BLOX Digital Content Exchange. Log In Keep it Clean. Please avoid obscene, vulgar, lewd, racist or sexually-oriented language. PLEASE TURN OFF YOUR CAPS LOCK. Don't Threaten. Threats of harming another person will not be tolerated. Be Truthful. Don't knowingly lie about anyone or anything. Be Nice. No racism, sexism or any sort of -ism that is degrading to another person. Be Proactive. Use the 'Report' link on each comment to let us know of abusive posts. Share with Us. We'd love to hear eyewitness accounts, the history behind an article.""]"
1,153,1_basketball_ncaa_playoff_college football,"['basketball', 'ncaa', 'playoff', 'college football', 'head coach', 'assists', 'sports', 'football', 'espn', 'nfl']","[""Strong first half is enough for Indiana to topple Chicago State Lamar Wilkerson scored a game-high 21 points Saturday and Indiana made 14 of its 15 3-pointers in the first half of a 78-58 nonconference home win over Chicago State in Bloomington. Reed Bailey came off the bench to add 17 points and eight rebounds, while Nick Dorn contributed 15 points on 5-of-11 shooting from the 3-point line. The Hoosiers (9-3) drew assists on all but two of their 26 field goals, with Conor Enright dishing out seven and Wilkerson handing out six. Javascript is required for you to be able to read premium content. Please enable it in your browser settings. Please log in, or sign up for a new, free account to read or post comments. Log In Keep it Clean. Please avoid obscene, vulgar, lewd, racist or sexually-oriented language. PLEASE TURN OFF YOUR CAPS LOCK. Don't Threaten. Threats of harming another person will not be tolerated. Be Truthful. Don't knowingly lie about anyone or anything. Be Nice. No racism, sexism or any sort of -ism that is degrading to another person. Be Proactive. Use the 'Report' link on each comment to let us know of abusive posts. Share with Us. We'd love to hear eyewitness accounts, the history behind an article. Please purchase a subscriptio"", '""The things they\'ve never had since Andrew Bogut"" - Udonis Haslem believes Warriors need a true big man to get back on track As a subscriber, you can share up to 3 articles each month with friends for free. Just click “Gift this Article” on this page, then copy the link or enter their email. Gifts are exclusive to subscribers, reset monthly, and each article can be redeemed once. Different people are pointing at various things as the cause or causes of the Golden State Warriors\' struggles this season. Some say it\'s because they don\'t have a consistent second option behind Steph Curry. Others say it\'s because their young guys have not progressed as expected. While some believe it\'s Steve Kerr\'s coaching. Former Miami Heat captain Udonis Haslem thinks that the Dubs\' issues are rooted in the fact that they did not get what they were supposed to receive last offseason. Javascript is required for you to be able to read premium content. Please enable it in your browser settings. Log In Keep it Clean. Please avoid obscene, vulgar, lewd, racist or sexually-oriented language. PLEASE TURN OFF YOUR CAPS LOCK. Don\'t Threaten. Threats of harming another person will not be tolerated. Be Truthful. Don\'t knowingly lie about anyone or anything. Be Nice. No racism, sexism or any sort of -ism that is degrading to another p', ""Inagawa helps pace Drake in 24-19 win over Butler to stay perfect in Pioneer Football League INDIANAPOLIS (AP) — Logan Inagawa threw for 244 yards and a touchdown and Drake remained unbeaten in the Pioneer Football League by beating Butler 24-19 on Saturday. Drake's Isaiah Bragg returned the opening kickoff 32 yards to the Drake 34. On the first play from scrimmage, Nick Herman took the handoff and ran 66 yards to the end zone for a 7-0 Drake (6-2, 5-0) lead. Javascript is required for you to be able to read premium content. Please enable it in your browser settings. Copyright 2025 The Associated Press. All rights reserved. This material may not be published, broadcast, rewritten or redistributed without permission. Log In Keep it Clean. Please avoid obscene, vulgar, lewd, racist or sexually-oriented language. PLEASE TURN OFF YOUR CAPS LOCK. Don't Threaten. Threats of harming another person will not be tolerated. Be Truthful. Don't knowingly lie about anyone or anything. Be Nice. No racism, sexism or any sort of -ism that is degrading to another person. Be Proactive. Use the 'Report' link on each comment to let us know of abusive posts. Share with Us. We'd love to hear eyewitness accounts, the history behind an article. Sorry, there are no recent results for popular commen""]"
2,145,2_stocks_shares_investors_holdings,"['stocks', 'shares', 'investors', 'holdings', 'investor', 'companies', 'corporation', 'llc', 'firms', 'investment']","['Allworth Financial LP Buys 1,544 Shares of e.l.f. Beauty $ELF Posted by Defense World Staff on Nov 19th, 2025 Allworth Financial LP increased its position in shares of e.l.f. Beauty (NYSE:ELF – Free Report) by 1,642.6% during the 2nd quarter, according to its most recent filing with the Securities and Exchange Commission (SEC). The fund owned 1,638 shares of the company’s stock after acquiring an additional 1,544 shares during the quarter. Allworth Financial LP’s holdings in e.l.f. Beauty were worth $204,000 as of its most recent SEC filing. A number of other institutional investors have also recently bought and sold shares of the company. Champlain Investment Partners LLC raised its holdings in e.l.f. Beauty by 19.7% in the first quarter. Champlain Investment Partners LLC now owns 2,665,026 shares of the company’s stock worth $167,337,000 after purchasing an additional 438,575 shares during the period. Prime Capital Management Co Ltd increased its position in shares of e.l.f. Beauty by 167.8% in the 1st quarter. Prime Capital Management Co Ltd now owns 604,535 shares of the company’s stock valued at $37,959,000 after buying an additional 378,826 shares in the last quarter. Mackenzie Financial Corp raised its stake in e.l.f. Beauty by 68.0% d', 'Adams Wealth Management Has $2.71 Million Stake in Schwab US Broad Market ETF $SCHB Posted by Defense World Staff on Dec 15th, 2025 Adams Wealth Management increased its holdings in shares of Schwab US Broad Market ETF (NYSEARCA:SCHB – Free Report) by 26.5% in the second quarter, according to the company in its most recent Form 13F filing with the Securities and Exchange Commission (SEC). The fund owned 113,506 shares of the company’s stock after buying an additional 23,754 shares during the period. Adams Wealth Management’s holdings in Schwab US Broad Market ETF were worth $2,705,000 at the end of the most recent quarter. A number of other hedge funds and other institutional investors have also recently bought and sold shares of the business. Milestones Private Investment Advisors LLC acquired a new position in shares of Schwab US Broad Market ETF in the 2nd quarter valued at $3,619,000. WT Wealth Management grew its stake in shares of Schwab US Broad Market ETF by 0.3% during the second quarter. WT Wealth Management now owns 1,284,069 shares of the company’s stock worth $30,599,000 after purchasing an additional 3,857 shares during the period. Cambridge Financial Group LLC increased its holdings in Schwab US Broad Market ETF by 43.8% in the second quarter. Cambr', 'AA Financial Advisors LLC Buys 37,001 Shares of FS KKR Capital Corp. $FSK Posted by Defense World Staff on Dec 22nd, 2025 AA Financial Advisors LLC increased its stake in shares of FS KKR Capital Corp. (NYSE:FSK – Free Report) by 24.9% during the third quarter, according to the company in its most recent disclosure with the Securities & Exchange Commission. The firm owned 185,859 shares of the company’s stock after acquiring an additional 37,001 shares during the period. AA Financial Advisors LLC’s holdings in FS KKR Capital were worth $2,775,000 as of its most recent SEC filing. A number of other institutional investors and hedge funds have also recently added to or reduced their stakes in the stock. CCLA Investment Management acquired a new stake in shares of FS KKR Capital in the 2nd quarter valued at about $33,463,000. SCS Capital Management LLC bought a new position in shares of FS KKR Capital during the first quarter worth about $10,822,000. Generali Asset Management SPA SGR grew its holdings in shares of FS KKR Capital by 21.7% during the second quarter. Generali Asset Management SPA SGR now owns 2,485,265 shares of the company’s stock worth $51,569,000 after buying an additional 442,374 shares in the last quarter. Wellington Management Group LLP']"
3,125,3_passed away_jane_died_grandmother,"['passed away', 'jane', 'died', 'grandmother', 'funeral', 'lived', 'memorial', 'ann', 'sister', 'mary']","['Tosca Theresa Pardini Birth: 1931 Death: 2025 Tosca Theresa Pardini, beloved mother, Nonna, great grandmother, and cherished friend, passed away peacefully on Sunday, November 16, surrounded by the love of her family. On a dark, cloudy day, as the Frank Sinatra song “Fly Me to the Moon” played softly, a single ray of sunshine broke through and gently touched her beautiful face as she took her final breath with her family by her side. She was born at home in San Francisco on May 7, 1931, and she carried the spirit of the city with her throughout her life. Tosca later made her home in Ross, California, where she built a life centered on family, tradition, and enduring love. Tosca met the love of her life, Sergio Pardini, and they were married on February 17, 1952, at Saints Peter and Paul Church in North Beach. For sixty one adventure filled years they were inseparable and shared a deep devotion that guided their lives together. Known for her warmth, elegance, and quiet strength, Tosca created a home where everyone felt welcome. She was deeply proud of her Italian heritage and the traditions she lovingly passed down. Her kindness and grace touched all who knew her. Tosca loved traveling the world with Ser', 'Janet Marie Flores Birth: 1931 Death: 2025 Janet Marie Flores passed away peacefully on November 21, 2025 at the age of 94 surrounded by the love of her family. Jan was born on October 31, 1931 in San Francisco to loving parents Alice Detour and Joseph Hettrick. Jan was a loving mother, grandmother and great grandmother who found her greatest joy in her family. She had a way of making people feel welcomed. She was kind, big hearted, extremely gracious and devoted to those she loved. Her presence will be deeply missed. Jan lived a long life traveling, playing golf, bunco with her friends and one of her greatest talents was to find a treasure at garage sales. In her final years she enjoyed playing penny slots at the casino. The last nine years Jan spent in the loving care of her daughter and son in law. A special thank you to her granddaughter Samantha for making her last days warm, comfortable and full of love. Jan survived by her daughter Tina Schilling (Michael), her grandchildren Michael (Marissa), Paul (Kacie), Samantha (Carlos), and her nine great grandchildren Jackson, Aubrey, Jordan, Mikey, Ellie, Luna, Ryder, Makayla and Stella. And her friends who will forever cherish her memory. Celebration', 'Linda Sue (Jordan) Schlosser Birth: 1950 Death: 2025 Linda Sue (Jordan) Schlosser March 16, 1950-December 15, 2025 passed away peacefully surrounded by her family at her home in San Pancho, Mexico. Survived by her husband of 41 years, Phil Schlosser, her mother Gerry, daughter Kelly Noel, son Kevin Noel and wife Jennifer and her grandchildren Trevor and Lena. She was preceded in death by her father, Wayne Henry Jordan and brother Michael Wayne Jordan. Linda was born and raised in San Rafael, CA and graduated from Terra Linda High School. Linda loved sunshine, warm weather and travel. She was an outstanding cook and loved to entertain. Her great adventure was moving to Mexico, building a wonderful home filled with warmth, family, friends and great meals. She loved traveling throughout Mexico and Italy. Her family requests that gifts in lieu of flowers be made in Linda’s name to St. Jude Children’s Research Hospital. Forever deep in my soul, The memory of your love Fills my heart And I am never alone. Honor with Flowers In memory of Linda Sue Plant a Living Memorial In memory of Linda Sue']"
4,81,4_united_chelsea_villa_manchester,"['united', 'chelsea', 'villa', 'manchester', 'inter', 'cup', 'match', 'championship', 'club', 'goals']","['EPL results: Manchester United beats City in derby, Arsenal and Liverpool held to draw, Premier League scores, goals, news, video Michael Carrick’s Manchester United beat Manchester City 2-0 on Saturday (Sunday AEDT), dealing a huge blow to their neighbours’ Premier League title hopes, as sorry Tottenham slipped to defeat against relegation-threatened West Ham. Arsenal failed to capitalise on Man City’s loss, being held to a scoreless draw at Nottingham Forest. Liverpool were held to a 1-1 draw by lowly Burnley while Liam Rosenior celebrated his first league win in charge of Chelsea. Get all the latest football news, highlights and analysis delivered straight to your inbox with Fox Sports Sportmail. Sign up now!!! The early result at a bouncing Old Trafford — in Carrick’s first game at the start of his second spell in temporary charge of the Red Devils — left Pep Guardiola’s City seven points behind Arsenal. The Gunners could have extended their lead to a daunting nine points if they had beaten struggling Forest in the evening game, but were left frustrated with a 0-0 result at the City Ground. Former United midfielder Carrick was appointed as head coach until the end of the campaign following the sacking of Ruben Amorim earlier this month. The 44-year-old, who was also briefly United’s caretaker boss in 2021', ""Liverpool injury update: Alexander Isak, Alisson Becker and Jeremie Frimpong latest news and return dates Sport | Football Liverpool returned to winning ways with a 2-0 victory over Aston Villa to end their four-game losing streak in the Premier League. Pressure was piling on Arne Slot after the Reds slumped to ninth in the table, but even without a number of key players, the champions were able to sweep Villa aside to move back up to third. They welcome Real Madrid - Trent Alexander-Arnold, Xabi Alonso, et al - to Anfield in midweek, before they take on Manchester City in a mouth-watering encounter at the weekend. But will they have any of their star names back from injury? Ahead of a big few weeks, here’s all the latest Liverpool injury news and return dates... Alexander Isak has endured a tough start to life on Merseyside. Subbed at half-time in Liverpool’s 5-1 win over Frankfurt in the Champions League, Slot later revealed the £125million summer signing had suffered a minor groin injury. “Alexander had to go off at half-time because he felt his groin a little bit. That's a pity,” said Slot. “I've said many times it is such a difficult balance to find with a player that missed three months.” Isak was not in the squad in the 3-2 loss at Brentford, and he also missed out on the Caraba"", ""Liverpool injury update: Alexander Isak, Alisson Becker and Jeremie Frimpong latest news and return dates Liverpool returned to winning ways with a 2-0 victory over Aston Villa to end their four-game losing streak in the Premier League. Pressure was piling on Arne Slot after the Reds slumped to ninth in the table, but even without a number of key players, the champions were able to sweep Villa aside to move back up to third. They welcome Real Madrid - Trent Alexander-Arnold, Xabi Alonso, et al - to Anfield in midweek, before they take on Manchester City in a mouth-watering encounter at the weekend. But will they have any of their star names back from injury? Ahead of a big few weeks, here’s all the latest Liverpool injury news and return dates... Alexander Isak has endured a tough start to life on Merseyside. Subbed at half-time in Liverpool’s 5-1 win over Frankfurt in the Champions League, Slot later revealed the £125million summer signing had suffered a minor groin injury. “Alexander had to go off at half-time because he felt his groin a little bit. That's a pity,” said Slot. “I've said many times it is such a difficult balance to find with a player that missed three months.” Isak was not in the squad in the 3-2 loss at Brentford, and he also missed out on the Carabao Cup defeat agai""]"
