Topic,Count,Name,Representation,Representative_Docs
41,12,41_immigration_britain_british_immigrants,"['immigration', 'britain', 'british', 'immigrants', 'diversity', 'society', 'trump', 'deport', 'liberal', 'nigel']","['‘UK public have tougher stance on immigration and diversity than people in US’ People in the UK are less likely than their US counterparts to feel diversity strengthens society and more likely to have tougher attitudes on immigration, according to research. The findings are said to show that a common narrative about Britain being more socially liberal than America does not ring true across all issues. The National Centre for Social Research also found Reform UK voters in Britain were more likely than supporters of President Donald Trump in the US to say immigrants living in their country without permission should not be allowed to stay. While seven in 10 supporters of Mr Trump felt this way, the figure was almost eight in 10 (79%) among Reform followers. The researchers said they wanted to “better understand how public attitudes in the UK compare with those in the US, and the extent of polarisation in the two countries”. Their survey found 42% of people in the UK think there should be legal efforts to deport immigrants living here without permission, compared with just a third (33%) in the US. While almost two-thirds (64%) of respondents in the US felt diversity strengthens society, only around half (49%) of the UK public agreed. Proportions were similar when', '‘UK public have tougher stance on immigration and diversity than people in US’ People in the UK are less likely than their US counterparts to feel diversity strengthens society and more likely to have tougher attitudes on immigration, according to research. The findings are said to show that a common narrative about Britain being more socially liberal than America does not ring true across all issues. The National Centre for Social Research also found Reform UK voters in Britain were more likely than supporters of President Donald Trump in the US to say immigrants living in their country without permission should not be allowed to stay. While seven in 10 supporters of Mr Trump felt this way, the figure was almost eight in 10 (79%) among Reform followers. The researchers said they wanted to “better understand how public attitudes in the UK compare with those in the US, and the extent of polarisation in the two countries”. Their survey found 42% of people in the UK think there should be legal efforts to deport immigrants living here without permission, compared with just a third (33%) in the US. While almost two-thirds (64%) of respondents in the US felt diversity strengthens society, only around half (49%) of the UK public agreed. Proportions were similar when', '‘UK public have tougher stance on immigration and diversity than people in US’ People in the UK are less likely than their US counterparts to feel diversity strengthens society and more likely to have tougher attitudes on immigration, according to research. The findings are said to show that a common narrative about Britain being more socially liberal than America does not ring true across all issues. The National Centre for Social Research also found Reform UK voters in Britain were more likely than supporters of President Donald Trump in the US to say immigrants living in their country without permission should not be allowed to stay. While seven in 10 supporters of Mr Trump felt this way, the figure was almost eight in 10 (79%) among Reform followers. The researchers said they wanted to “better understand how public attitudes in the UK compare with those in the US, and the extent of polarisation in the two countries”. Their survey found 42% of people in the UK think there should be legal efforts to deport immigrants living here without permission, compared with just a third (33%) in the US. While almost two-thirds (64%) of respondents in the US felt diversity strengthens society, only around half (49%) of the UK public agreed. Proportions were similar when']"
42,12,42_monitors_monitor_tvs_display,"['monitors', 'monitor', 'tvs', 'display', 'screen', 'samsung', 'gaming', 'roku', 'tv', 'xbox']","['Luckfox 16-inch 4K 120Hz portable touch monitor offers 100% sRGB coverage The segment of portable monitors continues to grow, with many models available on Amazon at relatively affordable prices, typically between $100 and $150. These screens can be useful for productivity on business trips or while traveling. But portable monitors that combine a high resolution with a fast refresh rate remain uncommon in the mid-range segment. Luckfox wants to address this gap with its new 16"" 4K Touch Monitor. The 16-inch display features a 3840 × 2400 (WQUXGA) IPS panel with 350 nits brightness and a 1200:1 contrast ratio. It uses optical bonding technology with 6H-hardness toughened glass and a matte finish to minimize ambient reflections. The 16:10 aspect ratio provides more vertical workspace than the standard 16:9 format. It also supports a 120Hz refresh rate, which is an upgrade over the common 60Hz panels found in many portable monitors, such as the Auzai ME16Z01 or the Arzopa A1M; response times aren\'t disclosed, though. As for connectivity, the product integrates two USB Type-C ports and a Mini HDMI input. Both USB-C ports support audio, video, and power delivery, meaning that only a single USB-C cable is required when connected to a compatible smartphone, tab', 'Samsung OLED 48S95H: New 48-inch and 165 Hz OLED TV revealed ahead of schedule with HDR10 Plus Advanced support Samsung has already teased plenty of devices on the eve of CES 2026. However, the trade show has decided to lift the lid on one of Samsung\'s forthcoming OLED Smart TVs. For context, Samsung listed numerous unreleased Smart TVs on its Parts Database over a month ago. Of those, CES has announced that the S95H is a 2026 Honoree in its Gaming & eSports category. Specifically, the trade show has signalled out a 48-inch variant that was missing from November\'s leak. Incidentally, last year\'s S95F only went as small as 55-inches (curr. $1,997 on Amazon). According to the listing, the S95H offers a 165 Hz refresh rate with VRR technology supported. Assuming a 4K resolution from the S95F series and the usage of HDMI 2.1 ports, a 165 Hz refresh rate would require the usage of Display Stream Compression (DSC) to output at its peak resolution and refresh rate simultaneously. Moreover, the new 48-inch Smart TV will support Samsung\'s new HDR10 Plus Advanced format. Pricing and availability are unknown for now; the full description provided by Samsung and CES is as follows: The Samsung OLED (S95H) is the world\'s most advanced 48"" OLED TV for high-end gaming. Combining unparalleled brightness and', ""World's largest monitor company designed a 4K 48-inch OLED dual-sided smart gaming display with metal feet, a magnetic power socket, and an Alienware-inspired sound system - but who will actually use it? Sign up for breaking news, reviews, opinion, top tech deals, and more. You are now subscribed Your newsletter sign-up was successful GP TV has unveiled what it calls the world’s first dual-sided 48-inch 4K OLED television, designed for gaming and sports viewing. The display is intended to deliver immersive experiences on both sides simultaneously, with built-in audio and dynamic lighting effects. TPV Technology Group, the company behind GP TV, claims the screen targets premium users who value high-end visual fidelity, as well as the public sector and government institutions. This design feels unusual because most monitors or televisions sit against a wall or on a desk, making a rear-facing display largely unnecessary. Its relevance only emerges if the screen stands in the center of a room, similar to display setups commonly seen in shopping malls - and even then, deploying such a device in public spaces would increase the risk of physical damage, leaving the practical use case for this product uncertain. It comes with an audio system that integrates surround sound, Dolby Atmos support, and sound tracking that follows on-screen action. Speakers with fabric covers on both sides creat""]"
43,12,43_strictly_itv_contestants_dancing,"['strictly', 'itv', 'contestants', 'dancing', 'davies', 'lorraine', 'ballroom', 'simon', 'presenting', 'elimination']","[""Strictly Come Dancing star confesses to feelings of 'guilt' about winning BBC show Karen Carney, George Clarke and Amber Davies will battle it out for the coveted Glitterball trophy on Strictly Come Dancing this weekend, with YouTuber George currently leading as the bookmakers' favourite. Yet the competition doesn't always go according to plan, with the BBC ballroom series having witnessed numerous surprising outcomes throughout its history. The 2009 series delivered one of the programme's most unexpected moments when Chris Hollins defied the odds to triumph over favourite Ricky Whittle. The victory surprised many, with the presenter later admitting he felt somewhat guilty about his win too. Hollyoaks actor Ricky, partnered with professional dancer Natalie Lowe, had regularly out-danced Chris, who performed alongside Ola Jordan. Nevertheless, Chris garnered substantial support from the viewing public and whilst he wasn't receiving the highest judges' scores, he consistently progressed through public votes, never facing elimination in the dance-off. Ultimately, he claimed victory, reports Wales Online. Prior to the finale, Chris acknowledged feeling a little guilty about reaching the last stage instead of Ali Bastian and Brian Fortuna, who had achieved better scor"", 'Strictly Come Dancing fans have same complaint as La Voix withdraws from show \'Pointless!\' Strictly Come Dancing fans have been left with the same question after it was announced La Voix has withdrawn from the competition. During Saturday (November 22) night\'s show, the remaining contestants took to the dance floor at the iconic Blackpool Tower Ballroom. Before things kicked off for Blackpool Week, presenter Tess Daly informed viewers that the drag queen – real name Chris Dennis – would not be returning to the competition after sustaining a foot injury. She said: ""We can confirm she has very sadly had to withdraw from the competition,"" before revealing there would be no elimination this weekend. But this has left fans wondering why Sunday night\'s show is still airing now that there is no dance-off. Taking to social media with their queries, one wrote: ""So what’s the point of Sunday’s show when everything can be done tonight #Strictly?"" Read more: Strictly pro says only one person can replace Craig Revel Horwood Read more: BBC Strictly viewers switch off as major star pulls out of show We use your sign-up to provide content in ways you\'ve consented to and to improve our understanding of you. This may include adverts from us and 3rd parties based on our understanding. You', 'Strictly Come Dancing star breaks silence after concern fifth contestant would quit Strictly Come Dancing\'s Alex Kingston is poised to carry on with her dance adventure, putting to rest concerns she might have to withdraw due to injury. The 62-year-old actress had triggered concerns about a potential exit after her daughter disclosed a rib injury on social media, stating that her mother had endured the discomfort to participate in Saturday\'s programme. The Doctor Who legend, who has been dazzling audiences on the dance floor alongside partner Johannes Radebe, was swift to comfort her supporters that injuries were simply ""part and parcel"" of the Strictly experience, and she had absolutely no plans to retire her dancing shoes. Fleur East, host of Strictly spin-off It Takes Two, has now verified that Alex will return to the competition following last week\'s Blackpool special. Discussing their forthcoming performance, Fleur disclosed: ""Alex and Johannes will be dancing a cha-cha-cha to Ring My Bell by Anita Ward."" We use your sign-up to provide content in ways you\'ve consented to and to improve our understanding of you. This may include adverts from us and 3rd parties based on our understanding. You can unsubscribe at any time. Read our Privacy Policy She continued: ""']"
44,11,44_protesters_political prisoners_syria_detainees,"['protesters', 'political prisoners', 'syria', 'detainees', 'activists', 'civilians', 'genocide', 'civil society', 'regime', 'humanitarian']","[""Hundreds protest in Tunisia over president's escalating crackdown on freedoms TUNIS, Tunisia (AP) — Tunisians took to the streets of downtown Tunis on Saturday over what they described as President Kais Saied ’s increasingly authoritarian rule and demanding the release of all jailed political prisoners. The rally, held under the banner “Against Injustice,” brought together families of political detainees and activists from different ideological backgrounds. The demonstration drew more than 1,000 protesters, some dressed in black and chanting anti-regime slogans, including “The people want to overthrow the regime,” “What a great country! Oppression and tyranny!” and “No fear no terror, the street belongs to the people.” The protest came as part of a broader surge in protests nationwide over political and economic turmoil under Saied’s rule. On Thursday, Tunisian journalists protested against the widening crackdown on the freedom of the press and the temporary suspension of several prominent civil society organizations. Protesters also called out Saied’s interference in the judiciary and accused him of using the police to target political opponents. Ayoub Amara, one of the organizers, told reporters on Saturday that the protest aimed to highlight the plight of"", ""Hundreds protest in Tunisia over president's escalating crackdown on freedoms TUNIS, Tunisia (AP) — Tunisians took to the streets of downtown Tunis on Saturday over what they described as President Kais Saied ’s increasingly authoritarian rule and demanding the release of all jailed political prisoners. Javascript is required for you to be able to read premium content. Please enable it in your browser settings. Copyright 2025 The Associated Press. All rights reserved. This material may not be published, broadcast, rewritten or redistributed without permission. Success! An email has been sent to with a link to confirm list signup. Error! There was an error processing your request. Stay ahead of the curve with instant alerts on the most urgent and impactful breaking news as it happens. Sign up to receive the latest breaking news delivered to your email inbox."", ""Hundreds protest in Tunisia over president's escalating crackdown on freedoms TUNIS, Tunisia (AP) — Tunisians took to the streets of downtown Tunis on Saturday over what they described as President Kais Saied ’s increasingly authoritarian rule and demanding the release of all jailed political prisoners. The rally, held under the banner “Against Injustice,” brought together families of political detainees and activists from different ideological backgrounds. Javascript is required for you to be able to read premium content. Please enable it in your browser settings. Copyright 2025 The Associated Press. All rights reserved. This material may not be published, broadcast, rewritten or redistributed without permission. A Florida sheriff’s deputy was killed and two other people were wounded Friday after gunfire broke out during an attempt to serve an eviction notice in Vero Beach, officials said. NEW YORK — After claiming for years that they couldn’t find any documents about what City Hall knew about the dangers of the 9/11 toxins swirling around Ground Zero, the city Department of Environmental Protection has now discovered 68 boxes worth of information that could be pivotal in lear… Tatiana Schlossberg, granddaughter of slain President John F. Kennedy, is battli""]"
45,11,45_government shutdown_federal government_grocery_house washington,"['government shutdown', 'federal government', 'grocery', 'house washington', 'white house', 'appropriations', 'government political', 'veterans affairs', 'snap', 'president donald']","['States scramble to send full SNAP food benefits to millions of people after shutdown ends The US government shutdown finally ended on November 12 after 43 days of budget paralysis – the longest in the nation’s history. Federal operations are resuming, but key issues remain unresolved and tensions in Washington persist. With the longest U.S. government shutdown over, state officials said Thursday they were working quickly to get full SNAP food benefits to millions of people who made do with little to no assistance for the past couple of weeks. A person shops for produce Monday at a grocery store in Baltimore. President Donald Trump signs the funding bill to reopen the government Wednesday in the Oval Office of the White House in Washington. Produce is displayed Monday at a grocery store in Baltimore. Stay up-to-date on the latest in local and national government and political topics with our newsletter. The US government shutdown finally ended on November 12 after 43 days of budget paralysis – the longest in the nation’s history. Federal opera…', 'States scramble to send full SNAP food benefits to millions of people after shutdown ends The US government shutdown finally ended on November 12 after 43 days of budget paralysis – the longest in the nation’s history. Federal operations are resuming, but key issues remain unresolved and tensions in Washington persist. With the longest U.S. government shutdown over, state officials said Thursday they were working quickly to get full SNAP food benefits to millions of people who made do with little to no assistance for the past couple of weeks. A person shops for produce Monday at a grocery store in Baltimore. President Donald Trump signs the funding bill to reopen the government Wednesday in the Oval Office of the White House in Washington. Produce is displayed Monday at a grocery store in Baltimore. Stay up-to-date on the latest in local and national government and political topics with our newsletter. The US government shutdown finally ended on November 12 after 43 days of budget paralysis – the longest in the nation’s history. Federal opera…', 'States scramble to send full SNAP food benefits to millions of people after shutdown ends The US government shutdown finally ended on November 12 after 43 days of budget paralysis – the longest in the nation’s history. Federal operations are resuming, but key issues remain unresolved and tensions in Washington persist. With the longest U.S. government shutdown over, state officials said Thursday they were working quickly to get full SNAP food benefits to millions of people who made do with little to no assistance for the past couple of weeks. A person shops for produce Monday at a grocery store in Baltimore. President Donald Trump signs the funding bill to reopen the government Wednesday in the Oval Office of the White House in Washington. Produce is displayed Monday at a grocery store in Baltimore. Stay up-to-date on the latest in local and national government and political topics with our newsletter. The US government shutdown finally ended on November 12 after 43 days of budget paralysis – the longest in the nation’s history. Federal opera…']"
46,11,46_manila_philippine_philippines_anti corruption,"['manila', 'philippine', 'philippines', 'anti corruption', 'manila philippines', 'petaling jaya', 'smuggling', 'jakarta', 'bureau', 'marcos']","['Chinese national arrested in Batangas for false identity MANILA, Philippines — A Chinese national was arrested in Batangas for allegedly misrepresenting himself as a Filipino citizen, the Bureau of Immigration said. In a statement on Monday, April 13, the bureau said the arrest took place on April 10 in Barangay Malainin in Ibaan. The suspect was identified as 35-year-old Zhou Jianxiao, who used the alias ""Donny Flores."" Zhou used the alias on a Philippine driver\'s license that identified him as a Filipino citizen, according to the bureau. At the time of his arrest, Zhou was found managing operations at a local warehouse. A further inspection of the facility led to the apprehension of three other Chinese nationals identified as Li Qican, Ji Jingui and Chen Longlong. They were arrested for various immigration violations, including overstaying, violating the conditions of their stay, and working without the required visas or permits, the bureau said. Zhou is facing charges for violating Section 37(a)(7) of the Philippine Immigration Act of 1940, as amended, for using Philippine documents to assume a false Filipino identity. The arrest is the latest in a string of cases involving Chinese nationals accused of posing as Filipinos using local', ""'There na ‘Yan!': The Palawan promise to OFW families MANILA, Philippines — For millions of Filipino families, Overseas Filipino Workers (OFWs) are everyday heroes who carry the weight of sacrifice so their loved ones can build better lives back home. Every remittance tells a story of love, resilience and deep responsibility. In tribute to these modern-day heroes, Palawan Group of Companies launches its “There Na” campaign, shining a spotlight on OFWs and reinforcing the value of fast, reliable and accessible international remittance services. Through Palawan Express Pera Padala and PalawanPay, families can receive support quickly and securely via more than 45 international remittance partners and thousands of branches nationwide or via the app anytime, anywhere, ensuring that distance never becomes a barrier to care. In their recent commercial, the “There Na” message comes alive through real stories of overseas Filipino workers, whom many Filipinos regard as modern-day heroes. A construction worker in Dubai sends his son’s allowance for school in Luzon, while a seafarer in Alaska sends funds to her wife in the Visayas, and OFWs in Hong Kong also send financial support, showing that distance is no longer a barrier. Bringing this messa"", 'BIR files tax raps vs. Wawao Builders over ghost project in Bulacan MANILA – In line with the whole-of-government effort to combat corruption in infrastructure projects exposed by President Ferdinand R. Marcos Jr., the Bureau of Internal Revenue (BIR) on Thursday filed criminal complaints before the Department of Justice (DOJ) against Mark Allan Villamor Arevalo, sole proprietor of Wawao Builders. The charges are in connection with an estimated PHP48.39 million tax deficiency arising from a ghost flood-control project of Wawao Builders in Malolos City, Bulacan in 2024. According to the criminal complaints, Wawao violated Sections 254 and 255 of the National Internal Revenue Code of 1997, as amended, by committing tax evasion and failing to supply correct and accurate information in its filings of income tax and value-added tax (VAT) returns for the first and second quarters of 2024. BIR Commissioner Charlito Martin Mendoza said the tax compliance investigation is also in line with Finance Secretary Frederick Go’s directive to prioritize tax violations connected to irregular government projects. “This case reflects the BIR’s active participation in the President’s anti-corruption crusade,” Mendoza said as quoted in a news release. “While other agenc']"
