Topic,Count,Name,Representation,Representative_Docs
23,11,23_betting_casino_steam_game,"['betting', 'casino', 'steam', 'game', 'platform', 'nhl', 'vegas', 'new players', 'interactive', 'milestone']","[""New Online Casinos 2025: Lucky Creek Ranked High For New U.S. Players New players gain fast access to bonuses, smooth payouts, and a broad gaming lineup Lucky Creek offers strong bonuses, steady payouts, and a wide range of games for new players A leading 2025 option for U.S. beginners seeking secure payouts and a large game selection Lucky Creek delivers fast rewards, clear navigation, and a wide mix of games for first-time players Las Vegas, Nov. 15, 2025 (GLOBE NEWSWIRE) -- CasinoTop10 has ranked Lucky Creek Casino as the best online gaming casino for new players, offering them a premium experience from the outset. The casino has solidified its position as the best for beginners, as they kick-start their online gaming journeys through its fast payouts, extensive gaming collection, and 24/7 customer support. Lucky Creek prioritizes player satisfaction at every step, whether you're topping up your account or cashing out after a productive gaming session. New players are greeted with a generous 200% match bonus of up to $7,000, plus 200 free spins over 5 days as a welcome bonus to explore the platform and wager on their favorite games without stretching their budget. The magic does not end there. Lucky Creek continues to celebrate players as they con"", ""AGS Interactive Expands Its UK Presence with bet365 Partnership LAS VEGAS, Dec. 05, 2025 (GLOBE NEWSWIRE) -- AGS Interactive (AGSi) has solidified its presence across the pond, taking a selection of its best-performing games live in the UK with bet365. This announcement further cements AGS’ partnership with bet365 building on existing collaborations in the United States, Canada, and Latin America. bet365’s established UK market position and diverse global presence make them a logical strategic partner to support AGS’ global growth initiatives throughout Europe and beyond. At the time of launch, bet365 players across the UK will have access to more than 20 popular game titles from AGS' interactive content library. Notable titles include: “We’ve worked closely with bet365 for years and extending our partnership to the UK is an important milestone for AGS,” said Zoe Ebling, Vice President of Interactive at AGS. “It not only reflects the strength of our relationship, but the growing global appeal and potential of our increasingly diverse portfolio of high-performing online slot content. This is a clear sign of where AGS is headed — broader reach, more markets, and a rapidly expanding international footprint.” “We’re delighted to welcome a selection"", 'AGS Interactive Expands Its UK Presence with bet365 Partnership LAS VEGAS, Dec. 05, 2025 (GLOBE NEWSWIRE) -- AGS Interactive (AGSi) has solidified its presence across the pond, taking a selection of its best-performing games live in the UK with bet365. This announcement further cements AGS\' partnership with bet365 building on existing collaborations in the United States, Canada, and Latin America. bet365\'s established UK market position and diverse global presence make them a logical strategic partner to support AGS\' global growth initiatives throughout Europe and beyond. At the time of launch, bet365 players across the UK will have access to more than 20 popular game titles from AGS\' interactive content library. Notable titles include: ""We\'ve worked closely with bet365 for years and extending our partnership to the UK is an important milestone for AGS,"" said Zoe Ebling, Vice President of Interactive at AGS. ""It not only reflects the strength of our relationship, but the growing global appeal and potential of our increasingly diverse portfolio of high-performing online slot content. This is a clear sign of where AGS is headed — broader reach, more markets, and a rapidly expanding international footprint."" ""We\'re delighted to welcome a selection']"
24,11,24_new season_release date_episodes_seasons,"['new season', 'release date', 'episodes', 'seasons', 'tv', 'netflix', 'date time', 'arrive', 'watch', 'series']","['Is There a A Man on the Inside Season 2 Episode 9 Release Date & Time? Viewers are wondering if there’s a A Man on the Inside Season 2 Episode 9 release date and time. The much-awaited sophomore season has recently released its eighth episode, leaving fans curious about whether the season is over. Here’s all you need to know. There isn’t a A Man on the Inside Season 2 Episode 9 release date and time. This is because the official schedule of the show confirms that the sophomore season will have only eight episodes. A Man on the Inside is a comedy series created by Michael Schur. It centers on a retired college engineering professor who accepts a new job as an investigative assistant and goes undercover at a retirement home to look for a missing necklace. The show stars Ted Danson, Mary Elizabeth Ellis, Stephanie Beatriz, and more. Yes, A Man on the Inside Season 2 has finished. The second season of A Man on the Inside was released with all eight episodes on Thursday, November 20, 2025. No more episodes will be added in this season. Moreover, the showrunners have yet to announce whether the series will return for a fourth season. There have been no reports of a cancellation either. Comingsoon will bring you the updates as soon as they arrive. You can wa', 'Is There a The Morning Show Season 4 Episode 11 Release Date & Time? Viewers are wondering if there’s a The Morning Show Season 4 Episode 11 release date and time. The popular drama series has recently released its 10th episode, leaving fans eager to know whether the season is over. Here’s all you need to know. There isn’t a The Morning Show Season 4 Episode 11 release date and time. This is because the season has ended with just 10 episodes, according to the show’s official schedule. The Morning Show is a drama series that delves into the inner workings of a high-profile network broadcast morning news program. The series features a stellar cast that includes Jennifer Aniston, Reese Witherspoon, and Billy Crudup, among others. Yes, The Morning Show Season 4 has finished. The fourth season of the show released its 10th and final episode, titled “Knowing Violation,” recently. There won’t be an additional episode in the coming weeks. However, fans need not worry as it will come back with a new season. In September 2025, Apple TV+ announced that The Morning Show had been renewed for Season 5. But a release window has yet to be confirmed. You can watch The Morning Show Season 4 via Apple TV+. Apple TV+ is one of the most popular streaming services in the', 'Fallout Season 2 Episode 6 Release Date, Time, Where to Watch Fallout Season 2 Episode 6 release date and time are not far away. In the previous episode, titled “The Wrangler,” the Ghoul and Lucy encounter not one but an entire pack of Deathclaws. After deciding to run for their lives, the two narrowly escape. Meanwhile, Hank experiments with the mind control device on a random person he picked up from an abandoned part of the city, and Norm arrives at an old Vault-Tec office. The episode also featured several flashbacks, in which Cooper is tasked with acquiring Cold Fusion technology. Later, Mr. House confronts Cooper in Las Vegas. So, here are all the release details you need to know about the upcoming Episode 6. The episode’s release date is January 21, 2026, and its release time is 12 a.m. PT and 3 a.m. ET. Check out its release times in the U.S. below: Find out how many episodes will be available to watch in the new season right here. You can watch Fallout Season 2 Episode 6 primarily via Amazon Prime Video. Prime Video is a global streaming platform that offers its members access to its endless catalog of movies and shows. Furthermore, the site also produces original projects, such as The Boys, Gen V, Fallout, and Citadel. The official']"
25,11,25_government shutdown_groceries_federal_government,"['government shutdown', 'groceries', 'federal', 'government', 'states', 'house washington', 'white house', 'snap', 'president donald', 'produce']","['States scramble to send full SNAP food benefits to millions of people after shutdown ends The US government shutdown finally ended on November 12 after 43 days of budget paralysis – the longest in the nation’s history. Federal operations are resuming, but key issues remain unresolved and tensions in Washington persist. With the longest U.S. government shutdown over, state officials said Thursday they were working quickly to get full SNAP food benefits to millions of people who made do with little to no assistance for the past couple of weeks. A person shops for produce Monday at a grocery store in Baltimore. President Donald Trump signs the funding bill to reopen the government Wednesday in the Oval Office of the White House in Washington. Produce is displayed Monday at a grocery store in Baltimore. Stay up-to-date on the latest in local and national government and political topics with our newsletter. The US government shutdown finally ended on November 12 after 43 days of budget paralysis – the longest in the nation’s history. Federal opera…', 'States scramble to send full SNAP food benefits to millions of people after shutdown ends The US government shutdown finally ended on November 12 after 43 days of budget paralysis – the longest in the nation’s history. Federal operations are resuming, but key issues remain unresolved and tensions in Washington persist. With the longest U.S. government shutdown over, state officials said Thursday they were working quickly to get full SNAP food benefits to millions of people who made do with little to no assistance for the past couple of weeks. A person shops for produce Monday at a grocery store in Baltimore. President Donald Trump signs the funding bill to reopen the government Wednesday in the Oval Office of the White House in Washington. Produce is displayed Monday at a grocery store in Baltimore. Stay up-to-date on the latest in local and national government and political topics with our newsletter. The US government shutdown finally ended on November 12 after 43 days of budget paralysis – the longest in the nation’s history. Federal opera…', 'States scramble to send full SNAP food benefits to millions of people after shutdown ends The US government shutdown finally ended on November 12 after 43 days of budget paralysis – the longest in the nation’s history. Federal operations are resuming, but key issues remain unresolved and tensions in Washington persist. With the longest U.S. government shutdown over, state officials said Thursday they were working quickly to get full SNAP food benefits to millions of people who made do with little to no assistance for the past couple of weeks. A person shops for produce Monday at a grocery store in Baltimore. President Donald Trump signs the funding bill to reopen the government Wednesday in the Oval Office of the White House in Washington. Produce is displayed Monday at a grocery store in Baltimore. Stay up-to-date on the latest in local and national government and political topics with our newsletter. The US government shutdown finally ended on November 12 after 43 days of budget paralysis – the longest in the nation’s history. Federal opera…']"
26,10,26_oil prices_oil gas_state lawmakers_california,"['oil prices', 'oil gas', 'state lawmakers', 'california', 'santa barbara', 'coastal', 'pacific coast', 'drill', 'power plants', 'state']","[""California lawmakers push back against offshore oil drilling (The Center Square) – Weeks after California Lt. Gov. Eleni Kounalakis spoke out against federal efforts to expand offshore oil drilling, state lawmakers told The Center Square that increased drilling is deeply unpopular among coastal residents. Opponents warn against the environmental costs. But supporters say technology has made drilling safer. They also note offshore drilling could boost America's energy independence and lower gas prices in California, which typically has the highest in the U.S. Legislators’ comments opposing the drilling come after the announcement in November 2025 that the U.S. Department of the Interior would expand oil and gas drilling leases not just off the Pacific Coast in areas such as Santa Barbara, but other sites on the nation’s outer continental shelf. “We have a deep, visceral experience that is seared into the community’s consciousness about the risks of offshore oil development,” Assemblymember Gregg Hart, D-Santa Barbara, told The Center Square. “We are adamantly opposed to the leasing. There’s been a bipartisan consensus for 40 years that we want to wind down offshore oil development, not expand it.” According to a November 2025 order from the U"", ""California lawmakers push back against offshore oil drilling (The Center Square) – Weeks after California Lt. Gov. Eleni Kounalakis spoke out against federal efforts to expand offshore oil drilling, state lawmakers told The Center Square that increased drilling is deeply unpopular among coastal residents. Opponents warn against the environmental costs. But supporters say technology has made drilling safer. They also note offshore drilling could boost America's energy independence and lower gas prices in California, which typically has the highest in the U.S. Legislators’ comments opposing the drilling come after the announcement in November 2025 that the U.S. Department of the Interior would expand oil and gas drilling leases not just off the Pacific Coast in areas such as Santa Barbara, but other sites on the nation’s outer continental shelf. “We have a deep, visceral experience that is seared into the community’s consciousness about the risks of offshore oil development,” Assemblymember Gregg Hart, D-Santa Barbara, told The Center Square. “We are adamantly opposed to the leasing. There’s been a bipartisan consensus for 40 years that we want to wind down offshore oil development, not expand it.” According to a November 2025 order from the U"", ""California lawmakers push back against offshore oil drilling (The Center Square) – Weeks after California Lt. Gov. Eleni Kounalakis spoke out against federal efforts to expand offshore oil drilling, state lawmakers told The Center Square that increased drilling is deeply unpopular among coastal residents. Opponents warn against the environmental costs. But supporters say technology has made drilling safer. They also note offshore drilling could boost America's energy independence and lower gas prices in California, which typically has the highest in the U.S. Legislators’ comments opposing the drilling come after the announcement in November 2025 that the U.S. Department of the Interior would expand oil and gas drilling leases not just off the Pacific Coast in areas such as Santa Barbara, but other sites on the nation’s outer continental shelf. “We have a deep, visceral experience that is seared into the community’s consciousness about the risks of offshore oil development,” Assemblymember Gregg Hart, D-Santa Barbara, told The Center Square. “We are adamantly opposed to the leasing. There’s been a bipartisan consensus for 40 years that we want to wind down offshore oil development, not expand it.” According to a November 2025 order from the U""]"
27,10,27_africa_school students_south africa_tourists,"['africa', 'school students', 'south africa', 'tourists', 'camp', 'continent', 'conservation', 'minn', 'studying', 'food']","['Minnesota high schoolers prepare for once-in-lifetime learning trip to Africa ASHBY, Minn. — There are field trips and there are field trips. Students at Ashby High School are busy raising money and getting ready to pack their bags for a two-week learning experience in South Africa. ADVERTISEMENT When it is below zero, the main street in Ashby, Minnesota, is quiet. Fewer than 500 people call this Grant County town home, but lately the town is busy rallying around a group of high school students. In the basement of Peace Grue Lutheran in the middle of town, five high school students join veteran church quilters in tying quilts that the students will take on their trip to South Africa. ""There is a reason the church ladies do this and not the guys,"" joked Kevin Fick, the girls\' weightlifting coach and organizer of the trip, of tying quilts the students will take with them as gifts. Five girls, along with Fick and four adult chaperones, will make the trip to Eastern Cape, South Africa, from Feb. 28 through March 10. Not as tourists, but to learn about conservation on another continent. ""Not a lot of kids get to do this,"" said student Hadley Hokanson, student. They will work a sheep ranch, fish for sharks, harvest their own food, camp in the bushes and more. ""I t', 'Minnesota high schoolers prepare for once-in-lifetime learning trip to Africa ASHBY, Minn. — There are field trips and there are field trips. Students at Ashby High School are busy raising money and getting ready to pack their bags for a two-week learning experience in South Africa. ADVERTISEMENT When it is below zero, the main street in Ashby, Minnesota, is quiet. Fewer than 500 people call this Grant County town home, but lately the town is busy rallying around a group of high school students. In the basement of Peace Grue Lutheran in the middle of town, five high school students join veteran church quilters in tying quilts that the students will take on their trip to South Africa. ""There is a reason the church ladies do this and not the guys,"" joked Kevin Fick, the girls\' weightlifting coach and organizer of the trip, of tying quilts the students will take with them as gifts. Five girls, along with Fick and four adult chaperones, will make the trip to Eastern Cape, South Africa, from Feb. 28 through March 10. Not as tourists, but to learn about conservation on another continent. ""Not a lot of kids get to do this,"" said student Hadley Hokanson, student. They will work a sheep ranch, fish for sharks, harvest their own food, camp in the bushes and more. ""I t', 'Minnesota high schoolers prepare for once-in-lifetime learning trip to Africa ASHBY, Minn. — There are field trips and there are field trips. Students at Ashby High School are busy raising money and getting ready to pack their bags for a two-week learning experience in South Africa. ADVERTISEMENT When it is below zero, the main street in Ashby, Minnesota, is quiet. Fewer than 500 people call this Grant County town home, but lately the town is busy rallying around a group of high school students. In the basement of Peace Grue Lutheran in the middle of town, five high school students join veteran church quilters in tying quilts that the students will take on their trip to South Africa. ""There is a reason the church ladies do this and not the guys,"" joked Kevin Fick, the girls\' weightlifting coach and organizer of the trip, of tying quilts the students will take with them as gifts. Five girls, along with Fick and four adult chaperones, will make the trip to Eastern Cape, South Africa, from Feb. 28 through March 10. Not as tourists, but to learn about conservation on another continent. ""Not a lot of kids get to do this,"" said student Hadley Hokanson, student. They will work a sheep ranch, fish for sharks, harvest their own food, camp in the bushes and more. ""I t']"
28,9,28_santa_christmas_holiday season_christmas eve,"['santa', 'christmas', 'holiday season', 'christmas eve', 'festive', 'holiday', 'presents', 'festival', 'traditions', 'children need']","['Celebrating Christmas in and around Larnaca The city, the suburbs and the villages of Larnaca all get into the festive mood this season as dozens of Christmas events pop up. All around the Larnaca region, markets, workshops and performances will share magical moments for visitors. The SanTa Lefkara Christmas Village is on until January 6 with artists’ stalls, entertainment, craft workshops, children’s activities and concerts taking over the village centre. As one of the deputy ministry of tourism’s eight Christmas Villages, Lefkara is dressed in full holiday glam with glimmering string lights, Christmas trees and a rich, weekly entertainment programme. On December’s first weekend coming up, Larnaca region’s biggest fair returns. The Traditional Christmas Market makes its anticipated annual comeback at Forest Beach, Dekeleia Road, bringing over 200 stalls selling a wide range of food, craft and handmade items from handbags to sweets, candles, baked goods and hundreds of other unique items. The market will include Santa visits, live radio links, hot drinks and food stands. The Livadia Christmas Programme will also bring holiday cheer on December 6, 14, 20 and 28 as the community square fills with music and dance beats, the fam', 'Want an ‘ezbacke uvin’ or ‘mot cantrl’ for Christmas? Write to Santa The time has come again for both the young and old to send in their letters to Santa. This has become one of my favorite Christmas traditions. The letters to Santa we publish each December are often heartwarming and occasionally heartbreaking. They are a reminder of what makes Christmas magical. They are an amusing break from the sometimes jarring news we must print in the paper. And, hey, they might even be beneficial to your brain’s elasticity. It takes some creativity on the reader’s part to figure out just what the little kiddies are asking for, since we publish the letters verbatim. Try to decipher these phrases from previous Santa letters: I’m looking forward to the, umm, creative writing in this year’s batch of letters. We will publish Santa letters from children and adults in north central Idaho and southeastern Washington. The letters can be just a few words if you have a short wish list, but please try to write no more than 300 words. Be sure to include the author’s name, age and town of residence. The letters can be emailed to city@lmtribune.com, sent in the mail to Letters to Santa, Lewiston Tribune, 505 Capital St., Lewiston, ID 83501, or dropped off at our office. The', 'Want an ‘ezbacke uvin’ or ‘mot cantrl’ for Christmas? Write to Santa The time has come again for both the young and old to send in their letters to Santa. This has become one of my favorite Christmas traditions. The letters to Santa we publish each December are often heartwarming and occasionally heartbreaking. They are a reminder of what makes Christmas magical. They are an amusing break from the sometimes jarring news we must print in the paper. And, hey, they might even be beneficial to your brain’s elasticity. It takes some creativity on the reader’s part to figure out just what the little kiddies are asking for, since we publish the letters verbatim. Try to decipher these phrases from previous Santa letters: I’m looking forward to the, umm, creative writing in this year’s batch of letters. We will publish Santa letters from children and adults in north central Idaho and southeastern Washington. The letters can be just a few words if you have a short wish list, but please try to write no more than 300 words. Be sure to include the author’s name, age and town of residence. The letters can be emailed to city@lmtribune.com, sent in the mail to Letters to Santa, Lewiston Tribune, 505 Capital St., Lewiston, ID 83501, or dropped off at our office. The']"
