Topic,Count,Name,Representation,Representative_Docs
11,40,11_grocery_groceries_supermarket_retailers,"['grocery', 'groceries', 'supermarket', 'retailers', 'consumers', 'shoppers', 'shopping', 'products', 'restaurants', 'foods']","['Convenience Store Market 2031 Outlook – A USD 1001 Bn Opportunity as APAC Leads Growth with Hyper Convenience Store Expansion says a 2026 Mordor Intelligence Report Hyderabad, Jan. 09, 2026 (GLOBE NEWSWIRE) -- According to Mordor Intelligence, the convenience store market valued at around USD 704 billion in 2025, is projected to grow from USD 747 billion in 2026 to USD 1001.6 billion by 2031, growing at a CAGR of 6%. Growth is fueled by urban migration, rising demand for quick-shopping experiences, and the integration of digital ordering, loyalty programs, and payment systems. Retailers are expanding prepared-food offerings, adding EV charging stations, and using real-time analytics to speed up restocking, boosting basket value even as fuel sales fluctuate. Active private-equity deals and M&A continue due to steady cash flows and consistent customer traffic, while regulatory incentives for alternative-energy solutions offer new revenue opportunities. Moderate competition, with top chains holding a limited share, opens room for regional and mid-tier players to gain an edge through localized strategies, diversified products, and data-driven promotions. Regional Market Outlook Asia-Pacific Asia-Pacific is emerging as the fastest-growing region, driven by rising incomes and compact urban living. Retailers in Japan and South Korea focus on hot-food', ""Aldi one-ups Costco with massive holiday deal As a subscriber, you can share up to 3 articles each month with friends for free. Just click “Gift this Article” on this page, then copy the link or enter their email. Gifts are exclusive to subscribers, reset monthly, and each article can be redeemed once. In the world of retail, both Aldi and Costco are known for their affordable groceries and household essentials. But while the two have very different business models, they have one thing in common -- loyal customers. There's a reason Costco members are willing to pay $65 a year for a Gold Star membership or $130 a year for an Executive membership. For those who shop at Costco regularly, the annual fee is worth paying if it translates into ongoing savings year-round. Javascript is required for you to be able to read premium content. Please enable it in your browser settings. Thanks for the feedback. Log In Keep it Clean. Please avoid obscene, vulgar, lewd, racist or sexually-oriented language. PLEASE TURN OFF YOUR CAPS LOCK. Don't Threaten. Threats of harming another person will not be tolerated. Be Truthful. Don't knowingly lie about anyone or anything. Be Nice. No racism, sexism or any sort of -ism that is degrading to another"", ""Pepsi adds a new take on cola Coca-Cola does not offer As a subscriber, you can share up to 3 articles each month with friends for free. Just click “Gift this Article” on this page, then copy the link or enter their email. Gifts are exclusive to subscribers, reset monthly, and each article can be redeemed once. It's natural for consumers to want healthier versions of unhealthy things. I, for example, have a sweet tooth and have been ordering from Shameless Snacks, a company that makes gummy candies that are 90 calories a package with only 3 grams of sugar and nearly a full day's worth of fiber. Javascript is required for you to be able to read premium content. Please enable it in your browser settings. Thanks for the feedback. Log In Keep it Clean. Please avoid obscene, vulgar, lewd, racist or sexually-oriented language. PLEASE TURN OFF YOUR CAPS LOCK. Don't Threaten. Threats of harming another person will not be tolerated. Be Truthful. Don't knowingly lie about anyone or anything. Be Nice. No racism, sexism or any sort of -ism that is degrading to another person. Be Proactive. Use the 'Report' link on each comment to let us know of abusive posts. Share with Us. We'd love to hear eyewitness accounts, the history behind an article. This""]"
12,38,12_nigeria_electoral_ghana_election,"['nigeria', 'electoral', 'ghana', 'election', 'democratic', 'kenya', 'presidential', 'democracy', 'democratic party', 'governor']","['As President of Nigeria, I won’t appoint past INEC chair as ambassador – Atiku Atiku, who contested the 2023 presidential election under the Peoples Democratic Party (PDP), said the decision raises “serious concerns” and risks being interpreted as a political reward rather than a merit-based appointment. “Let me state without ambiguity: under no circumstance would I, as President of the Federal Republic of Nigeria, nominate the immediate past INEC Chairman for an ambassadorial position,” Atiku wrote in a post on his X account on Thursday. He argued that the nomination “presents terrible optics for an administration already struggling with credibility,” adding that it sends the wrong message to the electoral body. “It risks appearing as a quid pro quo rather than a recognition of merit. It sends the wrong message to the current @inecnigeria leadership; that partisan, compromised, or poorly executed elections may ultimately be rewarded,” he said. Atiku added that it was “morally indefensible” for an electoral umpire at the centre of one of Nigeria’s most disputed elections to become a beneficiary of its outcome. “This is not the path to strengthening our democracy or restoring public trust in our institutions,” he said. Meanwhile, President Tinubu’s nomination', 'Ahiagbah Demands Urgent Action on Stalled Feed Ghana Agenda Political figure Richard Ahiagbah has demanded immediate government action to revive Ghana’s stalled agricultural agenda. He contends that critical delays in the Feed Ghana program are depriving farmers and the national economy of promised benefits. Ahiagbah argued the initiative, designed to enhance food security and provide farmer support, has failed to show meaningful progress. He expressed particular concern over the absence of promised buffer stock systems and market access for local producers. These shortcomings especially impact local rice farmers grappling with post harvest losses, he noted. The situation reportedly undermines confidence in the administration’s flagship strategy and hinders the sector’s potential for job creation and expanded production. Ahiagbah challenged the government to reaffirm its commitment to import substitution. He specifically urged authorities to bolster domestic capacity for rice production. “It would be a feather in the president’s cap to promote our local capacity,” Ahiagbah stated, advocating for political will to support Ghanaian growers over import cartels. He further emphasized that locally produced rice offers superior nutritional value', 'ADC Coalition: Atiku Saved Many Political Actors From Becoming Politically Stranded – Okai Prominent youth advocate and political figure, Comrade Usman Okai Austin, has identified former Vice President and 2023 presidential candidate of the Peoples Democratic Party (PDP), Atiku Abubakar, as a major driving force behind efforts to restore Nigeria’s democratic direction ahead of the 2027 general elections. Okai, a chieftain of the African Democratic Congress (ADC), stated this following a closed-door strategic meeting with Atiku, where discussions centred on the urgent need to build a united and formidable opposition capable of challenging the ruling party. The youth leader described the move to form a broad opposition coalition under the ADC platform as timely, especially in view of the prolonged leadership and structural crises rocking the PDP. According to him, Atiku’s intervention has prevented many political actors from becoming politically stranded as a result of the turmoil within their former party. He said, “Today, we are no longer at the mercy of those bent on destroying the PDP from within, because a stronger coalition has emerged due to Atiku’s foresight.” Okai argued that without the ADC-driven alliance, opposition voices would have been largely silenced in Ni']"
13,37,13_epstein files_convicted sex_justice department_prosecutors,"['epstein files', 'convicted sex', 'justice department', 'prosecutors', 'sex offender', 'comey', 'clinton', 'white house', 'jeffrey', 'trump']","[""Latest Epstein release shows scope of DOJ probes into Epstein, Maxwell The U.S. Justice Department has released tens of thousands more documents related to Jeffrey Epstein, a tranche that included multiple mentions of President Donald Trump but added little new revelatory information. WASHINGTON — The U.S. Justice Department released tens of thousands more documents related to Jeffrey Epstein, a tranche that included multiple mentions of President Donald Trump but added little new revelatory information to the long-anticipated public file on the late financier and convicted sex offender. President Donald Trump speaks Monday at his Mar-a-Lago club in Palm Beach, Fla. A desk and photographs are pictured July 6, 2019, during a search of Jeffrey Epstein's home in New York. An email that was included in the U.S. Department of Justice release of the Jeffrey Epstein files is photographed Monday. Get local news delivered to your inbox! The U.S. Justice Department has released tens of thousands more documents related to Jeffrey Epstein, a tranche that included multiple mention…"", ""Latest Epstein release shows scope of DOJ probes into Epstein, Maxwell The U.S. Justice Department has released tens of thousands more documents related to Jeffrey Epstein, a tranche that included multiple mentions of President Donald Trump but added little new revelatory information. WASHINGTON — The U.S. Justice Department released tens of thousands more documents related to Jeffrey Epstein, a tranche that included multiple mentions of President Donald Trump but added little new revelatory information to the long-anticipated public file on the late financier and convicted sex offender. President Donald Trump speaks Monday at his Mar-a-Lago club in Palm Beach, Fla. A desk and photographs are pictured July 6, 2019, during a search of Jeffrey Epstein's home in New York. An email that was included in the U.S. Department of Justice release of the Jeffrey Epstein files is photographed Monday. Get local news delivered to your inbox! The U.S. Justice Department has released tens of thousands more documents related to Jeffrey Epstein, a tranche that included multiple mention…"", ""Latest Epstein release shows scope of DOJ probes into Epstein, Maxwell The U.S. Justice Department has released tens of thousands more documents related to Jeffrey Epstein, a tranche that included multiple mentions of President Donald Trump but added little new revelatory information. WASHINGTON — The U.S. Justice Department released tens of thousands more documents related to Jeffrey Epstein, a tranche that included multiple mentions of President Donald Trump but added little new revelatory information to the long-anticipated public file on the late financier and convicted sex offender. President Donald Trump speaks Monday at his Mar-a-Lago club in Palm Beach, Fla. A desk and photographs are pictured July 6, 2019, during a search of Jeffrey Epstein's home in New York. An email that was included in the U.S. Department of Justice release of the Jeffrey Epstein files is photographed Monday. Get local news delivered to your inbox! The U.S. Justice Department has released tens of thousands more documents related to Jeffrey Epstein, a tranche that included multiple mention…""]"
14,36,14_family_family members_gifts_friendships,"['family', 'family members', 'gifts', 'friendships', 'santa', 'parents', 'friends', 'christmas', 'husband', 'siblings']","['Asking Eric: We’ve had a rough year. How do we tell family we want no gifts this holiday? Dear Eric: In a year that has been filled with not-so-great things,( family members being furloughed, health issues, rising costs) how does one tell the family you don’t want any gifts? My husband and I have plenty of things, we don’t need any things or clothing or food. In the past the family members have all planned lists. There are children that will get gifts from Santa but how do we tell the rest of the fairly large family that enough is enough? – Realistic Gift-Giving Dear Gift-Giving: Meet their lists with a list of your own. You can make a list of charities you’d like them to contribute to in lieu of gifts, or a list of gifts that can’t be bought, like quality time or homemade treats. Or your list can have just one item: “we have everything we could want. All we ask for is your continued love and support.” Dear Eric: This is in response to “Walking Seniors,” whose neighbor would turn the sprinkler on them when they walked by his house. I happen to be a lawyer. I would suggest the letter writer bypass the police who are doing nothing, go directly to his state attorney or district attorney’s office and file a complaint of harassment. And I would get a temporary restraining or', 'Asking Eric: Can mom work through tension in son’s relationship with dad so they can celebrate special birthday? Dear Eric: My son is turning 40 on December 22. My husband and I are at a quandary as to how to celebrate him. There have been issues between my husband and him over things from his childhood. We did a special trip for his older brother when he turned 40 and would like to do something special for this son’s 40th as well. Our daughter-in-law has made special plans for him and we are not included. I understand that, but I need some ideas as to how to celebrate this extra special year without rocking the boat. I love my son with all my heart, as I do all my children, and want his 40th birthday to be memorable in a positive way. Any suggestions? – Mom Who Wants to Celebrate Dear Mom: The issues your son and your husband are having may be an obstacle, but they aren’t insurmountable. And the thing that can get them on the path to resolution is the same thing that can get you answers about how to celebrate your son: open communication. It’s not within your purview to try to fix things between them, but you have your own relationship with your son and so I’d encourage you to reach out and tell him what you told me: you want to celebrate him, you know things are difficult, and you’re lookin', 'Asking Eric: After 6 years sober, man is frustrated by his family’s hold on their hurt and distrust Dear Eric: I’ve just turned 40 this past year. The last 15 years I was in a horrible drug addiction. I lied and hurt and did terrible things to a lot of people, especially my family. About eight years ago they officially disowned me. Understandable. I’ve cleaned up and got my act together six years ago. At first, I tried to force my way back into their lives, which all refuted. I lashed out, said horrible things and stopped trying to be in their lives. My mom will stop by on my birthday for 10 minutes or so and drop a card off at Christmas. As for my two older brothers and my father, it’s radio silence. I guess what I’m asking is, what do I do to fix this and fast, as I said I’ve turned 40 this year, my parents are both 70. Time is running out, and I couldn’t imagine living my life without some kind of acceptance from my father. Or knowing he did or does love me. My heart breaks at the thought, but this is a real pickle. How can I fix a problem when the ones I need to fix it with won’t talk to me? Do I just keep ignoring their existence and put on this façade that I don’t care to my wife and 4-year-old son? What picture am I painting to my son, as he’s been guilty by association yo']"
15,30,15_fabric_covers_garment_cotton,"['fabric', 'covers', 'garment', 'cotton', 'luxurious', 'fashion', 'coat', 'bedroom', 'colours', 'feathers']","[""'Luxury' quilted bedspread reduced from £65 'makes my bedroom look expensive' The bedspread has been reduced in price(Image: Dusk ) Finding the perfect finishing touch for the bedroom can be challenging, but sometimes a bedspread is all that's needed to add style and additional warmth. Over at Dusk, there is one bedspread which has been reduced in price and it comes in two colours. The Rome Velvet Greek Matelasse Bedspread is currently available from Dusk for £52, reduced from £65, saving shoppers £13. It also comes in the colour deep pink, but this is for the full price of £65. Dusk says the Rome Velvet Greek Matelasse Bedspread has been designed to add a 'luxurious and inviting finish' to the bedroom, and it features a Greek-inspired matelassé pattern. The velvet-feel fabric creates a 'soft touch', while the intricate quilting enhances its aesthetic, the site says. Shoppers have left rave reviews online The Rome Velvet Greek Matelasse Bedspread, which measures 2.5m x 2.6m, can be styled alone or layered with matching cushion covers. Plus, it is easy to care for, as it can be machine washed at 30 degrees and tumble dried on a low setting - but it is worth noting that it should not be ironed. As an alternative, Dunelm is selling this Helston Quilted Bedsprea"", ""Dusk's white lace-trim spring duvet cover 'looks gorgeous on' and is reduced The Alice Duvet Cover can be easily styled with lots of different themes and hues(Image: Dusk) March signals the arrival of spring and, gradually, the days are growing longer and brighter. Households anticipating the arrival of milder weather can help usher spring indoors with fresh décor choices. A straightforward method to revitalise a bedroom is to update the bedding which breathes new life into the space. Dusk remains a favourite destination for those seeking to refresh their homeware and the retailer frequently runs promotions and special offers. Currently, the brand is offering 15% off this Alice Duvet Cover when customers apply the code EXTRA15 during checkout. Typically retailing between £55 and £65, the promotional code reduces the cost to between £46.75 and £55.25. The Alice Duvet Cover comes in double, king and super king sizes and boasts a 200 thread count. It's worth noting that pillowcases aren't included and must be purchased separately, starting from £15 for one, for example. Dusk's Alice Duvet Cover is white and features an intricate lace, scalloped trim for a period aesthetic. The retailer describes the cover as 'soft, breathable, and effortlessly stylish', report"", ""Dusk's white lace-trim spring duvet cover 'looks gorgeous on' and is reduced This elegant lace-trim duvet from Dusk is perfect for spring (Image: Dusk) March signals the arrival of spring and, gradually, the days are growing longer and brighter. Households anticipating the arrival of milder weather can usher spring indoors through fresh décor choices. A straightforward method to revitalise a bedroom is to update the bedding, which breathes new life into the space. Dusk remains a favourite destination for those seeking to refresh their homeware and the retailer frequently runs promotions and special offers. Currently, the brand is offering 15% off this Alice Duvet Cover when customers apply the code EXTRA15 during checkout. Typically retailing between £55 and £65, the promotional code reduces the cost to between £46.75 and £55.25. The Alice Duvet Cover comes in double, king and super king sizes and boasts a 200 thread count. It's worth noting that pillowcases aren't included and must be purchased separately, starting from £15 for one, for example. Dusk's Alice Duvet Cover is white and features an intricate lace, scalloped trim for a period aesthetic. The retailer describes the cover as 'soft, breathable, and effortlessly stylish', reports the Daily Record. T""]"
16,27,16_baseball_inning_spring training_pittsburgh,"['baseball', 'inning', 'spring training', 'pittsburgh', 'nationals', 'rbi', 'pitches', 'sports hall', 'league season', 'runners']","['Pittsburgh Pirates capture 8-3 exhibition victory over Toronto Blue Jays BRADENTON — Oneil Cruz and Spencer Horwitz homered to lead the Pittsburgh Pirates to an 8-3 win over the Toronto Blue Jays in spring-training action Saturday. Horwitz belted a solo homer against his former team off Toronto starter Kevin Gausman in the fourth inning. Cruz added a two-run shot in the sixth for Pittsburgh (16-11). Gausman, tabbed as Toronto’s opening-day starter, went five innings. He allowed six hits and three earned runs while fanning two and walking three. Shortstop Andres Giminez, who was a member of Venezuela’s World Baseball Classic-winning team. had two hits in three plate appearances for Toronto (11-13). He also scored a run.', ""Pittsburgh Pirates capture 8-3 exhibition victory over Toronto Blue Jays BRADENTON - Oneil Cruz and Spencer Horwitz homered to lead the Pittsburgh Pirates to an 8-3 win over the Toronto Blue Jays in spring-training action Saturday. Horwitz belted a solo homer against his former team off Toronto starter Kevin Gausman in the fourth inning. Cruz added a two-run shot in the sixth for Pittsburgh (16-11). Gausman, tabbed as Toronto's opening-day starter, went five innings. He allowed six hits and three earned runs while fanning two and walking three. Shortstop Andres Giminez, who was a member of Venezuela's World Baseball Classic-winning team. had two hits in three plate appearances for Toronto (11-13). He also scored a run. Also on Saturday, Toronto manager John Schneider told reporters the team's five starting pitchers will be Gausman, Dylan Cease, Eric Lauer, Cody Ponce and Max Scherzer, in that order. That means Gausman, Cease and Lauer will go the mound when Toronto opens its season Friday against the Athletics at Rogers Centre. Ponce and Scherzer would then start against the Colorado Rockies. This report by The Canadian Press was first published March 21, 2026. The Canadian Press If you're interested in submitting a Letter to the Editor, click here. We'"", 'Pittsburgh Pirates capture 8-3 exhibition victory over Toronto Blue Jays Toronto Blue Jays’ Kevin Gausman (34) pitches to Canada during the first inning of an exhibition baseball game Tuesday, March 3, 2026, in Dunedin, Fla. (AP Photo/Chris O’Meara) BRADENTON - Oneil Cruz and Spencer Horwitz homered to lead the Pittsburgh Pirates to an 8-3 win over the Toronto Blue Jays in spring-training action Saturday. Horwitz belted a solo homer against his former team off Toronto starter Kevin Gausman in the fourth inning. Cruz added a two-run shot in the sixth for Pittsburgh (16-11). Gausman, tabbed as Toronto’s opening-day starter, went five innings. He allowed six hits and three earned runs while fanning two and walking three. Shortstop Andres Giminez, who was a member of Venezuela’s World Baseball Classic-winning team. had two hits in three plate appearances for Toronto (11-13). He also scored a run. Also on Saturday, Toronto manager John Schneider told reporters the team’s five starting pitchers will be Gausman, Dylan Cease, Eric Lauer, Cody Ponce and Max Scherzer, in that order. That means Gausman, Cease and Lauer will go the mound when Toronto opens its season Friday against the Athletics at Rogers Centre. Ponce and Scherzer would then start against the Colo']"
