Topic,Count,Name,Representation,Representative_Docs
11,51,11_snow_cold weather_winter_driving,"['snow', 'cold weather', 'winter', 'driving', 'weather', 'arctic', 'storms', 'rain', 'temperatures', 'winds']","[""Adopt the 'penguin protocol': Experts give cold-weather safety tips As temperatures drop, the risk of house fires rises. AccuWeather's Geoff Cornish explains why. For big parts of the United States, the past few days have brought lots of snow and lots of cold. Where there's snow and cold, there are slips, falls and ice-related injuries. Ice forms along the shore of Lake Michigan on Jan. 23 in Chicago. A man digs out his car on Beacon Hill following a winter storm that dumped more than a foot of snow across the region Monday in Boston. A woman walks across the campus of the University of Mississippi Monday in Oxford, Miss., following a weekend ice storm. Freezing rain and sleet are responsible for some of the most dangerous driving conditions during the winter. AccuWeather's Anna Azallion offers the best safety tips if driving on ice is unavoidable. A person walks across a street during a winter storm in Philadelphia, Sunday, Jan. 25, 2026. (AP Photo/Matt Rourke) A person jogs at JFK Plaza, also knows as Love Park during a winter storm in Philadelphia, Sunday, Jan. 25, 2026. (AP Photo/Matt Rourke) A worker throws salt onto the pavement to melt ice in downtown Indianapolis, on Sunday, Jan. 25, 2026. (AP Photo/Obed Lamy) Emilia O'Brien, of Michigan, s"", ""Adopt the 'penguin protocol': Experts give cold-weather safety tips As temperatures drop, the risk of house fires rises. AccuWeather's Geoff Cornish explains why. For big parts of the United States, the past few days have brought lots of snow and lots of cold. Where there's snow and cold, there are slips, falls and ice-related injuries. Ice forms along the shore of Lake Michigan on Jan. 23 in Chicago. A man digs out his car on Beacon Hill following a winter storm that dumped more than a foot of snow across the region Monday in Boston. A woman walks across the campus of the University of Mississippi Monday in Oxford, Miss., following a weekend ice storm. Freezing rain and sleet are responsible for some of the most dangerous driving conditions during the winter. AccuWeather's Anna Azallion offers the best safety tips if driving on ice is unavoidable. A person walks across a street during a winter storm in Philadelphia, Sunday, Jan. 25, 2026. (AP Photo/Matt Rourke) A person jogs at JFK Plaza, also knows as Love Park during a winter storm in Philadelphia, Sunday, Jan. 25, 2026. (AP Photo/Matt Rourke) A worker throws salt onto the pavement to melt ice in downtown Indianapolis, on Sunday, Jan. 25, 2026. (AP Photo/Obed Lamy) Emilia O'Brien, of Michigan, s"", ""Adopt the 'penguin protocol': Experts give cold-weather safety tips As temperatures drop, the risk of house fires rises. AccuWeather's Geoff Cornish explains why. For big parts of the United States, the past few days have brought lots of snow and lots of cold. Where there's snow and cold, there are slips, falls and ice-related injuries. Ice forms along the shore of Lake Michigan on Jan. 23 in Chicago. A man digs out his car on Beacon Hill following a winter storm that dumped more than a foot of snow across the region Monday in Boston. A woman walks across the campus of the University of Mississippi Monday in Oxford, Miss., following a weekend ice storm. Freezing rain and sleet are responsible for some of the most dangerous driving conditions during the winter. AccuWeather's Anna Azallion offers the best safety tips if driving on ice is unavoidable. A person walks across a street during a winter storm in Philadelphia, Sunday, Jan. 25, 2026. (AP Photo/Matt Rourke) A person jogs at JFK Plaza, also knows as Love Park during a winter storm in Philadelphia, Sunday, Jan. 25, 2026. (AP Photo/Matt Rourke) A worker throws salt onto the pavement to melt ice in downtown Indianapolis, on Sunday, Jan. 25, 2026. (AP Photo/Obed Lamy) Emilia O'Brien, of Michigan, s""]"
12,41,12_family_gifts_friendships_parents,"['family', 'gifts', 'friendships', 'parents', 'friends', 'christmas', 'husband', 'siblings', 'celebrate', 'grandson']","['Asking Eric: We’ve had a rough year. How do we tell family we want no gifts this holiday? Dear Eric: In a year that has been filled with not-so-great things,( family members being furloughed, health issues, rising costs) how does one tell the family you don’t want any gifts? My husband and I have plenty of things, we don’t need any things or clothing or food. In the past the family members have all planned lists. There are children that will get gifts from Santa but how do we tell the rest of the fairly large family that enough is enough? – Realistic Gift-Giving Dear Gift-Giving: Meet their lists with a list of your own. You can make a list of charities you’d like them to contribute to in lieu of gifts, or a list of gifts that can’t be bought, like quality time or homemade treats. Or your list can have just one item: “we have everything we could want. All we ask for is your continued love and support.” Dear Eric: This is in response to “Walking Seniors,” whose neighbor would turn the sprinkler on them when they walked by his house. I happen to be a lawyer. I would suggest the letter writer bypass the police who are doing nothing, go directly to his state attorney or district attorney’s office and file a complaint of harassment. And I would get a temporary restraining or', 'Asking Eric: Can mom work through tension in son’s relationship with dad so they can celebrate special birthday? Dear Eric: My son is turning 40 on December 22. My husband and I are at a quandary as to how to celebrate him. There have been issues between my husband and him over things from his childhood. We did a special trip for his older brother when he turned 40 and would like to do something special for this son’s 40th as well. Our daughter-in-law has made special plans for him and we are not included. I understand that, but I need some ideas as to how to celebrate this extra special year without rocking the boat. I love my son with all my heart, as I do all my children, and want his 40th birthday to be memorable in a positive way. Any suggestions? – Mom Who Wants to Celebrate Dear Mom: The issues your son and your husband are having may be an obstacle, but they aren’t insurmountable. And the thing that can get them on the path to resolution is the same thing that can get you answers about how to celebrate your son: open communication. It’s not within your purview to try to fix things between them, but you have your own relationship with your son and so I’d encourage you to reach out and tell him what you told me: you want to celebrate him, you know things are difficult, and you’re lookin', 'Asking Eric: After 6 years sober, man is frustrated by his family’s hold on their hurt and distrust Dear Eric: I’ve just turned 40 this past year. The last 15 years I was in a horrible drug addiction. I lied and hurt and did terrible things to a lot of people, especially my family. About eight years ago they officially disowned me. Understandable. I’ve cleaned up and got my act together six years ago. At first, I tried to force my way back into their lives, which all refuted. I lashed out, said horrible things and stopped trying to be in their lives. My mom will stop by on my birthday for 10 minutes or so and drop a card off at Christmas. As for my two older brothers and my father, it’s radio silence. I guess what I’m asking is, what do I do to fix this and fast, as I said I’ve turned 40 this year, my parents are both 70. Time is running out, and I couldn’t imagine living my life without some kind of acceptance from my father. Or knowing he did or does love me. My heart breaks at the thought, but this is a real pickle. How can I fix a problem when the ones I need to fix it with won’t talk to me? Do I just keep ignoring their existence and put on this façade that I don’t care to my wife and 4-year-old son? What picture am I painting to my son, as he’s been guilty by association yo']"
13,34,13_injury_cricket_zealand_world cup,"['injury', 'cricket', 'zealand', 'world cup', 'smith', 'hamstring', 'sidelined', 'england', 'matches', 'bowling']","['In-form England must keep developing to have Six Nations chance, says George By Mitch Phillips England hooker and former captain Jamie George has welcomed the confidence swirling around the team going into the Six Nations but said they cannot expect to win the title by playing the same way as they did to build an 11-match winning streak last year. England last won the tournament in 2020, and their most recent Grand Slam was in 2016, both under Eddie Jones, but they go into their opening match at home to Wales on February 7 with more confidence that they can top the standings than for many years. After narrowly losing their championship opener to Ireland in Dublin almost a year ago, England have chalked up 11 successive wins, including a rare one against New Zealand, and coach Steve Borthwick has built considerable depth in his squad. “We welcome the expectation because it’s a compliment for what we’ve done and what we’ve achieved over a short period of time, but it also keeps us on our toes because we know we can’t be complacent and can’t rely on previous performances,” George said at the Six Nations launch in Edinburgh on Monday. If we’re the same team as we were for the last 11 games, it will not be good enough, so our focus over the next two weeks is to', 'Australia’s Hazlewood unlikely to be fit for half of World Cup, Cummins says Australian fast bowler Josh Hazlewood may not return to action until halfway through the T20 World Cup, injured teammate Pat Cummins said on Tuesday. Hazlewood, arguably the squad’s most important bowler, has struggled with hamstring and Achilles injuries and missed the entire five-Test Ashes series against England. Australia head coach Andrew McDonald said in mid-January Hazlewood was on track to be fit for the squad’s World Cup opener against Ireland on February 11, but Cummins’s update was less optimistic. “I caught up with Joshy a few days ago, and he’s working so hard. I really feel for Joshy. He’s had a few setbacks. [He’s] one of the hardest trainers,” Cummins told Australian broadcaster Nine Network. “He’s doing everything he can. I don’t think he will be there for the start of the tournament, but he’s trying his best to be there about halfway through.” With Mitchell Starc having retired from the format and Cummins sidelined with back problems, Australia head into the February 7 to March 8 World Cup undermanned and in poor form after a 111-run humiliation by Pakistan, which completed a 3-0 series whitewash. Cummins said players’ late arrival to Pakistan after the domestic B', 'Australia’s Hazlewood unlikely to be fit for half of World Cup, Cummins says Australian fast bowler Josh Hazlewood may not return to action until halfway through the T20 World Cup, injured teammate Pat Cummins said on Tuesday. Hazlewood, arguably the squad’s most important bowler, has struggled with hamstring and Achilles injuries and missed the entire five-Test Ashes series against England. Australia head coach Andrew McDonald said in mid-January Hazlewood was on track to be fit for the squad’s World Cup opener against Ireland on February 11, but Cummins’s update was less optimistic. “I caught up with Joshy a few days ago, and he’s working so hard. I really feel for Joshy. He’s had a few setbacks. [He’s] one of the hardest trainers,” Cummins told Australian broadcaster Nine Network. “He’s doing everything he can. I don’t think he will be there for the start of the tournament, but he’s trying his best to be there about halfway through.” With Mitchell Starc having retired from the format and Cummins sidelined with back problems, Australia head into the February 7 to March 8 World Cup undermanned and in poor form after a 111-run humiliation by Pakistan, which completed a 3-0 series whitewash. Cummins said players’ late arrival to Pakistan after the domestic B']"
14,32,14_inning_baseball_home run_spring training,"['inning', 'baseball', 'home run', 'spring training', 'opening day', 'pitches', 'rbi', 'cardinals', 'cincinnati', 'nationals']","['Pittsburgh Pirates capture 8-3 exhibition victory over Toronto Blue Jays BRADENTON — Oneil Cruz and Spencer Horwitz homered to lead the Pittsburgh Pirates to an 8-3 win over the Toronto Blue Jays in spring-training action Saturday. Horwitz belted a solo homer against his former team off Toronto starter Kevin Gausman in the fourth inning. Cruz added a two-run shot in the sixth for Pittsburgh (16-11). Gausman, tabbed as Toronto’s opening-day starter, went five innings. He allowed six hits and three earned runs while fanning two and walking three. Shortstop Andres Giminez, who was a member of Venezuela’s World Baseball Classic-winning team. had two hits in three plate appearances for Toronto (11-13). He also scored a run.', ""Pittsburgh Pirates capture 8-3 exhibition victory over Toronto Blue Jays BRADENTON - Oneil Cruz and Spencer Horwitz homered to lead the Pittsburgh Pirates to an 8-3 win over the Toronto Blue Jays in spring-training action Saturday. Horwitz belted a solo homer against his former team off Toronto starter Kevin Gausman in the fourth inning. Cruz added a two-run shot in the sixth for Pittsburgh (16-11). Gausman, tabbed as Toronto's opening-day starter, went five innings. He allowed six hits and three earned runs while fanning two and walking three. Shortstop Andres Giminez, who was a member of Venezuela's World Baseball Classic-winning team. had two hits in three plate appearances for Toronto (11-13). He also scored a run. Also on Saturday, Toronto manager John Schneider told reporters the team's five starting pitchers will be Gausman, Dylan Cease, Eric Lauer, Cody Ponce and Max Scherzer, in that order. That means Gausman, Cease and Lauer will go the mound when Toronto opens its season Friday against the Athletics at Rogers Centre. Ponce and Scherzer would then start against the Colorado Rockies. This report by The Canadian Press was first published March 21, 2026. The Canadian Press If you're interested in submitting a Letter to the Editor, click here. We'"", 'Pittsburgh Pirates capture 8-3 exhibition victory over Toronto Blue Jays Toronto Blue Jays’ Kevin Gausman (34) pitches to Canada during the first inning of an exhibition baseball game Tuesday, March 3, 2026, in Dunedin, Fla. (AP Photo/Chris O’Meara) BRADENTON - Oneil Cruz and Spencer Horwitz homered to lead the Pittsburgh Pirates to an 8-3 win over the Toronto Blue Jays in spring-training action Saturday. Horwitz belted a solo homer against his former team off Toronto starter Kevin Gausman in the fourth inning. Cruz added a two-run shot in the sixth for Pittsburgh (16-11). Gausman, tabbed as Toronto’s opening-day starter, went five innings. He allowed six hits and three earned runs while fanning two and walking three. Shortstop Andres Giminez, who was a member of Venezuela’s World Baseball Classic-winning team. had two hits in three plate appearances for Toronto (11-13). He also scored a run. Also on Saturday, Toronto manager John Schneider told reporters the team’s five starting pitchers will be Gausman, Dylan Cease, Eric Lauer, Cody Ponce and Max Scherzer, in that order. That means Gausman, Cease and Lauer will go the mound when Toronto opens its season Friday against the Athletics at Rogers Centre. Ponce and Scherzer would then start against the Colo']"
15,32,15_icc_ipl_cricket_opening match,"['icc', 'ipl', 'cricket', 'opening match', 'rahul', 'ranveer singh', 'rs crore', 'innings', 'india', 'patel']","['Mumbai Indians Fall Short Against RCB in High-Scoring IPL Clash Mumbai (Maharashtra) [India], April 13: Following an 18-run defeat to Royal Challengers Bengaluru (RCB) in an Indian Premier League (IPL) 2026 match, Mumbai Indians (MI) captain Hardik Pandya expressed concerns over the team\'s defensive performance, stating they ""conceded far too many runs."" The match, held at Wankhede Stadium, saw a staggering total of 462 runs scored by both teams. After winning the toss and choosing to bowl first, MI allowed RCB to amass 240 runs for the loss of four wickets in their 20 overs, with notable contributions from Phil Salt, Virat Kohli, and Rajat Patidar. In the post-match presentation, Pandya highlighted the need for MI to reassess their strategies, particularly in the powerplay, as they have been struggling to keep pace in both batting and bowling. He emphasized the importance of reflection and exploring new options to regain their momentum. “We have been conceding too many runs lately. As a bowling and batting unit, we are always playing catch-up. We need to reflect on our performance and find ways to regain momentum. It’s crucial to perform well in the powerplay,” Pandya remarked. While chasing a target of 241, MI started strong with Rohit Sharma', 'Royal Challengers Bengaluru IPL 2026 Schedule: Full Fixtures, Opening Match Details, Squad And Key Encounters RCB will begin their IPL 2026 campaign against Sunrisers Hyderabad in the tournament opener on March 28 at the M Chinnaswamy Stadium in Bengaluru. Last season, Royal Challengers Bengaluru (RCB) had the honour of playing the IPL opener. This year, they return to the spotlight once again, but this time as the defending champions. The Bengaluru-based franchise enjoyed a memorable IPL 2025 campaign. RCB finished second on the points table, winning nine of their 14 league matches while losing four. Carrying that momentum into the playoffs, they defeated Punjab Kings twice (first in the qualifier and then again in the final) to lift their maiden IPL title. The opening fixture will also mark cricket’s return to the iconic Chinnaswamy Stadium after the tragic Bengaluru stampede, which resulted in the deaths of 11 people and left several others injured. The upcoming match will therefore carry added emotional significance for fans in the city. With IPL 2026 set to begin on March 28, RCB will be eager to start their title defence strongly in front of their home supporters. Here’s a look at Royal Challengers Bengaluru’s schedule for IPL 2026. (Phase 1 Schedule) March 28: RCB vs SRH (Bengaluru)', 'BCCI announces Rs 51 crore reward as India’s women clinch maiden World Cup New Delhi, Nov 3: In a watershed moment for Indian cricket, the national women’s team etched their name in history by winning their first-ever ICC Women’s World Cup title, defeating South Africa by 52 runs in a pulsating final at the DY Patil Stadium on Sunday night. Celebrations erupted across the country as BCCI Secretary Devajit Saikia reportedly announced a Rs 51 crore reward for the players and support staff, hailing the victory as a “monumental achievement that will take Indian women’s cricket to a new level.” Meanwhile, IPL chairman Arun Dhumal lauded the team’s historic feat, drawing parallels with India’s iconic 1983 men’s World Cup triumph. “It’s a red-letter day for Indian women’s cricket. What the men’s team achieved in 1983, the Indian women have recreated today in Mumbai. This historic triumph will give a tremendous boost to women’s cricket in the country, and I’m confident our game will now reach new heights,” Dhumal said. Earlier, batting first, India posted a commanding 298/7, powered by Shafali Verma’s fluent 87, Deepti Sharma’s composed 58, and valuable contributions from Smriti Mandhana (45) and Richa Ghosh (34). A solid 100-run opening stand between Mandhana an']"
16,30,16_cultural events_tourism_world cup_olympics,"['cultural events', 'tourism', 'world cup', 'olympics', 'events', 'sports', 'concerts', 'festivals', 'olympic', 'fifa world']","['Sporting And Cultural Events Boost Travel Intentions For 2026 Photo Credit: Deposit Photos Thirty-four percent of American travelers say they are likely to take an overnight trip to attend a sporting event in 2026. Twenty percent plan to attend a FIFA World Cup match, and 52% intend to travel overnight for cultural events such as concerts and festivals. Meanwhile, 47% are interested in touring Route 66 during its 100th anniversary year. These figures highlight a shift for the coming year where travel decisions are increasingly driven by events rather than relaxation. In 2026, Americans are choosing what to attend, not just where to go. The latest Longwoods International study shows that milestone celebrations and global competitions are now major motivators for travel. The calendar is driving demand. “Special events such as the FIFA World Cup, America 250 and the 100th anniversary of Route 66 will all motivate U.S. travel this year,” said Amir Eylon, President and CEO of Longwoods International. The industry has emphasized experience-based travel, but 2026 denotes a more specific trend. Events offer deadlines, shared participation, and reasons to plan trips in advance. The FIFA World Cup brings global visibility and international visitors. Am', 'Sporting And Cultural Events Boost Travel Intentions For 2026 Photo Credit: Deposit Photos Thirty-four percent of American travelers say they are likely to take an overnight trip to attend a sporting event in 2026. Twenty percent plan to attend a FIFA World Cup match, and 52% intend to travel overnight for cultural events such as concerts and festivals. Meanwhile, 47% are interested in touring Route 66 during its 100th anniversary year. These figures highlight a shift for the coming year where travel decisions are increasingly driven by events rather than relaxation. In 2026, Americans are choosing what to attend, not just where to go. The latest Longwoods International study shows that milestone celebrations and global competitions are now major motivators for travel. The calendar is driving demand. “Special events such as the FIFA World Cup, America 250 and the 100th anniversary of Route 66 will all motivate U.S. travel this year,” said Amir Eylon, President and CEO of Longwoods International. The industry has emphasized experience-based travel, but 2026 denotes a more specific trend. Events offer deadlines, shared participation, and reasons to plan trips in advance. The FIFA World Cup brings global visibility and international visitors. Am', 'Sporting And Cultural Events Boost Travel Intentions For 2026 Photo Credit: Deposit Photos Thirty-four percent of American travelers say they are likely to take an overnight trip to attend a sporting event in 2026. Twenty percent plan to attend a FIFA World Cup match, and 52% intend to travel overnight for cultural events such as concerts and festivals. Meanwhile, 47% are interested in touring Route 66 during its 100th anniversary year. These figures highlight a shift for the coming year where travel decisions are increasingly driven by events rather than relaxation. In 2026, Americans are choosing what to attend, not just where to go. The latest Longwoods International study shows that milestone celebrations and global competitions are now major motivators for travel. The calendar is driving demand. “Special events such as the FIFA World Cup, America 250 and the 100th anniversary of Route 66 will all motivate U.S. travel this year,” said Amir Eylon, President and CEO of Longwoods International. The industry has emphasized experience-based travel, but 2026 denotes a more specific trend. Events offer deadlines, shared participation, and reasons to plan trips in advance. The FIFA World Cup brings global visibility and international visitors. Am']"
