Topic,Count,Name,Representation,Representative_Docs
23,21,23_shah_hindi_singh_arjun,"['shah', 'hindi', 'singh', 'arjun', 'tamil', 'dhurandhar', 'cinema', 'yadav', 'actor', 'upcoming film']","['Jack Whitehall’s Victoria Beckham Swipe Reignites Brooklyn Wedding Drama Before Big Day The teaser of Ramayana is finally here, showcasing Ranbir Kapoor as Rama in a powerful new avatar. Released on Hanuman Jayanti, the glimpse promises massive scale, drawing comparisons to RRR. Directed by Nitesh Tiwari, the film features Sai Pallavi and Yash in key roles. With music by A. R. Rahman and Hans Zimmer, this epic aims to redefine Indian cinema globally. Amid the massive success of Dhurandhar 2, casting director Mukesh Chhabra has sparked fresh debate by revealing the film’s most satisfying casting choice—and it’s neither Ranveer Singh nor Akshaye Khanna. His insight shifts the spotlight onto a performance that quietly stole the film, proving that sometimes the real star isn’t the biggest name, but the most impactful presence on screen. A controversy has erupted after an “unflattering” photo of White House Press Secretary Karoline Leavitt was reportedly removed from major photo archives, sparking debate over media control and public transparency. The image, captured during an official White House press briefing, showed Leavitt smiling while holding her son, with a turkey named “Waddle” also in the frame. What appeared to be a simple moment quickly went viral due to the lo', 'OG ‘Ramba Ho Ho Ho’ girl Kalpana Iyer recreates iconic dance at Family wedding in new Dhurandhar song, video goes viral Veteran actress Kalpana Iyer, famously known as the OG ""Ramba Ho"" girl, has gone viral for recreating her iconic dance at a family wedding. Trending Photos New Delhi: Veteran actor and dancer Kalpana Iyer, who featured in the iconic song Ramba Ho Ho Ho sung by Usha Uthup and composed by Bappi Lahiri, has recreated her famous dance in a new video from a family wedding that is now going viral and leaving fans nostalgic. The Ramba Ho Ho Ho song was originally picturised on Kalpana Iyer in the 1981 film Armaan. Sharing the clip online, Kalpana expressed her gratitude in the caption, writing, “Grateful for all the love, kindness and blessings to each one of you forever.” Add Zee News as a Preferred Source The OG Kalpana Iyer dancing to Ramba Ho. Pure joy. pic.twitter.com/q8yYEstKJv — CinemaRare (@CinemaRareIN) January 30, 2026 In the video, Kalpana is seen performing during the wedding celebrations, draped in a purple silk sari paired with a black-and-gold blouse. She gracefully recreates the signature steps from Ramba Ho Ho Ho as the audience cheers for her. The track has once again found love among the younger generation. It recently gained renewed attention after being referenced in', 'Not Shah Rukh Khan or Salman Khan! French President Emmanuel Macron reveals his favourite Bollywood actor during India visit French President Emmanuel Macron revealed his favourite Bollywood actor during his state visit to India. Trending Photos New Delhi: French President Emmanuel Macron, who was recently on an official visit to India, opened up about his favourite Bollywood actor. His warm interaction with Indian film personalities during the trip also grabbed headlines and won hearts on social media. Emmanuel Macron Reveals His Favourite Bollywood Actor During an interaction with Brut India, President Macron was asked to name his favourite Bollywood star. Without hesitation, he responded with a smile, saying, “I mean, yesterday I mentioned Jai Ho, so I would say Anil Kapoor.” Add Zee News as a Preferred Source Earlier this week, Macron took to Instagram to share pictures from his meeting with several Bollywood celebrities. He captioned the post in French: “Aux côtés de légendes du cinéma indien. La culture nous rassemble,” which translates to, “Alongside legends of Indian cinema. Culture unites us.” The first photograph showed President Macron and First Lady Brigitte Macron posing with Manoj Bajpayee, Anil Kapoor, Zoya Akhtar, Richa Chadha, Shabana Azmi, Ricky Kej, and others. Another image captured t']"
24,20,24_bets_premium_prizes_betting,"['bets', 'premium', 'prizes', 'betting', 'uk', 'casino', 'jackpot', 'odds', 'slots', 'partnership']","['Three lucky winners scoop £100,000 in Premium Bonds prize draw Leisure Lifestyle Norfolk Three people from Norfolk won an incredible £100,000 in this month\'s Premium Bonds prize draw. But they were not the only people to get lucky. A total of 342 people across the county scooped a share of £1,134,000, averaging £3,325 each. Three others bagged £50,000 and eight won £25,000. Nine people won £10,000, 19 won £5,000 and hundreds more received £1,000. Last month, 369 people won a share of £1,919,000 - with £1,000,000 going to just one person. Premium Bonds are an investment product from National Savings & Investments (NS&I). Unlike other investments, where investors earn interest or a regular dividend income, bonds are entered into a monthly prize draw where people can win between £25 and £1m. Andrew Westhead, NS&I retail director, said: ""The quickest way to check if you have won a prize is to use our Premium Bonds prize checker app, check online, or even ask Alexa from the second working day of each month onwards.""', 'AGS Interactive Expands Its UK Presence with bet365 Partnership LAS VEGAS, Dec. 05, 2025 (GLOBE NEWSWIRE) -- AGS Interactive (AGSi) has solidified its presence across the pond, taking a selection of its best-performing games live in the UK with bet365. This announcement further cements AGS\' partnership with bet365 building on existing collaborations in the United States, Canada, and Latin America. bet365\'s established UK market position and diverse global presence make them a logical strategic partner to support AGS\' global growth initiatives throughout Europe and beyond. At the time of launch, bet365 players across the UK will have access to more than 20 popular game titles from AGS\' interactive content library. Notable titles include: ""We\'ve worked closely with bet365 for years and extending our partnership to the UK is an important milestone for AGS,"" said Zoe Ebling, Vice President of Interactive at AGS. ""It not only reflects the strength of our relationship, but the growing global appeal and potential of our increasingly diverse portfolio of high-performing online slot content. This is a clear sign of where AGS is headed — broader reach, more markets, and a rapidly expanding international footprint."" ""We\'re delighted to welcome a selection', ""AGS Interactive Expands Its UK Presence with bet365 Partnership LAS VEGAS, Dec. 05, 2025 (GLOBE NEWSWIRE) -- AGS Interactive (AGSi) has solidified its presence across the pond, taking a selection of its best-performing games live in the UK with bet365. This announcement further cements AGS’ partnership with bet365 building on existing collaborations in the United States, Canada, and Latin America. bet365’s established UK market position and diverse global presence make them a logical strategic partner to support AGS’ global growth initiatives throughout Europe and beyond. At the time of launch, bet365 players across the UK will have access to more than 20 popular game titles from AGS' interactive content library. Notable titles include: “We’ve worked closely with bet365 for years and extending our partnership to the UK is an important milestone for AGS,” said Zoe Ebling, Vice President of Interactive at AGS. “It not only reflects the strength of our relationship, but the growing global appeal and potential of our increasingly diverse portfolio of high-performing online slot content. This is a clear sign of where AGS is headed — broader reach, more markets, and a rapidly expanding international footprint.” “We’re delighted to welcome a selection""]"
25,19,25_nhl_hockey_scoring_devils,"['nhl', 'hockey', 'scoring', 'devils', 'goal', 'second period', 'newark', 'buffalo', 'ottawa', 'quinn']","['Buium, Demko lead Canucks to 2-1 win over Devils as post-Hughes era begins Published 12:10 pm Sunday, December 14, 2025 By Philip Wolf Vancouver Canucks defenceman Zeeb Buium, in NHL action Sunday, Dec. 25, 2025 against the New Jersey Devils at the Prudential Center in Newark, N.J. ( photo) Zeev Buium had a goal and an assist in his Vancouver Canucks debut, leading his new team to a 2-1 win over the host New Jersey Devils in NHL action Sunday afternoon at the Prudential Center in Newark, N.J. Buium, along with Marco Rossi and Liam Ohgren, were picked up by the Canucks in a blockbuster trade for Vancouver captain Quinn Hughes on Friday. Jake DeBrusk had the other goal for the Canucks (12-17-3), with Thatcher Demko sharp in making 25 saves for the goaltending win. Quinn’s brother Luke Hughes scored for the Devils (18-14-1). Former Canuck Jacob Markstrom stopped 13 of 15 shots and took the loss in goal. DeBrusk opened the scoring just 61 seconds into the game on the power play, knocking home his own rebound in front of Markstrom. It was DeBrusk’s first goal in 11 games and ninth of the season. Eight of those have come with the man advantage. Buium made it 2-0 at 6:48, when he flipped the puck toward the net and it banked in off a Devils defender. Buium now h', 'Buium, Demko lead Canucks to 2-1 win over Devils as post-Hughes era begins Published 12:10 pm Sunday, December 14, 2025 By Philip Wolf Vancouver Canucks defenceman Zeeb Buium, in NHL action Sunday, Dec. 25, 2025 against the New Jersey Devils at the Prudential Center in Newark, N.J. ( photo) Zeev Buium had a goal and an assist in his Vancouver Canucks debut, leading his new team to a 2-1 win over the host New Jersey Devils in NHL action Sunday afternoon at the Prudential Center in Newark, N.J. Buium, along with Marco Rossi and Liam Ohgren, were picked up by the Canucks in a blockbuster trade for Vancouver captain Quinn Hughes on Friday. Jake DeBrusk had the other goal for the Canucks (12-17-3), with Thatcher Demko sharp in making 25 saves for the goaltending win. Quinn’s brother Luke Hughes scored for the Devils (18-14-1). Former Canuck Jacob Markstrom stopped 13 of 15 shots and took the loss in goal. DeBrusk opened the scoring just 61 seconds into the game on the power play, knocking home his own rebound in front of Markstrom. It was DeBrusk’s first goal in 11 games and ninth of the season. Eight of those have come with the man advantage. Buium made it 2-0 at 6:48, when he flipped the puck toward the net and it banked in off a Devils defender. Buium now h', 'Buium, Demko lead Canucks to 2-1 win over Devils as post-Hughes era begins Published 12:10 pm Sunday, December 14, 2025 By Philip Wolf Vancouver Canucks defenceman Zeeb Buium, in NHL action Sunday, Dec. 25, 2025 against the New Jersey Devils at the Prudential Center in Newark, N.J. ( photo) Zeev Buium had a goal and an assist in his Vancouver Canucks debut, leading his new team to a 2-1 win over the host New Jersey Devils in NHL action Sunday afternoon at the Prudential Center in Newark, N.J. Buium, along with Marco Rossi and Liam Ohgren, were picked up by the Canucks in a blockbuster trade for Vancouver captain Quinn Hughes on Friday. Jake DeBrusk had the other goal for the Canucks (12-17-3), with Thatcher Demko sharp in making 25 saves for the goaltending win. Quinn’s brother Luke Hughes scored for the Devils (18-14-1). Former Canuck Jacob Markstrom stopped 13 of 15 shots and took the loss in goal. DeBrusk opened the scoring just 61 seconds into the game on the power play, knocking home his own rebound in front of Markstrom. It was DeBrusk’s first goal in 11 games and ninth of the season. Eight of those have come with the man advantage. Buium made it 2-0 at 6:48, when he flipped the puck toward the net and it banked in off a Devils defender. Buium now h']"
26,19,26_winter olympics_ice hockey_olympics_olympic,"['winter olympics', 'ice hockey', 'olympics', 'olympic', 'curling', 'women team', 'athletes', 'medal', 'opening ceremony', 'podium']","['Team USA Women’s Ice Hockey: How to Watch the 2026 Winter Olympics Event Live Online for Free If you purchase an independently reviewed product or service through a link on our website, The Hollywood Reporter may receive an affiliate commission. The 2026 Winter Olympics officially starts on Friday, Feb. 6 with the opening ceremony in Milano Cortina, Italy. However, there are a few events, like curling, that start early for group play, preliminaries and qualifying rounds. Countries, like Sweden, Germany, France, Italy, United States and others, compete in Women’s Ice Hockey to start the medal tournament. In addition, this is the first Winter Olympics featuring pro players from the PWHL (Professional Women’s Hockey League) participating in the games. Starting on Wednesday, Feb. 4, women’s ice hockey (preliminary rounds and group play) starts at 3:10 a.m. PT/6:10 a.m. ET and broadcasts on NBC, USA Network and CNBC, as well as livestream on Peacock. Related Stories TV How to Watch Chloe Kim Snowboarding at the 2026 Winter Olympics in Milan Live Online for Free TV How to Watch the 2026 Winter Olympics Live Online At a Glance: How to Watch 2026 Women’s Ice Hockey at the Winter Olympics Online The simplest way to watch Winter Olympics Women’s Ice Hockey without cable is by signing', 'U.S. Women’s Hockey Team declines Trump invite to State of the Union The U.S. Women’s Hockey Team declined an invite to President Donald Trump‘s State of the Union address on Monday, shortly after a clip of Trump making light of the women’s team made the rounds. Both American squads won gold at the 2026 Winter Olympics in Milan, taking down the Canadian team in their respective finals. On Sunday, Trump invited the men’s team to his annual speech and joked about the inclusion of the women’s team. “I must tell you, we’re going to have to bring the women’s team, you do know that,” Trump said, adding that he “probably would be impeached” if he didn’t. Everything about this is so genuinely gross but the “I guess I have to invite the women’s team too or else I’ll get impeached” is fucking crazy. Britta Curl is that your boy? Abbey Murphy you cool with this? pic.twitter.com/dTgpBF7hda — Maya🇵🇸🇱🇧 (@ilyasamsHOEnov) February 23, 2026 Related Trump celebrated the men’s hockey win on social media, lauding the team on Truth Social after their overtime victory. “Congratulations to our great U.S.A. Ice Hockey team. THEY WON THE GOLD. WOW!” he wrote. When the women’s team won just days earlier, Trump remained silent. Start your day with essential news from Salon. S', 'U.S. Women’s Hockey Team declines Trump invite to State of the Union The U.S. Women’s Hockey Team declined an invite to President Donald Trump‘s State of the Union address on Monday, shortly after a clip of Trump making light of the women’s team made the rounds. Both American squads won gold at the 2026 Winter Olympics in Milan, taking down the Canadian team in their respective finals. On Sunday, Trump invited the men’s team to his annual speech and joked about the inclusion of the women’s team. “I must tell you, we’re going to have to bring the women’s team, you do know that,” Trump said, adding that he “probably would be impeached” if he didn’t. Trump celebrated the men’s hockey win on social media, lauding the team on Truth Social after their overtime victory. “Congratulations to our great U.S.A. Ice Hockey team. THEY WON THE GOLD. WOW!” he wrote. When the women’s team won just days earlier, Trump remained silent. Start your day with essential news from Salon. Sign up for our free morning newsletter, Crash Course. On Monday, the women’s team shared in a statement that they would not be attending the State of the Union. The statement made no mention of Trump’s comments, citing “academic and professional commitments” for the athletes’ decision. “We']"
27,19,27_garden_village_guests_accommodation,"['garden', 'village', 'guests', 'accommodation', 'wales', 'car park', 'landscape', 'vale', 'acre', 'hotel']","['Attract bees and butterflies to garden with ‘superplant’ bursting with nectar-rich flowers Gardeners can attract bees and butterflies into their outdoor spaces with a nectar-rich ""superplant"" beloved by wildlife. As spring continues to unfold, green-fingered readers will be heading outdoors to tend to their gardens—made all the more rewarding when wildlife appears to enjoy the results. Pollinators like bees and butterflies play a crucial role in our ecosystem, supporting the growth of plants, fruit and vegetables. They\'re also synonymous with summer and a joy to watch as they flit from flower to flower. The Royal Horticultural Society (RHS) has named a ""striking and versatile"" wildflower that can help tempt these valuable insects into your own garden, calling it a ""top plant we can all grow to support biodiversity"". We use your sign-up to provide content in ways you\'ve consented to and to improve our understanding of you. This may include adverts from us and 3rd parties based on our understanding. You can unsubscribe at any time. Read our Privacy Policy READ MORE: UK gardeners urged not to make simple mistake over next two weeks READ MORE: Households urged to scatter sweetcorn on garden tables and lawns in spring In a recent piece about the so-called ""superplant"", Olivia', ""'Slice of heaven' holiday let with breathtaking views and a hot tub is a 'hidden gem' Visitors love the views from the Dreamcatcher Wagon(Image: Holiday Cottages) We might have found the ideal glamping break solution for those looking to get away from it all and be surrounded by nature. The Dreamcatcher Wagon is nestled in the village of Craswall, close to the border with Wales and enveloped by the dramatic landscape of the Black Mountains. The setting provides an ideal mix of tranquillity and chances to explore. Village shops with local produce and a traditional pub are within easy walking distance. Close to Hay‐on‐Wye, on the fringes of the Brecon Beacons National Park, the accommodation boasts stunning vistas across the surrounding countryside, allowing guests to feel truly connected with nature. It also has a private hot tub among its creature comforts. March availability for a seven-night break is currently priced at £488, down from £537 and there is still some availability through spring and summer. Perfect for two guests, the secluded off-grid retreat sits within a tranquil 17-acre farm that's home to horses, donkeys and chickens. The wagon boasts an attractive arched roof and carefully crafted interiors, delivering a warm yet elegant ambience. Within, visito"", ""'Hidden gem' holiday let with breathtaking views and a hot tub is a 'slice of heaven' The cosy interior of the Dreamcatcher Wagon (Image: Holiday Cottages) We might have found the ideal glamping break solution for those looking to get away from it all and be surrounded by nature. The Dreamcatcher Wagon is nestled in the village of Craswall, close to the border with Wales and enveloped by the dramatic landscape of the Black Mountains. The setting provides an ideal mix of tranquillity and chances to explore. Village shops with local produce and a traditional pub are within easy walking distance. Close to Hay‐on‐Wye, on the fringes of the Brecon Beacons National Park, the accommodation boasts stunning views across the surrounding countryside, allowing guests to feel truly connected with nature. It also has a private hot tub among a number of creature comforts. March availability for a seven-night break is currently priced at £488, down from £537, and there is still some availability through spring and summer at the time of writing. Perfect for two guests, the secluded off-grid retreat sits within a tranquil 17-acre farm that's home to horses, donkeys and chickens. The wagon boasts an attractive arched roof and carefully crafted interiors, delivering a warm yet elegant""]"
28,18,28_cultural events_tourism_world cup_events,"['cultural events', 'tourism', 'world cup', 'events', 'touring', 'concerts', 'festivals', 'fifa world', 'sporting', 'attend']","['Sporting And Cultural Events Boost Travel Intentions For 2026 Photo Credit: Deposit Photos Thirty-four percent of American travelers say they are likely to take an overnight trip to attend a sporting event in 2026. Twenty percent plan to attend a FIFA World Cup match, and 52% intend to travel overnight for cultural events such as concerts and festivals. Meanwhile, 47% are interested in touring Route 66 during its 100th anniversary year. These figures highlight a shift for the coming year where travel decisions are increasingly driven by events rather than relaxation. In 2026, Americans are choosing what to attend, not just where to go. The latest Longwoods International study shows that milestone celebrations and global competitions are now major motivators for travel. The calendar is driving demand. “Special events such as the FIFA World Cup, America 250 and the 100th anniversary of Route 66 will all motivate U.S. travel this year,” said Amir Eylon, President and CEO of Longwoods International. The industry has emphasized experience-based travel, but 2026 denotes a more specific trend. Events offer deadlines, shared participation, and reasons to plan trips in advance. The FIFA World Cup brings global visibility and international visitors. Am', 'Sporting And Cultural Events Boost Travel Intentions For 2026 Photo Credit: Deposit Photos Thirty-four percent of American travelers say they are likely to take an overnight trip to attend a sporting event in 2026. Twenty percent plan to attend a FIFA World Cup match, and 52% intend to travel overnight for cultural events such as concerts and festivals. Meanwhile, 47% are interested in touring Route 66 during its 100th anniversary year. These figures highlight a shift for the coming year where travel decisions are increasingly driven by events rather than relaxation. In 2026, Americans are choosing what to attend, not just where to go. The latest Longwoods International study shows that milestone celebrations and global competitions are now major motivators for travel. The calendar is driving demand. “Special events such as the FIFA World Cup, America 250 and the 100th anniversary of Route 66 will all motivate U.S. travel this year,” said Amir Eylon, President and CEO of Longwoods International. The industry has emphasized experience-based travel, but 2026 denotes a more specific trend. Events offer deadlines, shared participation, and reasons to plan trips in advance. The FIFA World Cup brings global visibility and international visitors. Am', 'Sporting And Cultural Events Boost Travel Intentions For 2026 Photo Credit: Deposit Photos Thirty-four percent of American travelers say they are likely to take an overnight trip to attend a sporting event in 2026. Twenty percent plan to attend a FIFA World Cup match, and 52% intend to travel overnight for cultural events such as concerts and festivals. Meanwhile, 47% are interested in touring Route 66 during its 100th anniversary year. These figures highlight a shift for the coming year where travel decisions are increasingly driven by events rather than relaxation. In 2026, Americans are choosing what to attend, not just where to go. The latest Longwoods International study shows that milestone celebrations and global competitions are now major motivators for travel. The calendar is driving demand. “Special events such as the FIFA World Cup, America 250 and the 100th anniversary of Route 66 will all motivate U.S. travel this year,” said Amir Eylon, President and CEO of Longwoods International. The industry has emphasized experience-based travel, but 2026 denotes a more specific trend. Events offer deadlines, shared participation, and reasons to plan trips in advance. The FIFA World Cup brings global visibility and international visitors. Am']"
