Topic,Count,Name,Representation,Representative_Docs
11,46,11_grocery_groceries_retailers_consumers,"['grocery', 'groceries', 'retailers', 'consumers', 'shoppers', 'shopping', 'products', 'restaurants', 'foods', 'appliances']","[""Sam's Club Is Selling a Versatile 12-Drawer Organizer That's a Serial Hobbyist's Dream Come True As a subscriber, you can share up to 3 articles each month with friends for free. Just click “Gift this Article” on this page, then copy the link or enter their email. Gifts are exclusive to subscribers, reset monthly, and each article can be redeemed once. Parade aims to feature only the best products and services. If you buy something via one of our links, we may earn a commission. I'm calling it now: 2026 will be the year of hobbies. Whether you love crafting, building LEGO sets, sewing, painting, putting together puzzles, crocheting or all of the above, there are plenty of different hobbies you can get into this year. Of course, many of these activities require supplies that can easily get scattered about and disorganized (looking at you LEGO bricks). This may lead to more clutter and chaos in the home—something no one wants. That's why before you start a new hobby it can be helpful to think about a storage solution for all of your hobby essentials. Javascript is required for you to be able to read premium content. Please enable it in your browser settings. Log In Keep it Clean. Please avoid obscene, vulgar, lewd, racist or sexually-oriented language. PLEASE TURN OFF YOUR CAPS"", ""Aldi one-ups Costco with massive holiday deal As a subscriber, you can share up to 3 articles each month with friends for free. Just click “Gift this Article” on this page, then copy the link or enter their email. Gifts are exclusive to subscribers, reset monthly, and each article can be redeemed once. In the world of retail, both Aldi and Costco are known for their affordable groceries and household essentials. But while the two have very different business models, they have one thing in common -- loyal customers. There's a reason Costco members are willing to pay $65 a year for a Gold Star membership or $130 a year for an Executive membership. For those who shop at Costco regularly, the annual fee is worth paying if it translates into ongoing savings year-round. Javascript is required for you to be able to read premium content. Please enable it in your browser settings. Thanks for the feedback. Log In Keep it Clean. Please avoid obscene, vulgar, lewd, racist or sexually-oriented language. PLEASE TURN OFF YOUR CAPS LOCK. Don't Threaten. Threats of harming another person will not be tolerated. Be Truthful. Don't knowingly lie about anyone or anything. Be Nice. No racism, sexism or any sort of -ism that is degrading to another"", ""Pepsi adds a new take on cola Coca-Cola does not offer As a subscriber, you can share up to 3 articles each month with friends for free. Just click “Gift this Article” on this page, then copy the link or enter their email. Gifts are exclusive to subscribers, reset monthly, and each article can be redeemed once. It's natural for consumers to want healthier versions of unhealthy things. I, for example, have a sweet tooth and have been ordering from Shameless Snacks, a company that makes gummy candies that are 90 calories a package with only 3 grams of sugar and nearly a full day's worth of fiber. Javascript is required for you to be able to read premium content. Please enable it in your browser settings. Thanks for the feedback. Log In Keep it Clean. Please avoid obscene, vulgar, lewd, racist or sexually-oriented language. PLEASE TURN OFF YOUR CAPS LOCK. Don't Threaten. Threats of harming another person will not be tolerated. Be Truthful. Don't knowingly lie about anyone or anything. Be Nice. No racism, sexism or any sort of -ism that is degrading to another person. Be Proactive. Use the 'Report' link on each comment to let us know of abusive posts. Share with Us. We'd love to hear eyewitness accounts, the history behind an article. This""]"
12,40,12_family_gifts_friendships_santa,"['family', 'gifts', 'friendships', 'santa', 'parents', 'friends', 'christmas', 'siblings', 'celebrate', 'grandson']","['Asking Eric: We’ve had a rough year. How do we tell family we want no gifts this holiday? Dear Eric: In a year that has been filled with not-so-great things,( family members being furloughed, health issues, rising costs) how does one tell the family you don’t want any gifts? My husband and I have plenty of things, we don’t need any things or clothing or food. In the past the family members have all planned lists. There are children that will get gifts from Santa but how do we tell the rest of the fairly large family that enough is enough? – Realistic Gift-Giving Dear Gift-Giving: Meet their lists with a list of your own. You can make a list of charities you’d like them to contribute to in lieu of gifts, or a list of gifts that can’t be bought, like quality time or homemade treats. Or your list can have just one item: “we have everything we could want. All we ask for is your continued love and support.” Dear Eric: This is in response to “Walking Seniors,” whose neighbor would turn the sprinkler on them when they walked by his house. I happen to be a lawyer. I would suggest the letter writer bypass the police who are doing nothing, go directly to his state attorney or district attorney’s office and file a complaint of harassment. And I would get a temporary restraining or', 'Asking Eric: Can mom work through tension in son’s relationship with dad so they can celebrate special birthday? Dear Eric: My son is turning 40 on December 22. My husband and I are at a quandary as to how to celebrate him. There have been issues between my husband and him over things from his childhood. We did a special trip for his older brother when he turned 40 and would like to do something special for this son’s 40th as well. Our daughter-in-law has made special plans for him and we are not included. I understand that, but I need some ideas as to how to celebrate this extra special year without rocking the boat. I love my son with all my heart, as I do all my children, and want his 40th birthday to be memorable in a positive way. Any suggestions? – Mom Who Wants to Celebrate Dear Mom: The issues your son and your husband are having may be an obstacle, but they aren’t insurmountable. And the thing that can get them on the path to resolution is the same thing that can get you answers about how to celebrate your son: open communication. It’s not within your purview to try to fix things between them, but you have your own relationship with your son and so I’d encourage you to reach out and tell him what you told me: you want to celebrate him, you know things are difficult, and you’re lookin', 'Asking Eric: After 6 years sober, man is frustrated by his family’s hold on their hurt and distrust Dear Eric: I’ve just turned 40 this past year. The last 15 years I was in a horrible drug addiction. I lied and hurt and did terrible things to a lot of people, especially my family. About eight years ago they officially disowned me. Understandable. I’ve cleaned up and got my act together six years ago. At first, I tried to force my way back into their lives, which all refuted. I lashed out, said horrible things and stopped trying to be in their lives. My mom will stop by on my birthday for 10 minutes or so and drop a card off at Christmas. As for my two older brothers and my father, it’s radio silence. I guess what I’m asking is, what do I do to fix this and fast, as I said I’ve turned 40 this year, my parents are both 70. Time is running out, and I couldn’t imagine living my life without some kind of acceptance from my father. Or knowing he did or does love me. My heart breaks at the thought, but this is a real pickle. How can I fix a problem when the ones I need to fix it with won’t talk to me? Do I just keep ignoring their existence and put on this façade that I don’t care to my wife and 4-year-old son? What picture am I painting to my son, as he’s been guilty by association yo']"
13,37,13_jeffrey epstein_epstein files_prosecutors_offender jeffrey,"['jeffrey epstein', 'epstein files', 'prosecutors', 'offender jeffrey', 'department justice', 'sex offender', 'comey', 'clinton', 'jeffrey', 'president donald']","[""Latest Epstein release shows scope of DOJ probes into Epstein, Maxwell The U.S. Justice Department has released tens of thousands more documents related to Jeffrey Epstein, a tranche that included multiple mentions of President Donald Trump but added little new revelatory information. WASHINGTON — The U.S. Justice Department released tens of thousands more documents related to Jeffrey Epstein, a tranche that included multiple mentions of President Donald Trump but added little new revelatory information to the long-anticipated public file on the late financier and convicted sex offender. President Donald Trump speaks Monday at his Mar-a-Lago club in Palm Beach, Fla. A desk and photographs are pictured July 6, 2019, during a search of Jeffrey Epstein's home in New York. An email that was included in the U.S. Department of Justice release of the Jeffrey Epstein files is photographed Monday. Get local news delivered to your inbox! The U.S. Justice Department has released tens of thousands more documents related to Jeffrey Epstein, a tranche that included multiple mention…"", ""Latest Epstein release shows scope of DOJ probes into Epstein, Maxwell The U.S. Justice Department has released tens of thousands more documents related to Jeffrey Epstein, a tranche that included multiple mentions of President Donald Trump but added little new revelatory information. WASHINGTON — The U.S. Justice Department released tens of thousands more documents related to Jeffrey Epstein, a tranche that included multiple mentions of President Donald Trump but added little new revelatory information to the long-anticipated public file on the late financier and convicted sex offender. President Donald Trump speaks Monday at his Mar-a-Lago club in Palm Beach, Fla. A desk and photographs are pictured July 6, 2019, during a search of Jeffrey Epstein's home in New York. An email that was included in the U.S. Department of Justice release of the Jeffrey Epstein files is photographed Monday. Get local news delivered to your inbox! The U.S. Justice Department has released tens of thousands more documents related to Jeffrey Epstein, a tranche that included multiple mention…"", ""Latest Epstein release shows scope of DOJ probes into Epstein, Maxwell The U.S. Justice Department has released tens of thousands more documents related to Jeffrey Epstein, a tranche that included multiple mentions of President Donald Trump but added little new revelatory information. WASHINGTON — The U.S. Justice Department released tens of thousands more documents related to Jeffrey Epstein, a tranche that included multiple mentions of President Donald Trump but added little new revelatory information to the long-anticipated public file on the late financier and convicted sex offender. President Donald Trump speaks Monday at his Mar-a-Lago club in Palm Beach, Fla. A desk and photographs are pictured July 6, 2019, during a search of Jeffrey Epstein's home in New York. An email that was included in the U.S. Department of Justice release of the Jeffrey Epstein files is photographed Monday. Get local news delivered to your inbox! The U.S. Justice Department has released tens of thousands more documents related to Jeffrey Epstein, a tranche that included multiple mention…""]"
14,34,14_injury_cricket_zealand_world cup,"['injury', 'cricket', 'zealand', 'world cup', 'smith', 'hamstring', 'sidelined', 'ashes', 'matches', 'bowling']","['In-form England must keep developing to have Six Nations chance, says George By Mitch Phillips England hooker and former captain Jamie George has welcomed the confidence swirling around the team going into the Six Nations but said they cannot expect to win the title by playing the same way as they did to build an 11-match winning streak last year. England last won the tournament in 2020, and their most recent Grand Slam was in 2016, both under Eddie Jones, but they go into their opening match at home to Wales on February 7 with more confidence that they can top the standings than for many years. After narrowly losing their championship opener to Ireland in Dublin almost a year ago, England have chalked up 11 successive wins, including a rare one against New Zealand, and coach Steve Borthwick has built considerable depth in his squad. “We welcome the expectation because it’s a compliment for what we’ve done and what we’ve achieved over a short period of time, but it also keeps us on our toes because we know we can’t be complacent and can’t rely on previous performances,” George said at the Six Nations launch in Edinburgh on Monday. If we’re the same team as we were for the last 11 games, it will not be good enough, so our focus over the next two weeks is to', 'Australia’s Hazlewood unlikely to be fit for half of World Cup, Cummins says Australian fast bowler Josh Hazlewood may not return to action until halfway through the T20 World Cup, injured teammate Pat Cummins said on Tuesday. Hazlewood, arguably the squad’s most important bowler, has struggled with hamstring and Achilles injuries and missed the entire five-Test Ashes series against England. Australia head coach Andrew McDonald said in mid-January Hazlewood was on track to be fit for the squad’s World Cup opener against Ireland on February 11, but Cummins’s update was less optimistic. “I caught up with Joshy a few days ago, and he’s working so hard. I really feel for Joshy. He’s had a few setbacks. [He’s] one of the hardest trainers,” Cummins told Australian broadcaster Nine Network. “He’s doing everything he can. I don’t think he will be there for the start of the tournament, but he’s trying his best to be there about halfway through.” With Mitchell Starc having retired from the format and Cummins sidelined with back problems, Australia head into the February 7 to March 8 World Cup undermanned and in poor form after a 111-run humiliation by Pakistan, which completed a 3-0 series whitewash. Cummins said players’ late arrival to Pakistan after the domestic B', 'Australia’s Hazlewood unlikely to be fit for half of World Cup, Cummins says Australian fast bowler Josh Hazlewood may not return to action until halfway through the T20 World Cup, injured teammate Pat Cummins said on Tuesday. Hazlewood, arguably the squad’s most important bowler, has struggled with hamstring and Achilles injuries and missed the entire five-Test Ashes series against England. Australia head coach Andrew McDonald said in mid-January Hazlewood was on track to be fit for the squad’s World Cup opener against Ireland on February 11, but Cummins’s update was less optimistic. “I caught up with Joshy a few days ago, and he’s working so hard. I really feel for Joshy. He’s had a few setbacks. [He’s] one of the hardest trainers,” Cummins told Australian broadcaster Nine Network. “He’s doing everything he can. I don’t think he will be there for the start of the tournament, but he’s trying his best to be there about halfway through.” With Mitchell Starc having retired from the format and Cummins sidelined with back problems, Australia head into the February 7 to March 8 World Cup undermanned and in poor form after a 111-run humiliation by Pakistan, which completed a 3-0 series whitewash. Cummins said players’ late arrival to Pakistan after the domestic B']"
15,34,15_nigeria_nigerian_electoral_election,"['nigeria', 'nigerian', 'electoral', 'election', 'democratic', 'constituency', 'democracy', 'democratic party', 'governor', 'political parties']","['As President of Nigeria, I won’t appoint past INEC chair as ambassador – Atiku Atiku, who contested the 2023 presidential election under the Peoples Democratic Party (PDP), said the decision raises “serious concerns” and risks being interpreted as a political reward rather than a merit-based appointment. “Let me state without ambiguity: under no circumstance would I, as President of the Federal Republic of Nigeria, nominate the immediate past INEC Chairman for an ambassadorial position,” Atiku wrote in a post on his X account on Thursday. He argued that the nomination “presents terrible optics for an administration already struggling with credibility,” adding that it sends the wrong message to the electoral body. “It risks appearing as a quid pro quo rather than a recognition of merit. It sends the wrong message to the current @inecnigeria leadership; that partisan, compromised, or poorly executed elections may ultimately be rewarded,” he said. Atiku added that it was “morally indefensible” for an electoral umpire at the centre of one of Nigeria’s most disputed elections to become a beneficiary of its outcome. “This is not the path to strengthening our democracy or restoring public trust in our institutions,” he said. Meanwhile, President Tinubu’s nomination', 'Insecurity: Kefas Shuts Down Boarding Schools In Taraba Taraba State Governor, Agbu Kefas, has ordered all secondary schools both public and private to immediately send their boarding students home following heightened security threats across the country. The directive was issued in a statement signed by the State Commissioner for Education, Dr. Augustina Godwin. She stated that the rising wave of insecurity has made boarding students vulnerable to targeted attacks by bandits, citing the recent abductions of schoolgirls in Kebbi and Niger states as worrying indicators. READ ALSO: According to Dr. Godwin, Kefas has now directed that all secondary schools in the state operate strictly as day schools until security conditions improve. School principals and private school owners have been instructed to commence immediate deboarding of students. She explained that the measure is a proactive step to protect students’ lives and prevent potential security incidents amid escalating unrest nationwide. The Taraba State Government assured parents of its commitment to restoring safety and stability. It also pledged stronger collaboration with security agencies to address emerging threats, while urging all school authorities to fully comply with the', 'ADC Coalition: Atiku Saved Many Political Actors From Becoming Politically Stranded – Okai Prominent youth advocate and political figure, Comrade Usman Okai Austin, has identified former Vice President and 2023 presidential candidate of the Peoples Democratic Party (PDP), Atiku Abubakar, as a major driving force behind efforts to restore Nigeria’s democratic direction ahead of the 2027 general elections. Okai, a chieftain of the African Democratic Congress (ADC), stated this following a closed-door strategic meeting with Atiku, where discussions centred on the urgent need to build a united and formidable opposition capable of challenging the ruling party. The youth leader described the move to form a broad opposition coalition under the ADC platform as timely, especially in view of the prolonged leadership and structural crises rocking the PDP. According to him, Atiku’s intervention has prevented many political actors from becoming politically stranded as a result of the turmoil within their former party. He said, “Today, we are no longer at the mercy of those bent on destroying the PDP from within, because a stronger coalition has emerged due to Atiku’s foresight.” Okai argued that without the ADC-driven alliance, opposition voices would have been largely silenced in Ni']"
16,31,16_inning_baseball_spring training_innings,"['inning', 'baseball', 'spring training', 'innings', 'opening day', 'home run', 'major league', 'garza', 'cardinals', 'nationals']","['Pittsburgh Pirates capture 8-3 exhibition victory over Toronto Blue Jays BRADENTON — Oneil Cruz and Spencer Horwitz homered to lead the Pittsburgh Pirates to an 8-3 win over the Toronto Blue Jays in spring-training action Saturday. Horwitz belted a solo homer against his former team off Toronto starter Kevin Gausman in the fourth inning. Cruz added a two-run shot in the sixth for Pittsburgh (16-11). Gausman, tabbed as Toronto’s opening-day starter, went five innings. He allowed six hits and three earned runs while fanning two and walking three. Shortstop Andres Giminez, who was a member of Venezuela’s World Baseball Classic-winning team. had two hits in three plate appearances for Toronto (11-13). He also scored a run.', ""Pittsburgh Pirates capture 8-3 exhibition victory over Toronto Blue Jays BRADENTON - Oneil Cruz and Spencer Horwitz homered to lead the Pittsburgh Pirates to an 8-3 win over the Toronto Blue Jays in spring-training action Saturday. Horwitz belted a solo homer against his former team off Toronto starter Kevin Gausman in the fourth inning. Cruz added a two-run shot in the sixth for Pittsburgh (16-11). Gausman, tabbed as Toronto's opening-day starter, went five innings. He allowed six hits and three earned runs while fanning two and walking three. Shortstop Andres Giminez, who was a member of Venezuela's World Baseball Classic-winning team. had two hits in three plate appearances for Toronto (11-13). He also scored a run. Also on Saturday, Toronto manager John Schneider told reporters the team's five starting pitchers will be Gausman, Dylan Cease, Eric Lauer, Cody Ponce and Max Scherzer, in that order. That means Gausman, Cease and Lauer will go the mound when Toronto opens its season Friday against the Athletics at Rogers Centre. Ponce and Scherzer would then start against the Colorado Rockies. This report by The Canadian Press was first published March 21, 2026. The Canadian Press If you're interested in submitting a Letter to the Editor, click here. We'"", 'Pittsburgh Pirates capture 8-3 exhibition victory over Toronto Blue Jays Toronto Blue Jays’ Kevin Gausman (34) pitches to Canada during the first inning of an exhibition baseball game Tuesday, March 3, 2026, in Dunedin, Fla. (AP Photo/Chris O’Meara) BRADENTON - Oneil Cruz and Spencer Horwitz homered to lead the Pittsburgh Pirates to an 8-3 win over the Toronto Blue Jays in spring-training action Saturday. Horwitz belted a solo homer against his former team off Toronto starter Kevin Gausman in the fourth inning. Cruz added a two-run shot in the sixth for Pittsburgh (16-11). Gausman, tabbed as Toronto’s opening-day starter, went five innings. He allowed six hits and three earned runs while fanning two and walking three. Shortstop Andres Giminez, who was a member of Venezuela’s World Baseball Classic-winning team. had two hits in three plate appearances for Toronto (11-13). He also scored a run. Also on Saturday, Toronto manager John Schneider told reporters the team’s five starting pitchers will be Gausman, Dylan Cease, Eric Lauer, Cody Ponce and Max Scherzer, in that order. That means Gausman, Cease and Lauer will go the mound when Toronto opens its season Friday against the Athletics at Rogers Centre. Ponce and Scherzer would then start against the Colo']"
