Topic,Count,Name,Representation,Representative_Docs
5,35,5_friendships_friendship_friends_family,"['friendships', 'friendship', 'friends', 'family', 'family members', 'husband', 'relationship', 'dinner', 'gifts', 'divorce']","['Asking Eric: Family, friends don’t seem to appreciate time I put into tedious Christmas cookie tradition Dear Eric: My late mother made a special Christmas cookie that required tedious decorating, considering each person’s personal preference for toppings, and giving them as gifts to family and friends. They always had a place of honor on our family Christmas table. When she was no longer able, she gave me the cookie cutter, and my daughters and I took over the family tradition. It takes the three of us several days to make, bake, decorate, package and mail cookies to family members around the country. We enjoy doing it and feel like we’re continuing the fun and festive tradition. However, in recent years, not all of the recipients acknowledge receipt. At some point in their lives, they have all helped Grandma decorate, so they know the time involved. Because of past delivery issues, I track the boxes and inquire if I haven’t heard from them in a couple of days. Last year, one response was “yes we got them.” This feels unappreciative! In the past most would text a picture of their children with the cookies, which we really enjoyed. We rarely see any of them anymore, as they are busy raising their families and don’t live nearby. This seems like a way for us to continue somewhat of a co', 'Asking Eric: Can mom work through tension in son’s relationship with dad so they can celebrate special birthday? Dear Eric: My son is turning 40 on December 22. My husband and I are at a quandary as to how to celebrate him. There have been issues between my husband and him over things from his childhood. We did a special trip for his older brother when he turned 40 and would like to do something special for this son’s 40th as well. Our daughter-in-law has made special plans for him and we are not included. I understand that, but I need some ideas as to how to celebrate this extra special year without rocking the boat. I love my son with all my heart, as I do all my children, and want his 40th birthday to be memorable in a positive way. Any suggestions? – Mom Who Wants to Celebrate Dear Mom: The issues your son and your husband are having may be an obstacle, but they aren’t insurmountable. And the thing that can get them on the path to resolution is the same thing that can get you answers about how to celebrate your son: open communication. It’s not within your purview to try to fix things between them, but you have your own relationship with your son and so I’d encourage you to reach out and tell him what you told me: you want to celebrate him, you know things are difficult, and you’re lookin', 'Asking Eric: After 6 years sober, man is frustrated by his family’s hold on their hurt and distrust Dear Eric: I’ve just turned 40 this past year. The last 15 years I was in a horrible drug addiction. I lied and hurt and did terrible things to a lot of people, especially my family. About eight years ago they officially disowned me. Understandable. I’ve cleaned up and got my act together six years ago. At first, I tried to force my way back into their lives, which all refuted. I lashed out, said horrible things and stopped trying to be in their lives. My mom will stop by on my birthday for 10 minutes or so and drop a card off at Christmas. As for my two older brothers and my father, it’s radio silence. I guess what I’m asking is, what do I do to fix this and fast, as I said I’ve turned 40 this year, my parents are both 70. Time is running out, and I couldn’t imagine living my life without some kind of acceptance from my father. Or knowing he did or does love me. My heart breaks at the thought, but this is a real pickle. How can I fix a problem when the ones I need to fix it with won’t talk to me? Do I just keep ignoring their existence and put on this façade that I don’t care to my wife and 4-year-old son? What picture am I painting to my son, as he’s been guilty by association yo']"
6,29,6_clinic_hospital_nursing_hospitals,"['clinic', 'hospital', 'nursing', 'hospitals', 'patients', 'clinical', 'counseling', 'medicine', 'nhs', 'healthcare']","['HNL Lab Medicine Brings Escape Room Fun to Hospital Education ALLENTOWN, Pa., Nov. 10, 2025 /PRNewswire/ -- HNL Lab Medicine is transforming hospital training by turning mandatory education into an adventure. To strengthen the collaboration between laboratory and nursing teams, HNL Lab Medicine\'s Clinical Hospital Advisors have introduced an innovative ""escape room""–style educational game that turns essential lab‐related lessons into an interactive experience. The escape room begins with a familiar challenge: how to avoid getting a phone call from the lab about a rejected sample. From there, nurses progress through a series of puzzles based on real‐world scenarios, selecting properly filled blood culture bottles; answering type & screen questions; identifying best practices to prevent clotted or hemolyzed samples; ordering laboratory tubes correctly, and collecting laboratory tubes in the correct order of draw. Each correct answer provides a key or code to unlock the next stage, ultimately leading to a prize. The activity takes less than ten minutes per nurse, no longer than a standard training session, but delivers far more excitement and engagement. The format encourages problem‐solving, sparks conversation, and helps key lessons stick. ""Ou', 'HNL Lab Medicine Brings Escape Room Fun to Hospital Education ALLENTOWN, Pa., Nov. 10, 2025 /PRNewswire/ -- HNL Lab Medicine is transforming hospital training by turning mandatory education into an adventure. To strengthen the collaboration between laboratory and nursing teams, HNL Lab Medicine\'s Clinical Hospital Advisors have introduced an innovative ""escape room""–style educational game that turns essential lab‐related lessons into an interactive experience. The escape room begins with a familiar challenge: how to avoid getting a phone call from the lab about a rejected sample. From there, nurses progress through a series of puzzles based on real‐world scenarios, selecting properly filled blood culture bottles; answering type & screen questions; identifying best practices to prevent clotted or hemolyzed samples; ordering laboratory tubes correctly, and collecting laboratory tubes in the correct order of draw. Each correct answer provides a key or code to unlock the next stage, ultimately leading to a prize. The activity takes less than ten minutes per nurse, no longer than a standard training session, but delivers far more excitement and engagement. The format encourages problem‐solving, sparks conversation, and helps key lessons stick. ""Ou', 'HNL Lab Medicine Brings Escape Room Fun to Hospital Education ALLENTOWN, Pa., Nov. 10, 2025 /PRNewswire/ -- HNL Lab Medicine is transforming hospital training by turning mandatory education into an adventure. To strengthen the collaboration between laboratory and nursing teams, HNL Lab Medicine\'s Clinical Hospital Advisors have introduced an innovative ""escape room""–style educational game that turns essential lab‐related lessons into an interactive experience. The escape room begins with a familiar challenge: how to avoid getting a phone call from the lab about a rejected sample. From there, nurses progress through a series of puzzles based on real‐world scenarios, selecting properly filled blood culture bottles; answering type & screen questions; identifying best practices to prevent clotted or hemolyzed samples; ordering laboratory tubes correctly, and collecting laboratory tubes in the correct order of draw. Each correct answer provides a key or code to unlock the next stage, ultimately leading to a prize. The activity takes less than ten minutes per nurse, no longer than a standard training session, but delivers far more excitement and engagement. The format encourages problem‐solving, sparks conversation, and helps key lessons stick. ""Ou']"
7,29,7_wedding_stage_musical_debut,"['wedding', 'stage', 'musical', 'debut', 'award winning', 'theater', 'brooklyn', 'singer', 'david', 'baby']","['Source details Victoria Beckham’s ‘inappropriate’ wedding dance with son Brooklyn In this photo illustration, U.K. newspaper front pages display stories and images on the Beckham family feud on Jan. 20, 2026, in London. On Monday night, Brooklyn Beckham posted a six-page statement via Instagram detailing the tension between him and his parents, David and Victoria Beckham. (Photo Illustration by Mark Case/Getty Images/TNS) A source is detailing the “inappropriate” dance Victoria Beckham shared with son Brooklyn at his 2022 wedding to Nicola Peltz, saying it left guests “deeply uncomfortable.” The 26-year-old son of Posh Spice, 51, and David Beckham claimed in a multi-part Instagram statement Monday that his mother “hijacked my first dance with my wife,” during which he said Victoria “danced very inappropriately on me in front of everyone.” Javascript is required for you to be able to read premium content. Please enable it in your browser settings. Raising more than $20,000 to take a group of drama students to a regional competition in Tennessee takes some creativity. Cathy Simprini has always been one to go with the flow, and a little over 11 years ago, that attitude led her to pick up a new hobby — the ukulele. McQuade honored as Notable Georgian by Georgia Tren', 'Source details Victoria Beckham’s ‘inappropriate’ wedding dance with son Brooklyn In this photo illustration, U.K. newspaper front pages display stories and images on the Beckham family feud on Jan. 20, 2026, in London. On Monday night, Brooklyn Beckham posted a six-page statement via Instagram detailing the tension between him and his parents, David and Victoria Beckham. (Photo Illustration by Mark Case/Getty Images/TNS) A source is detailing the “inappropriate” dance Victoria Beckham shared with son Brooklyn at his 2022 wedding to Nicola Peltz, saying it left guests “deeply uncomfortable.” The 26-year-old son of Posh Spice, 51, and David Beckham claimed in a multi-part Instagram statement Monday that his mother “hijacked my first dance with my wife,” during which he said Victoria “danced very inappropriately on me in front of everyone.” “The dance was deeply uncomfortable, and people did notice at the wedding,” an insider told Us Weekly. The source claims that the fashion designer “nuzzled on Brooklyn’s neck in front of everyone and he made a face.” Brooklyn “was in shock and upset,” they continued. “It was inappropriate and weird.” But another source speaking to the outlet felt the former Spice Girl “just seemed to be having a fun time” and people were not “g', 'Source details Victoria Beckham’s ‘inappropriate’ wedding dance with son Brooklyn In this photo illustration, U.K. newspaper front pages display stories and images on the Beckham family feud on Jan. 20, 2026, in London. On Monday night, Brooklyn Beckham posted a six-page statement via Instagram detailing the tension between him and his parents, David and Victoria Beckham. (Photo Illustration by Mark Case/Getty Images/TNS) A source is detailing the “inappropriate” dance Victoria Beckham shared with son Brooklyn at his 2022 wedding to Nicola Peltz, saying it left guests “deeply uncomfortable.” The 26-year-old son of Posh Spice, 51, and David Beckham claimed in a multi-part Instagram statement Monday that his mother “hijacked my first dance with my wife,” during which he said Victoria “danced very inappropriately on me in front of everyone.” “The dance was deeply uncomfortable, and people did notice at the wedding,” an insider told Us Weekly. The source claims that the fashion designer “nuzzled on Brooklyn’s neck in front of everyone and he made a face.” Brooklyn “was in shock and upset,” they continued. “It was inappropriate and weird.” But another source speaking to the outlet felt the former Spice Girl “just seemed to be having a fun time” and people were not “g']"
8,28,8_welfare_labour_mps_policy,"['welfare', 'labour', 'mps', 'policy', 'benefits', 'increase', 'claims', 'income', 'councillor', 'changes']","['How much will DWP benefits and pensions rise following the budget? Benefits Budget 2025 Child Benefit Department for Work and Pensions DWP Pensions PIP Rachel Reeves Universal Credit National government Personal Finance DWP benefits including Universal Credit, Child Benefit, PIP, Carer\'s Allowance, and the State Pension are to increase in April 2026 after Rachel Reeves announced higher payments in her budget speech today. Anyone who claims DWP benefits should be in line for an increase in the next financial year, as the chancellor laid out plans to help pensioners, disabled people, parents, low earners, carers and unemployed people keep up with rising costs. Addressing MPs, Ms Reeves said: ""The broken welfare system that we inherited wrote off millions of people as too sick to work and we will reform that system so that it is a system that does not count the cost of failure, but one that protects people who cannot work and empowers those who can. ""We have brought back face-to-face assessments for disability benefits. Those are the face-to-face assessments that the shadow chancellor (Sir Mel Stride) got rid of when he was work and pensions secretary and our changes we have made to Universal Credit will get 15,000 people back into work, a figure con', 'How much will DWP benefits and pensions rise following the budget? Benefits Budget 2025 Child Benefit Department for Work and Pensions DWP Pensions PIP Rachel Reeves Universal Credit National government Personal Finance DWP benefits including Universal Credit, Child Benefit, PIP, Carer\'s Allowance, and the State Pension are to increase in April 2026 after Rachel Reeves announced higher payments in her budget speech today. Anyone who claims DWP benefits should be in line for an increase in the next financial year, as the chancellor laid out plans to help pensioners, disabled people, parents, low earners, carers and unemployed people keep up with rising costs. Addressing MPs, Ms Reeves said: ""The broken welfare system that we inherited wrote off millions of people as too sick to work and we will reform that system so that it is a system that does not count the cost of failure, but one that protects people who cannot work and empowers those who can. ""We have brought back face-to-face assessments for disability benefits. Those are the face-to-face assessments that the shadow chancellor (Sir Mel Stride) got rid of when he was work and pensions secretary and our changes we have made to Universal Credit will get 15,000 people back into work, a figure con', 'How much will DWP benefits and pensions rise following the budget? Benefits Budget 2025 Child Benefit Department for Work and Pensions DWP Pensions PIP Rachel Reeves Universal Credit National government Personal Finance DWP benefits including Universal Credit, Child Benefit, PIP, Carer\'s Allowance, and the State Pension are to increase in April 2026 after Rachel Reeves announced higher payments in her budget speech today. Anyone who claims DWP benefits should be in line for an increase in the next financial year, as the chancellor laid out plans to help pensioners, disabled people, parents, low earners, carers and unemployed people keep up with rising costs. Addressing MPs, Ms Reeves said: ""The broken welfare system that we inherited wrote off millions of people as too sick to work and we will reform that system so that it is a system that does not count the cost of failure, but one that protects people who cannot work and empowers those who can. ""We have brought back face-to-face assessments for disability benefits. Those are the face-to-face assessments that the shadow chancellor (Sir Mel Stride) got rid of when he was work and pensions secretary and our changes we have made to Universal Credit will get 15,000 people back into work, a figure con']"
9,22,9_weather_snow_winter_storms,"['weather', 'snow', 'winter', 'storms', 'temperatures', 'forecast', 'forecasts', 'flooding', 'rain', 'warn']","['UK weather: ice warnings in place across country as heavy snow expected Nine children and nine adults suffered minor injuries in collision, with two taken to hospital for further treatment Two school buses have crashed on icy roads as arctic weather conditions continue to cause widespread disruption and parts of the country brace for up to 30cm of snow. Nine children and nine adults suffered minor injuries following a collision between a school coach and a Reading bus on icy roads in Wokingham on Wednesday. One adult and a child were taken to Royal Berkshire hospital for further treatment, while another school bus crashed into a ditch in Kent after slipping on black ice. Police said no one was injured in that incident. A Met Office yellow warning for snow and ice has been extended to midday on Thursday for Scotland and the north of England before Storm Goretti is expected to bring heavy snow later in the week. About 400 homes in the north of Scotland had their power restored after morning outages, as the region struggled with heavy snow that has cut off many rural areas, disrupted travel and seen hundreds of schools remain closed. After Aberdeenshire council declared a major incident on Tuesday, the severe weather had abated by the end of Wednesday, al', 'Denton County temps may plunge below freezing by weekend, with snow possible Winter weather is expected to descend on North Texas this weekend. Precipitation is forecast, but meteorologists say it’s too early to predict ice and snow accumulations. This file photo shows Sherman Drive on Jan. 30, 2023, after Denton saw a round of heavy thundersleet. It could feel as cold as 5 degrees in Denton County this weekend, meteorologists warn, as an arctic cold front brings a mix of wind, freezing rain and maybe even snow. The National Weather Service issued a winter storm watch effective from noon Friday to 6 a.m. Sunday, cautioning Denton County residents that the cold weather could impact roads, power lines, pipes, and people and animals without proper shelter. After a couple of days of highs in the 50s and 60s, the NWS forecasts daytime temperatures will drop to about 40 degrees come Friday. Showers Friday morning could turn to sleet or freezing rain in the afternoon. But meteorologists say any sleet likely won’t accumulate during the day Friday. Later on Friday, temperatures will drop even further to the lower 30s in the afternoon. Meteorologists expect more freezing rain, sleet and showers that night. After midnight into Saturday, freezing rain and snow could fa', 'Denton County temps may plunge below freezing by weekend, snow possible Winter weather is expected to descend on North Texas this weekend. Precipitation is forecast, but meteorologists say it’s too early to predict ice and snow accumulations. This file photo shows Sherman Drive on Jan. 30, 2023, after Denton saw a round of heavy thundersleet. It could feel as cold as 5 degrees in Denton County this weekend, meteorologists warn, as an arctic cold front brings a mix of wind, freezing rain and maybe even snow. The National Weather Service issued a winter storm watch effective from noon Friday to 6 a.m. Sunday, cautioning Denton County residents that the cold weather could impact roads, power lines, pipes, and people and animals without proper shelter. After a couple of days of highs in the 50s and 60s, the NWS forecasts daytime temperatures will drop to about 40 degrees come Friday. Showers Friday morning could turn to sleet or freezing rain in the afternoon. But meteorologists say any sleet likely won’t accumulate during the day Friday. Later on Friday, temperatures will drop even further to the lower 30s in the afternoon. Meteorologists expect more freezing rain, sleet and showers that night. After midnight into Saturday, freezing rain and snow could fa']"
10,18,10_cricket_opening match_england_world cup,"['cricket', 'opening match', 'england', 'world cup', 'injury', 'nsw', 'tournament', 'toss', 'australia', 'tests']","['One of the most exciting cross-code talents is ready to shine in green and gold One of the region\'s best dual-code prospects has received his biggest call-up yet. Login or signup to continue reading Cooper Williams has been called into the Australia under 16s rugby union team, having had a breakout season with NSW Waratahs, that featured in the grand final win over Queensland in the Super Rugby U16 championship. But he\'s also starred in the 13-man code, having worn the black and white of the Western Suburbs Magpies in the Harold Matthews Cup. The Year 11 St Stanislaus\' College student from Canowindra said he was in ""disbelief"" when he found out it was called into the national side. ""I was shocked, I just couldn\'t believe it,"" the Canowindra Pythons junior said. ""I\'ve always dreamed about it, making really high rep sides and stuff. But this, I\'m so grateful for people around me, like my family. ""It\'s just a great moment for me. My dad told me [over the phone that I was named] and my Nan was in the background and I could hear her clapping. ""There\'s so much disbelief, for out of the 1000s and 1000s of boys that play football and rugby union in Australia, I\'m one of the 25 boys to make the side. Williams, who now plays open-side flanker, said he first played rugby', 'In-form England must keep developing to have Six Nations chance, says George By Mitch Phillips England hooker and former captain Jamie George has welcomed the confidence swirling around the team going into the Six Nations but said they cannot expect to win the title by playing the same way as they did to build an 11-match winning streak last year. England last won the tournament in 2020, and their most recent Grand Slam was in 2016, both under Eddie Jones, but they go into their opening match at home to Wales on February 7 with more confidence that they can top the standings than for many years. After narrowly losing their championship opener to Ireland in Dublin almost a year ago, England have chalked up 11 successive wins, including a rare one against New Zealand, and coach Steve Borthwick has built considerable depth in his squad. “We welcome the expectation because it’s a compliment for what we’ve done and what we’ve achieved over a short period of time, but it also keeps us on our toes because we know we can’t be complacent and can’t rely on previous performances,” George said at the Six Nations launch in Edinburgh on Monday. If we’re the same team as we were for the last 11 games, it will not be good enough, so our focus over the next two weeks is to', 'In-form England must keep developing to have Six Nations chance, says George By Mitch Phillips England hooker and former captain Jamie George has welcomed the confidence swirling around the team going into the Six Nations but said they cannot expect to win the title by playing the same way as they did to build an 11-match winning streak last year. England last won the tournament in 2020, and their most recent Grand Slam was in 2016, both under Eddie Jones, but they go into their opening match at home to Wales on February 7 with more confidence that they can top the standings than for many years. After narrowly losing their championship opener to Ireland in Dublin almost a year ago, England have chalked up 11 successive wins, including a rare one against New Zealand, and coach Steve Borthwick has built considerable depth in his squad. “We welcome the expectation because it’s a compliment for what we’ve done and what we’ve achieved over a short period of time, but it also keeps us on our toes because we know we can’t be complacent and can’t rely on previous performances,” George said at the Six Nations launch in Edinburgh on Monday. If we’re the same team as we were for the last 11 games, it will not be good enough, so our focus over the next two weeks is to']"
