Topic,Count,Name,Representation,Representative_Docs
11,40,11_family_gifts_friendships_santa,"['family', 'gifts', 'friendships', 'santa', 'parents', 'friends', 'christmas', 'siblings', 'celebrate', 'grandson']","['Asking Eric: We’ve had a rough year. How do we tell family we want no gifts this holiday? Dear Eric: In a year that has been filled with not-so-great things,( family members being furloughed, health issues, rising costs) how does one tell the family you don’t want any gifts? My husband and I have plenty of things, we don’t need any things or clothing or food. In the past the family members have all planned lists. There are children that will get gifts from Santa but how do we tell the rest of the fairly large family that enough is enough? – Realistic Gift-Giving Dear Gift-Giving: Meet their lists with a list of your own. You can make a list of charities you’d like them to contribute to in lieu of gifts, or a list of gifts that can’t be bought, like quality time or homemade treats. Or your list can have just one item: “we have everything we could want. All we ask for is your continued love and support.” Dear Eric: This is in response to “Walking Seniors,” whose neighbor would turn the sprinkler on them when they walked by his house. I happen to be a lawyer. I would suggest the letter writer bypass the police who are doing nothing, go directly to his state attorney or district attorney’s office and file a complaint of harassment. And I would get a temporary restraining or', 'Asking Eric: Can mom work through tension in son’s relationship with dad so they can celebrate special birthday? Dear Eric: My son is turning 40 on December 22. My husband and I are at a quandary as to how to celebrate him. There have been issues between my husband and him over things from his childhood. We did a special trip for his older brother when he turned 40 and would like to do something special for this son’s 40th as well. Our daughter-in-law has made special plans for him and we are not included. I understand that, but I need some ideas as to how to celebrate this extra special year without rocking the boat. I love my son with all my heart, as I do all my children, and want his 40th birthday to be memorable in a positive way. Any suggestions? – Mom Who Wants to Celebrate Dear Mom: The issues your son and your husband are having may be an obstacle, but they aren’t insurmountable. And the thing that can get them on the path to resolution is the same thing that can get you answers about how to celebrate your son: open communication. It’s not within your purview to try to fix things between them, but you have your own relationship with your son and so I’d encourage you to reach out and tell him what you told me: you want to celebrate him, you know things are difficult, and you’re lookin', 'Asking Eric: After 6 years sober, man is frustrated by his family’s hold on their hurt and distrust Dear Eric: I’ve just turned 40 this past year. The last 15 years I was in a horrible drug addiction. I lied and hurt and did terrible things to a lot of people, especially my family. About eight years ago they officially disowned me. Understandable. I’ve cleaned up and got my act together six years ago. At first, I tried to force my way back into their lives, which all refuted. I lashed out, said horrible things and stopped trying to be in their lives. My mom will stop by on my birthday for 10 minutes or so and drop a card off at Christmas. As for my two older brothers and my father, it’s radio silence. I guess what I’m asking is, what do I do to fix this and fast, as I said I’ve turned 40 this year, my parents are both 70. Time is running out, and I couldn’t imagine living my life without some kind of acceptance from my father. Or knowing he did or does love me. My heart breaks at the thought, but this is a real pickle. How can I fix a problem when the ones I need to fix it with won’t talk to me? Do I just keep ignoring their existence and put on this façade that I don’t care to my wife and 4-year-old son? What picture am I painting to my son, as he’s been guilty by association yo']"
12,37,12_surgical_surgery_hospital_memorial hospital,"['surgical', 'surgery', 'hospital', 'memorial hospital', 'patients', 'procedures', 'dr', 'fraser', 'health care', 'precision']","['VIDEO: $5.5M robotic surgery system arrives at Surrey Memorial Hospital Published 12:10 pm Tuesday, January 27, 2026 By Anna Burns The da Vinci Xi System has been unpacked and calibrated and is being held in a temporary location until its permanent location is finished. Fraser Health said that it expects it to “go-live” later in the spring. (Fraser Health/ Contributed to Surrey Now-Leader) Health care workers pose in front of the da Vinci Xi System. (Fraser Health/ Contributed to Surrey Now-Leader) Surrey Memorial Hospital is one step closer to providing robotic-assisted surgery with the arrival of the da Vinci Xi Robotic Surgery system. It is expected to be used in surgeries in the spring. “With the aid of the da Vinci Xi system, we can expand minimally invasive thoracic and foregut surgery, and we can do operations with greater precision and accuracy,” says Dr Ahmad Ashrafi, regional division head and chief of thoracic surgery for Fraser Health. “Patients may experience quicker recovery times, and we can carry out more complex procedures right here in Surrey, using minimally invasive techniques. This advanced technology will also help us attract and retain top surgical talent at Surrey Memorial Hospital.” Construction is underway on an operating room', 'VIDEO: $5.5M robotic surgery system arrives at Surrey Memorial Hospital Published 12:10 pm Tuesday, January 27, 2026 By Anna Burns The da Vinci Xi System has been unpacked and calibrated and is being held in a temporary location until its permanent location is finished. Fraser Health said that it expects it to “go-live” later in the spring. (Fraser Health/ Contributed to Surrey Now-Leader) Health care workers pose in front of the da Vinci Xi System. (Fraser Health/ Contributed to Surrey Now-Leader) Surrey Memorial Hospital is one step closer to providing robotic-assisted surgery with the arrival of the da Vinci Xi Robotic Surgery system. It is expected to be used in surgeries in the spring. “With the aid of the da Vinci Xi system, we can expand minimally invasive thoracic and foregut surgery, and we can do operations with greater precision and accuracy,” says Dr Ahmad Ashrafi, regional division head and chief of thoracic surgery for Fraser Health. “Patients may experience quicker recovery times, and we can carry out more complex procedures right here in Surrey, using minimally invasive techniques. This advanced technology will also help us attract and retain top surgical talent at Surrey Memorial Hospital.” Construction is underway on an operating room', 'VIDEO: $5.5M robotic surgery system arrives at Surrey Memorial Hospital Published 12:10 pm Tuesday, January 27, 2026 By Anna Burns The da Vinci Xi System has been unpacked and calibrated and is being held in a temporary location until its permanent location is finished. Fraser Health said that it expects it to “go-live” later in the spring. (Fraser Health/ Contributed to Surrey Now-Leader) Health care workers pose in front of the da Vinci Xi System. (Fraser Health/ Contributed to Surrey Now-Leader) Surrey Memorial Hospital is one step closer to providing robotic-assisted surgery with the arrival of the da Vinci Xi Robotic Surgery system. It is expected to be used in surgeries in the spring. “With the aid of the da Vinci Xi system, we can expand minimally invasive thoracic and foregut surgery, and we can do operations with greater precision and accuracy,” says Dr Ahmad Ashrafi, regional division head and chief of thoracic surgery for Fraser Health. “Patients may experience quicker recovery times, and we can carry out more complex procedures right here in Surrey, using minimally invasive techniques. This advanced technology will also help us attract and retain top surgical talent at Surrey Memorial Hospital.” Construction is underway on an operating room']"
13,32,13_flooding_snow_spring_winter,"['flooding', 'snow', 'spring', 'winter', 'ontario', 'winter storm', 'weather', 'rain', 'waterways', 'forecasts']","['Spring thaw brings flood risks to Ontario waterways: Here is what you need to know Ontario conservation authorities are keeping an eye on the risk of flooding as mild temperatures melt snow this week. With a spring thaw expected this week, Ontario conservation authorities are keeping watch for possible flood risks in rivers and streams. But no warnings have been issued just yet, said Toronto and Region Conservation Authority (TRCA) spokesperson Afiya Jilani. There are 36 conservation authorities across Ontario, and most do not have any flood alerts issued as of Tuesday, March 3. According to Environment and Climate Change Canada, temperatures across Ontario will be above freezing from Wednesday, March 4 through the weekend, which will result in snow melting around the clock. And there is also a chance of rain or freezing rain to fall as some storm activity passes across the province later this week. Meteorologists predicted this stretch of warm temperatures at the end of February, and Ontario conservation authorities have been keeping watch. “Based on forecasts for later this week, river flows are expected to increase due to above zero degree temperatures and anticipated rainfall, but it remains too early to determine if this will result in a severe river floodin', 'Spring thaw brings flood risks to Ontario waterways: Here is what you need to know Ontario conservation authorities are keeping an eye on the risk of flooding as mild temperatures melt snow this week. With a spring thaw expected this week, Ontario conservation authorities are keeping watch for possible flood risks in rivers and streams. But no warnings have been issued just yet, said Toronto and Region Conservation Authority (TRCA) spokesperson Afiya Jilani. There are 36 conservation authorities across Ontario, and most do not have any flood alerts issued as of Tuesday, March 3. According to Environment and Climate Change Canada, temperatures across Ontario will be above freezing from Wednesday, March 4 through the weekend, which will result in snow melting around the clock. And there is also a chance of rain or freezing rain to fall as some storm activity passes across the province later this week. Meteorologists predicted this stretch of warm temperatures at the end of February, and Ontario conservation authorities have been keeping watch. “Based on forecasts for later this week, river flows are expected to increase due to above zero degree temperatures and anticipated rainfall, but it remains too early to determine if this will result in a severe river floodin', 'Spring thaw brings flood risks to Ontario waterways: Here is what you need to know Ontario conservation authorities are keeping an eye on the risk of flooding as mild temperatures melt snow this week. With a spring thaw expected this week, Ontario conservation authorities are keeping watch for possible flood risks in rivers and streams. But no warnings have been issued just yet, said Toronto and Region Conservation Authority (TRCA) spokesperson Afiya Jilani. There are 36 conservation authorities across Ontario, and most do not have any flood alerts issued as of Tuesday, March 3. According to Environment and Climate Change Canada, temperatures across Ontario will be above freezing from Wednesday, March 4 through the weekend, which will result in snow melting around the clock. And there is also a chance of rain or freezing rain to fall as some storm activity passes across the province later this week. Meteorologists predicted this stretch of warm temperatures at the end of February, and Ontario conservation authorities have been keeping watch. “Based on forecasts for later this week, river flows are expected to increase due to above zero degree temperatures and anticipated rainfall, but it remains too early to determine if this will result in a severe river floodin']"
14,31,14_inning_baseball_spring training_home run,"['inning', 'baseball', 'spring training', 'home run', 'pitch', 'garza', 'rbi', 'cardinals', 'nationals', 'starting']","['Pittsburgh Pirates capture 8-3 exhibition victory over Toronto Blue Jays BRADENTON — Oneil Cruz and Spencer Horwitz homered to lead the Pittsburgh Pirates to an 8-3 win over the Toronto Blue Jays in spring-training action Saturday. Horwitz belted a solo homer against his former team off Toronto starter Kevin Gausman in the fourth inning. Cruz added a two-run shot in the sixth for Pittsburgh (16-11). Gausman, tabbed as Toronto’s opening-day starter, went five innings. He allowed six hits and three earned runs while fanning two and walking three. Shortstop Andres Giminez, who was a member of Venezuela’s World Baseball Classic-winning team. had two hits in three plate appearances for Toronto (11-13). He also scored a run.', ""Pittsburgh Pirates capture 8-3 exhibition victory over Toronto Blue Jays BRADENTON - Oneil Cruz and Spencer Horwitz homered to lead the Pittsburgh Pirates to an 8-3 win over the Toronto Blue Jays in spring-training action Saturday. Horwitz belted a solo homer against his former team off Toronto starter Kevin Gausman in the fourth inning. Cruz added a two-run shot in the sixth for Pittsburgh (16-11). Gausman, tabbed as Toronto's opening-day starter, went five innings. He allowed six hits and three earned runs while fanning two and walking three. Shortstop Andres Giminez, who was a member of Venezuela's World Baseball Classic-winning team. had two hits in three plate appearances for Toronto (11-13). He also scored a run. Also on Saturday, Toronto manager John Schneider told reporters the team's five starting pitchers will be Gausman, Dylan Cease, Eric Lauer, Cody Ponce and Max Scherzer, in that order. That means Gausman, Cease and Lauer will go the mound when Toronto opens its season Friday against the Athletics at Rogers Centre. Ponce and Scherzer would then start against the Colorado Rockies. This report by The Canadian Press was first published March 21, 2026. The Canadian Press If you're interested in submitting a Letter to the Editor, click here. We'"", 'Pittsburgh Pirates capture 8-3 exhibition victory over Toronto Blue Jays Toronto Blue Jays’ Kevin Gausman (34) pitches to Canada during the first inning of an exhibition baseball game Tuesday, March 3, 2026, in Dunedin, Fla. (AP Photo/Chris O’Meara) BRADENTON - Oneil Cruz and Spencer Horwitz homered to lead the Pittsburgh Pirates to an 8-3 win over the Toronto Blue Jays in spring-training action Saturday. Horwitz belted a solo homer against his former team off Toronto starter Kevin Gausman in the fourth inning. Cruz added a two-run shot in the sixth for Pittsburgh (16-11). Gausman, tabbed as Toronto’s opening-day starter, went five innings. He allowed six hits and three earned runs while fanning two and walking three. Shortstop Andres Giminez, who was a member of Venezuela’s World Baseball Classic-winning team. had two hits in three plate appearances for Toronto (11-13). He also scored a run. Also on Saturday, Toronto manager John Schneider told reporters the team’s five starting pitchers will be Gausman, Dylan Cease, Eric Lauer, Cody Ponce and Max Scherzer, in that order. That means Gausman, Cease and Lauer will go the mound when Toronto opens its season Friday against the Athletics at Rogers Centre. Ponce and Scherzer would then start against the Colo']"
15,30,15_fabric_lace_covers_cushion,"['fabric', 'lace', 'covers', 'cushion', 'luxurious', 'garment', 'lamp', 'cotton', 'leather', 'pigment']","[""'Luxury' quilted bedspread reduced from £65 'makes my bedroom look expensive' The bedspread has been reduced in price(Image: Dusk ) Finding the perfect finishing touch for the bedroom can be challenging, but sometimes a bedspread is all that's needed to add style and additional warmth. Over at Dusk, there is one bedspread which has been reduced in price and it comes in two colours. The Rome Velvet Greek Matelasse Bedspread is currently available from Dusk for £52, reduced from £65, saving shoppers £13. It also comes in the colour deep pink, but this is for the full price of £65. Dusk says the Rome Velvet Greek Matelasse Bedspread has been designed to add a 'luxurious and inviting finish' to the bedroom, and it features a Greek-inspired matelassé pattern. The velvet-feel fabric creates a 'soft touch', while the intricate quilting enhances its aesthetic, the site says. Shoppers have left rave reviews online The Rome Velvet Greek Matelasse Bedspread, which measures 2.5m x 2.6m, can be styled alone or layered with matching cushion covers. Plus, it is easy to care for, as it can be machine washed at 30 degrees and tumble dried on a low setting - but it is worth noting that it should not be ironed. As an alternative, Dunelm is selling this Helston Quilted Bedsprea"", ""Dusk's white lace-trim spring duvet cover 'looks gorgeous on' and is reduced The Alice Duvet Cover can be easily styled with lots of different themes and hues(Image: Dusk) March signals the arrival of spring and, gradually, the days are growing longer and brighter. Households anticipating the arrival of milder weather can help usher spring indoors with fresh décor choices. A straightforward method to revitalise a bedroom is to update the bedding which breathes new life into the space. Dusk remains a favourite destination for those seeking to refresh their homeware and the retailer frequently runs promotions and special offers. Currently, the brand is offering 15% off this Alice Duvet Cover when customers apply the code EXTRA15 during checkout. Typically retailing between £55 and £65, the promotional code reduces the cost to between £46.75 and £55.25. The Alice Duvet Cover comes in double, king and super king sizes and boasts a 200 thread count. It's worth noting that pillowcases aren't included and must be purchased separately, starting from £15 for one, for example. Dusk's Alice Duvet Cover is white and features an intricate lace, scalloped trim for a period aesthetic. The retailer describes the cover as 'soft, breathable, and effortlessly stylish', report"", ""Dusk's white lace-trim spring duvet cover 'looks gorgeous on' and is reduced This elegant lace-trim duvet from Dusk is perfect for spring (Image: Dusk) March signals the arrival of spring and, gradually, the days are growing longer and brighter. Households anticipating the arrival of milder weather can usher spring indoors through fresh décor choices. A straightforward method to revitalise a bedroom is to update the bedding, which breathes new life into the space. Dusk remains a favourite destination for those seeking to refresh their homeware and the retailer frequently runs promotions and special offers. Currently, the brand is offering 15% off this Alice Duvet Cover when customers apply the code EXTRA15 during checkout. Typically retailing between £55 and £65, the promotional code reduces the cost to between £46.75 and £55.25. The Alice Duvet Cover comes in double, king and super king sizes and boasts a 200 thread count. It's worth noting that pillowcases aren't included and must be purchased separately, starting from £15 for one, for example. Dusk's Alice Duvet Cover is white and features an intricate lace, scalloped trim for a period aesthetic. The retailer describes the cover as 'soft, breathable, and effortlessly stylish', reports the Daily Record. T""]"
16,29,16_venezuelan president_pentagon_uss_security council,"['venezuelan president', 'pentagon', 'uss', 'security council', 'secretary war', 'trump administration', 'president nicolas', 'terrorists', 'venezuela', 'nicolas maduro']","[""Hegseth, Pentagon stand by explanation of second boat strike (The Center Square) – After a story was published last week claiming that Secretary of War Pete Hegseth ordered a second strike on an alleged Venezuelan drug boat to kill those remaining, both Hegseth and the Pentagon reiterated their defense of the War Department’s actions as completely legal. Pentagon Press Secretary Kingsley Wilson told reporters Tuesday that the U.S. has performed 21 strikes on drug boats in the Western Hemisphere, killing “82 narco-terrorists.” “Our operations in the SOUTHCOM region are lawful under both U.S. and international law, with all actions in compliance with the law of armed conflict,” Wilson said. “These actions have also been approved by the best military and civilian lawyers up and down the chain of command.” Wilson repeatedly described the boats as narco-terrorist vessels at the Pentagon's first press briefing under this administration, underscoring that the terrorist designation allows the Trump administration to respond more forcefully while remaining within the law. Democrats and some Republicans have questioned the legality of the strike, with some calling it a war crime. After the first strike, there were allegedly only two people left, cling"", ""Hegseth, Pentagon stand by explanation of second boat strike (The Center Square) – After a story was published last week claiming that Secretary of War Pete Hegseth ordered a second strike on an alleged Venezuelan drug boat to kill those remaining, both Hegseth and the Pentagon reiterated their defense of the War Department’s actions as completely legal. Pentagon Press Secretary Kingsley Wilson told reporters Tuesday that the U.S. has performed 21 strikes on drug boats in the Western Hemisphere, killing “82 narco-terrorists.” “Our operations in the SOUTHCOM region are lawful under both U.S. and international law, with all actions in compliance with the law of armed conflict,” Wilson said. “These actions have also been approved by the best military and civilian lawyers up and down the chain of command.” Wilson repeatedly described the boats as narco-terrorist vessels at the Pentagon's first press briefing under this administration, underscoring that the terrorist designation allows the Trump administration to respond more forcefully while remaining within the law. Democrats and some Republicans have questioned the legality of the strike, with some calling it a war crime. After the first strike, there were allegedly only two people left, cling"", ""Hegseth, Pentagon stand by explanation of second boat strike (The Center Square) – After a story was published last week claiming that Secretary of War Pete Hegseth ordered a second strike on an alleged Venezuelan drug boat to kill those remaining, both Hegseth and the Pentagon reiterated their defense of the War Department’s actions as completely legal. Pentagon Press Secretary Kingsley Wilson told reporters Tuesday that the U.S. has performed 21 strikes on drug boats in the Western Hemisphere, killing “82 narco-terrorists.” “Our operations in the SOUTHCOM region are lawful under both U.S. and international law, with all actions in compliance with the law of armed conflict,” Wilson said. “These actions have also been approved by the best military and civilian lawyers up and down the chain of command.” Wilson repeatedly described the boats as narco-terrorist vessels at the Pentagon's first press briefing under this administration, underscoring that the terrorist designation allows the Trump administration to respond more forcefully while remaining within the law. Democrats and some Republicans have questioned the legality of the strike, with some calling it a war crime. After the first strike, there were allegedly only two people left, cling""]"
